article_id,headline,text
021-HZF-1882-12-26-001-09385_toc_1,," KAK ברוסיא ופולין. אל השולח במוקדם לשנה 5 רו״כ.  כל נתני שנה, 2.75 רו״כ.  לרבע שנה 1.50 רו״כ.  ל ביתר הארצות 20 פראנק.  באמעריקא 5 דאללאר. C"
021-HZF-1882-12-26-001-09385_toc_2,, K מחירו באשכנז: 14 רייכם מארק לשנה. בעסטרייך 8 פל׳ לשנה.  וכן לרבע שנה.  שכר מודעות:  מכל שורה קצרה 5 קאפ׳  ומשורה רחבה 10 קאפ׳. SK
021-HZF-1882-12-26-001-09385_toc_3,מכתב עתי משמיע הדשות יוצא לאור אתת בשבוע...," 926 24 e E  מכתב עתי  יוצא לאור אחת בשבוע, מאת חיים זעליג סלאנימסקי."
021-HZF-1882-12-26-001-09385_toc_4,בעוד שבועיים תכלה השגה הזאת ותחל שגה חדש...," בעוד שבועיים תכלה השנה הזאת ותחל שנה חדשה למוציאי מכתבי העתים, ואז לפני כל מו״ל יהיו ספריו נפתחים בראש השנה לפקוד במספר כל הבאים והיוצאים מן החתומים שלו, וכחנוני על פנקסו הוא עומד לבקש חשבונות רבים מכל אלה אשר לא שלמו בעד העבר, ומצפה אל הבאים מחדש וכספם בידם לבוא בברית עמו, יעלה לפניהם זכר כל המעשים אשר עשה ופעל בשעבר, ויבטיחם להרבות ולהגדיל עוד כהנה וכהנה, — אנחנו אשר כגורל כל מכ״ע העברים גורלנו, לא נתפאר על העבר ולא נהלל את העתיד, אך כל חפצנו ותקותנו לעמוד ולהתקיים גם בשנה העשירית כמו בשנים שעברו אם יחזקנו ה׳ ונחיה לפניו, וע״כ אנו דורשים מכל החותמים והסוכנים שנשארו עדיין חייבים משנה הזאת, כי ימהרו להשיב לנו את המגיע מהם, ואת הבאים מחדש נבקש כי יקדימו לשלוח כסף חתימתם אלינו, למען נדע מספר העלים אשר נוציא בדפוס לבל נבוא במבוכה כמו בשנה שעברה, ואז שלום יהיה לנו ולכל הבאים אלינו בקוראי הצפירה. המו״ל"
021-HZF-1882-12-26-001-09385_toc_5,תוכן העניגים דברי הימים .ירושלים .האראדי...," תוכן הענינים. דברי הימים, ירושלים. האראדישץ. סטעפעניץ בערריטשוב. אנאנאיוב. פינסק. לאמזא. טאמאשיב דרוזנעניק. חייונות התוכנים במראה הקאמעט. הודעות. שאלות ותשובות."
