article_id,headline,text
021-HZF-1883-07-31-001-10215_toc_1,," KKK ברוסיא ופולין. ל פעולת במוקדם לשנה 5 רו״כ. לתני שנה, 2.75 רו״כ. אל לרבע שנה. 1.50 רו""כ.  ל ביתר הארצות 20 פראנק באמעריקא 5 דאללאר. א SA"
021-HZF-1883-07-31-001-10215_toc_2,, K מחירו באשכנז: 14 רייכם מארק לשנה. בעסטרייך 8 פל׳ לשנה. אל וכן לרבע שנה. שכר מודעות: ם כל מורה קרה 5 קאפ׳. ל ומשורה רחבה 10 קאפ׳. אל E
021-HZF-1883-07-31-001-10215_toc_3,"מכתב עתי משמיע הדשות יוצא לאור אתת בשמע,..."," Co 20 פ . רשות מכתב עתי משע יוצא לאור אחת בשבוע, מאת חיים זעליג סלאנימסקי."
021-HZF-1883-07-31-001-10215_toc_4,תוכן חעניגים דברי הימים.םשסט עלילת הרם ב...," תוכן הענינים דברי הימים. משפט עלילת הדם באונגארן. קיעוו. ביאליסטאק. לעטיטשעוו, פינסק. סטעפעניץ. דובנא. פראגא. ווארשא, הצופה לבית ישראל. חדשות שונות. הודעות. שאלות ותשובות."
021-HZF-1883-07-31-001-10215_toc_5,דברי הימים," דברי הימים שני איתני אייראפא, הקיסר ווילהעלם והקיסר פראנץ יוסף, נכונים בימים האלה לראות איש פני אחיו במקום הרחצה אישר הפגישה הזאת היא הראשונה בין שני הקסרים אדירי אייראפא ואז באו במכרת הברית המשולשת, שתי ממשלותיהן וממשלת איטאליא, היא הברית אשר הורה והנה ביסמארק בלבו זה עדן ועדנים ולא ראה עת מצוא להוציאה לפעולות עד שכוון את השעה בשנה הזאת. גלוי וידוע לפני כל יודעי העתים, כי בהיות שני הקסרים, האשכנזי והעסטרייכי, באמנה יחד בפעם שלפני זה, אז עלתה במחשבה תחלה לפניהם הברית הזאת, עתה הנה הברית כבר יצאה מעולם הדמיון לעולם המעשה, והם חפצים אפוא להביט לאחור על המעשה אשר נעשה, ולהתבונן קדימה אל המעשה אשר עוד לפניהם לעשות למען השוות את כפות המאזנים בכל עניני הפאליטיק באייראפא, להיות המשטר על מכונו, על פי השמעות אזנים יבואו גם ביסמארק וקאלנאקי לסוד הקסרים, לעדור שם יחד במערכת עניני המדינות, כל השמועות האלה היו כטל ללבות אוהבי השלום באייראפא, ורוח גיל הלפה גם על בתי הבערזע באייראפא ומחיר השטרות עלה עשר מעלות עד ארגיעה, כי גם העב הקטנה ככף איש אשר עלתה על שמי הענינים המדיניים מקצות אנגליא וצרפת חלפה כמעט כולה ויהי אור בהיר, מאז בא השר וואדינגטאן על כנו ללאנדאן בתור ציר צרפת, וישם כל מעינו בדבר להשיב את השלום בין צרפת ובין אנגליא לאיתנו. הלא כן יאמר מכ״ע „זורנאל דע דעבא"" המדבר בשם ממשלת צרפת, לאמר: אך בכסוך אחד נמצא בינינו ובין אנגליא, אמנם הוא עומד ברומו של עולם ונוקב ויורד עד התהום, לכן שוש נשיש על שעלתה בידינו לשלוח את השר וואדינגטאן לאנדאנה; הוא כבר הוכיח בעליל כי ידיו רב לו להסיר את הסכסוכים המתנגשים בין שני העמים העצומים, וללמדם ולהשכילם לדעת כי לא טוב היותם אחוזים בסבך חלוקי דעות, ולטובתם עליהם לעוז במעוז השלום והאחדות, ואולי יצליח וואדינגטאן גם הפעם לבצע את הדבר הגדול הזה, לחזק ולסעד את השלום, והיה כאשר תצלח זאת בידינו כפי אשר נקוה, אז יכול נוכל לנהל באין מחריד את הענינים המדיניים אשר לפנינו לענות בהם במדינות הים, וראתה אייראפא כולה, כי אין חפץ לה בענינים אחרים בפנות עולם המדיני, ודי לנו בזה להניח את רוחנו״. הדברים האלה ברור ימללו כי הדרך אשר בחרו בה שרי הממשלה הנוכחית בצרפת, היא, להחזיק במעוז השלום באייראפא ולבלי לבקש חדשות ונצורות פה, אך להרחיק את הענינים המדיניים ולכנסם ולצמצמם רק במדינות הים. הידיעות הבאות מטאנקין, טובות הנה. כאשר באו הגדודים הראשונים מן צבא השלוחים לטאנקין ויסתפחו אל החיל החונים שם, נסו גדודי מספר לצאת לתו את המקום מן המחנה והלאה ולא פגעו בהם העגמים בדרך וכפי הנראה, סרו צבאות הענמים ובני השבטים שפרעו פרעות על הנהר האדום, הנודעים בשם „הדגלים השחורים״, סרו מן העבר השמאלי לגדות הנהר וירחיקו משם נדוד, ועל הנהר כולו לארכו ולרחבו שוררת מנוחה, פסו השודדים תמו אנשי מרד ואניות סוחר יכולות לעבור דרכן בשלום עד מחוז חפצן, עד גבול כינא, מקום שמה פני סוחרי צרפת מועדות. בין כה קול הקריה „הוע"" בירת מלך ענמים, הומה ממחתה ובלהות, כי פחד הצרפתים נפל על בני ענמים, והם מתאזרים בשארית אונים לחזק את המצודות ולמלא עירם אנשי צבא ולסגור את דרך הנהר, אך כפי הנשמע, אנשי הצבא והמצודות וכלי התותח. מצבם בתכלית השפלות, ומן הנמנע הוא שיעמדו בפני צבאות הצרפתים הן אמנם השאלה, אם תצא כינא מגדרה או לא לא נפתרה עדנה, וקיסר ענמים עודנו בוטח בבן השמים מושל בינא. אולם בהיות שלום בין צרפת ובין אנגליא, לא תירא צרפת ולא תחת מפני שני זנבות האודים העשנים האלה, ולא תסור מדרכה, עד אם תבוא אל המנוחה והנחלה אשר תאבה נפשה לגדות „הנהר האדום״. גם ממאדאגאסקאר, תבואנה חדשות לבקרים שמועות נעימות להצרפתים, ובין יודעי דבר מדינה כבר נחשב לדבר ברור, שמאדאגאסקאר ועגמים יסבו לצרפת. — מן שאר מקרי עולם המדיני בשבוע העבר, גדולים חקרי לב למאמר מכ״ע „טהיימס"" אשר קם נגד ממשלת אשכנז ויחפא עליה עון על אשר תתנה אהבים עם ממשלת תוגרמא, להקימה לצוררת נגד בעלי בריתה מאז, ולברוא אותה בריאה חדשה בתקונים וסדרים אשר לא שערום התוגרים מעולם, כן בענינו הצבא וכן גם בשאר ענפי המשרה והשלטון וכ לת המדינה במדינותיה באייראפא ובארץ ישראל ובארם באזיא, הכל לרוח ביסמארק ופקידיו, כל זאת כלכל לא יוכל מכ״ע „טהיימס"" ויקרא חמס על מעשי סתרים אלה, ובסוף דבריו יאמר כי לפי דעתו ערומים התוגרים ולא באמת ובתמים יבקשו מעוז מאת האשכנזים, ורק אחיזת עינים וגניבת דעת היא, ולשוא ינאמו נאום להשלות את האשכנזים בברית שלום, וממול ערפם יתנו אהבים עם רוסיא, יוצים התוגרים לדמות את ביסמארק, אבל מי יודע אם יצלח חפצם בידם, כאלה וכאלה כתב מכ״ע „טהיימס"", ורבים יהגו ישיחו בו, באשר לא בין יושבי קרנות נחשב מכ״ע זה, ולא כרוב מכ״ע הוא עוסק בהעלות פילים בקופות של מחטים, ואם שנן את לשונו וידרוך קסתו פתאום נגד אשכנז, הן לא דבר ריק הוא, ואמנם חקרו צופי עניני המדינות אף מצאו כי היה יסוד ופנה למאמר הטהיימס, וזה הדבר: בפקודת ביסמארק אזנו וחקרו שרי צבא אשכנז שיטה חדשה לתקן את סדרי צבא תוגרמא, וזה כביר נגמרה ונשלמה המלאכה. אך הסולטאן פסח על שתי השעפים ולא מצא את לבו לקיימה, עתה הצליח מעשה ביסמארק, והסולטאן קיים וקבל על עצמו ללמד את האשכנזים אלופים לראשו בכל עניני הצבא ומוצאם ומובאם, הדבר הזה הכעיס תמרורים את נכבדי אנגליא משפיעי מכ״ע הטהיימס, והוא הוליד את המאמר הנ״ל. אך במאמרים לא תוסר תוגרמא את הנעשה אין להשיב, ואחרי אשר נפתה הסולטאן לקיים ולקבל ע״ע את עול האשכנזים בעניני צבאותיו, הלא תרום ותחזק שם יד ביסמארק, כי איה אפוא מקום נאמן לתקוע בו יתד אשר לא ימוש ולא יצא משם. כמקצוע עניני הצבא, חביון העז והמשרה שלה ספון: אשר בו חלקת המו התעלה השניה אשר היה בלב האנגלים לחפור על יד תעלת הזועץ במצרים, נתמלאה לע״ע מחוליתה. בשבוע העבר הודענו לקוראינו, כי כבר מנויה וגמורה בלב ממשלת אנגליא לחפור תעלה חדשה, וגם ה׳ לעססעפם חופר התעלה הראשונה נעתר לתת רשות, ורק בעיני ממשלת צרפת רע המעשה; והנה במשך הימים האחרונים נשתנו דעות ממשלת אנגליא מן הקצה אל הקצה, וגלאדסטאן הודיע בבית הפארלאמענט, כי לע״ע ההצעה ע״ד תעלה חדשה תנוח בקרן זוית. הצרפתים ששים ושמחים על השינוי הזה, ולדעת יודעי העתים נהיה השינוי הנמרץ על פי השתדלות ממשלת צרפת שהשתדלה להשיב את אנגליא מחפצה. זה הוא המפעל הראשון אשר הצליח ביד השר וואדינגטאן. (חדשות בקרב הארץ), כאבני נזר יתנוססו טהורי לב בין גדולי הרוסים בדור עקש ופתלתול כזה. הכהן הגדול לכנסת היונים, פלטון הקיובי, אשר פעלו והדרו נראה על פני כל בעלי ברית הפראוואסלאוויא בגלילות המערב. הוא היה בימים האלה בעיר באגוסלאוו בקרבת קיוב, וישא שם מדברותיו בבית התפלה להנוצרים על רשעת השנאה אשר בין בני הלאומים השונים, ויהיו דבריו כרשפי קשת ואמרותיו להבות אש נגד תועי לבב מחרחרי ריב. צירי היהודים היושבים שם קדמו פניו בלחם מלח, והוא השיב להם תשואות חן ויתן בלבם תקוה לימים טובים  מאלה בעיר ניקאליוב היתה פקודת ממשלת המקום אל היהודים. לקיים ולקבל עליהם להוציא לדרור את הנוצרים, אנשים ונשים, המשרתים בבתיהם, (וואסחאר גליון 27), ועל הפקודה הזאר העיר בצדק מכ״ע יוזני קראיי, כי היא תעשה רעה רבה לעניי הנוצרים יותר מאשר תעשה ליהודים. בימים האלה היתה ישיבה בהועד של קופת הצדקה העומדת וקיימת בפעטערסבורג למשען אחב״י עובדי אדמה ובעלי מלאכות ברוסיא, על פי הדין והחשבון שנדפס במכ״ע העברי הרוסי נראה, כי סך משען הכסף שחלקה החברה מזמן ישיבתה הקודמת עד היום עולה לערך 1180 רו״כ. רוב הנדבות נתנו לבעלי מלאכות היוצאים מן התחום לקבוע את מושבם ברוסיא הפנימית. מכ״ע הרוסי סאוורעמעניא איזוויעסטריא, שאיננו מגדולי אוהבי ישראל. מדבר ברוח משפט ואמת על אדות משפט עלילת הדם ובא לכלל החלטה זאת: אף כי המאדזיארים מתנאים בחופשם ובהשכלתם וחושבים את רוסיא לארץ מאפליה ואת הרוסים להמון בדברים, אולם עינינו הרואות עתה, כי בארצנו רוסיא לא יתכן שיהיה אף חלק מקצת מן המקצת מן התועבות הנוראות, סלף משפט בפומבי, עינוים וחמס ושערוריה, ככל אשר אנחנו רואים היום באונגארן. מכ״ע „העברי הרוסי"" (No. 26) הביא ספור מעשה ביהוד אחד יושב כפר ידוע, היושב ועוסק שם זה ימים רבים במסחר באין מפריע, אולם „החוקים שהזמן גרמא"" הפריעו את מנוחתו הפקידים הוציאו משפט חרוץ לגרש את היהודי ואת ביתו מ הכפר, ולא נודע איך ועל ידי מי נתגלגל הדבר, שהוצע המשפט החרוץ לפני האכרים, והאכרים אהבו את היהודי מפני יושר דרכו וכשרון מעשיו ולא אבו לחתום על המשפט, ועוד יתרה עשו והגישו מחאה נגד זה — עי״ז נולדה עלילה חדשה נגד היהודי ואומרים אמור: „לא דבר ריק הוא אשר האכרים מגינים עליו, אין זאת כי אם ידו עמם בקושרים״ ומפני הטעם הזה הוציאוהו מן הכפר (חדשות בחו״ל), זה לעומת זה עשה הזמן בארץ אונגארן, בעוד אשר השנאה חוצבת להבות אש. במקום אחר הסבלנות שלטת, בעיר גאלץ, היא העיר הראשית של מחוז זעמפלאן נבחר היהודי פאליצער לראש העיר מפרעשבורג מודיע בערלינער טאגעבלאט ע״ד איזה מקרים קטנים, שפגעו נערים שובבים ביהודים ויכום מכה רבה. בבית אופה אחד קראו המשרתים בערמה לאיש יהודי זקן לבוא שמה. ויהי כאשר בא ייסגרו את הדלת ויפילוהו ארצה ואחד מהם לקח מאכלת לשחוט את היהודי, והזקן צעק בכל כחו, ויבואו אנשי הבית ויצילוהו. על רענאן בעבור דרשתו האחרונה שדרש לטובת היהודים ולכבוד דת ישראל. התנפל מכ״ע „גאזעטט דע פראנס"" בחרפות וגדופים, ויעולל על החכם הנערץ עלילה, שלקח כסף מאת ראטהשילד במחיר זה נתן כבוד וגודל לישראל — גדופים כאלה נראו באו תה עה גם על עמודי נאוואיע וורעמיא ברוסיא. — מכ״ע המדבר בשם ממשלת יון Mossager dAthenes כתב בימים האלה מאמר נמרץ ויקר הערך נגד צוררי היהודים, ומרומם שבח היהודים היושבים בארץ יון ונהנים שם מזיו החפש. בימים האחרונים הוציאה ממשלת יון פקודה חדשה, ליסד בתי למוד דת ישראל בהוצאות הממשלה בכל עיר ועיר מקום שם מספר היהודים עולה עד לאלף נפשות. — מנויארק מודיעים למכ״ע רזויז קראניקל, כי ארבע בתי אבות מיהודי פולין שבאו זה מקרוב לנויארק בנדבת „החברה למשען הפליטים"" אשר בלאנדאן הושבו אחור בפקודת ממשלת אמעריקא מפאת אשר לא היה להם מודע ומשען ומשענה, והחברה אשר בנויארק לא רצתה לקבלם מאפס כסף למשען הפליטים החדשים ."
