article_id,headline,text
021-HZF-1882-04-25-001-09105_toc_1,," K ברוסיא ופולין. אל השולח במוקדם לשנה 5 רו""כ.  נחצי שנה, 2.75 רו""כ. אל לרבע שנה, 1.50 רו״כ.  ר ביתר הארצות 20 פראנק.  באמעריקא 5 דאללאר AM"
021-HZF-1882-04-25-001-09105_toc_2,, K מחירו באשכנז: 14 רייכם מארק לשנה. בעסטרייך 8 פל׳ לשנה.  וכן לרבע שנה. שכר מודעות: מכל שורה קצרה 5 קאפ׳.  ומשורה רחבה 10 קאפ׳.  A
021-HZF-1882-04-25-001-09105_toc_3,"מכתב עתי משמיע חדשות ""בקרב עם ישרון.מכל ..."," מכתב עתי משמיע חדשות בקרב עם ישרון, מכל הדברים הנוגעים בעניני המדינות. דברי חכמה ומדע, ידיעות העולם והטבע יוצא לאור אחת בשבוע, מאת חיים זעליג סלאנימסקי"
021-HZF-1882-04-25-001-09105_toc_4,תוכן העניגים דברי הימים .ירושלים .הצופה ...," תוכן הענינים דברי הימים, ירושלים. הצופה לבית ישראל מאת נ׳ סאקאלאוו. מעשה הצדקה להיוצאים מאת נ׳ סאקאלאוו. הוספה. היהודים בארץ החדשה מאת יהודה דוד אייזינשטיין. ידיעות העולם והטבע חכמת הציור מאת מאנע תלמיד הקאדעמיא, אבדן הצפרים במרחבי הטבע מאת האפפמאן. ווארשא. הודעות. שאלות ותשובות."
