article_id,headline,text
021-HZF-1883-06-14-001-10157_toc_1,," K ברוסיא ופולין. אל השולח במוקדם לשנה 5 רו״כ.  לחצי שנה, 2.75 רו״כ. ל לרבע שנה. 1.50 רו""כ.  ל ביתר הארצות 20 פראנק. באמעריקא 5 דאללאר. M"
021-HZF-1883-06-14-001-10157_toc_2,, K מחירו באשכנז: 14 רייכם מארק לשנה. בעסטרייך 8 פל׳ לשנה. אל וכן לרבע שנה. שכר מודעות: מכל שורה קצרה 5 קאפ׳ ומשורה רחבה 10 קאפ׳. K
021-HZF-1883-06-14-001-10157_toc_3,"מכתב עתי משמיע חדשות יוצא לאור אחת בשמע,..."," מכתב עתי משמיע חדשות יוצא לאור אחת בשבוע, מאת חיים זעליג סלאנימסקי."
021-HZF-1883-06-14-001-10157_toc_4,תוכל העגינים דברי היםיס .ירושלים .סמאלענ...," תוכן הענינים דברי הימים, ירושלים. סמאלענסק. טעמריאק מינסק. פינסק. האראדישץ. ווילנא. ראסיין הצופה לבית ישראל. הודעות, שאלות ותשובות"
021-HZF-1883-06-14-001-10157_toc_5,מפגי קדושת ימי ההג גתאהרה הצפירה לצאת בש...," מפני קדושת ימי החג נתאחרה הצפירה לצאת בשבוע המו״ל זה מכפי הנהוג בכל שבוע, ."
