article_id,headline,text
021-HZF-1880-08-17-001-070241_toc_8,גולי ספרד ופורטוגאל 1)," גולי ספרד ופורטוגאל 1) גלות ספרד עם גלות ירושלים ישאו יחד במאזנים, כגולי ירושלים יצאו גם גולי ספרד, אשר לחרב לחרב ואשר לרעב לרעב, אשר לדבר לדבר ואשר לשבי לשבי, כגולי ירושלים לא מצאו גם שארית הפליטה מגולי ספרד מנוס ומקלט בכל הארצות  אשר נפזרו שמה ממעונות אריות יצאו ואל הררי נמרים באו, ממאורת צפעונים התמלטו בעוד שניהם, ואל רבץ נחשים שרפים אשר אין להם לחש הדיחם קשה יומם, שפך אל זועם כאש חמתו על פליטת עמו ונחלתו ויטאטאם במטאטא השמד! שנים רבות התנודדו שרידי הגולים ההם בארצות אויביהם ונעו מים עד ים במצוקות מות וחבלי שאול, עד אשר הצליחו למצוא פנת גג לבלות שם טפחות ימיהם, וישישו כי מצאו קבר בין קברות ישראל. אחד מגולי עת רעה ההיא היה הרב הנאור דן דוד בן הנשיא הנכבד והנעלה דון שלמה אבן יחייא ז""ל (נולד בערך 1440 ונפטר בשנת 1504 בקאנסטאנ- טינאפאל) חוטר מגזע משפחה רמה בישראל בארץ ספרד ופורטוגאל, ונצר משרשי ארזי הלבנון אדירי התורה אנשי השם. הנשיא דון שלמה היה שר וגדול בחצר המלך אלפונסו בלי- 1) הפרק הראשון מספרי תולדות חכמי ישראל חלק חמישי אשר עודנו בכתובים. סאבון הבירה, חכם לבב ואיש אמונים, דורש טוב לעמו ועושה צדקה בכל עת, וה׳ אספו אליו בטרם הגיעו ימי הרעה ימי גלות ספרד ופורטוגאל. ודוד בנו היה אמון בבית הו החכם הגדול הנודע למשגב, דון גדליה אבן יחייא רופא המלך אלפונסו ואיש סודו, ודוד הלך הלוך וגדל וטוב גם עם ה׳ וגם עם אנשים, ויהי יקר בעמו ומופת בדורו, תופש תורה ותעודה וכביר כח בכל חכמה חמודה, הון ועושר בנוד צדקו, וצדקת פזרונו פרצה בישראל ובאדם, גם היה מגיד מישרים ומטיף לקהל עדת ישראל בליסאבון, ובשנת רל״ט הורם, והונף לשבת גם בשבת תחכמוני להגדיל תורה ולהאדירה. והוא עשה ספרים הרבה ויפרוש אור יקרות על באורי ספרי הקדש, על חכמת לשון הקדש ועל עוד ענינים רמים ונכבדים כאלה ובשבתו עוד בעיר ליסאבון הוציא לאור ספרו קב ונקי, ספר יקר לבאר את משלי שלמה, מליצותיו, דברי חכמתו וחידותיו, והבאור הזה נדפס במקראות גדולות באמשטרדם (שנת תפ״ז), גם הוציא אז לאור את ספרו הנכבד לשון למודים ללמד הליכות שפת קדשנו לבני ישראל, ונספח אליו ספר שקל הקדש לשקול את שירי שפת קדש על פי משקלי השירים בימים ההם ולהלביש צוארם בחרוזים, ויצא לאור בקאנסטאנטינאפאל בשנת רס״ו 2). והנה כשבת האיש היקר הזה שליו בביתו ורענן בהיכלו, בא פתאום כשואה פחדו ואירו כסופה אתה. כי מלשני בסתר רעיהם הכוהו בלשון לפני יואן השני מלך פורטוגאל וישיאו עליו עון אשמה כי מחזיק הוא בידי האנוסים אשר נסו מספרד לפורטוגאל, ויתמכם בישע ימינו לשוב לתורת היהודים ולהשליך את דת הנוצרים אחרי גיום, לדבר הזה חרה בו אף המלך ויחרוץ עליו משפט מות והונו ורכושו החרים לאוצר הממשלה. אך אוהבי דון דוד גלו את אזנו כי כלתה עליו הרעה מאת המלך וכפשע בינו ובין המות אם לא יחיש למלט את נפשו, ודון דוד מהר לקדם את פני הרעה, ויברח בלילה עם כל בני ביתו ואת רוב עשרו הניח בביתו והמלך החרימו לבית אוצרו, אך כאשר יגום איש מפני ארי טורף ויפגע בגמר שוקד, כן גם דון דוד אבן יהייא מפורטוגאל ויפול ברעה אחרת גדולה עוד מהראשונה בבואו אל שערי נעאפעל, כי בעת ההיא לכד קארל השביעי מלך צרפת את ממלכת נע- אפאל (בשנת 1495). ואף כי לא ארכו ימי ממלכתו שם רק שנתים ימים, בכל זאת כביר מצאה ידו לדבא תחת רגליו את היהודים האומללים והנדחים גולי ספרד, אשר מצאו מקלט למו בארץ ההיא על פי עזרת הר׳ הצדיק דון יצחק אברבנאל. כי הצרפתים צבאות קארל השביעי לבשו אכזריות כמדם וכחיתו טרף התנפלו על הגולים האובדים ההם וישסו שארית הונם ורכושם לראשונה ואת נפשות בעליהם רצחו לאחרונה, הכו אם על בנים, הרות בקעו ועוללי טפוחים נפצו על הסלע, ועברו ורמסו וטרפו ואין מציל. גם על דון דוד עברה כוס התרעלה הזאת, כי גדודי מרצחים ההם שללו את כל אשר לו, ולא השאירו בידו אף אגורה אחת ויציגוהו ערום כיום הולדו, ורק באורח פלא נמלט מחרב רעה ותהי לו נפשו לשלל, ויגם אל אי קורפו בערום ובחוסר כל ומשם החיש מפלט לו לעיר ארטא (בארץ יון), אך גם שם לא הונה לו וחייו היו תלואים לו מנגד, וישם פניו לארץ תוגרמא אשר פתחה אז שעריה להיהודים הגולים, אפס כי קצר קצרה ידו להוציא מחשבתו לאור, כי קדמוהו ימי עוני ולא היה לו במה לשלם שכר האניה על ב) מיתר ספריו נודעו לנו: באור על ס' המורה (ר׳ יש״ר מקאנדיא במכתב אחוז) ובאור פתיחת המורה היה ביד הר״א כרמולי והעיד עליו כי הוא באור נחמד וטוב, ובראשית דבריו ידבר על יקר ערך המורה ומחברו תולדות ימי חייו (דברי הימים לבני יחייא). ספר תהלה לדוד, בא זכרו ס׳ שלשלת הקבלה, וכותב כי לא הספיק להשלימו, ולא ידענו אם יצא לאור זו עודנו כמוס בכ""י. ספר קטן בהלכות טרפות, ונמצא לו תשובת שאלה בשנת רס״ג בשו״ת הרא״ס (סימן ל״ז) והוא כנגד פסק הרא""ם ושלח לו לעיין ו, והרא״ם המשיב עליו (בסימן ל״ח) ומחזיק את פסקו הראשון נוהג בר' ידוד כבוד גדול וקורא אותו „החכם הישיש החסיד״. (הכרמל החדשי נה ראשונה) — 247 שלח מכתב בקשה לאיש עשיר ומשכיל, ר׳ ישעיה מסיני שמו, ויבקשהו להיות למשען לו במשען כסף, והאיש ההוא היה בעל נפש טובה ורוח נדיבה, ולא אחר לשלוח לו כסף די מחסורו אשר יחסר לו עד בואו ארצה תוגרמא, ואז נסע דון דוד למחוז חפצו ויבוא לקאנסטאנטינאפאל (בשנת רג״ו) וישב שם שבע שנים וימת, ובנו הרב הגדול והחכם השלם ר׳ יעקב תם הציב לו מצבת אבן, ויחצוב בה בעט ברזל ועופרת את הדברים האלה: מזמור לדוד בן שלמה השר לבית יחייא ספרדי, אלי הדור פאר בגדי זמן פשט ולבש כמעיל חכמה, כסות לו דת, והתורה זר *) לכן זמן שמו בתוך הבאר וגם אבן גדולה שם על פי הבאר ד״ ה""ה הרב השלם רבי דוד ן׳ יחייא תנצב״ה, נתבקש בישיבה של מעלה בשנת הרס״ד בעיר גדולה קאנסטאנטינא (המשך יבוא)"
021-HZF-1880-08-17-001-070241_toc_9,חדשות שונות," חדשות שונות ציר ממלכת אנגליא מסר זה מקרוב מכתב נאטע ליד הנסיך מילאן בסערביען, אשר בו תדרוש ממשלת אנגליא ממנו לקיים את התנאי המאושר בברית הברלינית בנוגע לחופש היהודים בארצנו, באמרה כי קיום התנאי הזה בשגם היה כבד על ממשלת רומעניא בארצה, בכל זאת השתדלה להקים אותו באיזה אופן שיהיה. הנסיך הבטיח להציע את השאלה הזאת בבית אסיפת הנבחרים אשר יקרא לבוא בקרוב. סערות הרוחות ואבני הברד, הסבו חזיקות גדולות בכל יבולי הארץ ותבואות השדה ברוב מדינות אייראפא, בארץ אשכנז גברו המים בנהרות ויעברו על גדותם ויכסו ערים וכפרים, וישחיתו את עצי השדה וכל תבואת האדמה, מגדיש ועד קמה לא נותר מאומה, ותחת אשר קוו לאסוף מן השדה בשנה הזאת פרי הארץ למכביר, הנה נשארו בחוסר כל היוקר הולך וגדול והרעב נכון לבוא בארץ. ביום התקדש חג הלאומי בצרפת נשא נשיא הרפובליק את ראש כל האזרחים אשר זכו להתעטר באות הכבוד „עהרענלעגיאן) מכל המדרגות. וביניהם הננו מוצאים את גם את אחינו במספר עשרים ואחד איש, ומהם הכי נכבדים: הרופא הנודע בעולם המדעים, ושערמען סעע, שרי הגדודים: שמעון לעווי ויעקב לעווי, נציבי המחוזות: שנערב ולעאן קאהן, זה השני הוא חתנו של חכם עמנו והנדיב הנעלה ה׳ אלבערט קאהן זכרו לברכה ועוד רבים מאנשי שם זיטאמיר לא איש בשורה אנכי היום אלופי, ובלב נשבר הנני להודיעהו שאתמול בבוקר גוע ויאסף אל עמיו הרב החכם הכולל ר׳ מרדכי סוחאסטאווער נ״ע. האיש הגדול הזה נולד בגאליציען במאה העברה, וכבואו לרוססיא למד תורה את בני הגבירים בארצנו, וגם הבאראן הנכבד ר' הירץ גינצבורג היה אחד מתלמידיו, וכשנתיסדו בתי מדרש הרבנים נתמנה למורה בבית מדה״ר בזיטאמיר, ושמש בכהונה זאת עד כי נסגרו דלתותיו בפקודת הממשלה הרוממה בשנת 1873. כב תשעים שנה או יותר היה במותו, וביום ג׳ 29 יולי בעלות השחר עלתה נשמתו הטהורה השמימה. אחלי את כבוד המו״ל, אשר ידע את האיש המצוין הזה הטיב, ושמש עמו יחד בכהונה גדולה כמה שנים להציב לו שם וזכר במכ״ע היקר כאשר יאות לאיש מורם מעם כזה, תלמידו המתאבל עליו ג׳ קאָרשון 3) כצ״ל, ובס׳ דברי הימים לבני יחייא נדפס „שר"" בטעות"
021-HZF-1880-08-17-001-070241_toc_10,," (מודעה), יצא מבית הדפוס שלי:   מ  א) ספר שו״ת נודע ביהודה מהדורא קמא ומהדורא תנינא. כמו שנדפסו ראשונה בפראג, לא נחסר דבר, בשמונה כרכים, כלול בהדרו, בתיקון מחדש כל רענקיל זצ״ל המראה מקום, בהוספות הגהות הגאון המפורסם מרנא ברוך פ בעל המחבר ספר ברוך טעם, והגהות הגאון המפורסם מרנא יוסף שאול נאטאנזאהן זצ״ל אבד״ק לבוב. כל רואיו יאשרוהו, כי עוד לא נדפס כמוהו בטובו, הדרו ויפיו.  מחירו בווארשא ארבעה 4 רו""כ .   ב) ספר הכוזרי, עם שגי ביאוריו המפורסמים. האחד קול יהודה מהרב מוהר״ר יהודה מוסקאטו זצ״ל, והשני אוצר נחמד מהרב מוהר״ר ישראל הלוי זצ״ל, בחמשה כרכים. בהוספות רבות, כלול בהדרו. מחירו בווארשא 1,50 רו""כ. No. 25 נמצאים להמכר בבית מסחר הספרים של ר״א יעב""ץ נ״י נאלעווקי ובבית מסחר הספרים של ר׳ מאטיל קאלינבערג נ״י, נאלעווקי No. 23 בווארשא ובקרוב יצאו לאור שלשה ספרים המפורסמים, מאת הגאון מוהר״י לנדא זצ״ל בעל נודע ביהודה, ובנו הרב הגאון מוהר""ש לנדא זצ״ל (א) ספר דורש לציון, פלפול עמוק ונעים בסוגיות הש״ס, ובתוכם יע״ל קנ״ם (ב) ספר אהבת ציון, דרושים נעימים ומוסר השכל (ג) ספר שיבת ציון, שו״ת. מחיר כל שלשת הספרים יחד 1,50 ונדפסים בתבנית ספרי נודע ביהודה, ויחדיו יהיו תמים אחד עשר כרכים. כלם אהובים וחביבים על לומדיהם, ושמם נודע ביהודה וגדול בישראל, ג) עוד נמצא אתי להמכר מספר מועט מן ספר הלכות גדולות (בה״ג). נדפס עוד בשנת תרל״ה עם הוספות הגהות ומראה מקומות וחדושים קצרים מהרב הגאון המפורסם מרנא אברהם שמעון טרויב זצ״ל אבדק״ק קידאן, וכל הקונה יהיה זריז ונשכר, כי לא יודפס עוד מחדש עד עבור שנים ושמיטות. המדפיס יצחק גאלדמאן בווארשא "":: 143"
021-HZF-1880-08-17-001-070241_toc_11,," מודעה ע״ד אחרונים 2.3 הנני להודיע ללוקחי פרי עץ הדר, כי גם בשנה זאת תאחז ידי במסחר אחרונים קארפֿורער כשרים מובחרים ומהודרים עד למאד מפארגי ממש, מהמקומות המוחזקים זה מאלפי שנים לכשרים, ולא יהיה עליהם שום חשש הרכבה חלילה, הן בתיבות שלמות אשר יהיו חתומים בחתימתי, הן לאחדים, גם לולבים ירוקים יפים ומהודרים, גם הדסים טריעסטער, הכל במקח הזול, בית מסחר שלי מהאתרוגים הוא פה ווארשא ברחוב נאלעווקעס N. 17 בחצר ה׳ אריש גלאס. בבית מסחר היין של ר׳ איטשע מרגליות מקראקא אשר בחצר הנ״ל, ואני סמוך לבי ובטוח כי כל ל. יודעי שמי אך אלי יפנו לקנות, בידעם כי יש על מי לבטוח. שמעון לעווי, ווארשא דזיקא גומר 29"
021-HZF-1880-08-17-001-070241_toc_12,," ם    הודעה לסוחרי אתרונים .. האספו אלי ידידי כורתי בריתי על מסחר האתרונים משנים העברו וגם חדשים  מקרוב יבואו נא אלי, למסור לי הקאמיסיות שלהם לקנות בעדם אתרונים מכל המינים קארפורער, יוניוועד ארץ ישראל מאראקער, גם לולבים והדסים ע״פ המקחים בטריעסט, בהוספת שכר הפראכט ושכר קאמיסיא, ומקנת הסחורה בטריעסט תהית ע""י שותפי ב״א הרב הגאון מוה׳ אברהם יצחק נ״י משכיל לאיתן אבד״ק סמאלעוויץ כשנה בשנה. וכל החפץ במסחרנו יפנה אלי הח״מ ע״פ האדרעססע דלמטה, ולבבו נפתלי משכיל לאיתן. יהי סמוך ובטוח כי יהיה מלא רצון. аттолiо Маскиллелсоцу въ г. Минскъ губ. . א"
021-HZF-1880-08-17-001-070241_toc_13,,"   דאקטאר א׳ גרינבוים משכנו כעת ברחוב נאלעווקעס במכפלה השניה בבית תחת מספר ח׳ מהמספר החדש (No 8) יקבל חולים אשר יבואו אליו לשאול בעצתו במשכנו הנ״ל, בכל יום משעה רביעית עד שעה ששית, והעניים חנם משעה ששית עד שעה שביעית הכל אחר הצהרים.. מ  "
021-HZF-1880-08-17-001-070241_toc_14,," כשר כשר. זעעבאד האטעל פאלק, אסטענדע ..:: וש: 5 - רוהע דו נארד 4 עט רוחע ד׳ עספאגנע 12 נעבען דעם האטעל דע פרוסס, גאנץ נאיי איינגעריכטעטעס הויז, פראכטפאללער אויסזיכט. בילליגע  פרייזע, יעדען זאנגאבענד גאטטעסדינסט אים הויזע.  "
021-HZF-1880-08-17-001-070241_toc_15,," : הודעות ן . 348.2   קרא״. ללמד לילדים  מחב ת „קרוא  הקריאה הנכונה ב שפת עבר על פי כללי הדקדוק מחירה בעד 15 עקסעמפ׳ 1 להשיגה חפשי בבית מסחר הספרים ש  ער מרדכי קאלינבערג נאלעווקי , 23 ב ווילדער. ר"
021-HZF-1880-08-17-001-070241_toc_16,," Практическая Мстола инстонисашiя ג' חברות, מחיר כל חברת 6 ק׳, מלבד פארטא; נמצאות להמכר ביד המו״ל ה׳ קאדקין בגראדנא, ובווארשא ביד: М. Канланъ, Франц. N. 24."
021-HZF-1880-08-17-001-070241_toc_17,," דאקטאר סלאנימסקי, וואהנט אין ווארשא  אויף דיא נאלעווקעס גומר 41 (הויזע ווינקעלהאקען), נימט אויף קראנקע יעדען טאג מארגענס פאן 9 ביז 11, אונד פאן 5 ביז 7 אוהר נאך מיטטאג, בעזאנדערס עמפפֿיהלט ער זיך פיר איננערע אונד געהיימע קראנקהייטען, אונד בירורגי- שע. פיר ליידענדע ארמע אונענטגעלטליך"
021-HZF-1880-08-17-001-070241_toc_18,," בהרעדאקציא נמצא למכור הצפירה מראשית צאתה 1874 עד סוף 1875 עם כמה ציורים יפים, רק יחסר בה שני נומערין, מקחם 2 רובל עם פורטא, והקונה שנת 1875 לבד, ישלם 1.35 רו״כ."
021-HZF-1880-08-17-001-070241_toc_19,," הדאקטאר וואלנער מוויען, שפעציאליסט במהלות הלשת העצבים ומחלות נשים (גערווענשוועכע אונד, פרויענקראנקהייטען), יתעכב במשך ימות הקיץ הזה במקום המרחץ דובבעלן סמוך לריגא, ואלה החפצים לדרוש עצתו, יפנו אליו ע״פ האדרעססא שלמטה וימצאו מזור ותרופה. אדרעססע Доктору И. Воланеру въ Дуббельенъ близъ риги Hotel Petersburg, Karlsbader Strasse 11. 5....... "
021-HZF-1880-08-17-001-070241_toc_20,," שאלות ותשובות לה׳ משה סאבאל קבלנו, לה׳ מרדכי ראבי' בסק' קבלנו לנכון והגליונות נחפש עבורו, להחותמים על  המכתב מסותאוואליע עוד חזון למועד כי עדיין הדבר רחוק לצאת אל הקועל, להחותמים על המכתב מטאראשטשע, ע״ד אז״ז הממונה שנתעשר. ונחשד בעיניכם, מי יודע, הן אמרו חז״ל, כיון שנתמנה. אדם פרנס על הציבור מיד מתעשר (יומא)."
021-HZF-1880-08-17-001-070241_toc_21,, הרוצה לכתוב אלי יכתוב ע״פ אדרעססע S. Sionimski in Warschau יא Dzika No. 25a.   .. א״;  З. Слонинскiй. г. Варшава зикая № 254.
