article_id,headline,text
021-HZF-1877-11-14-001-40343_toc_1,,"   ברוסיא ופולין.  השולח במוקדם לשנה 5 רו״כ.  לחצי שנה, 2,75 רו״כ. לרבע שנה 1,50 רו""כ. ל ביתר הארצות 20 פראנק.  באמעריקא 5 דאללאר ."
021-HZF-1877-11-14-001-40343_toc_2,, A מחירו באשכנז:  3 14 רייכם מארק לשנה.   בעסטרייך 8 פל׳ לשנה  וכן לרבע שנה. שכר מודעות:  מכל שורה קצרה 5 קאפ׳. u
021-HZF-1877-11-14-001-40343_toc_3,"מכתב עתי משמיע חדשות בקרב עם יטחן , מכל ..."," מכתב עתי משמיע חדשות בקרב עם ישרון, מכל הדברים הנוגעים בעניני המדינות. ילר  לי⸗ דברי חכמה ומדע, ידיעו, עלם והטבע. יוצא לאור אחת בשבוע, מאת חיים זעליג סלאנימסקי."
021-HZF-1877-11-14-001-40343_toc_4,תוכן הענינים.," תוכן הענינים. מ דברי הימים, גראדנא. קרעמענטצוק. ניעזין. קראקא. ידיעות העולם והטבע. הכסף והשטר מאת המו״ל. מכרי הפחמים אצל נעווקאסטלע מאת אברהם אבא ראקאווסקי, גלגלי מים מאת נחמיה דוב האפפמאן. ידיעות תלגרפיות. הודעות. שאלות ותשובות."
