article_id,headline,text
021-HZF-1874-10-07-001-10303_toc_13,נסיעה באיי הים הגדול.," נסיעה באיי הים הגדול. (המשך) על האי הזה ישנם תניני-מצרים (קראקאדילע) הרבה, כאשר אמרנו. התנינים האלה ירבצו ברפש ואגמי מים אשר על החוף, אך לא יזיקו לאיש, כי אם יחיו את עצמם מדני הים ומחיות קטנות עם גדולות אשר יצודו למו, גם לא יחוסו על ילדיהם הקטנים, ואך בצאתם מביציהם יאכלו אותם בכל פה, עד כי לפעמים לא ישאר מהנולדים אף אחד. כאשר ירבה מספר העם היושב על האי הזה כן ימעטו התנינים, כי אז אין להם כל מהיה, לאשר האנשים יצודו את הדגים ולהם לא ישאירו מאומה; גם נלחמים התנינים איש את רעהו, וימיתו חד את אחד ומחריביהם מהם יצאו. עודם חזק עליהם כקרני הכוי (ביפפעל וכמין קשקשת הוא עליהם; בקנה רובה לא יומתו כי הכדור ישוב אחור מבלתי יכלת לעבור דרך העור, ואך אם מצא כדור עופרת את עין התנין אז ילך עד מוחו ויפגע בו וימות התנין הנורא ההוא. — אם ידרוך עליו איש ברגלו, אז יכוף התנין הזה את ראשו תחת למים, ויכהו בפרסות רגליו או בזנבו, או ותפשהו בשיניו החדות ואז בלי ספק יהיה האיש טרף למו. — התנין הזה קדוש הוא בעיני יושבי טימאר כבעיני המצרים בימי קדם, וגם כעת בעיני האינדינים היושבים בעיר באנארעס על נהר נאנגעם ובראמאפוטרא באינדיען התחתונה; אך בכל אלה אם יקח מהם שור או כשב — כאשר יקרה זאת לפעמים — אז נקום ינקמו בו, כי רכושם יקר מאוד בעיניהם ואין רשות גם לבני אלהים כהתנינים — לנגוע בו. וזה מעשה הנקמה: את שדה המלחמה יבחרו תמיד במקום אלונים רבים למען יהיו עלימו סתרה, ועשרה אנשים או יותר מזוינים בחנית ורמה ילכו לעת הצהרים, — אשר אז יצא התנין ממהבואו לשכב בחמה ולהחם את עורו בקרני השמש — ויסתרו בין האלונים, ובלכתם לתור את מקומו, אז על גחונם ילכו למען לא יראם התנין וימיתם, ואם מצאו את מקומו אז ישתדל האחד להגיחו ממקומו בתחבולת ערמה, למען יוכל השני להמיתו; והנשארים יפזרו לכל רוח, לגדור בעדו כל מקום, לבלתי ישוב אחור. האיש אשר עליו להגיח את התנין מרבצו, יסתתר תחת אלון אחד וישמיע קול ילד בוכה, התנין יתעורר אז משנתו, והאיש יוסיף להשמיע דתניי ממקומו לאט לאט וילך אחר המקום ם אשר ממנו היא האיש ילך מזה והבא תחת אלון אחר וישמיע את קולו בשלישית וכן ברביעית, עד כי האנשים ההולכים אחורי התנין על גהונם יסגרו בעדו כל דרך. ואז יניע האיש המגיח בענפי האלון אשר תחתיו יעמוד התנין כשמעו זאת ילטוש את עיניו על המקום הזה, בהאמינו כי שם טרפו לפניו, ולא ישמע כי איש יבוא מאחריו המבקש את נפשו, ואז יקפו⸗ האיש השני במהירות גדולה על ערפו סמוך לראשו ויעמוד עליו בכל כוחו, למען לא יוכל התנין להסב את ראשו ויבלעהו; התנין יפתח את פיו לבלוע את רוכבו — כי לא הסכין בזה — ואז ידקור הרוכב את כידונו המשוח ברעל לפיו ויחתוך את לשונו לשנים, וברגעים אחדים ימות התנין הנורא מחמת הרעל אשר החל לפעול את פעולתו חיש אחרי בואו אל פיו. זה הוא דרך ציר התנינים האלה אצל עם המאלאים. — פקיד המשאות קנה גם פה עלמה אחת מן החינעזים ואחר כן שבנו אל האניה. המלחים הקימו תרן, פרשו נס והאניה נסעה מצפון להאי טימאר אל האי אמבאי (Ombai). האי הזה הנהו על הגבול בין הקולוניות של הפורטוגיזים והאללאנדים. — האניה לקחה את מקומה הרחק כמטהוי-קשת מן החוף, ואנכי עם רב החובל ופקיד המשאות ואחדים מעבדי האניה ירדנו בסירות דוגה לבוא אל החוף, אשר על גבול נחלת ההאללאנדים, אך מה מר היה גורלנו או מואלאים אחדים סבונו בכידוניהם ובחניתותיהם, ויאמרו להמיתנו, למען יבואו בנקל אל האניה ויבוזו את כל אשר בה; לשוא התחננו עליהם על נפשינו, כי שומע לא היה לנו מאתם; לשוא הריקונו גם את אמתהות כספינו, ונתן להם את כל אשר היה אתנו, למען יעזבונו לנפשינו, כי המה אך באחד לבא אל האניה — ומי ישיבם: בדי ריק הרעימו המלחים הנשארים באניה בכלי תותח להביא מרך בלבבם, כי לקחו אותנו מזה ויובילונו אל תוך היער למען התרחק מן החוף כברכים כושלות ובעינים זולגות דמעה הלכנו ביניהם כצאן לטבח והנה — פתאום עמדו על מעמדם, ויקדו וישתהוו לפני איש אחד הבא לקראתנו, והוא — נשיאם. כרגע צוה להם הנשיא לסגת אחור, ואז אמרנו: נושענו. אך לא; גם הוא כפתן חרש אטם אזנו משמוע לקול תחנונינו, ואך אחרי עמל רב, אחרי כי הבטחנוהו לשוב אליו עם כלים יקרים בידינו, ואחר כי הפיל עליהם אימה ופחד המאחז עינים אשר היה אתנו, בירקו אש הרבה לעיניהם מפיו, עזבנו לנפשנו, ובכן שבנו אל האניה בלב מלא אימה ופחד, ושבנו עם האניה בדרך אשר באנו בה, והוא למזרחו של האי טימאר, למען לא תהי עוד אימת מות לנגד והאניה לקחה מקומה בפעם הזאת רחוק 120 מדות (קלאפטער) מן דילאי (Dieley). המקום הזה הוא מושב הפורטוגיזים, ופה נודע לנו משר המחוז, כי אמנם אוכלי אדם המה יושבי האי אמבאי כיושבי טימאר אולם רק בלחמם עם אויבם יעשו זאת, ולא יחכו אז עד שימות איש ריבם, אך בעוד בחיים יחתכו ממנו נתה בשר ויבלעוהו בתאוה עזה, אף ילוקו את הדם הנוזל ממקום הפצע, כאשר ילוקו הכלבים, ואם הדם ההוא לא יספיק להם לרות את צמאונם, אז יהתכו את צוארו בסכין, למען יפרץ דמו כנהל וישתו דים; זאת היא המת נקמת המאלאיים על האי אמבאי וטימאר. — האויר רע הוא ומשחת מאוד במקום הזה, גם לעתים לא רחוקות תרעד האדמה תחתיה פה ותשים שמות בארץ; לעומת זה ישנם יערים רבים במקום הזה אשר ישאו לשמים שיאם וירהיבו צלם לעונג נפש ההלך העיף והיגע מחמת השמש הנורא. תמרי הקאקאס יגדלו בזה לרוב, גם מצאתי פה את עץ-הלחם. והוא עץ אשר פריו יטעם להיך כלהם אשר בידינו, גם ראיתי במקום הזה את העץ הנקרא פאנדאנוס (Pandanus), והוא מין עץ אשר כל אחד מענפיו ישלח את שרשיו דרך האויר ישרישם בארץ, והמה יביאו לו את מחיתו. גם את עץ הואנדעל מצאתי פה לרוב, ועוד אלפי שתילים נחמדים אשר תתענג עליהם עין הרואה. — גם הנחש באא אוה את המקום הזה למושב לו. הנחש הזה נורא ואיום מראהו, לפעמים תללה מדת אשכו עד ארבעים רגל; גידי בשרו ועורקיו חזקים המה מאוד, שניו עקומות הנה ונוטות לצד הפנים; ובית בליעתו רחב מאות מחיתו הוא על הרוב חיתו שדי; בין נחשים הארסיים לא יוחשב, כי אם יקוף בשרשרת את טרפו וילחצהו בהטבעות הרבות אשר מסביב לגבו. אם כלה את טרפו, ישכב כאבן דומם ובנקל ימיתוהו אז; אך על הרוב שנים שנים ילכו הנחשים האלה, ובעת אשר האחד יתנפל על טרפו, יתור השני כמו כן אחר טרף לנפשו, והאיש אשר יקרב אז להמית את האחד בנקל יוכל להיות טרף לשני רעהו. מקום מגורת הנחש הזה הוא נגב אפריקא, אפריקא התיכונה, איי המזרח אשר באינדיען ונגב אמעריקא. — (ההמשך יבא)"
021-HZF-1874-10-07-001-10303_toc_14," חדשות
שונות","  חדשות שונות ביום 31 יולי משנה זו חגגו באמעריקא יום זכרון מאה שנה להתגלות יסוד החמץ (וויערשטאף) הנמצא על ידי החכם פרוסטליי מארץ אנגליה בעיר בירמינגעם בשנת 1774, ואשר הוא היה היסוד הראשון לכל חכמת הכעמיא החדשה. בשנה הזאת שנת 1874 הקימו לו מצבת זכרון (שטאטוע) עשויה משיש לבן טהור. המצבה הזאת היא תבנית החכם הזה בעת אשר המציא את המצאתו הגדולה והנכבדה, והיא מעשה ידי האמן הגדול וויליאמסאן. המה״ע הירחי „זאאלאגישער גארטען"" היו״ל בעיר פרנקפורט, יודיע את החקירות אשר עשו בעופות השמים בימי התחולל מגפת החלי רע בארצות ובתקופות שונות: בעיר פעטערסבורג ובעיר ריגא. בשנת 1848; בפרוכסיה המזרחית בשנת 1849, ובעיר האנאווער בשנת 1850; בשלש השנים האלה ראו אנשי המקומות הנזכרים את צפרי הדרור (שוואלבע) צפרי הקיץ (שפערלינגע) ואת הצפרים הנקובות בשם „דאהלען"" מתעופפות ונודדות ממקומן בכל ומי המגפה ולא שבו משם עד שוך חמתה מעל הארץ. בארץ גאליציה עפו צפרי הקיץ מעיר פשעמישיל עוד לפני ימים אחדים בטרם החל הנגף וישבו בארץ נודן עד אשר חדל המות מעשות שמות בארץ. על הדבר הזה התבוננו גם בנירענבערג ובמינכען. כל אלה יורונו דעה כי בימי מחלת החלי רע ישחת אויר הנשימה וימלא קטב והלאה, עד אשר יגרש מקרבו את עוף השמים. במשך הארבעים וחמש שנים האחרונות עלה מספר החוטאים הגדולים בארץ צרפת מעת לעת באופן מבהיל מאוד גם רבים הם החוטאים אשר אחר קחתם ענשם בפלילים שבו על עון עקביהם שנית. החזיון הזה עוד ירב להעציב אם נחלק את מספר השנים ההן ונעבירן חמש חמש: משנת 1829 עד 1834 גבר מספר החוטאים על 10%; משנת 1850 עד 54 על 20%. משנת 1866 עד 64 התרומם המספר במעלת 32. משנת 1865 עד 69 על 37, ומשנת 1870 עד שנת 1871 על 40%. — מחזה הפך מזה נחזה בארצות הברית באמעריקא; במשך שבע השנים האחרנות הלך שם מספר החוטאים הלך וחסר, ורק שנה אחת יוצאת מהכלל הזה, היא שנת 1869 אשר העלתה את מספרם. — אם נשים לבנו על מספר יושבי הארצות האל ההולכים ורבים משנה לשנה, עוד נוסיף להתפלא ולהשתומם הפלא ופלא. מכתבי העתים מודיעים המספר השנתי מתוצאות מורי השעות הנשואים בצלחת בארצות שונות: ארץ שווייץ תוציא שנה שנה 1,600,000 מורי שעות במחיר 88,000,000 פראנק. צרפת תוציא 300,000 במחיר 16.500,000; אנגליה 200,000 במחיר 16,000,000; ארצות הברית תוציאנה 100,000 במחיר 7,500,000 פראנק. כל תוצאות מורי השעות בארצות האלה שנה שנה היא 2,200,000 במחיר 128,000,000 מילליאן פראנק. י. זוסמאן קאפעליאוויטש ממינסק. הערכת ה׳ לעינקוף תוכל ארץ אוסטריא בשנה זאת למכור חו״ל חטים 12,000,000 קווינטאלס, דגן 3,000,000, וכמספר הזה שעורים. — איש מקנה הגדול בתבל הוא ה׳ שמואל אללען מן טאקסעס באמעריקא, מספר צאנו 225,000. המרעה הגדול אשר לו בין נהרי נאוועדא וקאלאראדא ארכו 80 ורחבו 40 פרסא יספיק מזון אל 120,000 צאן, מלבד שני מקומות מרעה אחרים המספיקים אל 35,000 ואל 70,001 צאן, לאיש ההוא דרושים 400 רועים 5000 סוסים לרעות את צאנו. — אמן אחד המציא מנורה חדשה אשר לאורה יוכל הפהאטא. ראפיסט לצייר גם בלילה. — כעת מתאספים לערך 6000 משוררים מכל ארצות אשכנז לעיר מינכען (מלבד הבאים מאוסטריא ואמעריקא.) להוג „חג המשוררים הגדול"" הוא השני בארץ אשכנז, הראשון הי׳ לפני תשע שנים בעיר דרעזדען. — גם בעת הזאת נמצא אוהבים לאפיפיור, חברה קתולית אחת בלאנדאן שלחה לו ביום 12 אויגוסט 100,000 פראנק למנחה, והוא קבלה בסבר פנים יפות. — ע״פ נסיון נודע כי בנייר הצבעי אשר יקח לדבק כותלי הבית והחדרים נמצא בם מות (ארשעניק) ולא פעם אחת קרה אשר אנשי בית ההוא נחלו ונפלו למשכב. — הרעב בארץ בענגאל בהודו חלף הלך לו מחיר האורז ירד מטה הכסף אשר נאסף בבריטאניא עבור סובלי הרעב עלה קרוב אל 200,000 שטער. — בעיר יעדא בירת יאפאן נמצא 18 מכ״ע, מהם יו״ל רק פעם אחת בשבוע. — רוב תושבי שווייץ מתים טרם הגיעם לשנת 50. — אמן אחד בארץ שווייץ המציא מורה שעות חדש אשר כח תנועת האופנים הוא ע״י אויר נלחץ. — חבל היותר ארוך בתבל נעשה כעת בעיר שאדוועל אורכו 10,000 פאטהאמס. — הדר הגדול בתבל הוא בסט׳ פעטערסבורג אורך 650 ורוחב 250 רגל. אין עמודים בחדר ההוא והתקרה נשען רק על צדי הכתלים. — באמעריקא נמצא 52,017 בתי מלאכה אשר אופי המכונה יסובו ע""י תנועת המים השוה לכח 1,130,416 סוסים. — מחיר הסחורות אשר הובאו לנגב אויסטראליען בשנת 73 הי׳ 3,700,000 שטער"" רב משנת 72 בהמספר 900,000, ואשר יצא משמה חו״ל המה מתכיות 770,602 שטער"" חטים 957,577, קמח 725,450, צמר — .1,600,000 הכנסת חוף וועץ בשנה העברה הי׳ קרוב למילליאן שטער״ הוצאות עלו פחות מן 700,000. אניות אשר עברו שמה 1,178 משקל משאם הי׳ יותר מן 2,000,000 טאן. "
021-HZF-1874-10-07-001-10303_toc_15,ראשית התישבות היהודים באמשטרדם.," ראשית התישבות היהודים באמשטרדם. כאשר התלקחה אש קנאת-הדת בספרד, וחמס האונקוויזיציאן אכל בכל פה את היהודים והיהדות לבלע ולהשחית, נשאה משפחה אחת לשמים עיניה, לעזרת ה׳ ממרום, למלט משחת חייה. ובשנת 1590 עזבה האשה מאיאר ראדריגוס, היא ואישה עמה, שני בניה עמנואל ואנטאני לאפעץ, ושתי בנותיה מרים נונעס ויואטא, את ארצה ומולדתה, וילכו באשר התהלכו. עמנואל ומרים התחברו יחד באניה את דודם מינועל לאפעץ ללכת הוללאנדה דרך הים; אבל גם שם נגעה גם יד ה׳, ונשבו ביד האנגליים הנשארים ממלחמת שפניה, ובתור שבויי חרב הובאו לונדנה. מרים היתה יפת תואר ויפת מראה, ויפיה כן טובה משכו עליה עין פקיד-האניה, ויט אליה חסד, ועינו שת לחומלה על בת יהודית זאת במדה נפרזה מאד, עד אשר עשתה לה ההתקרבות הנפרזה ההיא כנפים עד המלכה עליזאבעטא. המלכה צותה להביאה ותשתומם למראה עיניה, כי לא רק יפיה, אבל גם ענות רוחה ונעים לקחה הכו שרש בלבה, לאהבה אותה, ותשא חן וחסד לפניה; הושיבה אותה לימינה ותסע עמדה במרכבת המשנה ברחובות לונדון להראות השרים ותושבי העיר את טובה ואת יפיה. אולם לב מרים לא מצא מנוח בכל הכבוד הגדול הזה, ולא הטתה אזן לבקשת המלכה, כי אם נשאה תפלה לתת לה חפשה וחרות ללכת אל המקום אשר תבחר, וכאשר נעתרה לה המלכה וחפצה נתן לה, עזבה היא ושאריה את כל כבודה בלונדון, ויאחזו דרכם ללכת הוללאנד. מרים נונעס פערעאיר, היא היתה הראשונה אשר אחזה לשבת באמשטרדם, ותכח אבן פנה למוסדות התישבות קהלת יהודים אישפניים — פורטוגלים, אשר ברוב יונים עלו למעלה ראש לשם ולתהלה; כי במשך שנים אחדות באה גם אמה מאיאר ראדריגוס, אחיה וקרוביה, אמשטרדמה, ומשתי המשפחות לאפעץ ופערטאירא, נוסדה קהלת יהודים בימים לא כבירים. — מן המיסדים קהלת היהודים באמשטרדם, ואשר התאמצו להגדיל ולהאדיר מושבותם בעיר הזאת, הכי נכבד הוא אורי לעווי, יליד דוד אבן-דן, היו הראשונים אשר הניחו האבן הראשונה למוסדות בית-תפלה החדש, ואשר כן נקרא על שמו „בית-יעקב״. ור' אורי לעווי ויוסף פארדא הם היו הרבנים הראשונים אשר כהנו פאר בקהל עדתם זו. קטן יעקב ודל, אך רוחו בקרבו — רוח ה׳ — תחייהו, תגדלהו, ומאשפתות תרוממהו! אם אך מצא מפלט לו מחמס קנאת עם ורדיפות גוים עריצים אשר הלמוהו מחצוהו ומנוחה הדריכוהו, כן התנשא רוחו בקרבו, ואל אל תרוממהו, לשגב מבצרי דתו, וחומת אמונתו לבנות כמו רמים. קהלת היהודים באמשטרדם ביד אשה כוננה וגם נוסדה, וביד אלפי אנשים - בימים לא כבירים - הוצבו דלתיה ופתחו שעריה לכבוד ולתפארת, אך כחו שקטו כמעט מזעם עמים ועברת גאונם וזדונם, שגבו אזרו חיל לבנות להם בית לשם ה׳, וכי חפצם צלחה בידם לכונך „בית יעקב"" כן מהרו ויחליפו כח להרחיב גבולות דת משה, ולרוממה ולנשאה; כי לא ארכו הימים ויוסיפו עוד לבנות בית תפלה בשם „משכן שילה"", ובימים לא כבירים אחרי הבנות משכן שילה, הקימו עוד שלישיה, ושם דוד פארדא מתנוסס עליה בראש, וברוב ימים הוסיפו אמץ ויקנו להם במגרשי העיר אחוזת קבר, ותהי עדתם שלמה. כה יגדל שם ישראל בלאומים, וכה עלתה וגם רבתה עדת היהודים באמשטרדם, לשם ולתפארת ט״ף שפירא מעיל סייני. ולתהלה בקרב הארץ. אשכנז בשנת 1554, הוא הביא אתו באמבטרדה אורחה קטנה (קאראוואנא) מעבדי הישפניה - פורטוגליה אשר בקשו מפלט להם מחמת המציק, ואת אלה הביא במסרת ברית היהדות. בנו אחרן עמד לו לימינו במעשה הברית הזה, ובחייו מל תשע מאות ושלשים ואחד מבעלי ברית החדשה אשר קיימו וקבלו עליהם דת משה, להכניסם בבריתו של אברהם אבינו. אלה היהודים ועמהם עוד חדשים מקרוב באו, התקבצו יחד בכסא ליום חונו אל הרנה ואל התפלה לפני אל אלהי הרוחות לכל בשר, להקל מעליהם משאת יגונם ומפח נפשם הממלאים חללי לבבם, בשיח שפתותיהם והגות רוחם. ויהי בהשתפך עליהם נפשם, ולבבם מלאו רגש יה ויראת שדי, ואימה נוראה - הרת קנאת הדת - הקיפה אותם מסביב בית תפלתם, ותהי לזעוה. כי התנפלו עליהם קנאים נוראים להוציא בחזקה את הנמולים, בחשבם אותם לבעלי ברית הפאבסטים; אך כאשר נגלה טעותם, ונוכחו לדעת חלום קנאתם, נתנה להם הממשלה חפשה לעבוד את אלהים אשר החזיקו בו, בכל ערכי המושגים, מבלי מפריע ומכלים דבר. מן העת ההיא החלה קהלת היהודים באמשטרדם לשגשג ולעלות למעלה למעלה. אחרי שנות מספר השגו חיל וירבו ויעצמו, עד אשר מצאו די אונים לחשוב מחשבות לכונן למו בית מקדש מעט בנוי לתלפיות בתוך קהל ועדה; האיש המפואר יעקב טיראדא, ומרעהו"
021-HZF-1874-10-07-001-10303_toc_16,," יצא לאור מדפוסנו ד הרו לל  כרן עם ה  חומש . א) פירוש רש״י, ב) אבן עזרא, ג') פירוש הרשב״ם, ד) הרמב״ן, ה') בעל הטורים, ו) אבי עזרי, (באור לפירוש אבן עורא), ח') מסורה על התרגום, עם באורים יקרים מהרב בעל ס׳ אוהב גר, ט׳) ספר פתשגן, באור נפלא על תרגום אונקלס, ממחבר קדמון אשר לא נודע שמו, והיה ספון בכ״י עד כה, ונודע בין החכמים בשם „ספר יאר"" שקראו שמו על שם השנה (רי״א לאלף הששי׳ שנכתב בה הספר, יוד׳) נתינה לגר באור חדש ונפלא על תרגום אונקלם מאת הרב הגאון החכם הכולל מוה׳ נתן הכהן דר׳ אדלער ני׳ רב הכולל דמדינת ענגלאנד. גם נדפס בו ספר תולדות אהרן עם הרבה הוספות מספר בית אהרן. התרגום אונקלס נדפס ע""פ תרגום שנמצא בכ""י מנוקד מרבי ישעיה הנקדן ז""ל בשנת ה׳ אלפים ס״ד ליצירה, וע״פ התרגום שהגיהו הרוו״ה ז״ל מכ״י ישנים. החמש מגילות נדפסו עם פרש״י הראב״ע וספרנו, ועם תולדות אהרן, ועוד בו מעלות רבות, ונדפס בכל הידור, באקטאף (12 באגען) בחמשה חלקים, ולכל חלק ילוה סדר התפלה לשבת. מחירו (מלבד פארטא) שלשה רו״כ (5 פלארין ע״זו), ועל נייר רעגאל 4 רו״כ (ק״ר 65 .6 פ״ל, לקונים אותו למסחר יותן ראבאט נכון. גם יש אתנו לממכר חמשה חומשי תורה עם תרגום רוסי מאת הרב החכם הכולל מוהר״ל מאנדעל. שטאם. נדפס בזקטאף גדול, באותיות גדולות בכל פאר והידוד, מחירו (מלבד פארטא) שני רו״כ. לקונים למסחר יותן ראבאטט נכון. החפץ בספרים הנ״ל וכן בכל ספרי דפוסנו יוכל להשיגם בידי סוכנינו ומוכרי ספרינו אשר בכל עיר ועיר, או יפנו אלינו. המדפיסים האלמנה והאחים ראם בווילנא. אדרעססע אלינו: Wittwe S. Gebriider Romm in Wilna."
