article_id,headline,text
021-HZF-1880-08-17-001-070241_toc_1,, אנסלא ברוסיא ופולין. אי השולח במוקדם לשנה 5 רו״כ. א  לחצי שנה 2.75 רו״כ. אה לרבע שנה 1.50 רו״כ  ביתר הארצות 20 פראנק. באמעריקא 5 דאללאר.  א
021-HZF-1880-08-17-001-070241_toc_2,, נכ מחירו באשכנז: א 14 רייכם מארק לשנה. א בעסטרייך 8 פל׳ לשנה. וכן לרבע שנה. שכר מודעות:  מכל שורה קצרה 5 קאפ׳.  ומשורה רחבה 10 קאפ'.  אסרסרס
021-HZF-1880-08-17-001-070241_toc_3,",מכתב עתי משמיע חדשות בקרב עם-ישדון , מכ..."," כל- כתב עתי משמיע חדשות :32 מספר אללא . ה ולר  .  המדינות בנו - עם יש מב, הדברים, עם  1  דרי  ר דבו חכמה ומדע, ידיעות העולם והטבע. יוצא לאור אחת בשבוע, מאת חיים זעליג סלאנימסקי. ב"
021-HZF-1880-08-17-001-070241_toc_4,, No. 25-a. מן 1 יולי העבר נעתק מקום הרעדאקציא של הצפירה לרחוב דזיקא
021-HZF-1880-08-17-001-070241_toc_5,תוכן הענינים.," תוכן הענינים. דברי הימים. ראמאנאווע. קאטעלגיע. ידיעות העולם והטבע. מערכת בעלי החיים מאת משה בן זלמן פעלדשטיין. גולי ספרד ופורטוגאל מאת קלמן שולמאן חדשות שונות זיטאמיר, הודעות. שאלות ותשובות."
