article_id,headline,text
021-HZF-1883-07-10-001-10189_toc_9, שגיאות מי יבין,"  שגיאות מי יבין המכה""ע Jew. Chron. הודיע זה מקרוב כי הח׳ הצרפתי רענאן דרש במושב Societe des tudes Juives דרשה אשר כחש ביחוס מקור ישראל וישימנו לבני התערובות מעמים שונים, ובני החברה הנכבדה הנ״ל שמעו שמחו וימחאו כף, וע״ז הוכיח אותם בדברים קשים, אנחנו סמכנו אז על המו״ל הנ״ל. והעתקנו את דבריו בהצופה 23 וגם עוד הוספנו דברים נמרצים נגד החברה הנ״ל, והנה עתה באה לידינו החוברת Rerue היו״ל ע""י החברה הנ""ל, וראינו כי הבזוז קראניקל הסך הדברים מן הקצה אל הקצה רענאן לא דרש דרשתו במושב החברה, רק באסיפה אחרת שאינה של יהודים והחברה הנ״ל אדרבה בקרה את דבריו בקורת נמרצה, אנחנו לא נוכל לשים דופי בהדזוז קראניקל שלא הבין מה שקרא במ״ע הצרפתים, אבל שגיאה היא ששגה בזה, וכעת קרה גם לנו עם הדזוז קראניקל, בהצופה 23 ספרנו בשמו את האסון אשר קרה לעדת ישראל במאטטערסדארף באונגארן אשר בהכנ""ס ובהמ״ד נהרסו בית המחסה לזקנים נחרב, ובחורי הישיבה הראו גבורה להציל ס״ת וכו׳, ולא השגחנו שם על המלה 1nundation הכתובה בראש המאמר (ר״ל שטף מים רבים), וע״כ נתחלפה אצלנו תוכן הידיעה הזאת, אבל ע""ז לגלג עלנו בעל המגיד כאלו לא הבננו מה שקראנו! ומה טעם יש בהחולים כאלה? כן נגע בנו בעל המגיד בלצון ע״ד העלמה עמא לאצארוס, שלפי דבריו השפלנו את כבודה והוא קנא את קנאתה, והלא כמונו כמוהו לא ידענו את האמעריקאנית ההיא, והזכרנוה רק בעבור פתגמה שהגידה בפומבי שדת משה ).Jew. Mess וישראל מאפס ותהו נחשבה ורק גזע הלאום הוא הכל וכל בו N. 17 1882) ובמה הצדיקה בעל המגיד בהתוליו לומר שקדמו פניה בלאנדאן למרות דברינו אודותה?!"
021-HZF-1883-07-10-001-10189_toc_10,,"  הודעה הנני מודיע לכל בעלי בריתי, כי העתקתי את הדפוס אשר לי ומסחר עזרת השי""ת. הספרים, אל בית-חומה החדש אשר בניתי בע ווארשא, ברחוב מוראנאוו 16  מדפיס בווארשא יצחק גא И. Гольныавъ Варшава, Мурановская № 16. J. Goldman Warszawa Muranowska No. 16."
021-HZF-1883-07-10-001-10189_toc_11,," הודעה ע״ד האחרונים קאמיסיאן מכל החפץ להשיג ע״י אתרונים מכל הסארטין נכונים אנחנו לקו קארזיקאנער, אתרוני א""י עם פיטמות ובלא קאראפירער, גענווער, מן שפת פיטמות. וגם לולבים והדסים ירוקים ולחים, כפי מחירם בטרייעסט וו הודענו בשנים הקודמות, וגם אשתקד אשר מחיר קאמיסיאן מעוטה. וכפי אשר ה האתרונים הי' ביוקר, לא העלינו במחיר הקאמיסיאן, והננו נכונים לשלוח סחורה טובה לכל דורש גם ע״י נאכנאהמע בשלחו אלינו אויפנאבע, וביד כל אדם להריץ אל כל מקום אשר יחפוץ, וכפי האדרעסין דלמטה, ונקוה להפיק רצון אלינו ( יורשים לעשות מסחר עמנו. מכל הד האחים אהרן ואברהם בירגער במינסק Aрову Виргеру въ г. г. Минскъ אדרעס למינסק Abram Burger in Triest Oestrich. אדרעסע לטרייעסט"
021-HZF-1883-07-10-001-10189_toc_12,," אתכבד בזה להודיע שכל יודעי ומכירי איך שהפאברי- שלי מפאפיראסין ביכליך אשר עד כה זה כעשר שנים היתה הפירמע א׳ זאטערמאן עט מ׳ קוראטאוו. ועתה מן דען 1 מאיי הרחקתי את שותפו מאתי ונשארתי ת״ל בעצמי בהפאבריק הנ״ל, באותו מקום אשר היה מקדם ברחוב נאלעווקי תחת נומר 25 בחצר הגביר טאקאר, ואבקש מאת הקונים הקרובים והרחוקים לפנות אלי באשר יצטרכו ואקוה שישבעו רצון ממני, ובעוד חדש ימים אקוה שיהיה לי מארטין חדשים ממש כמו ווינער נאטאראל .A. Zaterman, Warschau,Nalewki No. 25 אדרעסע"
021-HZF-1883-07-10-001-10189_toc_13,," כנודע לכל יודעי ומכירי מאז אשר אנכי הייתי המוציא והמביא והעיקר לתכלית הפאבריק שלי מפאפיראססין ביכליך, אשר היה לי יחד עד כה עם א׳ זאטערמאן ברחוב נאלעווקי. וכעת הנני להודיע כי למען הפיק רצון הקונים אשר לא היה לרצונם לרדת במקום מדרון הייתי מוכרח לעזבו, וכעת הפאבריק שלי בדירות מרווחים ברחוב נאלעווקי בחצר הגביר ר׳ לייזר ווייס 12, ותקותי חזקה כי בזה אמלא רצונם, ע״כ אבקש מאת כבוד הקונים הקרובים והרחוקים לפנות אלי בעת אשר יצטרכו, ובעזר ה׳ אמלא כל מבקשתם בסחורה טובה כמו ווינער ממש, ובשאר M. Krow Warschau, alewki № 12 אדרעססע שלי פרטים ."
021-HZF-1883-07-10-001-10189_toc_14,," בגליון הנוכחי נגמר רבע השני להצפירה לשנה זאת, ע״כ באתי לעורר מכירי ומיודעי אשר רכשתי ח״י על הצפירה שייטיבו לחדש ח״י גם להרבע השלישי ואנכי על משמרתי אעמודה, לשלוח להם העלים במועדו גם מכ״ע המגיד והעברי אנכי וספרי השכלה חדשים וישנים „הנודעים"" יש להשיג מידי וגם סיפורים ישרים ונעימים בשפת ושארגאני והכל אשלח לכל דורש בזריזות בלי איחור ווארשא תמוז תרמ״ג נחמי׳ צבי טשארנאוויץ анъ Ларновичъ въ Варшавъ зикая улинa N. 8. אדרעסע אלי"
021-HZF-1883-07-10-001-10189_toc_15,," הנני להשיב לשואלי דבר ע״י פאסט במהר האפשרי בכל ספראווקעס הדרושים לו, הן בסענאט, והן בכל מקומות המשפט דפ״ב, ושכרי מכל ספראווקא ממכירי אשר ידעו אמונתי, ותום דרכי, הנני לקבל עלי לעמוד לימין, ק שני רו""כ. צדקם בכל מקומות המשפט פה, ולהביא לידי גוביינא תביעתם מחברות מסילת הבר פה, עבור המחיר אשר נשווה בינינו לפי איכות וכמות הענין, ובעז״ה אפיק בטח חפץ Сaмуалу Мееровичу инибергу въ Петербургъ. ורצון כל איש אדרעססא голъ Вознесенскiя и Ккатернигооский, омъ ихачева N№ б. къ. № 36."
021-HZF-1883-07-10-001-10189_toc_16,," זה כששה ירחים עזבני בעלי יצחק משה פידעלזייד מווארשא, אותותיו: גבה הקומה, שנותיו כבן עשרים, שערות ראשו גבות עיניו וזקנו אשר התחיל לצמוח, שחורות, עיניו מעט כהות (קורצזיכטיג). אנא אחב״י רב״ד חוסו נא עלי ועל בתי לאה תחי׳, לדבר על לבו בא קום שהוא שישוב לביתו ויסלח לו, גם ישיבו לו כל ההוצאות אשר הוציא בנסיעתו נאום האשה נעמי פירעלזייד בת ר׳ ראובן יוסף קאהן מווישענראד (פלאצקער ובערניע) אדרעססע כשמי"
021-HZF-1883-07-10-001-10189_toc_17,," הודעה אזכיר מסחר האתרונים ליודעי ומכירי מכבר, ולכל החפצים לבוא עמי בבריו המסחר מחדש לקנות בעדם כל מיני אתרונים ארץ ישראל, קאראפירער אניווער, ומא- ראקער, וכן לולבים והדסים בעד שכר קאמיסיאן קצוב, וכל החפץ כי יפנה אלי  כפי האדרעססע דלמטה נפתלי משכילאיתן Паттоло Маскиленсону въ губ. г. Минскъ."
021-HZF-1883-07-10-001-10189_toc_18,," אשר כוננתי פאבריק מבורית כמו הבורית שלעך ויוכל להשיג הנקרא בפי ההמון קריסט משה גאטראט במקח הזול. No 33 ווארשא, גענשע"
021-HZF-1883-07-10-001-10189_toc_19,," עכטע זיידענע שווייצער מ  מיללער- גאזע איר מיללער, אויך בוימוון עם אונד וואללענעס גלאססע, האנדשוה, פוטטער פיר האנדשוה פאבריקאנטען, עמפפעהלט A. S. Wachholder Warshau Nalewki 9"
021-HZF-1883-07-10-001-10189_toc_20,,"  תחבולה לעשות חיל יש לנו למכור תמצית חומץ 80%, (עססיג עססענץ) אשר מוכשר ל ת חומץ טוב 3 חלקים מים. נגד של כאשר יערב עם של 70 קאפעיקעם (בפאסט מארקין) ישיג כל מבקש פראבע Люблинеръ и Конъ Влоцлавекъ, Варш. губ."
021-HZF-1883-07-10-001-10189_toc_21,," פראנקפורטער עססיג-עסענץ אין הארט אונד אין פלאשען, בעקאממען בייא מ׳ וויסקאטש, ווארש פראנצישקאנער 10 №, אים הויזע קאפטאלס"
021-HZF-1883-07-10-001-10189_toc_22,," שאלות ותשובות לה׳ ח""ת בצפת הג׳ רו""כ נפקדו יען ( חתם המכתב על ד' כנפות לאברהם גאליאנט בשגיאת המשלח נעשתה. לה׳ קארט בברי' לא לנו לקבל תשובות על המדובר בהמליץ, לה שלמה שיף כבר נשלח לו שנית."
021-HZF-1883-07-10-001-10189_toc_23,, אדרעססא שלנו редактору газ. ГАПEопр З. Слонинскону Варшава. S. Sionimski WWarszawie. Dzika No. 259.
