article_id,headline,text
021-HZF-1883-04-17-001-10099_toc_1,," A ברוסיא ופולין.  פשולח במוקדם לשנה 5 רו״כ. אל לחצי שנה 2.75 רו״כ.  לרבע שנה 1.50 רו""כ   ביתר הארצות 20 פראנק. באמעריקא 5 דאללאר. M"
021-HZF-1883-04-17-001-10099_toc_2,, K מחירו באשכנז: 14 רייכם מארק לשנה. בעסטרייך 8 פל׳ לשנה. וכן לרבע שנה. שכר מודעות: מכל שורה קצרה 5 קאפ׳.  ומשורם רחבה 10 קאפ׳. ל A
021-HZF-1883-04-17-001-10099_toc_3,"מכתב עתי משמיע חדשות ייצא לאור אחת בשמע,..."," מכתב עתי משמיע חדשות יוצא לאור אחת בשבוע, מאת חיים זעליג סלאנימסקי."
021-HZF-1883-04-17-001-10099_toc_4,י דכרי הימימ .סלאנים '.זוועתית .וועדתנאצ...," תוכן הענינים דברי הימים. סלאנים. זוועהיל. ווערהנאצקע בענדער, אנאניוב. קיידאגאוו. רידנא. סוראז. הצופה לבית ישראל ידיעות העולם והטבע. כח החוזר בעולם. מאת המו״ל קרית ספר הודעות. שאלות ותשובות."
