article_id,headline,text
021-HZF-1882-09-12-001-09271_toc_7,,"  יצא לאור ס׳ שנאת עולם לעם ע גם מאת נחום סאקאלאוו מחיר הספר הזה לאחדים עם דמי המשלוח 1 רו״כ. כל. החפץ בו יפנה במכתבו אל המחבר לפי האדרעססע: М. Соколову, въ Варшаву Лзикая № 25. N. Sokolow, Warschau, Dzika No 25."
021-HZF-1882-09-12-001-09271_toc_8,," אל סוחרי אתרוגים לבעלי בריתנו במסחר אתרונים ולולבים. הננו מודיעים כי שולח במלאכותנו בשנה ההיא ישר לטריעסט ציר אמונים, בקי בטיב הסחורה, כל פרי למינהו, ונבון דבר האברך המופלג מו״ה נפתלי הירץ פינעס, לדעת ולתור שמה בעדנו פרי עץ הדר באמת, וכפות תמרים כולם יפה ומום אין בם, כל איש אשר יאבה לעשות עמנו חוזה במסחר אגולניע ולאחדים, יפנה אלינו פה ביאליסטאק וישבע רצון, כאשר ישיג רק סחורה ראיעלע לא מזויפת; ביאליסטאק ר""ח מנ״א שנת ואיש יביא בפריי לפ""ק. יצחק יאנאווסקי — אליעזר ברוך דארמאן"
021-HZF-1882-09-12-001-09271_toc_9,," הנני מודיע לכל בעלי משאי ומתני מכבר. ולכל החפץ לכנום עמי במסחר האחרונים מחדש, כי הנני נוסע לטריעסט גם בשנה זו לקנות אתרונים קארפירער כשרים מובחרים ומהודרים עד מאד. גם לולבים והדסים ירוקים יפים ומהודרים, הכל יש אצלי למכור במקח הזול, הן תיבות שלמות, הן לאחדים. בית החנות שלי מהאחרונים וקע בחצר גלאס N. 17 בבית מסחר היין של ר׳ איטשע מרגליות הוא ברחוב נאלעו אשר בחצר הנ״ל. ואני סמוך לבי ובטוח, כי כל יודעי שמי אלי יפנו לקנות בידעם כי יש על מי לבטוח, ואקוה כי לא יבושו מסברם. שמעון לעווי מווארשא. Пинонъ Левя въ Варшавъ анкая N. 29 אדרעססע שלי או על האדרעססע של ה׳ מרגליות הנ״ל."
021-HZF-1882-09-12-001-09271_toc_10,," הנני מודיע כי שלחתי לטריעסט את שותפי מו״ה מרדכי הירש אפטע מקראקא הדר כעת בווארשא אחרי אתרוגים כשרים מובחרים ומהודרים גם לולבים ירוקים יפים ומהודרים ויהיו נמכרים במקח הזול תיבות שלמות והן לאחדים. ברחוב נאלעווקי בחצר שטערין No. 19 בבית החנות של טלתים מר׳ משה זילבערפריוו, אקוה כי הקונים אצלינו ישמחו בחלקם בידעם כי צור אמונים הוא בקי בטוב הסחורה, ויש על יצחק טעמקין מווארשא מי לבטוח. Temkin Dzika.17. אדרעססע שלי"
021-HZF-1882-09-12-001-09271_toc_11,," כמו בכל שנה ושנה נסעתי גם בשנה זו לטריעסט לקנות אתרונים. והגם שהבטחתי להקונים שישיגו אצלי בשנה זו גם אתרונים מאה״ק, רק מחמת ששנה זו היא שנת השמיטה לדעת הגאונים, ולמנהג א״י, ואין מוציאין פירות שביעית מא״י לחו״ל אי לזאת לא עשיתי שום מסחר עם אתרוני אה״ק, אבל זאת אבטיח להם שישיגו אצלי אתרוגים מפראגא טובים ומהודרים גם לולבין מיגענווע ירוקים ויפים. גם הרסים מטריעסט מובחרים תלת על תלת, והקונים יפיקו רצון מהסחורה שלי גם הקונים תיבות שלימות ישיבהיאנאט הגון כנהוג, מקום מסחרי בשנה זו יהי' ברחוב נאלעווקי בחצר הג׳ ר׳ יודל .No בבית מסחר היין של הג׳ ר׳ יוסף בוכווייץ לפנים מאליניאק. No. 6 מקום דירתי לפני שער הברזל בחצר הג׳ מארקוס לעווי פישל לעווקאוויטש"
021-HZF-1882-09-12-001-09271_toc_12,," אזכיר מסחר האתרונים ליודעי, ומכירי אנשי בריתי מקדם ואקרא לכל החפצים לבוא עמי בברית מחדש לקנות בעדם בשכר קאמיסיאן קצוב כל מיני אתרונים קארפירער יוניווער מאראקער וארץ ישראל, וכן לולבים והדסים, כי בא מועד אסיפת הקאמיסיות ועל משמרתי אעמודה למלאות בעז״ה רצון איש ואיש כנודע מסחרי זה בשער בת רבים נפתלי משכיל לאיתן זה שנים רבות, והחפץ בי יפנה אלי כפי האדעססע דלמטה Паттало Маскиленсоцу Въ губ. г. Минскъ."
021-HZF-1882-09-12-001-09271_toc_13,," ראו זה חדש הוא! ונמצאו אתי למכירה „מטפחות בד״ ועליהן „מפת ארץ ישראל״ כתובה הדר בכתב עברי וגלוו לה „תבנית ירושלים עיר הקודש״ עם תבנית מקדש שלמה"" הכל נעשה יפה. המטפחות נמכרות שתים עשרה (1 דוצענד) איר 3.20 רו״כ עם דמי הפאסט, ושש מטפחות במחיר 1.75 רו״כ, והקונים למסחר לפחות עשרה דוצענד בפעם אחת, אקצוב המחיר ע״פ מכתבים אם ישימו במכתבותם פאסט מארקע לתשובה. פחות מן חצי דוצענד לא אשלח כלל אליעזר יצחק שפירא בווארשא .И. Шапиръ, Варшава, Па № 7 . האדרעססע"
021-HZF-1882-09-12-001-09271_toc_14,,"  הודעה ציריך, איזראעל. קנאבען⸗אינסטיטוט גימנאזיום, טעכניקום האנדעלס - אונד מוזיק⸗שולע, מאטוריטעטס פריפונג פֿיר אוניפערזיטעט פאליטעכניקום, דיא אנשטאלט ליענט אם זעע, אם פֿוסע דער אלפען, פרייז יאהרליך 1,500 פראנקס. געהערעס ד׳ פראספעקטע. רעקטאר לאנדאוי, ראבב. פרעד׳, דער אידישען געמיינדע"
021-HZF-1882-09-12-001-09271_toc_15,," נכונים אנחנו לקבל קאמיסיאן מכל החפץ להשיג ע״י אתרונים מכל הסארטין, וגם לולבים והדסים ירוקים כפי מחירם בטרייעסט בתוספת קאמיסיאן 124 קאפ׳ מכל אתרוג 10 מכל לולב, 50 מכל פעקיל הדסים והננו נכונים לשלוח סחורה טובה לכל דורש גם ע״י נאכנאהמע בשלחו אלינו אויפנאבע 50 קאפ׳ לכל אתרוג 25 לכל לולב, 1 רו״כ לכל פעקיל הרסים. ונקוה להפיק רצון לכל הדורשים לעשות מסחר עמנו. האחים אהרן ואברהם בירגער בעיר מינסק אדרעססע Арону Виргеру, въ г. г. Минскъ Aron Burger, in Gouw. Minsk (Russland"
021-HZF-1882-09-12-001-09271_toc_16,," החפץ ללמד את בניו תנ״ך עם באור יפה ודקדוק, ולבאר כל דבר הקשה בתנ״ך ע״פ הפשט, יפנה אלי, יהושע טוביה טארלאווסקי, מורה ברשיון הממשלה מגראדנא, כעת בבית ר׳ אליעזר יעוונין בווארשא, נאלעווקי-"
021-HZF-1882-09-12-001-09271_toc_17,," החפץ בלמוד הלשונות רוסיש אשכנזית צרפות, אנגלית ואיטאליאנית, יוכל לפנות ביאליסטאק י""ט סיון. אלי. יוסף בהרח״ז סלאנימסקי."
021-HZF-1882-09-12-001-09271_toc_18,," איך בעעהרע מיך היערמיט אנצוצייגען, דאס איך אם 1 טען יוני ד״י איינע פאבריק פאן לעדערווארען אלס, פארטעפעהלס פארטמאנע, רייזע אונד דאמען טאשען, פלעידרעמען, פארטציגארען אונד זא ווייטער אם היעזינין פלאטצע ערעפינט האבע. ל. לאנגפיר אין ווארשא No. 9 נאוואליפקי"
021-HZF-1882-09-12-001-09271_toc_19,," שאלות ותשובות לה׳ מאיר ליוועראנט בשעדלין, לא נוכל לקבל דין ודברים נגד מו״ל זולתנו, ויפנה עוד הפעם אליו והיא תשובה גם לה׳ אהרן שלמה בקישינוב, לה׳ לאנדא הנומערין הראשונים אין בידינו, לה׳ הורוויץ בבר' לא לנו לבקש עבורו, והננו מברכים ברכת השנים עם כל קוראינו ה׳ יחדש עלינו את השנה הזאת לטובה ולברכה, אמן."
021-HZF-1882-09-12-001-09271_toc_20,, אדרעססא שלנו З. Сонинскому Варшава. S. Sionimski in Warschau. Dzika No. 25a.
