article_id,headline,text
021-HZF-1882-12-26-001-09385_toc_7,חזיונות התוכנים במראה הקאמעט האחרון מחודש העבר," פני האדמה ובני אדם יולדו אשר העמיקו להתבונן ולחקור אחר מעשה אלהים בארץ, למדו חכמת בנין העולם ונתגלה להם סודות היצירה, אז מצאו גם תעלומות סתרי הקאמעטען, כי הם כוכבים שמומיים ככל צבא השמים, רק ממין מיוחד (בעלי שבט) הטובבים ומקופים את השמש במסלולים ארוכים למאד, אשר בהיותם בגבהי מסלוליהם הם נסתרים מאתנו, ובירידתם בשפל מסלוליהם להתקרב אל השמש הם נראים לעינינו בתבניתם, עד כי לא יפלא עוד בעיני התוכנים כיום לדעת ולמצוא בחשבון על כל קאמעט הנראה פעם אחת מתי ישוב שנית להתראות אלינו, כמו שבארנו כ״ז בספרנו „כוכבא דשביט"" (ווילנא תקצ״ה ומהדורא תנינא, ווארשא תרי״ז) אבל עם כל הגדולות האלה אשר השיגה ידי התוכנים בימים האחרונים להגיד מראש כל מקרה וחזיון, אשר יבוא בתהלוכות צבא השמים וכסיליהם. הנה מהות עצם הקאמעטען ותכונת טבעם, הם כחידה סתומה ונפלאה בעיניו אשר לא ידע שחרה! התוכן העומד על מגדל המצפה עם כלי מחזיו הגדולים  הבו עים חלוני הרקיע, להביט בשמי השמים העליונים, ומתפאר לומר „נהירין לו שבילי דרקיע כשבילי דמתא״. לבר מכוכבא דשביט הוא מודה בפה מלא „לא ידענא מאי ניהו״! — כי גוף הקאמעט ושבטו הוא ממין חומר גשמי זר ומפליא אשר אין דוגמתו בעולם החמרי כללי, והוא נבדל ויוצא מגבולות הטבע אשר לכל הגופים השמיימים והארציים בשמים ממעל ובארץ מתחת, כפי הנודע יש לאל ידי התוכנים להוציא ע״פ חשבון המהלכים לכוכבי הלכת. כמה הוא כובד החומר של כל אחד מהכוכבים הארציים ההם בערך כובד חומר השמש, בהיותו מתחייב מצד מתינות ומהירות תנועתם ע״י כח המושך השולט ביניהם, להשבית ולהפריע בסדר מהלכם לפי ערך התקרבם והתרחקם זה מזה, כמו שבארנו כ״ז בספרנו „תולדות השמיו (ווארשא תקצ״ח ותרכ״ה יעויי״ש), וע״י פלס החשבון הזה בסדר  מהלך הקאמעטען ותנועותיהם, מצאו וראו שהם גופים למאד אשר אין להם שעור וערך כלל בערך כובד האויר שלנו על הארץ! ועם גודל דקותם וקלותם הם יכולים להתרח ולהתפשט לחלקים מבהיקים עד כדי מלוא רוחב כמה מיליאנען פרסאות! - גוף הקאמעט בעצמו הוא כדור עגולי קטן מאד בערכו, פונה במהלכו במרוצה נפלאה למול השמש, ומאחוריו נמשך ומתארך שבט נורא עד אלפי אלפים פרסאות! ע״י כלי המחזים אנו רואים את השבט כמו חלקים דקים נזרקים ונדחים ממנו בכח נפלא ע״י השמש למרחק רב מאד מאחוריו, ובכל זאת כולם נמשכים והולכים עם הקאמעט במרוצתו הגדולה הקאמעט שהיה בשנה העברה, לפי כובד חמרו שמצאו ע״פ חשבון תנועת מהלכו, היה קל מאד במשקלו, עד שבאם נדמה שחומר גופו יהיה רק כמו מים שלנו, היה גדלו רק כמו כדור אחד אשר מדת עביו הוא רק 400 מעטער, ובכל זאת הוציא מקרבו שבט אשר חלקיו מלאו שטח 88 מילליאן וויערסט שלנו, הקאמעט שהיה בשנת 1861 היה משקל כבדו רק 1160 צענט- נער, והוציא שבט אשר החזיק שטח מן 68 מילליאן ק״מ וויערסט)! זאת היא החדה הסתומה אשר נעלמה מעיני התוכנים ונבוכו בה עד היום! קצרה בינת אנוש לצייר בדמיונו גוף גשמי מן חלקים קלים וקטנים כנקודות בלימה הרחוקים זמ״ז מרחק גדול מאד. וכולם מתאחדים במקום מוגבל וכח אחד לשוטט במרוצה גדולה במרחבי העולם כמו גוף אחד שלם! בכל פעם כאשר יקרה להתראות אלינו קאמעט, יתאזרו עוז התוכנים לדקדק בבחינותיהם עליו, למדוד כמות גדלו, חוזק אורו וסגולת חלקיו ביסודי הכעמיא (כפי הנודע ע״י השפעקטראסקאפ), ובכל פעם ימצאו סברות והשערות שונות על מהות חמרו התראות הקאמעטען אינם רחוקים כ״כ, כי כמעט בכל שנה יתראה אחד או יותר מהם, רק כי רובם קטנים אין להכירם בלעדי כלי מחזה, בשנה העברה נדדו האורחים האלה ויבואו אלינו זה אחר זה שבעה במספר, ורק אחד מהם שנראה בחודש יוני היה גדול ונכבד בשבטו הארוך, ובשנה זו ראינו ג״כ שלשה, אשר זה האחרון היה גדול מאד עד שבארצות איטאליא, שפאניען, ואלגיער, ראוהו בעצם היום קרוב מאד אל השמש, מקרה רחוק מאד בספרי הזכרונות להקאמעטען מזמן ב' אלפים שנה ויותר אפס כי מפני ימים המעוננים שהיו ברוב ארצות אייראפא, לא חזיונות התוכנים במראה הקאמעט האחרון מחודש העבר אין לך מראה גדול ונפלא בעולם הטבע אשר יעורר בקרב האדם תמהון לב ומורא שמים, מפני הדר גאון העולם וגבורות מעשה בראשית, כמו מראה הקאמעט הנראה לפעמים רחוקי⸗ ברקיע השמים, כל איש אשר ראו עיניו אחד מהקאמעטען הגדולים שהיו בימיו, כמו הקאמעט הגדול בשנת 1857, גם אם הוא איש אשר מעודו לא נשא למרום עיניו להביט אל צבא השמים ולראות מי ברא אלה, הנה בראותו פתאום כוכב חדש עם שבט ארוך נורא מאד, עומד בכפת השמים להחריד תבל ומלואה, ישתומם ויקרא מה הוא? מאין בא? ומה חפץ ה׳ בו כי שלחו הנה על פני תבל? וגם אחרי אשר יעמוד על מדו ימים ושבועות והורגל לראותו, ואך מעט מעט יקטן אורו וישוב לעלות בגבהי מרומים אשר יצא משם ועין איש לא תשורנו עוד גם אז ישאר זכרונו בקרב לב עמוק, ועוד כל ימי חלדו יזכור את המראה הגדול אשר ראו עיניו, מבלי דעת פתרון החזיון הנפלא הזה, — בימים הקדמונים היה מראה הקאמעטען בעיני יושבי הארץ כמו יד ה׳ שלוחה ממעון קדשו לשפוט את בני האדם בשבט אפו, וע״כ חזו עתידות למו, כי נכונים לבוא מקרים ופגעים רעים בעולם, אפס מאז החלה החכמה לרוב ע יכלו התוכנים כולם לראותו, ורק התוכן מאללעט בפאריז אשר לא יכול להתאפק מבלי לראותו. התנשא על כדור הבאללאן עם מרעהו פאנוויעללא, ועלו ויעופו מעל ענני שחק, ויראוהו  בעצם השמים עומד קרוב אל השמשובדי ""3 מעלות והתוכנים מאללאן ואור ב והם על ההר גראס אצל ניצצי, ראוהו בחצות היום עומד אצל השמש עם שבטו הארוך, ואך באחרונה כאשר עבר פני השמש והתחיל לשוב במסלולו, אז נראה אצלנו בבקר בפאת מזרח קודם עלות השחר. אבל אור שבטו כבר נחלש אז, אחרי כן ראה התוכן שמידט באתונא עוד קאמעט קטן אחד קרוב אלי הרודף, ורץ, אחריו מסלולו אשר לפי ההשערה הוא חלק נבדל ונפרד מגופו. וכאבר המדולדל נמשך אחריו וכמקרה הזה כבר קרה לקאמעט אחד בימינו, הוא הקאמעט. ביעלא, (עיין ספרנו כוכבא דשביט  הנ""ל) והנה הצגנו פה ציור מושג מן מראה תמונת הקאמעט הנ״ל  כפי שנראה אצלינו בווארשא בסוף חודש אקטאבער. בבוקר קודם עלות השמש בפאת מזרח להאיש המביט עליו מגדות הנהר ווייכסעל הפונה לצד דרומית מזרחית."
021-HZF-1882-12-26-001-09385_toc_9,חדשות שונות," חדשות שונות (אחריות הפאסט) כפי הנודע כל השולח מעותיו ע״י הפאסט בתוך אגרת הפאסט מקבלת אחריותו עליה, שבאם יאבדו בדרך, עליה להשיב סך ההוא לידי המשלח, והשולח מכתב סתם „רעקאמאנדירט״, ר״ל באין מעות, רק שיגיע בטח להמקבל, או אם נאבד בדרך אין להפאסט לשלם רק 10 רו״כ מכל מכתב כזה באין הבדל, ולמען דעת כמה מכתבים בעלי אחריות כאלה הולכים ונאבדים על הפאסט בכל שנה, הנה יצא זה מקרוב חשבון ע״ז מהדעפארטאמענט של הפאסט בפעטערבורג. בשנת 1878 שלמה הפאסט סך 74,707 רו״כ. בעד אחריות המכתבים. בשנת 1879 סך 136,327 רו""כ. בשנת 1880 סך 74,942 בשנת 1881 סך 75,000 רו״כ, ומכל המכתבים האלה כמעט רובם דרובם היו רק רעקאמאנדירטע סתם, אשר התחייבה לשלם רק 10 רו״כ בעד כל מכתב לא יותר (המרבים שלום בעולם) המכה״ע היוצא בשווייץ הביא בחשבון הסטאטיסטיקא מן ההוצאות הרבות ותועפות כסף אשר יעלה בכל הארצות והמדינות להחזיק השלום בעולם, ע״י צבאות מלחמה העומדים להגן מכל צר ואויב, והראה בחשבון נכון כי לעת הזאת, נמצאים אנשי חיל העומדים חלוצים בכל הארצות והמדינות, כדי מספר ששה מילליאן נפש אדם, מלבד אנשי החיל זולתם הנפטרים לבתיהם (רעזערווע) בשעת שלום ההוצאה לכלכל את כל החיל הזה בשעת שלום, עולה בכל שנה לכדי 37 מיליארדען פראנק. ואולם בשעת מלחמה כאשר גם הנפטרים לבתיהם קרואים לרגלי המחנות, אז עולה מספר כל אנשי החיל החלוצים למלחמה בכל הארץ, לכדי 43 מילליאן נפש. (פעולת אור העלעקטרי על בעה״ח) בבית מלאכה אחד ליציקת הברזל אשר באשכנז, העומד על הלקת שדה בתוך יער גדול, בנו להם זה מקרוב מכונה גדולה להאיר באורות עלעקטריים ויהי בלילה כאשר המכונה הפיצה את אורה הגדול להאיר באור היום על פני היער מסביב, והנה רבים מן חיתו היער יצאו ממעונתם אשר ירבצון, וירוצו וישתובבו, לא ידעו מה הוא ומהם באו עד קרבת המקום ההוא ויעמדו משתאים, הצאן והבקר יצאו ממכלאותיהם וירקדו כאלים, גם בעלי הכנף נתעו לצאת מקניהם ויעופפו וישוטטו מסביב, עד כי רבים מהם נפגעו בחוטים העלעקטרים ויפלו וימותו (כלי מחזה גדול) מעיר פאריז מודיעים כי כעת יבנו שם כלי מחזה גדול כענק אשר כמוהו לא היה עוד בארץ, היותר גדול בימינו לא הגיע ארכו יותר מן 13 אמות, ועתה יגדל ארכו עד 23 אמות, כי רוחב הזכוכית (אביעקטיף) שלו יהיה 87 סענ- טימעטער (עיין ספרי תולדות השמים). להחכם מו״ה זלמן אקסילראד נ״י מאמרך „טעם זקנים"" הגיענו לנכון, ולא אכחד מהגיד לך האמת כי דבריך לא יתכנו, ואיך תבקש לשנות הגירסא במשנה ולפרש דברי הגמ' באופן אחר שלא כפי׳ רש״י ונירפתו הנכונה בגמ׳, רק בשביל תיקון הלשון שמצינו למשנה זו במקום אחר, והלא כבר מצינו משניות הרבה שבאו בגמ' בנוסחא אחרת מכפי שהן שנויין במשניות שלנו, ויש אשר בשינוי נוסחאות ההן נמצא עוד נפקותא רבא לדינא, לדוגמא במס' כלים (פ׳ י""ו משנה ז'), זה הכלל א""ר יוסי כל משמשי משמשיו של אדם בשעת מלאכה ושלא בשעת מלאכה טמא, וכל שאינו אלא בשעת מלאכה טהור. ובמשנה זו בש""ס איתא בשעת המלאכה טהור ושלא בשעת המלאכה טמא, וכן בטהרות (פ""ד משנה ט) היתה ככר בידו וכו׳ ספיקו טמא, ובמשנה זו בש""ס איתא ספיקו מהור, — וכמוהן הרבה שהעיר כבר עליהן הגאון מהר""י ברלין במקומן, ואין  ספק אצלי, כי שנוי נשחאות ההן הגיעו לנו בראשונה ממדפיסי הש""ס אשר תמיד זכות הרבים אצלנו תלוי בהם כנודע. המו״ל"
021-HZF-1882-12-26-001-09385_toc_10,,"  הודעה כעת יודפס בדפוס ספר שפתי כהן על התורה, מהרב החסיד המקובל מגורי האר״י מו״ה מרדכל הכהן זצוק״ל, מצפת, ואור תורתו האיר בארם צובה יע״א. פשטים נחמדים ונעימים וסודות ליודעי דעת דרך האמת, ונימטריאות מחודשות פרפראות לחכמה, נדפס ראשונה בשנת ש״ע לפ״ק, ושנית בשנת ת״ן לפ״ק, וכעת הוא יקר המציאות. ונדפס כעת בכל יופי והדור בהשגחה מעולה, ויחולק ע״פ פרענומעראנטין ע״י איש נכבד בר אוריין, והכל מסייעון לדבר מצוה. וגם נדפס כעת בדפוסי ספר שירי תפארת בשש חוברות, להרב המליץ הנשגב, המבאר הנעלה, כבוד מוהר״ר נפתלי הירץ ווייזיל ז״ל, המפורסם בשיריו שירי קודש, המלאים יראת ה׳, וספור מעשי ה׳ ונפלאותיו ביציאת מצרים, ומתן תורה, והמפורסם אינו צריך ראיה יצחק גאלדמאן מדפיס בווארשא"
021-HZF-1882-12-26-001-09385_toc_11,," ס' שנאת עולם לעם עולם מחירו 1 רו""כ ס׳ מצוקי ארץ (ווארשא תרל״ח), מחירו 40 קאפ׳. תורת שפת אנגלית קלה וטובה למתחילים בלי עזרת מורה (ווארשא תרמ״ג), מחירה 50 קאפ׳. ס׳ צדיק ובע שגב, ספור חדש (יצא לאור בימים האלה) יסודתו בקורות חיי הה״ג בעל התוי״ט ז״ל. מחירו 30 קאפ׳ החפץ בארבעה ספרים אלה יחד ישלם רק שני רו״כ, ויפנה במכתבו על פי האדרעסע. נחום סאקאלאוו, ווארשא, דזיקא No. 25, או אל מו״ס הנודעים"
021-HZF-1882-12-26-001-09385_toc_12,," הטר מגזע ישי או „דוד אל ראי"" ספור נכבד בשני חלקים מאת השר ביעקענספיעלד ונעתק לשפת עבר צחה ע״י אברהם אבא ראקאווסקי, יצא בימים האלה על ידי לאור לאור. מחירו בשנו חלקים עם דמי הפאסט 1.25 רו״כ ולדורשיו בעתו אחישנו לוקחי „הבקר אור"" לפנים אשר אפס קצה הספור הנכבד קראו באיזה חוברות הב״א, ישיגו על ידי את יתר העלים עד תמם במחיר 75 קאפ׳. והיה הספור שלם ווארשא בחדש טבת תרמ״ג בידם. האדרעססע אלי. אליעזר יצחק שפירא Л. И. Паниръ, Палевкя № 7."
021-HZF-1882-12-26-001-09385_toc_13,," ריל כשר, תמצית חומץ, כשר וגם על פסח אם ינתן בתשעה ושלשים ליטער מים ליטער אחד מתמצית חומץ הזה, יצא ממנו ארבעים ליטער חומץ טוב טעם למאכל. וימכר בבאלאן מארבעים או ששים קילאגראס, במקח הזול, והחפץ לקנות מתמצית חומץ הזה יפנה אל האדרעססע, ויקבל תשובה ברורה בכל הפרטים . תמצית חומץ הזה או הממוזג ממנו יעמוד ימים רבים מבלי יתקלקל טעמו, וערובה נתונה בעד נקיותו, ועל השגחת הכשרות היא הרב ד״ר לעהמאנן. גם תמצית חומץ בלתי כשר נמצא בבית מסחר הנזכר. הוגא באנדי וחבריו במאינץ Hugo Bondy C Cie. in Mainz."
021-HZF-1882-12-26-001-09385_toc_14,," הודעת המדפיס כהיום נמצא בבית אוסם הספרים אשר לי כל מיני הספרים פערלאג שלי, לא נחסר אף מין אחד, וימכר למזכרי ספרים ע״פ מקח קצוב כפי רשימת הקאטאלאג, בנכיון פראצענט כנהוג וע״פ האנד-געלד ישולחו הספרים ע״פ נאכנאהמע. ומאנשים פרטיים המבקשים רק איזה ספרים לעצמם, אבקש שלא יכתבו אלי, ולא ישלחו מעט כסף, כי אשיב הכסף בחזרה, והטרחה יתירה על השבח לשלוח ספרים ע״י הפאסט -. ובפרט כי המקחים הקצובים בהקאטאלאג שלי, המה רק לקבלם בווארשא, או לשלחם ע״י הבאהן על הוצאות הקונה, ואם יצטרכו לאיזה ספרים משלי, יכתבו לה׳ א׳ י׳ שפירא, או לה׳ א׳ צוקקערמאן בווארשא, אשר כוננו מוסדות מכחרם לשלוח ע""י הפאסט). יצחק גאלדמאן מדפיס ופערלאג סקלאד. בווארשא. И. Гольдманъ-Варшава Мурановская No 24. J. Goldman—Warschau, Muranowska No 24."
021-HZF-1882-12-26-001-09385_toc_15,,"  הודעה אגענטור אונד קאמיססיאנסגעשעפט  מאריטץ מאיר אין טריעסט. ניממט אן אויפטרענע פאן אין אונד אויס- לאנד פיר איינקייפע אללער זארטען קאלא- ניאל אונד באקאלי וואארען, אעלע אונד פריכטע פרישע אונד טראקקענע, געווירצ אליען אונד דראגען מיט ביליגסט  צור צייט שטעהענדען פרייזען, אונד מאכע נאך אייניגער ווידערהאלונגען דער אויפטרענ מאנכע ערלייכ רונגען אין קרעדיט שטעל- לונגען. בעריכטע אונד נעטהיגע מוסטער ערדען נאך פערלאנגען געזענדעט. אויך איבערנעהמע אללע פערקויפע, קאמיססיאנען אונד ערזען אויפטרעגע, געגען רעעלע אד- טיקעל וויא געטריידע אונד נאך פערהאנד- לונג פארשוסס געגעבען. מיינע אדרעססע איזט: Moritz Mayer in Triest, Oesterreich."
021-HZF-1882-12-26-001-09385_toc_16,," פוטץ פאמאדע צום פוטצען אונד פאלי- רען פערשידענע מעטאללע, קופפער, מעסינג בראנזע, בלעך, אייזען א. ז. וו. איבערטריפט, אין גיטע אללע אנדערע זעהר געמעסינטע פרייזע . עמפהילעט, אפאטהעקער, מאטריאליען האנדלונג. A. Centnerszwer, Tlomackie No. 9."
021-HZF-1882-12-26-001-09385_toc_17,," אתכבד בזה להודיע כי יש תחת ידי סקלאד מתמצית חומץ (עססיג אסענס) מפאבריקען מובחרים מח״ל מן 80 עד 100 גראד, ויכולים לעשות מן א׳ קווארט 40 קווארט חומץ טוב בטעם וריח גם אתי התמצית הזה כשר לחג הפסח בהכשר הרבנים גדולים מח״ל אשר יכולים לסמוך עליהם בלי חשש פקפוק ומיחש כלל, והרוצה להשיג פרובע ישלח א׳ רו״כ על אדרעס שלי С. З. Кучинскiѣ. въ Влоцлавекъ губ. Варшавск"
021-HZF-1882-12-26-001-09385_toc_18,," זאדא וואססער פאבריק מיט באללא נס בילליג צו פערקויפען, טווארדע שטראססע  וואהנונג No. 25, דארט איזט אויך איין אויספערקויף פאן קרימסקי שמוישען בילליג."
021-HZF-1882-12-26-001-09385_toc_19,," שאלות ותשובות למוהר""מ זילבער למאמרים תלמודיים ארוכים כאלה אין לנו מקום בהצפירה. לה׳ הירשזאהן לא נזכ עוד מה היה. להסופר מביאליסטאק יבוא בנומער הבא, לה׳ משה ברייוויץ ישלח, לה׳ י״מ בוועליז אין בידינו להסופר בוויניצא הביא עדות בלי לכתוב  הענין עצמו"
021-HZF-1882-12-26-001-09385_toc_20,, אדרעססא שלנו Редактору газ. ГАПEOHPA З. Слонинскому Варшава S. Sionimski in Warschau. Dzika No 253.
