article_id,headline,text
021-HZF-1882-03-14-001-09073_toc_1,, N ברוסיא ופולין. ל השולח במוקדם לשנה 5 רו״כ.   לחצי שנה 2.75 רו״כ. דל לרבע שנה 1.50 רו״כ ל ר ביתר הארצות 20 פראנק. ל  באמעריקא 5 דאללאר. E
021-HZF-1882-03-14-001-09073_toc_2,, K מחירו באשכנז: 14 רייכם מארק לשנה. שב בעסטרייך 8 פל׳ לשנה.  וכן לרבע שנה. שכר מודעות: מכל שורה קצרה 5 קאפ׳.   ומשורה רחבה 10 קאפ׳. א H
021-HZF-1882-03-14-001-09073_toc_3,מכתב עתי משמיע חדשות בכךב עם ישרון.מכל ה...," מכתב עתי משמיע חדשות בקרב עם ישרון, מכל הדברים הנוגעים בעניני המדינות, דברי חכמה ומדע, ידיעות העולם והטבע. יוצא לאור אחת בשבוע, מאת חיים זעליג סלאנימסקי."
021-HZF-1882-03-14-001-09073_toc_4,תוכן הענינים דברי הימים • ירושלים .אמערי...," תוכן הענינים דברי הימים ירושלים. אמעריקא היהודים בארץ החדשה מאת יהודה דוד אייזינשטיין. הצופה לבית ישראל. מאת נ׳ סאקאלאוו. מעשה צדקה להיוצאים, ווארשא. הודעות. שאלות ותשובות."
021-HZF-1882-03-14-001-09073_toc_5,דברי הימים," דברי הימים מן כל מקרי הימים האחרונים. העתידים להראות פעולה רבה על דברי ימי המדינות ויחס הממלכות האדירות באייראפא, הכי נכבד: התנשאות הנסיכות סערביא למעלת ממלכה מגליון העבר כבר יודעים קוראינו כי ביום 6 מארץ (22 פעברואר) התנשא הנסיך מילאן מסערביא למעלת מלך. ביום הזה התאספו כל קרואי העם לאספה רבה (גראססע סקופשצינא) ובהמון חוגג ונשיא הנבחרים בראשם באו עד ארמון הנסיך ויודיעוהו כי דבר יצא מאת העם הסערבי לתת לו ולבניו אחריו שם התואר „מלך״, והנם מחלים את פניו לעשות רצון עמו ולשית עטרת מלוכה בראשו, למען הגדולות אשר עשה בהסירו מעל שכם עמו את סבל עבדות תוגרמא, הנסיך קבל את קרואי העם בפנים מאירות, וקול קורא יצא ממנו לאמר: „עפ״י חפץ ובקשת עמי הנני משים כתרומלוכה על ראשי, ואושר עמי אשוה לנגד עיני כל הימים; סערביא נשענת על אהבת אייראפא תצפה לימים טובים וארוכים של שלום ותקופה חדשה של אושר ועושר המדינה, טוב כל אזרחיה, אהבת העבודה, הצדק והמישרים עם ממשלת הסדרים הישרים וחוקי החירות גם יחד, עה״ח , מילאן הראשון מבית אברענאוויץ מלך סערביא"", בו ביום יצאו הרצים אל כל חצרות המלכים להודיע דבר התמורה הזאת בהממלכה הסלאווית אשר בקצה מזרח אייראפא. הראשון אשר בא לברך את המלך החדש ולהודיעהו כי דבר מלכותו מאושר ומקוים מאת ממשלתו, היה ציר אוסטריא בבעלגראד; להציר הזה הראו קרואי העם אותותיהם אותות רצון ותודה לממשלתו אחריו בא ציר אשכנז ויתר צירי הממלכות האדירות, ולאחרונה גם ציר רוסיא, ביום הזה באה תשובת שתי הממלכות בעלות הברית אשכנז ואוסטריא, כי מכירות הן את תוקף המעשים בבעלגראד כאשר קיים וקבל עליו העם הסערביא, אשר מהיום תחד כבודה בקהל הממלכה השש עשרה מממלכות אייראפא גם בבריטאניא מצאו מכה״ע הדוברים בשם הממשלה קורת רוח מהשנוי הזה, מובן הדבר כי פנות העם בקרית מלך רוסיא הממלכה האדירה והסלאווית אשר היתה הראשונה להוציא את הסערבים מעבדות לחירות, מצאו ג״כ קורת רוח בהשנוי הזה, ורק הנאוואיע וורעמיא הוא האחד האומר, כי בכל המעשה הזה איננו רואה רק שנוי השם בלבד, ומזהיר ומעורר את סערביא לבל תלכד בשחיתות אוסטריא, אשר ערים תערים להתראות עתה כאוהב, ובקרבה תשים ארבה לפרוס עליה מצודתה לעת מצוא, ולעומת זה נראה את הממלכה החדשה מתנה אהבים עם אוסטריא שכנתה, ואחרי שלשת ימי חג ושמחה, כאשר נאספו שנית כל קרואי העם אל המלך החדש לברכו ביום 9 מארץ, היה דברו אליהם: הנני מאושר לבשרכם, כי עוד טרם עברו ארבע ועשרים שעות מיום אשר נקראתי בשם „מלך״, מהרו שתי הממלכות האדירות בעלות הברית אשכנז ואוסטריא להכירנו, אלה שני המושלים הנאורים אשר בכל עת הראו לי ולעמי אותות חבה יתירה; והנני ממלא היום חובתי וחובת העם הסערבי בהביעי את תודתי קבל עמי אל שני המלכים האדירים והנאורים הקיסרים פראנץ יוסף וווילהעלם. ביום הזה בקר המלך את נשיא המיניסטעריום „פיראטשאנאץ"" ויביע לו תודתו, על פעולתו במועצות ודעת, ובהשכילו לסדר פני המעשים ולהטותם לרוח החפץ הזה, אשר שת פאר ותהלה על עמו וארצו הדברים האחרונים האלה נותנים פתרון ותשובה מספקת על השאלה: מה ראתה סערביא להתנשא לממלכה ברגע הזה, ומדוע לא יביעו שמחתם על המעשה הזה אלה המתאמרים לאוהבי הסלאווים הדוברים בשמם. כהאיש אקסאקאוו ומרעיו בערי ממלכת פעט״ב ומאסקווא? תוכן הדבר הוא; כי זה ימים ושנה אשר המיניסטער המוסר מפקודתו „ריסטיץ"" והכהן שעבר מיכאל, שניהם בעלי ברית אקסאקאוו ומרעיו. מרבים להסית את העם בהממשלה, ולחתור חתירה תחת המיניסטעריום והנסיך בעצמו, בקראם בקול, כי עבדי אוסטריא המה ובכסף נמכרו אליה, סערת הרוחות גברה במדה הזאת אשר נמשכה המלחמה על שדה מערכת המרידה בהערצעגאווינא ודאלמאציא, ע״כ נועצה הממשלה לעשות מעשה למשוך אליו לבות העם, ולהתחזק על עמדתה מול הפאנסלאוויסטים עוכרי הארץ, והענין הזה מראה בעליל, כי קנאת הסלאווים בהאשכנזים והשנאה השוררת בין שתי משפחות לאומים אלה, במקומן עומדת, ומהעת שדברי אביר שרי צבאות רוסיא הגענעראל סקאבעלעוו הרגיזו את האשכנזים ויכעיסום תמרורים, לא שככה סערת הרוחות עד עתה, וכמעט אין לך יום שלא נראו בו אותות שנאה כבושות והתרגזות הרוחות, לפני ימים אחדים נתחדשה המחלוקת הזאת באשר באו לאזני האשכנזים דברי הגענעראל הנזכר בעברו דרך ווארשא לבוא לפ״ב, בברכו על הכוס לחיי הרוססים והפולאנים עם דברים אחרים שאינם נעימים לאזן האשכנזי, והדברים האלה הם שנתנו יד למה״ע כלי מבטאו של הנסיך ביסמארק „נארדדייטשע צייטונג"" לאמר, כי מעתה דעת הקהל באשכנז תשפוט בצדק, כי על הממשלה להיות מוכנת ומזומנת לקום פני המקרים המתרגשים לבוא באייראפא, ולהכין את עצמה לימי ריב ומלחמה מאחור וקדם. בעוד יום בא מאמר במה״ע הנזכר המערער על מעשי ממשלת רוסיא להגביה את המכס מסחורות שונות המובאות מאשכנז לרוסיא, לאמר, כי ע״י המעשה הזה ירד מסחר אשכנז עשר מעלות אחורנית, ונחוץ מאד למדוד לרוסיא כמדתה, ולהעלות המקח על דגן ועצים אשר תשלח היא על שוקי אשכנז, לפני ימים אחדים היה גם דבר אחד הגענע- ראלים בפרוססיא אל חברת חלוצי הצבא (לאנדוועהרסלייטען) ילידי הפולאנים בפאזען, ויביע מגגת לבו, כי ישנם אנשים הזורעים מדון ותגרה בין הפולאנים והאשכנזים, ויודיע, כי בקרב הימים תפקוד הממשלה את צבאותיה בקרבת המקומות האלה. למחרתו באה טע״ג להנאוו וורעמיא כי ממשלת פרוססיא שלחה דברה לפאזען, לבקש שם אפיצירים שיודעים ושומעים שפת רוסיא; והגאלאס הודיע, כי הפרוססים קונים סוסים במספר רב על גבולות הארץ. סוף דבר מה״ע מזה ומזה מלאים דברים בוטים הטלת חשד ודברי ריבות, אשר הרעישו היום לבות כל דורשי רשומות ונביאי הפאליטיק. הדברים האלה הכו מכות נוראות את בעלי המסחר, וירופפו עמודי הבטחון ושטרי המלכות ירדו פלאים בימי השבוע העבר, לאות נאמן כי מקרים גדולים ונכבדים מתרגשים לבוא. המה ההכנות הרבות אשר יעשו ממלכות ארצות המזרח; מההכנות ברומאניא כבר הודענו בגליון העבר ועתה נוסיף כי שרי הממשלה בקשו לקיים בידם סך כסף שלשת מילליאן לצרכי מלחמה; התכונה והעבודה בכל המבצרים ובתי הנשק בתוגרמה רבה מאד, ומאת הסולטאן היתה שומה על שר חיל הים ואניות מלחמה אשר לתוגרמה איש בריטאני האבארט פחה, לפקד את אניותיו ולהוכח אם נכונות הן לקרב ומלחמת הים. ביום 9 מארץ באה הידיעה מאדעססא, כי בני חברת אוהבי הסלאווים אשר שם בחרו את ראש המתקוממים בהערצע- גאווינא „סטאיאן קאוואצעוויץ"" לחבר להם, וגם הגענעראל סקא- באלעוו נבחר לחבר נכבד באגודתם על מערכת המרידה בהערצעגאווינא לא נעשו חדשות, התגרות הקטנות והגדולות נשבתות ונפסקות וחוזרות ומתחדשות, פה ייעפו המתקוממים, ובמקום אחר יחליפו כח. בכלל נראה כי יש להם על מי להשען. בכ״ז בימים האחרונים נראה כי המה הולכים ודלים, דבר קריאת סערביא לממלכה ע״י אוסטריא, הטילה עליה החובה להשגיח היטב על מעמד הבינים, וגם במאנטענעגרא נמצאו אחדים הדורשים בשבח השלום, ולא יארכו הימים ותשקוט הארץ. בעוד אשר קול ענות מלחמה נשמע בשערי אייראפא המזרחית והתיכונה, נשמעו דברי ריבות ע״ד עניני דעות ואמונות בשערי בתי המחוקקים אשר במערב אייראפא, כמעט ביום אחד פרצו הוויכוחים בהפארלאמענט הבריטאני ובית קרואי העם בצרפת בדברי אמונה. בגליון העבר הודענו, כי זה האיש ברעדלא אשר נגרש מהפארלאמענט בגלל הודאתו ברבים כי הנהו מהמכחישים במציאות השם. ועל כן לא נתנוהו להשבע השבועה הנהוגה, נבחר עתה מחדש, והנהו מכין את עצמו שנית לחדור אל הפארלאמענט, החותרים חתירה תחת מצב גלאדסטאן מצאו המעשה הזה נכון לפניהם להדית עי״ז את שרי הממשלה משאתם. ביום ד׳ העבר הציע ה׳ נארטקאט כי לא יתנו לברעדלא להשבע השבועה הנהוגה בבואו שנית לקחת מקומו בין מחוקקי בריטאניא; כנגד זה הציע אחד מבעלי ברית גלאדסטאן, אשר תהיה הרשות לכל חבר הפארלאמענט אם להשבע בנוסח השבועה הנהוגה. ואם לחדול, והדבר הזה לא יעכב את הנבחר משבת בבית המחוקקים גלאדסטאן גלה דעתו, כי הוא מסכים לההצעה הזאת, הנבחרים עמדו למנין, והצעת נארטקאטה נתקבלה, וכל היודעים את רוח הבריטאנים אשר כרובם המה שומרי אמונים ומחזיקים בנושנות בעניני הדת אומרים, כי יש בכח המעשה הזה להדיח את המיניסטעריום משאתו ולהביא בעקבותיו תמורה חדשה בחיק הממשלה בעצם היום הזה דנו גם בבית נבחרי העם בפרוססיא דין האמונה הקאטולית, בהגיע תור קיום בעד הממשלה הפרס הקצוב להציר המיוחד אשר תשלח הממשלה לעמוד בכל עת לפני האפיפיור, הפרס הזה נתקיים, אך בעלי המרכז לא יסתפקו בזה, והנם דורשים בחזקה לבטל לגמרי את חוקי חדש מאיי הנודעים, ואם לא, לא יחזיקו את ביסמארק בחפצו אשר הממשלה לבדה תעשה מסחר בעלי הטאבאק, דבר הנכון להעשיר את אוצר הממלכה עושר רב מדי שנה בשנה, באופן אשר הממשלה לא תהיה תלויה מעתה בדעת נבחרי העם לקיים או לבטל את ההוצאות אשר תשים לפניהם, כפי הנראה יהיה ביסמארק אנוס למלא משאלות בעלי המרכז ולמלא את כל חפצם כדברים האלה נשמעו גם בבית המחוקקים בצרפת, אחד הנבחרים הראדיקאלים מאהבתו להדרור עד קצה האחרון, הציע לבטל את החוזה והקשר אשר בין ממשלת צרפת וכסא האפיפיור משנת 1801 העומד עד היום, עפ״י החוזה הזה מקבלים משרתי האמונה פרס קצוב מאוצר המדינה; נגד ההצעה הזאת יצאו הנבחרים הכהנים ועוד אחדים, פרייסינע הגיד בשם הממשלה אשר לא תחפוץ בביטול החוזה לעת עתה, אך יבקש כי יבחרו המחוקקים מקרבם אנשים לשבת בועד מיוחד לצרף וללבן הענין. הצעת הממשלה נתקבלה וחפץ הראדיקאלים לא נמלא היום אך אין ספק כי לא יארכו הימים וחפצי האמונה יהיו נבדלים מחפצי הממשלה, והכהנים יחדלו לקבל פרס מאוצר המדינה"
