article_id,headline,text
021-HZF-1882-09-12-001-09271_toc_1,," K ברוסיא ופולין. ל השולח במוקדם לשנה 5 רו""כ. א לחני שנה, 2.75 רו״כ. כל לרבע שנה. 1.50 רו״כ.  ביתר הארצות (20 פראנק. באמעריקא 5 דאללאר. G"
021-HZF-1882-09-12-001-09271_toc_2,, K מחירו באשכנז: ל 14 רייכם מארק לשנה. בעסטרייך 8 פל׳ לשנה.  וכן לרבע שנה. . שכר מודעות: מכל שורה קצרה 5 קאפ׳.  ומשורה רחבה 10 קאפ׳.  E
021-HZF-1882-09-12-001-09271_toc_3,מכתב עתי משמיע חדשות 'בסרב עם ישרו!מכל ה...," מכתב עתי משמיע חדשות רל ניני המדינות. בקרב עם ישרון, מכל הדברים הנוגעים ב דברי חכמה ומדע, ידיעות העולם והטבע. יוצא לאור אחת בשבוע, מאת חיים זעליג סלאנימסקי."
021-HZF-1882-09-12-001-09271_toc_4,תוכן הענינים דברי הימים .למועד צאת השנה....," תוכן הענינים דברי הימים. למועד צאת השנה. מאת נ""ס סטעפעניץ. ליבויא. זאבולדאווא. סאחאטשין. הודעות. שאלות ותשובות."
