article_id,headline,text
021-HZF-1883-06-14-001-10157_toc_8,," הודעה  יצא לאור ס' שנאת עולם לעם עולם o. 25 נחום סאקאלאוו, ווארשא, דזיקא במחיר 1 רו״כ ישיג כל דורש את הספר הזה מיד המחבר או מיד הרעדאקציאן של הצפירה (האדרעססע של המחבר הוא ג״כ: ווארשא, דזיקא o. 25), והקונים סך מסויים יקבלו הנחה כנהוג. И. Соколову, въ Варшаву Лзикая № 25. N. Sokolow, Warschau, Dzika No 25."
021-HZF-1883-06-14-001-10157_toc_9,," יצא לאור היום על ידי ח״י גורלאנד „לוח ישרון״ בשפת עברית ורוססית לשנת התרמ״ד. בריאה לכל אחינו בני ישראל ברוסיא, עם הוספת כמה ענינים מועיי לים ודברים גד איש מדיני בכלל. מחיר הלוח ה כנים החפצים להפיצו בכל ערי הזה הוא 5 קאפ׳ ליחידים, ולמוכרי ספרים בותיהם תנתן הנחה הגונה מעשרים עד ארבעי שאה (40%—20), והקנין אך ורק במזומן ולא בהקפה. הפונה יפנה אל המו״ל לפי הכתבת הזאת: онъ 1вичу гурланду въ 11овокосковскъ (Eкатернносл. губ."
021-HZF-1883-06-14-001-10157_toc_10,," מודעה אתכבד בזה להודיע שכל יודעי ומכירי איך שהפאבריק שלי מפאפיראסין ביכליך אשר עד כה זה כעשר שנים היתה הפירמע א׳ זאטערמאן עט מ׳ קוראטאוו. ועתה מן דען 1 מאיי הרחקתי אותו מאתי ונשארתי ת״ל בעצמי בהפאבריק הנ״ל. באותו מקום אשר היה מקדם ברחוב נאלעווקי תחת נומר 25 בחצר הגביר טאקאר, ואבקש מאת קונים הקרובים והרחוקים לפנות אלי באשר יצטרכו ואקוה שישבעו רצון ממני, ובעוד חדש ימים אקוה שיהיה לי סארטין חדשים ממש כמו ווינער נאטאראל .A. Zaterman, Warschau Nalowki № 25 אדרעסע"
021-HZF-1883-06-14-001-10157_toc_11,," ""מס׳ ידיעות הטבע להחכם א׳ בערינשטיין יצאו כעת עוד חוברות ה׳ ו׳ ז׳ מקח כל חוברת 30 קאפ׳. ויוכלו לשלוח ע״י פאסטמארקען על אדרעססע: . P. Sаксу, въ Варшавъ."
021-HZF-1883-06-14-001-10157_toc_12,," זה חמש שנים אשר עזבני בעלי, אותי ואת ברג אשר ילדתי לו, וילך למסעיו ויתחבר אל חבר המשחקים (טרופפע) של שייקעוויץ וגם של „קריק״. בשנים הראשונות קבלתי ממנו מכתבים אחדים, אך זה עשרה יחים אשר נסתם ממנו כל חזון, והנני יושבת ומה ועגונה ובדי עמל אביא טרף לפי וחוק לבתי, ואלה סמניו: שמו איצק מאיר קנעל (RMERRIe( שנותיו כ״ז, קומתו ממוצעת, שער ראשו וגבות עיניו שחורות, עיניו כמראה שכר פניו טהורים, זקנו שחור עם שערות דונקעלאשפארב אך אולי יגלחנו. כל אשר יכירהו ע״פ סמניו יודיע נא אלי או אל הרעדאקציע. ברי האשה האומללה בילא קנעללער דובנא, האדרעססע כשמי"
021-HZF-1883-06-14-001-10157_toc_13,," בני איכה! זה כשלש שנים עזבני בני ואיננו. בשנה הראשונה עוד הריץ מכתבים פעם מווילנא ופעם מגראדנא, ומני אז כל חזון נסתם ממנו, ואלה סמניו: שמו אברהם הירש העפטמאן, שנותיו כעשרים ושלש  מתו ממוצעת, שערותיו טונקל בלאנד. מכתב מסעו מבריסק דליטא, מי היודע ממנו ייטיב להודיעני על האדרעססע הר״מ, ואליך בני אשא את דברתי, בני מחמדי! חום נא על נפשי ועל נפש אמך אשר אך בך כל מגמתנו. הודיעני אולי באשר כי נכספה וגם כלתה נפשך להשתלם במדעים, ובאשר כי לא זו דעתי נחבאת לברוח? אבטיחך נאמנה, כי לא אהיה לשטן לך על הדרך אשר תכונן אשוריך עליה, אך הודיעני נא השלום לך. г. Мошко Матусу Гестману въ г. Врлискъ г. г."
021-HZF-1883-06-14-001-10157_toc_14,," הודעה אבות לבנים אודיע כי הנני נכון לקבל מחודש אוגוסט הבא אשר אקח לי אד מעון במסבי הגימנאזיע והפאליטעכניקום דפה, נערים בפענסיאן  לכלכלם היטב ולנהלם שרים, כאשר עידוני כל יודעי, האדרעססע . L. Sossnitz, Riga Romanowska 32"
021-HZF-1883-06-14-001-10157_toc_15,," עכטע זיידענע שווייצער מיללער-גאזע פיר מיללער, אויך בוימוואללענ גס אונד וואללענעס גלאססע, האנדשוה, פוטטער פיר האנדשוה פאבריקאנטען, עמפפעהלט A. S. Wachholder Warshau Nalewki 3"
021-HZF-1883-06-14-001-10157_toc_16,," היערמיט האבע דיא עהרע איינעם נע- עהרטען פובליקום בעקאנט צו מאכען איך פערשיעדענע זארטען פלוש איינינער פאבריקאציאן צו מאססיגען פרייזין פערקויפע.  אין דיא לע האנדלונג אים הויזע דעם ה׳ א. פראססאק No. 282 אונד ביטטע איך צור געפעלליגען בעאכטונג. האכאכטונגספאל ל׳ יאקאבאוויטץ, לאדז"
021-HZF-1883-06-14-001-10157_toc_17,," תחבולה לעשות חיל יש לנו למכור תמצית חומץ 80%, (עססיג עססענץ) אשר מוכשר להיות חומץ טוב כאשר יערב עם 35 חלקים מים. נגד ש  של 70 קאפעיקעס (בפאסט מארקין) ישיג כל מבקש פראבע Люблинеръ и Конъ Влоцлавекъ, Варш. губ. פראנקפורטער עססיג-עסענץ אין הארט אונד אין פלאשען, צו בעקאממען בייא מ׳ וויסקאטש, ווארשא פראנצישקאנער 10 נא, אים הויזע קאפטאלס"
021-HZF-1883-06-14-001-10157_toc_18,," שאלות ותשובות לה׳ אבולכיר באלגיר קבלנו לנכון, לה׳ צ״מ הנומערין הראשונים עד 18 אן בידע סוד, לה' הערשינהארין בקארעץ בנומר הבא, לה׳ מ״מ הדרשות שדרשו הרבנים ביום חג הכחר לא נוכל להדפים כי רבים הם, לה׳ גי""מ ומה נעשה אם על הפאסט דפק נתעכבו רוב האגרות אשר בהם משלוח כסף"
021-HZF-1883-06-14-001-10157_toc_19,, אדרעססא שלנו Редактору газ. ГаHEIр4 З. Слонинскому Варшава. S. Stoniunski wWarszawie. IDzika No 25.
