article_id,headline,text
021-HZF-1883-05-22-001-10131_toc_1,," A ברוסיא ופולין. אל השולח במוקדם לשנה 5 רו״כ. ל לחצי שנה, 2.75 רו״כ.  לרבע שנה 1.50 רו""כ.   ביתר הארצות 20 פראנק.  באמעריקא 5 דאללאר נ"
021-HZF-1883-05-22-001-10131_toc_2,, M מחירו באשכנז: 14 רייכם מארק לשנה. בעסטרייך 8 פל׳ לשנה. אל וכן לרבע שנה. שכר מודעות: וכל שורה קצרה 5 קאפ׳. ומשורה רחבה 10 קאפ׳ K
021-HZF-1883-05-22-001-10131_toc_3,"מכתב עתי משמיע חדשות יוצא לאור אחת בשמע,..."," מכתב עתי משמיע חדשות יוצא לאור אחת בשבוע, מאת חיים זעליג סלאנימסקי."
021-HZF-1883-05-22-001-10131_toc_4,תלכ[ ההגיגים דברי הימים .דאמםגאט .אןארקא..., תוכן הענינים דברי הימים. ראמסגאט אזארקאוו. ההכנות לחג הכותרת. הצופה לבית ישראל. הודעות. שאלות ותשובות.
