article_id,headline,text
021-HZF-1874-10-07-001-10303_toc_9,רומניה.," רומניה. פאלטישען בחדש אלול תרל״ד. האיש אשר מרוכא הוא ביסורים ואין לך יום שאין קללתו מרובה משל חבירו ולפתע פתאום יראה אור מרחוק אל יאמין לבו כי טוב טוב יהיה לו מעתה כי בלי ספק האור הזה אור מתעה הוא, והוא בצרתו יהי עדי ישקיף ה׳ ממרום ויאמר לצרותיו די — זה כשני חדשים שמענו אנחנו יושבי ארץ מאפלי׳ כי הציר האנגלי החדש אשר בא זה לא כביר לבוקארעסט הטה אזנו לבקשת אחינו השו גאלדשמידט בלאנדאן לנסוע לערי ארץ רומאניה ולראות בעיניו הבצעקת היהודים הבאה אליו אמת ונכון הוא! רבה היתה שמחתנו, בשמענו הבשורה הטובה הלזו, כי אמרנו בלבנו: יהיה הציר מי שיהיה, אם רק איש באנשים הוא ועיניו לנוכח יביטו יבין וידע את אשר אנחנו סובלים תחת עול הגוי הזה, ובצפיתנו צפינו כי הציר הזה אם יבא אל איזה עיר אז יעמוד שם ימים אחדים לראות אם שם היהודי מנואץ הוא בכל הארץ ואם בתי המשקאות בהכפרים עומדים שוממים וכמה אנשים נשארו בלי משען לחם ואז יוכל להשיב אמרים אמת לשולחיו. אך את אשר קוינו לא ראינו! הציר נסע בלוית אחד סופרי מ""הע Da"" היו״ל בלאנדאן ובכל מקום בואו התעכב  כשתים או שלש שעות; ויתאכסן בבית שר העיר... בעיר יאססע והתמהמה יום אחד אך עם איש ישראל לא דבר; ובערים אשר בני ישראל התאמצו לדבר עמו ולהציע לפניו את כל מצוקותיהם לא יכלו, כי שר העיר עמד בפניהם. בבא הציר לעירנו התמהמה כשתי שעות, ואח״כ נסע למדינות בוקאווינא, גם בדרך הזה נלוח אליו הפרעפעקט. אך לאנשים אחדים מאחינו צלחה השעה לדבר עם הציר בעצמו כשעה תמימה והוא הבטיחם כי תצמח טובה להיהודים בנסיעתו זאת, אף הוסיף לאמר כי המלבושים הצואים הארוכים כמנהג אנשי פולין המה יעכבו גאולתנו; אמנם על דברי אחינו אשר שאלוהו: „מה לתבן את הבר אם יש בין עמים אחרים איש אשר ילבש כמנהג אבותיו, אם רק איש ישו נבון הוא, הלא לא יעלה על לב איש לפקוד עליו את עון בגדיו, החריש ולא ענה מאומה, והנה לדאבון לבנו, קראנו זה כשני שבועות מאמר אחד מהסופר אשר נלוה להציר ושם ישפוך חמתו על היהודים לאמר, כי ראוים המה לעונש יען יש ביניהם אנשים אשר נמשלו כבהמות נדמו, ובפרט הרבנים אשר ימוצצו דם ישראל, כזה וכזה יפער הכותב הזה פיו לבלי חוק ורוצה לבלענו חנם! אוי לאותה בושה! כל איש אשר עינים לו יראה איך שנה הסופר ברואה ולא ידענו מי ומה עוד את עיניו... מה לנו ולרבנים! ובמה ימוצצו דם ישראל, הבזה אשר ישגיחו על קיום התורה והדת? האם לא ירימו קולם להגיד לבני ישראל: למדו נא לבניכם שפת רומענית עם שאר השפות החיות, האם ימצאו כעת בינינו אנשים אשר ילמדו לבניהם ובנותיהם רק שפת עברית ולא רומענית? ואם גם ימצאו הלא מעט מספרם ונער יכתבם, עד אשר לא אאמין אם גם אחד ממאה מן הדור החדש אשר יקום לא ידע קרוא רומענית! ומה היה להכותב כי כה נשא במרום קולו על הרבנים? ומי הגיד לו את כל אלה? האם עמד בכל עיר ועיר לראות מצוקות העברים וצרותיהם? האם בקר בתי הספר אשר לבני ישראל כמעט בכל עיר ועיר לראות איך הבנים ילמדו וידברו שפת רומענית ואשכנזית בכל אות נפשם! אך לשקר עשה לו האיש הזו עט סופרים! מאיר יוסטער."
021-HZF-1874-10-07-001-10303_toc_10,אפריקא.," בערב יום ההוא התנפל ההמון על איש עברי המתהלך לתמו עם איש אטליני וידו אבן בם וירבו פצעיהם חנם, עד אשר נחלו האנשים ויפלו למשכב. דברים כאלה יקרו שם יום יום ובעלי הפקודות עומדים מנגד; אך לעתים לא רחוקות יעמוד הקונסל הספרדי ה׳ סאן פעדרא בפרץ ויאיץ בממשלה להעניש את הפושעים, והיא תשמע בקולו. מספר היהודים היושבים בעיר הזאת הוא 1,500 נפש אדם, ומהם אך שבע או שמנה משפחות עשירות הנה, והנשארים הם עניים היודעים מחסר גם בצרכי האדם היותר נחוצים. אפריקא. מאראקא. לפי דברי אחד הסופרים מעיר זאאפי מצב היהודים בעיר ההיא רע הוא מאד, כי גדולה שנאת העם אליהם והם רודפים אותם באף ובהימה, ביום הג המושלמנים 2 מאי התהלכו שתי מאות איש ברחובות קריה בקול המון חונג, וישליכו אבנים גדולות על היהודים, אשר התראו ברחוב או הרשו לעצמם לגשת אל החלון להביט החוצה."
021-HZF-1874-10-07-001-10303_toc_11,"ו
ריאה
 העולם והטבע.","  ריאה  העולם והטבע. השתלמות חכמת החרשים (סוף) לפי מה שהראנו יהיה בטבע סגולת האויר הכבוש ונלחץ במקום סגור כח חזק מאוד לשוב ולהתפשט, עד שבפעולתו זאת נוכל להשתמש בו למכונות גדולות העושות כל מלאכה עבודה כמו מכונות הקיטור. וכבר ישאל כל קורא בהשקפה הראשונה א״כ איפו למה לא נעשה מכונות האויר תחת מכונות הקיטור לכל דבר מלאכה? אבל כלל גדול אמרו חכמי הטבע כל כח פועל היוצא ונולד מצד איזה סיבה קודמת לו, א״א שיהיה גדול מן כח הסיבה הראשונה אשר הולידה אותו״ לפי שאין כה נולד בטבע, בלי כח מוליד השוה לו בגדלו וכמותו. ובנדון שלפנינו אם נעשה מכונה ע""י האויר, אשר תוציא בכחה איזה פעולות, הנה הפעולות האלו בעצמן יכולות לצאת ג״כ מן הכח הראשון בעצמו שהוכרחנו לכבוש את האויר בתוך המכונה, וכבישת האויר במכונה השנית הוא לפ״ז מלאכה שאינה צריכה לגופה כלל. ולא הרווחנו בזה מאומה, ורק באופנים ידועים אשר א״א להשתמש בכח הראשון בעצמו, כמו שראינו בבנין הטונגעל שבארנו, אז היה הכח השני. באמצעות האויר נחוץ ומועיל מאוד. וחכמי החרשים הפליאו עוד יותר בפעם הזאת, כי גם לכה הראשון הכובש את האויר תוך המכונות, המציאו להם ג״כ כח טבעי חזק מאוד באין צורך למכונות הקיטור כלל. המה חקרו ומצאו בחשבון, אשר כמות המים היורדים מראשי ההרים ההם, ע״י הגשמים והשלג הנמס עליהם, לפי ערך גובה נפילתם ומרבית כמתם, אם נוליכם דרך נכונה בתחבולות ידועות, יש בטבעם להוציא כח פועל חזק מאוד. ובתחבולה נפלאה הכינו להם מכונה פשוטה הפועלת בכח עצום בכח 300 סוסים!*), יסוד התחבולה הזאת הוא הנודעה בלמודי הטבע בשו איל המים (וואססער ווידדער, הידראולישער ווידדער). ונפלא הדבר כי התחבולה הזאת הנודעה בשם איל המים, לא שמו לב עליה עד היום, ולא השתמשו בה רק לבלי שעשוע בגנות ופרדסים, להגביה מים מן הנהר ולזרקם למעלה על תבנית „בארות הקופצות (שפרינגברונגען), ורק בחריצות חכמי החרשים מצאו ידם לעשות ממנה מכונה גדולה ועצומה הפועלת בכח 300 סוסים, והיא היתה המכונה הראשונה והעיקרית אשר עבדה את עבודתם משך 13 שנים בבנין הטונגעל הזה בלי הפסק. ואלו בקשו להם במקום הזה לעשות מכונות הקיטור, כמה הוצאות *) כח הסוס נחשב אצל בעלי המעכאניק, כח שיכול להגביה 510 ליטרות בגובה רגל אחד בזמן זעקונדע אחת. ו הנדחק ממשא המים שעליו. מן הכלי ת יוצא שוב קנה הלול גבוה הכפוף למעלה בראשו  לשפוך ממנו מים אל הכלי L, ואם נדמה ד״מ שבמקום הפנוי א בכלי יהיה מכונס וסגור אויר הרבה הכבוש ונלחץ שמה בכח. הנה ידחה את פני שטח המים אשר ישכון עליו ויכריחם לעלות לתוך הקנה ט למעלה ולשפכם שם לתוך הכלי L. במקום הקנה 6 נמצא עוד קנה אחד BR מחובר אליו, אשר למעלה הוא סתום בכסוי, ורק באמצעו הוא נקוב ופתוח אשר דרך בו יעלה וירד כמו ברוא של הביות K הכבד במשקלו ע""י הראש  המכבוד אותו מלמטה, וע״י כבדו הוא תלוי ונמשך למטה וסותם את הנקב ע״י K הכפתור א היורד עליו, ורק כאשר נגביה מעט את הכפתור יפתח הנקב ויצאו המים לעלות בגובה שוה לגובה המים שבכלי . — מעתה נדמה שבמצב הזה כמו שהוא נראה בצורה נדחוק את הברוא K לצד מטה, הנה כרגע יתחילו המים לרוץ במרוצה מן הכלי ת דרך 43 ולצאת בכח דרך R לצד מעלה, אבל ע״י כה מרוצתם ידחפו את הראש ך ויגביהו את הברזא לצד מעלה ועי״ז יסתימו את פי הקנה מבלי לצאת עוד, ולאשר כח מרוצת המים בתוך 4 לא נפסק כרגע ע""כ ירוצו אז להלאה  מן 6 עד 6 ושמה יגביהו את הכסוי 6 וידחקו עצמם ל לתוך הכלי ת, ועי״ז ילחצו את האויר הנמצא שמה בחלל הכלי למעלה, והאויר הנכבש ילחוץ שוב על שטה המים שבכלי ויכריחם לעלות דרך פי הקנה 9 למעלה עד 5 ולהשתפך לתוך הכלי L, אפס כי דחיפת המים דרך 6 על האויר שמה, תחלש מעט מעט מצד לחיצת האויר שוב על המים ויבטלו כחותיהם וא״ז, עד שיבואו למעמד המנוחה על רגע קטנה, ואז יפול מעצמו הכסוי 6 ויכסה פי הקנה וכן המים שמתוך הקנה Ag ינוחו מכה מרוצתם, וברגע המנוחה הזאת בהכרה שיפול שוב גם הברזא עך מצד כבדו, ובנפלו יפתח שוב את הנקב K, ועי״ז ישובו המים שבתוך הקנה 45 להתחיל שנית ולרוץ במרוצה, ובכח מרוצתם יגביהו את ראש הברזא R ויסתמו את פי יציאתם, ויוכרחו לרוץ להלאה עד  ולהגביהו שנית וליכנם לתוך הכל כמשפט הראשון, וכזה יחזור הענין חלילה פעם אחר פעם, בהפתח הנקב K יתחילו המים לרוץ במרוצה ויפעלו לסתום את  ולפתוח את 6 וכאשר יתם כח פעולתם וישובו למנוחה, חזור R להפתח ולהביא את המים למרוצתם הראשונה, ויתחדש הדבר שנית ואח״ז בלי הפסק נקל להתבאר מזה כי מרוצת המים בקנה 46 אשר הוא הכח הראשון בפעולת המכונה הזאת, יגדל יותר כל אשר יהיה גובה הכלי BH יותר גבוה, וכערך הזה יגדל ג״כ כח פעולתו לכבוש את האויר בתוך הכלי R יותר. והנה לרגלי ההר הגדול בהררי אלף גובה המים היורדים מראשו הוא רחוק מאוד, ובהכרח שיהיה גם פעולתם ללחוץ את האויר כח חזק ועצום למאוד עד כי מצאו לאל ידם להוליד מהם כח נעלה ונפלא מן 300 סוסים, ולעבוד בו כל העבודות והמלאכות הרבות והעצומות אשר היה להם בבנין הטונגעל הזה משך י״ג שנים. רבות וגדולות היה צריכים לבנין מכונות כאלו, וכמה אלפי אלפים  כברי פחמי אבן אכלו אש המכונות האלו במשך 13 שנים? ואומרים עליו על השר (Cavour) אשר היה אז שר היושב ראשונה במלכות איטאליע, שכאשר הציע לפניו חכם החרשים האטליאני (Sommeiler) את התחבולה הזאת, להוציא מן המים היורדים מראשי ההרים באטליא כח טבעי חזק מאוד למלאכת עבודת הטונגעל, אמר לפני שרי המחוקקים בפרלאמענט, כי בהמצאה הזאת הוא רואה אוצרות זהב וכסף לרוב אשר יכלכלו הוצאות רבות מאוד הנחוצות לבנין הגדול הזה, וכי המים הרבים אשר ישפיעו לנו ברכה הררי האלף בארצנו, הם שקולים בערכם כמו כל בורות אבני הפחם אשר לממלכת ענגלאנדו, והוא הוא אשר השתדל באומץ רוחו הכביר להוציא בנין הטונגעל לפעולת אדם, כי לבו ראה הרבה חכמה, אשר מסילת הברזל המחברת ארץ אטליא ליתר מדינות אירופא, תתן יד גם בתהלוכות הפוליטיק לעת מצוא. ולאשר פעולת המכונה של איל המים הוא ענין מהודד מאוד, בהיותה מכונה הפועלת ומתפעלת מעצמה באין כח בא אליה מחוץ, ויסודתה בלמודי הטבע הבלתי מבואר עוד לרבים מהקוראים אצלנו, כי גם ברוב ספרי חכמת הטבע מלשונות העמים המצוים בידי ההמון ביום, לא נמצא זכרה כלל, ע״כ אמרתי לבאר הנה לפני הקורא אופן תקונה ותוכן פעולותיה. כבר ראינו שמטבע האויר הוא להיות נכבש ומתקמץ בכמותו, ונוכל להכניס הרבה ממנו תוך כלי סגור מכל צד עד כמה שנרצה, וכל אשר יתקמץ יותר יגדל ג״כ כח ההתפשטות שלו, וילחוץ בכח יותר על דפנות הכלי אשר הוא נפוח בו אבל לא כן הוא בטבע המים, כאשר נמלא איזה כלי במים ונכבשם גם בכח היותר חזק וגדול שאפשר, הנה המים לא ותקמצו יותר מכפי שהם, והכלי לא ימלא יותר אף כחוט השערה רק ישארו במדת כמתם כמו שהיו, ואז יבקשו להם מקום לצאת בכח גדול השוה לכח הדוחה אותם. ומעתה אם בכלי אחד סגור יהיו עצורים מים ואויר כאחד, וכח פועל מחוץ רק על המים לדחקם, אז תצא הפעולה מהם על האויר לקמצו ולכבשו עד שיקטן בכמותו, והמים ימלאו מקום האויר הנדחף, ועל פי סגולות מתנגדות האלו שבין האויר, והמים, נוסד הכלי איל המים שאמרנו, וזה ענינו. בצורה שלפנינו נדמה כי  הוא כלי גדול מלא מים עד גובה ידוע, מקרקע הכלי יוצא שוב קנה הלול 466 הכפוף ופתוח לתוך כלי אחר CR המחובר אליו, באופן שפי הקנה 0 הוא פתוח לצד מעלה לתוך הכלי , ורק ע״י כסוי של ברזל או המונח על פיו הוא נסגר, באופן שהמים המכונסים שם עד הגובה R, אינם יכולים להשתפך ולצאת לתוך הקנה מצד הכסו"
