article_id,headline,text
021-HZF-1876-03-29-001-030093_toc_1,," ברוסיא ופולין.  השולח במוקדם לשנה 5 רו״כ.  לחצי שנה, 2,75 רו״כ. לרבע שנה 1,50 רו״כ.  ביתר הארצות 20 פראנק.  באמעריקא 5 דאללאר.  רוסיא לאור עיני ולא אלי"
021-HZF-1876-03-29-001-030093_toc_2,," . מחירו באשכנז:  14 רייכם מארק לשנה.  בעסטרייך 8 פל׳ לשנה, לל וכן לרבע שנה. .  שכר מודעות: מכל שורה 5 קאפ'. ."
021-HZF-1876-03-29-001-030093_toc_3,מכתב עתי משמיע חדשות בקרב עם ישרון ' מכל...," מכתב עתי משמיע חדשות בקרב עם ישרון, מכל הדברים הנוגעים בעניני המדינות, דברי חכמה ומדע, ידיעות העולם והטבע. יוצא לאור אחת בשבוע, מאת חיים זעליג סלאנימסקי."
021-HZF-1876-03-29-001-030093_toc_4,," אל הקוראים הנכבדים הגליון הבא יהיה האחרון לרבע הראשון משנה הזאת, וע״כ נבקש מאת כל אלה החפצים לכתוב את ידם אל הצפירה גם ברבע השני, כי ייטיבו בחסדם להקדים ולשלוח את כסף חתימתם עליה, למען יגיעו העלים לידם כסדרם בלי הפסק."
021-HZF-1876-03-29-001-030093_toc_5,תוכן הענינים.," תוכן הענינים. דברי הימים. טירקייא. פראנקרייך, שפאניען. אדעססע מינסק. דיגא, פעסט. ידיעות העולם והטבע. מורה שעות הדיפליידאסקאפ מאת המו״ל. אבן האקדח מאת יעקב פרענקעל מאגוסטאוו. חדשות שונות. אלון בכות. דון יוסף נאסי מאת א. לאנדמאן. הודעות. שאלות ותשובות."
