article_id,headline,text
021-HZF-1883-07-10-001-10189_toc_1,," 3 ברוסיא ופולין.  השולח במוקדם לשנה 5 רו״כ.  לחצי שנה, 2.75 רו״כ. כל לרבע שנה. 1.50 רו""כ.  אל ביתר הארצות 20 פראנק.  באמעריקא 5 דאללאר. A"
021-HZF-1883-07-10-001-10189_toc_2,, SH מחירו באשכנז: 14 רייכם מארק לשנה.  בעסטרייך 8 פל׳ לשנה. וכן לרבע שנה. שכר מודעות: מכל שורה קצרה 5 קאפ׳. ומשורה רחבה 10 קאפ׳. ב K
021-HZF-1883-07-10-001-10189_toc_3,"מכתב עתייוצא לאור משמיע אתת בשבוע, מאת ח..."," ברי- מכתב עתי משמוע חדשות יוצא לאור אחת בשבוע, מאת חיים זעליג סלאנימסקי"
021-HZF-1883-07-10-001-10189_toc_4,"הגליון הזה הוא האהרון למהצית השנה הזאת ,..."," הגליון הזה הוא האחרון למחצית השנה הזאת, וע״כ כל הבא עה״ח יקדים לשלוח כסף המחיר בכדי שלא תתאחר הצפירה לבוא אליו, והסוכנים אשר עדיין לא שלמו בעד העבר לא ישיגוה עד אשר ימלאו חובתם אליה. המו״ל"
021-HZF-1883-07-10-001-10189_toc_5,תוכן הענינים דברי הימים .מששט עלילת הדם ..., תוכן הענינים דברי הימים. משפט עלילת הדם באונגארן. לינקאווע. הוראדנא. הצופה לבית ישראל. שגיאות מי יבין. הודעות. שאלות ותשובות
021-HZF-1883-07-10-001-10189_toc_6,דברי הימים," דברי הימים בימי השבוע העבר עלה על במתי עולם המדיני ויהי לשיחה בפי כל יושבי אייראפא, הגראף הצרפתי שאמבארד חוטר מגזע מלכי בית ארלעאן המיוחס למלוכת צרפת. האיש הזה עשה לו הפעם יד ושם ויהי לנשיא היום (העלד דעס טאגעס), לא ע״י כשרון המעשה ופעלים נשגבים, כי אם ע״י מחלתו הכבדה אשר לפי דברי הרופאים תצעידהו למלך בלהות בעוד ימים מספר. המחלה הזאת והידיעה הברורה כי הגחלת האחרונה לבית מלכי ארלעאן תכבה בעוד ימים, העלו על הבמה את השאלה מה יעשו כעת צוררי הרעפובליק, היוסיפו לחתור תחתיה או ישליכו אחרי גום את מלכי דמיונם, וידבקו בהרעפובליק לסעדה ולחזקה ולאמץ עי״ז את כח צרפת מבית ומחוץ? עוד נצר אחד נשאר משרש בית ארלעאן אך לא מן הגזע הראשי, הלא הוא הגראף פאריס, אשר עד היום אחז בכנף כסות שאמבארד ולא הורם למעלה ולנשיאות בקרב מפלגת הארלעאניסטים, אך עתה בהפקד מקום אלופם, אולי אליו יפנו ולדגלו ישבעו. הרעפובליקאנים ששים ושמחים כשמחה אשר שמחו בנפול „לולו"" בן הקיסר נאפאלעאן במערכות המלחמה באפריקא הדרומית. הגראף שאמבארד נחשב עד היום במפלגת נאמניו כמלך צרפת, ומה טוב ומה נעים להרע- פובליק כי הוגה מן המסלה „המלך"" הזה, ומפלגת בני בריתו תהיה כגל של עצמות, ולא תוסיף להדאיב עוד את לב הממשלה בכרכוריה ובתחבולותיה, כי גם אם יקום הגראף פאריס על מקום שאמבארד, לא לו יהיה העז והמשרה, כי תחסר לו התכונה הראשית, זיו המלוכה והוד האצילות הנעלה וקסם היחש, אשר כחם גדול למשוך לבות אנשים אוהבי ישן נושן ותאבי הדרת מלך כהארלעאניסטים הקלים בדעתם, אשר הרעפובליק לא טובה בעיניהם באשר יחסרו לה הנוי וההידוד, העטרה והמדהבה סכנת מות ודאי שנמצא בה כיום הגראף שאמבארד מלאה כ״כ את לבות הצרפתים בהגיונות ומחקרי עניני מדינה התלוים בזה, עד כי הסיחו דעתם כרגע ממלחמתם אשר להם בארץ ענמים . המלחמה שבתה ותרום כאבן בימים האלה, צבאות הצרפתים חונים על מצבם בערים אשר לגבול הארץ, והענמים ממולם כמצודות, ועוד לא נמנו וגמרו הצרפתים, הלחדור לפנים הארץ עד עיר הבירה הוא מקום מושב הקיסר טודוק, או לעמוד על מצבם מבלי מוש משם להלאה. גם כינא עודנה עומדת במנוחה, צבאות הכינעזים אף הם נצבים בגדוד ממול הצרפתים וממול הענמיים, ושלשת פלגות הצבא עומדות ומביטות אשה על רעותה מבלי דעת מה להן לעשות, כי לפי הנשמע פרצו חילוקי דעות בין שרי המיניסטעריום בצרפת ע״ד המלחמה, יש מהם דורשים בחזקה לשלוח את אנשי הצבא עד עיר הבירה בארץ ענמים, ויש זהירים ומתונים המפחדים מפני כינא, ופוסקים „שב ואל תעשה עדיף״, לו יצאו צבאות הענמיים מגדרם להתנפל על צבאות צרפת, כי אז נטפלו אליהם הצרפתים להלחם בהם ולרדפם עד בירת מלכותם, אך הענמיים לא כסילי אדם המה ולא יאבו להתחיל במלחמה, ובכן אנשי הצבא עומדים חוצץ, כלי התותח נכונים, רכב ופרשים ערוכים בסדרים, אך שקט ומנוחה מסביב. נשיאים ורוח — וגשם אין. לא כן במאדא- נאסקאר באפריקא, שם המנוחה שוררת, אבל המנוחה היא אחר המלחמה, שקט אחרי הרעמים, כי כמעט כל האי נכבש על ידי הצרפתים, מתוקה מנוחה כזאת, למנצחים ונעים להם לישון על מרבדי עטרות של זיתים זרי הנצחון הנתנים להם לאות גבור תם ונצח עוזם. מלבד הגראף שאמבארד הנוטה למות, עלה גם האפיפיור ראש הכנסיה הקאטולית על מרום עולם המדיני, האפיפיור הזה איש פעלים הוא, מתקן כל ההריסות אשר הרס ואשר פרץ פיוס התשיעי שקדם לו. פיוס היה איש ריב ואיש מדון לכל הארץ, עם הקיסר ווילהעלם רב את ריב דתו הקאטולית, עם רוסיא הפיר את בריתו, באיטאליא התקוטט תמיד אף הטיל על מלכה וויקטאר עמנואל את להט החרם, אך לא כן לעאן הי״ג המכהן בכהונתו הגדולה היום, הוא גדר את הפרץ בינו ובין רוסיא, הוא בא בדברים עם ביסמארק אף בצע את השלום — רק אחת היא צרפת אשר לא יוכל לכרות ברית עמה. נקל לשער בנפשנו עד כמה זועמת צרפת את כהני הקאטולים, אם ראה האפיפיור אוהב שלום הלזה לנכון לפניו לערוך מכתב אל נשיא הרעפובליק, האדון גרעווי, ולהוכיחהו תוכחת מגולה, ולבקש ממנו להיטיב את דרכו בנוגע לשאלת הדת הקאטולית ולהלכות הכהונה והנהגת בתי התפלה ובתי המקלט להנזירים היעזואיטים שנשארו בארץ אחרי הגירוש הכולל, גרעווי לא ענה דבר על המכתב הזה. כן תתנהג צרפת, הבת הבכירה להדת הקאטולית — כאשר קרא לה פיוס התשיעי —. כן יתנהג גרעווי הקאטולי בעת אשר ביסמארק הפראטעסטאנטי, האיש אשר קרא לפני עשר שנים את קול הקריאה הנודע „נאך קאנאססא געהען וויר ניכט"" יזחול כעת בדחילו ורחימא להתאבק בעפר רגלי האפיפיור ולבטל את רצון ממשלתו מפני רצונו, האין זה עולם הפוך? (מדוי מצרים הרעים), אורח נורא ואיום המפיץ פלצות ומחתת מות בכל מקום עברו, בא מארץ הודו מצרימה, וידרוך גם על מפתן אייראפא, וכבר הראה את פניו המזרים אימה במאלטא אשר לגבול אייראפא. האורח הזה הלא הוא „החלי-רע״ מלאך המשחית אשר אין עצה ואין גבורה נגד מגלו. זה חדש ימים תתחולל המחלה האיומה הזאת בעיר דאמיעטטא במצרים. בימים הראשונים לא שמו אליה לב, והאנגלים חסו על המסחר וימאנו לחסום שם את הדרך ולעשות גדרים, וינחמו הבל כי אך חלי הבל הוא. אולם המחלה התגברה מיום אל יום, ועד עתה מתו בדאמיעטטא אלף וחמש מאות איש וכל יושבי המקום מרחפים בין החיים והמות, ותעש לה השמועה כנפים ואימת מות נפלה על כל יושבי ארץ מצרים, על יושבי קאהירא ואלכסנ- דריא, והם בורחים לאלפים ולרבבות אל כל קצוי תבל, ויחרדו כל העמים אשר באייראפא פן יביאו אתם פליטי מות אלה את הנגף, ובין כה וכה יצאו שמועות משמועות שונות ע״ד מקרים של הלי-רע בכמה ערים מערי אייראפא, לא נודע אם נכונות השמועות, או רק מקרים טבעיים הם אשר זה וסתם בימי החום כאלה, ולא במגפה שרשם — אך מי יחקור דבר בעת אשר אימת מות פורשת את כנפיה השחורות? ממשלות אייראפא כולן הוציאו פקודות שונות של זהירות יתירה, לכל תקרבנה האניות הבאות ממקום הנגף אל החוף, עד אשר יכלו ימי מרוקיהן וטהרתן גם הוציאו פקודות כאלה בקרב הארץ להזהר במאכל ומשתה ובנקיון, ולהודיע אל פקידי הממשלה כל מקרה וכל צרה שלא תבוא גם בארצנו ובעירנו יצאו פקודות כאלה, וראוי ונכון לכל איש לשמרן, להזהר באכילתו ובשתייתו, ולהתרחק מכל חלאה להיות גופו נקי וכו' וכו׳."
