article_id,headline,text
021-HZF-1882-03-14-001-09073_toc_9,מעשה הצדקה להיוצאים," מעשה הצדקה להיוצאים כעמוד האור יאיר הועד הכללי בלאנדאן לפני מחנה יוצא חפזון, רבים ישאלו יכספו לדעת אנה פני הועד מועדות, ואיה איפוא המסלה העולה אל המטרה אשר הציב לו, אך הוא לא בחפזו יוציא משפט, וכל מזמותיו ומערכי לבו יפלס בפלס התבונה. הן הקארדינאל מאננינג, האיש אשר רוחו נוסס לים בהועד ההוא לנס ולתפארה. לא בסתר הגיד כי רק ירושל קרית מעוז לישראל, רק ארץ הצבי תהיה למנוס ולמקלט לבני עם עולם אשר ארץ מולדתם מתקוממת נגדם, כי שם לא ידח מהם גדה ולא תתעורר נגדם קנאת עם. בכל זאת יעביר הועד לעת הזאת את פליטי רוסיא ארחות ימים באניות לאמעריקא ורק לימי האביב יצפו, כי אז חזון למועד אשר ילך אליפהאנט לבראדי, להפיץ את הנדחים בארצות תבל. ולחלקם באה״ק, אמעריקא, קאנאדא, ומוצאות האנגלים, כאשר הודענו „בהצופה״ .Jew. בהתאסף יחד ראשי הועד בפעם האחרונה לדברת מכ״ע נקראו דברי מכתב אשר ערכו בעלי חברת גומלי חסדים , בו יודיעו כי המונים המונים מפליטי רוסיא ינהרו בעת הזאת לונדונה, ויבקשו פרות ועזר מאת החברה, אך מעינות אוצרה וללו וחרבו, על כן החלו לעורר לנדבות, ויכוננו ועד משנה לתמוך את האומללים ולהיות להם עזר כנגדם הגרעפין די אביגדור הודיעה להועד, כי בימים האלה אגודת גבירות נדיבות נוסדה להלביש ערומים ויחפים מן האומללים היוצאים לאמעריקא, בענות חן ענה הקארדינאל מאנגינג על הדברים האלה, גם הפלה לו אחד מכהני צדק הנוצרים לחבר הועד. מעיר גלאזגאוו תרדמת העצלות בשאר הארצות התעוררו, בארץ צרפת נשמע סוד שיח גדולים אשר יתכוננו ויתעתדו להרגיז ולהרעיש ארץ, לצעוק חמס נגד שערוריות בני עולה, ולאחוז בצנתרות הזהב להריק מעליהם הזהב אל אוצר הועד הלונדיני, וגם בשאר הארצות נמס הקרה אשר התעלם על לבות נדיבי אחינו באונגארן החלו אחב״י להתנדב לטובת האומללים, ובברלין נשא הד״ר הילדעסהיימער גם למתנדבים. ה׳ אשכנזי קורא עוד הפעם את הקריאה אל נטילי הכסף בפאריז, ליסד קולוניא גדולה באמעריקא בעסק של שטרות, אך ההצעה הזאת תחוג ותנוע במרחבי עולם הדמיון עד אשר תפול לבלי הוסיף קום לדברת סופר מכ״ע „יוד׳ פרעססע"" מעיר מילוואקעע באמעריקא, לא נכון רוח היהודים היושבים שם עם משלחת הפליטים אשר נהרו שמה כזרם מים כבירים, האומללים האלה המורדפים במוץ הרים מסערת קדים, לא בחפצם הלכו שמה, אך הועד בנויארק הותיר פליטה לכל מחוז ממחוזות אמעריקא, ובין כה וכה יכעסו אנשי המקום ובלא חמדה יקדמו פניהם, מכ״ע צייט- גייסט מטשיקאגא יחוה את דעתו לאמר: רצונכם לעזור להאומללים, החישו להם עזר ופדות, אולם אם לבכם כשמיר חזק מצור רגזו בלבבכם קפצו את ידיכם ודומו ואל תעקשו את פיכם לדבר תועה, כי למה תניאו ותשיבו אחור את ידי המתנדבים. בשבוע הבא נכונים 150 איש מגולי מחוזות הדרום ללכת באניה מלאנדאן לנויארק, שבעים וחמשה איש נשלחו בהוצאות הועד הברליני לאנגליא, והדבר הזה הריק עד היסוד את אוצר הועד הזה, אשר אחרי כל העמל, המליצות והמאמרים, קבץ כמה אלפים מארק! חברת בעלי האניות כוננה להנוסעים האלה בית מבשלות לתבשילי כשר. בפילאדעלפיא קדמו אחב״י את פליטי אחינו אשר באו שמה במספר שלש מאות איש, ויתנו להם לע״ע מעונות מרווחים, ויקרבום כמו נגיד באהבה ובאחוה ראש חברת בעלי ישוב בכנסיה פלארידא אשר באמעריקא שלח דברו לפילאדעלפיא, כי נכון הוא לתת ארבעים אקקער (ערך מארגע בארצנו) לכל משפחה, ואזרח עשיר אחד מכנסית קאראלינא הצפונית הודיע נדבת לבו לתת לכל משפחה אחת אחוזה מחמש וארבעים אקקער אדמה פוריה ודשנה צומחת דגן וגלומי טאבאק ויבול למכביר, עשיר יהודי אחד הודיע כי נכון הוא לתת פרס 250 דאללאר להיהודי הראשון אשר יקצור ויכ שיעור ידוע צמר גפן הצומה לרוב בארץ ההיא. אולם מצב אחינו הנעים ונדים בבראדי ובשאר הערים, אשר מארץ מולדתם כבר נעתקה רגלם ואל מעונם החדש עוד לא באו. הוא מעציב ומרגיז לב. במכה״ע האנגלי „דייל טעלעגראף״ אנו קוראים כדברים האלה: ד״ר שאפפיער אשר נשלח כציר מיוחד מאת חברת כי״ח לבראדי, להחיש עזר להפליטים ולתמוך בימינם לשוב אחור לרוסיא, שב בידים ריקות ולא מלא את מלאכותו. למרות עמלו וניב שפתיו אשר דבר קשות ורכות. לא הצליח המריץ ולהגיע לב האנשים לשוב בדרך אשר באו, הנה על כן תשית החברה את לבה לחוש עתידות לאלף ושלש מאות הנודדים האלה, הצפוים לעת הזאת אלי עוני ומחסור, עוד אנחנו כותבים והנה השמועה עשתה לה כנפים במכה״ע, כי הועד הואיל לחלק לתמיכת האומללים האלה 10,000 פונט שטערלינג, ואת המפעל הגדול הזה תוציא למענהו החברה אשר בוויען. לע״ שלחו להם חליפות שמלות, וישכרו למענם מעון לחסות בצו קורתו עד ימי האביב. גם חלקו ביניהם כסף מעט לכלכל את מחסוריהם, ד״ר שאפיר בא כעת מעיר יפו אשר שמה הוביל את הילדים למסרם אל בית החינוך לכורמים ויוגבים, את מלאכת הרפואה אשר היא אומנתו השליך אחרי גוו, ואת כל עתו ועמלו הרים תרומה לטובת האומללים. לפי דברי מכ״ע הנ״ל. תנועת היציאה הולכת ומתגברת בדרומה של רוסיא, ואם יראו אותות פרעות ואי סדרים, מוכנות ועומדות חמשת אלף משפחות מאדעססא וארבעת אלפים משפחות מיעליזאוועטגראד לעזוב את הארץ ולנוע לאה״ק או לאמעריקא. במכ״ע „דיילי ניוס"" נכבדות ידובר ע״ד אחב״י הפלטים המתגוררים לע״ע בבראדי. בתחלה התמרמרו נגדם הפקידים והשוטרים, וייראו לבל תפרוץ מהלה או תקלה וקטטה בעיר לרגלי הזרים האלה, כנודע. אולם ביושר דרכם ובחין הליכותיהם וארחות חייהם, קנו להם האומללים האלה לבות פקידי העיר והם חביבים ואהובים מאד, ונחומי האזרחים ככרוב סוכך עליהם מסביב. וסופר מכ״ע הנ״ל שבע ענג מצחות שפתם, סבר פניהם היפות וכל שיחם ושיגם; ולפי דעתו אך למען כחש יתלוננו עליהם שונאיהם, כי מפני שהם נבדלים ומצוינים בלשונם ובבגדיהם, על כן הם לשמה ולשריקה לבני האספסוף, בעוד שבאמת מצב המוסרי של הפחות והגרוע מהם, הוא נעלה ונשא על מצב המוסרי של הגדול שבשונאיהם. ווארשא ביום ב׳ משבוע העבר הובל פה לקברות אחד מאפרתי ונכבדי עירנו, הגביר המפורסם מו״ה יעקב חיים בערינשטיין ז״ל, האיש המצויין הזה היה אהוב ורצוי לב יודעיו ומכיריו, אוהב תורה ורחים רבנן וגם חנך את בניו היקרים על דרכי התורה והחכמה, ביתו היה פתוח לצדקה חסד, והניח מעזבונו סך עשרת אלפים רו״כ לקרן קיימת אשר התרבית העולה מהם 500 לשנה ילבישו בהם תלמידי תלמוד תורה בכל שנה, בן חמשים ושש שנים היה במותו, וכבוד גדול עשו לו תושבי עירנו, ה׳ ישלם נחומים לאשתו הכבודה ובניו הנכבדים וכל המתאבלים עליו. ותנצב״ה."
021-HZF-1882-03-14-001-09073_toc_10,נדבות עבור השדודים בווארשא," נדבות עבור השדודים בווארשא מעיר פלונסק, ה׳ יצחק כהן 10 רו״כ, ה׳ קלמן שלמה וילבערשטיין 3 רו״כ, זאב וואלף בערנשטיין 2, ר׳ יהודה יהושע בוימאן, שמואל קריגער אברהם שיטקא, פישל מאשינסקי, גרשון דובנא, כ״א 1 רו״כ, ועוד נדבות קטנות ס״ה 21,25 רו״כ. נמסר להועד. מעיר זנוראווקע פלך פאלטאווע ע״י ר׳ צבי הענין ממתנדבים שונים 15 רו״כ."
021-HZF-1882-03-14-001-09073_toc_11,," יי""ש של פסח להתוודע ולהגלות להקונים המדקדקים לשתות רק י""ש פסח מפאבריקען מנישעוו וגאזלין אשר מכרנו אנחנו החתומים למטה את הי״ש הנ״ל לאיזה סוחרים דפה הנקובים בשמותם היינו להר״ג נחמן לאטטהע מחזיק דיסטילארנע ברחוב דזיקא נומ׳ 22. לה״ג ייענטע מושקאט ולה״ג שרה מאלינאק. ועמהם עשינו חוזה שבל יקנו ולא ימצא בסקלאדען שלהם שום יי""ש אחר מפאבריק אחרת זולת מפבריקען מנישעוו וגאזלין. ולזאת יוכלו הקונים להשיג מבוקשים אצל הסוחרים הנ״ל, כי אנחנו על חשבוננו לא עשינו שום סקלאד מיי""ש מנישעוו וגאזלין בווארשא, רק מכרנו את היי""ש אורטאווקע להסוחרים הנ״ל וגם ה׳ לאסקי קנה אצלינו איזה סכום, ולכן אין קדימה בזה לאחד על רעהו, וכל אחד מהם ימכור סחורתנו במקח השווה כחוק כל מסחר ולראיה בעה״ח יום ד׳ אדר תרמ״ב לפ""ק. מענדל בלאס אברהם רובינשטיין"
021-HZF-1882-03-14-001-09073_toc_12,," יי״ש של פסח מבתי המלאכה (פאבריקען) הנודעים מנישעוו וגאזלין, יהיה גם בשנה הזאת. כמו בשנים הקודמות. ברחוב נאלעווקי בחצר הגביר ר׳ No. 22485 )27( איטשע אשר קליינמאן (לפנים ווישניעווסקי) למול חצר פיינקינד וכל החפץ לעשות מסחר ביי״ש, יפנה אלי, ולבבו יהיה נכון ובטוח כי חפצו ימולא באופן היותר טוב, וגם להקונים לאחדים אתאמץ למכור במחיר זול. בבית מסחרי ימצא למכור. גם יי""ש ישן מובחר במינו שעברו עליו כמה שנים. יי""ש מתוק (ליקיער) ויי""ש שזיפים שליוואוויץ מן המינים המובחרים — בשם קוויאטקאווסקי. עקיבא לאסקע"
021-HZF-1882-03-14-001-09073_toc_13,," ויין ישמח לבב אנוש בבית מסחר היין הנודע לתהלה זה יותר מחמשים שנה פה ווארשא להמנוח No 1 ר׳ מאטיל ז״ל. התנוסס בשם „האננא"" נגד שער הברזל ברחוב פשעהאדניע והנהו על שמי ביילא זילבערשטיין, מכבר היה האננא, ובזאת אודיע הסוחרים מכירי ויודעי אשר רוצים לעשות אצלי בעשטעללונגען, הן ע״י הפאסט או ע״י הדע- פעשע יכתבו על שמי הנ״ל על רחוב פשעהארניע No 1 ויכול כל איש להשיג אצלי כל מיני יינות טובים, ומי דבש שליוואוויטץ, הכשרים על חג הפסח במקח השוה גם שכר ופארטער ממדינת בריטאניא, והמסחר של רחוב גענשע No. 3 איננו שייך לי N 1 כלל, רק ברחוב פשעהארניע א No. 1 אדרעססע שלי ביילא זילבערשטיין לפנים האנגא ברחוב פשעהאדניע הפרייז קראנט על כל הנ״ל ישיג כל אחד חפשי"
021-HZF-1882-03-14-001-09073_toc_14,,"  הודעה לסוחרי יין הן זה משנים רבות נודע למשגב לכל באי שער עיר ווארשא מסחר היין מאמי ת׳ מ׳ ביילה זילבערשטיין או האננא היא עוד משנת 1830 וזמן כביר יסדה ג״כ בית מסחר יין כזה, היא פיליא מחלקה ממסחר הנ״ל על רחוב גענשע No. 3 הנקרא זיידענ- פאבריק וכעת המסחור הוא תחת ידי והרחבתי ופשטתי את ענפי מסחרי הנ״ל עד כי אוכל להשביע לכל קונה רצון עם מיני יינות שונות הבאים ממקומות שונות, וגם מי דבש הן על הארט ועל דעטייל וכשרים הם על חג הפסח הבע""ל והכל במקח השוה, לזאת אתכבד להודיע להסוחרים אשר באו עמי בברית המסחר כי ישבעו רצון בכל עניני המסחר ולאלה הבאים בצל קורתי להתענג על ייני ודבשו אודיע כי הכינותי חדרים מרווחים מרהיבי עין ולב, והמשרתים תמיד עומדים על משמרתם לעשות כרצון איש ואיש. אדרעססע אלי ב׳ וואנחאצקער, גענשע No. 3 ווארשא בונם וואנחאצקער, בן שה״ג ביילה זילבערשטיין הנקרא „האננא״"
021-HZF-1882-03-14-001-09073_toc_15,," הודעה לסוחרי יין הנני להודיע בזה כי כל היינות כשרים הנמכרים מהמרתף של ה׳ געברידער קעמפנער מפה המה חתומים בחותם שלי הן על החביתים והן על הבוטעליען, וחותם הלז מונח ג״כ על כתב ההכשר עם ח״י על כל טראנספארט ומגוף הסחורה יוכלו לבטוח על נכון אשר רוחם יהי׳ נוחים על צד היותר טוב ובפרט מהמקחים. בעה״ח פה ווארשא בחודש אדר תרמ״ב. משה הלוי קויפמאן חתן הרב ז״ל מאזארקאוו Gebruder Kempner Warschau, Dluga No 5. אדרעססע M. Kaufmann Warschau, Muranow № 10. או 1"
021-HZF-1882-03-14-001-09073_toc_16,," ספר מבשרת ציון אסיפת כל מאמרי הש״ס ומדרשים ע״פ סדר א״ב, נגמר בשבוע זו כרך הו שון, ואי״ה מרו גם יתר הכרכים וא״ז בלי עכוב וכל הדורש ימצאנו אצלי חיים ליבערזאהן בברדיטשוב המלה״ד"
021-HZF-1882-03-14-001-09073_toc_17,," יי""ש של פסח מפאבריק מנישעוו, גאזלין, גם שליוואוויטץ וליקער על חג הפסח, הכל במקח השוה ימכרו במקצוע רחוב דזיקא ופאוויע, אצל ס׳ ניידינג."
021-HZF-1882-03-14-001-09073_toc_18,," קנקן חדש מלא יש הנני מודיע לרבים שיש בבית מסחר היין שלי כל מיני יין טוב על חג הפסח הבע""ל והמקח בזול מאד, היינו יין טוב מירושלים וגם יין ישן נושן, וגם אונגער ייי  כל מיני קרעמישען יין טוב והי  הרבנים המופלגים ומפורסמים ב  ליום אשר יכולים לסמוך עליהם אפילו מההרין הדרין. וז מן המו הקונים מהאפראווענץ מבטיח אני אותם מלבד אשר ישיגו ראבאט טוב יכולים להיות בטח שהיין לא יקלקל ולא ישונה ולא יהי׳ בו ח״ו שום הפסד ווארשא אצל ר׳ נחמן נתן קאָיאַלניק בחצר הגביר ר׳ משה אולריך ברחוב גויבאוו No. 1 באגנע"
021-HZF-1882-03-14-001-09073_toc_19,," אומן במלאכת הבורית אשר למדה תהעארית וגם פראקטיס, ויודע לעשות מאר- מארירטע בצבעים שונים גם נעלע, וגם שע, מבקש משרה. גרינע וו  סע דוד קאשעווניק קאוונא"
021-HZF-1882-03-14-001-09073_toc_20,," סדורים מחזורים והגדות עם העתקות פולאנית, צרפתית, אשכנזית ורוסית בכריכות נאות מאד נמצאו למכירה אצל L. J. Szapira, Nalewki No. 7."
021-HZF-1882-03-14-001-09073_toc_21,," הנני להודיע לכל יודעי ומכירי הקרובים והרחוקים כי מסחר היין שהחזקתי זה 14 שנים ברחוב נאלי פקעס בבית הנקרא הצר כהן״ס נומ׳ 13, העתקתי כעת לנוכח הבית הנ״ל בחצר הג׳ ר׳ לייזר ווייס נומ׳ 12 והנני בטוח שכל הקונה אצלי יין יפיק רצונו, ובפרט על פסח הבע""ל בדבר שרות, אנכי איש מוחזק לזה גם להיותר מדקדק מרדכי קראנענטהאל M. Kronenthal, Warschau Nalewki No. 12."
021-HZF-1882-03-14-001-09073_toc_22,," שאלות ותשובות לה׳ אלעזר באשטינאוו התחיל מן נו׳ 34, לה׳ גאלד׳ בפיר׳ מאמרו לא יודפס מהשנים שעברו אין לנו, לה׳ שמואל מאנדלבוים בווענגראווע ישלח לנו חזרה הנומערן מן 1 עד 6 אשר לא שילם בעדם לה׳ ברוך מפאפוליאת קבלנו ושלחנו, לה׳ זלמן שמואליע"" בקיש׳ מכתביו קבלנו ואנו שולחים כסדר ולא ידענו מאיזה סיבה לא ישיג."
021-HZF-1882-03-14-001-09073_toc_23,, אדרעססא שלנו З. Сонинскону Варшава. או S. Sionimski in Warschau Dzika No 253.
