article_id,headline,text
021-HZF-1877-11-14-001-40343_toc_8,"גלגלי מים (שטרודעלן, מעער-ווירבעלן)","  אחד מספר המסעות של הנוסע המפורסם ה׳ גערביליאן, אשר הוא בעצמו ראה חזיון כזה בהתגוררו לרגלי מסעותיו במעס- סינא, הלא כה דבריו: ויהי היום, והנה אנית סוחר גדולה למאד התראה מרחוק על שטח פני הים. בעזרת הפערנראהר יכולתי להתבונן על האניה הזאת מרחוק, כי הנה אנית נעאפאל אשר היתה עמוסה בכל מיני בר ומזון להובילם עירה מעססינא, ותכונן דרכה ישר דרך התעלה בפאת המזרחית מן ההאריבדעס, רוח דרומי מזרחי (זיד-אסטווינד) התעורר אז בעצם תקפו ויהי לסער מתחולל. ההאריבדעס התחיל להראות ליושבי האניה החדשים במה כחו גדול, גליו ומשבריו האיומים התנשאו בגאון עוזם כהררי עד לשחקים הגיעו, גלגלי המים התחילו מדי רגע ברגע להגדיל את שאונם והמית רוחם באופן נורא מאד רב החובל והמלחים בראותם לחרדת נפשם כי איד גדול נכון לצלעם, הסירו עד מהרה את תרני ומפרשי האניה, ובכל מאמצי כחם ואונם התחילו לחתור על החוף המשתרע בפאת הצפוני מן ההאריבדעס; אפס עוד לא הגיעה בתוך החצי מן התעלה קאלאפארא, והנה זרם מי ההאריבדעס התחיל למשכה בתעצומות עוזו ושטפו הנורא אל מרכז החאריבדעס אשר לשוא היו כל תחבולות ועבודת אנשי האניה האומללים להמלט משני גלגל המים האיום והנורא, ואחרי אשר גליו האיומים, והנוראים טלטלוה טלטלה גבר והשתעשעו עמה כמו בכדור בניס שוחקים, הפכוה על פניה, שברוה, הרסוה וערוה עד היסוד בה, אנשיה וכל קניניה ורכושה ירדו מצולה, ורק אנשים מעטים נצלו ממות, בעזרת המלחים אשר החשו ישע באני שיט שלהם״. ממוצא כל הדברים והאמת האלה, יוכל הקורא המשכיל, לברוא לנפשו מושג נכון, ולהוכח לדעת על נכון כי ההאריבדעס הנהו גלגל-מים בלי שום תפונה וספק, וכל מי אשר יאבה להחליט כי לא כן הדבר אינו אלא טועה. בעת אשר זרם המים יקום לדממה ויעצור את שטפו העז והנמהר, אז אין שום סכנה להאניות ולהנוסעים ויכולים אז לכונן דרכם דרך התעלה בהשקט ובבטחה ואין שום מגור ופחד למו מסביב המשורר הנפלא האממער הנזכר יתאר ויצייר את שני גלגלי המים סציללא והאריבדעס בשיר השנים עשר משיריו הנשגבים והמפורסמים אשר שר על אודות הים, ומלואו (אדיזעע) גם המשורר הנעלה שיללער יתאר את שני גלגלי-המים האלה בשירו הנודע „הצולל"" (Der Taucher) בציור איום ונורא מאד. בהחליטו כי המה משלחת מלאכי זעם הים, היותר איומים והיותר נוראים אשר אין על עפר משלם. נפלאות שני גלגלי המים האלה ועזוז נוראותם אשר יופיעו על פני שטח המים, ימשכו אליהם בחזקת היד את עיני איש ואיש, כחכם כסכל, כנבון כבער. מן אביר החכמים אשר בידו כל מחקרי ארץ ותועפות הרים לו, ועד צעיר הפראים הקוטף מלוח עלי שיח, בערבות ציה, ועד היושב על ראש תרזה ואלון ביערי עד; החוקר הטבעי אשר כמעט כל מרחבי הבריאה לא אניס לו, ישים אליהם לב כעל כל מראות הטבע, ובעין חכמתו יחשוף תעלומות ונצורות רבות בחכמת ההידראאגראפהיע בכלל וגלגלי המים בפרט, אשר תשיתנה לעיניו נוספות מראות הוד והדר במקדש התולדה אשר כלו אומר כבוד, והבלתי נאורים יושבי חשך וצלמות ושוכני יעד לבדד ההם, אשר יתהוללו באימים ואשר נוגה ההשכלה וזוהר הציוויליזאציאן לא האיר עליהם, יחרדו ויפחדו ויעורו לקראת גלגלי המים בלב מלא רעד הבל ובעינים פראות יראום כראות פני שד בלהות, הרצים לפני מרכבת מלאכי זעם הים לחבל את האניות. חוקרי הטבע הקדמונים באטאלמעאוס והיפארכוס, חשבו את שני גלגלי המים האלה, לזרמי מים עזים ואיומים אשר ירעשו ויהמו באין מעצור, אשר כמוהם יבראו ויולדו חדשים לבקרים במקומות שונות על שטח המים אשר לים אוקינוס ולים התיכון, לרגלי הרוחות השונים אשר יתעוררו על הים. וגם כאשר פתחה החכמה את פיה בימי החכמים ההם ובתי גלגלי מים (שטרודעלן, מעער-ווירבעלן) (סוף מגליון 42) חוקרי-טבע-המים (הידראלאגען) אשר חפצם הצליח בידם לבוא עד תכונת ההאריבדעס על נכון, יורו לדעת כי זרם המים הזורם במעגלה מסביב לההאריבדעס, יזרום וישטוף ממעל לשטח המים עד עומק רב בחומר המים, ולפעמים — עד קרקע הים הקף שטח זרם ההאריבדעס יגיע עד מאה רגל, והגלים הרבים המתנוססים בזעף סופה וסערה מדי רגע ברגע, יתראו כמגדלים גבוהים אשר שיא ראשימו עד שחקים יגיעו האני- שיט אשר ישבתי בתוכה התגודדה משצף קצף הגלים האיומים ויטלטלוה טלטלה גבר באין מעצור, פעם הרימוה למעלה על ופעם השפילוה מטה, ולוא לא קם הסער הנורא לדממה, אשר התחולל בסופה וסערה לפני זמן לא כביר, כי עתה היינו בלי ספק לברות למלתעות גלגלי המים באין מציל. אנכי נסיתי להשליך איזה גופים בתוך המים, אשר משקלם היה יותר מחומר המים בעצמו, וכל הגופים האלה לא נשקעו במצולה כ״א נשארו צפים על שטח המים בקש ותבן. מן הדבר הזה נוכחתי עוד יותר לדעת, כי ההאריבדעס הנהו גלגל-מים, יען כי ע״י הרתחותיו העזים וזרמו הנורא לא נתן את הגופים לרדת מצולה כ״א הדפם כה וכה באין מעצור אחרי כן נסיתי למדוד את עומק ההאריבדעס באנך- עופרת הצולל (זענקבלייא), ואחרי יגיעות בשר ועמל רב מרבה להכיל, הצליח לי למצוא בעזרת החבל, כי עמקו הוא חמש מאות רגל. ובפאתו המזרחית יגיע עמקו עד אלף רגל. המלחים אשר היו אתי בתוך האני-שיט, ספרו לי אודות החאריבדעס בכלל כדברים האלה: „בעת אשר הזרם והרוח התמידי יתנגדו איש את אחיו בעים רוחם ותעצומות עוזם, וזולת זאת בעת אשר הסציללאקא או הרוח הדרומי יתעורר בשצף קצפו, אז יתעוררו מי הים מסביב לההאריבדעס. ויתחילו לזרום במעגלה בסאון והמולה נוראה באין מעצור, עוד יותר איום ונורא כמו בהתעוררם התמידי, ואז יוכל כל אדם לראות משלשה עד ששה גלגלי מים איומים אשר ירתיחו מסביב לההאריבדעס, ולפעמים עוד יותר במספרם; אניה היותר חזקה והיותר גדולה בשוטה אז לא רחוק מן החאריבדעס, לא תעצור כח להמלט מתגרת ידי גלגלי המים, כי בתוקף עוזם ובעים רוחם ימשכוה אליה ההאריבדעס במרוצה נמהרה למאד, ויתחילו להסבה ולהגיעה במעגלה מסביב, עד כי לאחרונה יהפכוה על פניה ותרד במצולת תהום רבה עם המונה ושאונה יחד. כל השתדלות ותחבולות רב החובל והמלחים האמיצים והחרוצים במלאכתם יעלו בתוהו ויאבדו, וכלם יצללו כעופרת במים אדירים באין מפלט ומנוס ממות, ועד ארגיע יושלכו כחרם נבל יוצרים על החוף לאנטערנא והאניה פור תתפורר לרסימי קטנים. בכדי לתת להקוראים הנבונים מושג נכון וציור אמתי ממקרה מעציבה ומבחילה כזאת, הננו להעתיק בזה ספור קטן"
021-HZF-1877-11-14-001-40343_toc_9,"מדרשם.,ותדבר על כל מקצעוח חחכטות וחזיוגו..."," מדרשם, ותדבר על כל מקצעות החכמות וחזיונות הטבע השונים. גם אז אטמה את שפתיה לדבר דברים נכוחים ואמתים על אודות חזיון הטבע הנפלא הזה.. — שני החכמים האלה, לא מצאו נחת לדבר בספריהם ע״ד הענין הנכבד הזה, לא מהם ולא מעזוז נוראותיהם ולא מאיכות הויתם, ואין זאת רק יען לא נשאו את ראשם להתבונן על חזיונות הים הנפלאים אשר אך על פקודי צבא השמים ביחוסם לחכמת התכונה שמור כל מגמת פני מחקרם; וגם חוקרי אלכסנדריא של מצרים אשר חיו יחד עם החכמים האלה. חשבו את גלגלי המים האלה לשטף זרם מים עוז ונמהר אשר דבר אין להם עם גלגלי- המים אשר היו נודעים בימים אחרים בימיהם ובקהלם לא  יחדו הסופר הלאטיני פלוניום הקדמון אשר מצא חפץ לדבר דברים נכבדים אודות חכמת ההידראלאגיע בכלל ידבר ג״כ גבוהה גבוהה על אודות גלגלי המים מציללא והאריבדעס בפרט הוא יערך לנו צלם דמות תבנית שני גלגלי המים האלה בתואר איום ומוזר למאד. הוא ירחיב פה ויאריך לשון בדבר הזה, לצייר את עזוז נוראותם ותוקף עוזם בעת אשר יתחוללו שני רוחות מתנגדים על הים, ויספר לנו הרבה ספורים מבהילים למאד מנוסעים שונים אשר היו טרף לשניהם, בירדם המה והמונם וכל קניניהם במצולות תהום רבה באין עזר ומושיע  גם בספרים משנות הבינים, מן שנת המאה האחת עשרה ועד שנת המאה החמש עשרה, ימצאו דברים זרים ונפתלים בדבר הזה. כן למשל החליטו כי גלגלי המים סציללא והאריבדעס, הן המה שני משלחת מלאכי זעם הים, לכלות מעל פני האדמה את אלה הנוסעים אשר כשאול יחטאו ואי אלהים כל מומותם. וציוו למשלת הרבה אניות אשר הי מלאות עם אנשים רעים וחטאים מאד, אשר מצאו קברם  לר במצולות הים לרגלי שני גלגלי המים האלה; אף כי לא זכר למו לא בספרי חכמי ההידראאלאגיע, אף לא בספרי הנוסעים וקורות הימים. כאשר אך ישים על לב החוקר הטבעי או הקורא המשכיל את כל הדברים הנוראים והאיומים אשר הטפנו בזה, ע״ד חזיון הטבע הנשגב והנורא הזה, אז יקרא מנהמת לבו ובחרדת קודש; האח! מה איומים מעשיך צור נורא עלילה! ומה נשגבו נחמיה דוב האפפמאנן, בעהמ""ח ס׳ „אוצר נחמד"" יליד טויראגען"
021-HZF-1877-11-14-001-40343_toc_10, ידיעות תלגרפיות מהממשלה,"  ידיעות תלגרפיות מהממשלה פעטערסבורג מן טיקמי מודיעים מיום 27 אקטאבער מלחמת הגענעראל היימאן ביום 23 על גבעות דעבעביון, נמשכה משעה 10 קודם חצות עד שעה 7 לערב, הטורקים נסו מן המערכה אל סביבות העיר ערזערום, ואך הגשם ואחריו השלג עצר בעדנו מלרדוף אחריהם, 8 אפיצירים ושלש מאות אנשי חיל לקחנו שבי ושלל המחנה 40 כלי תותח, עם כל הכבודה מן מזון וצידה וכדורי שריפה; מאתנו נפקדו 30 אפיצירים, ועוד 800 אנשי חיל וויען 9 נאוועמבער. בחצר המלכות בסטאמבול נגלה קשר מורדים, הסולטאן הראשון מוראד, שב לבריאותו, ואמו עומדת בראש כת האחת, אשר ידיהם עם מיטהאד פחה להשיב לו כסא המלוכה, נוו חה, גיסו של השולטאן אמיד, עם איע א האנשים ממתי שורו, הובאו בכלא.  א . "
021-HZF-1877-11-14-001-40343_toc_11,,"  תקנת עגונה הסופר הנכבד עקיבא השמל הודיע בהצפירה 41 № בשם המכ״ע „יודישער טעלעגראף״ כי איש יהודי מארץ ליטויען ושמו, ברוך אבער, נהרג בדרך מן ביעלע לסיסטאף; ואנכי האשה האומללה בשמעי את זאת מלאו מתני חלחלה, כי אפונה מאד אילי בעלי הוא, אשר חמק עבר ממני זה כעשר שנים, ועקבותיו לא נודעו; כי גם שמו הוא ברוך, ושנותיו הגיעו לערך ארבעים שנה, אפס כי שם משפחתו הוא „פאנטאָפעל"" לא אבער, אך אולי הסב את שם משפחתו לשם אבער. לכן אחלי אדוני המו״ל יודיע נא זאת ברבים ובטח יגיע דברי גם לאזני עקיבא חשמל, ואז אולי ידע להתחקות על שרשי הדבר הזה אל נכון, כמו: שם אביו, שם אשתו, שם עירו, וכמה יתומים ויתומות השאיר אחריו, או שאר סימנים אשר יהיו לנו לעינים אל הדבר הזה. דברי האשה הנעצבת, רחל בריינע בת ארי׳ צבי מעיר לאזרייא"
021-HZF-1877-11-14-001-40343_toc_12,,"   „דבר חדש"" לוח עברי בשפת רוססית לשנת 1878 למספרם, כולל : מלבד סדר הימים והשבתות והמועדים והחנים אשר לב״י: א) ראשי הימים בתולדות היינו מבריאת העולם עד הזמן הזה, ב) דברים נחוצים וכוללים ע״ד הלוח העברי וענינו ג) פתרון ובאור כל חג ומועד. בקצור נמרץ, וד׳) זכרונות לנפשות חכמינו ורבנינו שהלכו לעולמם בחמש שנים האחרונות ע""י ח״י גורלאנד הוכן והובא לדפוס - וה . כל הרוצה היושב ודורש בזיטאמיר. מחיר הלוח הקטון הזה 10 קאפ׳   לאספו הביתה יפנה בטובו אל המו״ל הנזכר ויקבל המבוקש, זה הוו: ג . И. Гурлинду въ итошръ"
021-HZF-1877-11-14-001-40343_toc_13,,"  5  מי החפץ בספרי „אוצר נחמד"" אשר יצא עתה לאור בדפוס המשובח של ר׳ י״ל מ״ל בווילנא, כלול בהדרו, המדבר מעניני ידיעות העולם והטבע, יפנה אלי כפי האדרעססע הרשומה למטה, מחירו לאחדים 50 קאפ. עם פארטע, והקונים ה סך מסוים למסחר ישיגו ראבאט כנהוג.  נחמיה דוב האפפמאנן   И. Госнану, въ м. Кршвилки черезъ М. Цорбургъ Ков. губ. Редакторъ-Пздатель S. Слоцинскiы"
021-HZF-1877-11-14-001-40343_toc_14,," כל המוכים במחלות אשר מוצאן מי הילדות, כמו חסרון כח המוליד וחלישה העצבים (אימפאטענץ אונד, גערווענשוועסע) וגם המוכות במחלות נשים, ימצאו מות ותרופה על ידי. גם לחולים מערים אחרות או מארצות רחוקות אמציא מזור ותרופה בכתב, אחרי אשר יודיעוני מחלתם וכל אשר יחסר להם בכתב, אשיב לאוש ואיש בכתבו וכלשונו (ר״ל בלשון עבר, אשכנז או צרפת). אדרעססע: M. Wollner, Doctorder Medicin u. Chirurgie. Accoucheur in Wien. Wien, Stadt, Adler-gasse № 8."
021-HZF-1877-11-14-001-40343_toc_15,," שאלות ותשובות אל... הס' דברי חכמים בלתי נמצא בידט. אלב ע' כ' מאמרו בלתי ישר בעינינו, ובהיותו לא כמציע דברים לפני הקהל, רק כעומד על המצפה בהצפירה לאומית לבני עירו בפרי כל הקוראים?"
021-HZF-1877-11-14-001-40343_toc_16,, ―  הרוצה לכתוב אלי יכתוב ע״פ אדרעססע S. Sionimski in Warschau  Muranowska № 24. S. Сбинискiй г. Варшава Мурановская № 24. . . ;:   ב
