article_id,headline,text
021-HZF-1883-07-31-001-10215_toc_8,דובנא. קול קורא!," דובנא. קול קורא! מי האיש מכם, קוראים אהובים, אשר לא ידע את שם הגבר הנעלה המליץ ומשורר הרב א. ב. גאטטלאבער? מי מכר לא התענג על נפת צוף שיריו הנשגבים ולא שבע נחת מספריו היקרים? זה כחמשים שנה כאשר הוציא לאור את ספרו הראשו „פרחי אביב״, ומהעת ההיא עד היום הזה לא חדל מכתוב מהפיץ תבונה, חכמה ודעת בקרב עמנו. שמות ספריו אשר הדפיס עצמו מספר וגם שנים רבות שלה דבריו ביעקב על ידי מכתב עתו „הבוקר אור"" ובכל מכתבי העת בשפת עבר הרבים והשונים אשר יצאו לאור במשך החמשים שנה האלה אין אחד אשר לא לקח הוא חלק בו ואשר לא התנוססו בו שיריו ומאמריו לגאון ולתפארת. כל אלה תדעו גם אתם, קוראים נחמדים, ולמותר לי לפאר לרומם את האיש הזה אחרי כי תהלתו מלאה כל הארץ ושמו מרומם בפי כל אחינו חובבי שפת קדשנו היודעים אותו, אך את מצבו ומעמדו עתה לעת זקנתו אחרי כל עבודתו בשדה-ספרותנו ואחרי כלה כחו ואונו להיטיב ולהשכיל את עמנו! אם לא תדעו זאת אגיד לכם אני כי בעיר מגוריו אני יושב ועיני תראינה את כל אשר אתו מצבו רע מאד אחרי נשבר מטה לחמו בהסגר בית מדרש הרבנים אשר הוא היה בו אחד מראשי המורים, ואחרי כי חוש גוו רופפו מזקנה ואין לאל ידו לכתת עוד את רגליו ולנסוע מעיר לעיר לבקש עזרה מנדיבי עמנו בצר לו. גם העזר התמידי אשר אמרו בעיר המלוכה לעשות בעבורו במלאות לו שבעים שנה, היה לאפס ואין אחרי משוך החוקר קדמונית החכם הגדול והיקר ד״ר א. הרכבי את ידו ממעשה ופעלי חברת מפיצי ההשכלה ובין העומדים בראשה לא ימנה. הדבר הזה חרפה היא לנו לעזוב את ראש משוררינו ובחיר, סופרים בעניו מבלי עשות מאומה להיטיב את מצבו ולכלכל את שיבתו ולשלם לו מעט מהרבה אשר הגדיל לעשות לספרותנו, האם נדיבים אין בנו? האם ספו תמו חובבי שפת קדשנו בקרבנו? לא כן אנחנו עושים ועלינו להיטיב את דרכנו. לכן ש  נדיבי עמי, אילי הכסף, והקשיבו לקולי אוהבי שפת קדשנו. ספרים הרבה הוציא הרב א. ב. גאטטלאבער לאור, אך רבים הם עוד הספרים אשר אתו בכתובים ובתוכם ספר „שירי מהללאל״ המכיל בקרבו שירים רבים חדשים וישנים אשר שר בעתים שונות בנוח עליו רוח השיר. את הספר הזה יחפוץ להפיץ בקרב עמנו, ואנחנו אם נעזור על ידו ונתן כסף למפעלו זה נעשה טוב עמו, כי ממחיר הספר אחרי כן יאכל וישבע וישכח רישו, וזה הדבר אשר תעשו: כל נדיב אשר ספרות ישראל וסופריו יקרים בעיניו, ישלח דמי קדימה, הממעיט לא ימעיט משני רו״כ, כי הספר „שירי מהללאל"" יכיל בקרבו כעשרים עלי דפוס, והמוסיף כפי אשר תשיג ידו יוסיפו לו ברכה חיים וחסד מהשמים את מכסת הכסף ישלחו המתנדבים לדובנא, מקום מושב המשורר לידי הגביר הנכבד הישיש ה׳ מאיר שומסקי אשר נתן לבו לדבר הזה — וכאשר יהיה הכסף למדי יצא הספר „שירי מהללאל לאור וכל החותמים עליו יקבלו איש איש ספר אחד ואתם סופרי ישראל החכמים והמורים אשר בכל עיר ועיר והאנשים אשר דבריהם נשמעים, שימו נא לבכם לדבר הזה, דברו נא על לב אנשי החסד אשר בעירכם והזכירו להם את שם משוררנו הנעלה ואיש לא ישיב את פניכם ריקם, כי עמנו עם עושה צדקה וחסד ומוקיר סופריו ושפת קדשו, כן עשיתי גם אני אספתי פה דובנא על הדפסת הספר „שירי מהללאל"" יותר מחמשים רו״כ המונחים עתה בידי הגביר ה׳ מאיר שומסקי. ה׳ מרגליות, רב מדובנא פראגא (סמוך לווארשא) בליל ב׳ פ׳ פנחס יצאה אש ותאכל כמה בתים עד היסוד אשר יושביהם נשארו בעירום ובחוסר כל, כי נגזר אוכל מפיהם, אין לחם ואין שמלה ואין מחסה. אמנם כן יושבי פראגא לא קפצו את ידיהם מאחיהם האביונים, אבל אין הקומץ משביע וכו׳ ע״כ אחב״י החישו להביא נדבותיכם בעבור הנדבאים והאומללים האלה, והיה מעשה הצדקה שלום. הישרים בלבותם ישלחו נדבותיהם ע״י המו״ץ הרב ר׳ ישכר טעננענבוים בפראגא...... אהרן טעננענבוים"
021-HZF-1883-07-31-001-10215_toc_9,חדשות שונות," חדשות שונות (הצופה בתהום הים) בשער המצבה הנכון להיות בעיר ניצצא בשנה הבאה, ימצאו הנוסעים שמה לראות על חוף ם התיכון דבר נפלא מאד אשר המציא חכם אינזעניר אחד טאזעללי, והוא כדור באללאן אשר ישוטט בעומק הים, עם אנשים אוהבי מראות הטבע החפצים להתענג על חזיונות נפלאים שבתהום הים הכדור הזה גבהו י״ב אמות, והוא בנוי מברזל מוצק ונחושת וזכוכית עב וחזק, בכדי שיוכל לשקוע במים עד לערך מאתים אמה בעומק, מבלי שיהיה נכבש ונשבר מרוב לחיצת המים הלוחצים אז ברב כח בעומק כזה, (כי אז יהיה כובד הלחיצה על שטח כל אצבע מרובע ממנו, כדי משקל 160 ליטרות כנודע). הבאללאן הזה נחלק בתוכו על תחתיים שניים ושלישים, העליה הראשונה שלמעלה הוא מקום רב החובל אשר בידו כל הנהגת הבאללאן, למטה ממנו בעליה השניה מקום פנוי ורחב לשמונה אנשים הנוסעים, החפצים לראות דרך החלונות הגדולים אשר מסביב את כל עומק הים ונפלאותיו אשר במצולה, כל מיני הדגים הרבים והמשונים המשוטטים בו, מיני החיים ההולכים ורוחשים על קרקע הים, הצמחים הגדולים והרבים אשר יגדלו שמה הסלעים והכפים הגבוהים וכו׳, ולאשר בעומק הגדול יותר מן 180 אמות, כבר חשבו מאורות השמים שמה מבלי לראות כל מאומה, ואור היום נהפך ללילה, ע״כ נכונה שמה מנורה עלעקטרית המפיצה אור חזק על כל סביבות הבאללאן דרך חלונותיו הגדולים. — ואולם המדור התחתון הוא מיוחד רק לכלי המעכאניזם, והמכונות הפועלים להחליף תמיד את האויר שבתוך הכדור, ועל ידיהם יוכל רב החובל גם לפעול על הבאללאן שיעלה ויצוף יותר למעלה, או ישקע יותר למטה כפי חפצו כל הכדור הזה הוא נאחז וקשור לאנית הקיטור ההולכת למעלה על פני הים לתור לפני הנוסעים המקומות בים הנאותים יותר לחפצם, ומן הבאללאן יוצא גם חוט טעלעפאן אחד אל האניה אשר על ידו יכול החובל והנוסעים עמו לדבר עם יושבי האניה אנה יסעו ואיפה יחנו, אם עלו למעלה ואם ירדו למטה וכדומה הנה כי כן פרץ רוח אנוש בארץ ויעבור גבולות עולם, יעלה שמים ירד תהומות, וגם חשך לא יחשיך ממנו, ידו על כל חית הארץ, יהלך בין תניני הים, וידו בכל משלה!  ווארשא (ציון לנפש) אל שמועה כי באה מסובאלק נמס לבי ונפשי עלי תאבל, כי עלה הכורת על ראש נזיר אחיו המיוחד בגבירי עדתו הנכבד ומפורסם שלשלת היוחסין כמו״ה ולמן אייזענשטאדט בן להרב הגאון מו״ה צבי הירש אייזענשטאט מווילנא בהגאון המפורסם מו״ה אברהם משה בהגאון הגדול ר׳ דוד אב״ד דק""ק מיר המנוח ז״ל קבע עתים לתורה ולתעודה, והיה ירא אלהים מנעוריו, משכיל בקי בשפת קודש וספרותה, וגדולה האבדה אשר אבדה קהלתו, בעצם ימיו בשנת החמשים ושתים לימי חייו. ביום י""א לחודש הרביעי הנחילו לו את הכבוד הגביר המפורסם ר׳ משה עדעלמאן נתנה לצדקה עבור נשמתו לביה״ח, לתקון בהכנ״ס, לבית הת״ת וליתר מעשה הצדקה, ס״ה אלף ומאה רו״כ — יהי שמו לזכר עולם בעלי הצפירה, ותנצב״ה. צל״י ווארשא (אסון נורא) האשה הכבודה שרה רבקה אשת ר׳ אליהו ווילנער נ״ע מפה, נסעה לעיר ווילנא לדרוש שם בשלום חתנה ה׳ ברענער ואשתו ויהי ביום ג׳ פ׳ מטות לעת ערב הלכו שלשתם לשוח בגן הבאטאניק שמה, ופתאום התקדרו השמים בעבים וגשם שוטף נתך ארצה, ויבקשו למו מחסה תחת דליות אילן גדול רב הענפים, והנה התחולל רוח חזק מאוד וישרש את האילן ויפול על שלשת האומללים ההם יחד. האשה אשת ברענער מצאה את ידה לצאת מתחת האילן ולקרוא לעזרה, אבל אמה האשה שרה רבקה אחרי שבעה מכאובים נוראים מתה, חתנה ה׳ ברענער שבר רק את רגלו הימנית אשר לדברי הרופאים אחר איזה ירחים ישוב וירפא לו, וגם אשתו מרת העניע אשר היא קרובה לעת לדתה, מרוב הפחד והעמל נפלה למשכב, אבל יש אפו״ד תקוה כי בקרוב תשוב לאיתנה."
021-HZF-1883-07-31-001-10215_toc_10,," מודעה בעזהי״ת יצא לאור מבית דפוסי, ספר אבן ישראל, להרב הגאון מוהר״ר ישראל ליפקין זצללה״ה, המפורסם בכל קצוי ארץ בשם ר׳ ישראל סאלאנטער כולל רובי דרשותיו הנעימים, ביראת ה׳ מוסר השכל, ומדות טובות. גם איזה חדושי תורה בש""ס ופוסקים, כל אשר נמצא ממנו בכתובים ואשר סמך ידו על תלמידו הרב הגאון מוהר״ר שניאור זלמן נ״י אבדק״ק גאלדינגען, להדפיסם, בפי מכתב י""ק הנדפס בראש הספר. — ונלוה לו קונטרס אבן ון מהרב הגאון מהרש״ז הנ״ל, איזה דרושים ושו״ת, אשר נתן להדפסה למבחן, מספרו אשר אתו יצחק גאלדמאן מדפיס בווארשא בכתובים. М. Гольнынанъ Варшава, Мурановская № 16. J. Goldman Warszawa Muranowska № 16."
021-HZF-1883-07-31-001-10215_toc_11,," הודעה ע״ד האתרוגים נכונים אנחנו לקבל קאמיסיאן מכל החפץ להשיג ע״י אתרונים מכל הסארטין קארזיקאנער, אתרוני א""י עם פיטמות ובלא קאראפירער, גענווער, מאראקער פיטמות. וגם לולבים והדסים ירוקים ולחים, כפי מחירם בטרייעסט, ובתוספת קאמיסיאן מעוטה. וכפי אשר הודענו  בשנים קודמות, וגם אשתקד אשר מחיר האתרוגים הי' ביוקר, לא העלינו במחיר הקא וסיאן, והננו נכונים לשלוח סחורה טובה לכל דורש גם ע״י נאכנאהמע בשלחו אלינו אויפנאבע, וביד כל אדם להריץ אלינו מכתבו, כל מקוממאשר יחפוץ וכפי האדרעסין ולמטה, ונקוה להפוק רצון מכל הדורשים לעשות מסחר עמנו האחים אהרן ואברהם בירגער במינסק Арону Виргеру въ г. г. Минскъ אדרעס למינסק Abran Burger in Tricst Oestrich. אדרעסע לטרייעסט"
021-HZF-1883-07-31-001-10215_toc_12,," יצא לאור ס׳ אב לבנים מאת אליהו נייווידעל, מחירו 35 קאפ׳. (המחבר הזה הנודע לאומן פדגוג יצא בעקבות אביר חכמי פידאגאגיג קאמפע, ויתן חנוך לנער במוסר השכל ערבים ושוים לכל נפש, לשונו צחה וניבו נאוה במאד, והמקראות ומאמרי התלמוד אשר יעלו בה בלולים ישיתו עליה לוית הן. המו״ל) אדרעסע על נייווידעל  ווארשא, וואלינסקי No. 11 או אצל המו״ס הנודעים פה"
021-HZF-1883-07-31-001-10215_toc_13,," צא לאור ספר „הנוסע"" המכלכל מאמרים וענינים שונים מידיעות העולם היבים והטבע מעלפים בספורי מסעות (רייזעבעשרייבונגען) נחמדים אף נעימים המר אוזן שומעת, המשמחים לב והמושכים נפש להתענג על מפעלות תמים דעים בשמים ממעל ועל הארץ מתחת, מחזיק 16 דרוקבויגען. מאת נחמיה דוב האפפמאן מח״ס „אוצר נחמד"", וס׳ „תולדות חכמי הבאטאניק״ מחירו על נייר פשוט 1 רו״כ ועל נייר רעגאל 1 רו״כ 50 קאפ׳. הרוצים בספר היקר הזה, יפנו במחירו אל המחבר על האדרעססע הרשומה מטה וישיגו חפשי אדרעססע: מפארטא במוקדם. . Гоаману, въ М. Повонъсто Ков. губ. россiенскаго утада N. Hoftmann, in Neustadt, Pub. Kowno, Russland. (המחבר הזה כבר נודע במאמריו המחוכמים בכל מכ״ע העברים הוא מדבר בשפה ברורה וקלה בכל עניני הידיעות ההן ויודע לבחור את הטוב והנאות לרוב הקוראים)"
021-HZF-1883-07-31-001-10215_toc_14,," אין לך מקום הבריאות לחולה ומבקשי מנוחה כעיר ניצצא במדינת צרפת, גן אייראפא, ויסדתי בית נאמן להאורחים כפי האדרעססע שלמטה, הידיעות מעניני הבריאות של (לונגענליידען או בלוטשפוק קען) או מן דירות גדולות וחדרים ממקחים שונים, או מסחרים דפה והסביבות, ישיג כל דורש ממני ע״י מכתב עם 3 רובל או 10 פראנק שישלחו אלי פראנקירט, הכהן הקטן מאחיו פ׳ מושקאט, נודע בווילנא וקען ובתים נכבדים ברוסיא אשכנז וצרפת ובסובאלק ובבא Hotel Willa Speranza Rue st. Btienne 21. a Nicce."
021-HZF-1883-07-31-001-10215_toc_15,," בית מחסה ליולדות . הוא כעת ברחוב פלעסקא 20 .    הנני להשיב לשואלי דבר ע""י פאסט במהר האפשרי. בכל ספראווקעס הדרושים לו, הן בסענאט, והן בכל מקומות המשפט דפ״ב. ושכרי מכל ספראווקא רק שני רו״כ. ממכירי אשר ידעו אמונתי, ותום דרכי, הנני לקבל עלי לעמוד לימי רקם בכל מקומות המשפט פה, ולהביא לידי גוביינא תביעתם מחברות מסילת הברזל פה, עבור המחיר אשר נשווה בינינו לפי איכות וכמות הענין, ובעז״ה אפיק בטח חפץ Сануилу Мееровицу Гинибергу въ Петербургъ. ורצון כל איש אדרעססא гоъ Вознесенскiя и Вкатернигоаскiй, дошъ Лихачева № б. кв. № 36."
021-HZF-1883-07-31-001-10215_toc_16,," זה שנה ומחצה עזבני בעלי חודש ימים אחר חתונתי גם כספי לקח עמו ונשארתי בעירום ובחוסר כל וזה כתשעה חדשים אשר ילדתי בת, ואלו סמניו: שמו יצחק בן אברהם אליהו כ״ץ, שנותיו ל״ב, שערות ראשו וזקנו צהובות (בלאנד) קומתו ממוצעת, מלאכתו טאפצירער גם זאטלעראיי אשר למד מלאכתו זאת בקעניגסבערג ע״ח הקאמיטעט דשם, באחרונה קבלתי מאתו מכתב מקעניגסבערג ומאז נסתם כל חזון ממנו, ועתה שמעתי כי הוא בנוי-יארק, כל היודע ממנו יחוס עלי ועל בתי ויודיעני על האדרעססע של הרב הגאון מוה׳ משח אריה ראבינאוויץ אב״ד דפה. נעסא בת ר׳ לייב הירשאוויץ כנים דברי האשה. נאום משה אריה במוהרא״ז הלוי החופ״ק יאנאווא פלך קאוונא."
021-HZF-1883-07-31-001-10215_toc_17,," אל סוחרי האתרוגים אזכיר מסחר האתרונים ליודעי ומכירי מכבר, ולכל החפצים לבוא עמי בברית מסחר מחדש לקנות בעדם כל מיני אתרונים ארץ ישראל, קאראפירער אניווער, ומא- ר, וכן לולבים והרסים בעד שם קאמיסיאן קצוב, וכל החפץ בי יפנה אלי כפי האדרעססע דלמטה נפתלי משכיל לאיתן Паттоло Маскилерсону въ губ. г. Минскъ."
021-HZF-1883-07-31-001-10215_toc_18,," בימים האלה אדפים רשימה חדשה ואקנה כל הספרים אשר לא נמצאו בביו מסחרי ואבקש את פני המחברים והמוציאים לאור אשר יאבה בחסדם לשלוח לי ספר אחד מהספרים אשר הוציאו לאור ויודיע המקח הקצוב למו״ס, ואקנה אי״ה מספר עקסעמפלארים מכל ספר A. Paust, Buchhandlung Krakau."
021-HZF-1883-07-31-001-10215_toc_19,," דאקטאר ש. סלאנימסקי נאך לאנגערער צייט פיר וויססענשאפט- ליכע צוועקען אים אויסלאנד וויילענד איסט צורריק אין ווארשא וואהנהאפט Nאויף קראשינסקעס פלאטץ 3 ט אונד ניממט אויף קראנקע מארגענס ביז 12 אוהר, אונד פאן 3 ביז 6 אוהר נאכמיטטאג.  ר"
021-HZF-1883-07-31-001-10215_toc_20,," איש צעיר בקי בתנ״ך ודקדוק, יודע השפות: עברית, רוסיש פאלניש, אשכנזית ידע חשבונות יב ז להיות מורה לש  או שמרת בבית אחד הסוחרים. ועל ישרתו וחריצות מפעלו יעידו יודעיו אשר בזמן קצר ראו בלמדו אור ההש כלה. לדרוש No. 14 בחנות ה׳ משה ווינער נאלעווקי  א. קאנעלבוים"
021-HZF-1883-07-31-001-10215_toc_21,," בבית מסחר ספרים שלי נמצא למכור ספרי מלים ה׳ שמיד, דפוס לייפציג הוצאה האחרונה, רוסיש דייטש דייטש רוסיש פארמאט גדול. מקחו בלייפציג 9 מארק אוזיל עד 50 3 רו״כ, פארמאט קטן מקחו בלייפציג 50 3 מארק, אמכור 150 עם פארטע, מ״ס ראבאט כנהוג. Кним. Магаз. . Каганъ אדרעססע שלי въ г. Вѣлостокъ"
021-HZF-1883-07-31-001-10215_toc_22,," עכטע זיידענע שווייצער מיללער-גאזע פיר מיללער, אויך בוימוואלל ענעס אונד וואללענעס גלאססע, האנדשוה, פוטטער פיר האנדשוה פאבריקאנטען, עמפפעה ט SS. Wachholder Warshau Nalewki 9"
021-HZF-1883-07-31-001-10215_toc_23,," שאלות ותשובות לה׳ בנימין בלומענטהאל איננו חתום אצלינו ויבקש מאת הסוכן שלקח ממנו, לה' או""ר בנומ' הבא לה׳ יהודא ליב קאסי׳ הס' כוכבא דשביט אין א עוד, לה׳ ז' בביא' בנו' הבא, וכבר אמרנו שמן הנומ' הראשונים, תשרים לנו."
021-HZF-1883-07-31-001-10215_toc_24,, אדרעססא שלנו Редактору газ. ГАПEонрA З. Сонинскому Варшава S. Sionimski W Warszawie. Dzika No 253
