article_id,headline,text
021-HZF-1875-03-24-001-20089_toc_1,, e 85   מחירו באשכנז:  14 רייכס מארק לשנה. קן ם בעסטרייך 8 פלי לשנה. 5 וכן לרבע שנה. שכר מודעות: מכל שורה 20 פפ'. S
021-HZF-1875-03-24-001-20089_toc_2,, S  ברוסיא ופולין. לשנה 6 רו״כ.  לרבע שנה 1.50 רו״כ. ביתר הארצות 20 פראנק.  באמעריקא 5 דאללאר.  H
021-HZF-1875-03-24-001-20089_toc_3,מכ ע תב ת י מ ^ ן י ע ש הד ו ת | יי . ר ...," ל מכתב עתי משמיע חדשות ר ו בקרב עם ישרון מכל הרבו ים הנוגעים בעניני המדינות, אהר דברי חכמה ומדע, ידיעות והטבע.  לד יוצא לאור אחת בשרוע, מאת   היים זעליג סלאנימסקי.  מ. .  "
021-HZF-1875-03-24-001-20089_toc_4,,"  לשנה הנוכחית, וע״כ נבקש מאת כל אלה אשר לא שלמו אל הקוראים הנכבדים! הגליון הזה הוא האחרון לרבע הראשון עדיין בעד העבר לשלוח את המחיר המגיע מהם ליד מי שקבלו ממנו, אם אל הסוכן שבעירם, ואם אל הרעדאקציע, והחפצים לכתוב את ידם אל הצפירה ברבע הבא, יטיבו בחסדם להקדים דמי חתימתם עליה למען יגיעו העלים לידם על  הסדר בלי הפסק. א"
021-HZF-1875-03-24-001-20089_toc_5,"E
תוכן הענינים."," E תוכן הענינים. דברי הימים. ענגלאנד: לאנדאן, רוססלאנד: הוראדנא. ביא. ליסטאק. מאזיר. רומעניען: פאלטישען. ידיעות העולם והטבע: צי אדיר: מאת המו״ל. האויר והתחלואים: מאת יוסף ליב זאסניץ. נסיעה באיי הים הגדול: מאת משה יחזקאל גוטפארב. חדשות שונות. מכתב: מאת אברהם אליהו הרכבי. הודעות:"
021-HZF-1875-03-24-001-20089_toc_6,דברי הימים.," דברי הימים. (אשכנז.) בשבוע הזה נשאו ונתנו בבית מועד הנבחרים בדבר החקים החדשים אשר הממשלה אומרת לכונן ביחס אל הכהנים הקתולים. כמעט כל בני המפלגות השונות לקחו חלק בהמשא ומתן הזה. הליברלים, והם העומדים כעת לימין הממשלה ושלום להם עם הנסיך ביסמארק מתנגדם ואיש ריבם מלפנים, תמכו את חקי הממשלה בכל עז באמרם, כי כבר מלאה סאת המרי של הכהנים הקתולים וקשי ערפם, ועת להממשלה להשיב להם כגמולם. ההולכים לפנים (פארשריטספארטייא), מראש לא בסתר הגידו, כי אין דעתם נוחה ממעשי הממשלה בכלל, להתערב בעניני האמונה, ולעשות איזה אמונה שתהיה שלטת בארץ, כי אין להממשלה להיות אפטרופוס להעם בדברי אמונה ולשלם שכר לכהני הדתות, וגם הדת הפרוטיסטנטית בכלל, רק הקהלות בעצמן תתנה משכרת הכהנים, אם תרצינה; נקל הוא להבין כי בדבר החק החדש נתנו צדק לפעלי הממשלה ויחליטו, כי באמת ע   א  אין להממשלה לשלם כסף מאוצרה לאנשים אשר כל מגמתם להפוך סדרי המדינה, המקריבים את אושר ארצם על מזבח אהבת הכבוד והשררה הממלאה את כל חררי לבב פיוס התשיעי. אמנם מובן מאליו, כי יושבי המרכז, והם הקלריקלים, התנגדו אל החקים החדשים בכל לבם ובכל נפשם, ואחד מהם לא ידע בשת להחליט, כי נחוץ לקרא מעל הבמה באזני כל הנבחרים את מגלת פיוס התשיעי הידועה, אשר כמעט בשלה כל הרעש הזה, ואחרי אשר לפי חקי בית הנבחרים לא יכל היושב ראשונה להשיב פני בקשתו ריקם, על כן עלה האדון ההוא על הבמה ויחל לקרא מעל המגלה את החרם הגדול אשר הטיל האפיפיור על ממשלת אשכנז והכהנים השומעים בקולה. הדבר הזה העיר רעש גדול בבית הנבחרים, וכמעט כל הנבחרים החישו לעזוב את הבית, לבלתי שמוע באזניהם מוסר כלימתם מפי מנדיהם ואנשי ריבם. ראש יושבי המרכז ווינדהארסט, אשר כבר עשה לו שם בין המהפכים בזכות האפיפיור וקדושיו, עלה על הבמה וימטיר דברים קשים כגידים על ראש הממשלה, וביותר על ראש הנסיך ביסמארק אשר נתנהו לאויב האמונה ולצורר את הדת הנוצרית בכלל. אמנם ברגע ההוא הופיע הנסיך ביסמארק בעצמו בפתח הבית, והליברלים אשר כהתה עינם מכעס לראות את שם ביסמארק מנואץ בפי אחד הקלריקלים, מהרו לכפר פני הנסיד וידיעו תרועה גדולה לכבודו, והקלירקלים גם הם הריעו לעמתם, לבלבל את קול תרועת שמחתם, ויהי רעש וסאון בבית; והנסיך ביסמארק עלה גם הוא הבמתה ויען בדברים נמרצים, אם גם מהולים בשחוק והתולים, על דברי הנבחר ווינדהארסט, ובסוף דבריו אמר, כי תקותו חזקה, אשר במשך ימי המנוחה לסבת החגים תתישב דעת הנבחרים, כדי שיהיו אחרי זה, בשובם להתיעץ שנית בדבר החקים יותר צלולים בדעותיהם ויותר מתונים בדינם. אבל, אחרי כל טענותיהם של הקלריקלים והשתדלותם, הנה לבסוף נתקבלו החקים החדשים ברוב מנין.   זה לא כביר הודיעו מ״ע רבים באשכנז, כי שלחה הממשלה את דברה אל ממשלת אטליה ותדרוש מאתה לשים מתג ורסן בפי פיוס התשיעי, לבל יוסיף לסכסך את עם אשכנז איש ברעהו. ולהעיר את חמת הכהנים על הממשלה. והנה רבים אמרו, כי מתאנה ביסמארק לממשלת אטליה, בדרשו מאתה דבר לא תוכל עשוהו; אחרים הגידו דעתם, כי ידים נתן ביסמרק בזה לממשלת אטליה לכלות חמתה בהאפיפיור הנצב לשטן גם על דרכה; אבל יש אשר גם בזה לא נחה דעתם ויחליטו, כי שקר הדבר מתחלתו ועד סופו. המה״ע Post הודיע, כי יודע הוא על נכון, כי נאמנים דברי השמועה הזאת וביום ההוא בעצמו באה ידיעה ע״י התלגרף מעיר רומא, כי ציר ממשלת אשכנז באטליה הבטיח, כי לא ידע מזה מאומה. ועוד לא נודע עם מי הצדק. (עסטרייך.) לפי דברי מה״ע יסע קיסר עסטרייך בימים האלה לווענעדיג להתראות שם פנים את וויקטאר עמנואל מלך אטליה. גם על החדשה הזאת התנפלו שואפי חדשות ימצאו בה פנים לכאן ופנים לכאן. המה״ע הצרפתים העיונים את אשכנז אומרים, כי חפץ פראנץ-יוסף להזהיר ולהתרות את מלך אטליה לבל יבטח באהבת אשכנז, אשר היא איננה תלויה בדבר הקרילקלים מבטיחים, כי מאת החוזה הזה תצמח להם טובה גדולה אבל מי יודע אם בכלל יצרור החוזה הזה חדשות בכנפיו? ואם אמת גם בפי השמועה, כי אחרי זה יתאספו שלשת קיסרי איראפא להתראות פנים בקרלסבאד גם אז לא נדע, אם יביא הדבר הזה שנוי ותמורה במצב הענינים באיראפא (פראנקרייך.). בימים האלה הודיע ה׳ ביופעולפני נבחרי האספה הלאומית את המטרה אשר הציב לו המיניסטריום החדש אשר תחת פקודתו ואת הדרך אשר הוא אומר ללכת בו. לפי דברי ביופע, הנה עתיד המיניסטריום להחזיק בנושנות בכל עז; אף נכזבה תקות יושבי השמאל והארלעאניסטים, כי יצרור המיניסטריום החדש את הבנפרטיסטים וישים מעצור לרוח ערמתם ומומותיהם, כי בענין הזה לא דבר ביופע מאומה. יושבי השמאל, אם כי לא מצאו דברי ביופע חן בעיניהם ואין נפשם אל הדרך אשר סלל לו המיניסטריום, בכל זאת לא יחפצו לסכסך את הענינים כעת ומסתפקים המה עדנה בשם „רפובליק"" אשר ממשלת הארץ תשא אותו על דגלה. אבל אם יוכלו לשקוט במכונם גם בראותם עין בעין, כי תחת שם רפובליק עושה הממשלה מעשים המתנגדים לרוח הרפובליק מן הקצה אל הקצה, קשה להגיד מראש; גם אין הדעת נותנת, כי ישים המרשל מאקמאהאן מעצר לרוחו השואף לנושנות ויבטל מעט את רצונו מפני רצון רוב הנבחרים, כדי שיהי רוח ממשלתו מתאים עם השם: נשיא הרפובליק אשר הוא נושא. אי לזאת לא יוכלו כל האוהבים ארץ מולדתם בצרפת לעשות שקר בנפשם ולנבאות עתידות טובות להרפובליק. (שפאניען.) ודון אלפונסו יושב אל עקרבים בספרד תחת השושנים והפרחים אשר קוה לראות מפוזרים על דרכו. אותות האהבה והחבה היתרה אשר הראה להקלריקלים וכל מת סודם הרחיקו ממנו את כל אוהבי החרות וההולכים קדימה. ובראות הכהנים אשר היתה אהבתם אליו אהבה תלויה בדבר, כי סר לב הליברלים, אשר הם פנות העם ורביו, מאחרי המלך, ולרגלי הדבר הזה יהי המלך חסר כח ואין אונים, וישובו גם המה לנהות בסתר אחרי דון קרלוס; ובכן ילך דון קהלום הלך וחזק, ודו אלפונסו הולך ודל. ויהי כראות אם המלך כי רפו ידיו ותשלח לו את אחותו הבכירה להיות לו לעזר בעניני הממשלה. אמנם מד תושיעהו אחותו זאת אשר גם היא כרוכה אחרי הקלריקלים בכל לבה? בין כה וכה, הנה המצב הולך ומתבלבל ותלונת העם הולכת ורבה."
021-HZF-1875-03-24-001-20089_toc_7,ענגלאנד," ענגלאנד לאנדאן, אדר שני. אם אמנם ימצאו אנשים אשר לא ידעו ולא יבינו את תועלת ידיעת המספרים (סטאטיסטיק) בתהלוכות בני האדם, אבל מעטים המה לעומת האנשים ההם היודעים כי רק בידיעת המספרים נוכל לדעת מצב הצלחת הארץ ויושביה, אף גם המספר אשר הנני נותן היום לפני הקוראים יופיע אור על מצב אחב״י בלאנדאן בכלל, ועל אחיהם הרוסים והפולאנים בפרט. מספר הדרשות אשר דרש פה הרב המפורסם ה׳ דיינאוו מעת בואו הנה (בקץ ירח סיון העבר) עד כה, היה קרוב לתשעים, מספר הנאספים לשמוע אותו בכל פעם המה כאלף איש ויגיע לס״ה תשעים אלף! רוב הנאספים המה ילידי רוסיא ופולין, בתוכם גם אחינו הבריטאנים וילידי אשכנז. טרם בא הרב לפה הי׳ דרך אחינו הרוסים והפולאנים אשר רובם המה מכת הישנים וארטהודוקסים), להתאסף בכל יום שבת ברחוב ווייטשעפעל מהם גם לבושים בבגדים ארוכים כמנהג בני ארצם, לבלות את היום כדבור, שחוק, וקלות ראש, שמה האומנים תופרי בגדים באו למצוא פועלים לעבודתם, גם נערות מוכחלות ומקושטות באו שמה לבקש ולמצוא רעיהן, תחת אשר אחרים כיהודים כנוצרים באו לבקש את המקום לראות המחזה המוזר ההוא, כן גם סופרי מכ״ע באו שמה למען הודיע אח״כ במכ״ע את אשר בעיניהם ראו ובאזניהם שמעו, ומלבד חילול שבת החמור גדול היה מאוד חילול השם לפני הנוצרים אשר שמעו כי אנשים האלה יהודים המה אשר באו הנה מארץ פולין ורוסיא, וזה דרכם מדי שבת בשבתו להתאסף פה ברחוב לבלות העת, לגמור עסקים, וכדומה. שוטרי העיר (פאליצייא) העומדים שמה על משמרתם נהר גרונם מלקרוא אליהם פעם בפעם: גשו הלאה! לא תסגירו נתיב הרבים! כי לא יכלו לעמוד נגד המחנה הגדולה ההיא, ובזה יתאר נא הקורא מעצמו את גודל החרפה והבזיון אשר האנשים האלה הביאו עלינו בכלל ועל אחיהם הפולאנים בפרט. רבות נסו אחב״י הנכבדים פה לעצור בעד הרעה ההיא ולא הצליחו, עד אשר זרח השמש ויבא מרוסיא הרב ה׳ דיינאוו, ומיד כאשר התחיל לדרוש בבהכ״נ ראשונה, אנשים למאות ולאלפים רצו לשמוע את דבריו הנעימים, כקטן כגדול, כעשיר כדל כולם התענגו בנופת צוף דרשותיו המתוקות, ובפה מלא קראו אחריו לאמר זה ינחמנו, אין פרץ ואין צוחה עוד ברחוב ווייטשעפעל, ותחת להתאסף ברחוב ילכו לבהכ״נ, תחת לשמוע שיחות בטלות ישמעו דברי תורה, חכמה, מוסר וד״א. דבר גדול עשה לנו הרב בזה, וכל אדם אשר כבוד עם ישראל יקר בעיניו עליו לקום ולהודות את הרב מקרב לב על טובו ופעלו אשר יעשה את אחיו. גם כעת אשר היום הולך וגדול דורש הרב שתי פעמים ביום השבת, ובזה טרודים המה אחב״י הפולאנים כל יום השבת רק בתפלה ובדרשות הרב תקותנו עוד תאמצנו כי ישתלם הרב גם בשפת הארץ ואז גם אחינו הבריטאנים יתענגו בנועם דבריו, וטוב הרב יגיע גם לנו. במכ״ע „הטעליגראף״ נמצא מאמר אחד אשר בו יעורר המו״ל את אזרחי בריטאניא להתנדב גם המה למזכרת השר מאנטיפיארע באה״ק, ויאמר: כי לא לבד עם אחיו כי גם אתנו הנוצרים עשה השר רב טוב, ושמו נודע באה״ק אצל התוגרמים, ארמינים, ויונים, כולם יריבו איש את רעהו, אך יתאחדו ביחד לכבד את שם השר על טוב חסדו אשר עשה גם עמהם. שושנה."
