article_id,headline,text
021-HZF-1882-04-25-001-09105_toc_8,מעשה הצדקה להיוצאים," מעשה הצדקה להיוצאים בימי השבוע שעברה היתה אסיפה גדולה בבית הועד של החברה הראשית למשען יהודי רוסיא בלאנדאן. ראש המדברים ומנהל המשא ומתן היה שר העיר לאנדאן, אולם אחרי כן פנה את מקומו מפני הכבוד להשוע היהודי מאקאטטא, אשר שב ממסעו ומדרכו בערי אשכנז ואוסטריא אשר נסע בחברת השר לאהרענס אליפהאנט. תכלית ה׳ מאקאטטא אשר אליו היו פניו מועדות במסעו זה, היה, לכונן וליסד סדרים ישרים וטובים בהנהגת תמיכת היוצאים, ומשטרי עוז ערוכים בטוב טעם ודעת למען כל הועדים הגדולים והקטנים העוסקים בהמפעל הגדול הזה גם הד״ר בערנשטיין חבר הועד הראשי מברלין היה בין הנאספים בתור ציר שלוח מאת הועד ההוא, לכונן לחקר השקפות הועד הלונדוני ונטיותיו ומערכי הצעותיו בענין היציאה בכלל ובאופן חלוקת הכסף בפרט, הציר אשר עליו סבבו כל דברי המשא ומתן והויכוחים השונים בהאסיפה הזאת, היתה השאלה ע״ד התיסדות קופה של צדקה עם סך 25,000 ל״ש, ולהקופה הזאת יאבה הועד להפריש תרומה מכספו לערך 5,000 ל״ש. את הכסף הזה הציעו לשלוח לאמעריקא לחלקו בידי אנשים נאמנים להיות בידם למען יוכלו לקבל את האומללים הבאים מרוסיא ולתת להם קרקע לעבודה, הלארד מאיאר קרא באזני הנאספים את התשובה אשר השיב הבאראן ראטהשילד על בקשת הועד לעמוד לימינו ליסד קרן קימת מיוחדה ופרטית זו, הבאראן ראטהשילד השיב בתור ראש הועד הפאריזי, כי נכון הוא. להכניס אל קופת הצדקה 5,000 פראנק, בתנאי שיתברר ויתלבן קודם לכן יעוד הקופה הזאת ותכלית קביעותה, קצב עניניה ומעגל פעולתה, ושכל מעשי האנשים הנבחרים להתעסק במעשה הצדקה יעברו אח״כ תחת שבט הבקורת, והם יהיו אחראים בדבר וזקוקים למשגיחים ולרואי חשבון; בדעה הזאת החזיקו גם ה׳ גאלדסמיטה ומאקאטטא, והאחרון הכביד להוכיח באותות ובמופתים, כי מפני העדר הסדר הנכון, כל הפעולות וההשתדלות עולות בתהו וכסף רב יורד לטמיון, על כן הוכיחו שניהם את נחיצות הענין ליסד ולסדר השגחה ושמירה מעולה, למען ידע הועד מקום כל אחד ואחד מן הנודדים אשר קבלו ממנו משען אשר יעלה לכל פעולות הועדים, אם יהיו מעשיהם כתקונם בסדרים ראוים ונכונים. הדברים האלה העירו את אחד החברים, שר הצבא פרענדערהארסט, לדרוש מאת הועד לקצוב מדה בדיוק בצמצום, עד כמה תהיה השגחתו פרושה על האומללים אש נבנו ממנו, גם לבחור איש אחד או שני אנשים ולשלחם לאמע- ריקא לסדר ולתקן שם את דבר תמיכת הבאים לעסוק במלאכה או בעבודת האדמה. ההצעה הזאת נתקבלה, והיושב בראש הודיע כי יבחר שני חברים. ולפי הנראה תחול בחירת הועד על ה׳ אליפהאנט ומאנטאגו. גם הועד אשר בהאמבורג גלה דעתו, כי נכון הוא לסדר את עניני תמיכת היוצאים וחלוקת הכסף שהיא לע״ע מבולבלת ומטורפת, ותחת אשר עד היום שלחו היוצאים מהאמבורג ללאנדאן, ומלאנדאן לאמעריקא, ועי״ז רבתה ההוצאה ללא הועיל. נקבע כעת לשלוח אותם מהאמבורג לאמעריקא, והכסף המתוכן בלאנדאן לחלק ביניהם, יתחלק ע״י הועד אשר בהאמבורג. לסוף האסיפה נקרא באזני החברים ודיעה טאלגראפית אשר שלח אליפהאנט מבראדי לאמר: כי 1,221 איש כבר נכתבו בכתב היוצאים לאמעריקא, זולתם יש עוד כמה מאות אשר לא באו עוד על החתום בכתב היוצאים, מספר הבאים יגדל וירבה מיום אל יום באופן מבהיל, ולפי דעת רבים תרב התנועה הזאת ברבות הימים על אחת שבע. לדברי ה׳ מאקאטטא מצב האנשים האלה מעורר דאגה ופחד, ואחריות והחובה המוסרית הרובצת על שכם הועד תכבד יותר ויותר. מלבד 5,000 ל״ש אשר הרים הועד ליסוד קרן קימת הנזכרה, התחייבה חברת כי״ח אשר בפאריז להכניס 2,000 ל""ש, והועד הפראנקפורטי 5,000 ל״ש, ע״כ מלבד אשר הבטיחו גם הועדים בברלין ובוויען להועץ על הדבר הזה, הנה לע״ע עולה הכסף הנאסף לסך 17,000 ל״ש. בנוגע לתועלת הקרן קימת הזו למותר נחשוב לבררה. הן מפאת מיעוט הכסף אשר ביד הועד האמע- ריקאני נאלץ הועד לחלק כספו בצמצום גדול ולמנות כל פרוטה ופרוטה, ועל כן לא נפלאת היא בעינינו בשמענו תלונות וזעקת שבר מפי האנשים אשר נשאו עמל ותלאה, מצוקה ומחסור, בתקותם למצוא מנוחה מעבר לים, ואחרי כל אלה עוד לא באו אל המנוחה והנחלה. בין הנסבות אשר התנגשו כאבני נגף על דרך תנועת היציאה, תחשב בצדק גם החלטת הועד אשר החליט לקבל רק אנשים בריאים וחזקים בעלי מלאכה או מחונכים לעבודת האדמה. הן ככה אנו קוראים בהמכתב הערוך מאת הועד האמעריקאני אל כל הועדים וסניפיהם וסעיפיהם הקטנים ועוד יתרה עשו במכתב ההוא, כי בשפה ברורה הודיעו, כי את האנשים שאינם בריאים ואיתנים ומהירים בחרשת המעשה ובעבודת האדמה, ימריצו לשוב לבתיהם. מסירת מודעה זאת ראויה היא לשים אליה לב, והאמת נגיד ולא נכחד כי הננו רואים בה חשבון נכון ומדוקדק, אשר מקומו בעניני המסחר ולא בדברים שבצדקה, הן הנדיבים הנוצרים והיהודים, ולא רק הנדיבים אשר נתנו למאות ולאלפים אך גם הבינונים והעניים אשר נתנו פרוטות, שהן שקולות בערכן כנגד כל גנזי הקצינים ואוצרותיהם, התנדבו סתם למשען האומללים, לחלץ את העניים מעניים להקים כושלים אשר ההפך עליהם בלהות, ולא התנו תנאי קודם למעשה, שרק הפועלים ועובדי האדמה ממין היותר משובח שהם אינם צריכים לעזר אחרים — יהנו מנדבותיהם, והיש איפוא הצדקה להועד האמעריקאני, אשר לע״ע פעולתו כאין וכאפס נחשב נגד פעולות הועדים אשר בערי אייראפא, לצוות את נדיבי אייראפא לאמר, קבלו דעתי, החזיקו בידי הבריאים והחזקים, ואת החלושים ונעררי אומנות ועבודת האדמה, ואת הזקנים והנשים והטף שלחו לעזאזל? הזאת היא אהבת אדם אשר בשמה ידגילו בהמיטינגים, הן אמנם לא נכחד ממנו כי הגזירה הזאת לא תקום ולא תהיה, הבחינה בין הבריאים האמיצים והחלושים לא תצא לפעלה, וכל גופה של הפקודה הוא רק משום „דרוש וקבל שכר״. אבל אין מקבלים שכר על דרישה כזו. וזאת יורו לנו גם מכה״ע האנגלים והאמעריקאנים אשר באו לידינו, כולם קוראים תגר ותובעים בחזקה מאת הועדים לקרוע גזר דין זה, בין כה וכה באה הידיעה, כי בבית הועד בלאנדאן היתה עוד הפעם אסיפה פרטית, אשר בה הציע הבאראן ראטהשילד, לקרוא אסיפת באי כח קהלות אחב״י מכל ארצות אייראפא לדון בדבר היציאה, מזה נראה, כי בעוד אשר אחב״י בארצנו חלוקים בדעותיהם ע״ד שאלת היציאה הנה בחו״ל דעה אחת לכל דורשי טובתנו, כי התגברות תנועת היציאה היא הפתרון הנכון לשאלת היהודים, רק שהם דנים על אופני היציאה ופרטיה כנוגה הקשת ביום הענן תזהיר ותתנוסס ביפעת קדשה הצעת ישוב א״י בימים האלה. ברומעניא תצעד התנועה הלאומית הזאת צעדי און קדימה. החברות והועדים יציצו בין לילה בכל ערי המדינה. השר משה מאנטעפיורי והגאון מהר״נ אדלער נוהים בכל לבם אחרי ההצעה, אך למורת רוחנו כבר תשש כחם מחמת זקנה ולא יוכלו להתעסק בה ולהכנס בעובי הקורה, הרעיון הנעלה הזה סלל לו נתיב גם לוויען בירת אוסטריא, והתלבש בלבוש חברת אהבת ציון המתאספת כפעם בפעם לחליפות דברים, שני מכתבי העתים הגדולים לבני ישראל באנגליא Jew Chr. וגם .Jew. World. אשר הראשון פונה קדימה והשני מחזיק בנושנות, שניהם כאחד מודים ומחליטים, שלא תבוא תקות ישראל הלאומית וישועתו לדורות, לא ממוצא וממערב ולא ממדבר גדות הים הכספי, הן אמנם אמעריקא היא איצטומכא גדולה שבה מתעכלים כל בני ארצות אחרות המשתקעים בתוכה, אולם בסך הכסף הנצרך לקנין קולוניות באמעריקא טוב טוב לתקוע לבני ישראל יתד במקום נאמן במקום אשר יאמר עליו כי הוא זה ארצם ומולדתם, וגם הטעמים לפגם אשר מנה ה׳ נעטטער במאמרו שהדפיס במכה״ע נגד הצעת ישוב א״י, בטלים ומבוטלים במ״ע הנ״ל המוכיחים כי ה׳ נעטטער סותר א״ע, כי הוא בעצמו הרבה להלל תכונות ארץ הצבי בהחוברות שבהן הוא נותן דין וחשבון מפעולות בית החינוך לכורמים ויוגבים ביפו. בין כה וכה באה הידיעה הנכבדה כי הסולטאן הואיל לתת הסכמתו על הצעת ישוב א""י וגלה רצונו לתת להקולוניסטים היהודים חוקים ומשפטים מיוחדים, גם יוכלו להקים להם חיל צבא לשמור את גבוליהם. אמת כי בלעדי בנין מסלת הברזל בארץ הגלעד לא תוכל ההצעה לצאת לפעולות, יען תהיה „כמאן דלית ליה דרתא ותרעא לדרתא עביד"". אך גם הדבר הזה קרוב לצאת אל הפועל וימיו לא ימשכו. ולו יאבו הנדיבים להניח מעותיהם על קרן ארץ הצבי ולו תוסדנה חברות ואגודות שונות לעורר לנדבות את כל העם, כי אז אולי תוכל ההצעה הזאת לצאת מעולם הדמיון לעולם המעשה. אולם כאמור אין ההצעה הזאת מעכבת את תמיכת האומללים היוצאים לאמעריקא הצריכים לעזר לפי שעה, ואין הוא נוגעת כמלוא נימא בהישועה האזרחית במדינה אשר אליה עינינו כלות, ובל״ס ידוע ידע השר אליפהאנט — הראשון אשר כונן הצעת ישוב א״י על יסודות חזקים בספרו המפואר והנעלה לכלכל מעשה הצדקה במועצות דעת, ללכת באמצע בין שני השבילים בנוגע לשאלת שינוי מקום ולאחוז בזה וגם בזה, להחיש עזר להאומללים, ולחוש עתידות גם לטובת העם כולו בעקב כל המקרים האלה הממהרים לרוץ ארחם התאוששו אחב״י בכל אפסי רוסיא האדירה להצמיח קרן להצעת ישוב א״י, נשמת רוח הלאום ועמוד האור, אשר האיר לנו הדרך בכל ימי ענינו ומרודנו, לדברת מכ״ע „אדעססקי וויעסטניק"" התפעם החפץ הזה בכל עז בקרב לבות היהודים יושבי אדעססא ונכונים הם להרים פעמיהם לארץ הצבי בימי האביב האלה. הרב המטיף שוואבאכער דבר דברים כבושים לבני עדתו מעל הבמה, ויפליג בשבח הצעת ישוב א״י, ויוכיח משוגת בעלי השיטה „שב ואל תעשה עדיף״ על פניהם, ולדבריו נכון הוא בעצמו ג״כ להיות בין היוצאים לארץ הצבי. מאת הועד הכללי למשען יוצאי רוסיא אשר בלאנדאן הגיענו מכתב אשר בו נקרא כדברים האלה: הועד יחשוב לו לחובה, מפאת הידיעות הבאות מאמעריקא ע״ד מצב היהודים הבאים שמה, להודיע כי אין לאל ידו לתמוך בידי יהודי רוסיא היוצאים לאמעריקא, ורק אלה אשר יעמדו על המבחן ויתברר הדבר שהם בריאים ואמיצים ובעלי כשרון, אך המה יוכלו לבטוח כי נעזור להם ככל אשר תמצא ידינו. גם בארץ אנגליא אין מקום להאומללים. ולבל יבטחו יהודי רוסיא בשוא, הננו מזהירים אותם לבל יעזבו את ארצם ולבל יבואו הלום, כי אנחנו נוכל לקבל רק אנשים צעירים בעלי כח וכשרון בעלי מלאכה ועובדי אדמה, ועה״ח הסופר והמזכיר, (ליוניל אלכסנדר). נחום סאקאלאוו אחרי כתבנו כל אלה קראנו עתה במ״ע (קורי׳ ווארש׳ נו׳ 91) בשם הפרעמדענבלאט, הנודע למ״ע הקרוב למלכות אוסטריה בדברים האלה: תנועת היציאה בין יהודי רוסיא תלך דרכה בסופה וסערה, רוב היוצאים ישימו פניהם לאמעריקא, אך עתה נוסד וועד גדול אשר יפלם נתיב לארץ ישראל. בראש הועד הזה עומד השוע האדיר „קאזאלעט"" מקאנסטאנטינאפאל, הנכון להקדיש לתכלית יישוב א״י סך עצום 200,000 ליטרא שטערלינג (לערך שני מיליאן רובל). בכבר הארץ המיוחד לישוב הזה ובנו בעלי החברה מסלות הברזל, ובקרבת המסלה יבנו ערי מושב וכפרים לעובדי אדמה מבני ישראל. העולים לאה״ק ישיגו שם חנם כברת ארץ לעבדה ולשמרה. ההצעה הזאת ישרה בעיני הסולטאן, ובקרב הימים יצא לאור פקודה ורשות להתיסדות החברה הנ״ל. מעיר אדעסא מודיעים כי שמונה מאות אנשים נכונים לעלות ציונה, ומקיוב נסעו מאתים וחמשים לאמעריקא."
021-HZF-1882-04-25-001-09105_toc_9,," — 112 — אל המאספים והמחלקים ספרי הרמב״ם דפוס ארגעלבראנד וגאלדמאן בווארשא הנני להודיע להמאספים מן הרמב״ם הנדפס על ידי הח״מ, כי כעת יחולק הכרך השמיני, ובכרך הזה ימצאו פירוש הרדב״ז מכ""י שהוספנו, ובקרוב יחולק החלק התשיעי, גם שם ימצא פירוש הרדב״ז מכ״י נוסף על הכסף משנה, והכל באותיות ממוצעות כמו שנדפס המ״מ והכ״מ והלח״מ בכל הכרכים, לא כדפוסים הראשונים שנדפס רק הכ״מ ובאותיות קטנות מאד, על דבר המשניותן דפוס ארגעלבראנד אשר יחלק למו״ס בכרכים, אין רצוני להרעיש עולם בקול קורא, כי בשובה ונחת ישיג כל מו״ס בכל פעם שירצה איזה כרכים משניות שיחפוץ עם פי׳ קול הרמ״ז או פירוש הרמב״ם. גם הנני להודיע להסוכנים המחלקים ש״ס החדש מדפוס ראם בווילנא, ולוקחים פעם בפעם הכרכים מש״ס מדפוס הנ״ל, כי מעתה יוכלו להשיג שם גם הכרכים מהרמב״ם שלנו הנדפס מחדש ע״י הח״מ, וישיגו שם הראבאט היאות, כי מלאתי את ידם בזה ע״כ מהרו ודרשו איש איש כמספר הכרכים הנצרכים לו, ואל תאחרו אדרעסע למכתבים לי השותף המנהל העסק הזה בסקלאד ספרים הגדול שלי מרדכי קאלינבערג М. Канинбергъ Варшава, Палевки № 23. M. Kalinberg Warschau, Nalewki No 23. No. 23. ווארשא נאלעווקי"
021-HZF-1882-04-25-001-09105_toc_10,,"  קול מבשר ביום א׳ כ״א אדר העבר יצא ממני מודעה עפ״י התבל, כי התחלתי להדפיס  משניותין טובים ויפים אשר כמוהם עוד לא נהיתה, עם פרושים יקרים והוספות ומעלות רבות, ה״ה: פי׳ הרב מברטנורה, תוספות יום טוב, תוספות חדשים, תוספות ראשון לציון, שנות אליהו על זרעים, אליהו רבה על טהרות, הספר הון עשיר פי׳ יקר ממו״ר עמנואל חי ריקי על כל המשניות, חידושי מגיד משנה כת""י ממו״ר כו׳ מו״ה ישראל זצללה״ה מגיד דק""ק קאזעניץ, חידושי הרב הגאון הקדוש ר׳ לוי יצחק זצללה״ה. מברדיטשוב. חדושים והגהות מהגאון ר׳ יוסף שאול הלוי זצ״ל אבד״ק לבוב, משנה ערוכה המבארת כל מלות זרות בל״א, פי׳ ר״ע מברטנורה על פ״ג מ״א ופ״ה מ״ה מכלאים, על פרענומעראנטין בששה חלקים, על נייר מאשין יפה וטוב מאד נעלה, ועל נייר רעגאל בגליונות רחבים (כמו נייר הרמב״ם שלי) במחיר כל כרך על נייר מאשין 60 קאפ׳ ועל נייר רעגאל 85 קאפ׳. ולהסוכנים ינוכה רבא״ט הגון וטוב ועתה הנני להודיע כי ב״ה כבר נגמר מבית הדפוס כרך הראשון מהמשניות הנ״ל הוא סדר זרעים, ביתר שאת ויתר יופי וטוב מכפי הבחינות והמודעות שיצאו אז ממני ויתענג עליו עין כל רואה, ובקרב הימים יצא החלק השני הוא מועד ג״כ, כן כבר יצא לאור מהדפוס הכרך השנים ועשרים מהש״ס. ואדפיס עתה הכרך התשיעי מהאלפס, ויחושו נא הקונים לאסוף ברכה אל בתיהם ובע״ה לא יתאחר זמן כביר ואברך יום ג׳ תזו״מ תרמ״ב אל המוגמר על המשניותין והש״ס והאלפסין הנ״ל No. 19 נאום יהושע גרשון מונק, ווארשא בית מסחר הספרים נאלעווקי"
021-HZF-1882-04-25-001-09105_toc_11,," אתכבד להודיע בזה לעוברי דרך ווילנא כי מיום כ״ג אפריל כוננתי חדרים יפים ורוחים, ומאכלים טובים ובריאים, ומשרתים הגונים עומדים הכן בביתי למלאות רצון איש ואיש בישע ד׳, וע״כ אקרא אליכם אורחים יקרים עוברי דרך ווילנא, „סורו נא אלי ותמצאו מנוח טוב תחת צל קורתי״. משה שמעון הכהן אנטעקאלסקי, בבית ה׳ קאצערגיסקע, ברחוב יאטקעס אצל דפוס ראם, ווילנא."
021-HZF-1882-04-25-001-09105_toc_12,," אם כי זה שני פעמים אשר הודענו במ״ע „הצפירה"" אשר בלי פ״פ לא יוכלו התלמידים להתקבל פה בהישיבה, ודברנו עשו פרי בעז״ה כי מני אז כל הבאים ללמוד פה, הביאו כתבי תעודותיהם עמהם, אך עוד לא נתמלאה סאת חפצנו בשלמות, כי הרבה מהם לא היה להם פאספארטין רק על חדש או שלשה ירחים, וכאשר כלו ימי תעודותיהם הרבה לנו שברון לב מהנוסעים לביתם בלא עת, ואימת פקידי הממשלה העושים מלאכתם באמונה, מהנשארים, אי לזאת הננו מודיעים אשר כל אשר ישאהו לבו ללמוד פה יביא אתו פ״פ למצער על חצי שנה, ושלום אמת יהי לכולנו. דברי המודיע שלמה דוד במהור״ר יונה דינקין משגיח בישיבת וולאזין."
021-HZF-1882-04-25-001-09105_toc_13,," שאלות ותשובות לה׳ שלמה לעוויזאהן בעד הרבע הא׳ לא קבלנו מאומה, ואם שלח, למה החריש עד כה  ה׳ העניך בעלאצערקאוו ברוזאני הפאסט דפה אינה מקבלת לשם דברים שיש להם אחריות, ויתן אדרעסע נכונה אחרת, להסופרים מ""ס וע״ג מסיבה בלתי תלויה בנו נחסרו הדברים בנומערין שעברו, ועתה נתמלא החסרון בנומר הזה."
021-HZF-1882-04-25-001-09105_toc_14,,"  תחבולה לעשות חיל ש לנו למכור תמצית חומץ 80%, (עססיג ססענץ) אשר מוכשר להיות חומץ כאשר יערב עם 35 חלקים מים. נגד שלוח של 70 קאפעיקעס (בפאסט מארקין) ישיג כל מבקש פראבע Люоблинеръ и Конъ Влоцлавекъ, Варш. губ."
021-HZF-1882-04-25-001-09105_toc_15,,"  הודעה הנני להודיע בזה כי נכון אנכי להקדיש שתי שעות ביום בעד בחורי חמד, שוחרי תושיה להשכילם בינה במקראי קודש בשום שכל ובטוב טעם ודעת גם לתת להם לקח טוב בדקדוק לשון עבר בכל פרטיה בדרך ושרה וקלה וכל אשר יש לו חפץ בזה יואל נא לבקר אותי במעוני וימצא את מבוקשו במחיר מצער. חיים מאניקאוו איש סלאנים שמאלע מילע No. 11 וואונונג No. 8 צו הויזע בין איך פון אוהר 1 ביז 4."
021-HZF-1882-04-25-001-09105_toc_16,," זה כשנה תמימה אשר עזבני אנשי עם שלשה ילדים, ואין קול ואין קשב מאתו; ואלה המה סימניו: שמו „ליפא לובמאהן״. שנותיו לערך ארבעים, שפל הקומה שערות ראשו וזקנו הקטנה שחורות, ועקבות אכעבועות נכרים על צוארו מלאכתו מולייאר). כל אשר יכירהו ייטיב נא חסדו להודיע על אדרעס שלמטה. ולמצוה גדולה יחשב זאת, דברי המעתרת דבורה בת צבי ליב. Потъ Воруховичу г. Фишману Въ г. Мозндръ Мин. губ. נאום גרשון בהרב מוה׳ חיים אבד״ק מאזיר"
021-HZF-1882-04-25-001-09105_toc_17,," זה רבות בשנים מאז אחי היקר ר׳ יעקב נאה עזב את ארץ מולדתו וילך לו לאמעריקא ומאז שבתו שמה הודיעני בכל עת משלומו וגם לא עזב מלתמכני תמיד. והנה זה בחמש שנים אשר הריצותי לו ע״פ האדרעסע שלו הרשומה מטה ולא השגתי כל מענה. לכן בקשתי שטוחה לפני קוראי הצפירה אולי נודע להם מקום מושבו ייטיבו נא להודיע האדרעססא שלו למכ״ע הצפירה ושכרם יהי כפל מן השמים. האדרעססא של אחי נ״י אשר כתבתי אליו כמה שנים הוא: Jacob Noach dealer in foreign and domestio Dry Coods Millinery Goods, Bennets, Ribbonns C Co. Nr. 1884 South Broadway, Baltimore."
021-HZF-1882-04-25-001-09105_toc_18,, редактору газ. ГАIEопр אדרעססא שלנו З. Сонинскому Варшава. או S. Sionimski in Warschau Dzika No 25a.  Прнбавлевiе
021-HZF-1882-04-25-001-09105_toc_19,הוספה להצפירה גומר *1 14ק**1{8<1>11 י14 ..., הוספה להצפירה נומר 44 Дршбавленис къ и 1 Ганесира
