article_id,headline,text
021-HLB-1880-01-23-PG001-SINGLE-ORIGNAME_160195_toc_1,"^^^^^^ 361)^180116 ^118^1)0 (168 181""^61..."," Hebraische Ausgabe des „sraelit שנת שש עשרה נומערא כה . A מחירו לשנה  החפץ להשיג את הלבנ בארצות אשכנז, 12 מארק. ע״י בוכהאנדלונג או ע״י פאסטאמט ד פלורין א״ו 3 באוסטריא ישוהו מהם בשמו האשכנזי: ברוסיא ופולין 50 ,5 רו״כ. BBR AUSe DzSISRAELIT ברוסיא ידרשותו לעת עתה 1 פונד פעלג. בהודו וכינא   עפ״י האדרעססע הזאת: בשאר ארצות 75 18 פראנק. edaction der ichr Ausg. מחצית או לרבע שנה בחני או rueft in Mainz  - ראשי  רבע ממחיר הקצוב למעלה. לין יומיריו מאה   B. Kaplan, anior Zu מחיר מודעות   PRAGA Dei Warschau. ס - 20 פפעניג בעד כל שורה, ואם  מאמר אשר לא יעלה לרצון על א נדפסת איזה פעמים ינוכה ראבאט. מזבח הלבנון אינו חוזר לבעליו. הודעת עגונה מקובלת בחנם.  תב בלתי חפשי לא יקובל.  איש אשר ראיתי לי איש אשר לא יעוררו ויעלסל האהייטערריערער אפריל. מכתב עתי לבני ישראל יוצא לאור בכל שבוע להודיע ולבשר ולהורות כל דבר הנדרש לאיש יהודי לדעת באשר הוא יהודי וחבר לחברת האדם מאת מאיר (דר.) לעהמאן ע״י יחיאל ברי״ל יצ""ו דֶרֶךְ אֱמוּנָה בַחַרְתִּי (תהלים קי״ט)"
021-HLB-1880-01-23-PG001-SINGLE-ORIGNAME_160195_toc_2,"!^ 1880 1וונ&זנ23. מ%^1#,2<16נ ^0. 25 1י...", התרים   מאינץ י' שבט 1850
021-HLB-1880-01-23-PG001-SINGLE-ORIGNAME_160195_toc_3,הנומער הזה הוא האחתך מרבע השניה משנת שש ...," הנומער הזה הוא האחרון מרבע השניה משנת שש עשרה להלבנון. והננו מזכירים את הקוראים הנכבדים למהר בשילוח מרתנו נעמוד ועינינו ולבבנו יהיה בנון עבור רבע השלישית, ויגיע לידם על הסדר בלי איחור. ואנחנו בעזר ה׳ על מ מחיר ה המו״ל בהלבנון כי יעש פרי קדש הלולים טובים ומועילים. אנא ה׳, הושיעה נא! כל ד"
021-HLB-1880-01-23-PG001-SINGLE-ORIGNAME_160195_toc_4,ס אמר ראשי: מורה נביט זמן החלש דברי הימי...,  מאמר ראשי: מורה נבוכי זמן החדש דברי הימים: השקפה כללית על מקרי שבעת ימים האחרונים. מכתבי סופרים: אופינא. ידיעות העולם והטבע: אוצרות תהום. חדשות וענינים שונים. — הודעות. ידכתי לבנון: ספור „רבי יוסף בן גרשון המכונה יאזימאן מראסהיים״.
021-HLB-1880-01-23-PG001-SINGLE-ORIGNAME_160195_toc_5,"ג
מורה נבוכי זמן החדש"," ג מורה נבוכי זמן החדש עלה על לב כל בעל נפש יפה לחשוב כי היהודי התלמודי הוא משולל ההרגשות הטבעיות מידי אביר הטבע, או מי יאמר כי התלמוד אשר היא מכלכל דתי היהודי הנאמן, נוסד באופן אשר הוא מהלך מנגד לההרגשות הטבעיות ואהבת החיים; לוא חכמו ישכילו בתלמוד ויראו עד כמה שמרו בתקנותיהם אשר לא יסינו גבולות הטבע ולבל יעבטו אורחות החיים. כמה ומים נמצא בדבריהם הדברים המדיניים, דבר זה אין רוב צבור יכולים  לעמוד בו״, באופן זה „לא שבקת חיי לכל בריה"" וכדומה, המה המורים מקבלי פרושי התורה על פה, אשר בארו מצות וחי בהם"" על החיים הזמניים ולא שימות בהם*); אולם אף כי למותר יחשב להראות איך התלמודים גם המה עז להם באהבת החיים הזמניים בכל היקום אשר בארץ, אך לא למחסור יחשב להעיר אזן השומע כי להיהודים התלמודים עשר ידות באהבת החיים. הלא זה הוא הדבר אשר השיבו חכמינו במשפט קצר להמלך ע ונה: מה יעשה האדם וימות? יהיה את עצמו. כי רק האדם שאלתו ה הדואג לאחריתו ושואל מה לעשות עליו להוקיר מאד מאד את החיים, כי הם יביאוהו לראות בטוב ה׳ במה שיהיה אחד החיים העוברים. סוף דבר, היהודים הנאמנים לה׳ ולתורתו המאמינים באמונה שלמה באל-מות הנפש, המה ישאלו מה יעשה האדם וימות ותשובתם „יחיה א״ע"" היא תשובה מאירת עינים ומשמחת לב ומסכמת מאד עם ההרגשות הטבעיות. אולם לדאבון נפש כל ישרי לב רבו בימינו האנשים אשר פרקו מעליהם עול התורה האלהית המישרת את האדם בדרכי החיים, ואמונת אל- מות יטילו בספק קל מסובן. כל פנות שהם פונים הן רק אל החיים הזמניים וכל שאלתם רק מה יעשה הארם ויחיה? לכן תשובתם כלה ונחרצה שמענו „ימית א״ע!"" כי מה בצע לו בחייו העמוסים משא לעיפה, הטעונים שאלות *) ביומא פ""ה: אמר שמואל אי הואי התם הוה אמינא דידי עדיפא מדידהו וחי בהם ולא שימות בהם. אמר רבא וכולהו אית להו פרכא לבד משמואל דלות ליה פרכא. יעו״ש אם כי לפי הפשט הוא נאמר על חיי עוה״ב כפירש״י ע״ש. מאת חיים ירמיהו פלעגסבערג מבאלבירישאק.  שאלת החיים (ההמשך מנו׳ 24) אמנם כן הוא החיים הזמניים דרושים ונחוצים מאד להאיש הישראלי הנאמן לדתו, כי גם בהשקפתו זו אשר ישקיף על חיי עוה״ז כעל פרוזדור לחיי עוה״ב, הוא אוהב ימים לראות טוב למורת רוח שונאי היהודים והיהדות האומרים כי היהודים הנאמנים שומרי הדת לא יחפצו בזכיות המדינה, כי דבת שוא היא ביתר העלילות אשר מקורן בשנאת הדת. כבר שמענו דבת שונאי ישראל רבים, בני ברית ואינם בני ברית, אלה האחרונים יאמרו כי היהודים הם גרים בארץ מולדתם כל זמן אשר שם יהודי נקרא עליהם. והראשונים יאמרו כי היהודים הם גרים על הארץ בכלל כל זמן אשר אמונת אש דת למו וידיהם מלאות עבודה במצות כל היום אשר אין בהן כל חפץ וישע לחיי עוה״ז כי אם בעולם הדמיון. אלה ואלה ברוע לבם יוציאו משפט מעוקל על היהודי, אלה למען דחותו בשתי ידים מתורת האדם ולא יהיה לו חלק ונחלה במשפטי אזרחי הארץ, ואלה למען הרחיקו מתורת אל חי והאמונה התמימה באל-מות הנפש. ואולם להוכיח בדברים איך גם היהודים הנאמנים התלמודים מוקירים את חיי עוה״ז והליכותיו הוא אך למותר, כי מעולם לא אחת, כי לפתח היהדות ומנהגי ישראל העניות רובצת, ולא נפלאת היא מעתה כי הקורא יהיה כחכם ומבין מדעתו את הדברים אשר נשארו עצורים על דל שפתם. ומה נמרצו אמרי יושר אשר ראיתי בהמליץ שנה עברה גומר הקצרים והנמרצים גלה את פני הלוט הלוט אשר הסופרים החדשים יסתירום בסתר כנפיהם, אשר בעבורם יוציאו משפט מעוקל לחייב את הזכאי ולזכות את החייב. דבריו ראוים לבא בקהל קוראי הלבנון. אחרי אשר הקדים לדבר בטוב טעם ודעת מן הספרות החדשה הוסיף לחות דעתו לאמר: ובכן לא לוחמים בקסת סופרים לנו נחוצים, אך מעשים טובים לבלי לתת למבקשי מומים לקרוא עלינו חמס. ראשית דבר, לבלי יעדו גאון אלה „מאחינו אשר הצליח ה׳ דרכם, ולא יביטו מגבוה בשאט נפש על אחיהם „הנאנחים והנאנקים תחת עקת משא לעיפה, לכלכל נפשות ביתם ממוצא „למחיה אכזב; ב) גם אלה אשר בתי מדרש החכמה יעידו עליהם כי מלומדים יהם, אל נא יתכחשו לאחיהם בני בריתם, לא יבזו צלמם במסבת רעיהם „הנוצרים בתקותם להתרצות להם בזאת; ג) אל נא יגלו קלונם ברבים „במכה״ע הכוללים בתואנה כי אם יתראו באינם נוגעים בדבר, ובלי משא פנים יספרו קלון עמם, אז יאמינו גם למליצותיהם, והמה לא ידעו כי רק ""את הרע יקבלו מהם ואת הטוב לא יקבלו; ד) אל נא יבקשו בעלי עסקים „גדולים להתקרב לרשות ולעשות חונף לאיזה תקיפים באמרם כי חוק שמו עצומות המועילות להותו. ע״כ תרגז הארץ ועמודי המדינות יתפלצון, וחברת התמימים ובהיהדות הנאמנה. ותוצאת כל דבריהם יוכל הקורא לכלול במלה האדם נעשתה עדרים עדרים רבים מהנבוכים בארץ הסגירו למות נפשם ויתמכרו לרצח, ויבז בעיניהם לשלוח יד בנפשם לבדה ויאמרו לאבד יחד את כל יושבי תבל ושוכני ארץ. בדבר אשר זדו לשלוח יד במלכי אוראפא ושריה הנותנים נשמה לעם עליה ורוח לההולכים בה, לאחוז בכנפות הארץ 20 יוצאים מפי ה׳ דר. מאלום רופא המחוז בסט. פעטערסבורג אשר בדבריו ולנער ממנה כל חוקי התולדה אשר שמו בה משטרם, להרוס כל סדרי הממלכות והארצות ולחדש פני האדמה ברוח דמיונם העזה בחקים חדשים אשר על פיהם קותה נפשם למצוא סדר חיים חדש שבע רצון לכל חיים. ומה נאמנו מאד דברי מלך ישראל הראשון אשר חכמים הגידו צדקתו ותומת נפשו כי היה חף מפשע כיונק שדי אמו, באמרו להקושרים עליו: הלכלכם יתן בן ישי שדות וכרמים; הלכולכם יעשה שרי אלפים״ — הה, האנשים האלה אשר קצו בחייהם לחיות חיי צלמות בעולם של הפקר, לפי שטתם, הרגיזו מנוחת המלכים ומושלי ארץ הצדיקים אשר המה נפש החיים מכמה מילליאן נפש אדם רגעי ארץ ותמימי דרך החפצים חיים ובשלומם להם שלום. — כאשר יבא הרופא הנאמן אל החולה ויראה כי מחלתו אנושה ויגזור לגרוע ממנו דמו הנשחת ע״י עלוקות מוצצות דם וכדומה, מן הנמנע כי עם רדם הנשחת הנחוץ לגרוע ממנו לא יזל גם חלק רב מדמיו הטובים, יען נפלאת היא ממנו למצוא דרך אחרת אשר תפלה בין דם לדם; אולם אחר עבור הסכנה והחולה יחל לשאוף רוח חדש אז יצו הרופא להברותו בדברים „להם לבלי תת משרה בעסקיהם לאחד מבני בריתם, וגם רופא ומורה עברי ""וכדומה ירחיקו מהם — הטרם תדעו אתם העשירים ובעלי העסקים הגדולים גם חזוכים לשם הכבוד „מלומרים"" כי בגללכם היה כלל ישראל על הרוב למטרה לחצי זעם מקנאים אשר קנאתם תבער בם לראיתכם עולים לגדולה ""ומתערנים על רב טוב, והמה אם הוכו בסגורים להאמון כי כל היהודים מלאים עושר רב ועוד מעט ירשו ארץ, אז כי לא יוכלו לנגוע בכם לרעה ישאפו נקם מאחיכם הנדכאים״. פחד ורחב לבי לראות כתוב יושר דברי אמת כאלה מאיש מלומד מטעם הזמן החדש כאשר יעיר עליו התואר הנכבד דר. ורופא המחוז בסט פעטערסבורג. האח! דר. מאלום מחייב את המלומדים ואת העשירים, חזיון כזה בלתי נפרץ ויקר מאד בימים האלה. הכותב הנכבד יוסיף לאמר: ולא בצדק אפוא יאמר ה׳ מ. כי רוב היהודים חיים מן הרוח ואין להם מקור נאמן לכלכל נפשות ביתם ע״כ לא יועיל להם חוק שיווי הזכיות; „כי גם בדבר הזה לא נופלים היהודים מיתר האומות אשר בתוכם הם יושבים, כי מלבד האכרים הלא יתר כל מקורי המחיה והעושר תלוים ברוח המקרה, וגם האכר יוכל להשאר בלא להם גם אם צרכיו מעטים, אם אדמתו לא תתן את פריה בסבת מקרים שונים, האם אין סרסרים ומלוי ברבית ועושי רמית „ופועלים בטלים בין יתר העמים? וההבדל ביניהם הוא זה, כי אלה האחרונים הבטלה מביאתם לידי שעמום ויתנו בכוס עינם והיהודים יחבקו תגור בית המדרש, יענו את נפשם ויקמצו הצטרבותיהם. נסה נא לתת גם לאלה „עבודה „שיוכלו לעשות בה אם לא היו כבני אדם פשוטים עמלים אשר ישיבו לו אבדת דמו אשר אבד במשך ימי חליו ורפאתו, כי הדם הוא הנפש. כן הדבר, האמונה הצרופה היא נשמת כל חי, אמנם בימים מקדם חלו כל יושבי תבל את חלים המסוכן אשר הוליך אותם תועה להאמין בכל אמונה נבערה עד להשחית, המחלה האיומה הזאת הביאה את החכמים לאט לאט לידי הכרה ברורה כי נחוץ לגרוע חומר דמיה הרבים הנשחתים. אמנם בדרך זה היה מן הנמנע ביד החכמים להפלא בין דם לדם, ובכן זבו גם דמים טובים מן האמונה, וברבות הימים היו חיי תבל מגיעים עד שערי כות. לכן נחשבה למשפט, ואולי בצדק — אך לא במחזה כי לא נביאים אנחנו ולא בני נביאים רק דברי נביאנו הקודמים לא מוזרים לנו — כי ימים יבאו אשר החכמים הגדולים רופאי תבל ומפליאים לעשות. ימצאו לטוב לתור בחכמתם להשיב להאמונה אבדת דמיה הטובים ותחי רוח תבל ויושבי בה, אך למתי? אם הימים האלה רחוקים ממנו או הנם עומדים אחר כתלנו אין אתנו, יודע עד מה, ואם אולי הקורות אשר תביאנה שמש צדקה ומרפא בכנפיה להאיר ליושבי תבל באור האמת, לא תהיינה באופן אשר אמרנו כי אם בסבות אחרות ממסבב הסבות אחת היא לנו, ואנחנו בשם אלקינו נדגל ובדברי נביאנו נשגב, אשר אמר (צפניה ג') כי אז אהפך אל עמים שפה ברורה לקרוא כלם בשם ה׳ ולעבדנו שכם אחד, ואמר (ישעיה י״א) כי מלאה הארץ דעה את ה׳ כמים לים מכסיס. כמעט נטינו מן המסלה אשר לפנינו ודאינו על כנפי רוח החוזה לדבר נשגבות מימים יוצרו, אך כל קורא מבין יבין לרעינו, כי רק את ההוה שמנו נגד פנינו, להגיד ליעקב מה טוב ומה החיים דורשים ממנו. „ויגעים להיות עושים ואוכלים."" גם בזה הטיב אשר דבר לגול את האשמה הנוראה מאחינו הידכאים ואת השקוצים אשר השליכו עליהם בית מאהביהם לא בצדק ולא במשפט, למשיב נפש היה לי מקרא דבריו, קראתים ושניתים, ולא אהיה כמפליג אם אומר כי מעט מן המאמר הזה דוחה הרבה מן השאלות וההצעות השונות אשר חלו וילדו הסופרים החדשים בענין זה. כמעט לא האמנתי למראה עיני ודמיתי כי הדברים האלה אשר הגיוני לב מחזיקי התלמוד ופליטת סופריה נחזה בהם, יצאו מאחד הרבנים הגדולים, לולא ראיתי כי בהצעתו הטובה  אשר אמר להעיר את אילי הכסף והדעת להתאחד ולדאוג לתקן מצב אחינו הרוחני והגשמי, בהזכירו בה לטוב להכין בתי ספר למתחילים בכל עיר ועיר להרגיל את ילדי הדור החדש לאיזה עבודה המחיה את בעליה בכבוד, לחכמה ולספרות כו' כו, שכה לזכור לטוב גם את למודי דת קדשנו אשר כבר הגיע  היום שידובר בה ולדאוג לאחריתה גם בארצנו. אז נוכחתי לדעת כי הכותב הנכבד הזה עוד לא נגלו לפניו המחזות המעציבות אשר תתננה דאגה בלב ב  התיעצות בהיסח הדעת במאמרנו זה אין השתדלותנו להושיט סדר חיים ופרנסה לאלה השואלים כהוגן להביא עצות חדשות איך ובמה אביוני עמנו ספרי מעשיהם ישבעו לחם גודה ולא נבוש כי אין בידינו מפתחות של פרנסה, ותמיד נביט בעין יפה על הסופרים המתגדרים במלאכתם לשאת ולתת בשאלה זו כיד ידיעתם הטובה עליהם, מי יתן וחפצם הטוב יצלה בידם ויהיה ריוח בעולם. אולם מגמת פנינו להעיר, אשר למננת לבנו אנחנו רואים כי כרובם אך בשאלת הפרנסה ידברו ואל שאלת היהודים ישלחו חצי מבטיהם, ולתכלית הזאת יפרזו על המדה לתאר לפני הקוראים את שאלת הפרנסה מורה מאד בתוך עדת ישראל מכשאר שכניהם העמים אשר אנחנו בקרבם ואשר גם בתוכם נמצאים הרבה עניי צאן אדם, ובעת יחלו להתיעץ ולחות דעתם במה וכל העם הזה להושע. יכפרו את ידיהם אשר לא תעשינה תושיה בהיהודים ת״ח שומרי משמרת הקדש, בראותם אחרית כל בתי ספר לישראל במדינה הנושאים פרי כחש וזדון לבב לדת קדשנו ולהיהדות, ויהי כשמעם עצת בתי ספר לנערי ישראל ושם למודי הדת לא יזכירו לפקוה גם עליה עין רואה ולא עין סמויה או כהה כאשר עד עתה. לבם יהגו אימות ויחרדו לרגעים מפני המת הזמן ורוחו השפוכה כעת על בתים כאלה, אשר לא יחובל עול הדת מפני שמן וקטורת הלמודים החדשים כאשר יעידו הנסיונות למכביר. ובדבר זה אין פדות בין כל בתי ספר כי הזמן לא יפלה בין בתי ספר נמוכים וגבוהים לחכמה ובין בתי ספר לעבודה, כי כאשר תבא איזה דעת ולמוד בלב התלמידים עדי ארגיעה יעזבו את מקור מים חיים, את ה׳, ודעת דרכי האמונה הצרופה לא יחפצו באשר לא ידעוה ולא יכירוה, ויחשבוה לפתיות וקטנות הדעת. ואם כזה יהיה חלילה גורל הדור החדש חניכי בתי ספר אלה. מה נעשה לשם קדשנו ותפארתנו?! (ההמשך יבא) -"
