article_id,headline,text
021-HLB-1881-05-13-PG001-SINGLE-ORIGNAME_170325_toc_1,^ 0 1 1 ^ ( ־ 36 1 ) 1 ^ 1 8 0 1 1 6 1 ^...," 9 COralsche „AUSgDO des „ISTAGIE E HE שנת שבע עשרה נומערא מ 4 החפץ להשיג את הלבנון מחירו לשנה (הג ע״י בוכהאנדלונג או ע״י פאסטאמט בארצות אשכנז, 12 מארק רשוהו מהם בשמו האשכנזי: באוסטריא 7 פלורין א""וו Иввв. АUзс. рва IенавLгг ברוסיא ופולין 50 ,5 רו״כ ברוססיא ידרשוהו מאתנו: בהודו וכינא 1 פונד שטלג. Redaction der hebr. Ausg. בשאר ארצות 75 ,18 פראנק. des „raelit in Mainz.  ולמחצית או לרבע שנה בחצי או A. J. Epstein, in בפולין מאת   ברבע ממחיר הקצוב למעלה. Ch. CZernowicz או מאת L0D2 ת ם מחיר מודעות Dzika No. 3 in Warschau.  ָ מאמר אשר לא יעלה לרצון על 20 פפעניג בעד כל שורה, ואם נדפסת איזה פעמים ינוכה ראבאט. מזבח הלבנון איננו חוזר לבעליו. מכתב בלתי חפשי לא יקובל. הודעת עגונה מקובלת בחנם. ויעוררו ויעוררו ולעוררה ב. מכתב עתי לבני ישראל  ומשם ישיש לאיש ואיש ישישים העשירים האללא יוצא לאור בכל שבוע הוי ורר דד ילהלם להודיע ולבשר ולהורות כל דבר הנדרש לאיש יהודי לדעת באשר הוא יהודי וחבר לחברת האדם מאת מאיר (דר) לעהמאנו ע""י יחיאל ברי״ל יצו דרךְ אֱמוּנָה בָחַרְתִּי (תהלים ק""ט)"
021-HLB-1881-05-13-PG001-SINGLE-ORIGNAME_170325_toc_2,"ן ! 1881 •א. !8ם] 0 . }40 1 *141x2 ,<16 ..."," - MAINz, den 13. Ma 40 . מאינץ י""ב אויר. התרמא 1881 "
021-HLB-1881-05-13-PG001-SINGLE-ORIGNAME_170325_toc_3,מאמר ראשי: למוד ה.' דברי הימים: השקפה כל...,  מאמר ראשי: למודי ה'. דברי הימים: השקפה כללית על מקרי שבעת ימים האחרונים. ארץ תונים. מכתבי סופרים: דימייעווקי. רוססיא הקטנה. מיטויא. הודעות. ירכתי לבנון: ספור „לפני מאה שנים״.
021-HLB-1881-05-13-PG001-SINGLE-ORIGNAME_170325_toc_4," 
מאמר ואשי","  מאמר ואשי על שכמם בתור מורי הוראות ורועי צאן קדשים, יתקשטו ויזדיינו בכל הידיעות החצוניות הנצרכות להתקבל אצל אנשי דורנו דהיינו ידיעת הלשונות ודברי הימים וחכמת המפה וכו׳ וכו׳, וההפרש הנראה עדיין קיים בין ב׳ הכתות אשר לא נתפשטו קמטיו, הוא אם הלמודים האלה יושנו בסעמי- נאריום אמן ועמידו לחלק שם הידיעות האלה למתחנכים בטבנות, או אם כל א׳ וא׳ ישתדל להתקשט כאשר תשיג ידו בכל הידיעות הנזכרות ולהיות מקובל ומרוצה בעיני בני אדם ולרעות אותם דעה והשכל. אם לא שגיתי זהו מצב המחלוקה בעת ובעונה הזאת, ועל זה נפשי יודעת מאד כי ראוי היה לי לאחוז בפלך השתיקה, אם מפני שאיני כדאי להכריז דעתי ברבים במקומות אשר רבו כמו רבו אנשים חכמים ונבונים בין שתי המפלגות, אם מפני כי למדינות רחוקות אני נבא ומי ירשני לעלות הבמתה להטיף לאנשים אשר יודעים הנצרך להם יותר מאיש זר אשר לא נסה כף רגלו הצג על ארצם, ואשריו אם ראה אותה בחלום, לולא כי יראתי פן תהיה נחשבת לי המגיעה לאשמה, מאחר כי לדעתי איזה תועלת יוכל להמשך אם אחוה דעתי ברבים, ואם לא יראת הגאוה הייתי אומר כי נחוץ מאד מאד הדבר להודיע ולהודע. ומימי הרפו, למן היום אשר סבותי עיני שכלי לפתרון השאלה הגדולה והנשאה הזאת, הבריק הרעיון הזה לנגד עיני ויאחוז במורשי לבבי בלהבות אש עד שהיה לי כדבר אלקים עצור בעצמי  גלאותי כלכל ולא אוכל. ובכל השנים שחלפו מן היום והלאה עד היום הזה, ובכל המאורעות אשר נתחדשו כה וכה בארצנו ובארצות זולתנו ובכל אשר קראתי ושמעתי על פתרון השאלה הזאת, עדיין בדעתי החזקתי לא ארפנה, כי יסודותיו ואשיותיה נתחזקו בכל אלה ולא תמוטנה, באופן כי הגם שאינני בעיני לא נבון ולא חכם, אמת אמר המשל אין חכם בבעל הנסיון, על כן אשאלה מכם  הקוראים רשיון, ולפני יהיו לרצון אמרי פי והגיון. תחלת כל חובה עלי להודיע כי גם לי לבב חושק וחומד לעשות שלום בין ההשכלה והדת, ולא נופל אנכי מאיזה שיהיה לרדוף להשיג ההסכמה והשלום הזה, אך לדעתי (וזהו הפנה שהכל תלוי בח) יש שני מיני שלום והסכמות ושני דרכים להתאים ולהצמיד ולחבר ההשכלה והדת. המין הראשון הוא השלום אשר אקראהו חצוני, לא מפני שישתוו הכתות ולבם כל עמם  ולא יעשו אלא לפנים, חלילה מלחשוד בני ישראל על חנם, הגם כי לא חדלו למודי ה׳ מאת אליהון אמוזג. כל איש אשר רוח היהדות תפעם בקרבו ואשר נתן לו עינים לראות אזנים לשמוע ולב להבין, לא יוכל להתעלם מהמראה הגדול הזה, והאותות והמופתים מהחדשות ונצורות העתידים עורר בארצות הצפון ובפרט במדינת רוסיא, פעולות נוראות וסדר זמנים חדשים בסדר הלמודים ותעודת הרבנות. היא השאלה אשר עליה שוטטו רבים ורבו הדעות, זה אומר בכה וזה אומר בכה, והשתוות הדעות אשר הוא התנאי ההכרחי לבצע כל מעשה שיעמוד לימים יבאו נגד כל מעיק משטין ומפגיע, נשאר מעל. מצב אחינו ברוסיא ופולין, אם לא שגיתי, הוא בעצמו המצב אשר עמדו בו אחב״י באיזה ארצות איברופא בדור שעבר ובתחלת הדור שאנו בו, והמלחמות והמערכות והמפלגות הן הנה בעצמם אותן שהפרידו לבבות אחב״י באותו זמן והיו לשני ראשים. הראש האחד נושא דגל האמונה כאשר הורישו לנו אונותינו מבלי תערובת ידיעות זרות אשר היו לשמצה בעיניהם, והראש השני בשם החכמה ידגל וכל ישעו וחפצו לעשות שלום במרומי הדעת והיהדות, בין הדת והחכמה; אלה יקראו בשם מאמינים ואלה בשם משכילים. כאשר קרה בדור שעבר בשאר ארצות, ככה נראה שעתיד להיות בארצות רוסיא ופולין, רצוני לומר ששתי הכתות יסכימו לחבר את האחל להיות אחד, לעשות שולום בין האמונה וההשכלה. אך באופן זה שהיושבים כסאות למשפט. הרבנים ומורי התורה, חוץ מהידיעות הנצרכות להם למלאות המשרה אשר חנפים וצבועים בכל הכתות, ויפה אמר המלך החכם אל תתיראי לא מן הפרושים ולא משאינם פרושים אלא מן הצבועים; רק אקראהו חצוני מב׳ טעמים והאחד קשור בהבירו. הטעם ראחד הוא מפני שהתכלית הנרצה בו איננו ההתחדשות בפנימיות הלמודים הדתיים באופן שלא יוזקו מהחכמות אשר להן יחס עמהם כאשר עוד יבואר, רק התכלית הוא לספח ולהוסיף אל למוד התורה איזה חכמות שאין להם קשר עצמי והגיוני עם שום א׳ מחלקיה רק לתפארת אדם באשר הוא אדם לבלתי יגרע נחלת תלמידי חכמים משאר אנשים הנאורים אשר אכלו מפרי עץ הדעת ותאורנה עיניהם, והגם כי על ידי זה יתעלה כבוד התורה בהיות הרבנים גם הם מקושטים באותן הדעות, בכל זאת חובה להודות כאשר אמרנו כי אין הדבר נוגע כלל לפנימיות התורה רק הוא חיצוני לה ואין התועלת הנמשך מהן חוזר אל עצמה ואל בשרה כי אם לאנשים הנושאים את דגלה ועל ידם דוקא נוכל לקוות שת תכבד התורה גם היא בהיות אנשיה מכובדים ויודעי ספר ומביני מדע ויש לאל ידם לדבר צחות ולהכניס למודיה בלב שומעיהם. זה הוא האופן הראשון שקראתיו חצוני. האופן השני (נבדל אבל לא נגדיי אל זה הראשון) הוא לחדש פנימיות למודי התורה על דרך זה דהיינו להשתמש בכל חלק וחלק ממנה באותן הידיעות והחכמות אשר להן יהם עם כל אחד מהן, אשר מהם לקחו שונאינו ומנגדינו כשיל וכלפות להרוס חומותיה, ואשר מהם אנחנו המאמינים נוכל לקוות לשאוב מימי הישועה הן להשיב על טענותיהם ולהצדיק תורתנו, הן להביא בכלי טהור טענות חדשות לחזק אשיותיה יותר ויותר לדעתי ההבדל בין שני האופנים האלה הוא מבואר מעצמו ודעת ההפרש לנבון נקל מבלי הוספת ביאור, רק להפיץ אור ביתר שאת אפתחה במשל פי וכמו שזכרנו לדוגמא על האופן הראשון ידיעת הלשונות הנוהגות כי היות הנה, וידיעת דברי הימים לכל עם ועם וחכמת המפה וכו׳ וכו' כן נזכיר איזה דוגמא לבאר מהו הנרצה אצלנו באופן השני הנוגע לפנימיות התורה. על זה בטח אני אומר כי מספר חלקי התורה כן מספר החכמות האנושיות הנצרכות לכל ת״ח לדבר את אויבים בשערה, כי מכל אחת מאלה תוכל לצאת תקלה ומכל אחת מהן נוכל להוציא רפואה למכה, ואדרבה להפיך הקללה לברכה להטיב ולא להרע. ידיעת הטבע לפחות בכללי הגדולים הלא היא הכרחית להשיב שואלינו דבר על ספור מעשה בראשית ומביאים טענות מהגיאולוניא, פאליאוטולוגיא ואיטנולוגיא; ידיעת קדמוניות עמי קדם מצרים, אשור ארם, בבל, פרס, אמונותיהם, מנהגיהם, לשונותיהם, הלא היא הכרחית לכל המדובר בעדם בספרי התורה והנביאים הן להבין הדברים על בוריים הן להליץ במקום שמצאו להתנגד. הן להביא מהם ראיה על קדמות הספרים הקדושים שנזכרו בהם, כאשר יבין כל משכיל על נקלה. ידיעת החכמות המדיניות הלא היא נחוצה להבין ולהליץ על הסדור המדיני הנראה בתורה בין דם לדם בין דין לדין דיני ממונות ודיני נפשות. וכמו שאמרנו על התורה הכתובה כך ראוי לומר על התורה המסורה ועל ספריה ביחס האומות אשר היו בזמנם ואשר ראוי להכיר בקורותיהם מנהגיהם אמונותיהם ומשפטיהם מהטעמים האמורים וביחס החכמות כפי אשר נודעו בזמנם בכדי לעמוד על כונתם בכל מקום אשר ידברו בהם בתלמוד ובמדרשים; יספיק לנו כעת הדונמאות האלה שזכרנו אשר בהן די והותר לכל משכיל להבין מה שרצינו באופן השני מהשלום וההסכמה אשר ראוי לרדוף בין החכמה והדת. ישפוט נא מזה האיש הנלבב אם האופן הזה השני איננו גדול ונכבד בראשן ויותר ממנו, כי אם באנו להעריך שניהם ביחס התועלת הנמשך מכל אחד מהן לאמונה, אין ספק שנראה ונבחין לא בלבד שהאופן השני הוא נחוץ ומועיל כפלי כפלים לצורכי הדת בדורותינו אלה, אלא שבלתי האופן הראשון עם כל הטובה אשר נוכל לקוות ממנו, אם באולי יפרד מהאופן השני שזכרנו יתהפך למעין נכזב ומקור משחת ממנו יצאו נזקים וחבלות רבות ועצימות שאם ינתנו בכף מאזנים והטובות בכף שניה יכרעו הם את כלם - גדולת התועלת מהתקון הפנימי על החצוני נראה לעין בסקירה אחת מהתארים האלה עצמם הנושאים על שכמם, כי כמו שבריאות הגוף והנפש שהם ענינים פנימיים לאדם הם רמים ונכבדים על תקון המלבושים ויפים כן גדלו החכמות הנוגעות לפנימיות התורה על אותן החכמות הנוגעות רק לתכשיט התלמיד חכם; מהראשונות יבא התועלת העצום הנדרש לכל אמונה והוא להכות שרש בלבות בני אדם בראותם כי על אדני האמת נוסדו יחד משפטיה אמונותיה וספוריה, ובפרט בלבות היושבים ראשונה בחכמות האנושיות אשר כל אדם אחריהם ימשוך, ובהם תלוי אושר הדור או השחתתו כאשר הנסיון הוכיח שמהתפקרות החכמים והמלומדים נמשך פריצות ההמון הן רב או מעט כפי המקומות, כמו שהמים הנשחתים במקורם יוליכו העפוש וההשחתה בכל מקום אשר יהיו נגרים ארצה, וכן להפך אם יעלה בידינו לרפאות המים במקורם הראשון שהיא הכת המשכלת לא יוסיפו עוד לבלע ולהשחית ולהכאיב כל חלקה טובה כל עץ גבוה או קטן מהארז אשר בהלבנון עד האזוב אשר יצא בקיר. ולא בלבד גדלה התועלת היוצאת מהאופן השני על היוצאת מהראשון אלא שבלתי ההסכמה הפנימית הלא כל חכמה חצונית אשר תסתפח אל התורה בחצוניותה מבלי שתתעצם עמה בפנימיותה עד שישובו לבשר אחד, תתהפך חלילה לסם המות ברוב הימים, כי אם לא נוכיח לעין כל כי התורה מצד עצמה היא אמתית ומקובלת ורצויה אפילו כפי החכמות האנושיות הנוגעות אליה באיזה צד, כל זווג וחבור והסכמה הצונית אשר נפעול בינה ובין איזו חכמה חצונית אליה לתכלית קשוט ותפארת ההוגים בה, הלא הם בחרב פיפיות יאכלו כל נתח טוב ירך וכתף משני הצדדים, מזה אחד אצל העם הרואים את הדברים מבחוץ יפים והנונים רק תמונה שכלית אינם רואים זולתי קול ומראה וריח, חצוניות, מראה, דמות, דמות כמראה אדם ולא אדם כצלם החקוק בששר וכל רוח אין בו, ומזה א׳ יבוא הקשה מן הכל, אצל הת״ח עצמם כי אין ספק שהתורה יפה מצד עצמה, אך כבודה בת מלך פנימה, לא יצאנית ולא דברנית. לא כחל ולא שרק ולא פרכוס ויעלת חן עד שתמצא מי שידלה המרגלית הטמונה בעמקי הבור, להפך החכמה החצונית האנושית הומיה היא וסוררת, ובתולותיה אחריה רעותיה נטויות גרון ומסקרות עינים לצודד נפשות הקוראים וההולכים לתומם ביופי הסדור וצחות הלשון הגיון המופתים, ומזה יולד שעין הקורא יבוז ליקהת אם הזקנה ולהפך יתפתה אחר הנערה כשור לטבח יובל ובעכס אל ומוסר אויל ויאמר בלבו, מה רב היתרון אשר לחכמות האנושיות אשר נתנו לתכשיט, לחכמות התורה אשר בהן התקשט, ויחזיר אצלו הטפל עיקר והעיקר אפילו טפל לא יחזור, כי ארחות כל בוצע בצע לעשות פשרה בין החכמה והתורה על פי האופן הראשון דוקא שעליו נדברנו, פשרה, לא חמה ולא קרה אלא כמים פושרים הקשים לגוף מחרבות אם לא יפנה גם, ועל הבל, אל האופן השני דהיינו ההסכמה הפנימית והעצמית שכבר זכרנו, אם את הדבר הזה יעשו רבני הדור המחזיקים במעוז האמונה ודואגים על מה שיהיה אחריהם לימים יבאו, אזי, ולא קודם לכי, יאותה להם להתקשט באופן הידיעות שקראנו חצוניות שהם כמו כלים חצוניים להשלים תעודתם ולהפיץ מעינותיהם חוצה במשאם ומתנם, בויכוהם בספריהם להתכבד ולכבד את התורה בעיני הבריות ובפרט בעיני ההמון אשר למראה עיניו ישפוט ולמשמע אזניו יוכיח, כי אז יהיו דומים לאשה יפה בטבעה ומתקשת בקשוטים נאים להגדיל את יפיה, להפך אם יהיו נעדרים מאותן הידיעות השייכות לחלקי התורה בפנימיותה וידמה בעינים למלאות חסרונם ולשמור פקודתם ולעבוד עבודתם באלה התכשיטין החצונים לא תכשיטין אמר להם כי אינם אלא לגנאי, זר יהיה מעשיהם נכריה עבודתם וסופם להזיק לעצמם ולאחרים. (הסוף יבא)."
