article_id,headline,text
021-HLB-1878-03-01-PG001-SINGLE-ORIGNAME_140235_toc_1,") 61 0 # ' מ 361)1^ 108 ( "" 1801101118 1..."," AleOralsche Ausgape des„ISRAOIIE שנת ארבע עשרה N"" 30 נומער ל כל איש יכונ נהש אימתי בזאר ארצות: 18 פ   ים ונשי — סאנטו פ א עליל מיה ממער   ם משגת לשלם  יא נוהו בנוגע א אבי - וכנז ובליק אלה אשר נוכל לשנו יה בכל חנות אפ שה  ר״ט. — ברוססיא תי א  Herrn :הסוכן הכללי אהבי י  ינעם ם Leib Levinsohn in עלות): 2 זילבער גל ועה לתקנל Wilna  לא על אבל לא Balschaia Clita, D. נו נוב שם א (108 — 6 רו״כ 50 קא״פ. לומר גלה השני ראו נאום מכתב עתי בשפת עבר יוצא לאור בכל שבוע להודיע ולבשר ולהורות כל דבר הנדרש לאיש יהודי לדעת באשר הוא יהודי וחבר לחברת האדם מאת מאיר (דר.) לעהמאנן ע״י יחיאל ברי״ל יצי ברך אמונה בחרְתִּי (תהלים ק""ט)"
021-HLB-1878-03-01-PG001-SINGLE-ORIGNAME_140235_toc_2,"2 !878ז1 ^[36 מ2, <3*א^1מ מאינץ, כו"" אד ..."," HAINZ, den 1 Maerz 1878 מאינץ, כ״ו אד״ר התרל״ח"
021-HLB-1878-03-01-PG001-SINGLE-ORIGNAME_140235_toc_3,מאסר ראשי דבר בעתו'. דברי היסים : ממערכו..., מאמר ראשי דבר בעתו. דברי הימים: ממערכות הדיפלומאטיה. הפאבסט החדש. מכתבי סופרים: קאוונא. ודיעות העולם והטבע הטעלעפהאן או הטעלעגראף המגיד לאדם מה שיח רעהו. חדשות שונות. הודעות. הודעות אחרונות ירכתי לבנון: ספור „ומי הבינים״.
021-HLB-1878-03-01-PG001-SINGLE-ORIGNAME_140235_toc_4,דבר בעתו," דבר בעתו ממשלת מדינתנו אשר ברוב חסדה שמה לה לקו בכל פינותיה שהיא פונה להשוות כל בני הדתות תחת שבט ממשלתר, הזכירה לטוב גם אותנו היהודים, ותבוא פקודה משר הפנים לבחור מיוחד מהעם בכל מחוז אשר מהם יבוחר שבעה אנשים לשבת בתור אספת רבנים בקמ״ר פ״ב. ולפי דברי מכה״ע מטרתה רצויה בזה אך לאחד לבות כל עבדיו הנאמנים באופן שלא תהיה שינוי הדעת חוצץ ביניהם, להיות ידם ולבם אמונה לממשלתם, וגם למצוא גדר בעד המתפרצים מעמנו המשמיטים א״ע מעבודת הצבא, (אשר אמנם מעט הוא ומקרה רחום). ועתה אתם שלוחי רבבות עמנו דעו וראו אשר לפניכם, עיני אלפי עמכם עליכם תלויות, להוכיח במישור כי אין נכונה בפי המשטינים הטופלים עלילות שוא עלינו ועל דתנו, חופים דברים אשר לא כן המה, ומחפשים תואנות להפרידנו מן האזרחים, לתת אותנו לשמצה ולמגרעת בלאומים, ואדרבה בכל פנית התורה שבכתב והתלמוד וכל ספרים הק׳ המוסכמים באומתנו, מחובבים אותנו להיות באהבה ואחוה עם כל אשר נברא בצלם, ואין לדון מהפרט על הכלל כלו, כן ימצאו גם מהנוצרים התושבים איזו מתפרצים, וכן נמצאו גם בהם הרבה משמיטים א״ע מעבודת הצבא יותר מהנשמטים מבני עמנו ורבים מבני עמנו זריזים המה לבוא למקרא הצבא וחוב קדוש הוא להם לשמור פקודת הממשלה לתועלת המדינה באמת ובתמים, ואף בזסן שמלכות ישראל נוהגת מבואר ברמב״ם ריש פ״ח מה׳ מלכים שחלוצי צבא בעת מלחמת מצוה מותר להם לאכול כל מאכלות אסורות עפ״י דתנו במקום שאינו מצוי למצוא בהכשר, ומבואר שם עוד פ״ו הל׳ י״א כתב שעושין מלחמה אפילו בשבת. ודברי הימים יעידו ויגידו ויאמרו אמת כי עמנו בטבעם נוחים המה להתאחד עם שכניהם בכל לבם ובכל מאדם. גם אין דתנו חוצץ מאומה מלחיות באהבה נאמנה עם הכל, ואדרבה בכל פנות הדת תחובב אותנו להיות קשורים באחוה עם כל אדם ולהיות עבדים נאמנים לארץ מולדתנו ולהממשלה אשר שרוים בתוכה, וגם מוכשרים הננו לתועלת המדינה בכל ענפי עניניה. אולם בזה נפלגו הדעות, את מי נשלח ומי ילך לנו במקום הגבוה הלזה לענין נכבד כזה. מהם רוצים לבחור במלומד משכיל למען ידע להמליץ דבריו בלשון המדינה, בשפה צחה וברעיונות נשגבות ויהיה תפארת לשולחיו: ומהם רוצים לבחור בתורני בקי בכל פנות הדת מוסכם ומפורסם באומה למען ידע לכלכל דבריו במשפט הדת בכל פרטיה והעם יתנו אמון בו ובעצתו. והנני רואה כי זה כשאלת החנוך הנושנה שהכל מסכימים שדרך הישרה היא, להרגיל הבנים באופן שהתורה וההשכלה יחדיו יתלכדו בם. אך במקום שא״א לקיים שניהם הנה, מי שדתו יקרה בעיניו ביותר, יאמר לדחות ההשכלה מפניה ולקצות בתלתלי קווצותיה. ומי שאושר האנושי חביב עליו ביותר יאמר לדחות הדת ספני ההשכלה. וכן בשאלה זו הנוכחית הנה שתי המפלגות כוונתם רצויה לטובת האומה ולאשרה, ואלו היה נמצא בדורנו איש שלם ומאושר באושר התורה וההשכלה, ושניהם יחד התנוססו בקרבו הנה הוא הגבר אשר אלה לו, הוא יכשר מאד רצוי לכל אחיו להיות שליח מרבבות עמו להליץ בעדם ובעד דתם, אך אם באיזו פלך לא ימצא איש שהכל בו. בזה נפלגו בני דור החדש עם אנשי דור הישן. וכאשר נתבונן נבחין, כי עצת הזקנים מאושרת ביותר, משלשה הבחינות אלה: א) שהרי לא חסר להממשלה אנשי מדע משכילים פליסופים, ואין מטרתה רק להושיב את המצוינים בדור שהם ימצאו אופן לנטוע האחוה בהעם ולקשרם באמנה לארץ מולדתם ולהסיר את המעצורים אשר יוכל להיות בזה, וא״כ יצרך לזה מי שבקי בכל פנות התורה שבכתב ושבע״פ ולהשיב על כל שאלה הנוגעת בתלמוד ופוסקים ואפי׳ בזוה״ק ושאר ספרים אשר מוסכמים בהאומה, כי זהו מה שנצרך להממשלה ושמם מוכיח עליהם „אסיפת רבנים״, ואף אם בלשון עלנים ידברו אבל עכ״פ לא יחטיאו את המטרה, כאשר ראינו שבחר השי״ת במרע""ה לעמוד לפני מלך מצרים להיותו ציר נאמן אף שהיה כבר פה, ובוודאי ילך הדבר במתינות והשאלות והתשובות יהיו הכל ע״פ כתב ואחד הישוב. ב) הנה לאשר התורני והמשכיל צריכים להעזר זה מזה, כל אחד במה שחסר לו, והלא בעיר המלוכה יקר המציאות הוא משלומי אסוני עמנו והאפרתים ימצאו שם למכביר היודעים מצב האומה ומה הזמן והמקום דורש מהם, להעזר על ידיהם ותשועה ברוב יועץ, ג) שאם תצא תקנה חדשה מהאספה לא יאמינו העם לסמוך עליהם רק על המצוינים הספורסמים המוסכמים בתורה ובצדקות, והחוט המשולש הלזה לא במהרה ינתק לטובת האומה, כחפץ הממשלה להשוות כל עבדיה הנאמנים בזכיות האזרחים וחופש הדת לקשרם באגודה אחת. והשי״ת יהיה עם פיפיות, שלוחי עמנו להבינם מה שידברו, ולתת חנם בעיני הממשלה להכירם לטוב ולהפיק חפץ העם וחפץ הממשלה עפ״י יסודי דתנו לטוב לנו כל הימים. כ״ד המציע דורש טוב לעמו ודובר שלום לכל זרעו איש ימיני"
