article_id,headline,text
021-HLB-1879-04-25-PG001-SINGLE-ORIGNAME_150297_toc_1,*' . ^ ^^ 3 013^ 180116 ^ 08 0136 ^068 1...," Hebraische Ausgabe des „Israelit E SE ומצר שנת חמש עשרה נומערא לז מחירו לשנה החפץ להשיג את הלבנון ע״י בוכהאנדלונג או ע""י פאסטאמט  בארצות אשכנז, 12 מארק.  ידרשהו מהם בשמו האשכנזי: 7 פלולין א״וו  באוסטריא HEви AUst DESISRAELIT וסיא ופולין 50 ,5 רו״כ. ברוסיא ידרשהו מאת ישוכן הראשי  בהודו וכינא 1 פונד שטלג. ם L. Lewinsohn. בשאר ארצות 75 ,18 פראנק. Bolschala Uliza. Wina. י בנ חצית או לרבע שנה בחצי אי  בפולין ידכשוהו מאת מסוכן הראשי   ברבע ממחיר הקצוב למעלה. A B. Kaplan, antor zu No מחיר מודעות ר PRAGA bei Warschau. K ם 20 פפעניג בעד כל שורה, ואם מאמר אשר לא יעלה לרצון על נדפסת איזה פעמים ינוכה ראבאט. מזבח הלבנון איננו חוזר לבעליו. הודעת עגונה מקובלת בחנם. מכתב בלתי חפשי לא יקובל. רי אשר יולי ימי אשר יקירי ועשירי ישים איש להשלישים לעוררו ויעורר ל. מכתב עתי לבני ישראל יוצא לאור בכל שבוע להודיע ולבשר ולהורות כל דבר הנדרש לאיש יהודי לדעת באשר הוא יהודי וחבר לחברת האדם מאת מאיר (דר.) לעהמאן ע""י יחיאל ברי״ל יצו דֶרֶךְ אֱמוּנָה בַחַרְתִּי (תהלים קי״ט.)"
021-HLB-1879-04-25-PG001-SINGLE-ORIGNAME_150297_toc_2,^1' 1879ק^ י25 ם<*6 י ^0. 37 I 5*4^2 ן מ...," MAINz, den 25 April 1879  אא"
021-HLB-1879-04-25-PG001-SINGLE-ORIGNAME_150297_toc_3,הנומער הזה הוא האחרון מרבע השלישית משנת ...," הנומער הזה הוא האחרון מרבע השלישית משנת חמש עשרה להלבנון. והננו מזכירים את הקוראים הנכבדים למהר בשילוח מחיר הלבנון עבור רבע הרביעית, ויגיע לידם על הסדר בלי איחור. ואנחנו בעזר ה׳ על משמרתנו נעמוד ועינינו ולבבנו יהיה  המו״ל כל היום בהלבנון כי יעש פרי קדש הלולים טובים ומועילים. אנא ה׳, הושיעה נא!"
021-HLB-1879-04-25-PG001-SINGLE-ORIGNAME_150297_toc_4,מאסר.ראשי: : גדוציס חקרי לב. ... דברי הי...," מאמר ראשי: גדולים חקרי לב. דברי הימים: השקפה כללית על מקרי שבעת ימים האחרונים.  מכתבי סופרים להצדיק רב צדק. חדשות שונות מתפוצות ישראל: שאלת היהודים ברומאניה. וויען. לאנדאן. ירושלם. חדשות וענינים שונים.   הודעות. —  ירכתי לבנון: ספור „רבי יוסף בן גרשון המכונה יאזימאן מראסהיים״.  הוספה: ה מכתבי סופרים: דבר בעתו. קאוונא. ידיעות העולם והטבע: שבט הצוללו קאפפערן, והקאלאניע פארט נאטאל באפריקא."
021-HLB-1879-04-25-PG001-SINGLE-ORIGNAME_150297_toc_5,"גדולים חקרי לב.
א"," גדולים חקרי לב. א ספרות זמננו ודבר עמנו עולים בהגיוני דורש טוב לעמו ויהיו נקראים לפני דעת-הקהל.  א מרמה בלב חורשי רע וליועצי שלום שמחה (משלי י""ב כ') ם א . : צ   בפרוע פרעות בישראל. (המשך מנו׳ 36) 35. עוד יזכרו קוראינו את אשר אמרנו בתחלת דברינו איך הועילו לנו גדולי עמנו המאורות בישראל ברובי תורתם וחכמתם אנשי השם המצוינים לתתם מופת בישראל ולהראות, כי עם היותם ראשי אמנה, היו גם חכמים מחוכמים, וכי נשענים עליהם ודעת דרכם בקדש ובחול, ולינו לקבל באהבה את החכמה ולהגות בה. ובעלומינו, בעת אשר החכמה לרבים כנכריה נחשבה, פעלו האויטאריטעטען שמם וזכרם לטובתה מאד ולכל שוחריה באמת ואמונה, ועתה בחליפת הזמן מהקצה אל הקצה אשר (לדאבון לבבנו) כה ירדו האמונה והדת פלאים עד כי עלינו לבקש אצל בני הדור מליצי יושר לעורר את לבבם להחזיק במעוזן, וכי אלה האויטאריטעטען בעצמם בעלי המופת לישראל שבתקופה החולפת היו לנו לעדים ולראיה מהימנא לטובת החכמה המה בעצמם יוכלו ודרושים להיות עתה לאותות ולמופתים להטות למוסר אזני העם ולהראות כי אלה עם גודל חכמתם היו ראשי אמנה וכאשר בררנו די באר שמה, כי יכולנו לפעול הרבה בכח העדות הזאת: את הרעיון הזה בטח ידע ויודע היטב ה״ס „בעל השחר״, ובלי תפונה לא פעם השתמש בהם ובעדותם בהיותו עפ״י דברי אב״ג נער בישיבות ליטא ובתי מדרש של החסידים. ואם כי לא ידענו אם הועילו לו, יען כי מעשיך יקרבוך כו"" הוא מאמר להלכה מקוימת ודוחה את כל הרוצה להרחיק עדותו למען היות לו מעמד ומצב איתן, אך את גודל האויטאריטעטען ופעולת חין ערכם בעיני העם ידע ה״ס והכיר עד מאד כי כבודם יוכל למצוא מסלות עתה בלב בני דורנו ביום שידובר להשיב בנים לגבול ונחלת אבותם אל חוסן ישועותינו, אל האמונה ודת קדשנו, ויען כי נשבע ה״ס בלבו לרדוף באף ולהכות חרם את כל קדשי דת קדשנו ולבער אחריהם כאשר יבער הגלל עד תומו התהפך בתחבולות למצוא אמצעים ראדיקאליים אשר יועילו להותם במאד מאד, ותהי ראשית מזמתו לשכל אנשים אנשי השם אנשי קדש אלה אשר כגודל אמונתם ותורתם היו גם חכמים מחוכמים וישים לו לחוק לשים רק את אלה ביחוד מטרה לחצי זעמו לחלל את כבודם ולהשליך עליהם שקוצים דבר אשר לא עשו עוד גם אחד מצוררי הדת היותר גדולים, יען מה? יען ידע ה״ס כי אלה ראשי אמנה וגדולי החכמים יוכלו להיות למשל נאמן חי וקים ועדות לישראל גם בימינו אלה שגברה יד החכמה והדעת לבלי יסודו מדת קדשם ימין ושמאל, בעוד יזכרו את מוריהם מאוריהם אלה שחכמתם האירה פניהם ובכ״ז היה כל אחד „צדיק באמונתו יחיה״, מעוז ומשגב לדת קדשנו באופן מאד רם ונעלה, ויאמר ה״ס לפגוע בהם ביחוד לעולל בעפר קרנם ולהורידם משאתם למען לא יהיה להם שם ושארית עוד בלבות בני הדור לעשות כמעשיהם וכמעשה כהני בית אל לאיש האלקים התנכל מזמות ה״ס על אנשי השם אלה להבאיש ריחם ולנבל את שמם וכבודם בעיניהם לבל יאבו וישמעו אליהם עוד, וכל הקורא את מאמרי ה״ס למן היום אשר עשה את השחר עיפה, יתבונן היטב כי את כל זה שם לו למטרה ולתעודת חייו (?) לקצץ ביחוד את אנשי השם ראשי אמנה שהצטינו בחכמתם מפני מדמת ערומים זדון ורשע לבל יוכלו להיות לאותות ולמופתים בישראל כבימי עולם וכשנים קדמוניות, ואף כי סוף סוף כל דבריו ישא רוח ומזמה זו חשב לא תפעל במאומה לנדע קרנות כבודם של חכמינו ז״ל, והמלך החכמ״א הקדים לנחמנו לבל יפול לבנו בראותנו רשע מכתיר את הצדיק"" באמרו מפורש: לא יכון אדם „ברשע"" ושורש צדיקים בל ימוט״. אך רב לנו לבוא עד חקר „חודש רע"" זה ולהוריד עז מבטחו לעולל עלילות „ברשע"" בידענו מראש כי כזה וכזה כל ישעו וחפצו, וכי מטרת תעודתו לשכל אנשים אשר זכו להתגדר בתירה וחכמה גם יחד וההשגחה הרוממה העמידה אותם למורי דרך לדור ולדור דורים, וכי עליהם ביהוד ידו הדה לחלל את כבודם ולנבל את שמם וצור ישועתם. את שלמה המלך החכמ״א משגב עז לעמו ולכל שוחר חכמה הזוכרו למזכיריו נתן לבוז ולשמצה וינחילהו קלון מכבוד, את קרן ירבעם בן נבט ירומם ה״ס בכבוד והדר, את ירבעם אשר למן היום שישראל ידע ועם ה׳ התבונן להבדיל בין קדש לבין שקוץ משומם, בין מוריו הנאמנים ובין מאשריו מתעים לפנים ועד היום, לא ידעו כל שם וכינוי אחר מלך זה רק את השם הנקוב לו בפי חז״ל „ירבעם חטא והחטיא את הרבים כו״, את התנא רבי עקיבא ז״ל רדף באף בשבט עברתו וישליך עליו שקוצים ויטפול עליו שקר ודברי בלע תצילנה אזנים וחיל ורעדה יאחז כל קורא את דברי המשקר המחרף והמגדף את ר״ע מבלי דעת דרכיו בקדש ובחול ומבלי דעת את הספרות התלמודית שכבר הראו לו כחשו בפניו ויתעקש באולת ודעה רבה שלא נשמע כמוהן לרומם בפיו את כבוד אחרי הקוצץ בנטיעות ולתתו עליון על כל חכמינו ז""ל (בטח ראה בו ה״ס את דמותו וצלמו או מצא א״ע מחויב לקרוא אותו אלופו מורו ורבו בשביל... ומאמיני הגלגול היו אומרים בסוד: „עפר אתה ואל עפר תשובי כי הקול קול אלישע בן אבויה מדבר מתוך גרונו של..), את הרמב״ם ז״ל גאון הגאונים ראש גולת אריאל עין ישראל לו דומיה תהלה, העולה לכל ראש בשורת חכמינו ז״ל האחרונים שהשתמשו בכתר תורה וחכמה עד נאמן אשר עיני כל אוהב עמו באמת ואמונה ומוקיר חכמה ודעת אליו נשואות לפנים בהבאת עדים על קרת החכמה, והיום ביותר בשמירת האמונה בעצם תומה — את הרמב״ם אשר למותר ולמחסוד לכלול פאר את רום כבודו אבן נזר במשכיות תולדות ישראל והזמנים, עשה ה״ס לסיר רחצו גם השליך עליו נעל לנבל את שמו בשיח ושיג שלא עלה מעולם על לב מלעיב בחכמי ישראל זרע קדש מחצבתם, ובכל אשר יזכיר ה״ס את שמו משפיל את כבודו והאויטאריטעט שלו עד לעפר מטעם אדיר חפצו ומזמתו הרבה להסיר כל טענה מארזי אל אלה וחכמים מחוכמים להביא מהם עדות לישראל ושמירת דת קדשו, וכן עשה עם הרמ״א ז״ל וגדולי הדורות אשר היו חכמים מחוכמים נוסף על תורתם ויראתם להשפיל את כבודם ומעלתם פן יראה העם בעיניו את גדולי חכמיו אלה ושב ורפא להם באמונת עתותם זאת המסוכנה מאד לריח בן אדם העולה היא למעלה מפני הסבות הרבות הידועות והגלויות אשר תשפילנה עד לעפר, ויפן ה״ס כה וכה לראות אם אין איש בתקופות המאוחרות אשר דורש טוב לעמו יוכל להראות עליו באצבע ולאמר: ראו זה היה חכם גדול ונודע למשגב בעולם, וזה האיש החכם והמחוכם היה שומר תורה ומצוה וידקדק עליהן כחוט השערה, הוא יוכל לחייב את החכמים בכל דור ודור אשר ישליכו מעליהם את מוסרות הדת והאמונה, הוא יהי אות לבני מרי לבל יאמרו, כי האמונה והתבונה לא תוכלנה לדור בכפיפה אחת ובע״כ עליהם להודות כי רק בשרירות לבם ילכו, וזה יהיה אות ומופת לישראל בימינו אלה ללמוד ממנו ודרכיו לשמור תום ולדעות אמונה בשכנם ארץ ובלמדם בחשק לבב את הלמודים והמדעים הדרושים והנחוצים ובהליכות עולם. — וומצא ה״ס לפניו איש מצוין כזה אשר כבודו רם ונשא ומאד נעלה גם אצל הנקובים בשם „משכילים או נאורים"" אשר לשמו מקטר ומוגש תהלות ותשבחות זה מאה שנה, זכר את הרמבמץ (בן-מנחם, מענדעלזאהן) ופרשת גדולתו בימיו ובימינו. ואלו הוה הרמבמ״ן חכם לבר ככל חכמי העמים וחכמי ישראל בכל דור ודור, החריש ה״ס, ולא דבר על אדותו מטוב ועד רע, אך יותר שהיה הרמבמ״ן חכם ופלוסוף נעלה, אזן ותקן וחקר ועשה אזנים לחכמה לכונן את מציאת אלקים והשארת הנפש על מוסדות נאמנים וחזקים (ולא זה המקום לדבר על שטת הרמבמ״ן בפלוסופיא ועד כמה דבריו מגיעים ומחזיקים מעמד אך מכונתו ומעשיו הרצוים נדבר בזה) וביחוד כי היה שומר אמונים ומדקדק כמצות, את עקרי הדת והאמונה עשה לאקסיאמען הבלתי נופלים תחת כל מחקר ואמתתם אמת עצמית גם העתיק את השתי מלות של הי״ג עקרים אני מאמין"" איך ערקעננע פיר וואהר אונד געוויס, ויקדש את החקים במאד מאד ויעמידם כסלע איתן מבלי שינוי אם לא שישנה ה׳ אותם בעצמו ובכבודו, ואיככה יכול ה״ס בעל „השחר"" וראה שיש עד ממהר ועד נאמן כזה בתולדות ישראל החדשה אשר כל משכיל יאמר עליו: מכובד מכובד"" וזה הרמבמץ יוכל בטח להועיל הרבה למטרת אוהב עמו וחפץ ביקר הדת והדעת גם יחד בבואו לעורר את בני עמנו להחזוק במעוז האמונה והדעת, לכן עשה ה״כ עבור הרמבמץ מדור בפני עצמו ובמאמר כעין ספר שלם אשר נקב בשם עת לטעת"" (אשרה בכרם ה׳ צבאות) בקרדומות עלה על הרמבמץ לטרוף זרוע אף קדקוד בן מנחם זה להורידהו מגדולתו ולנדע את קרן כבודו ותהלתו ולטפול עליו חטאים עונות ופשעים בעיני העם. ואף מה ששפחה ועבד אחורי הריחיים בסוף המאה התשע עשרה והעשרים עתידים להכשל באיזה על הטא״, על כלם אשם בן מנחם עפ״י דברי ה״ס וחטאיהם ישא יען כי מידו זאת למו, יען כי למר כי בנ״י המה בני דת"" אחת, יען כי קדש עד מאד את החקים, והוציא ה״ס מזה תוצאה מעוקלת (שלא חשב ושלא עלה על דעת בן מנחם מעולם) לשלול את עממות ישראל וכי בנ״י אינם בני עם רק בני דת אחת, ויבוא ה״ס הנוטע לטעת אמונה חדשה כי בנ״י המה רק בני עם אחד (ולא בני דת אחת יען כי ה״ס יבטל את החקים וישימם לאל), ואמנם מוח ה״ס לא סבל ולא יסבול כי בנ״י המה בני עם אחד ובני דת אחת גם יחד, ויתאמץ לתת רוח בין הדבקים ויביע אולת ורעה רבה בהפרידו את אחדות עמנו ללאומית לבדה ולדתית לבדה ולא קרבה זה אל זה בעיני ה״ס בשום אופן והמחזיק באחת עליו לבטל את השנית, דבר הבל כזה אשר לא עלה גם על לב משוגע או נבער מדעת את עצמות ישראל תעודתו ויחוסו אל לאומתו ודתו, ואשר לוא שאל ה״ס את המן בן המדתא את שאלתו מה אנו""? (אם בני דת אחת או בני עם אחד) כי עתה מצא תשובה מפורשת (כי בן אנגי זה הכיר יותר מה״ס מה הוא ישראל, וכדי בזיון לבעל השחר לבלי שנן בלבו היטב ולדעת בע״פ את כ״ד צוררי ישראל להיות נכונים בידו לעת מצוא או למצער לבל יבוש ויכלם בעוד הם יביעו רק רעה והוא (ה״ס) יביע אולת וזדון גם יחד) תשובה ברורה: ישנו עם אחדודתיהם שונות מכל עם״ כי כאוהב כשונא ישראל ידע היטב כי אחדות ישראל היא: להיות בני עם ובני דת אחת ובשניהם ידגלו מעת היותם לגוי, וכי עממות ישראל אחוזה ודבוקה כשלהבת בנחלת עם דתו המקובלת בהתגלות אלקית. „ועמך עמי"" יוכיח שאמרה רות המואביה בחפצה להכנס בדת קדשנו, בידעה בטח כי עממות ישראל תלויה ועומדת על קבלת ושמירת הדת והא בהא תליא (אך את דברינו אלה נחשוך בדברנו על דבר הכסל ששם ימצא ה״ס מתנת חלקו כראוי לו). מובן מאליו כי רק באזכרה סלה כל המון שיח ושיג של הים וספרו זה בטלים ומבוטלים, אך לא על הבליו אנחנו נדונים בזה, רק על ר שעת לבבו ועזות מצחו ולהראות איך העמיק סרה לשכל אנשים, ויען חושו בו כי הרמבמ״ן יוכל להיות למופת בישראל להשיג מטרה נאמנה עת נשוחה עם בני דורנו לעורר את לבבם לאמונה ודת להיות תמימים עם ה׳ וחקיו בעת יבואו לחסות תחת דגל חכמת מדם, לכן התקוממם גם עליו לעולל בעפר קרן כבודו ולתלות עליו קופה של שרצים שאין עמו כל יחס ברב או במעט. והנה את עלבון הרמבמ""ן תבע ממנו הסופר והמשורר אב""ג ונניח להם את שדה המלחמה, ילחמו כטוב. בעיניהם, ואנחנו לרגל הענין שלנו ע״ד הספרות נראה בזה רק את אשר יזם לעשות הים ברשעת לבבו וכי דרך קשתו ויכונן חציו לפלח את כבוד אלה אנשי השם שהשתמשו יחד בכתר תורה וחכמה כאחד למען לא תהי האויטאריטעט שלהם למכשול על דרכו של ה״ס לצודד נפשות לפורחות ולהסירם מאחרי דת קדשם וכל קדשי ישראל אשר נשבע להרע להם ולא ימיר. אלה סופריך ישראל בימינו אלה, והדור אתם ראו מה חפצם בבית ישראל ואת הדרך אשר יאשרו אתכם! ואם כי לא נבחר כי ע״ד שטת הרמבמ״ן והתוצאות אשר נעשו אח״כ ע״י המתכנים לתלמידיו שלא שמשו כל צרכם או עשו זר מעשיהם, יש לדבר ולבקר הרבה, אך לא מטעמי ולא מדברי ה״ס ולא בדברי רשעתו והבליו שאין בו מתום והנה אמנם חטא פשע והעוה גם החכם גראָטץ סופר דה״י לב״י בהקילו בכבוד חכמינו ז""ל, ואשר להביא במשפט את החכם הדגול הזה נדרש ספר או ספרים להעריך את שגיונותיו גם במקצוע הזה של כבוד חכמים״ על הרבותו לפסוע על ראשי עם קדוש, וכמעט לא יוכל דברו לשלום את אלה המאורות בישראל שצרפו לגדולת תורתם גם את הקבלה או את הפלפול שנואי נפשו תכלית שנאה, וגם הוא יביט על גדולינו רק מנקודת חפצו ואין פעדאנט ועקש כמוהו בענין הזה (עם רוממות גדולתו בספרות דה״י לבני עמנו) עד כי עפ״י דבריו נראה כי בעיניו גדולים וטובים ה׳ ערטער ובעהמ""ח „עמנואל״ על הגאונים הגדולים אשר רק על תורתם היו, היינע ובערנע אשר לא יוציאם בשום אופן מקהל ישראל חשובים בעיניו אולי יותר מהב״י, הר""ן והמרש״א ז״ל ודומיהם אשר אותם זכר כלאחד יד ועל הראשון שפך חצי זעמו, את שד״ל יקרא בשם אם ואת ר״ן קראכמאל בשם אבי הליטעראטור העברית, והנה לא נפון כי המה ישקלו בעיניו או יכריעו מאות גאונים וגדולים בישראל, ואולי עוד נבוא אי״ה לדבר על הח׳ גראָטץ ספרותו, אך למצער הח׳ גראָטץ יתן כבוד ובמדה נפרזה לאלה חכמינו ז""ל שהיו מצוינים בתורה ובחכמה יחד (אף כי הוא ירומם אותם ביהוד בעד חכמתם וצר גדולת תורתם יעמיד בקרן השכה) ירבה לדבר על אדותם ולפאר ולרומם את קרנם בכבוד והדר, (ואשר גם זה וזה גרם כי היס כתב עליהם ביחוד שטנה בהיותו בעל להפך (אנטיפאדע) של גראטץ, כלומר הוא השלים את מלאכת הבטול של חכמינו ז״ל גם חבל און ברשע להוריד לעפר כבודם מטעם שאנחנו נדונים עליו) והצד השוה שבהם שבאו יחד בעקיפין להלל את כבוד חכמינו ז״ל בזדון לבב וברעה רבה, אך אל יפול לבנו חלילה לא מפי גראָטץ וה״ס ודומיהם אנו חיים, ספרי המאורות הגדולים תורתם וחכמתם חיים וקימים עמנו ואלפי שכמותם לא יפילו משערת כבודם ארצה, בהם נדגול והמה כשהיו כן יהיו לאותות ולמופת בישראל לדור דודים, גם העם יראו ויבינו כי מעוקל הוא המשפט המעוקל שיצא בעת „הרשע מכתיר את הצדיק"" ולא תאונה להם כל רעה וכל דורש טוב לעמו יגדור את הפרצות בישע ה׳ ובמקום שקלקלו המה, ועל ה״ס ורשעתו נאמר לא יכון האדם ברשע"" ושורש צדיקים בל ימוט! (ההמשך יבא) משה זלמן אהרנזאהן"
