article_id,headline,text
021-HLB-1880-08-06-PG001-SINGLE-ORIGNAME_170011_toc_9,הודעות," הודעות בע״ה, כבוד הרב הגדול בתו״י כליל השלימות המפואר מוה׳ מאיה נ""י לעהמאנן האב״ד לעדת היראים דק""ק מאינץ יע״א. תמול בא הלבנון ההולך בחושך ומחשיך, ומדבר תועה על חכמי עה״ק, החליף אומנתו מרעדאקטאר למורה רעה בישראל, כמותו לי״ב. זה האיש ידענוהו, מאז היותו פעה״ק שבע תועבות הי׳ בו, ועתה הגדיל צחנתו עוד, וביותר בנטותו אחרי הבצע נתחבר לטמא מ׳ פ׳ שבפה ומרעיו, ונחה עליו רוח הטומאה של מ״פ וג״ז האיש ידוע במדינתו רוסיא כי היה מן הנוטים לשמאל (ובפה עדיף כתרי) מבזה ומלעיג על ת״ח, ואין תמיחתנו אלא על כת״ר אחרי ראו עיניו זה פעמים השריץ צחנתו בלבנון הי׳ לו לגעור בו, והנה הוא כמחריש. גם על רש״ס, הוציא רבה. ועתה הנה עיני כת״ר רואות כי הי' רש״ס מן המנוים הראשונים לחדש הח׳, גם במכתב מחאה שכתבנו באותו פרק ללונדון לראטשילד ולמאנטאנו, הי׳ ה׳ רש״ס מראשי החתומים, גם כל העיה״ק הדור קבלוהו בשמחה. על רי״ב נאמר יסכר פי ד״ש. בטחנו כי מעתה ישגיח מע״כ שלא יכתוב עוד דבר שאינו הנון, גם את פקוא״מ דעי״ת אמשטרדם, יזהיר שימשכו ידם מדברים מבוערים כאלה וכבודו ירום ונשא כנפשו ונפש ידידיו. ועל נוסח הכרוז דמעלד״ז וכל הדברים האלו נחתם בחותם בד״צ דפעה״ק ירושלים ת""ו. זל- חותם בד״צ דקהל אשכנזים מעיר הקדושה ירושלם תובב״א. כותל המערבי.  (הערת המו״ל) המכתב הזה שלחו לנו „אנשי מעשה"" שבירושלם ומפני היראה לא חתמו שמם עליו והתקדש רק בחותם ב״ד, והוצאנוהו לאור לא בעבור „שבחי ירושלם״ שנמצאים בו, כי אם למען הודיע כי שמנו החותם הנדפס על המכתב הזה לעומת החותם ב""ד שנדפס על מכתבים רבים מירושלים שנמצאים בידינו למשמרת מימים רבים, ובהבטה ראשונה הכרנו כי לא ישוה ולא ידמה החותם ב""ד שעל המכתב הזה אל החותם ב""ד שעל מכתבים אחרים. והנה ידענו מכבר הימים כי בעה״ק נמצאים לבשתנו ולכלמתנו זייפנים המזייפים חתימות הכוללים על המכתבים ששולחים עפ""י חוצות לקבץ נדבות על דברים שלא באו ולא יבאו לעולם ורבי אבא דוד שברח מסיביריה והיה לאזרח נכבד באה״ק לקבל חלק מכסף הצדקה, כמעשהו בחו״ל מעשהו בקדש ועושה חותמות מזויופות לכל מי שישלם לו שכר בטלה, והרבנים הגדולים עם הקטנים יודעים את המזייפים ואין מיחה בדבר  כאלו הותרה הרנועה, — אבל עוד לא שמענו כי כה היתה ירושלם עה״ק עזובה ופרועה לשמצה עד כי ירהבו אנשים בני בלי שם לזיף גם חותם ב״ד. ומעתה מי יכול עוד לסמוך על איזו עדות באו״ה ותק""ע מהב״ד שבירושלם אם יש שם זייפנים המזייפים את חותמיהם, ולאו כולי עלמא יכולים להכיר את החותם האמת. והנה יכול להיות כי הב""ד שבירושלם יש להם עתה שני חותמות האחד שחותמים בו דברים שבקדושה והאחד לדברים של חול, ולכן הננו דורשים מאת הרה״ג ר׳ יעקב ליב לעווין נ""י שהוא עתה רב""ד ובידו מונח חותם ב""ד ולא יוציאנו לעולם מתחת ידו ליד אחר, כי יודיע נא אם הוא נתן החותם ב״ד לחתום על המכתב הנז' או לא, וכל הימים אשר לא יודיע האמת לאמתו יזהר כל איש ירא ה׳ וכל רב בישראל לבלי יקבל שום עדות בחותם ב״ד מירושלם. וגם אחרי שיודיעו האמת לאמתו כי ישנו חותם ב""ד מזויף בירושלם אין לקבל עדות ב""ד משם עד שיתאספו מחלקי כסף הצדקה בירושלם לנזור בחרם על מזייפי החתימות כמו שגזרו בחרם גם על למוד שפת ערבי. ותחת אשר החרם על למוד שפת ערבי יראו מדינא דמלכותא להכריז בחוצות ירושלם כדרכם בקדש ויהיו במחשך מעשיהם הנה חרם על המזייפים להונות אלקים ואדם בקדש ובחו״ל יכולים להכריז בריש גלי כי גם ממשלת טירקיא לא תוכל לראות בארצה זייפנים וכו'. ארד בשם ה׳ שוב ירושלים. כרוזא קר וא בחיל. כל באי שערי עיר קדשינו יודעים, כי גאוני ירושלים קדמאי שהיו ידועים ומפורסמים לגאוני הדור וצדיקי יסודי עולם, אסרו באיסור חמור ונורא. לבלתי יתן איש מכל כוללות האשכנזים מזרעו ללמדו בבתי ספר כתב ולשון אחד מבלעדי כתב ולשון הקודש, ובשגם אם יקומו מי ומי מגבירי אירופא לייסד בעיר קדשנו בתי לימוד ללשונות אחרות גדרו הגאונים הצדיקים ההם בגזירה ראורייתא, ובכל חומר על כל איש ואשה מכל כוללות האשכנזים, לבלתי יזידו למסור את בניהם או את בנותיהם לבתי ספר ההם. והנה מלבד אשר מחויבים אנחנו כולנו לשמור את כל דברי הגאונים ההם, ואת כל איסוריהם אשר אסרו על הלימודים ההם כי כל דבריהם בנחלי אש ולחישתן להישת שרף ועקיצתן עקיצת עקרב כידוע, והאיסור החמור אשר אסרו עודנו הי וקיים עומד בתקפו ובכחו כח התורה הקדושה, מלבד זה עיני כל הרואות עד כמה צדקו הרבנים הצדיקים ההם בהטלת האיסור החמור על הלימודים ההם, וכי עד כמה הרגישו בגודל הנזק אשר יזיקו וישחיתו הלימודים ההם בילדי בנ״י לומדיהם, כי עינינו הרואות כי כל הנכנסים לבתי ספר ההם בכל מקום ובכל זמן פורקים מעליהם עול תורה, ועול מלכות, ועול דרך ארץ ותפר יראה, והוצפא ישגא, ומריעים לעצמם ולבני דורם כידוע. והנה ע״כ התאספו יחד גדולי ורבני וראשי כוללות האשכנזים פרושים וחסידים הי""ו יושבי ירושלים עיר קדשינו ת""ו לחדש את כח אותו האיסור החמור אשר אסרו גאוני קדמאי, ולהזכיר ולהזהיר את כל איש ואשה מכל כוללות האשכנזים לבלתי יעבורו על גזירה דאורייתא, וישמרו מאוד לנפשותם לבלתי הלכד במצודה הפרושה לרגלם, ולבלתי תת את בניהם ואת בנותיהם ללמדם כתב ולשון אחרת מבלעדי שפת קדשינו, ולא הם בעצמם יבואו שם להתלמד שום כתב ולשון אחרת ולא יהו מסייעים ידי עוברי עבירה וידעי כי שוחה עמוקה פרושה לרגלם, ושומר נפשו ומוקיר התורה והאכונה ירחק ממנה כאשר יתרחק איש מן נחש שרף ועקרב, וגם בדבר שפת קדשינו בפירוש נאמר, שהמלמדים והתלמידים הדרים בתוך העיר לא ילמדוהו כ״א בחצר ר״י החסיד או באיזה בהמד״ר מפורסם דווקא והדרים מחוץ לעיר המלמדים והתלמידים כמו בנחלת שבעה, מאה שערים, בית יעקב, אבן ישראל, משכנות ישראל לא ילמדו כ״א בבתי מדרשות שלהם דווקא, או עפ״י רשות ועיני העדה ובד״צ. ולהשומעים יונעם ותבא עליהם ברכת טוב. אלה הם קרואי האסיפה. ע״ד איסור הלימודים של כתב ולשון אחר בבתי ספר. נתחדש ז׳ אייר תרמ״ס פעה״ק ירושלים ת""ו: הרב הגאון הגדול דבריסק שליט״א. הרב ר׳ יעקב ליב רב״ד. הרב ר׳ זלמן בהרב הצדיק מוהר״נ ז״ל. הרב ר׳ שמואל מונע. הר׳ הג׳ מו״ה שמואל סלאנט נ״י הרב ר׳ יצחק רב דקראלע. הרב ר׳ מרדכי רב דליפעלאוו. ר׳ חיים ואנענפעלד. הרב דהאסלאוויטש. הרב ר׳ יוסף נאכט, רב דיאם. ר׳ אליעזר דן רלכ״נ. ר׳ יצחק צבי הלוי. הרב דמאלטש. ר׳ אברהם אייזינשטין. ר׳ יצחק דוד. ר׳ יעקב קרינדילש. הרב דשטובץ. ר׳ מאיר מאניקסט. ר׳ אליעזר שפירא כ״ץ. ר׳ יוחנן הירש. הרב דמאטאלע. ר׳ ניסן ב״ק. ר׳ לוי יצחק חב״ד. ר׳ אייזיק יפה. ר׳ משה נחום: הנוסח הזה הוכרז עפ״י שלשה שלוחי רבי דינא פעה״ק ירושלים ת""ו בכל החצירות ממש, וגם בסביבי העיר למושבותם, וכולם הדור קבלוהו בשמחה עד ביאת נ״צ בב״א."
021-HLB-1880-08-06-PG001-SINGLE-ORIGNAME_170011_toc_10,מודעה," מודעה נכונים אנחנו לקבל קאממיססיאן מכל החפץ להשיג ע״י אתרונים מכל הסארטען וגם לולבים והרסים ירוקים כפי מחירם בטריעסט ובתוס' קאממיססיאן 12 וחצי קאפ׳ מכל אתדוג, 10 ק׳ מכל לולב. 50 קאפ׳ מכל פעקיל הדסים. והננו נכונים לשלח סחורה טובה לכל דורש גם ע״י נאכ- נאהמע בשלחו אליני אויפנאבע 50 ק׳ לכל אתרוג, 25 לכל לולב, 1 רו״כ לכל פעקיל הדסים ונקוה להפיק רצון מכל הדורשים לעשות מסחר עמנו. האחים אהרן ואברהם בירגער במינסק ברוסלאנד. Aron Burger, in Gour. Minsk, (Russland( :האדרעססא אלינו"
021-HLB-1880-08-06-PG001-SINGLE-ORIGNAME_170011_toc_11,פאנסיאנאט," פאנסיאנאט עוד מקום אתי בביתי לקבל נער אחד לכלכלהו לגדלהו ולחנכהו בתורה ודרך ארץ ולהשניה עליו ועל למודו באחד מבתי ספר הגבוהים אשר פה. והנני מוכן בכל עת להשיב לשואלי על דבר שכרי בעד הארוחה ולמוד וכו'. אליעזר (המכונה דר.) כהן, רב לעדת ישראל בוויעסבאדען. Dr. Haln. BABBINER der alt judischen geneinde I WassADRN, (Deutsesland"
021-HLB-1880-08-06-PG001-SINGLE-ORIGNAME_170011_toc_12,מודעה," מודעה הנני מידיע לכל מכירי ויודעי שמי, כי באהבתי להלבנון ולהמו״ל קבלתי שנית את הסוכנות על הלבנון ועל האיזראעליט והישראלי עד אשר ימצא המו״ל סוכן תמידי בלבבו. ובכל זאת עסקי כמאז כן עתה עסק הקאמיסיאן לכל הסחורות הנדרשים מפה ולכל אשר יובאו הנה, ובעז״ה אמלא חפץ דורשי כלבבם. וכעת שאלתי מכל אלה שלא שלמו לי עדין המגיע מהם בעד העלים שקבלו על ידי כי לא יאחרו לשלם כי בא מועד. האדרעס אלי: אבא יצחק עפשטיין, נאלעווקי נו׳ 27, ווארשא."
021-HLB-1880-08-06-PG001-SINGLE-ORIGNAME_170011_toc_13,"ד
 אל הקוראים הנכבדים ברוסיא"," ד  אל הקוראים הנכבדים ברוסיא כבר הודענוכם שאין לנו עוד סוכן כללי בווילנא, והחתומים המקבלים את הלבנון מווילנא ישלחו כסף מחירו אלינו למאינץ כפי האדרעססע הזאת: J. BEI, Hintere, Bieiche 18 in MAlNz (Deuteand. והננו מקוים כי אלה המעטים דקים להו כהאי תנא דאמר שכר מכ״ע בלה״ק אינו משתלם אלא לבסוף, יתעוררו עתה לשלם את המגיע מהם כפי החשבון ששלחנו להם כבר, כי כבר כלתה שנת השש עשרה להלבנון. דאלה הנכבדים אשר גם מחיר מכ״ע עברי כמכ״ע רוססי ישלמו במוקדם ימהרו גם הפעם לשלוח אלעו המחיר בעד שנת י״ז שכבר החלנו לספור  המו״ל ו תברכם נפש"
021-HLB-1880-08-06-PG001-SINGLE-ORIGNAME_170011_toc_14,"יצא לאור ספר
אוצר הספרים."," יצא לאור ספר אוצר הספרים. לידיעת ספרי ישראל מיום שנכתב ספר עברי על הארץ עד התרכ״נ (שנת האסף המחבר אל עמיו), נדפסים וכתבי יד. חובר מאת הרב החכם וסופר הביבליאגראף המובהק והנודע מהו' יצחק אייזיק ז""ל בן-יעקב מווילנא. את כלם יפקוד בשמותיהם, שמות מחבריהם, יבאר תוכן עניניהם מקומות וזמני הדפסותיהם, תבניותיהם ותולדותיהם, ועלו ובאו בז חקירות מאנשי מופת בעלי אסופות ישנים גם חדשים על כל אודותם והברעת המחבר. הכל בסדר יפה ומועיל עפ״י א״ב מטעם בחירי דליי-וי -אנ ללשונותם למצוא דברי חפץ. הוא האוצר שכבר נגלה ברום עולם החקירה והדרישה לחכמת דשימות קדמות ספרי ישראל, וכל חכמי הדור אשר ידעוהו ושמעו את שמעו עודנו בכ״י מלאו פיהם תהלתו: כי לא בא עוד כאוצר הזה באוצר ספרת ישראל, יוקירו מאד את חין ערך פעולת המחבר ועבודתו הנכבדה והכבדה (כמבואר בהסכמות הגאונים ומכתבי חכמי הדור הנדפסים, מעט מהרבה, בראש הספר) בהיותו פנת יקרת ידיעת הביבליאגראפיע למעין ישועה והוסן רב לתורה ולתעודה ולכל חכמה חמודה בכלל גם לתולדות ב״ע וגדולינו בפרט. ערן עקס פארמאט (אקטאף גדול). נדפס כלול בהדו, בשלי זה ח מחירו ליהידים עם פארטא: ברוססיא 4 רו״כ 60 קא״פ; באשכנז 15 מארק; בצרפת 18 פראנק, בבריטאניא ואמעריקא 15 שיללינג; באוסטריא 8 פלארין. החפץ במכורך יפה עליו להיסיף עוד 65 קא״פ על המחיר הנ״ל. לסוחרי ספרים יותן ראבאטט נכון. החפץ בו יפנה אל בן- המחבר הוא המו״ל על הוצאותיו: .J. Bengacob, in Wilna, (Russland, Sirotskaja Str. Nro. 27/10. .P. 8 החתומים זכו כבר במקחם שנקצב להם בשנת תרל״ז ע״י מכ״ע, וימהרו נא במחירם כי נדפסי עקועמפלאראן במספר מעט."
021-HLB-1880-08-06-PG001-SINGLE-ORIGNAME_170011_toc_15,הודעה," הודעה גם בשנה זו יהיה אצלי אתרונים מאה״ק טובים ומהודרים, גם לולבים ידוקים והדסים, וכל הרוצה לבוא במסחור עמדי יודיעני על אדרעססע שלי כחתימתי ואבטיח להקונים שיהיו שבעים רצון ממסחרי בכל הפרטים. ברוך ברוידא בקאוונא."
021-HLB-1880-08-06-PG001-SINGLE-ORIGNAME_170011_toc_16,להודי, להודי לכל מכירי ויודעי שמי כי גם בשנה זו יהיו אצלי אתרוני אה״ק טובים ומהודרים גם אתרונים ממקומות אחרים והכל ממינים מובחרים וכן ימצא אצלי לולבים ירוקים ומהודרים איטאליענים וכן הדמים אשר כל זה אני משיג ממקומם בלי שום יד אמצעי ולכן אוכל למוכדם במקח השוה וכל מי אשר יפנה אלי אף ע״י מכתב אקוה כי ישיג מבוקשו וישבע רצון. האדרעססע אלי בשמי: אבינדור מאיר גארדאן אין דינא מאסקאווער פארשדאדט ייעהאנא שטראס 23
021-HLB-1880-08-06-PG001-SINGLE-ORIGNAME_170011_toc_17,מענה בקצרה," מענה בקצרה קבלנו: מידי״נ הרמז״מ בשאוו׳ 4 רו״כ, ורשמנו 2 רו״כ ע״ח השנה החדשה. מכתבו קבלנו ונשיבהו כאשר עם לבבנו. — מה׳ מ׳ זלאטקין בראס׳ 3 רו״כ, ועוד 3 רו״כ עבור ה׳ ליפשין. — מה׳ ל""ש בשקור 2 רו״כ. — מה׳ י״ס ביאנאווא 75 ,2 רו״כ. — מה׳ שרייבער בסלאבאדקא 36 ,1 רו״כ. — מה׳ בנימין רייכלין בסט. רוד 1 רו״כ ומגיע ממנו עד סוף הרבע עוד 37 קא״כ. — מהג׳ מוהרשמ""ש בדי׳ 10 רו״כ, ויקבל בקרוב גם הספרים. — מה׳ רובאש׳ במע׳ 4 רו״כ. — מה׳ שפ״ש בזי׳ 2 רו״כ, חשבונו מדוקדק, כי במשך השנה שלח 99 ,6 רו״כ וא״כ מגיע לחשלום השנה 51 ק'. מאמרו יראה אור. - מה׳ ה׳ ב״מ בווינדאווי 6 רו״כ. לפני נעילת שערי הלבנון הגיענו כתב מרירי מעה״ק ירושלם מתלונן ומתאונן על ממאמר „דבר בעתו"" בהלבנון בו׳ 47. ובאשר הכותב לא חתם שמו על המכתב אין אנו נזקקים להשיב על חלומותיו ועל דבריו אשר יעידו בכותבם כי עודנו נער ובער. אי לך ירושלם שנערים מנוערים ימשלו בך!"
021-HLB-1880-08-06-PG001-SINGLE-ORIGNAME_170011_toc_18,*111 410 ^0(1*01100 V6^0^0*111011 1£11]£..., Fur die Redaction Verantwortlich Dr. LANN — Druck Von J. Bril in Muin
