article_id,headline,text
021-HLB-1878-03-01-PG001-SINGLE-ORIGNAME_140235_toc_8,דיעות העולם והטבע," דיעות העולם והטבע הטעלעפהאן או הטעלעגראף המגיד לאדם מה שיח רעהו. נעתק ממאמר החכם א. בערינשטיין מאת שלמה צבי פאסיוויאנסקי מקאו ונא ד. להתוות גבול וחקר ליקר ערך הטעלעפהאן ושמושו, לא יוכל עדנה שום איש בזמן ההוה. היסודות אשר עליו הטבעו פעולותיו עודם חדשים בידיעת חכמת הטבע, ולא נוכל להגיד מראש עד כמה תגדל ותתרחב פעולת המכונה הזאת, ועד כמה תתפתח ותשתלם בימים יצרו. אולם את זאת נוכל להגיד בבטחה, כי אף כמעט עודנה לא באה לידי השתלמותה בכ״ז רבת כח, גדל העלליה, מפלאת לעשות היא, ותעלה בערכה על יליד ויציר נברא של ההוה היותר חדש והמועיל ומטיב לכל, והוא הטעלעגראף אשר פרש מטות כנפיו במלוא רחבי תבל, להביא ממרחק שיח ושיג בי איש לרעהו הרחוקים קצוי ארץ ואיים רחוקים. גם עתה הראו לנו נסיונות שונות למדי כי אין קצה וגבול למפעלות הטעלעפהאן ותועליותיו הצרורות בכנפיו. כפי הודעת המכ״ע כבר צלחה בידי המכונה הזאת להעביר את הדברים המדוברים באירלאנד לאזן השומע בנויארק. גם מראש נחזה כי השבתות (שטערונגען) מחזיונות הכובד על כל החוטים המנהלים אשר בין מזרח למערב מכרור הארץ תוסדנה ע״י זרמי הטעלעפהאן היותר מהירים באין חקר אשר לא ייעפו ולא ייגעו על דרך העברתם, ובדבר הזה בלבד הנה יתר שאת לו, יען כי יוסרו כל המעצורים השונים אשר יקרו ויאתיו בהעברת הטעלעגראף ע״י החוטים המנהלים המונחים תחת הים אשר יתנהלו דרך הקוים המקבילים (פאראלעלקרייזען) אשר לארץ. כמו כן גדולה מאד תועלת הטעלעפהאן ביחס החוטים המנהלים בין אורופא לאמעריקא, בעוד לא יצטרכו למכונות היותר ענוגים ודקים, אשר ישתמשו עמהם עתה לתת אותות ממצוקי ארץ האחד אל השני. הן נודע כי עד כה לא צלחה עוד לעשות כמתכונת כל מעשי מכונת המכתב הנהוגים, למען יביא ע״י החבלים הראשים כתב עצמי, ונאלצו עד עתה להשתמש ע״י אותיות נראים מאוד שבור, אשר לדרש היה לזה אומן הטעלעגראף היותר מהיר להפוך את זאת לכתב הנהוג. והיה בבוא הטעלעפהאן להשתמש ע״י החבלים, אזי הדברים המדוברים נשמעים וקשובים היטב ובקלות יתר הרבה מאשר ע״י האותות הרשומות בקוים ונקודות על פסות הנייר רק לעין הרואה, אשר המה בעצמם אין להם כל מובן ומושג ורק ע״י יחס והשתוות נדע לפתור את תוכן הנקודות והקוים האלה לדעת את החתום בהם. בעגלא ובזמן קריב ידעו ויכירו לדעת כל העם את גורל ההבדל בין הדבור החי ובין הנקודה אז הקוים המתים שאין בהם רוח חיים, אשר אין ערוך אל תועלת הראשון מהשני. השטענעגראף הנוטה אזן והסאזין ומקשיב לקול הטעלעפהאן יוכל לבטחה ובברור לכתוב לפניו את הדעפעשע אשר שמעה אזנו כמו התיצב בעצמו בעדת הנאספים לשמיע את דברי הנושא מדברותיו שמה. יקרת הטעלעפהאן וגודל ערכו הוא ביחוד, כי להעברת דבור הטע- לעפהאן לא נדרש כשרון טעכניק, כאשר בהעברת ומעשה הדלונדרב, באופן פשוט מאד נוכל לשמוע ולדבר כמו שנעשה יום יום בחברת אנשים. יש לקוות כי בבוא הטעלעפהאן לעצם הכנת תשמישו, יוכלו שני אנשים לדבר איש את רעהו זמן כביר, וישמע רק בין המדבר והשומע, מבלי צורך להיות עד ביניהם, כאשר להדלוג רב אשר עלינו לסבול את הטעלעגראפיסט אשר יודע הוא ועד על כל סוד כמוס אשר ידובר בין איש לרעהו בענינים שונים. אף כי השמוש עם הטעלעגראף כבר נודע לנו הרבה, בכ״ז נתפלא כאשר יסופר לנו כי בתי אנשים פרטים ברחובות שונות יחוברו על ידי הטעלעגראף יען כי פה יחשבו כי רק לפקידי הממשלה המשפט והרשות לעשות קוי טעלעגראף כאלה, ואשר אמנם גם זה יעבור ויבטל כאשר תהיה היכולת לדבר איש את רעהו באיזה מרחק מבלי עזרת טעלעגרא- פיסט מלומד. באמעריקא כבר ערוכים ומוכנים בתי מסחר בהתקשרות הטעלעגראף עם אדוניהם, גם בעלי ברית המסחר אחד עם רעהו ישתמשו לדבר את דבריהם ועניניהם עם התקשרות קוי הטעלעגראף המיוחדיה להם. אמנם כן אין כל סבה אשר תעצור בידי תושבי הארץ בעת אשר בני העם ימצאו חפץ למהר את דבריהם ע״י מכונות שונות הערוכות לזה ביחוד יתפשט ויתרחב השמוש כזה כאשר תתפשט מכונת הטעלעפהא למצוא לה מהלכים בין אדם לחבורו, בעוד יקטן ויוזל המחיר במאד מאד, סבלי צורך למכונות המארוע או טעלעגראף האותיות אשר ישתמשו עד בה, ויותר מזה נוכל לקוות כי השמוש עם הטעלעפהאן בתוך הבית פנימה גדל וירחב במאד מאד, מבלי צורך עוד להשמעת קול הפעמון אשר וצלצל לבשר את בוא האורח או את פקודת הבעה״ב לעבדיו, יען אשר המכונות הישנות הודיעו רק את הקריאה לבדה, אבל לא את דבר הפקודה באר היטב. החוטים הקלים הדרושים להטעלעפהאן ישמיעו ויודיעו כל דבר ודבר בדיוק נמרץ ובקלות נפלאה. אף כי להטעלעפהאן יחסר עוד דבר אחד, והיא הקריאה בקול רם למען ידע השומע כי נדרש לו להגיד דבר מה, כי לפי עריכת הטעלעפהאן כפי שהיא עתה שומע האיש הזה אשר יטה אזנו אל מפתח המכונה, ולמען הגיד להשומע מראש כי עליו להטות אזנו נדרש להודיעו מזה ע״י איזה אות למען ידע את אשר עליו לעשות, בכ״ז בהיות מנהלים עלעקטריים לא קשה הדבר למצוא אות ולפעול את הקריאה בקול רם למען ידע השומע כי דבר לרעהו במרחקים ואליו לשיח עמו על דבר ענין נחוץ הדרוש לשניהם. עוד יש לנו לחכות בבטחה כי בטח ימצאו אופנים נכונים איך להכשיר אותו עד מאד למען יהיה השמוש אתו טוב נעים ומסוגל גם יחד אם כי נפלא הדבר אשר ע״י הטעלעפהאן נוכל להכיר בבטחה את קול המדבר בכ״ז נדרש איזה כשרון ותקון בהטעלעפהאן למען הקל את הרעש ודברה המעטה אשר נשמע בהעברת הקול. פחי הברזל אשר ישתמשו בהם דרושים להיות מתוקנים וענוגים יותר למען יאבדו מקרבם את קול המתכת המיוחד אשר להם ורק את דבור קול האדם וחתוך קול המלות לבדה ישמיע בטוב טעם. זאת תורת הטעלעפהאן או הטעלעגראף המגיד לאדם מה שיח רעה החדש מקרוב בא בחכמת הטבע, ואם גם בראשיתו לא מצער הוא, אבל אחריתו ישנא מאד מאד, ויושבי תבל ושוכני ארץ יקדמו בשמחה את פני האורח הנכבד אשר גדולות ונצורות הביא בכנפיו להטיב ולהועיל לקרב רחוקים, ולהגיד לאדם מה שיח רעהו בכל ענין וקנין בעולם. ומי יתן והממציאים הנכבדים אשר ימציאו המצאות נכבדות, גדולות ונצורות שרורות בכנפיהן חדשות אשר נעלמו מעין כל חי, גם ישנות אשר לא הובאו עוד אל תכלית שלמותן כן ירבו וכן יפרוצו, ותמלא הארץ דעה כמים לים מכסים."
021-HLB-1878-03-01-PG001-SINGLE-ORIGNAME_140235_toc_9,חדשות שונות," חדשות שונות — (מספר הדתות השונות באזיען). מפני כי דבר המושלימאנים והנעשה עמהם בימינו אלה עורר עתה את חפץ כל אחד לדעת מה אתם וכמה מספרם, לכן הביא לנו המכ״ע „רעוויע געאגראפהיע"" הודעות ע״ד בעלי האמונות באזיען: בסיביריען עולים מספר התושבים לסך 3,400,000 נפש, מהם 1.800,000 בעלי דת הפראוואסלאווען 800,000 מהמורנים 600,000 עובדי אלילים, באחוזות ארצנו באזיען בבוכארע דזינגאריע וטור- שעסטאן נמצאים 8,941,000 מחמודנים, בקאוואקע נמצאים לערך 4,890,000 תושבים אשר בעלי הדת המתיחסים אל דת הרוססית יונית והארמענית עם המחמודנים כמעט עולים במספרם שוה בשוה. בטירקיא האזיאטית נמצאים 300,000 נוצרים עם 10,000,000 מחמודנים. בערב 4,000,000 מחמודנים, בפרס כמעט כל התושבים העולים במספרם 5,000,000 המה בעלי דת מחסד. כמו כן נוכל להגיד על תושבי ארצות אפגאניסטאן קא- פיריסטאן ובעלודזיסטאן אשר מספר התושבים עולה לערך 5,300,000 נפש. בארץ חינא אשר שמה תושבי הארץ עולים למספר 425,000,000 נפש, הרוב מהם המה מבעלי דת קונפוציוס ובודהא. יהודים ונוצרים מפוזרים כמעט בכל הארץ הזאת, מספר הקאתו ליקים עולה לסך 1,000,000 נפש והמיססיאנארען הפראטעסטאנטים מוצלחים המה שמה להכניס רבים תחת כנפי דתם. ביאפאן אשר מספר תושבי הארץ עולה עד 33,000,000 נמצאים אלה מבעלי דת חינטא ומבעלי דת בודהא במספר שוה בשוה. בהודו עם ציילאן נמצאים 238,000,000 תושבים והמה מבעלי דת בראהסינען, מכל התושבים בעלי דת בודהא נמצאים לערך 25,000,000. מחמודנים 50,000,000 ונוצרים לערך 4,000,000. באינדאקיטאי אשר מספר התושבים עולה שמה לערך 25,000,000 המה בעלי דת הבודהא. מהחשבון הזה יוצא לנו לדעת כי באזיה נמצאים לערך 85,000,000 מחמודנים; אך המספר הזה עוד מעט הוא בערך בעלי דת המחמד הנמצאים הרבה שמה, אל המספר הזה נצרף את 50,000,000 בעלי דת מחמד באפריקא אשר שמה דת המחמד הולכת ומתפשטת הרבה מאד. (חובות הממשלות). המכ״ע נאוואסטי מביא חשבון ומספר מסכומי הכסף של חובות הממשלות: חוב ממשלת צרפת עולה לסך 29 מילליארד 403 מילליאן פראנק. חוב ממשלת בריטאניה עולה ג״כ לסך עצום וגדול מאד והוא 19 מיליארד 600 מיליאן פר, הוב ממשלת שפא- גיען לסך 10 מיליארד 243 מילליאן, חוב איטאליען סך 9 מילליארד 883 מיליאן, חוב רוססלאנד 9 מיליארד 445 מיליאן, עסטרייך-אונגארן 6 מיד ליארד 810 מילליאן. חוב טירקיא 4 מיליארד 928 ביליאן. חוב בעלגיען בס״ה 942 מיליאן. חיב שווייץ בס״ה 31 מילליאן פר. מכה״ע עווענעמאנט יעיר ע״ז כי באיזה ממשלות לפי חשבון מספר מפקד החובות הגז׳ כמעט לא יאומן אשר ישולמו באיזה זמן מן הזמנים, וכי לפי מצב הפינאנסען יעיק על איזה ממשלות לשלם גם את הצינזען העולים על החובות הגדולים והעצומים במאד מאד. הכנסת אוצר הממשלה בשנה העברה מהמדינות הנאחדות באמעריקא עלתה לסך 269,000,687 דאללאר וההוצאה 238,660,009 דאל. (בהמספר הזה נכלל גם 97,124.512 דאללאר פ״צ על חוב הנאציאנאל) ונשאר ההכנסה עודפת על ההוצאה בס״ה 30,340,578 דאלאר. משנת 1862 נתמעט חוב הממשלה על סך 658.992,226 דאללאר. המעתיק: נח איפפ."
021-HLB-1878-03-01-PG001-SINGLE-ORIGNAME_140235_toc_10,הודעות," הודעות לבן שיניים (מילך צעהנע). האדם יולד חלש ורפה כח, ומיתרי החיים יחשבו להנתק מכל חול אשר יארב עליו לרגעים. והנה כעת אשר שיניו יחלו לצמוח, מעת היותו בן חמש ירחים, עד אשר יחליפו עליו שלש שנים, אז נכון הוא לכל פגע: מכנה גופו ירופף ועצביו יתפלצו, דיר ירד מפיו על לחיו, ושאת וקדחת ואחזוהו. כל אשר יתפוש ביד יושיט לפיו, וכמו יראה את מקום מרותו רק הילד, אשר נולד חזק ומוצק, הוא יתגבר על מחלהו, ועמודי בריאותו לא ימוטו. אפס אם חלש הוא ושניו בכבדות תצמחנה, אז קדחה תקיר בקרבו, דלקת בראשו, מכוה באזניו ושאת במקום מושב השינים, את גופי יאחז השבץ העבול ובני המעים ישחתו וקרוב הוא כי יקראנו אסון. וכבר נועעו חכמי הרופאים למצוא רפאות תעלה, למהר ולהקל את צמיחת השנים. אפס הנסיון הורה, כי יתר שאת לתעלה, אשר המציא אחד מראש רופאי דורנו היא התעלה הנקראת: רביד עלעקסראמאטאריש לשנים, וכל התעלות אשר המציאו שאר הרופאים לא תשוינה לה ולא תערכנה לה, ובמשך ימים מעטים פרצה תהלתו, תועלתו וטובו בארץ, ומלכים ושרים כנסיונם, ורופאים במדעם העירו והכירו, כי הרביד הזה לבדו יעזור להנערים ויסיר כל מחלה מהם. והיה כאשר תגיע העת כי שניו תצמחנה אז ישימו הרביד על צוארו ויומם וליל לא ימוש ממנו, ובקל יבקע כשר השנים, והשנים תעלינה ותצמחנה מהרה, והדביר הזה יוסיף גם לתת חיים חדשים בבשרו ובעצביו והעלם ינצל מכל פגע וגם בווילנא"
021-HLB-1878-03-01-PG001-SINGLE-ORIGNAME_140235_toc_11,על ובחנו אדרעס הרביד אבות הזה יביס למטח ...," הדביר הזה ימצא כעת בידי וכל החפץ לקנותו יבא אלי או יכתוב על אדרעס הנקוב למטה וישיגו במחיר 1 רו״כ עם פארטא Chaim Herz Kodkin in Wilna Deuische Strasse, Haus Klot"
021-HLB-1878-03-01-PG001-SINGLE-ORIGNAME_140235_toc_12,EGERS ROTEL in BERLIN," EGERS ROTEL in BERLIN הלא ידוע, ועתה נתקנה ביתר שאת בחדרים מרוחים וכל מיני מטעמים מתוקים לחיך, ריח ניחוח, ובמשרתים נמהרים וחשים למלאות חפץ האורח, לכן הנני מתכבד לבקש מעוברים ושבים לסור אל בית סלוני ובאשר מחוק המדינה הוא עתה בלי לשלוח משרת על הבאהן לקבל פני האורחים ויסתעף מזה השנת גבולי כידוע, לכן הנני רושם האדרעססע שלי ונא לשים עין עליה. S. Eger Berlin, Kloster Strasse No. 97."
021-HLB-1878-03-01-PG001-SINGLE-ORIGNAME_140235_toc_13,הודעה," הודעה יש אתי בית מלאכת עבוד עורות על ווייסנערבעריי ערוך בכל ושני אלפים רו״כ אחפוץ ליתן למי אשר לו יד ושם במלאכה הזאת גם תעודה נאמנה על ישרת לבבו למען הצב בבית מלאכתי את המסחר עורות. ומי אשר אלה לו יפנה אלי וישמע פרטי הדברים הנוגעים לעסק הזה. S. M. Thal Talsen, Curland (Rassland."
021-HLB-1878-03-01-PG001-SINGLE-ORIGNAME_140235_toc_14,"יי""ש הנעשה על טהרת הכשר:"," יי""ש הנעשה על טהרת הכשר: להתודע ולהגלות לכל סוחרי י""ש בארצנו רוססיא ובארצות אחרות כי ישיגו גם בשנה זו יי""ש של פסח אשר נעשה בהפאבריקען שלי זה אחת עשרה שנים ביתרון הכשר אף למהדרים וחרדים במאד. וכל הקונים ממני בכל השנים שעברו יעידון ויגידון כי נכון לתת תודה על כושר מפעלי וכי היי״ש שלי סובחר וטוב בריחו וטעמו זך ונקי לטוהר, והודות לה׳ כי הגדלתי הפאבריק שלי פי שנים ועוד יגדל בע״ה כי מדי שנה בשנה ירבו הקונים אצלי מארצנו ומארצות אחרות, וכל מי שחפץ לבוא עמי בקשר Baer Jofie in Crodno :המסחור יפנה אלי על פי ראדרעססע הזאת והנני למלאות בקשתו באופן היותר טוב וספיק רצון. פה הוראדנא, שנת תרל״ח לפ""ק. דובער בהגאון מו״ה מרדכי נימפל יפה."
021-HLB-1878-03-01-PG001-SINGLE-ORIGNAME_140235_toc_15,אתכבד להודיע לכל יודעי שסי ולא ידעו אותי...," אתכבד להודיע לכל יודעי שמי ולא ידעו אותי, כי אנכי מאז בואי לווארשא הנני קאממיססיאנער לכל הסחורות הנדרשים ולכל אשר ישלחו חנה, וכל אשר ינסה עסקים עמי תקותי כי יהיה מלא רצון ממני בעזר ד׳, אבא יצחק עפשטיין והנני עומד על משמרתי לסור למשמעתם (סוכן הלבנון על ערי פולין), בווארשא רחוב נאלעווקי 27."
021-HLB-1878-03-01-PG001-SINGLE-ORIGNAME_140235_toc_16," מודעה
 ","  מודעה   אודיע למיודעי ומכירי, כי חבורי 1) ידיעות השיעורים על המדידה והתחלות אלגעברא, 2) צפנת פענה, 3) תוספה להערבון, 4) קונטרס „כהן ללא אלהים״, נתתי על יד ידידי המשכיל והנבון מו״ה בנימין מאיר מהרש״ק המכנה (מאקס מארשאק), איש צעיר לימים ונכבד אשר רוח בו להשכלה, והוא חבר ומשען לבעלי אספות אשר התנוססו בליטעראטור העברית ושוקד בכל עת לטובתם ולעזרתם ביגיעה. גם מסרתי לו למכור הבורים „ספורים בשיר ושירים שונים מאת שני בעלי אספות, והם בערכם כמו השירים היותר נכבדים אשר יצאו לאור עד עתה. — מהות ואיכות החבור „ידיעות השיעורים"" מבוארות בפרטות בההודעה הנדפסה בסיף החבור ספורים שונים וכו׳ הנ״ל, וגם שם נקצב המחיר לסוכרי ספרים החפצים לקנות סך מסוים מעקסעמפלארען. ווארשויא כ״א לחדש אדר א׳ תרל״ח גבריאל יהודה ליכטענפעלד."
021-HLB-1878-03-01-PG001-SINGLE-ORIGNAME_140235_toc_17,הודעות אחרונות," הודעות אחרונות האגענס רוססע מבטחת לדעת כי בספר ברית השלום לא נמצא כתוב אשר חלק אחד מבאסניה תספח סערביה אליה. — השר היועץ המפקד על עניני המלחמה בבריטאניה הודיע בבית מועד נבחרי העם . חדש הזה, כי המחנה הראשונה מצבאות בריטאניה מוכנת ומזומנת בכל הדרוש למלחמה, וצרכי המחנה השניה הולכים וקרבים במהירות אל הגמרם. — ביום הנז׳ הודיע לארד דערבי בבית מועד נבחרי האצילים כי לא קבל עוד הודעה ברורה אדות תנאי השלום, והודעות שונות באו לאזניו על אדותב, אך זאת ברור, אשר אחד מתנאי השלום הוא אשר בולגאריה תהיה לממשלת נסיך ותשתרע גם בעבר הדרומי של הבאלקאן וגם מחוז אחד מהמחוזות אצל הים העני יחשב לבולגאריה; רק לא ידע אם גם עיר סאלוניקי תספת לבולגאריה. ואדות התשלומים חלף הוצאות המלחמה אשר נוטלו על ממשלת השולטאן; יש אומרים כי יעלו מסך 150 עד 200 מילליאן פפונד שטערלינג (ערך 5 מילליארד פראנק) והכך. הזה כמעט לא יאומן, ואחרים אומרים רק 40 מילליאן פפו זה שטערלינ מלבד חלק גדול מארצות טורקיא. ועד שתשיג הממשלה הודעה ברורה אדות תנאי השלום ללא הועיל הוא הוויכוח על אדותם."
021-HLB-1878-03-01-PG001-SINGLE-ORIGNAME_140235_toc_18,א!! 11* ^1*1•!ע •611104100 — ]>7116£?01 ..., -
