article_id,headline,text
021-HLB-1881-05-13-PG001-SINGLE-ORIGNAME_170325_toc_7,"יה
מכתבי-סו
—"," יה מכתבי-סו — דימי פרוד קיוב. — מאז אשר החלו מכ״ע לישראל לצאת לאור נהגו הסופרים וגם שמו להם לחוק להודיע ולהשמיע בשערי מכ״ע את חסדי נדיבי עירם היוצאים לעזרת אחיהם חילכאים. ובפרט בעת הזאת אשר היוקר יגביה למעלה עוף וישלוט שלטת בלתי מוגבלת זכו גם הערים הקטנות להעלות על מזבח הדפוס עבור צדקת מנדביהן ומרחמיהן. ובאמת לולא רחמי נדיבינו שהיה לנו אזי כבר ספו תמו מן הארץ אלה האנשים אשר נסתמו בעדם מעינות וצינורות הפרנסה ואין לאל ידם לעמוד בפני הזמן האכזר הזה אשר גם אילי הכסף שהו ראשם לפני משא היוקר אשר יכביד אכפי עליהם וילכו קרד בלחץ העוני והמחסור. ומה מאד ישמח ויגיל לבב איש הישראלי אשר אהבת עמו בועד בלבו לאמונתו ודתו, בראותו כי לא אלמן ישראל מאנשים נדיבים המשכילים אל דל, כי זאת מראה לו לדעת שחוט החסד והחמלה הנטוע בלב העם הממושך והממורט יאחדם וילמדם ולא יתפרדו איש מעל אחיו ורק איש את רעהו יעזורו, וזה לו האות כי לא לחנם יתאמרו ויתפארו ישראל בשם „רחמנים בני רחמנים״. והנני לספר גם את חסדי נדיבי עירי אשר יצאו לעזרת האומללים אשר נשבר מטה לחמם, ואף כי עירי לפי מספר תושביה לא תוכל להמנות בין הערים הגדולות, יען כי אנשים בה מעט ונער יכתבם, אולם לפי מספר ענייה ואביוניה תוכל להחשב גם בין הערים היותר גדולות, יען כי הבטחת השי״ת אשר הבטיחנו בתוה״ק כי „לא יחדל אביון בקרב הארץ"" נתקיימה בעירנו במלוא מובן המלה, כי כל איש מר ומצוק אשר צר לו המקום לשבת בפנים עיר קיוב ולא יכול לסבול הוצאות העיר הגדולה, הוא ימלט אל פרור דימייעווקי, ובחרו את עירנו לעיר מקלט העניים, ואנשי עירנו אשר לא יכלו לראות בנוע אחיהם העניים לעיניהם ובהתעטף נפשות עולליהם ברעב, המה מוכרחים ונאלצים להיות בסומכי נפשם לבל יתנו למוט רגלם, וכל ימות החורף כלכלום בלחם ובמזון כפי מסת ידם הנדיבה והספיקום בעצים אשו גם עליהם עלה היוקר, וגם יסדו „חברה בקור חולים"" להמציא להם מזור ותרופה בעת חלים ח״ו. ונוסף לזה אין איש מאנשי עירנו אשר לא יחזיק על שולחנו עני או איש חיל בימי שבת ומועד ויש אשר יחזיקו שנים או שלשה יחד על שולחנם, ובעבור העניים פליטי עיר קיוב לא יכלו נדיבי עירנו לשאת ראשם להשגיח ולפקח על צרכי עירנו ולתקן את הדברים הצריכים תקון וזה כשנה אשר בית המרחץ נוטה לנפול וסכנה גדולה מרחפת על כל הנכנס לשם. ודבר גדול כזה אשר הוא מהדברים אשר דת היהדות נשען עליהם אם יעזבו ביד המקרה ולא יצאו חוצץ לתקו הריסותיו או לבנות אחר תחתיו אז כמה קלקולים וכמה מכשולים יוכלו לבוא לרגלי הדבר הזה. אולם מאין יקחו מוצא לכסף לסך גדול כזה אשר בנינו יעלה לארבעת אלפים רו״כ? עוד לא נשכה מהם נדבתם אשר התנדבו יותר מכפי כחם לשבעים משפחות בישראל על מעות חטים כאשר ספר לי המו״ץ דעירנו הוא הרב המופ׳ מהור״ר מאיר גרשון פרידמאן אשר לקח המשרה על שכמו לחלק את המ״ח לעניי עירנו, לבד מהעניים הנעלמים והנסתרים אשר בושת תכסה פניהם לבקש עזרה מקופת הקהל ולהחשב בין העניים, עניים כמו אלה ידועים וגלוים רק להגביר המצוין בעמנו החכם מו״ה בייניש קאצענעלענסאן והשני לו המצויין בעירנו. מו""ה שלום באריספאלסקי. ויהי כאשר ראו מנהלי עירנו כי צר כחם ואין לאל ידם לבנות בית המרחץ, קראו עצרה ואספו אספה לבקש תחבולה ועצה לדבר הזה, ואחרי הקאנפערענץ והמשא ומתן אשר היו ביניהם התיעצו לבחור ששה אנשים מנכבדי עירנו שילכו אל גבירי עיר קיוב לבקש מהם להאציל מקופת הקהל אשר תחת השגחתם סך אלף וחמש מאות רו״כ, וגם בקשו את הגביר קאצענעלענזאהן להיות לפה ולמליץ בעדם לפני הגבירים והאצילים ובחרו באלה האנשים הנקובים בשמותם הנכבד מ׳ יצחק יעקב בא- ריספאלסקי וחתנו מ' ברוך מרדכי גארנאסטאפילסקי, ומו״ה נח שור, ור׳ אליהו וועקסלער ור' אליהו טשערקאסקי והרב המו""ץ הנ״ל, ואנשי עירנו מתפללים בסגנון הזה היה עם פיפיות שלוחי עירנו ההולכים לבקש עזרה מלפני נדיבי עיר קיוב, הורם מה שיאמרו הבינם מה שידברו, ידעם איך ופארו את דבריהם בלשון מליצתם שלא יכשלו בלשונם ולא ינקשו בשנוגם ולא נבוש במשענינו אשר אנו נשענים עליהם, אולם מי יודע מה יענו הגבירים על זה? אולי ידחו אותם בלך ושוב? ע״כ בשם עדתי אבקש מכם אדונים נכבדים רודפי צדק אשר כל מגמתכם להטיב לבני עמכם בכלל ולעיר התהלה קיוב בפרט, תנו און קשבת לשלוחי עירנו ושימו נא עיניכם ולבכם הנדיבה לפקח על צרכי עירנו, כי למה יגרע פרור „דימייעווקי"" מכל פרורי עיר קיוב? הלא לעיר קיוב יחשב גם הפרור הזה ובמה נפלנו אנחנו תושבי ואזרחי דימייעווקי משאר תושבי עיר קיוב? וגם באשר רוב דמי הטאקסע אשר יובא אל קופת הקהל היא מאנשי עירנו יען כי טבחי בשר כשר הם תושבי עירנו, ע״כ לנו הצדקה לבקש מאת כבודם להאציל מקופת הקהל אשר תחת השגחתכם סך הנ״ל ולהרים גם נדבת ידכם הנדיבה על בנין בית המרחץ אשר אנחנו רוצים לבנות, ואל תפרידו בין הדבקים לחשוב את עירנו כעיר אחרת ותפרשו את אברות כנפיכם גם עלינו להסתירם בצל הכסף אשר אנחנו מבקשים מכם, כי תושבי ואזרחי עירכם גם אנחנו. נחום ביילין. רוסיא הקטנה. — שמעתי קול ינשוף הומה בלבנון עלה 33, מפיו ימטיר אש וגפרית על יהודי מאלאראסיע בכלל ועל הסטאציאן באכמאטש בפרט, קולו כקול איש ליטא, השונאים את המאלארוסים עבור טוב לבבם וכשרון מפעליהם וקנאתם במו מקלקלת את השורה לתתם לפני בני בליעל ובוערים בעם, ואם אמנם לא אכחד כי המקום באכמאטש לא מהמקומות המצוינים בהלכה הנהו, אך יען מה, יען כי יכיל בקרבו האספסוף מכל קצוי ארץ הבאים שעריו לרגלי מסחרם, ובין המון אדם רב כזה לא ימלט כי לא ימצא אנשים מאנשים שונים בסוגיהם, במו זוללים וסובאים במו רקים ופוחזים במו גם תופשי תורה אף אנשי לצון, ובאכמאטש עיר מקלטם יהיה למו לארץ חפשית, לפרוע בה פרעות, כל אחד מהם יטע במקום הזה דרכו בקדש אשר ע״כ גם יושביו בעורים מגששים באפילה מבלי ידעו איזה דרך ישכן אור אך איך הרהיב הכותב בנפשו עוז לשום תהלה בקהל עדת ישראל היושבים בני עדתי אכלתני להשיב על דברי הסופרים המשתמשים במקורים לא נאמנים ומבלי חקור שרש דבר יוליכו שולל את הקוראים ויתעו בנכליהם את דעת הקהל להוציא משפט מעוקל על עיר ויושביה, וביותר אחרי אשר לא זר לי שקהלתנו שם לא טוב לה במשכנות יעקב הקרובים והרחוקים ואת בדה מלבו, והפרט יעיד על הכלל. הה! צר לי עליכם אחיי בני רוסיא הקטנה אשר לא יאומן כי יסופר על עיר אחרת יאמן עליה, עד כי הכל נאמנים עליה בעדותן לחללה ולהשפילה עד עפר. אמנם כן כי רבים וכן שלמים הרואים באספקלריא המאירה את כל המצוה להציג מאמרי זה כארז בלבנון ולחוס על קהל עדת ישראל למען לא דפה בנו׳ ל״א, ומלבד אשר דברים כמו אלה לא לעזר ולא להועיל המה כי אם יעירו עוד המה, ומי יסתפק אף רגע שהרב אשר יבא לשבת בעירנו על כסא מדין לא למשמע אזניו ישפוט רק למראה עיניו יוכיח ואין לו לדין אלה מה שעיניו רואות, ואם בעל נפש הוא יכיר את מקומו ויראה את אשר לפניו. כן בצדק דבר הכותב מריגא, כי רק אם לשלום יהיה פני הרב מועדות ובשובה ונחת ידרוך נתיבותיו או אז תקוה קרובה כי יפעול ישועות לקרב הלבבות ולחבר הנפרדות, ורק אם במקל נועם ינחה את בני עדתו יצלח לו למשיך לו את כל העדה, ואם נוסף לתורת אמת אשר יהיה בפיהו ילך בשלום ובמשור דרכו או אז ישיב רבים מעון ויפה עולה לקהלתנו דרשת ר״מ (אבות דר״נ): מה תלמוד לומר ורבים השיב מעון, כשהיה אהרן מהלך בדרך פגע באדם רע ונתן לו שלום, למחר בקש אותו האיש לעבור עברה אמר אוי לי איך אשא פני ואראה את אהרן בושתי שנתן לי שלום, נמצא אותו האיש מונע עצמו מן העברה. וכן שני בני אדם שעשו מריבה זה עם זה כו׳. אך ללא אמת השוה הכותב את הרבנות דפה לעיר אדעססא ולשוא נתן מקום לטעות כי כשם גם פה יקח הרב מטעם הממשלה גם הוראת או״ה תחת כנפיו וימרה את פי יודעי דת ודין תורה. ואם אין להכחיד שהרב מטעם הממשלה ידו משלה בכל עניני העיר והוא המוציא והמביא כל צרכי הקהלה אך בכל עניני או״ה לא יתערב ואינו נכנס בד׳ אמות של הלכה בהרב משם המתלבש בעטרה שאינה הולמתו וממרה את פי בעלי ההוראה, אם לא בדבר הנצרך קיום מבית פקודת העיר או אז יהיה לעזר בפה ובכתב להמליץ הענין לפני השרים אשר בידם עתותינו. וכאשר הודעתי במועדו שהיה עוזר מעיר T ברוסיא הקטנה בכלל, וגם על הסטאציאן באכמאטש הפרועה לשמצה, הפריז ! כי שתיקותי תעלה יפה כדבר חכם עליון שהעולם מתקיים בשביל מי שבולם על המדה. ואם אמנם העיר נאמנה כי לא ידעו להבחין בין שירת האזינו עצמו בשעת מריבה (חולין פ״ט) והיה זה שכרי — ואך קנאת עירי וכבוד לתוכחת בהקותי, לא אפונה כי לא ראה המעשה הרע הזה בעיניו רק באזניו שמע מפי תנוקות של בית רבן כי יוכל להיות כזאת בישראל, והעד כי גם אנכי שמעתי מפי מגידי אמת כמהו שקרה מעשה כזה באחת העיירות במדינת ליטא על שירת בשלח. ובטח כי המעשה הזה עוד לא היה ולא נברא, רק הלא גם לנו חלק באלקי ישראל ובמה נפלינו מכל קהל ועדה כי נפלנו במקום אי נקי כפי הליטוי הלז אשר הוא... ואין קולו נשמע, אשר ימוד במדה ארכנו ורחבנו וישקל במשקל משמן בשרנו. — ואתה אדון נכבד מו״ל עליך הנעשה והנשמע בקרבנו לא לחכמה חשבו את העצה היעוצה בדבר הרבנות יוסיפו פושקי שפתים להבאיש ריחנו באזני כל קוראי הלבנון, והלבנון גם הוא לא יהיה פרוע לכל חיה דורסת ואינה אוכלת! היי״ט בשב״ר. מיטויא ג׳ קדושים. — רוח קנאה עברה עלי לראות זה פעמים סופרים מסתתרים יוצאים לחלק בדבר המסור ללב קהלתנו ונושאים ונותנים בענין הרבנות דפה, על מה אדניה הטבעו ומה כחה כי עז, ותעירני לבוא היום במגלת ספר ולחוות דעי אף אני. אמנם לא קנאת סופרים על אשר באו זרים בגבולי ונגעו בנחלתי תקפתני לדבר דבר, זאת לא זאת, כי בחדרה כזו לא אהפך ומיום אשר אחזתי קשת הסופר בידי לא אמצא את לבבי להעביר כבני מרון את מעשי בני עירי ולהביא במשפט הגות רוחם ומחלקותיהם למשפחותם אם לשבט ואם לחסד, יען כי אם גם אפתח חלונות להראות לפעמים איזה נגעים ולתאר בצבעים שחורים ולבנים מראות שונות, אין שומע לי פה. אחרי כי קוראי עברית בעירנו מעט מזעיר הנם, כי גם אלה אשר שפת יהודית לא כספר החתום היא לפניהם מספיקים עצמם בילדי נכרים ויוצאים בקריאת כה״ע הכתובים לועזות ולמה אשחית את דברי חנם? וביחוד במקרה המטיל שאון וסער גדול בהמונה של עיר, חק שמתי לי להיות נהבא אל הכלים, כי אם גם אשביע את הקולמוס להשמר מכל דבר רע ומבלי פגוע איש, בכ״ז ימצאון, לעת זעם כזאת אנשים אשר ישגיחו בבת קול שיגלה את אזנם כי נגעתי בכבוד איזה מפלגה, ובעל כנפים יגיד להם מה שנמצא בין השורות, ומוטב לי שאקבל שכר על השתיקה יותר מעל הדרישה H"
021-HLB-1881-05-13-PG001-SINGLE-ORIGNAME_170325_toc_8,ברכת אובד עלי תבא.," ברכת אובד עלי תבא. שאלתי את פי אדמו״ר הגאון מהור״ר שמעון הלוי איש הורוויץ נ״י  אשר כל רז לא אניס ליה להגיד לי אם באמת נמצא באיזה מקום הדברים אשר הזכיר אבא ס״ט בהלבנון נו׳ 88, ואמר לי כי אבידתו הראשונה היא במ״ג ח״ש פל״ג *), ואבידתו השניה ימצא בילקוט שיר השירים סי׳ ג׳ פסוק כמעט שעברתי וגו׳ אחיתיו ולא ארפנו, ושם איתא וגלגולתא של ארונא וכו' Dr. Aibert Scheinin צבי דוד שיינין המכונה ע״ש. לייפציג יש למב״י. *) גם ידי״נ הנב״ן בדימייעווקי מצא האבדה הראשונה. המו״ל. לנקר הבשר בשלימות והוסרה בזה מכשלה רבה. גם מעת אשר הרב רג' רי״ח הלך מאתנו למנוחות לא יוציא הרב מטעם הממשלה מפיו דבר הלכה באו״ה, ורק הרב החוב״ק ר׳ יהודה ליקניצקי — שעמד לימין הרב כו׳ מעת אשר אור עיניו נלקה ממנו — הוא יורה דבר ה׳ ומשגיח על המקולין וכו'. כללו של דבר כל איש אשר משרים ישפוט ולא אחרי מראה עיניו לבד יבקר, יראה ויגיד כי לא במדה ההיא אשר יציגוה התרים למשל על רפוי האמונה ועל העזובה אשר בקרבה כן הוא, ואם כי בין קהלות יעקב אשר משם תצא תורה וכל בניהם למודי ה׳ לא תמנה. אך עוד יראת ה׳ במקום הזה ומצב המוסרי והדתי לא ברע הוא כאשר יחשבו רבים ועוד חזון למועד לדבר בפרט מדרכיה בקודש. ובכן אם אמת ושלום יאהבו הסופרים העומדים לצופים על שדי ישראל בל יהיו מהירים במשפטם על עיר אשר לא נהירין להו שביליה, ואם גם יקשיבו קשב רב קשב יהיו מתונים בדין, כי אברהם רובינשטיין. בחפזו אדם כוזב הוא."
021-HLB-1881-05-13-PG001-SINGLE-ORIGNAME_170325_toc_9,הודעות," הודעות נעתרנו לבקשת רבים וכן שלמים להוציא שנית לאור את יון כבוד הלבנו בחוברות קטנות בכל רבע שנה לע״ע, והיה כי ירבו הרודפים אחר כבוד הלבנון, נחלק להם כבוד בשתי חוברות לרבע שנה. והננו מחלים את פני הרבנים הגאונים והסופרים החכמים כי יאבו לחדש כבודם אתנו ויתנו מהודם על הלבנון במאמרים טובים בעתם. לר״ המו."
021-HLB-1881-05-13-PG001-SINGLE-ORIGNAME_170325_toc_10,מודעה," מודעה ספר מורה נבוכים בשלשה חלקים וארבעה פרושים וספר הכוזרי בחמשה חלקים ושני פירושים מדפוס המשובח של הרב מהר״י גאלדמאן הי״ו, מחיר כל ספר וספר שני רו״כ. ספר באר הגולה (יבאר מעלת אה״ק. מדת ותבנית המשכן ובית המקדש, ועבודת הכהנים והלוים. סדר מלחמות היהודים, אמונת המשיח וכו' חברו אחד מרבני ספרד הקדמונים) יצא ראשונה לאור ע״י מו״ל הלבנון הי״ו מחירו חמשים קאפ. ירושלמי מס׳ ברכות עפ״י כת""י הנמצא בירושלם עם פי׳ הגאון מוהר״ש סיראליו יצא לאור לראשונה ע״י המו״ל הלבנון מחירו 1 רו""כ. מציאת הנפש שלשים קאפ. — דברי ימי עולם שבעה חלקים 70 ,3 רו״כ. — תולדות חכמי ישראל ארבעה חלקים 2 רו""כ. — מלחמת קרים (סעבאסטאפאל) 50 קאפ. — אשמת שומרון שני חלקים 1 רו״כ. שבילי עולם אוראפא ארבעה חלקים 1 רו״כ. באלה המקחים אשלח לכל דורש ומבקש ע״י פאסט רעקאמאנדירט נחמיה צבי טשארנאוויץ, ויגיע בטח ליד הקונה. סוכן הלבנון והישראלי ואיזראעליט ויתר מכ״ע ומו״ס בווארשא רחוב דזיקע נו׳ 3. Chum Carnouicz, Warcchca, Dzika No. 3."
021-HLB-1881-05-13-PG001-SINGLE-ORIGNAME_170325_toc_11,הודעה.," הודעה. לבאי ועוברי דרך האמבורג וביחוד לנוסעי אמעריקא אודיע בזה גלוי כי זה שבע שנים נהלתי פה בביתי קראיענקאמפ נומר 8 אויסוואנדערער שעפט תחת ציאן אונד העכסעל-ג לאטטעריע קאמיסיאן שפעדי הפירמא יארמולאווסקי אונד מארקעל אשר נתפרדה השותפות ומעתה הנג מנהל עסק כנ״ל לכל פרטיו על שמי לבדי שלמה מארקעל. נשען על ידיעתי הנכונה בטוב עסקים כאלה ארהיב להבטיח את כל דורשי בית מסחרי אשר אמלא אי״ה את כל הדרוש עצהיו״ט. אדרעססע שלי: S. Markel, Fraienkamn S, i HAMBURud."
021-HLB-1881-05-13-PG001-SINGLE-ORIGNAME_170325_toc_12,"„הודעתי נאמנה"" לפ""ק."," „הודעתי נאמנה"" לפ""ק. על דבר אשר הגיעו אלי מכתבים מברדיטשוב. מעבירים עם ה׳ בקול לעז שיצא על הציקאריע, שלא טהורה היא מתערובת איזה שומן מבע״ח; ורבים וכן שלמים יראי חטא פרשו מלשתות ציקאריע, ואשר על כן פניתי בשאלתי אל הדירעקטאר מטעבניטשססקאע אוטשיל ישטשיע של אדוננו הקיר״ה פה מאסקווא, ה, אריסטאוו, ונתתי לו איזה לטרות צי- קאריע מהפאבריק אשר להאחים פיחאוו (בעיר ראסטאוו אשר במחוז יאראסלאוו) למען נסות דבר בהלאבאראטאריום ולדעת אמתת הדבר וזה אשר השיבני ביום ג׳ 17 פעברואר הזה תחת הנוסער 803: „להאדון הרב לעדת היהודים, ה׳ חיים בערלין. הנני מתכבד להודיעכם אדון נכבד, כי בדוגמת הציקאריע מהפאבריק של האחים פיחאוו, ההובאה מאתכם, עפ״י הנסיון הנעשה בלאבעראטאריום אשר בבית התלמוד עפ״י הבוחן פארשעזינסקי. לא נמצא שום תערובת משומן שום בע״ח. הממלא משמרת הדירעקטאר. אינספעקטאר איוואן אריסטאוו״ ומעתה יהיו בטוחים כל יראי ה׳, וחושבי שמו ותורתו שיוכלו להשתמש בציקאדיע הנעשה בפאבריק האחים פיחאוו בלי שום חשש וגמגום. וע״ז בעה״ת, יום ה׳ ב׳ אדר שני שנת „אמת וצדק"" לפ״ק מאסקווא. נאום חיים בהגאון מו״ר נפתלי צבי יהודא ברלין החופ״ק,"
021-HLB-1881-05-13-PG001-SINGLE-ORIGNAME_170325_toc_13,ספר גלילות הארץ," ספר גלילות הארץ יכיל חכמת כתיבת- הארץ לחלקיה התבונית ההנדסית הגעאלאגית ותבניותיה ותקופותיה מיצירי קדם שכבר היו לעולמים ולחלקיה הטבעית והמדינית נכתב בשפת קדש בשפה ברורה ונעימה ובסדר נכון כפי מצב הידיעה בעת הזאת לכל פרטיה, עם הרבה לוחות וציורים פתוחי נחושת תכוניים הנדסיים נע- אלאגיים פאנטעאלאגיים וטבעיים נדפסים במקומם ועם מפה גדולה מכל כדור הארץ בעברית ובצבעים. מאת הלל כהנא ב״ר יהושע ז״ל. מחיר הספר שלשה ר״כ או ששה פראנק או חמשה מארק וכל החפץ לקנות יפנה להמחבר על האדרעססע: Hilel Kahane, Schuldirector in Botaschian, Rumanten. או אל האדון ה׳ ד׳ ליפפא מו״ס בוויען."
021-HLB-1881-05-13-PG001-SINGLE-ORIGNAME_170325_toc_14,העתקתי משכני לעיר לדז," העתקתי משכני לעיר לדז ועסקי גם פה עסק קאמיסיאן, וגם אכסניא הכינותי, ואבקש מאת פני כל מכירי ויודעי שמי אשר יש להם עסקים לפה כי יפנו אלי בין בעסק הקומיסיאן ובין להתאכסן אצלי, ואבטיחם כי יהיו מלאי רצון.  וכל מי החפץ במכ״ע הלבנון, הישראלי והיזראעליט יוכל לפנות אלי וימולא רצונו עצהיו״ט. אבא יצחק עפשטיין. Ab. J. Epstein, LODz, 275, Haus Ch. Blawet."
