article_id,headline,text
021-HLB-1880-01-23-PG001-SINGLE-ORIGNAME_160195_toc_10,חדשות וענינים שונים," חדשות וענינים שונים — (הקור תחבולה נגד האבעבועות). מכ״ע אחדים מודיעים כדברים האלה: בימי החורף העז הזה עת שרר הקור בעזוז תקפו, ראו בבית החולים בעיר פאזען דבר נפלא מאד. חולים אחדים במחלת האבעבועות (פאקקען) הנמצאים בביה״ח ההוא, כאשר גברה עליהם יד הקדחת ותביאן למצב הנורא הנקרא דעליריום ברחו מבית החולים וילינו בחוץ, כאשר יקרה פעמים רבות להולים כאלה. המחלה תקפה את כל נופות החולים, כל עוד בשרם היה מכוסה באבעבועות וחום הקדחת עלה עד 41 מעלות. חולה אחד מהם אשר היה לבוש רק בכתונת בד אחד, התחמק מבעד לחלון ביה״ח החוצה בעוד ירד מעלת הקור עד 10 מעלות, וילך ויתע זמן רב הנה והנה ובבקר מצאוהו וראו כי לא רק הקדחת העזה עזבתו לגמרי, כי גם האג בעבועות קטנו מאד והולכות ומתיבשות. שתי נשים חולות אשר גם הן התגנבו מחדר החולים ולנו כל הלילה בפרוזדור, נמצאו גם הן במעמד הנ״ל כהאיש החולה, ויה: הדבר לגם. אחרי אשר נודע הדבר הזה ע״פ מקרה, נסו הרופאים להשתמש בתחבולה הזאת לרפאות את החולים. חולים אחדים במחלת האבעבועות כאשר הובלו לבית החולים, הובאו ע״פ מצות הרופאים להדר בלתי מוסק וגם חלוניו היו פתוחים, ושם עשו להם רפאות תעלה נחוצות. למחרת היום ההוא, וימצאו הרופאים והנה הקדחת של החולים חלפה הלכה לה, האבעבעות קטנו והחלו להתיבש ואחרי שמונת ימים נרפאו החולים ממחלתם. ולא לבד במחלת הפאקען, כי גם במחלות מתדבקות אחרות אשר הקדחת גברה אצל מאד, נסו להשתמש בהקור ועל ידו נרפאו החולים בלי רפאות תעלה אחרות הנהוגות למחלות כאלו״. עכ״ל המכ״ע. אך כשאנו לע מנו לא נדע מה זה החדוש הגדול בהמקרה הזה. הטרם נדע כי מסגולת הקור לצנן את הקדחת? מה שעשה פה האויר הקר, כבר נודע לרופאים מומחים בצותם לרחוץ חולים כאלה במים קרים רחיצה במים קרים והבאת אויר זך ונקי מן החוץ לתוך הדר החולים במחלת הפאקען, טיפוס וכדומה, כבר נודעו לתחבולות טובות ומועילות. P. — במכ״ע טימעס היו״ל בלאנדאן נמצאים איזה תוצאות ממנהגי חוקי הדרך ארץ בזמנים שונים ונעתיקם פה לפני קוראינו הנכבדים. ואלה דבריו: המושג „המקובל והאינו מקובל"" לנאה ומגונה יתחלף לעתים שונים. נעים מאד להביט לפעמים על הרשום בספרות העמים אדות חוקי הדרך ארץ נתפלא עליהם במאד מאד, אם לא נמלא שחוק פינו"" אחרי דבריו אלה יביא המכ״ע הנז' כללים אחדים מחוקי הד״א אשר שררו בארץ אשכנז באמצע המאה החמש עשרה. הכללים האלה רשומים בכתב יד אשר נמצא בעקד הספרים באחד מבתי הנזירים, ואלה המה: אם יקרא איש לאכול איזה ארוחה בבית איש אחד נכבד, אז נוטלת עליו החובה לרחוץ קודם הסעודה את ידיו ולעשות את צפרניו. לא נאה הוא להחזיק את הכוס מלא יין או משקה אחרת בידו האחת, יען כן יעשו העגלונים כ״א יחזיקו בשתי ידיו וישתה. מחוקי הד״א לבלי לשתות בעת אשר ישתה שכנו עמו במסבה וגם לא יפה הוא להוריד את החוטם בהגביע כדרך החזירים. לא תאר ולא הדר לו לאיש לשתות בשאון כמעשה השור. בכלות הארוחה נצרך לנגב את החוטם והפה. בעת אשר בעל הבית בעצמו שותה אז על האורחים למנוע מקחת אוכל אל פיהם. לא נאה לאכול לבדו תפוח בלי אחוזת מרעים או בני ביתו. האיש אשר ישמור את חוקי הד״א כמשפטם עליו לנתח את התפוח על שני חלקים ואחרי כן ינתה גם את החצי האחת לשני גזרים ויתנם לשכניו היושבים על ימינו ועל שמאלו ואת החצי האחרת יאכל הוא לבדו. אין לך דבר מכוער מלמשוח המאה על לחם באצבע האגודל (ובשאר האצבעות?) לאכול מרק ככף (לעפפעל) נדרש לעשות זאת בהשקט כאשר תעשינה הבתולות. וגם לבלי לשתות מהקערה כמעשה העגלים. בעל דרך ארץ נכר גם ממנחנו לאכול פירות. את האנסים נדרש להסיר את הקליפה מן הענף ולמעלה ונהפוך הוא בהתפוח. מכ״ע פינארא אשר דרך התולים לו תמיד ואוהב לצון מצא תחבולה חדשה איך לקבוע מס בארץ ונותן הוא את עצתו זאת להגראף טאאסע למען יהיה לו מוצא לכסף למלאות, את החסרון ולשלם את חובות הממשלה. רבים המה המקרים והפגעים רעים בכל עת וזמן אשר יעברו בארץ וישימו משטרם עליה. אך כנודע, רבו כמו רבו בשנה העברה שנת 1779, ויעשו שמות ופרעות בארצות רבות. חרב, דבר, רעב ושטף מים כבירים אשר זטפו עברו על גדותיהם ויהרסו ערים רבות, יצאו, חוצץ כלם זה אחר זה והביאו רעה רבה על ממלכות שונות. וביחוד נראו עקבותיהם בארצות אשכנז ואוסטריא והכבידו את ידם הקשה על יושביהן, אשר גם בלעדם לא מאושר חלקם ודרכי המסחר אבלות זה שנים רבות; ובכל זאת לא חדלו שתי הממשלות האלה להוסיף מסים על החוסים בצלן, למען יהיה לאל ידן להשוות את ההכנסה אל ההוצאה הגדולה אשר תתרבה יום יום ע״י כלכלת צבא תמידי רב, אשר יעמדו הכן וכלי נשקם בידם להגן על ארצם, כי שתי הממשלות האלה חזיונות שוא יהזו למו תמיד ומגור להם מסביב, וגם מקול עלה נדף אשר ישמע בארצות שכניהן היושבים לבטח אתן, יחתו וירגזו תחתיהן. אבל עד עתה לא הצליח עוד חפצן בידן ואוצרן ריק כמקדם, ויבקשו תחבולות להוסיף עוד מסים על מסים. ולכן ייעץ מכ״ע הנז׳ בדרך התול לשים מס גם על הדברים האלה: 1) כל האנשים אשר בריאים ושלמים הם בגופם ושולטים בשתי ידיהם; הגבן פטור מהמס הזה. 2) מס על המגפה. המס הזה יושם על האנשים אשר נצלו מהמגפה אשר עברה בארץ. 3) על הפנוים בלא אשה: המס הזה ישלם כל פנוי על אשר לא יסבול צרות ותלאות ימי הנשואים, האלמנים ישלמו רק החצי מהמק הזה. 4) על החתונה. המס הזה יושם על הנשואים יען כי יתענגו בחיי משפחה. 5) על שטף המים. המס הזה ישלמו אלה אשר לא סבלו משטף מי הנהרות אשר פרצו גבולם לבלע ולהשחית; האנשים אשר טבעו וינועו במצולה בעת אשר מסרו את נפשם להציל מרדת שחת את יתר הצוללים פטורים מלשלם את המס הזה. 6) על שריפות, רציחות או נשיכת לבים משוגעים המס הזה ישלמו האנשים אשר לא סבלו משריפות, אשר אינם הרוני נפש ואשר שני כלב משוגע לא נגעו לדי בבשרם. 7) מס על החופש. המס הזה ישלמו כל האנשים המתעננים על החופש והדרור ואינם בגורים בבית האסורים. המעתיק בזר"
021-HLB-1880-01-23-PG001-SINGLE-ORIGNAME_160195_toc_11,"י
א
יחד.
אל אם הנכבדים בו ומא"," י א יחד. אל אם הנכבדים בו ומא כבר הודעתי כי הרב ר׳ שלום דוד מאיראוויטץ איננו עוד סוכן הכללי, ועתה הנני מודיע כי באתי לשלום לווילנא, ולא אסע מזה עד אשר אסדר ברצות ה׳ את הליכות הלבנון בסדר מרוצה ומקובל להקוראים ומתוקן (לא מסוכן ח״ז) גם לי. ועד שאודיע ממי יקבלו את הלבנון לימים הבאים ישלחו הקוראים הנכבדים א לאחר) הלום לווילנא על את הכסף מחיר הלבנון לי (1 האדרעססע הרשומה למטה. והנני כופל ומשלש שאלתי כהוגן מאת הקוראים הנכבדים כי ימהרו במשלוח הכסף בעד העבר ועל הרבע הבע""ל, כי לא אוכל למוש מזה עד אשר אגבה החובות חדשות גם ישנות. ומאליהם יבינו כי לא אוכל להתמהמה פה ימים רבים. פה ווילנא כ""ח שבט התר״ס יחיאל ברי״ל אדרעססע אלי: Gospodinu Kupzu Eisiku Rabinowitschu dlia Brila, Wilno."
021-HLB-1880-01-23-PG001-SINGLE-ORIGNAME_160195_toc_12,הודעות," הודעות  מודעה נודיע בזה כי הפקדנו את הר׳ החכם הנעלה סופר מהיר מוהר״ר יעקב מהרש""ק הי״ו לסוכן כללי על מכ״ע „שערי ציון"" בארצות רוסיא ופולין. כל איש החפץ לבא אל השערים האלה או כי יהיה לו דבר אלינו יפנה אל הרה״ה הנז׳ וישיג מבוקשו. כן הננו לבקש את חכמי עמנו כי יעניקו אותנו במאמרים טובים ומועילים לחברת האדם. האדרעססע: sak Marsckak, Buchhandlung, Nalewke No. 19, Warschan."
021-HLB-1880-01-23-PG001-SINGLE-ORIGNAME_160195_toc_13,' ם0000000ם0ם0ם0ם0ם000ם0ם000ט0ם0ם000ם£ 5...," nonouonoliolonononononononononononOס קייזערליך דייטשע פאסט. האמבורג אמעריקאנישע פאקעטפאהרט-אקטיען געזעללשאפט.  היה ראיתי ראיתי לי )322( צווישען  האמבורגאונר נעוו-יאר דורך פאסאזען נאך אללען פלאָטצען דער פעראיינינטען שטאאטען  אבפאהרט פאָן"" האמברג יעדען מיטטוואך, מארגענס. . נאָהערע אויסקונפט וועגען פראכט אונד פאססאזע ערטהיילט דער גענעראל-בעפאָלמאָכטיגטע ADC UST BO TE N, Wn Milers Nachn HAMB O R G Admiralitaeustrasse 33, 34 זאוויא דעססען גענעראַל-אנענט: P. J. Bothof, in Main 2. Sonononouonononononononcnonononono65 הנוסעים ימצאו מנוחה בשבתם בהאמבורג בבית מלון שלנו הנקרא נאסטהויז צור שטאדט קעניגסבערג. יארמולאווסקי עט מארקעל קראיענקאמפ 8 אין האמבורג. .Jarmnulowsky et Markel, Kraienkanb S in Bamburg"
021-HLB-1880-01-23-PG001-SINGLE-ORIGNAME_160195_toc_14, השתיה כדת,"  השתיה כדת שפירט וליקער של פסח להתודע ולהגלות לכל סוחרי יי""ש דארצנו ובארצות אחרות, כי להנחיל אוהבי יי""ש לי שפיריטוס של פסח, סובחר וטוב, מן פאטיקע של צוקעה הכשר לפסח, דעסטילירט גם על 90 נראה, זך ונקי ומצוין בריחו הטוב, גם כל מיני ליקער של פסח טוב ערב ומועיל. כפי שנודע ומפורסם כבר תוצאות בתי חרושת מעשי היי״ש שלי לשם ולתהלה בכל מיני הבשר כראוי ונחוץ לחג הפסח, כפי הוראת והוראות הרבנים הגדולים גאוני המו״ץ רפק״ס יע״א, אשר עדותם נאמנה מאד, כי הכל נעשה במשמרת למשמרת עפ״י שימת עינם ובדיקתם ובקורתם המובהקה כמעט מדי יום ביומו, גם משניה נכבד מיוחד מצדם על משמרתו יעמוד במקום המעשה, החוקר וביהן ובידק בשבע עינים, ליתרון הכשר על טהרת הקדש. וכי עושי המלאכה אנשים כשרים המה, יראים וחרדים, זהירים וזריזים בכל חקי הפסח פרטיהם ודקדוקיהם כד״ת. גם יי״ש לי רב משנים הקודמות, וכל דורש טוב ומתוקן ישחרונני בפאדוואל שלי בחצרי ברחוב ווילנער נר דוד ב״ר אפרים ליפסקי. 72012 פה ווילנא שנת תר״ס"
021-HLB-1880-01-23-PG001-SINGLE-ORIGNAME_160195_toc_15,"יי""ש הנעשה על טהרת הכשר"," יי""ש הנעשה על טהרת הכשר להתודע ולהגלות לכל סוחרי יי""ש בארצנו רוסיא ובארצות אחרות כי ישיגו גם בשנה זו י""ש של פסח אשר נעשה בהפאבריקען שלי זה שלש עשרה שנה ביתרון הכשר אף למהדרים וחרדים במאד. וכל הקונים ממני בכל השנים שעברו יעידון ויגידון כי נכון לתת תודה על כושר מפעלי כי היי״ש שלי מובחר וטיב בריחי וטעמו זך ונקי לטיהר, והידות לה׳ כי הגדלתי הפאבריק שלי פי שנים ועוד יגדל בע״ה כי מדי שנה בשנה ירבו הקונים אצלו מארצנו ומארצות אחרות, וכל מי שחפץ לבוא עמי בקשר Baer Jole in Crodno :המסחור יפנה אלי על פי האדרעססע הזאת והנני למלאות בקשתו באופן היותר טוב ומפיק רצון פה הוראדנא שנת תר״ס לפ""ק. דובער בהגאון מו״ה מרדכי נימפל יפה."
021-HLB-1880-01-23-PG001-SINGLE-ORIGNAME_160195_toc_16,לבן שיניים (סילך צעהנע).," לבן שיניים (סילך צעהנע). האדם יולד חלש זרפה כח, ומיתרי החיים יחשבו להנתק מכל חזל אשר יארב עליו לרגעים. והנה כעת אשר שיניו יחלו לצמות. מעת היות כן חמש ירחים, עד אשר יחליפו עליו שלש שנים, אז נכון הוא לכל פגעי מכנה גופו ירופף ועצביו יתפלאו, דיר ירד מפיו על לחיו, ושאת וקדחת יאחזוהו. כל אשר יתפוש ביד יושיט לפיו, וכמו יראה את מקום מדות רק הילד, אשר נולד חזק ומוצק, הוא יתגבר על מחלהו, ועמודי בריאות לא ימוטו. אפס אם חלש הוא ושניו בכבדות תצמחנה, אז קדחה תקיר בקרבו, דלקת בראשו, מכות באזניו ושאת במקום מושב השיגים, את גופו יאחז השבץ העכול ובני הטעים ישחתו וקרוב הוא כי יקראנו אסון. וכבר נועצו חכמי הרופאים למצוא רפאות תעלה, למהר ולהקל את שמיחת השנים. אפס הנסיון הורה, כי יתר שאת לתעלה, אשר המציא אחד מראש רופאי דורנו היא התעלה הנקראת: רביר עלעקטראמאטאריש לשנים, וכל התעלות אשר המציאו שאר הרופאים לא תשוינה לה ולא תערכנה לה, ובמשך ימים מעטים פרצה תהלתו, תועלתו וטובו בארץ. ומלכים ושרים כנסיונם, ורופאים במדעם העירו והכירו, כי הרביד הזה לבדו יעזור להנערים ויסיר כל מחלה מהם. והיה כאשר תגיע העת כי שניו תצמחנה אז ישימו הדביר על צוארו ויומם וליל לא ימוש ממנו ובקל בקע בשר השנים, והשנים תעלינה והצמחנה מהרה, והרביר הזה יוסיף גם לתת חיים חדשים בבשרו ובעצביו והעלם ינצל מכל פגע וגם בווילנא נסו ובחנו אבות רבים וראו כי אין טוב כמוהו. הרביר הזה ימצא כעת בידי וכל החפץ לקנותו יבא אלי או יכתו על אדרעס הנקוב למטה וישינו במחיר 1 רו״כ עם פארטא. Chalin Herz Kodkin, Wilna, Deutsche Strasse, Haus Klotz"
021-HLB-1880-01-23-PG001-SINGLE-ORIGNAME_160195_toc_17,"1 10 £1311)2ת1$ ־ 1>*11<£ VI*"" \>. ־־־ !...", ur die liedaction Verantwortlich Br. Lchimaun — ruck Von J. Brii in Mainz
