article_id,headline,text
021-HLB-1878-12-27-PG001-SINGLE-ORIGNAME_150163_toc_1,"18£8!)6 (168 48186111?""?ו361)]$180116 1...."," Hebraische Ausgabe des „Hsraelitz A H שנת חמש עשרה נומערא כא מהידו לשנה החפץ להשיג את הלבנון ע״י בוכהאנדלונג או ע״י פאסטאמט  בארצות אשכנז, 12 מארק. באוסטריא 7 פלורין א״וו ידרשהו מהם בשמו האשכנזי: ברוסיא ופולין 50 ,5 רו״כ. квек. АUse риздзнавьдт 1 פונד שעלג. בהודו וכינא  ס בשאר ארצות 75 ,18 פראנק. ברוסיא ידרשהו מאת הסוכן הראשי ב ולמחצית או לרבע שנה בחצי או L. Lewinsohn. ברבע ממחיר הקצוב למעלה. Bolschala Ulisa, Wilna    מחיר מודעות  20 פפעניג בעד כל שורה, ואם מאמר אשר לא יעלה לרצון על ב נדפסת איזה פעמים ינוכה ראבאט. מזבח הלבנון איננו חוזר לבעליו. הודעת עגונה מקובלת בחנם. מכתב בלתי חפשי לא יקובל. רי העיר ועיר ועיר ועיר לעוררו ורוב מכתב עתי לבני ישראל אל איש איש איש ואין בעיני ורעי העיר ועיניו העשיריעה יוצא לאור בכל שבוע להודיע ולבשר ולהורות כל דבר הנדרש לאיש יהודי לדעת באשר הוא יהודי וחבר לחברת האדם מאת מאיר (דר.) לעהמאן ע״י יחיאל ברי״ל יצ""ו דרךְ אמונה בחרתִי (תהלים קי״ט.)"
021-HLB-1878-12-27-PG001-SINGLE-ORIGNAME_150163_toc_2,"ן !878 ז1)©מנ606פ 27 ם1 ^0. 21 I %^% , (..."," MAIN, den 27 December 1878 מאינץ א׳ סבת התרל״ט"
021-HLB-1878-12-27-PG001-SINGLE-ORIGNAME_150163_toc_3,דברי הימים: השקפה כללית על מקרי שבעת ימי..., דברי הימים: השקפה כללית על מקרי שבעת ימים האחרונים. מכתבי סופרים.: על דבר ישוב א״י ווארשא. ידיעות העולם והטבע: במה דברים אמורים. חדשות וענינים שונים. הודעות. — ירכתי לבנון: ספור „רבי יוסף בן גרשון המכונה יאזימאן מראשהיים״. תשובה
021-HLB-1878-12-27-PG001-SINGLE-ORIGNAME_150163_toc_4, דברי הימים,"  דברי הימים השקפה על מקרי שבעת ימים האחרונים. — שערי הפאר- לאמענט הבריטאני סוגרו בי״ז לחדש הזה, ועד יום 13 פעברואר הבא אשר בו יתאספו נבחרי לאום ואצילי בריטאניה בבתי מועדיהם כדרכם שנה שנה יהיה חזון הפאליטיק העומד עתה ברומו של עולם יקר, ומכ״ע מצאו עתה לענין לענות בו את הדברים אשר דבר ה׳ וואדינגטאן היועץ הצרפתי באספת הסענאט בארבעה עשר לחדש הזה. באספה הזאת שאל ה׳ ג. ביראָן (שהיה ימים רבים ציר צרפת בברלין) את ה׳ וואדינגטאן כי יטב להודיע את דרכיו בענינים החצונים, ויאמר: אף כי אין את לבבו לדרוש משרי העצה כי לא יוסיפו לעמוד מרחוק בעניני הפאליטיק האורופית כאשר עמדו עד כה מפני מקרי שבעת שנים האחרונות (ר״ל בעקב המלחמה שהיתה בין אשכנז ובין צרפת), ואולם חפצו ורצונו לדרוש משרי העצה כי יציעו לפני הסענאט את הדעפעשע אשר ממשלת צרפת שלחה לממשלת השולטאן לעוררה כי תחיש ותמהר להוציא לאור את אשר נוטל עליה עפ״י הברית הברלינית, וכמו כן יציעו את הדעפעשע אשר קבל מממשלת השולטאן לתשובה על ההתעוררת הנז. ויען ה׳ וואדינגטאן את השואל, לאמר: הנני שבע רצון מאד כי השואל סבב בשאלתו כי אוכל לדבר כהיום במצב ממשלת צרפת בנוגע אל הענינים החצונים מאז שובי מהקאָנגרעס הברליני. ואך עוד דעפעשים מעטים יש לי להציע אשר המה יעידו ויגידו ויאמרו אמת כי בהשכל ודעת עשו צירי צרפת בהקאנגרעס הברליני את כל מעשיהם. צירי צרפת לא סרו מן הדרך אשר הודעתיו את נבחרי הלאום בטרם הלכתי ברלינה. כל מעינינו והשתדלותינו היתה שם לשמור את תועלת צרפת באריענט ולהחזיק את שלום אורופא מבלי נצטרך לצאת מגדר עמדתנו מרחוק או לקבל עלינו איזו חובה, וכמו שבאנו אל הקאנגרעס כן יצאנו משם מבלי אסרנו את ידינו שם באיזו התחייבות... ומאז נכרתה הברית בברלין לא שנתה צרפת את הפאליטיק שלה; ממשלת צרפת לא חדלה מהשתדל כי דברי הברית הברלינית יצאו לאור בכל פרטיהם. האמנם כי נמצאו במו דברים רבים אשר אינם נוחים להעשות, אבל מהיום אשר שם ממשלת צרפת כתוב תחת דברי ספר הברית הברלינית, חובת צרפת היא לכבד את הדברים האלה. הברית הברלינית היא כמו שאר הבריתות אשר על פיהן תשתוינה הממשלות והעמים אשר תועלותיהן שונות; והנועדים בהקאנגרעס הברליני בקשו למצוא אופנים אשר על פיהם יבאו לעמק השוה אלה אשר הפאליטיק והדת שלהם שונה מאד, ובאשר אדע אל נכון כי אם עד ימי האביב הבא לא יצאו לפעולת אדם כל דברי הברית הברלינית, אז תעמוד אורופא נגד סכנה גדולה, ולכן כל גדולי הדיפלומאטיה מהממשלות השונות הנם בעצה אחת כי אין טוב זולתי להשתדל בכל עוז אשר דברי הברית הברלינית יצאו לאור״... ואחרי הדברים האלה נשא ה, וואדינגטאהן את מדברו אדות הרחבת גבול ממשלת יון אשר על פי הצעת ממשלת צרפת הסכים הקאנגרעס כי ממשלת השולטאן תתן חבל ארץ מארצותיה לממשלת יון. ה׳ וואדינגטאהן יאמר כי הוא ומרעיו בקשו באספת הקאנגרעס רק את הדבר אשר לעאפאלד מלך בעלגיען דרש אז כאשר הוצע לפניו שישב על כסא המלוכה באתונא. המלך החכם אמר בעת ההיא כי רק אז ירצה להיות מלך יון כאשר ממשלת השולטאן תרחיב את גבולות ארץ יק. והיה אם שאלת יון תמצא פתרון אזי תחלוף סכנה גדולה הנשקפת על פני שאלת האריענט. וגם ממשלת השולטאן תשיג תועלת גדולה בתתה לממשלת יון את משאלותיה, כי בהיות שלום בינה ובין ממשלת יון תוכל לשום עינה ולבבה להרחיב ולפתח את מקור החיים של ממלכת טירקיא, כי רק אם שלום יהיה לה מכל עברים תוכל לדאוג לאושר ולעושר ממלכתה. — ובמה שנוגע אל בקשת ה׳ ג. ביראָן כי שרי העצה יציעו לעני הסענאט את הדעפעשים אשר ממשלת צרפת שלחה אל ממשלת השולטאן, והיא אל ממשלת צרפת, אמר ה׳ וואדינגטאהן כי עוד לא באה העת להוציא לאור גלוי לכל את הדע- פעשים האלה. וכהיום יכול להודיע רק זאת כי ממשלת צרפת תשתדל אשר גם שאר הממשלות תתננה ידן אליה וכלן בעצה ויד אחת תשתדלנה כי ממשלת השולטאן תמלא את משאלות ממשלת יון בכל אשר הוסכם בהקאנ- צ גרעם. עד הנה תוכן דברי היועץ הצרפתי, ולמרבה הפלא נראה כי כמו כל הדיפלומאטים האודופים מתגבאים בסגנון אחד; כבעאקאנספיעלד באנדראסי  בווארינגטאהן מדי ידברו אדות הברית הברלינית יבטיחו לשומעי דבריהם כי אין כל ספק אשר כל דברי הברית הברלינית יצאו לפעולת אדם, ובעוד מלת ההבטחה על לשונם יאמרו כי הממלכה אשר בעבורה לא יצאו דברי הברית הברלינית לאור תעלה עליה חמת בריטאניה או אוסטריא או צרפת. והדברים האלה יורו לדעת כי הדיפלומאטים האלה המבטיחים לשלום במו פיהם לא יאמינו בו בכל לבבם. ובאמת שלום אורופא עודנו תלוי בין השמים ובין הארץ, כי אם אמנם בנים מאד הדברים אשר דבר בעאקאנספיעלד אל שלוחי בני בריטאניה הנמצאים בקאליפארניה כי בין המלכים בעצמם לא נמצא אף אחד אשר לא ירצה לקיים את דברי הברית הברלינית, ורק אנשים פרטים חושבים על הברית ההיא רעה — בכל זאת נמצאים רבים בין יודעי בינה לעתים אשר נפשם בשפק תלין אם דברי הברית יצאו לאור במועדם. והספק הזה יגדל יום יום בעקב הבולגארים אשר בנוף מזרח רומילי. הבולגארים האלה לא יאבו להביא שנית את צוארם בעול מלכות השולטאן בכל אשר הוסכם בהקאנגרעס הברליני, ודברי הקאמיסיאן האורופית היושבת בפהיליפאפעל (ראש מזרח רומילי) לתקן שם סדרים חדשים ואופני ההנהגה אינם נשמעים ונעשים, ובמקומות שונות לא אבו ראשי הבולגארים להראות להקאממיססיאן פנקסיהם וספרי ההכנסה וההוצאה. ואם כזאת יעשו הבולגאריס בעת אשר הרוססים עומדים בתוכם ומוראם על פניהם הלא בצאת הרוססים משם יתקוממו הבולגארים ולא יאבו הכנע תחת הפחה אשר יפקיד עליהם השולטאן. והנה בימים האחרונים עברה השמועה כי איזה ממשלות הסכימו כי בצאת הרוססים ממזרח רומילי תשלחנה הממשלות הנאחדות את צבאותיהן כי תעמודנה שם עד אשר תשוב המנוחה והכל על מקומו יבא שם בשלום ואולם מכ״ע זורנאל דע סט. פעטערסבורג יאמר כי עד היום לא החליפו הממשלות מכתבים ביניהן אדות הדבר הזה. ומלבד הכחשת מכ״ע הנזכר השומע אמרי הריפלומאטים הרוססים, הנה מוכחשת השמועה הזאת מאליה כל הקורא את הפראטאקאל של הקאנגרעס, ימצא כתוב בו כי במושב הקאנ- גרעס מיום 24 יוני הציע גראף אנדראססי כי בצאת הרוססים ממזרח רומילי יבא במקומם אנשי חיל מכל הממשלות, ובאשר אין אין גם אחד מכל הנועדים בהקאנגרעס תמך את ההצעה הזאת ע״כ לא הוסיף אנדראססי להזכירה. וכל היודע מדוע בעת הקאנגרעס לא אבו הנועדים שם, זולתי אנדראסי, לשמוע לההצעה הזאת, הוא לא יכול להאמין כי עתה רוח אחרת היתה את הממשלות האדירות בענין הזה. האמנם כי בסעיף 15 מספר הברית הברלינית כתוב לאמר שאם יראה הפחה המושל במזרח רומילי כי קצרה ידו לעצור ביושבי הגוף הזה בעזרת המיליץ מילידי הארץ, אזי הרשות בידו לדרוש מממשלת השולטאן כי תשלח אנשי חילה שמה. ואולם לא נוכל להאמין כי ממשלה פלונית או פלונית תחפץ כי מדי יצאו הרוססים ממזרח רומילי יבאו אחריהם הטורקים. כי אין כל ספק אשר חמת הבולגארים שם תעלה למרום שיאה אם אחרי מושיעיהם יבאו מכניעיהם. ואם יבא חיל טירקיא לנוף מזרח רומילי בטרם ישכחו הבולגא- רים את אשר עוללו למו הטורקים לפני איזו שנים אזי תקום מרידה חדשה. סוף דבר לשאלת נוף מזרח רומילי גדולים חקרי לב, ולפי חות דעת מכ״ע גאלאס הרוססי גם בעאקאנספיעלד אשר הוא אבי הגוף הזה (כי על פיהו התחלקה בולגאריה לשתי נפות), גם הוא הטיב לראות כי לא תקום ולא תהיה מחשבתו. השולטאן לא יעצור כח לבנות מבצרים חדשים בהררי הבאלקאן כי אין כסף לאדון זה, וכאשר לא תהיה מחיצה של ברזל מפסקת בין בולגאריה ובין נוף מזרח רומילי אזי עד מהרה תתחברנה שתי המחוזות האלה, והשאלה למי תהיה קאנסטאנטינאפול תמצא פתרונה בקרוב — כאשר בעאקאנספיעלד רואה עתה את אשר לא רצה לראות בעת הקאנגרעס ע״כ הנהו חושב עתה מחשבה אחרת, הנהו חושב לחלק את ממלכת טירקיא בחבל, באופן אשר החלק הגדול תשיג בריטאניה. הקוראים הנכבדים לא יחשבו לי לעון על כי הפעם יהיו „דברי הימים״ מעטים, כי גם לכתוב מעט הגדתי שארית כחי, כי ל״ע הנני כלוא בבית ושומר מטתי זה כעשרת ימים. יתן ה׳ כי במהרה אשוב לאיתני ואוכל לשמור יחיאל ברי״ל. משמרתי כבראשונה."
