article_id,headline,text
021-HLB-1875-10-13-PG001-SINGLE-ORIGNAME_120103_toc_9,"ת
.
.3
ממשלת בריטאניה ומסחר העבדים.
.","    ממשלת בריטאניה ומסחר העבדים. . העבדות בחוף הזהב - אפריקא התיכונה - העבדות באפריקא. המזרחית - העבדות על ים האדום - אבו זיד סיר שמואל באקער .  (המשך מנו׳ 9) „לפי הידיעות האלה — תגיד הודעת החברה המגינה על הפראים. — לא נוכל לכחד כי פתיחת וגלוי ארצות אפריקא התכונה תביא בנקל להם רעה יותר מאשר תביא להם ברכה אם לא תצלח להרחיק את סוחרי העברים הערביים ועוזריהם לבל יתפרצו שמה לשדד את שלום וטובת היושבים שמה, ועל זה עלינו להשגיח הרבה גם לבקש מאת הממשלות כי תהינה בעזרנו לבל יעלה שבט הנוגשים על המחוזות השקטות על שמריהן והשלות מפחד רעה האלה, לבלי ישחיתו את רוח האזרחים נפשב ובשרם; לא יוכל להיות אסון גדול יותר בתבל, ומפעלות ליווינגסטאן אשר גלה את הארצות האלה בחרף נפשו בעכל ותלאה נוכל לרמום ברגלים ולמחות-שמם, אם גם בהארצות האלה ימצא מסחר העברים קן למו״. בכל זאת ידענו כי במקומות שונים גם באפריקא התיכונה ישלוט גם עתה סחר העבדים גם הכה שרשים חזקים עד כי לא נוכל לשרשהו על נקלה אך רבים יאמרו ויבטיחו כי אם נעשה קץ לסחר העבדים באפריקא התיכונה אז נבער עי״ז מן העולם את רובי השן (עלפפן ביין השן הוא הראש והראשון לסחורות תוצאות אפריקא התכונה ומסחר הש יוכל לצאת לפועל רק ע״י עסק חליפין (אויסטוישהאנדע) על עבדים (לפי דברי ליווינגסטאן „בלאסט זורנאל"" שלו ידרש בכל שנה 44,000 עבדים להעברת מכסת השן מאפריקא לבריטאניה מדי שנה בשנה). על דבר מסחר העבדים באפריקא המזרחית תביאנה לנו ידיעות הקאפיטאן פי ידיי והוויצעקאנזול עלטאן אל הלארד גראנוויל, ספורים רעים ונאמנים אשר נעוה משמוע ושערת בשרנו תסמר: אנית המלחמה „בריטאן"" בנסיעותיה החדשות בנחלי המים אשר באפריקא המזרחית תפשה אחת עשרה אניות מובילות עבדים אשר עשר מהן נחרץ עליהן המשפט ונהרסו עד היסוד, ובאניה אחת מהן נמצאו 120 שחורים אחרי אשר שמינים נפש כבר מתו, שלשים יום היו על הים טרם נתפשה אניתם מהאניה „בריטאן״, בהיותם חבושים כמו דגים מלוחים לא יכלו לנועע את אבריהם מעת נתן להם חופשם רק אחרי עבוד ימים אחדים: נער אחד ביחוד חרב ודלל בגופו באופן נורא מאוד עד כי גבר ונראה כל עצם ועצם מעצמות גופו. ואף כי היה לו 12 שנים בכ״ז עלה משקל כל גופו רק 25 לטרות. למרות כל עמל רופא האניה לכלכל את חייתו מת הנער ביום המחרת לחופשו. למען תת מובן מאופן הנורא איך חובשים (פערפאקען) המה את העברים נתאר בזה: כי עבה אחד ישב נשען ונלחץ בערפו אל קיר האניה, כי השני נמצא בין רגליו וערפו נלחץ אל הזה הראשון וכה היו חבושים שורות שורות עבדים אוש על יד, ע על אדות הדבר הזה נכרתה ברית בירח יוני 1873 בין בריטאניא ובין השולטאן מזאנזיבאר אשר בו ניאות האחרון כי תבטל בשלימות תוצאת העבדים (עקספארט) מחופי מזרח אפריקא וכי כל השוקים והירידים למכירת העבדים יסגרו ולא יהיה עוד בארצו. בקשר ואופני הברית הזאת יתחובב השולטאן להשתדל בכל מאמצי כחו להפריע ולבטל בכל מקומות ממשלתו את מסחר העבדים, כל אניה אשר תוביל עבדים תתפש ובעל האניה יוצג בשער לפני המשפט. אך קשר הברית הזה כפי הנראה לא הביא פעולה גדולה ונכרת, לפי ההודעות והשמועות החדשות השתדלו סוחרי העבדים למען הנצל מכף אניות בריטאניא לסלול להם מסלה למסחרם זה מלאמא עד בראווא. דר׳ קירק הקונזול האנגליא בזענזיבאר הודיע מחדש כי במשך זמן של ששה שבועות העבירו בדרך הזה יותר ממספר 2,800 עבדים — כמו כן הידיעות אשר הגיעו להגראף פאן גראנוויל ממקומות אחרים תעדנה ותוכיחנה כי קשר הברית משנת 1873 חדל כה ואין אונים לו לעצור בעד הרעה גם לא נמלא שמה כחוק. (הסוף יבא)  המעתיק: ברוך זאב ברי״מ קאפלאן חזה ועל רגל רעהו לחוצים ודבוקים יחד, מה איום ונורא היה מצבם להענות ככה שלשה ימים רצופים! לדאבון לבבנו נוכל לחשוב כי אלה האניות הבריטאניות אשר תעודתן לרדוף אחרי האניות המובילות את העבדים ולתפוש אותן יסבבו עוד להאומללים לפעמים מצור, ומצוק עוד יותר, יען כי סוחרי העבדים למען המלט מהתפש בכף אניות בריטאניא יעשו להם אניות קטנות מאד למסע עם העברים בדמותם כי בזאת יוכלו בהמון רב לבקש מפלט להם בכפי הסלעים (קאראללען ריפפע) אשר בחוף סאנזיבאר ועל האניות הקטנות האלה יטעינו משא לעיפה עבדים ממספר רב מאד בהיותם  מוכרחים לעשות כל תחבולה להנצל מידי רודפיהם, ונפש האומללים בטרם תבוא להם התשועה יתמו לנווע ולא יראו עוד אור וחיים על פני הארץ. בכל זאת יאמינו אנשי השם וגדולי דעה על דבר מסחר העבדים באפריקא המזרחות כי אם ירבו אניות מלחמה אשר לבריטאניה לחתור שמה ולארוב על אניות סוחרי העבדים כי אז יבטל המסחר, יען כי הסוחרים בזכרם את ההפסד והסכנה אשר יסבלו מהעסק הזה ינערו כפם לבלי עסוק בו עוד ומפני תוקף המחשבה המקובלת הזאת שלחה הממשלה הקאנסערוואטיווית אחרי קבלה את רסן שלטונה לדאוג בחפץ לבב כי יתרבו  אניות המלחמה במימי נהרות וימי אפריקא המזרחית."
021-HLB-1875-10-13-PG001-SINGLE-ORIGNAME_120103_toc_10,חדשות שונות," חדשות שונות איש אחד בשם רודאלף באיימן הלך ברגליו מנוייארק לסאן פראנציסקע מהלך 6,300 ווערסט במשך מאה ושלשים וחמשה יום — מספר הקאררעספענדענציאנען בחמשת חלקי התבל 2,300,000,000 מכתבים, משקלם יעלה עד 33 מילליאן קיללאגראס ואם נשטח את כל הגליונות אשר עליהם נכתבו המכתבים נכסה במו שמונה, פ״מ געאגראפיות. מהמספר הזה יחשבו מכתבים אשר לעבר הגבול 490 מליאן - בימים ההם נגמרה מלאכת גשר הברזל אשר על מסלת גאנג בקאונפורי. הגשר הזה יחבר מסלת אסט אינדיען עם מסלת ראודע ראגולינד, ובאופן הזה יהא מהלך ישר בין קאלקוטע ודוקאני, אורך הגשר 2750 רגל ונתאחד מחמש ועשרים כפות (ארקען) ברזל תלויות, אורך כל כיפה מאה ועשרה רגל. העמודים אשר עליהם ישענו הכפות נהפרים בהאדמה עמוק ששים רגל. הוצאת הבנין 150,000 ליט׳ שטערלינג. — זה לא כביר המציא הקאפיטאן קראפערצקי קנה רובה חדש העולה במהירתו עד ארבע פעמים מהצינדנאדיל. — בימים ההם נתנסה בברלין לעיני קהל גדול מחכמים וטעכניקים מכונה פיאעלעקטערית, בעזרת המכונה ההיא נוכל לקרות כתב מורגל במרחק פרסא. ביחוד נפלאה המכונה עת נעריך אותה על ראי מלוטש הפונה מול השמים, השמים כולו יופיע על הראי באור מבהיק מאוד כאור המפיץ כוכב הקאמעט, וכל נקודה אשר יראה על פני הראי תתראה באור המבחיק הזה, בקרוב ינסו גם לידות למטרה בעזרת המכונה הזאת. — בימים ההם מת באינדיען הלאמא (כהן הראש ממאמיני דת  בודהא) הכהנים הסובבים אותו מתאמצים בכל עוז להסתיר מותו מדעת הקהל ובסתר ימשחו „לאמא"" אחר תחתיו, הכהונה הגדולה ההיא גדולה פי שנים מכהונת האפיפיור ברומא כי ממספר 1,190,800,000 יושבי תבל יתחשבו: בודיסטים 405,800,000, בראמינים 1741, עובדי אלילים 111 מושלומנים 96, נוצרים 99ו ליהודים 5 מיליאן, נמצא כי בודיסטים יותר מנוצרים בכלל וכפלים מקאטולים בפרט, אשר מספרם יגיע עד 200 מליאן. — הצוללים במים (טאבר) אצל האי שציללי׳ כבר הוציאו מהים כדי 20,000 ליט. שטערלינג, מאנות שיללער הנטבעת זה לא כביר ועוד יחסר להוציא 40,000 ליט׳ שטע׳ כי כל שלל האניה הנטבעת ההיא היתה 60,000 ליט. שטערלינג. — נערה אחת בת ארבע עשרה שנים „מים בעקויז"" שמה, עשתה גם היא כמעשי הקאפיטאן אועב ולעיני קהל גדול קפצה מהגשר בהטעמזא ושטה כשש פרסאות אנגלית בלי כל עמל. — לפי דברי המ״ע לקח מלך בירמאניע דברים עם איש איטאליעני לבנות מסלות הברזל מעיר ממלכתו מאנדאל, עד הגבול ושם יתחבר עם המסלה אמט אינדיע בריטאנית ההולכת לאורך עומק יארוואדי. - ביום 31 אוגוסט היתה האספה האחרונה מחברת אוהבי השלום החברה גמרה אומר להשתדל בכל כחה לעצור בעד המלחמות וליסד שופטי שלום על כל ריב מדיני. — דאבין זאן דורינו. — לפני עשרים ושש שנים נאבדה אניה בריטאנית „פלוראנדיע"" במסעה מנעוו-ארלעאנס לקאליפארניע, הידיעה האחרונה אשר נשמע ממנה היתה בשנת 1849 מריא זיינארא, ומשם פרסה נסה הלאה לים השקט ונאבדה יחד עם אנשיה ועקבותיה לא נודעו עד אשר זה כשני ירחים ורוח סערה הטיל אניה אחת בריטאנית על אי שמם ובודד בים השקט הבלתי נודע עדנה. ומה מאוד השתוממו האנשים  במצאם על האי אנשי אייראפא, והפלא היותר גדולה כי דברו אנגלית וכאשר שאלו אותם: מי הם? מאין הם? ואיך באו הנה? השיבו: בריטאנים אנחנו, וזה לפני עשרים ושש שנים ורוח סערה הטיל אניתנו הנה בנסענו מריא זיינארא, ומאז עוד לא דרכה רגל בן אייראפא על האי הזה, ויקראו בשמותם לבית אבותם מי המה בענגלאנד. אנשי האניה בשובם ללאנדאן חקרו ודרשו בספרי הנוסעים באניות משנת 1849 וימצאו כי כנים הדברים וכי הם הם האנשים הנאבדים יחד עם האניה פלוראדיע. — לפי דברי „הרוסקי מיד׳ בדעת ממשלת רוסיא לבנות בית ענושים „צוכט הויז׳ מיוחד בעד הפושעים בענינים מדינים מבני הנעורים אשר עד עתה שולחו בעד פשעם לסביר או לעבוד בפרך (קהמארזני בבית הזה ישאו את עונם לא יותר מארבע שנים, ותקות הממשלה חזקה אשר במשך העת ההיא ישובו מדרכם הרעה. הבית ההוא יבנה כפי הנשמע בסביבות פעטרבורג. — באיטאליע מצאו החופרים באדמה עצמות מת (סקעלעט) שני ילדים מכוסים בקליפת ברזל, ולפי דברי הגעאלאגים הנם עוד מימי המבול.  בין ממשלות אייראפא, ממשלת רוסיא היא האחת אשר פתרה לטוב את שאלת הנשים, ועוד לפני שנתים נתנה הזכות להנשים אשר כלו חק הלמודים בהאוניווערזיטעטין לשרת במשרות המדינה להיות רופאים ואדוואקאטים, כאחד האנשים. וגם עתה לפי דברי המ״ע סט״פ וויעדימסט נתנה הזכות לנשים לשרת במשרות שונות על מסלת הברזל, חברת בוג המסלה ברוסיא גמרה אומר לקבלם בתור פורטי הטעלעגראף אשר על המסלה. בתולות ואלמנות בלתי צעירות משמונה עשרה שנה, ובתנאי אשר מספר הנשים לא יגיע רק עד 000 15 ממספר האנשים העובדים.  המעתיק: אלחנן ליב לעווינסקי"
021-HLB-1875-10-13-PG001-SINGLE-ORIGNAME_120103_toc_11,הו- ו ת," הודעות ענערס האטעל אין בערלין הירמיט ערלויבע איך מיר, מיין פיעלען יאהרען בעשטעהענדעס אין לעצטערער צייט פערגרעססערטעס האטעל, דען פערעהרטע רייזענדען בעסטענס צוא עמפפעלען, פיר בעקוועסליכקייט, שנעללע בערינונג, אונד גוטע שמאקקהאפטע קיכע איז געזארנט. שמרי' אייגער נכד הגאון רע״ק איינער אין בערלין קלאסטער שטראוזע 97 (ביטטע בעאבאכטען גוט אוף מיין אדרעססע) אתכבד להודיע לכל מכירי אשר התלוננו בבית חותני הר״ר אורי' גערשאנאוויט נ""י ואח״כ אצלי בפה קאוונא, אשר למען הפיק רצון האורחים בכל קורות רוח הדרושה לאכסניא טובה אעזוב את חצר קאזזאלעווסקי. ושכרתי לי המלון אורחים המפואר הנודע בשם האטעל לאנדאן. אצל הגביר ר׳ אנשיל וואסערדאם, ברחוב ארוך באמצע העיר מול הקאנטרים הגדולים בתי-מסחר, שמה ימצאו האורחים מרגוע לנפשם בתאים ועליות מרווחים צרכי אוכל, ושירות כן באכסניא כן בנוגע לעסקיהם יהיה עצהיו״ט. זומן 1 אקטבער הבע""ל אתקע אהלי שמה אי""ה אליהו אהרן גארפינקעל הנני להודיע לכל קוראי הלבנון כי נמצא ת""י הספרים הנרשמים פה והנני נכון לשלוח ליד דורשיהם חפשי, על המקח הקצוב: ס׳ עלית אליהו הוצאה רביעית 37 ק׳, ס׳ נפש החיים 40, ס׳ גבורת אדי 60, ספר חליפות שמלות הוספות וביאורים על תרגום אונקלס (כעין הספרים אשר הוציא לאור ס׳ „לחם ושמלה"" „ועוטה אור"" אשר כבר יצאו לאור על הארץ) 60 קא׳, ס׳ זיס אפפענהיים 20, ס׳ אג״ת השנית מהרי״ס 20. א״ס ח״ש מהנ""ל 2 רו״כ, פ׳ ר׳ חננאל על מס׳ פסחים 50, ס׳ אגרת הרמ״ה 40 קאפ. והנני בבקשתי מכל מי שירצה להשיג ספרים בעברית או בשפות אחרות או יש לו ספרים ליתן בקאמיססיאן לפנות אלי ואני אמלא המבוקש כרצון איש ואיש. ארי׳ ליב לעווינסאהן סוכן הלבנון זה כתשעה ירחים כאשר נער אחד מעירנו שאוויל כבן י""ב שנים המק ועבר מבית הוריו על אשר אביו ייסד אותו כאב את בנו ולא נודעו עקבותיו, וכבר כתבתי מזה במכ״ע המגיד, אבל לדאבון לב הוריו עודנה לא נבעו מצפוניו ומחמת שהמתחיל בדבר מצוה אומרים לו גמור ע״כ מצאתי מחוייב את נפשי להודיע גם כן בשערי הלבנון ולחלות את פני קוראים נכבדים אם שמע או ראה או ידע מהנער הנ״ל האם עודנו בחיים הייתו לחוס על הוריו הנדכאים והאומללים ולהודיעני כפי האדרעססע הרשומה מטה ואז יקוים מאמר הכתוב להשיב לב אבות על בנים וכו' שמו יצחק מיכאל שם אביו משה ראטהויז קומתו ממוצעת וגם על הפרצוף יש לו נקודים (זאממער שפריינקלעך). הכותב בעד הגדכאים ומצפים בכליון עינים על ידיעתכם. יעקב יהושע בלא״א מהו׳ ניסן וואלבערג איש שאוויל."
021-HLB-1875-10-13-PG001-SINGLE-ORIGNAME_120103_toc_12,סי סאחינו בארץ אלניר חחפץ לאסוף את הלבנו...," מי מאחינו בארץ אלגיר החפץ לאסוף את הלבנון אל ביתו במחיר 18 פראנק 75 סאנטין לשנה, יכול להשיגהו על ידי ידידנו: Mr. Le Rabbin Juda Darmon a Oran. או ע״י ידידנו: Mr. Le Rabbin Joseph SamuelAboulafia chez Mr. Ch. Mesgis AOran, Algerie. האברך המופלג החריף מוה׳ יוסף בר״י הכהן גוטמאן נ״י (חתן הגאון מוהר״א נ״י אבדק""ק פיקעלין), התנדב להיות סוכן הלבנון בממלכת בריטאני׳. והחפץ בטוב הלבנון וכבודו בארץ ההיא יפנה אליו עפ״י האדרעססע הזאת: Mr. J. Coodman, 26, Scarboroug-street. Coodmans fields London"
021-HLB-1875-10-13-PG001-SINGLE-ORIGNAME_120103_toc_13,' הודעה' אחרונה :בעת נעילת שערי הלבנון ה...," ה ודעה אחרונה בעת נעילת שערי הלבנון הביאו כה״ע הודעה טעלגראפית שבאה פאריזה מבאגדאד, לאמר: לפי ההודעות שבאו באגדדה מטעהראן (בירת פרס) נתפשו בכף כל החוטאים אשר ידם היתה כסעל שרפת איש יהודי בעיר האמאדאן, וממשלת פרס ענשתם כיד פשעם. והממשלה הבטיחה כי לימים הבאים תגן על היהודים בארצה כמו על יתר אזרחי הארץ."
021-HLB-1875-10-13-PG001-SINGLE-ORIGNAME_120103_toc_14,םכתבים 10 או פשלוח־כסף ישולח אלינו(רק חפ..., מכתבים או משלוח-כסף ישולח אלינו (רק חפשי) על האדרעססע הזאת: An die Redaction des Jsraelit (hebraeisch Ausgabe( in Mainz Deuischland(
021-HLB-1875-10-13-PG001-SINGLE-ORIGNAME_120103_toc_15,110£.?011.1. 21*11 111 118108־11> — 1)1ם..., Fur die Redacgon Verantvortlich: Dr. Lehmann. — Druck Von J. Bril in Mainz
