article_id,headline,text
021-HLB-1882-08-10-PG001-SINGLE-ORIGNAME_190233_toc_1,"ב 1[£1,1(*£ 14 . 10 8,110ג08ד־ X ־ ^ 6 1..."," ALOanOR yORM ALIG E  COralsche Ausgabe des „Asraellu המפורסמים מהם מתחת מהם  SE שנת תשע עשרה נומער החפץ להשיג את הלבנון,  מחירו לשנה ע״י בוכהאנדלונג או ע""י פאסטאמט בארצות אשכנז, 12 מארק ידרשוהו מהם בשמו האשכנזי:  באוסטריא 7 פלורין א""וו иквв. AUзс. Dва декABLгг. ברוסיא ופולין 50 ,5 רו״כ.  מרוססיא ידרשוהו מאתנו על פי 1 פונד שטלג  בהודו וכינא האדרעססע הזאת: בשאר ארצות 75 ,18 פראנק. S. J. Bril in Mainz. Deutschland ולמחצית או לרבע שנה בחצי או בפולין מאת: ברבע ממחיר הקצוב למעלה. Ch. CZernowicz, Dzika No. S, W   מחיר מודעות in Warschau. ם מאמר אשר לא יעלה לרצון על  20 פפעניג בעד כל שורה, ואם ב מזבח הלבנון איננו חוזר לבעליו.  נדפסת איזה פעמים ינוכה ראבאט. מכתב בלתי חפשי לא יקובל. הודעת עגונה מקובלת בחנם. מההקווארדארראוואסוריאל מכתב עתי לבני ישראל ל האיש אישים איש איש איש איש היום העלים ושלם יוצא לאור בכל שבוע   לבשר ולהורות כל דבר הנדרש לאיש יהודי לה  להודיע ת כאשר הוא יהודי וחבר לחברת האדם מאת יחיאל ברי״ל יצ״ו. דֶּרֶךְ אֱמוּנָה בַּחַרְתִּי (תהלים קי״ט)"
021-HLB-1882-08-10-PG001-SINGLE-ORIGNAME_190233_toc_2,"1x61x2, 460 10. ^§^ 1 "" 882 ־־ I ] \ . 0...", א מאינץ כ״ב מנ״א . No. 30 גם
021-HLB-1882-08-10-PG001-SINGLE-ORIGNAME_190233_toc_3,תוכן הענינים:, תוכן הענינים: דברי הימים: שאלת מצרים. סוריא. צרפת. מכתבי סופרים: ברלין. ווארשא. ווילקאווישק. מכתב פתוח. ירושלם. חדשות שונות מתפוצות ישראל: מאינן. ברלין. בראדי. עלילת דם בהונגאריה. טריעסט. טריפילים. בעלגראד. קאנסטאנטינאפול. הודעות. ירכתי לבנון: פארטהענאפא.
021-HLB-1882-08-10-PG001-SINGLE-ORIGNAME_190233_toc_4,דברי הימים," דברי הימים תחת מחסה אוראפא כלה, בהציבה לה יד בעיר סועץ. ממשלת בריטאניה יודעת גם היא כי הממשלות האדירות לא תתננה אותה לכבוש את ארץ מצרים לספחה אל ממלכת בריטאניה. אבל גם זאת יודעת על פי הנסיון כי בהציבה לה יד בארץ מצרים תהיה ידה שם על העליונה אחרי מלחמה, ממשלת בריטאניה רואה כי עין שאר הממשלת צרה בה, בתתן כח והרשאה לממשלת השולטאן כי תשלח צבא מלחמתה מצרימה, ולה (לממשלת בריטאניה) לא תחפיצנה לתת הרשאה כזאת בשם אוראפא כלה, ועל כן תקח לה הרשאה כזאת בעצמה, באמרה כי הקהעדיווע אשר כל הממשלות האדירות קימו את הפירמאן אשר נתן השולטאן בשנת 1879 לטעוופיק באשא להיות שליט בארץ מצרים, הוא עוד היום מושל הארץ, וברשותו העלתה את צבאותיה על יבשת אלכסנדריה, ועל פיו שלחה צבאותיה לסועץ לשמור את לשון הים לבלי יעצור אדאבי ביי את האניות העוברות עליו. ה׳ גלאדסטאן בפה מלא אמר בסוד הפארלאמענט בשבעה לחדש הזה, כי הדבר אשר הממשלות האדירות תחפוצנה כי לשון ים סועץ תעמוד תחת מחסה אוראפא כלה הוא למען לא תעצרנה האניות העוברות ושבות דרך לשון ים סועץ בעת המלחמה, והדבר הזה תשיג עתה אוראפא על ידי חיל בריטאניה השומר את מבוא לשון ים סועץ מפני חיל המצרים, ועוד לא באה העת לשאת ולתת בהשאלה אם לשון ים סועץ היא דרך הרבים ויד כל הממשלות שות בו, או לא. — עד היום שאנו כותבים דברינו אלה עוד לא הודיע הטעלעגראף כי באה ממשלת בריטאניה אל עמק השוה בדבר מלחמתן יחד בארץ מצרים. בשבעה לחדש הזה ענה סיר דילקע לשואלו בסיד הפארלאמענט כי המשא ומתן בין שתי הממשלות עוד לא בא אל נקודת השתוות שיכול להודיע מה ממנה. במושב הקאנפערענץ מיום השמיני לחדש הזה הבטיח ציר השולטאן כי אדונו ישלח מכתב גלוי להמצרים להודיעם כי השליט בארץ מצרים הוא הקהעדיווע גם עתה, ואראבי ביי אשר התקומם נגדו הוא מורד במלכות. אבל ציר השולטאן לא הגיד אם שליחת מכתב גלוי הזה תהיה בטרם תעמודנה רגלי צבאות השולטאן על אדמת מצרים, כאשר דרשה וחזרה ודרשה ממשלת שאלת מצרים שנתה פניה בימים האחרונים. עתה לא נשא עין עוד אל הקאנפערענץ בקאנסטאנטינאפול כי אם אל עמוד העשן העולה מהקאנאנים הבריטאנים על אדמת מצרים. בעת אשר הממשלות האדירות נושאות ונותנות בההצעה להעמיד משמר משני עברי לשון ים סועץ מאנשי חיל של כל הממשלות, עשו הברי- טאנים את הטוב בעיניהם, ושלחו אנשי חיל באניה דרך לשון ים סועץ והציבו להם יד בעיר סועץ אשר בפתח לשון הים מנגבה. כפי ההודעה הבאה מברלין, מתנחם הנסיך ביסמארק על המעשה אשר עשתה בריטאניה למרות עיני כבודו, למרות חפצו להביא את לשון ים סועץ תחת מחסה אוראפא כלה, באמרו כי הציבו להם הבריטאנים יד בסועץ רק למען יהיו בטוחים כי אנשי חיל בריטאניה הבאים מהודו אל מערכות המלחמה במצרים לא ימצאו מעצור בעלותם היבשה בחוף הים סועץ אצל סועץ. כן יתנחם הנסיך ביסמארק, אבל האמת לא כן היא. כמעשה ממשלת בריטאניה באלכסנדריה כן מעשיה בסועץ. ממשלת בריטאניה הקדימה את כל הממשלות האדירות העוסקות בשאלת מצרים באשר היא שאלה הנוגעת לכלן בדבר אשר הרסה מדעת עצמה את מבצרי אלכסנדריה, והעלתה היבשה חיל גדול אשר יספיק לדחות בשתי ידים את אראבי ביי בבואו ביד חזקה לקחת את העיר תחת ידו. וכן הקדימה את הממשלות האדירות אשר אמרו להביא את לשון ים סועץ אל המושיע אשר קם מקרב אחיהם, ואין כל ספק שאם תעוז יד אדאבי ביי אך פעם אחת במלחמה תפרץ מרד גם בסוריא. וכמו במצרים כן שם יתנפלו הערביים המוסלימאנים על הנוצרים יושבי הארץ לכלותם מעל פני האדמה. וכבר רואים הנוצרים בסוריא את הרעה כמו היא נגד פניהם ואיש איש מהם יכין לו בביתו בלי נשק, אבק שרפה ובדורים להגן על נפשו ונפשות ביתו ביום יקראו הערביים מטבח להנוצרים. צרפת. — עשרה ימים שבע נשיא הרעפובליק עמל ויגיעה עד אשר מצא אנשים שהתרצו אליו להיות לשרי עצתו תחת שרי העצה שהתפטרו ממשמרת פקודתם בכ״ט לחדש העבר. בתוך שרי העצה החדשים נמצאו אך שלשה משרי העצה הקודמים, והם היועץ בעניני המלחמה ביבשה, בים ובעניני הפאסט והטלעגראף. שם היועץ בענינים החצונים והוא יושב בראש שרי העצה, הוא: קארלעס טהעאדארע דיקלעריק. האיש הזה הוא בן שבעים שנה, ובענינים החצונים לא יצא לו עוד שם בין הדיפלומאטים, ותחת זה הוא משכיל ונבון דבר בעניני הפינאנצים. ואם כן יכונן הפאליטיק החצונית של צרפת על יסודי הפינאנצים. בתשעה לחדש הזה נקרא באזני נבחרי העם הפראגראם של שרי העצה החדשים. בענינים החצונים מקבלים עליהם שרי העצה לבלי נטות ימין ושמאל מהסכמת נבחרי העם בכ״ט לחדש העבר, והיא לבלי התערב בדבר שאלת מצרים. ורק אם יקרה דבר הנוגע בכבוד צרפת ונבחרי העם ישאפו מנוחה בבתיהם, ימהרו לקרוא אותם להתאסף יחד ויציעו לפניהם את דבר המקרה וישאלו את פיהם מה לעשות. בריטאניה; או אחרי כן כרצון השולטאן. וכנראה תתפשרנה שתי הממשלות בדבר הסכסוך הזה, כי בה בעת אשר יחלו בני חיל השולטאן לעלות היבשה באלכסנדריה, יצא דבר השולטאן אל המצרים להודיעם כי אנשי חילו באו  מצרימה לחזק את ממשלת הקהעדיווע ולענוש את אראבי ביי כדין מורד במלכות. וכן בסדר המלחמה על אדמת מצרים ימצא דרך פשרה. הבריטא נים יחזקו לראשונה עמדתם באלכסנדריה ובחוף לשון ים סועץ, ויניחו את חיל השולטאן ללכת לבדם הלאה בפנים ארץ מצרים. והיה כאשר יראו הבריטאנים כי קצרה יד צבאות השולטאן להכניע את אדאבי ביי, או כי יתחברו צבאות הטורקים יחד עם צבא המצרים, אז יצאו צבאות בריטאניה ביד חזקה להלחם עם המורדים עד חרמה, מבלי יפחדו עוד פן תקצר ידם להשיג חפצם אחרי התבצרם במבצרי אלכסנדריה ומפתחות הים הן בידם. בין כה וכה אניות מבריטאניה ומארצות הודו תוליכנה אנשי חיל למצרים, וכן מקאנסטאנטינאפול כבר יצאו אניות עם אנשי חיל מחיל השול- טאן. ומובן מאליו כי חיל השולטאן לא ינסו לעלות היבשה בטרם תשתוינה ממשלת בריטאניה וממשלת השולטאן בכל הענינים הנוגעים להמלחמה, כי ציר ממשלת בריטאניה הודיע מפורש ובאר היטב בסוד הקאנפערענץ כי האדמיראל הבריטאני העומד לפני אלכסנדריה לא יתן את חיל השולטאן לעלות היבשה באלכסנדריה בטרם יהיו כל עקובי הסכסוכים בין בריטאניה וטירקיא למישור. הדברים האלה שכתבנו בזה הוא כפי העולה על רוח בני האדם החפצים בקיום השלום הכללי. ואולם לא יחסרון אנשים בין יודעי בינה לעתים הרואים מרחוק כי מהמלחמה הקטנה על אדמת מצרים תפרץ מלחמה גדולה בשערי אוראפא. ה׳ פאן בלאוויץ המודיע לחדשות מפאריז במכ״ע טימעס הלונדוני, יודיע את הדברים אשר שמע מפי אחד הדיפלומאטים הגדולים (מי הוא זה?). הדיפלומאט הזה אמר לה׳ בלאוויץ כי הנסיך ביסמארק ישתמש בממשלת השולטאן כמו בכדור אשר ישחקו בו הנערים. המשחקים ברצותם להפיל את אחד מחבריהם ארצה ישליכו בין רגליו כדור למען יפול במרוצתו. אבל תקות ביסמארק תכזב בו הפעם. ממשלת בריטאניה לא תפול לארץ ע״י הכדור הטורקי אשר ביסמארק השליך בין רגליה, וסוף סוף תבוא ממשלת בריטאניה לעמק השוה עם ממשלת השולטאן. ממשלת בריטאניה תכבוש לה את ארץ מצרים, ושם השולטאן יהיה נקרא עליה כאשר נקרא עוד היום על אי-קפריסין אשר הביאו הבריטאנים בידם. ואולם אם הנסיך ביסמארק לא יתן להשולטאן להשתוות עם ממשלת בריטאניה, אזי תפרץ מלחמה כללית בשערי אוראפא. בעקב הסכסוך בין ממשלת בריטאניה ובין ממשלת השול- טאן תתחלקנה הממשלות האדירות לשתי מחנות. המחנה האחת תהיה מממשלת אוסטריה, אשכנז ואיטאליה; והמחנה השנית תהיה מרוסיא (?), צרפת ובריטאניה. האמנם לא יאומן כי הנסיך ביסמארק לא יראה מראש אחרית מלחמה גדולה כזאת, אבל מי יודע אם ההשגחה לא בחרה את ארץ מצרים לשבור שם זרוע מרעישי ממלכות. וכבר רבים ועצומים מהנסיך ביסמארק ירדו ממרום שיאם על אדמת מצרים. סוריא. — מודיעים מביירוט במכ״ע אונ. אלל. צייט. כי מצב שלום יושבי ארץ סוריא הוא ברע מאד, מאז הרסו הבריטאנים מבצרי אלכסנדריה והעיר היתה למאכולת אש. האמנם כי פקידי ממשלת השולטאן ישתדלו למראה עינים לעצור בעד הרעה המתחוללה, אבל בקרב לבבם יקונן החפץ כי גם בסוריא תהיה יד המוסלימנים בהנוצרים. ורבים מפקידי הממשלה אשמים בחפחד אשר ישכון על פני ארץ סוריא. אז כאשר הפקיד השולטאן את מידהאט באשא הנאור לפקיד בארץ סוריא, השתדל הוא בכל עוז לכונן בכל מקום ומקום חברות אשר יאספו כסף לתמוך בידי דלת העם מבני המוכי לימאנים. בראשי החברות עומדים עשירי ארץ סוריא ורבים מפקידי החיל. והראשים האלה חושבים מאז לכונן ממלכה ערבית מארץ סוריא ומצרים יחד, ובדבר אשר בני דלת העם מקבלים תמיכה מראשי החברות עבר גם עליהם הרוח להשליך מעליהם את עול ממשלת השולטאן הטורקי. ועתה כאשר התקומם אראבי ביי במצרים ישאו גם הערביים בסוריא את עיניהם"
