article_id,headline,text
021-HLB-1878-09-27-PG001-SINGLE-ORIGNAME_150067_toc_1,I I 3 61 ) ^ 1 80 11 6 1 118^ 1 ) 6 168 ...," Hebraische Ausgabe des „sraelit SHA BA ו- שנת חמש עשרה במעוא ט החפץ להשיג את הלבנון  מחירו לשנה ע״י בוכהאנדלונג או ע""י פאסטאמט בארצות אשכנז, 12 מארק. יחרשהו מהם בשמו האשכנזי: באוסטריא 7 פלורין א״וו HEBR. AUSG DESISRAELIT ברוסיא ופולין 50 ,5 רו״כ.  ברוסיא ידרשהו מאת הסוכן הראשי . דו וכינא פונד שטלגי ב E  ( L. Lewinsohn. זאר ארצות 75 ,18 פראנק. Bolschaia Uliza, Wilna מחצות או לרבע שנה בחלי או  בפולין רוסיא מאת הסוכן הראשי   ברבע ממחיר הקצוב למעלה. A. J. Epstein   מחיר מודעות 27 Nalewkss. Warschau ם . ם מאמר אשר לא יעלה לרצון על 20 פפעניג בעד כל שורה, ואם מזבח הלבנון איננו חוזר לבע נדפסת איזה פעמים ינוכה ראבאט. מכתב בלתי חפשי לא יקובל‧ הודעת עגונה מקובלת בחנם.  רועי העירי ימים אשר אין רוחי היונים ומשם לעולל עיר ועיר ועיר ועוררו ויעוררו - מכתב עתי לבני ישראל יוצא לאור בכל שבוע להודיע ולבשר ולהורות כל דבר הנדרש לאיש יהודי לדעת באשר הוא יהודי וחבר לחברת האדם מאת מאיר (דר.) לעהמאן ע״י יחיאל ברי״ל יצ""ו דֶרֶךְ אֱמוּנָה בַחַרְתִּי (תהלים קו״ע)"
021-HLB-1878-09-27-PG001-SINGLE-ORIGNAME_150067_toc_2,"!878־27 §6^1)61 מ2 > ^6א"" ^11 ל 1 שנה טו...", et תכתבו ותחתמו. מאינץ ערב ראה״ש התרל״ט No. 9 לשנה טובה
021-HLB-1878-09-27-PG001-SINGLE-ORIGNAME_150067_toc_3,רירו הימם: השקפה כללית על מקלי שבעת ימים..., דברי הימים: השקפה כללית על מקרי שבעת ימים האחרונים. — הודעות שונות. מכתבי סופרים.: שאוועל. יארצעווע. ווארשוי. חדשות שונות מתפוצות ישראל: בערלין. רומא. ראסקאוו. וויען. פראנקפורט. קארלסבאד. איזמיר. אלגיר. מארוקו. חדשות שונות. הודעות. — הודעות אחרונות. ירכתי לבנון: ספור „בת נדיב״.
