article_id,headline,text
021-HLB-1875-01-06-PG001-SINGLE-ORIGNAME_110275_toc_7,מלחמת האמונה והאהבה," מלחמת האמונה והאהבה נעתק משפת עם לועז על ידי ישעי געלבהויז מרים עמדה על חלון ביתה ותבט אחרי אישה אשר הלך ממנה, כי הבינה אשר הוא נסה להסתיר מבוכת נפשו ממנה, ודבריו האחרונים צללו באזניה בלי חשך. ותפעם רוחה ולבה נע בקרבה כנוד הקנה במים. מאוד נכספה לרוץ החוצה ולקרא לבעל נעוריה היקר לה מאוד ולהבטיח אותו שנית כי עזה כמות אהבתה אליו ואך בו כל אשרה והצלחתה עלי תבל. ועוד קותה כי פעדדינאנד ישוב במהרה לביתו מפני זרם המטר וסער המוער בלילה הזה, אולם לשוא! לאט לאט התעלם פערדינאנד מעיניה ועקבותיו לא נשמעו. חזיז נורא האיר חדרה ואחריו הרעים רעם גדול בשמים ותתר מרים ממקומה ותמש מן החלון וכאשר שבה שנית לראות  בעד האשגב והנה חושך וצלמות מסביב וימש הושך. ל. השתקשקה ברחובות העיר ורצתה בחפזה כגלגל לפני סופה. עשתונות מרים נבוכו מאוד, תעה לבבה על דבר אשר עוד מאתמול בושש אישה היקר לשוב לביתו: האם גלה ארטור הדבר הכמוס עמדו למען השחית את פערדינאנד? — זאת לא תוכל היות - ההוא נשבע ולא יקימנה — אולם ארטור חשב כי בגד בגדה בו מרים ולא יכול להאמין כי נקי הוא משבועתו ומעלתו לאשת מאראלעס? — ולא נשבע שטאנלייא בראותו אותה בפעם האחרון לקחת את נקמתו מפערדינאנד?... כן התרוצצו מחשבותיה רצוא ושוב עד אשר העגלון משך בהסוסים והמרכבה עמדה. מרים הלכה אל האולם הגדול מהיכל הגבירה ותפן כה וכה לראות האם לא יבוא מאדאלעס לקדם פניה. אולם אין קול ואין קשב, האנשים והנשים אשר פגשה בדרך החרישו ולא דברו דבר ויביטו אחריה ויתמהו זה אל זה והכרת פניהם ענתה בם כי מאוד ינודו לה. בצרת נפשה ובצוק לבב רצתה מרים לשאול איה פערדינאנד, אולם לא יכלה לפצה פיה מפחד גדול. בעוד רגעים מעטים עמדה לפני המלכה. *.* מרים שמעה האסון הגדול אשר קרה. לא במהרה בשדה אותה המלכה הבשורה הרעה הזאת מיראתה פן תהלמנה השמועה כחולם הרעם, אך לאט לאט הודיעה לה פידה הנורא ושברה הגדול. המלכה לקחה בכל כאבה ובצרתה לה צר. וכרעה כאחות גדה לה. כשמוע מרים השמועה הזאת צעקה צעקה גדולה ומרה בכתה רב בכי קרעה שערות ראשה עוררה תאניה ומפיה יצאו דברים אשר מוזרים היו להגבירה. איזאבעללא עוד לא הגידה למרים איך נפל מאראלעס, וממוצא שפתיה לשפוט ידעה כל מוצאות המקרה הזה יען במבוכת לבה דברה מרצח, חרב, ודם, ואוררה היום אשר הביא לה הצרה ההוא ותיילל כי אך היא אשמה בהאסון הנורא לאמר: הסער קם לדממה העבים נפוצו והגשם חדל, ותלך מרים לשכב על מטתה ותישן עד עלות השחר. אזיון נורא החריד אותה כל הלילה. וכמו השחר עלה הקיצה פתאום משנתה וקול צעקה התמלט מפיה מפני הכאב הגדול אשר הציקה. ותהי ראשית מחשבתה בהדברים אשר דבר אליה פערדינאנד טרם הפרדו ממנה. וצלצלה בהפעמון אשר אצל מטתה לקרא לנערה משרתה ולשאול אותה האם שב מאראלעס הביתה. נעמי באה החדרה ותאמר גבירתה כי עוד לא שב מארמון המלך. „אם כן״ — קראה מרים — „מהרי נא לשלוח אל היכל המלך לשאול מה היה לו מדוע אחרו פעמיו לבוא בפעם הזאת״. ותקם מרים מעל מטתה ותלבש מן הבגד הבא בידה. וטרם כלתה להתעטף בכתונת הפסם, ונער נושא כלים בא החדרה ויבשר אותה כי רצי המלך עומדים בחצר עם מרכבה אחת שלוחים מאת המלכה להביא את מרים חיש מהר אל חצר המלכות, „גבירתי יקירתי!״ — הוסיף הנער לדבר — „תנה אותי ללכת אתך, האנשים אשר באו כלם מחשים כאלמים לא יפתחו פיהם — בטח בא אסון נורא ושבר גדול״ „החרש!״ — קראה נעמי ותשסע אותו בדבריה בהביטה בפני מרים — „המות תמית בדבריך את גבירתנו״. „המות תמית! מי זה מת?״ — קראה מרים בתמהון — „אייה הוא פערדינאנד?"" „האדון עודנו בארמון המלך״״ — השיבה נעמי במהרה — „עוד לא כלתה המועצה והמלכה שלחה המרכבה הנה, יען נכספה לראות גם את פניך גבירתי״״. — ובדברה הדברים האלה הלבישה את מרים כתונת הפסים והביאה אל המרכבה מבלי אשר מרים ידעה אנה היא באה. מרים ישבה בעגלת צב והעגלון הרים את רסן הסוסים והמרכבה „למה לא בלע אותי המות לנצח?״ — התיפחה מרים ותפרש כפיה — „עתה כאשר למדתי לאהוב אותך בכל לבבי ובכל נפשי עתה כאשר אוכל לגמול לך באמת ותמים העמל אשר הסיבותי לך, עתה תלך ממני ולא תשוב אלי עוד תעזוב אותי בודדה כערער בערבה בלי נוחם בלי מודע ורעה! „לא נשארת בלי מודע ורעה כל עוד אשר איזאבעלא חיה."" קראה המלכה ותחבק את מרים בזרועותיה — „בכי בכה בתי האומללה! בכי בכי תמרורים להולך ולא ישוב לראות עוד את ארץ החיים! על אבדון האיש הזה תרדנה דמעות עיני כל גבורי שפאניא. וימים רבים ימשכו עד אשר תבלגי עלי יגונך ותמצא נוחם לנפשך, אולם חדלי לך לדאיב את חייך בעשותך אשם נפשך למה תחרף את לבבך מימיך?״ מרים נפלה לרגלי המלכה וזעקת שבר עוררה: „לא תדעי גבירתי איך אהוב אהבני אישי, הגידי נא לי כי עוד אשוב לראותו פעם אחת, הגידי לי כי עוד אשבע נעימת פניו והוא יסלח לכל עונותי טרם נפשו הטהורה תשוב לשמי מרומים, ואשא את אשר נטל על גורלי המר והנסהר!"" „„עיניך תחזנה אותו, אם זאת תנחמך, אולם לשמוע את קולו!.. מי יתן ותוכל גם זאת! ואני תפלה לאלוק שמים הכל יכול לברוא בריאה חדשת להקיץ את אישך מתרדמת מות ולהשיבו לארץ החיים, אולם, אתה - פערדינאנד הוכה אל החומש והחרב באה בבטנו!"" „הוכה אל החומש! החרב באה בבטנו!״ — צעקה מרים כמשתגעת — „מי זה שפך דמי פערדינאנד כמים?!״ — המלכה חרדה בהביטה בפני מרים. „האמנתי כי גם את דברת משוד ורצח״״ — השיבה איזאבעללא אחר רגעים מעטים — „הגידי נא לי אם ידעת איש אשר יוכל להרים את ידו נגד מאראלעס להכותו נפש משנאתו אותו? מרים לא יכלה לרום עיניה אל הגבירה ותסתיר את פניה באדרת איזאבעללא וכאוב מארץ אמרתה צפצפה „אין גם אחד!״ „אין גם אחד! הלא תסתור את דבריך הראשונים״ — השיבה המלכה — „„אולם אם גם האיש אשר הובא במשמר שלח ידו במאראלעס את לא תוכלי לדעת את שונא אישך ואויבו בנפש, כל המקרה חידה היא וגם דבריך כדברי ספר החתום המה לי. אך טרם כל נקום ינקם מאראלעס מהרוצח״. „מהרוצח! מי הוא הרוצח? — צעקה מרים עד כלות כחה — „מי זה הרים אגרוף רשע נגד פערדינאד? האם אמרתי כי לא היה לו אויב? זאת לא זאת - איש אחד שנא אותו במאוד מאוד, ומאתי היתה נסבה כי שנאהו — אולם הוא לא רצחו נפש!״ — ובדברה הדברים האלה החזיקה בידי הגבירה — „אל גדול בשמים! — רעיוני נבוכו — מי הוא הרוצח?"" „איש אחד אשר לא ארכו הימים מעת תדעהו״״ — השיבה איזאבעלא — „ואם גם חרבו ובגדיו יעידו בו ופיו ירשיע אותו בכל זאת לא נקל להאמין כי האשם בארטור שטאנלייא״"". „שטאנלייא!!״ — קראה מרים קול גדול אשר כל השומע צללו שתי אזניו, ונפלה אחורנית מתה לרגלי המלכה. (ההמשך יבא) —"
021-HLB-1875-01-06-PG001-SINGLE-ORIGNAME_110275_toc_8,"לא ילכו במו• ונער לא יוצלח ישולח מהמה,אך..."," לא ילכו במו. ונער לא יוצלה ישולח מהמה, אך כולם נערים ישרים הולכו בדרך ד׳. סוף דבר: מצב הת״ת טוב הוא במאד, ומי יתן וירבו הב״ב הגבוהים לשלוח את בניהם, אז יעלה ביר מנהלה להגדיל את מספר מוריה מורי שפת רוסיא, וילמדו הכל עפ״י פראגראמע נכונה, ובמשך העת יצאו משם נערים לומדי תורה ודרך ארץ. דברי הכותב ב״ר ביעלסק. — בראשית ימי החודש הזה נגמרה פה מלאכת בית הועד לעבודת הצבא והאנשים מבנ״י אשר מלאו להם עשרים שנה לימי חייהם התאספו כולם ליום המוגבל, לא נפקד אף אחד, וגם כאשר עלה הגורל על י״א איש מאחבנ״י לעבוד עבודת הצבא, לא נשמע בחוצות קול ייליל, אין קול הקריה הומה מתאניה ואניה כאשר היה בימים מקדם, וגם אלה הנלקחים לעבודת הצבא לא התעצבו אל לבם כאשר התעצבו בשנות עברו ובלב שקט קבלו עליהם החוב הקדוש הזה אשר נוטל עליהם, וראש בית הועד אמר: „כי לא פלל אשר היהודים ימלאו את חובת העבודה בחפץ נפשם ביתר שאת מהאנשים אשר לא מבנ״י המה״. המ״ע הנכבד „ספ״ב ווועדמאם"" פתח שעריו לכל אלה אשר ידברו טוב על ישראל, וגם המו״ל מ״ע ההוא בעצמו יהלל את מעשי היהודים כנראה מדבריו בנומער 345, והנני להעתיק את תוכנם לפני הקוראים הנכבדים: „תהלוכות חובת הצבא בשנה הנוכחית יתנהגו בטוב ובמשטר ישר לא נראו עתה מראות העצבות אשר הרעישו בשנים עברו את בית הועד לעבודת הצבא, לא נראו נשים מקוננות על בעליהן, וילדים — על אביהם. כי מבני עשרים שנה הנלקחים היום לעבודת הצבא מעטים מאוד בעלי אשה. ואף כי יודעים אנחנו כי רבים מסופרינו ימהרו להוציא משפטם טרם התבוננם על שורש דבר, בכל זאת לא נוכל להסתפק באמתות הדבר הזה, כי סופרים רבים ונכבדים יעידו על זה. „ואף כי רבו מאוד מספר האנשים אשר התאספו למלא את החוב הקדוש אשר נוטל עליהם, בכל זאת רבו גם האנשים אשד עקבותיהם לא נודעו, וביחוד בהערים הגדולות אשר יעלה מספרם למאות, בעיר מאסקווא 113 איש לא באו למלאות את חובתם, ובאדעסא נעדרו מאה איש ממחלקה אחת, אך בכל זאת יודיעו לנו פקודי הפאליצייא כי לא יוכרחו לבקש את הנעלמים כבשנות עברו״. עוד פעולה אחת נכבדה באה לרגלי החוק החדש, כי גם היהודים יתנהגו עתה בסדר ישר ומשטר נכון וכולם באו ליום המוגבל, לבד בעיר אדעססא רבים מהנעלמים הנם יהודים, במחוזות המערבות גם בבערדיטשוב אשר תושביה רובם יהודים ישרו דרכיהם בעיני שרי הממשלה, החכם היהודי וויינשטיין הודיע במ״ע „קיעוולאנין״ כי לפי הסטאטיסק מגלילי המחוזות יעלה מספר אלה מבנ״י אשר מלאו להם עשרים שנה לפי ערכם פעמים מבני עשרים שנה משאר תושבי רוסיא, למרות אלה אשר חשבו כי נהפך יהיה הדבר הזה אך עתה הודיע אותנו ראש בית הועד מעיר בערדיטשוב כי הנסבה לזאת היא, מאשר כי רבים מהיהודים אשר מספר שנותיהם לפי ספר הפקודים, ולפי שטרי ראיה (דאקומענטין התנגדו זה לזה, אשר נארכו במספר עשרים שנה גם את אלה אשר כבר עברו עליהם יותר ממספר הזה לימי חייהם, ומזה נדע על נכון כי היהודים מלאו את חובת עבודת הצבא ביתר שאת מאשר נחוץ להם״. „ובכל זאת גם סדרים לא טובים נאספו עתה בעקב החוק הזה  כי הנקראים לעבודת הצבא באו יחפים וערומים מבלי לבוש, תחת אשר עד הנה אנשי העדה אשר ממנה יצאו נחלו אותם במנעלים ובגדים לכל אשר היה נחוץ למו, בעיר סערגיעוו באו בני העניים הנקראים לצבא רק בכתנותיהם אשר עליהם, ובדבר הזה ראוים לתהלה היהודים אשר הם יהמלו על אנשים כאלה, בעיר פראסקראוו (מחוז פאדאליען) נתנו להנלקחים לצבא לכל בעל אשה 310 רו״כ ולאלה אשר בגפם המה 200 רו״כ לכל אחד, ומזה נראה אשר בכל מקום אשר האחדות תמצא לה מקום תשגב גם מעשי החסד והרחמים״. בואו נתחזק טובה להחכם המשכיל ה׳ אברהם קאוונער אשר גלהו מלחמת ישראל נגד המ״ע, הקול ישר לו כי „הקול"" בנומער 285 יכתוב כי מבית הועד מעיר ווילנא הודיעו כי 314 איש לא באו ליום המוגבל, והקול אשר יחפוש בעין רמיה אחרי דברים אשר אין להם שחר, כתב כי כולם יהודים המה, על זה ענהו החכם קאוונער במ״ע „ספ״ב וויעד"". כי עתה נראה בעליל כי אך כזב דבר „הקול"" כי רק 177 מהנעלמים יהודים והנשארים המה אנשי רוסיא, ופולין. יצהק מינקין"
021-HLB-1875-01-06-PG001-SINGLE-ORIGNAME_110275_toc_9,הודעות," הודעות  הודעה לסוחרי יי""ש הנני מתכבד להודיע לסוחרי יי""ש, כי הכינותי מכונה להכין פהמין ע״י כעמי, לנקות את היין העשוי משיראפ ומדגן. נסיון הורה לדעת כי ע״י הכנה טובה את הצאנען, הפחמין יעמדו על מקומם לפעול פעולתם שנה או יותר, ולא ידרשו להחליפם באחרים כאשר בראשונה. ואנכי ערב בדבר הזה, ומי אשר יחפוץ לדעת איך להעמיד את „הצאן״ על פי המעטאדע החדשה, הנני נכון לבוא לקול קורא אלי. מחיר הפהמין כל פוד 2 רו""כ 10 קא״פ אחלה פני הסוחרים הדורשים הפחמין לפנות אלי כפי הארדעסע שלי, ובלי התמהמה מלא אמלא כל משאלותם. דיסטילאטר, ברוך סוהאוואלסקי. Dietilator Baruch Schuhowolski, in Meretz. St. peter. Warsch. Eisenbahn, Station Marzinkanzy."
021-HLB-1875-01-06-PG001-SINGLE-ORIGNAME_110275_toc_10,כל מוכרי ספרים וקונים בארץ רוסיא ופולין ...," כל מוכרי ספרים וקונים בארץ רוסיא ופולין אשר יחפצו לעשות מסחר וקנין עמנו הן בספרים עברים או באשכנז ובכל לשון ידעו כי הושבנו סוכן נאמן לנו בעיר ווארשא ה׳ אברהם צוקערמאן ואליו יפנו וישיגו מבוקשם. האדרעססע אליו הוא: Abraham Zuckerman, in Warschau. Dsalnagasse No. 12 GEBRUDER WINTER.  Wien, Fraterstrasse, No. 9."
021-HLB-1875-01-06-PG001-SINGLE-ORIGNAME_110275_toc_11,"הננו לבשר כי החילונו להדפיס את
רויי
ן וה
הירושלמי סדר
1 שלן "," הננו לבשר כי החילונו להדפיס את רויי ן וה הירושלמי סדר 1 שלן  מכתב יד עתיק יומין הובא מעה״ק ירושלם עם פירוש מרבנו מו""ה שלמה סיריליאו י ונחלה בזה את פני החתומים הנכבדים אשר באו עה״ח ואת כסף החתימה לא שלחו עד כה, כי לא אחרו עוד משלוח אלינו או ליד סוכן „הלבנון בוילנא. ואלה אשר בטובם הבטיחונו לאסוף חתומים כאשר נחל להדפיס, נזכירם בזה את הבטחתם הנאמנה, למען נוכל לשקוד על מלאכת הקדש הזאת לגמרה בכי טוב בזמן קרוב. הירושלמי הנהו נדפס על פאליע גדול ונייר לבן ואותיות יפות וחדשות. ויודפס מחברות מחברות, כל מחברת שלשים באגען במחיר  ר״ט פ״ק. והבא עה״ח יתן 1 ר״ט במוקדם וינוכה לו בעד המחברת האחרונה ה׳ יגמור לטוב בעדנו  המו""ל"
021-HLB-1875-01-06-PG001-SINGLE-ORIGNAME_110275_toc_12,שמועה רעה," שמועה רעה קעלן (פרוססיא) אור ליום ג׳ כ״ח טבת תרל״ה. — בלילה הזה נכבה נר ישראל הרב דר שווארץ ע״ה רב דפה, ובמבחר ימיו (ב חמשה וארבעים שנה) עלה על לראות באור החיים, אחרי חלה עשרה ימים. אבדה גדולה אבדה העיר קולוניא כי הרב הזה היה טוב לאלקים ואנשים והרבה לעשות חסד רב בישראל והיה רצוי ומקובל לכל אדם, ושמנה עשרה שנה שמש ברבנות בעיר הזאת, ה׳ יגדור פרצות עמו ישראל ברחמים. בן לוי"
021-HLB-1875-01-06-PG001-SINGLE-ORIGNAME_110275_toc_13,"•*פג&ע *. £;11, .ג09ד 31 01(10*— 2116114..."," Pux die Redaction Veranzwortlich : Dr. Leh mana. — Buendznokerei Von J. Вri1, Mains"
