article_id,headline,text
021-HLB-1880-08-06-PG001-SINGLE-ORIGNAME_170011_toc_1,""" 2 6 1 ) 1 * 9 1 8 0 11 6 1 . 11 8 § 8 ..."," Hebraische Ausgabe deslsraelit ת שבע עשרה נומערא пinen ... ואני                         מחירו לשנה החפץ להשיג את הלבנון ע״י בוכהאנדלונג או ע״י פאסטאמט ב בארצות אשכנז, 12 מארק ידרשוהו מהם בשמו האשכנזי: 7 פלורין אוו באוסטריא HERв. AUse. DES ISRAELIT ברוסיא ופולין 50 ,5 רו״כ ברוססיא ידרשוהו, לעת עתה 1 פוגד שמלג.  בהודו וכינא בני האדרעססע הזאת: בשאר ארצות 75 ,18 פראנק. S Redaction der hebr. Ausg. ולמחצית או לרבע שנה בחצי או des „sraelit in Mainz.  ברבע ממחיר הקצוב למעלה. בפולין ידרשוהו מאת הסוכן הראשי 40 מחיר מודעות  A. J. Epstein, Nalewkistr. ת 6 No. 27 in Warschau. 20 פפעניג בעד כל שורה, ואם  מאמר אשר לא יעלה לרצון על נדפסת איזה פעמים ינוכה ראבאט. מזבח הלבנון איננו חוזר לבעליו. מכתב בלתי חפשי לא יקובל. הודעת עגונה מקובלת בחנם. HE עיניו ושארי העניי עירנו. מכתב עתי לבני ישראל  בימים היום הראשי עיר ועיר ועיניו ילידי הישיש לשלם יוצא לאור בכל שבוע  להודיע ידרין ולבשר ולהורות כל דבר הנדרש לאיש יהודי לדעת באשר הוא יהודי וחבר לחברת האדם שאת מאיר (דר.) לעהמאנו ע״י יחיאל ברי״ל יצ""ו. דָרֶךְ אֱמוּנָה בַּחַרְתִּי (תהלים ק״ט) ."
021-HLB-1880-08-06-PG001-SINGLE-ORIGNAME_170011_toc_2,6. ?0£1** 18801 פ??0 . 2 *422% ^ 6כ'מ מנ...," MAINz, den C. Vugust 1880  התר״ם No. 2 מאינץ כ״ט מנחם אב"
021-HLB-1880-08-06-PG001-SINGLE-ORIGNAME_170011_toc_3,־אמר ראשי: מורה נבוט זמן החדש. דברי היסי..., אמר ראשי: מורה נבוכי זמן החדש. ברי הימים: השקפה כללית על מקרי שבעת הימים האחרונים. דרשות שונות מתפוצות ישראל: בערלין. — בריעזען. — עמס. ווירצבורג. שווערזענץ. — וויען. — פאריז. — גענעו. —  היהודים בארז ערב. - חדשות וענינים שונים. — הודעות. ירכתי לבנון: ספור „רבי יוסף בן גרשון המכונה רבי יאזימאן מראסהיים״.
021-HLB-1880-08-06-PG001-SINGLE-ORIGNAME_170011_toc_4,"ידי
מורה וכי זמן החדש"," ידי מורה וכי זמן החדש מאת חיים ירמיהו פלעגסבערג מבאלבירישאק. ט זיופי הספ רות הכוללים (ההמשך מנו׳ 1) בצאתנו לפניכם היום קוראינו היקרים להוכיח ולהעריך לעיניכם את מלאכת הזיוף אשר הספרות החדשה שלחה בה ידיה, הלא תדמו היות יהיה כותב המאמר הזה בקי מאד במעשה ידי הסופרים החדשים קרא הרבה בספריהם עד כי נגלו לפניו אוצרות חשך ומטמוני מסתרים של מלאכת זיופם. כאשר אמנם השתבה בכזאת תפארת ישראל ראש חכמי ישורון הרמבים ז״ל כי לא הניח ספר מספרי שגעונות הבשדיים והכלדיים והצאב״ה שנעתקו בלשון ערבי אשר לא קרא בהם, מראש ספרי דברי ימיהם אשר יספרו בהם טענותיהם על אברהם אבינו שחלק עליהם, עד אחרית שארית עובדי הצאב״ה בימיו; כי אמנם כן היה נאה לאיש מורם מעם כמוהו, המופלא שבסנהדרין, להבין ולהורות למען לא ישמעו הפתאים את שמע הספרים ויפותו אחריהם כמו שכתוב בתורה השמרו לכם פן יפתה לבבכם וגו׳ כאשר הורה כל זאת המודה לצדקה בפרק כ״ט משלישי. אך לא לנו קוראינו היקרים! לא לנו לבלות ימינו לריק בקריאת כל הספרים החדשים כאלה אשר אין בהם לא תורה ולא חכמה, כי אם דברי נאצה וסכלות עשוים בצחות הלשון ומפוטמים בקטורת מרוח הזמן, למען יכנסו באף הצעירים ויעטשו ויאמרו האח כי יהל אור! - אמנם כותב המאמר הזה אך לימים רבים ולעתים החוקות נקרה לפניו ספר מן הספרים המדברים בענינים באלה, ומן המעט אשר קרא בהם לאונסו, ירק, שחק ובכה; ירק, על גודל עזות נפש הסופרים האלה לדבר עתק על אנשים צדיקים וחכמים ידועים מאד בדורותיהם עד היום! שחק, על משבתם ואי- ידיעתם בתורת ה׳ בתלמוד ובספרות היהדות הנאמנה, ועושים עצמם ביודעים! ובבה, על החרבות והשממון אשר עושים ברי השועלים הללו בכרם ה׳ צבאות בית ישראל. והנה בבואנו לדבר על הספרות לבאר זיופיה הכוללים וקצת הפרטים, ונדרש לנו להביא דברי איזה ספר מן החדשים ממבחרי סופריהם אשר שלח ידו בהדברים העומדים ברומה של היהדות, אל יחשבו לנו הקוראים לאמר נחה רוח הבקרת עלינו. כי אמנם אין דעתנו נוחה מן השבח הזה כדבר חכמינו האמתים אין אומרים בקרו כו׳ בקרו כו׳ אלא בקרו טלה; ולמודת רוחנו לא מצאנו סימני טהרה בספר ההוא אחרי תהיה תפארתנו אחרי מומיו לבקר. ומטעם זה לא הבאנו את השחוק אשר עשה לנו המחבר ההוא, כי במקום אחד בספרו חשב לעשות עצמו כשונה הלכות, ואמר לכל אין בי! — ואחרי הדברים האלה הננו בעיר ה' לבאר בפרקים הבאים לפנינו את זיופי הספרות הכוללים וקצת הפרטים. הזיופים אשר יצאו מתחת עט הסופרים החדשים בדבר היהדות, יפרדו והיו לשלשה ראשים. א) זיופים במאמרי חז״ל. ב) זיופים בשמוש הלשון והמליצה. ג) זיופים בכח המשער בחקרי קדמוניות ישראל. על שלשה פשעי הספרות האלה כל עין ראתה תעידם, כי אך לב הותל הטה סופריה לעשות זר מעשיהם לחקוק בספר חקקי אבן באיבתם השמורה בלבם להיהדות הנאמנה. א) הסופרים מביאים ראיות של דופי לדעותיהם ולשיטתם, מן התלמוד והמדרשים, אשר אם היה שמץ דבר אמת בראיות אלה, היו חז״ל חכמי התורה הכתובה והמסורה אשר הגו בה יומם ולילה והקריבו נפשם על מזבח קדושתה, עם תועי לבב וכופרים בעיקר כמוהם! אשר נביא קצת ראיותיהם בפרקים הבאים. — ידענו קורא יקר כי נעוית משמוע בדברים האלה על חז״ל אשר אין להם שחר, ובנפש נבהלה תשאלנו: הסופרים החדשים שפקחים הם מה ראו לשטות כזה? גם אנחנו נשיבך: אל תתמה על החפץ, כי לא חדש הוא, כבר הסכן הסכננו לשמוע דברי תוכחה ונאצה כאלה לפני שנות מאות, מפי צוררי אמונתנו הקדושה אשר ממעי ישראל יצאו וחצו את האיש החי הזה בחרבות עטם המהיר. זכרו את כבוד האיש הזה ואת גדלו רק מחציו ולמטה, ומחציו ולמעלה בקדש הסתירו פניהם וכבשום בקרקע, ובכן עמדה להם מלאכת זיופם לקרוא לעצמם בשם תלמידי הרמב״ם. אולם הלא תדעו עושי מלאכת הספרות רמיה! האיש החי רב פעלים הזה הרמב״ם ז״ל אם יחלק אין שמו עליו. המשפט הזה ילמדנו הה התלמודי בגדר כל חי״), אף כי על מבחר יצורי החיים האדם הגדול בענקים הרמב״ם ז״ל. — אמנם כן! מאור עינינו הרמב״ם ז״ל היה מגורה של זהב ונר של חרס על גבה, על כן מלא לב יוצרי חרם בהם לאמר תלמידי הרמב״ם אנחנו נר אחד לכולנו ולאורו נסע ונלך! הנה הראיתיך קורא יקר מה שהסופרים עושים על שם הרמב״ם, עולם אנשי וממנו תוכל לשפוט על מה שהם עושים על שם שאר צדי מופת אשר היו למאורות בעמנו כמו רב סעריה גאון וראב״ע והראב״ד והרמב״ן ודומיהם. (ההמשך יבא) והמירו כבודם. בקראם אל זקני עמנו להתוכח עמם בדבר אמונתנו לפני מלכים ומושלי הארץ, והביאו להם ראיות ורמזים מן התלמוד ומדרשים כי חז״ל היו מאמינים באמונה השלטת למען יכריחו מלכי הארץ את היהודים לקבל אמונתם ע״פ מצות חז״ל!! ובהיות שהרבנים התלמודים אשר נקראו ע״פ פקודת מושלי הארץ להתוכח עמהם ידעו לבאר היטב לפני השומעים את דרכי ההטעה והזיופים עד אשר גם המלכים והשרים אשר לא ידעו דרכי התלמוד נוכחו לדעת את זיוף דברי בעלי בריתם החדשים ותרמית לבבם, ע״כ הוכו משנאינו אחור ושבו בבשת פנים (ועתה בחסדי ה׳ וביושר לבב מלכינו ושרינו יר״ה כבר מימים רבים חדלו הויכוחים ללא אמונה אלה להיות להם מהלכים בחצרותיהם, ולא נוסיף לדאבה עוד בויכוחים כאלה אשר הנפש היפה תבהל בהם) — המלאכה הזאת מצאה לה עתה נתיבות בחצרות הספרות העברית החדשה, ואם אמנם מי יצו עלינו עתה במפגיע חלילה להשפט עמהם? ונהפוך הוא, כי כל הממלכות עיון רעה בהכופרים אשר מהם יצאו המרגיזים מלכים וארצות. אולם בהטיבנו לראות לא נוכל לחשות מזה, כי עתה בכחה חלילה לפרוע פרעות יותר מאז, יען עתה תאחז דרכה בין רבבות אלפי קוראים אשר אינם יודעים ומכירים את מלאכת הזיוף, אלה, מבלי משים לב אל הזיופים בקראם בהם רק לשעשועים בעת אשר יבקשו לתת מנוחה לנפשם, ואז כאשר יבאו דברי הזיופים בלבם כן יקנו מקומם כמת מצוה מבלי יבקשו ממנו הבא ראיה הבא עדים; ואלה, מבלי דעת התלמוד. יש אשר גם קרוא בו עלה אחת לא ידעו, ויש אשר גם הגיעו לקרוא בו שתים ושלש מסכתות בבית רבם, יפרשו והפליגו בים התבל, האם נוכל לבקש מהם שידעו המאמרים המפוזרים בתלמוד והמדרשים אשר המזייפים הביאו לפניהם קצוצי פאה, בלי ראש ובלי סוף ומזויף מתוכו, וע״כ דעת הספרות המזויפת רבה עליהם. הנה הודענו לכם קוראינו היקרים את מלאכת הזיוף אשר אחזו בה צוררי דתנו הקדושה מלפנים ואחרי בלותה מימים רבים נפקדה כי מצאו בה חפץ סופרי דורנו ושבו ויסדוה בספרות החדשה; ומה מאד נחוץ הדבר לכל קורא בספרי הספרות החדשה שישמור הדברים האלה בלבו וישמח בהם כעל כל הון, ובבואו אל המקום אשר הסופרים החדשים עושים כונים להכפירה מלקטים מאמרים מחז""ל ומדברי חכמינו החוקרים הצדיקים הראשונים והאחרונים, ועליהם תטוף מלתם במתלהלה ויורה חצים, ישים הדברים האלה לנגד עיניו וידע להזהר. והנה נביא בזה דמיון אחד מן הזיופים הכוללים, כי בפרק זה נדבר רק מן הכוללים, ומן הפרטים יעדנו לדבר בעזר ה׳ בפרקים הבאים. העושים במלאכתה יאמרו: תלמידי הרמב״ם אנחנו מימיו אנחנו שותים ושמו אנו מזכירים״ — אמנם כן, הדברים האלה כליל תפארת המה לתלמידיו הנאמנים אשר לא יגרעו מצדיק עיניהם, ומתדמים אליו ללכת בדרכיו, ברוח נאמנה יכולים להשתבח בתהלתו מבלי יוכרחו לזייף ולהבליע בשתיקה או בחניקה ואת הדברים העקריים הראוים להוסיף בזה לכל אשר בשם תלמיד הרמב״ם כונה, והם: ואת תורת הרמב״ם אשר עמל בה כל ימי חייו אנו לומדים ואת ספר מצותיו אנו שומרים, ובדרכיו בקודש ודקדוקי סופריו אנו אוחזים""; אמנם הסופרים החדשים הבקיאים במלאכת הזיוף שכלו את ידיהם, גם המה יודעים כמונו כי זה האיש משה כליל תפארת ישראל העומד לנס עמים, היה „איש אלקי"" [וכמליצתם ז""ל במדרש״ט) מחציו ולמטה איש, שואל ומשיב חוקר ודורש עד מקום שיד השכל האנושי מגעת, ולבו ראה חכמה הרבה, ומחציו ולמעלה היה אלקי, איש אמונה צדיק וישר מסר נפשו על קדושת התלמוד, והלך בדרכי החסידים ואנשי מעשה התלמודיים, בקול עז הרעים על פריצי הדור הנותנים כסף סוררת לדברי חז״ל בעלי הקבלה הנאמנה, הוא נזר אומר ויקם לו להרחיק את הקראים מעל ישראל למען לא ינוח שבט הרשע על גורל הצדיקים ולא ילמדו מדרכיהם וימשכו אחרי דעותיהם היורדות שחת, ומי יוכל בתנות את כל צדקת הרמב״ם ז״ל וחסדיו הנאמנים אשר עשה לתורת חכמינו אל המקבלים הנאמנים, אשר קבלו פרושי התורה על פה, על פי ה׳ ביד משה. ואך למותר הוא להגיד ולספר דבריו ביעקב כי כולם יודעים אותו מגדולם עד קטנם, ואחרי כל אלה יאמרו סופרי הדור החדש „תלמידי הרמב״ם אנחנו״!? ובל יתפשו לבדאים בעיני כל איש ישראל אשר כולם יודעים את קדושת הרמב״ם תורתו וצדקתו, השכילו לזייף את מאמרם,"
