article_id,headline,text
021-HLB-1882-09-21-PG001-SINGLE-ORIGNAME_190273_toc_1,"111) 3, II 0 II ^^^ ^ ^ ^ ^ ^ ^ ^ ^ ^ 36..."," AID An O E VORMALIGE Hebraische Ausgabe des „Heraelit H THE שנת תשע עשרה נומער לה החפץ להשיג את הלבנון מחירו לשנה ע״י בוכהאנדלונג או ע""י פאסטאמט בארצות אשכנז, 12 מארק ורשוהו מהם בשמו האשכנזי: באוסטריא 7 פלורין א""וו ввв. AUSс. DE8 ISRAELIг. ברוסיא ופולין 50 ,5 רו״כ מרוססיא ידרשוהו מאתנו על פי ב בהודו וכינא 1 פונד שטלג. האדרעססע הזאת:  בשאר ארצות 75 ,18 פראנק. St J. Bril in Mainz. Deutschland ולמחצית או לרבע שנה בחצי או בפולין מאת: ברבע ממחיר הקצוב למעלה. Ch. Czernowicz, Dzika No. 8, ע ה מחיר מודעות in Warschau. ר ם מאמר אשר לא יעלה לרצון על  20 פפעניג בעד כל שורה, ואם מזבח הלבנון איננו חוזר לבעליו. נדפסת איזה פעמים ינוכה ראבאט.ב מכתב בלתי חפשי לא יקובל. הודעת עגונה מקובלת בחנם.  ראובן העיר ועיר ועיר ועיני ישראליטעראטור מכתב עתי לבני ישראל-  היה ירים האיש ואיש ואיש לאלו רושם ביום ליססעב יוצא לאור בכל שבוע להודיע ולבשר ולהורות כל דבר הנדרש לאיש יהודי לדעת באשר הוא יהודי וחבר לחברת האדם מאת יחיאל ברי״ל יצ""ו. דרךְ אֱמוּנָה בַּחַרְתִּי (תהלים קי""טא"
021-HLB-1882-09-21-PG001-SINGLE-ORIGNAME_190273_toc_2,I 1882 ז^ 11411 }4 $60 2 21. ^*^ ן 1 V ]...," No. 35 מאינץ ח׳ תשרי  התרמ״ג MAINz, den 21. Septenber 1882"
021-HLB-1882-09-21-PG001-SINGLE-ORIGNAME_190273_toc_3,תוכןהעגינים: דברי הימים : כלתה המלחמה במ..., תוכן הענינים: דברי הימים: כלתה המלחמה במצרים. מכתבי סופרים: קארקאוו קיטב. חדשות שונות מתפוצות ישראל: הקאנגרעס מבני בלי שם. הודעות. ירכתי לבנון: מכתבים משי״ר אל רשד״ל.
021-HLB-1882-09-21-PG001-SINGLE-ORIGNAME_190273_toc_4,"ררי הימים
דבר"," ררי הימים דבר טאניה כי תחסר לו עצה ותחבולה למלחמה. וכלם ענו ואמרו: האמנם לא מצאה ה' אראבי ביי לגרש את הבריטאנים מגאסיססין, ואולם אומץ לבו ותחבולותיו אשר הראה במלחמת היום ההוא יערבו ערובה בעדו כי בקרוב הבריטאנים להתגר בו מלחמה אצל טעל אל קאביר הבצורה כמו פלעוונא תהיה ידו בעורף אויביו, וימים רבים יצורו הבריטאנים על טעל אל קאביר עד אשר ילכדוה, וגם בלכדם את „גבעת העת"" (שיקזאָלסהיגעל), את טעל אל- קאביר לא תכלה המלחמה. עוד יתיצבו המצרים בפני הבריטאנים בעיר צאגאציג, שם יעצרו המצרים את הבריטאנים בתתם למי הגילוס לשטוף את כל חבל הארץ אשר בין צאגאציג עד קאירא. והחיל הגדול אשר אסף אראבי בכפר עד דאואר, דאמיאט אבוקיר, ראשיד ועוד בשארי מקומות הקרובים אל ים התיכון לא במהרה ינצחום הבריטאנים, אשר מספר אנשי מלחמתם לא רב הוא, — ככה חשבו כל יודעי דבר מלחמה. אבל הנצחון הגדול אשר עמד לימין הבריטאנים בשלשה עשר לחדש הזה, שם לאל את כל החשבונות, ובמשך עשרים מנוטים נלכדה כל ארץ מצרים לפני הבריטאנים, והיד החזקה של אדאבי נשברה שבר לא יוכל להרפא, וגם אראבי ביי ושאר ראשי הקושרים לקחו הבריטאנים בשבי. בליל שלפני יום השלשה עשר לחדש הזה, כחצות הלילה עזבו אנשי חיל בריטאניה את רבצם בגאסיסין, והפקודה נתנה מאת המפקד את צבא המלחמה כי בכל הדרך מנאסיסין עד טעל אל קאביר (ערך שש פרסאות בריטאניות) לא ידברו אנשי החיל איש אל רעהו, וגם יזהרו כי כלי נשקם לא ישמיעו קולם בלכתם, וכה הלכו לאטם חרש עד אור היום. והמצרים נחו בשלום על משכבותם וגם בחלומם לא ראו את הבריטאנים הקרובים אליהם. ואך אז כאשר קרבו הבריטאנים לפני טעל אל קאביר במרחק שלש מאות מעטטער, הרגישו המצרים את ריח הבריטאנים, והחלו לירות עליהם בחפזון ובבהלה ולא קלעו אל המטרה. והבריטאנים הסתערו על הסוללות בחרבות ורמחים משלש עברים, ובמשך עשרים רגעים לבדו את כל הסוללות והרגו מהמצרים כאלפים איש, וכשלשת אלפים  איש תפשו הבריטאנים, והנשארים השליכו כלי נשקם מידם ונמלטו על „כלתה המלחמה במצרים; אל תוסיפו עוד שלוח אנשי צבא!"" הדברים האלה הודיע המפקד את צבא בריטאניה הגענעראל ויאלזעליי בחמשה עשר לחדש הזה בעת עמדו רגליו בשערי קאירא קרית מצרים, אל היועץ המפקד על עניני המלחמה בלונדון. כן הוא, המלחמה במצרים כלתה עוד לפני העת שראתה אותה ממשלת בריטאניה. והגענעראל וואלזעליי טעה בחשבונו רק במספר תשעה ימים. ביום 20 לחדש העבר בעת עלו הבריטאנים היבשה באיסמאיעל הודיע המפקד את צבא בריטאניה ללאנדאן כי בעוד שמנה עשר יום יוליך את אנשי חילו קוממיות דרך שערי קאירא. ותקותו זאת באה ונהיתה אך אחרי שבעה ועשרים יום. ואולם באמת לא במלחמה אשר האריכה שבעה ועשרים יום נצחו הבריטאנים את המצרים, כי אם במשך עשרים מנוטים, בשליש שעה אחת, פזרו הבריטאנים את חיל אדאבי ביי לכל רוח והכוס מכה נצחת. בתשעה לחדש הזה כבוא השמועה אשר אראבי ביי הרהיב בנפשו עוז לצאת בחיל כבד מטעל אל קאביר לקראת הבריטאנים אשר חנו אז בגאסיססין ויתגר בם מלחמה, אף כי במלחמה הזאת היתה יד הבריטאנים על העליונה (כפי הודעותיהם), ובכח חמשת אלפים איש הדפו הבריטאנים את אדאבי ביי אשר התנפל עליהם במספר עשרים אלף איש חיל ושנים עשר קאנאנים עמו — בכל זאת שמחו אויבי בריטאניה כמו התעצבו אוהביה על השמועה הזאת. כי מקרי המלחמה ביום ההוא ענו בהמפקד את צבא ברי- נפשם וחיל הרוכבים מהבריטאנים רדפו אחריהם והרגו את כל אלה אשר לא מהרו לברוח. בעצם היום הזה באו הבריטאנים לצאגאציג, ולמחרתו בא החלוץ ממחנה הבריטאנים בעגלות הקטור לקאירא. ושם השיגו את אראבי ביי ומשנהו טולבא באשא אשר נסתרו באחד הבתים אשר לפני העיר. והמה בראותם כי הקיפו הבריטאנים את הבית יצאו הפתחה והתמסרו בידם. וכבוא הבריטאנים בשערי קאירא יצאו יושבי העיר לקראתם ויקבלם בפני רצון, ואחרי אראבי ביי השליכו אבנים ויקראו אחריו „עוכר עמו וארצו!"" ויהי כבוא השמועה מנצחון הבריטאנים אל המחנה אשר בכפר עד דאואר מהרו שרי הצבא לשלוח מלאכי שלום אל הקהעדיווע אשר באלכ- סנדריה, ויחלו את פניו כי יסלח לעונם, והוא נעתר להם וישלח אליהם את אחד משרי צבא בריטאניה והתמסרו כלם בידו ויתנו אליו את כלי נשקם, והוא לא רצה לקחת אותם מידם, באמרו כי ביום השבת הבא יעבירו שרי צבא הבריטאנים, את כל אנשי חיל המצרים על פני חיל בריטאניה בעמדם בשורה, ואחרי עברם את השורה יקחו מידם את כלי נשקם ויפשיטו מעליהם את בגדי אנשי מלחמה וישלחום הביתה, ואת הבזיון הזה רצו הבריטאנים לחלק לאנשי חיל אדאבי למען יכנעו לעולם ולא יוסיפו להרים ראש. ואולם המצרים לא הוחילו עד אשר ינחילום הבריטאנים בושת וכלמה, ויהי בליל ח״י לחדש הזה, קמו המצרים בכפר עד דאואר, וילכו כל איש מהם לביתו וכבוא הבריטאנים מאלכסנדריה למחרתו לא מצאו בכפר עד דאואר, זולתי כלי הנשק ושומריהם. כפי ההודעות הטעלעגראפיות הבאות מארץ מצרים הודיעו שרי הצבא אשר בראשיר ואבוקיר להקהעדיווע כי הנם נכונים להתמסר בידו ולאיוסיפו להלחם. ואין כל ספק אשר בעוד ימים שנים שלשה לא ישארו שני אנשים יחד מחיל אדאבי, כי נפל פחד הבריטאנים על כל המצרים כמו מן השמים לחמו להם. בקאנסטאנטינאפול מתהללים יועצי השולטאן כי ההודעה אשר הודיעה ממשלת השולטאן במכתב גלוי כי אדאבי ביי הוא מורד במלכות, היאהסבה נצחון הבריטאנים. כי מאז שמעו המצרים כי אראבי ביי לוחם עם הברי- טאנים שלא ברצון השולטאן רפתה רוחם ורבים מאנשי חילו עזבוהו. אבל באמת רק תחבולת הבריטאנים ואומץ לבם עשו כל אלה. ולמען הוכיח להשולטאן כי לא ברוח פיו הפיץ את חיל אדאבי ביי, לא יאבו הבריטאנים לענוש את אראבי ביי כמשפט מורד במלכות, וינהגו בו כבוד כמו שחולקים כבוד לשר צבא בנפלו בשבי ביד המנצח. מכ״ע „סטאנדארד"" הלונדוני שנה עתה את טעמו ויאמר: אראבי ביי הוא איש תם וישר ואוהב ארץ מולדתו, ועד היום לא נמצאו עדים וראיה כי ידו היתה בהשרפה והבזה שהיתה באלכ סנדריה, ועל כן מחויבים אנחנו לנהוג בו כבוד כראוי לשר צבא שבוי. האמנם אנו שומעים כי נקרא בשם מורד במלכות. אבל באין כל ספק לא יכבד ממנו להוכיח כי כל מה שעשה בעת הראשונה היתה בעצת השולטאן וברצון הקהעדיווע. ואחרי כי אראבי ביי נפל שבי ביד הבריטאנים ולא ביד הקוראים אותו בשם „מורד״, הנה חובת ממשלת בריטאניה לכבדהו כמו תכבד שו צבא אחר בנפלו ביד חיל בריטאניה במלחמה. עתה כאשר נחו הבריטאנים מאויביהם המצרים החלו הדיפלומאטים, ר״ל אלה הרואים בעבי הדיפלומאטיה, לשאת ולתת אדות המחשבה אשר תחשוב ממשלת בריטאניה על מצרים. מכ״ע האשכנזים והאוסטרים יאמרו כי אלה האומרים אשר עתה באה העת „לעשות"" לשאר הממשלות האדירות, עתה באה העת לדבר על אדות מה שנחוץ לעשות בארץ מצרים למען תהיה אוראפא בטוחה כי לא תקום פעמים מרידה בארץ הזאת, — אלה האומרים כן יצדקו מאד. אבל אלה האומרים כי למהר או למחרת השני יתאספו צירי הממשלות האדירות לעסוק בשאלת מצרים, שוגים ברואה. כי לעת עתה אין דבר אשר בעבורו יקראו הממשלות האדירות אספת קאנפערענץ או קאנ- גרעס. רבים חושבים כי כמו אז אחרי תום המלחמה בין הרוסים ובין הטורקים לא אחרו הדיפלומאטים להתאסף יחד, כן עתה לא יחמיצו את הדבר שבא לידם. אבל החושבים כן אינם אלא טועים. אז עשתה ממשלת רוסיא מעשה אשר בעבורו הוכרחו הממשלות האדירות למהר אספתן. אז כרתה ממשלת רוסיא ברית שלום עם ממשלת השולטאן. ושנתה את גבולות מממלכת טירקיא והקימה ממשלות חדשות בחצי האי באלקאן. המעשה הזה אשר נעשה בלי שאלת פה אוראפא, הבריח את אוראפא לצאת מגדרה ולקרוא את ממשלת רוסיא אל אספת הקאנגרעס לבחון את הברית מסאן סטעפאנו. לא כן הוא הדבר עתה אחרי מלחמת הבריטאנים עם המצרים. ממשלת בריטאניה הגידה לפני המלחמה כי היא שולחת צבאותיה מצרימה להבניע שם את המורדים ולהשיב את סדרי הממשלה לקדמותם. והנה את המורדים הבניעה, ועתה תראה אוראפא איך תשיב את סדרי הממשלה במצרים על מקומם עיניהם אל השולטאן, ותחת אשר מקאנסטאנטינאפול קצרה יד השולטאן לעזור בסתר את המוסלימאנים באפריקא להשליך מעליהם את עול צרפת, הנה אם עמדו אנשי חילו במצרים הנקל היה להשולטאן לעורר רוח מרד בין יושבי אלגיר ותונים. ואולם עתה אשר הבריטאנים לבדם הכניעו את המתקוממים במצרים, הראו לדעת כי אין להשולטאן כל שליטה באפריקא, וכמו כן נוכחו כל המוסלימאנים באפריקא לדעת כי כל הנוגע לרעה בהאו- ראפים לא ינקה. והיה בעת יהם לבבם להתקומם נגד ממשלת צרפת, עד מהרה ישובו מדעתם, כי המכה אשר הוכו המצרים לא במהרה תשכח. בשלום. וכל עוד אשר אוראפא לא תראה כי ממשלת בריטאניה שנתה דבר בארץ מצרים תוכל לעמוד מרחוק ולחשות. לע״ע מסר המפקד את צבא בריטאניה במצרים את הממשלה ביד הקהעדיווע אשר שב לקאירא קרית ממשלתו, ושרי עצתו הם כמעט כל אלה אשר עמדו לפני הקהעדיווע לפני המלחמה. גם הנשך מהחובות אשר ממשלת מצרים חייבת באוראפא משתלם בעתו, והמפקחים על ההוצאה וההכנסה עומדים על משמרתם כבראשונה. ועתה כי כן אין כל תואנה להממשלות האדירות להתערב בשאלת מצרים. ואך אז כאשר תחפץ ממשלת בריטאניה לשנות דבר בהסדרים הקימים הנז' או באחרים, אך אז תאמר אוראפא כי בלעדה לא ישונה דבר בארץ מצרים. ואולם אין כל ספק כי בבוא העת לשנות, תודיע ממשלת בריטאניה בעצמה לשאר הממשלות האדירות, כי דבר זה או זה נחוץ לשנות ותשאל את פיהן ותתיעץ עמהן. מובן מאליו כי מתי תבוא העת הזאת לא ידע איש זולתי ממשלת בריטאניה לבדה. ובאשר הממשלות האדירות בוטחות בממשלת בריטאניה כי תשמור מוצא שפתיה, ולא יעלה על לבבה להשאיר צבאותיה ימים רבים בארץ מצרים ואף כי לספח את ארץ מצרים לממלכת בריטאניה. אין כל הכרח להן לדחוק את השעה ולשאול את ממשלת בריטאניה כי תודיע אותן את אשר עם לבבה לשנות בארץ מצרים. אלה המה הדברים אשר מכ״ע האשכנזים והאוסטרים ידברו עתה בשערים. אם באמת מאמינים בדבריהם היוצאים מפיהם, או רק בפיהם הנם בוטחים ולבבם מלא דאגה ופחד פן תציב לה בריטאניה יד בארץ מצרים ככל אשר עשתה צרפת בתונים, לא נוכל אנחנו לדעת. ואולם מכ״ע אשר רוח דעת הקהל בצרפת דובר בם המה לא לבד שלא תרע עינם בנצחון בריטאניה, הנם עוד שמחים בו כמו היו הצרפתים המנצחים. הנם אומרים כי בדבר אשר הכניעו הבריטאנים את המצרים יפחדו הערביים באלגיר ותוניס להרים ראש נגד הצרפתים. מכ״ע הצרפתים יהללו שבע את ציר בריטאניה בקאנסטאנטינאפול אשר חכמתו ובינתו עמדה לו להמשיך את גמר כריתת הברית בין ממשלת בריטאניה ובין ממשלת השולטאן בדבר שליחת אנשי חיל טירקיא למצרים עד אשר נצחו הבריטאנים את המצרים. כי עתה כאשר הכניעו הבריטאנים לבדם את אראבי ביי, אין כל תועלת עוד בשליחות צבא השולטאן מצרימה. ועל הדבר הזה תשמח צרפת עוד יותר מבריטאניה, כי אם שלח השולטאן אנשי חילו מצרימה הוסיפו המוסלימאנים באפריקא לשאת"
