article_id,headline,text
021-HLB-1875-10-13-PG001-SINGLE-ORIGNAME_120103_toc_1,"1^019180118 ^118^1)6 (168 181^611(;"""" שג...","  Hcbraische Ausgabe des „sraelitr.  No. 10 נומער י שנת שתים עשרה  בשאר ארצות: 18  איש יכונ  ויטם  גם למחצו  מיליי    לגרם""  ארג  בא אליו אל  על ימינם 4 ר""ט פ״ק א  ובני ימי ר ש .  מאילי (ב  כל שול Herrn :לי   ילות): 2 זילבל Leib Levinsohn in ודעה לתקנ מאה ל Wilna שם ומי הוא נגני Balschola Clitza, D.  האנשים בואו אלי ולא יוני (108 - ח רו״כ 50 קא״כ. מכתב עתי בשפת עבר יוצא לאור בכל שבוע להודיע ולבשר ולהורות כל דבר הנדרש לאיש יהודי לדעת באשר הוא יהודי וחבר לחברת האדם מאת מאיר (דר׳) לעהמאנז ע""י יחיאל ברי""ל יצ""ו דרך אמונה בַחַדְתִּי (תהלים ק״ט.)"
021-HLB-1875-10-13-PG001-SINGLE-ORIGNAME_120103_toc_2,"£875 •2, (160 13 00101)61א^1 מאיגץ,ערבסמ..."," HAINZ, den 13 October  התרלז מאינץ, ערב סכות 1875"
021-HLB-1875-10-13-PG001-SINGLE-ORIGNAME_120103_toc_3,מאמר?ראשי: על דבל ישוב א/ ן דברי הימים: ..., מאמר ראשי על דבר ישוב א״י. דברי הימים: אוסטריא. טירקיא. מכתבי סופרים: קאוונא. טעלז. קארלין. יאססי. חדשות שונות בתפוצות ישראל: מאינן. אמסטרדם. לאנדאן. בגדד. פאריז. מכי״ח. חדשות שונות.— הודעות. ירכתי לבנון: ספור „בית עבר״. — ממשלת בריטאניה ומסחר העבדים.
021-HLB-1875-10-13-PG001-SINGLE-ORIGNAME_120103_toc_4,"על דבר ישוב א""י"," על דבר ישוב א""י מפינו דברים אחדים בפתרון השאלה הנכבדה הזאת. ולא מפני כי לא ידענו להוקיר חפצכם קוראים יקרים עצרנו במלים עד כה, עד אשר קשתה עלינו יד דעת הקהל, לאמר: עת לדבר בישוב א״י! עד ששמענו מאחרינו אומרים לאמר: ראו כי המו״ל את הלבנון דרך עקש דרכם, או כי יאמרו בפה מלא „מר"" לכל אשר יאמרו שאר מו״ל מכ״ע „מתוק"", או כי ירצו לשום לאל הדבר אשר אחרים ידברו בו כל היום, בשימם יד לפה ולא יזכירו ולא ידברו בשם הדבר ההוא. — לא מפני כל אלה אחרנו עד בוש. קוראי הלבנון משנים שעברו המה יעידו ויגידו ויאמרו אמת כי שאלת ישוב א""י יקרה היא בעינינו מאד. פתחו נא שערי הלבנון מאז החל לצאת לאור. והיה הדבר אשר בו תראו לראשונה הוא המגדל אשר בנינו בתוכו אשר ממנו יראה הרואה את כל הנעשה ואת כל אשר אפשר לעשות באה״ק בכלל ובעה״ק ירושלם בפרט. וגם בפעם הזאת לא היינו ישנים בין הערים והבאנו לפניכם חות דעת סופרינו הנכבדים בענין הנכבד הזה. ואנחנו, אמרנו לחכות בדברים ע""י ישוב לשלום השר הצדיק סיר משה מונטיפיורי ממסעו לארץ הקדושה, אמרנו לעצור במילין עדי יראה השר הצדיק בעיניו ובלבבו יבין: הבצעקתה הבאה על אנשי קדש אשר בירושלם עה״ק, עשו, כלה; אם כה ירדו פלאים בני ציון היקרים כאשר יספרו מוציאי דבתם רעה; אמרנו נשמעה ראשונה מטוב ירושלם אשר יספר לנו סיר משה מושיע ישראל, ואחר נדבר דברינו גם אנחנו. כי ידענו מאד את מחשבות רובי אחינו. הן זה דרכם כאשר יקראו באחד ממכ״ע  דבר אשר מדובר בו בפאריז או בלאנדאן, יאמינו בנפשם כי המדברים שם הם כלם קרובים למלכות, והחולק על דבריהם כחולק על האמת המוסכמת באין כל ספק, כמו האנשים האלה יצאה עליהם בת קול  מן השמים כי אינם ככל האדם כוזב, כי אינם עלולים לשגיאה — בדעתנו מראש כי רוח שקר היתה עתה בפי הדוברים בענין ישוב א״י, ואם אנחנו נדבר רק אמת בשם ה׳ והיינו בעיני המון השומעים כמתעתעים או כמתעים. על כן אמרנו ישמעו אחינו לראשונה את אשר ידבר משה עבד  עם ה׳ אשר בכל בית ישראל נאמן הוא, ואז אולי גם דברינו יהיו נשמעים. לא נכחד מאתנו כי אלה אשר לא יאמנו לא יאמינו גם במשה עבר עם ה׳. הן עוד בטרם ערך סיר משה את הראפארט שלו לפני הועד בלאנדאן, הודיעו מגידי בעלטה — בדעתם כי נכוחות יחזה ומהתלות לא ישמיע - הנושכים בשניהם ובפיהם יקראו שלום ואמת, לאמר: „במשך היותו (השר שי׳) בירושלם ת""ו לא היה מצב בריאותו „עצהיו״ט, ורק ארבע פעמים היה ביכלתו בכל הזמן ההוא לעזוב „את בית מעונו וללכת לראות שלום אחיו.... נביאו הלוי  נ״י בקר את כל בתי הצדקה וישם עינו על כל בתו עוד לא התנערו מאבק רגלינו, עודנה עיפה נפשנו מהמלחמה הכבדה אשר קראנו על אתרוני קורפו ועל עקשות לב אשר בה חסו סוחריהם, בטרם נשתעשע בזר פרחים אשר נצחון המלחמה הזאת שם על ראש הלבנון*) — בעוד הננו שומעים מאחרינו קול יללת יוני קורפו וצוחת סוחרי האתרונים תצלל באזנינו — הננו יוצאים למלחמה חדשה, מלחמה לה׳ גם היא, מלחמת האמת עם שקר, עם חנופה, עם רבה רעה, עם החפצים להשכיח את תורת ה׳; על כל אלה הננו יוצאים עתה למלחמה! ואם תשאלו קוראים יקרים: מה כחכם ומה גבורתכם כי תתחרו את מלומדי מלחמה, את אלה אשר כבשו כמעט את כל העולם כלו תחתיהם ורבים עוזריהם מרצונם או שלא מרצונם מדעת או שלא מדעת; על מה תשענו כי תנצחו את גבורי כח אלה? — אל נא תדאגו לנו אחים אהובים! ידענו גם אנחנו כי אנשי ריבנו יצאו לקראתנו אלה בנבליהם ותחבולותיהם, ואלה בהבליהם והזיותיהם, אלה בנאוה וגודל לבב. ואלה בכחש ומרמה — ואנחנו, אך בשם ה׳ נתעודד ובשם אהבת ציון וירושלם נדגול; בך ה׳ השוכן בציון והבוחר בירושלם, בך בטח לבנו כי לא תתן למוט רגלינו גם הפעם; קושטא קאי שקרא לא קאי! עוד לא הגרנו לכם קוראים אהובים. על מה נצא לקרב היום, עוד לא הודענוכם אם הדבר אשר בעבורו נחרף היום את נפשנו, אם שוה אף לדבר בו. לכן שמנו חתו בראש מאמרנו „על דבר ישוב א״י'. הוא הדבר אשר רבים ידברו בו היום. וידענו כי כבר אזנים כריתם לכם לשמוע גם *) גם בערים הגדולות באשכנז: האמבורג ברלין, פפר״מ. מאינן, כו׳ כו׳ כשמוע לאחינו היראים את תוצאות החקירה והדרישה על אחרוני קורפו משכו את ידם מגעת בהם. וברו""פ, גם בהערים אשר הרבנים שם לא נמנו לדבר מצוה אשר נמני עליה רוב בנין ורוב מנין מגאוני דורנו (מטעם הכמוס עמהם, ונודע לכל -) גם שם נזהרים יראי ה׳ באמת מקנות אחרוני קורפי, אף כי בשנה הזאת שהיתה שנת שרב לא גדלו האחרונים בשאר המקומות בהדורם ויפים, „הצדקה וישם עינו על כל תהלוכות אחב״י ויכתוב בספר מיוחד אשר „יוצע לפני הועד בלאנדאן. על כל הכתוב בספר בידיהלוי הנ״ל חתמו עצמם לעדים נאמנים הר״י ריבלין מזכיר כולל הפרושים ועוד שני רבנים מהפרושים. רבני הספרדים לא חתמו על „הדברים ההם״. *) בלי ספק תבין כמונו קורא מבין עד היכן הדברים האלה מגיעים, כמונו משרים תשפוט כי המגיד שקרים ומפיח כזבים. השונא תכלית שנאה את בני ציון היקרים כשנאת כל ע״ה לת״ח - שלח הדברים האלה כמכה קודם לרפואה. שונאי ציון יודעים גם המה כי השר הצדיק צדקות אהב, וצדקת בני ציון יתנה, ותהלות היושבים על אדמת הקדש ידבר פיו על כן קדמו להעביר את השמועה כי השר הצדיק במשך ד׳ שבועות שישב בתוככי ירושלם אך „ארבעפעמים היה ביכלתו בכל הזמן ההוא לעזוב את בית מעונו וללכת לראות את שלום אחיו. ומי הוא אשר בקר את כל בתי הצדקה ושם עינו עליהם ועל כל תהלוכות אחב״י שם? לא השר הצדיק בעצמו ובכבודו, כי אם „נביאוהלוי״. הוא ראה את כל „ויכתוב בספר מיוחד אשר יוצע לפני הועד בלונדון"". ומי המה המעידים על דברי הנביא הלוי? לא השר בעצמו ובכבודו, ורק „הר״י ריבלין מזכיר כולל הפרושים ועוד שני רבנים מהפרושים"" אלה המה העדים אשר הנביא הלוי מצאם נאמנים לפניו. ואף כי לא נדע מי הוא הר״י ריבלין והשנים מהרבנים אשר חתמו אתו, נכירם משם „פרושים״, הנקרא עליהם. לא כן רבני הספרדים, אנשי אמת נקיי כפים ברי לבב (1! 1) המה לא שתו את ידם את עדי חמס עדי שקר 111) הנז' — האין זאת הכונה אשר שונאי ציון הבליעוה בחלקת לשונם? אבל מביני דבר יבינוה לאשורה. המה כמונו נכחות יחזו כי בהדברים האלה יחפצו החפצים להשכיח תורת ה׳ גם מציון ודבר ה׳ גם מירושלם, לשום לאל את הראפארט אשר השר הצדיק יציע לפני הועד בלונדון. אי לזאת ההכרח לא יגונה אם בטרם נדבר דברינו בישובה של א״י, נעבור על פני הקוראים הנבונים את חורבנה של א״י, כי אם ידעו אחינו הדורשים את שלום ירושלם על מה חרבה הארץ הקדושה, ומי המה מהרסיה ומחריביה, אז מאליהם יבינו איך יכול להיות כי האוהבים שערי ציון והמוקירים את משכנות בני יעקב שם, בבואם ירושלימה כמו יראו כי דרכי ציון אבלות מאד, כן יראו את הטוב הנמצא בבני ציון היקרים. לא כן אלה אשר מחשבותיהם לא מחשבותינו ולא דרכיהם דרכינו, המה בבואם ירושלימה עולם הפוך יראו שב, והאוהבים תהפוכות דורשי טובת עצמם וכו׳ וכו׳ הנמצאים בתוכבי ירושלם במספר לא מעט, אם אינם נביאים ולא בני נביאים בכל זאת ככל עורב יכיר מינהו יכירו את הבאים לראות את ערות הארץ, ועד מהרה יתחברו אליהם ואך רע רק רע יספר באזניהם כל היום. ואלה יכתבו את כל הדברים, ששמעו ולא ראו, שהאזינו ולא בחנום, עלי ספר ויפיצוהו בכל תפוצות ישראל. ואחינו, גם התמימים, אשר לא ידעו מי ומי המה מוציאי דבת יושבי הארץ, בשמעם כי שם פאריז או לאנדאן נקרא עליהם יאמינו בשוא נתעה כי פה המדבר נבלה מיושבי ירושלם. הוא קרוב למלכות, וחלילה לו להודיע את אשר לא ראה ולא שמע או גם ההפך מאשר שמע וראה... חלילה מאחינו הקרובים *) קוראי הלבנון הזוכרים את אשר הודיע סופרנו הנכבד מירושלם בלו׳ 6, המה כירו הזיוף מתוך הדברים האלה. משם יראו כי הספר אשר חתמו עליו הרבנים הגאונים מוהר״מ אוירבאך ומוהר""ש סלאנט נ""י, הוא הספר אשר בו נאספו התשובות אשר גם הרב וגאון מוה' אברהם אשכנזי רב לעדת הספרדים יחד עם הרבנים הנז' השיבו באזני השר על דברי הראפארט אשר הוצע כבר לפני הועד בלונדון להבאיש את ריח בני ציון היקרים. וכאשר הובאו התשובות בכתב לפני הרב לעדת הספרדים, לקיים אותן בחתימתו, לא אבה לחתום עליהן באשר בעלי גו""ף של הספרדים אשר על פיהם נכתב הראפארט הנז' העידו בארב כי בנפש רבנותו הוא אם יחתום על התשובות המכחישות את הראפארט. - ואולם הראפארט אשר השר משה יציע לפני הועד מכל אשר ראה בעיניו ושמע באזניו הוא יהיה נקיים בחותמו לבד והאמת עד לעצמו. והמגיד שקרים, ערבב הדברים, למען תפוש לבות התמימים והישרים. למלכות לעשות כדבר הזה — ולכן כמעט גם אחינו הישרים יוציאו משפט מעוקל על אחיהם יושבי אה״ק. וכמעט יאמינו כי אוירא דארץ ישראל משכלת, וגם האיש אשר ידעוהו מאז ומימים פנים בפנים לאיש אמת ויקר ערך, גם בו לא יאמינו אחרי בואו ירושלימה. אי לזאת - עוד הפעם - ההכרח לא יגונה אם נפתח לרוחה את שערי ציון, שערי צדק כמו שער האשפה, ויראו וידעו אחינו שבגולה את כל הנעשה בירושלם, ואחר נשתעה יחד במה נוכל להושיע את אחינו ויושבים בציון לא רק תשועה נשמית גם תשועה רוחנית, באופן אשר היושבים באה״ק יהיו נאים לה והיא נאה להם — —  (ההמשך יבא)"
021-HLB-1875-10-13-PG001-SINGLE-ORIGNAME_120103_toc_5,דברי הימים," דברי הימים אוסטריא. — בימים האלה חגגו יושבי באקווינא חג מלאות מאה שנים להסתפחות ארץ באקווינא אל ממלכת אוסטריא. ובעצם היום ההוא התחנכה האוניווערזיטעט אשר הוקמה על בטשערנאוויטץ בירת באקווינא. החג הזה יאמת את דברי הנסיך טאללעיראנד הצרפתי אשר אמר כתבונתו הרחבה ובהתבוננו על גבולות עמי אוראפא, לאמר: „אם לא היתה באורופא ממלכת אוסטריא, כי אז היינו מוכרחים לכונן ממלכה כזאת״. דברי היודע בינה לעתים הצרפתי הנז׳ אמנם ירמזון רק על מעמד ממלכת אוסטריא בממלכות אורופא, על דעתו ממלכת אוסטריא היא הממלכה אשר בידה נפקד שמירת משקל השוה באורופא, ולולא היא כי עתה בטל המשקל השוה ולאום מלאום התאמץ תמיד, להיות יהו על העליונה; ואולם גם העמים השונים החוסים בצל כנפי אוסטריא יוכלו לאמר בצדק כדברי הצרפתי, כי לולא היתה ממלכת אוסטריא אשר בצלה יחסיון היה נדרש לכונן ממלכה כזאת למענם. כי אמנם הננו רואים באשכנז עוד היום הארצות אשר נספהו אל ממלכת פרוססיא, לא ישמחו כל יושביהן בהממלכה החדשה, וגם הממלכה לא תשמח בהם, ולא נדבר מיושבי עלזאס ולאטרינגען הנוהים ועוד ינהו רבות מאות בשנים אחרי צרפת, אף כי צור מחצבתם הוא לאום אשכנז — ומה אנו רואים באוסטריא? כמעט ההיפך: יושבי בוקאווינא הרומאנים אשר דתם ולשונם שונה מדת ולשון משפחת בית האבבסבורג המושל עליהם, ואשר רואים כי אחיהם הרומאנים אשר מעבר לנהר סעראט, הנם כמעט היו לממלכה עומדים ברשות עצמם ובכל זאת יחוגו עתה בשמחה וטוב לב את זכר היום אשר לפני מאה שנים באו בו תחת ממשלת אוסטריא. האין זה אות נאמן כי העמים השונים אשר בממלכת איסטריא ישבעו רצון ונחת ממעמדם הזוסציאלי והפאליטיקי מאז שם ממלכת אוסטריא נקרא עליהם! כן הוא הדבר, הרומאנים, הפולאנים, הסערביים, הטשעכים וגם האוגארים הנם רואים כי טוב להם עתה מאז כאשר היו שבטים נפרדים חסרי מדע נעדרי כל טוב האדם ובנוים לא התחשבו. גם בנוגע לשאלת ארצות הטירקיא אשר המרד בההערצענאווינא העלה אותה על שולחן מלכים, גם בדבר הזה תראה אורופא כלה כי נאמנו דברי הנסיך הצרפתי הנז, ולמרות דעת הקהל בבריטאניה אשר לפני שבועות אחדים הוציאה כל רוחה על אוסטריא לאמר כי יר אוסטריא במרד אשר בטירקיא; עתה תראה אורופא כי לולא אוסטריא אשר השתדלה בכל עוזה ואליה נלוו שאר ממשלות צפון אורופא לעורר את השולטאן להיטב מעמד הנוצרים בארצו, ועל לב המתקוממים דברה כי יסתפקו באשר ירצה ויכול השולטאן להיטב עמהם, כי עתה מלבד אשר המרד בההערצעגאווינא לא אבד כחו ונדעך במקומו, גם פרץ ורחב בין כל הנוצרים הסובלים עול מלכות השולטאן אליהם, וגם סערביע מאנטענגרו ורומאניה יצאו לקראת נשק. ממשלת השולטאן גם היא הסירה את אשר עשתה ממשלת אסטליא לטובתה ותשלח את תודתה לממשלת אוסטריא ביד צירה היושב בוויען.  טירקיא. — כמעט כל כתבי העתים באורופא (זולת אלה אשר רוח המתקוממים דובר בם) קוראים ללכת להלוית ההתקוממות בההער- צעגאווינא אלי קברה. האמנם המתקוממים עוד לא השיבו חרבם אל נדנה ועוד היום יתגרו מלחמה עם חיל השולטאן, אבל גם הם יודעים עתה כי תקותם רחקה ממנה. עתה כאשר הנסיך מסערביע ומאנטענגרו יעצרו בעמם בכל עוז לבלי יתחברו אל המורדים, עתה מה כח ההערצעגאווינים לבדם לעמוד בקרב נגד חיל השולטאן. גם מצד מלכי אורופא לא יש להם כל תקוה, מלכי אורופא הנם שבעים רצון כי השולטאן השכיל להבטיח לעשות שינוים לטובה בסדרי ממשלתו — לנוצרים ולישמעאלים וליהודים יחד - ויותר מזה לא יוכלו ולא ירצו לעשות עבור הנוצרים בטירקיא כי עוד לא באה השעה המוכשרת לחלק את הטורקיא בחבל, ולמען היטב מצב הנוצרים בטירקיא לבד, די הבטחת השולטאן אשר הבטיח להיטב עמהם. כי אמנם יודעת אורופא מאז ותוסיף לדעת עתה ממקרי המלחמה בההערצעגאווינא, כי הנוצרים בטירקיא הנם בשפל המדרגה בנוגע להציווילזאציאו כמו הישמעאלים. ומאה התשע עשרה לא תבוש אם הנוצרים בטירקיא עודם סובלים עולמלכות ישמעאל עליהם. מכ״ע האוסטריים מודיעים מה שראו בעיניהם כי המתקוממים בההערצענאווינא בנפול בידם חלל חרב או פצוע מלחמה מחיל השולטאן אף כי עודנו חי ויכול להתרפא מפצעיו, יכרתו את ראשו מעליו ואם יכבד עליהם לשאת אתם ראשי ויביהם יכרתו חוטמיהם וישאום אתם להראות לשריהם את כחם וגבורתם ולפי מספר הראשים או החוטמות אשר אתו ככה תגדל מעלתו במעלות הצבא ועד שר מאה ירום ונשא אם הביא חוטמות רבות. והנה פעולה כזאת לא תוכל לצאת ממקור שנאת הדת או באשר השולטאן מכביר אכפו עליהם, כי אם ממקור אכזריות אשר לא נשמע בימינו אלה כי עשה כן גוי פלוני באורופא. עמי אורופא בהלחמם יחד מקברים מתי האויב בכבוד ומרפאים ומכלכלים את הנפצעים הנופלים בידם כמו היו מאנשי חילב, ורק ההודים באמעריקא הנם עושים כאכזריות הזאת להאורופים הנופלים בידם במלחמה. בנפול איש אורופא ביד ההודים, יפשטו מעליו את עוד ראשו בעודנו חי ואת העור ישאו אתם לאות כח וגבורה. וכנראה אשר ההערצעגאווינים הנם בוערים כאלה אשר לא ידעו גם מה שיעשו ההודים באמעריקא, כי אז בלי ספק לא כרתו חוטמי אויביהם, כי אם בההודים חפשיטו גם הם העור מעל אויביהם. A"
