article_id,headline,text
021-HLB-1875-01-06-PG001-SINGLE-ORIGNAME_110275_toc_1,"י 0 61) 18 186116 1 1188 81) 6 # 68 "" 18..."," Hebraische Ausgabe des „lsraelit Nr. 21 נומער כא שנת אחת עשרה     איש יר  בועטי בלי יושבים  באניות ה ליליה ם   בירושלים לימין אנואר ב  ירי ימיהם בכל הבנין המי א   בי  לא יביאו אויביא  בליל  א מלות):? Leib Levinsohn in דעה Wilna בל ניר ים. — Poplawes Strasse ליום.  בעיני   לכתוב כל יגל „קובל. 5 רו״כ 50 קא״כ. — מכתב עתי בשפת עבר יוצא לאור בכל שבוע להודיע ולבשר ולהורות כל דבר הנדרש לאיש יהודי לדעת באשר הוא. יהודי וחבר לחברת האדם מאת מאיר (דר) לעהמאנן ע""י יחיאל ברי""ל צ""ו אֱמוּנָה בַחֲרְתִּי (תהלים קי״ט.) "
021-HLB-1875-01-06-PG001-SINGLE-ORIGNAME_110275_toc_2,החברה בעצמה יצאו הדברים והמה בעצמם שגו ב...," החברה בעצמה יצאו הדברים והמה בעצמם שגו בהמישנים מהכרת אחב״י ברו״פ, כי אז החרשנו כי נאמנים פצעי אוהב, אולם למגינת לבבינו רואים אנחנו איך גברה בימינו העזות השקר והחנופה, ורבים משוטנינו בנפש, ושונאי היהדות בגלוי יתראו כאוהבים למען הנאתם, והטו את לבות ראשי החברה בחלקות (ועוד יבואו מהם על שכרם) זה תועה ימתעה בארץ החיים, יפיץ את מאמרי (ד״ר) דאבין לכפור בתורה מן השמים מברך און לרומם את אחר וירבעם. ומחרף את המלך החכם מכל אדם ואת ר׳ עקיבא ע וקר הרים, מזכיר לבונה להקים בשם החברה רבנים ברומעניא; וזה דין דינו למזור הצ״ד ציד בפיו הולך רכיל בעמו להתקלם באחיו לפני ראשי החברה ומשפיל כבוד רבוא רבבות אחב״י לתתם לחרפות ולנידופים כעם. לא בינות. ואם לא נחוש להשיב דבר, הלא יחש בו השתיקה כהודאה, ומשנאינו (על כי תורת ה׳ אתנו) יוסיפו להתקלם בנו. ולדכא כבודנו עד עפר. ע״כ אמרנו כבוד החברה במקומה מונח ובמקום גדולתה שמה. ענותנותה לשמוע דברים של טעם ממי שאמרם, באשר כי לא את הכבוד ידרשו כ״א האמת והתועלת. ואחרי אשר באו איזה סופרים בהלבנון והצפירה להשיב על דברי הקול קורא וקצרו במקום הראוי להאריך אמרנו לבוא בארוכה בתשובה מאהבה למען תת כבוד לשני מילליאן מאחיהם אשר רק טובתם ידרשו, ויקבלו האמת ממי שאמרה בבריעת ראש בכפיפת קומה ובענות צדק: א) כל המעיין בהקול קורא יכיר כי הוא נערך בטעם ובמושג כאל אחינו הפלשת באבעסיניען (כאשר העיר ע״ז בצדק גם הסופר הנכבד מפאריז בהלבנון גליון 7) וכשגגה היתה למו לתת אוזן קשבת ליחידים טרם נודע למו הלנו המה אם לצרינו, וע״כ יצאו להקל בכבוד שני מילליאן מאחב״י אשר לא נופלים המה מאחיהם בארצות המערב, בתורה בחכמה במוסר במדות טובות, וברגשות עדינות. — והנה בפתח דברי הקול קורא יזכירונו את התשועה הגדולה אמר עשו לנו: כי מרעב וממות מלטנו בשנות הבצורת והכפן ר״ל, למען דעת צדקת החברה ואהבתה לנו בני רו״פ. ואנחנו לא נדע טעם לההקדמה הזאת, כי אם לגלות אזנינו כי להם הצדקה ללמדנו אורחות מוסר וד״א?! האזכרה הזאת דיה להכיר רשעת שוטנינו בנפש המושגים הנתעבים אשר השרישו מנדינו בלבבות אלופי החברה התמימים משפלות הרוח ועניות הדעת של אחב״י ברו״פ כי מותר האדם אין לנו להכיר חין ערך מעלת החברה מצד עצמותה ומטרתה הנשגבה אם לא בגדר „ידע שור קונהו וחסור אבוס בעליו״ — עד כי נאלצה החברה (בטח למורת רוחה) לצאת מגדר הצניעות ולהזכירנו חסדיה כי ברעב פדתנו ממות להיותנו כיום הזה. ואם באמת הגדילו לעשות, וחסד אחינו מחו״ל אשר קמו לעזרתנו עדי נצח לא ישכחו מלבבינו סלה. אמנם אם מאמר ראשי: תשובה מאהבה לכברת כל ישראל חברים. השקפה כוללת על דברי ימי שנת 1874. דברי הימים: אשכנז. צרפת. ספרד. מכתבי סופרים: אמשטרדם. לאנדא. ווילנא. קארלין. ביעלסק. הודעות. — שמועה רעה מקעלן. ירכתי לבנון: ידיעות הטבע „חיי הצמחים״. — ספור „מלחמת האמונה והאהבה""  התרל״ה MAINZ, den 6 Jannar מאינץ, כ״ט טבת 1875  תשובה מאהבה  לאלופי חברת כל ישראל חברים הי""ו יראת הרוממית אשר היא על פני כלל אחב״י לנגד החברה המפוארה „כל ישראל חברים"" הי״ו, היא עצרה בעד מרבית סופרי ארצנו מהשיב דבר על הקריאה של חבה אשר קראה החברה לאחב״י סרו״פ בהקול קורא הבא בהלבנון גליון מ״ז שה״ע, אם גם מרגשי אש אהבתם נכוו כלל אחב״י מרו״פ ועד נפשם וכבודם נגעו — בהעלות כל איש אשר רוח רגש תפעמו את יקרת וחין ערך החברה הרוממה הזאת אשר אין בתולדות ישורון משלה למיום גלות ישראל מעל אדמתו, יתפעל בחרדת קודש, וממעמקי לבבו ישא רנה ותפלה בעדה, וכל רוחו ונפשו ימלא תודות ותהלות אין קץ לה; בדור כזה אשר רבו המשליכים את עדי הדת מעליהם ובוזים ליקחת אם, יקומו שועים אדירים העומדים בחצרות שרים ורוזני ארץ, לעשות אגודות קודש לזרוע זרע אמת וצדקה בעד אחיהם! ומלבד כל הגדולות והנצורות אשר פעלו בעד אחיהם בארצות המזרח, הנה עצם אגודתם בקודשנעלה על כולנה, כי באלה ירימו את קרן ישראל בלאומים והעירו רוח נעלה בלבבות האפרתים והאצילים באחב״י בכל מדינה ומדינה לבלי לבוש בצור מחצבתם ולראות תפארת למו מן העמים להקראית בשם אוהבי עמם, להיות למו למלאכי מליצים לפני שרים ורוזני ארץ. ומי ירהיב עוז להוכח במילין פרתמים ואצילים כאלה אשר רק שלום אחיהם המה דורשים בכל לב ונפש. ואולם מאז בא בהלבנון גליון ט׳ הודעת החברה (הנעתק ממכ״ע החדשי שלהם) לאמר: „כי באו ידיעות להחברה אשר למותר לה להתערב בפועל בדבר הרחבת ההשכלה בין אחב״י ברו״פ אולם לעוררם בדברים כהקול קורא תוכל להביא תועלת״ — ההודעה הזאת הגדילה את הקול תלונה דקה אשר נשמע במחנה העברים בארצנו מאז יצא הקול קורא, והקול הולך וחזק מיום ליום: מדוע לא נשיב דבר לראשי החברה שליט״א על הדברים המרים והקשים כגידים אשר הציאו שלא ברצונם להקל בכבוד שני מילליאן מאחב״י ה׳ עליהם יהי'? ולוא ידענו כי מרוח וחפץ נערוך את כל הצדקות אשר הגיעו לנו מאת אלו פי החברה באחרית ימי הרעב, והצדקות המכופלות אשר הגיעונו מראש ועד סוף מאחינו הנדיבים באשכנז, מול ערך העניים הרבים במושבות אחב״י, אזי נאמר בצדק כי לא הספיקו לכלכל מספר האביונים גם חדש א׳ משלשת שני הרעב. ובאמת רק לשני מחוזות בארצנו הגיעו הנדבות מחו״ל, וגם במחוזות האלה לולי חשו נדיבי ארצנו בכל עיר ועיר לקום לעזרת האומללים לרוחתם לישועתם וחשפו זרוע צדקתם בנדבות נעלות ונפלאות, אשר בערך הנותנים לא נשמע מעולם בחו״ל נדבות וצדקות כאלה, כי עתה כל הצדקות מחו״ל לא הועילו מאומה. ולוא באו השוטנים האלה תחת להלשין על עמם לפני החברה כמליצי יושר לספר רק האמת מהצדקות הנפלאות בשני הרעבון והכפילות והמכופלות אשר פזרו בהשנים האחרונות לפדיון נפשות לקנות קוויטין בעד בעלי אשה ובנים אשר עלה גורלם להחלץ לצבא, וכי עדה קטנה בת שתי אלפים נפשות שלמה שנים הרבה בזה אחר זה כשתים עשרה אלפים רו״כ שנה שנה — או אז התפלאו והשתוממו נכבדי החברה על הצדקות הנפלאות האלה ועל נדבות לבבנו יותר מעל המילליארדים אשר שלמה צרפת לאשכנז, והכירו יקרת רוח ומעלות נפשות אחיהם בני רו״פ, ואז לא באו לאסיפה בברלין חיש אחר הרעב להתיעץ לטובת אחיהם בני רו״פ, כאפיטרופסים בעד יתומים קטנים, מבלי דרוש וחקור מהם בעצמם צרכם ומחסורם, ואופני תקנתם; ולא הוציאו משפט מעוקל כאחד מבעלי האספה שמה לאמר כי סבת הרעב הוא לא מאשר עצר ה׳ את השמים שלש שנה, או מאשר לא הורשה לנו עדנה להתפשט בפנים ארץ רוסיא וכדומה, כ״א מאשר רוח אחינו ברו״פ הוא כרוח העת אשר היו בה רבינא ורב אשי (2) והנערות תגדלנה סרוחות על ערשותן עד יום חופתן ותבלנה ימיהן במטה (?) (המגיד שנה י״ג גליון 42), וכדומה סבות כאלה: ולא החליטו עצותיהם ע״פ עצת אלה אשר רוח ומצב אחינו בני רו״פ מוזרה להם; ולא באו גם עתה בהקול קורא לתת את רבוא רבבות ישורון כאזיאטין שונאי מוסר ודעת! וכאשר לא באנו אנחנו ללמד מוסר ויראת שדי לאחב״י בעיר שטרסבורג וארץ פרס בגלל הנדבות למרבה אשר שלחנו מארצנו, כן ידעו גם אלופי החברה להוקיר את כבודנו מגדל ומעוז היהדות מאז מעולם! ב) החברה תעוררנו לכבד ולאהוב את הקיסר הצדיק יר״ה ולאהו. את ארץ מולדתנו כו' לשמוע פקודי מלך ושרים — יודעים גם שיטני. כי אחב״י בכל ארצות פזוריהם נאמנים המה למלכם וארצם ועם שונים יתערבו, ובצדק יתפאר ישראל כי הנהו עבד נאמן למלכו, גם ע״פ אזהרו. תורת ה׳ התמימה. הפריזיו של עבודת הצבא הכללית בארצנו אשר זה כשלש שנה מאז יצא הפקודה ושוטנינו פערו פיהם לאמר כי מהיהודים לא ימצא אף א׳ בן כ״א שנה אשר יחלץ לצבא, ויעצו בעד זה את הממשלה לגרוע זכיות היהודים ולהגביל בעדם זכיות מיוחדים — עתד הודיעו הכה״ע כי היהודים באו לפי הערך יותר מהנוצרים ותחת כי נוצרים רבים חסרו והתחבאו ולא באו להפריויז, היהודים באו כולם! כאלה וכאלה יודעים גם שונאינו אשר מקרבינו יצאו. אפס מזימות זו חשבו אולי כאשר נשמעו דברי ראשי החברה באזני המחפשים אחרי מימי ישראל להבאיש ריחינו בעיני הממשלה יר״ה כי גם בעיני החברה השודים אנחנו על ככה, ויטיבו הרע; ומי וידע אם לא קלעו בזה אל המטרה. (ההמשך יבא) נעקב הלוי ליפשיץ."
021-HLB-1875-01-06-PG001-SINGLE-ORIGNAME_110275_toc_3,השקפה כוללת על דברי ימי שנת 1874," השקפה כוללת על דברי ימי שנת 1874 בעת כלינו השקפתנו הכללית על שנת 73 בנו׳ 21 שנה העשירית בהחדשות אשר נולדו בספרד בראשית 74, חדשות אשר השכיחו את הישנות משנת 73: בעת הודענו כי הגענעראל פאויא בא (בעצת סעראג) עם גדוד בני צבא אל בית מועד הקארטעס, ויגרש את נבחרי הלאום, ואת רסן הממשלה לקח סעראנו בידו — בעת ההיא אמרנו: „כי לא יארכו הימים ודון אלפנוזו (כן איזבל הסגורשת) ישב לכסא ספרד״. אכן זאת לא חשבנו כי בשאתנו מדברותנו על שנת 74 ממקריה ותוצאותיה, יהיה פתח דברינו בעניני ספרד, באשר המה יעמודו ברומו של כל עניני אורופא. ביום 31 לחדש העבר ביום האחרון משנת 74, באה הבשורה ביד הטעלגראף אל איזאבעלע המגורשת מכסא ספרד ויושבת בגרות פאריז. כי בני הצבא ממחנה האמצעית, ומהמחנה אשר בצפון הארץ המליכו על ארץ ולאום ספרד את דון אלפונזו בנה למלך! וההודעות שבאו אחרי כן עד היום הזה כלם מאשרות את ההודעה ההיא, וכי גם האזרחים במאדריד ובשאר הערים הגדולות לא התקוממו ועונים אמן אחרי קול הקריאה אשר בני הצבא נותנים במרום „יחי דון אלפנוזו מלך ספרד!"" מי יגלה עפר מבין עיניך מארשאל פרים, וראית יושב לכסא ספרד את בן איזבל אשר ביד חזקה של בני הצבא גרשת אותה בחדש סעפטמ שנת 1868 מהלאה להררי פיראנעים, והתפארת לאמר כי amais עד עולם לא תשוב המלוכה לבית בורבאן - כי עתה היית משבח את המרצח אשר הכך נפש בסתר לפני ארבע שנים, כי על כן לא תצטרך עתה לכסות בכלמה פניך. והנה אף כי רוב ממשלות אורופא הכירו זה לא כביר את המארשאל סעראנו למושל ספרד, בכל זאת אין כל ספק כי לא יארכו הימים וממשלות אורופא תכירנה את דון אלפנוזו למלך ספרד, ואולי גם ממשלת רוסיא האדירה לא תהיה אחרונה. כי רק את ממשלת סעדאנו לא רצתה להכיר באשר היתה מלכותא בלא תגא. ואם אמנם גם דון אלפנוזו נקרא למלך בחזקת יד בני הצבא ולא מאת נבחרי הלאום, אבל גם אמו אשר גורשה מארץ מלכותה ואשר רבות מאות בשנים ישבו לכסא שם אבותיה ואבות אבותיה, לא הלאום גרש אותה מעל פניו כי אם המארשאל פרים ועוד איזה משרי הצבא קשרו עליה קשר ויחד גרשו אותה בחזקת היד, והיד החזקה אשר לקחה בשנת 68 את רסן הממשלה מיד בית בורבאן, היא השיבה אותו בסוף שנת 74 ליד דון אלפנוזו אשר אמו המגורשת מחלה על כסא מלכותה ביום גורשה, לטובת בנה זה. והלאום אשר יענה עתה אמן על קיל הקריאה: יחי דון אלפנוזו״, איננו עונה בקול אשר ענה אחרי הקול אשר העביר פרים בספרד לאמר: רדי אינאבעלע מכסא ספרד, ועד עולם לא ישב איש על כסא ספרד בית בורבאן"", כי עתה נלאה הלאום מהשמות אשר נעשו בארץ מיום ורשה איזאבעלע מכסאה, ועוד טובים היו הימים — ימי חושך — לספרד פני איזאבעלע מהימים אשר עברו על הארץ מאז גורשה מספרד. ולא פלא עוד אם הספרדים כלם או מרביתם ישאפו רוח תקוה לשוב תחיה בצל דון אלפנוזו אשר במכתבו הגלוי מיום הראשון לירד דעצעמבער העבר הבטיח כי בעלותו על כסא המלובה, שבט מישור יהיה בידו, ועל פי חקים קאנסיסטונעלים (ממשלה מוגבלת) יעצור בעמו. בנוגע להמלחמה עם הקארליסים, אין להגביל גם עתה מראש את היום אשר דון קארלס יראה כי אזלת ידו ויעזוב את גדודי השירדים אשר בשמו יפרעו פרעות בארץ. האמנם כי רבים משרי הצבא אשר יעבדו את דון קארלס יעזבוהו עתה ויבואו לעבוד את דון אלפנוזו, באשר כי רק משנאתם את הרעפובליק אשר משלה בספרד. אחרי דון אמאדעי, נספחו אל דון קארלס. אבל מי יודע אם פיוס התשעי הזקן מרומאפיצו את ברכתו את דון אלפנוזו, כאשר יברך כל היום את דון קארלס. ואף אם לא ישקר הטעלגראף מפאריז אשר הודיע, כי דון אלפנוזו מהר לדרוש מהפאבסט כי יברך אותו, והבטיח מראש כי ילך בעקבי אבותיו להיות מגן לזכותי הפאבסט, — בכל זאת אין להגיד על נכון אם הפאבסט יאמין לו על דברתו כאשר כמעט הבטחתו אליו סותרת את הבטחתו ללאום ספרד נגד אורופא כלה למלוך עליהם כראוי ויאות בשנות המאה הנוכחית. וכל הימים אשר הפאבסט וכל קדושיו עמו יתמכו את דון קארלס, תרוה ארץ ספרד מדמי בניה. גם אלפנוזו יודע כי נכונים ימי מלחמה גם לו. והמודיע לחדשות מפאריז במכ״ע „טיהמעס"" מודיע כי שאל את המשוח למלך, אם יאמין כי הקארליסים גם עתה לא יחדלו ממלחמה, ודון אלפנוזו ענה לו לאמר: על דעתי המלחמה תהיה בימים הבאים כבדה ונוראה מאד, אבל אקוה כי לאום ספרד מעט מעט ידבקו לאהבה אותי ויעזרני כלם כאחד להשבית המלחמה מן הארץ"". וסעראנו אשר היה במקום המערכה בעת חוקם דון אלפנוזו למלך, לא אמר לנערו הנושא כליו כי ימותתהו בחרבו, ובלב שקט שב מאדרידה. ומכ״ע „פאטערלאנד"" מוויען (המכ״ע הזה הוא לפה לקדושי הפאבסט) יאבה לדעת, כי זה ימים רבים אשר סעראנו וביסמארק התלחשו יחד לשום עטרת ספרד על ראש דון אלפנוזו, להכרית כל תקוה מדון קארלס, אשר נשבע להיות מחסה עוז להקאטוליסמיס. (ההמשך יבא)"
