article_id,headline,text
021-HZT-1876-07-28-001_Ar_toc_11,מחזה גאליציה.," מחזה גאליציה. אשר חזה עליה הרב ר' איבוש אייזניר. מלפנים אב״ד דק""ק גריידינג. וכעת דומיץ בק""ק קאראלאפקא המשך מגליון 34 הבו לכם אנשים חכמים ונכונים אשר יציו בצרת עמם ואשר דעת להם להבין ולהביא עצה ולעשות תושיה בכל דרכי העדה לא כאשר תעשי עתה. לא כאשר תעשו עתה ביניע התור לבחור ראש הקהל רוח עועים יתעה אתכם ואחם תערים סוד מה לעשות ואת מי להושיב על נסא מרים. זה את דוד וזה מסרפו. האב תכסיף נפשו לרוחות את בני בין גדולי העם וראשי הקהל ולהיות הוא מהנומנים לראש וכי הוא ישב בראש זאת תהיה תפארתו. וידבר בלש עם בני משפחתו קרוביו ימיודעיו לאמר: ראה זה בני איש מבין היא ומשכיל על דבר לא ישא פני איש, אך אתכם בני בסתר פנים ישא, ועמו עצה ותבונה לו נאה ולו יאה לשבת עם קציני העדה אם יש את נפשכם ינפשי הטי את לבב אחיכם אליו. והם יענו בקול הננו למבקיצך רת. לו מצפט הבחירה, חפצנו בו. גם בבית משתה היין עצה את מי יבחרו. ויען אחד ויאמר ראי זה דודי וזה כבר הון ועישר בביתו למה יגרע כב דו לבלתי היות דה וכלם מאחד עונים ואומרים דבריך טובים ונכוחים מלידה הכן האיש הזה לכפא הכבוד הזה הלא זה שנית ביו עב דתו בשלמות ובחריצות ידים בחברת בקור חולים בהשכל ודעת חברת קדישה. מלפניו עמים יחפזין חיל אחזון כאשר תבוא קין כל בשר לא יתן קבור מתב ם עד אשר קרוב המת יקנו בכסף מלא אחוזות קרקע הוא לא יבקר בין טוב לרע בין עשיר את הכל אצלו, הזכור תזכרו עוד כאשר עשר שטות  כי לא נתנו לקבור עד אשר בניו שלמו בעדו ששת אלפים להחבורה, ובאמת נתעשרה החבורה מיום שקבל עליו המשרה על שכמו וחלת זאת הימים האלה טובים לנו מהראשונים כי בכל רגע יעשה לנו מעודה כפעודת שלמה בשעתו וחשתיה כדת אין אונם, אותו נבחר ואך טוב לנו להיות נמנה בראש והוא אך הוא ינהל את עדתנו בחפין לבבנו ויעשיר את עירנו. בהקלויזין ידברו בעת התפילה זה יאמר לבחור האיש הנעלה ר״... אשר הוא ראיש וראשון להם יען כי מכובד היא בעיני ובלי תפונה נכבדת מדובר בו כי זכה לירש הכבוד הזה גם אנחנו מחייבים לתת על שכמו משרה הכבודה הלזו להיות ראש המאספים בתוך האדה וכלם יענו ויאמרו על חלומותיו ועל דבריו מה יפו ומה נעמו דברך הנאמרים בהשכל ודעת. הוא ולא אחד ולוא יבאו כל רוחות שבעולם לא יזזו דבר אחד מדבריך ומהם לא תפול ארצה. בבית אחד יושבים אנשי הופש רוח פרייאגייסט) וישחקי בקלפים (קארטען) ובתוך הוצחוק יפתם אחד את פיהו ויענה ויאמר הלא ידעתם כי המשכיל פלוני אלמוני הוא מצוין בחכמה וידיו רב לו לכתוב ולקרוא באשכנז כיליד אשכנז מבטן אמו, ראוי ינכון הוא לעמוד בראש העדה כי כל כתב הנכתב בשם המלך יקרא היא לנד במתירות יגם ידע לעת מצוא לענות לשואליו דבר, כא צר יקרא הוא יענה, זאת העצה היעיצה מאתו כי עליו תשימו את עיניכם והיא יהיה לנו נם לפה ולמליץ, וגם לראש העדה וכלם יענו ויאמרו טיבה עצתך אשר יעצת הפעם. כן תקום. וכאשר יאספו אח״ז העדה בתוך השיק קול רעד וכעס ורעש נשמע בחוצות בעיר מהדעות מונות עד אשר ריב וקטטה תצמיח ביניהם ויקראו למחלומות ה רוצה להטות את לב העם אחרי דעתו ועצתו, וזה אחרי דעתו ועצתו. אך כל עמלם לריק המה ובתוהו נלכו לים האבדין כי מי יעלה בראש מי המה הנבחרים בהערים הקטנים בגליציה הלא מעצמכם תוכלו לדעת זאת, הקרוב לאלה אשר פה להם וידברו, דבריהם יוליכו את העם שולל בכל מעשיהם הטה ימו את ל העם אחריו והיא ראש וראשין לכל הנבחרים שני לו הגביר אשר הון יעישר בביתו והכסף יענה את הכל . השלישי להם הוא האיש איש לו משפחה גדולה, והמה כלם אנשים אשר לא ידעו אף לחתום את שמם בכתב אשכנז כאשר עיני ראו ולא זר, עיך בילדותי בעיר אולישטשין עיר רבתי בעם. עיר ואם בישראל ובין ערים הגדולים שבגאליציה תחשב. ב אלי ראש הקהל משם ובידו אחז כתב אשכנז שנשלח לו מבית המשפט הכתב הפך מלמעלה למטה ונתן ל לקראחו באזנו, בראותי זאת ועוד נער הייתי ולא ידעתי להדר פני זקן הוצאתי מפי שחוק גדול מרגיז לב ונפש. והראש הקהל נכלם מפני ומרוב בשתו אמר לי „חבל על דאבדן ולא משתכחין על ימי ילדותי אשפוך כמים דמעות כי הלכו בתהו ולא שמת לבו על אחריתי לראות אשר נגד עיני, על אבי אקרא חמס, ואך עליו תלונתי כי לא נתנני ללמוד כתב אשכנז למען אדע לפחות לחתום את שמי ואנוכי נער משובב הייתי בכל נערי בני ישראל בנאליציה, ולכן גם אנכי בעצמי לא שמתי לבי על דרכי. ועתה הנה אנוכי ברעה כי נהייתי לשחוק לכל שדי המרכות, השחוק אשר אתה מלאת עלי ועל מעשי לא חדש הוא בעיני ולא ראשין הוא לי, כן אישמע כמעט בכל לכל שעה, ותחת אשר אמרתי להנחיל כבוד במשמרתי א וקלין"". כן דבר אלי והוציא אנחה מקרב ולב השוב גופו של אדם ויפן ערפו אלי וילך לו, ואף לשאלני על א נכתב בהכתב שכח מהדאנה אשר מצאתהו אז. — המשך יבא אי""ה."
021-HZT-1876-07-28-001_Ar_toc_12,ירושלם.," ירושלם. ביים השני שבוע זה בבוקר השכם עזב חיל הריזערף את עירנו וילכו יפו. לעלות על אחת אניות המלחמה אשר נשלח מהעיר הבירה אל סוריא לעחת את חיל הריזערף ולהיגילם קאנסטאנטינאפילה, בכביר גדול יצאו, פחת עירנו שריה וגדוליה יצאו מחוץ לעיר ללותם. מננני הצב, ובהני התוגרמים רגלים בידם הלכו לפניהם, והמון אדם רב למאד לוום הדחק מחוץ לעיר"
021-HZT-1876-07-28-001_Ar_toc_13,שות שונות.," שות שונות. מלכות השולטאן טוראד יר""ה נדב מאיצרו המרו המה לער צבאות הממשלה הלוחמים על שדה הקרב חמש עשרה אלם לאלא. הוד מלכותה הנסיכה אם השולטא יר""ה חמשת אלפים לירא, השרים הגדולים יועצי הממשלת, מאאתים עד חמש מאות לירא. בסאלוניק נאסף לעזר הדבר הזה עד הנה שלשת אלפים וחמש מאות ושבעה וחמשים לירא, הנדבה היותר גדולה בהעיר הזאת היא נדבת אחינו הגביר המדומם דאקטאר אלאטיני (ראש יועד הכי״ח בסאלוניק) אשר נתן חמש מאות לירא. היד הגלאנד וויזיר הנ""ש תורתו נטעלענדאף להאדון אלאמיני בעד אותות חסדו וארבתי להונדמה אשר הראה במפעלו הזה. בארדיאנאפאלי נאסף עד הנה אלפים. ובבגדר אלף והמש מאות לירא, שני סוחרים נוצרים בה עיר הגירה התנדבי גם הם א חמש מאות לירא, פקיד ימורי ותלמידי בית המדרש לחכמה הרפיאה בהעיר הבירה, התנדבו לתת את שכרם לחודש ימים נדבה לטובת הדבר הזה. הוד השולטען יר״ה העריך מכתב גלוי לתושבי באסניען ואלכאניען אשר בו ידרוש מאתם כי יקימו לעזרת ארץ מולדתם וכל איש נכן שבע עשרה עד שבעים שנה יצא לצבא. בהעיר הבירה הופקד קאמטיסיאן לרשום בספר שמות אלה אשר יתנדבי לצאת למלחמה בחפץ לבבם. ביום הראשון גריצמו במשך חמשה שעות שבעה אלפים וחמש מאות איש, מהם אלף וחמש מאות מאפטאס, (תלמידי בית מדרש הדת) והם דרשו כי אחד ממוריהם יפקד לראש גדודם, הממשלה הרומטה מלאה שאלתם בחפץ לבב. באזעיר ובנותיה התנדבו כעשרת אלפים איש. ללכת למלחמה. כן בכל ערי תוגרמה נדבה רוח רבים מצעירי העם לקום לעזרת ארצם ומילדתם ולהלחם באויביה. המתנדבים האלה יחילקו לגדודים מאלף איש, ולא יקבלו אכר מאת הממשלה, ואך לים חיקם ונתן להם, שלש מאות דראהם להם, ושלשים דראדם בצר, דבר יום ביומו. בין המתנדב ם בהעיר הבירה ובאזמיר, ימצאו גם רבים מהנוצרים, ואחדים מהיהודים. אחינו הרופא הנכבד דאקטאר אליהו איפענדי כהן. הופקד לאחד מיוטאי הוד מלכותו השולטאן מיראד יר""ה. הרופא הנכבד הזה היא יליד העיר הבירה ובבית מדריש הרפואה אשר שטה השלים חוק למורו, לו שם בתוגרמה בחכמתו, ביחוד הנהו רופא חולי העינים מצוין ונעלה, יהי ה עמו ויעל. אנית הקיטור ההולאנדית „גענעראל קרעזען נשברה לרסיסים לא רחוק מסונדע (הידו אשר להאללאנד) ומאתים ושלשים איש נטבעו. דממשלה הודיעה ברבים כי המקרים החדשים יאלציה לאחד עוד הפעם את מועד שלום הקופאנס וזכיות הגורל עדי יסירו הנפיבות הספריעות, והשלום ישל מבארץ שלטת"
021-HZT-1876-07-28-001_Ad_toc_14,, ירושלם  ז' מנחם אב תרל״ו
021-HZT-1876-07-28-001_Ar_toc_15,"כ יאור . על מרשה כו "" מסמר ירמיח . . ממנ..."," ביאור. על פרשה כ""ו מספר ירמיה. ממני חיים יוסף פאללאק. המשך וגליון 36 א. בראשית ממלכת יניקים פרשה זו נאיורה ארבע שנים לפכי הפרשה כ״ח שקדמת, וכ״כ רשי ז""ל ובנין זה אחז״ל גם מכמה פרשיות שבתורה „אין מיקדם וולאוחר בהורה"" ר״ל שאין קדימת אי איחיר כתיבתם בתורה שוה לקדימת או איחור קבלהם ואמירתם בסיכי ב. על כל ערי וכו׳ ר״ל אל כל יושבי ערי יהודה הבאים ור""ל לאנשי מעמד שבאו בכל שביע ושבוע לירושלם להשתחות בעזרה לפני ה׳ בעת שחיעת והקרבת החמיד, או ש אינרה פרשה זו לפני אחד משלש רגלים אשר אז נראו כל זכרים לפני ה׳ בירושלם. אל רגרע, אל תחסר ותמנע מא מה מדבני הפורענות אשר אביא עליהם אם לא ייטיבו דרכם.  ונתתי את הבית הזה (לחרבן ולשממה) כאלה, כי בה חרב המשכן שתי' שם כאשר לקחו הפלשתים במלחמת את ארון העדות אשר שכן שם בתחילה וכ""כ נד""ק. א. מדוע בבית וכו׳ ר״ל בזה כי לא האמינו לו שדברי בבואתו הרעה הזאת עליהם מפי ה׳ י או כי אם הול לבדו בדם איהם מלבו, וע״כ רצו להענישו ביושפט מות והיוד במלת נבית היא תמורת אלף הש רש כמו נבאת, והעיר הזאת החיב ר״ל תהי' חרבה ושוממה, והיא פעל עומד (יוירד וכטג זיין) נגזר משם חורב המורה בהנחתו הראשונה על חום השמש הגדול בעת הקיץ המיבש כל לח נובעיי בעשבות הרים ובקעות כמו (ברא׳ ל״א מ׳) הייתי ביום אכלכי חרב, ואולי נקרא גם הר סיני ע״כ בשם חורב בעבור שכלו יבש מאוד בהיותו לחיח סלע וליר חלמיש, ויען כי ארץ כנב כזה אשר שם ישליך השמש קרניה הלוהטים כאש מן כל שיח ועשב חשדה בעבור כי החום הגדול שם מיבש פכי החדמה ולא הנה להוליא צמחה למאכל אדם וחליר לבהמה, יהי׳ רק וקום ליה ושממה מאין יושב בה ע״כ הושאל פעל חרב גם על העשות מקום מיושב לפנים, ע״י צר ואייב או שאר סיבה אחרת לשאיה ושממה מבלי יושב. ולפי האינור נרדף גם שם חרב הומורה על הכלי אשר בו יומתו ויהרגו בכי אדם ושאר בע""ח בהוראתו עם שם חרב המיבש ליחית כל הלמחים ומסבב בזאת את מיתתם ושביבת חייתם הטבעית. שער ה׳ החדש. תיב״ע תרע בית מקדשא דה׳ מדינחאה. ר""ל שער המזרחי ונקרא כן לפרש""י ורד""ק בעבור שנבגלה וויכין וקלת כני בית אלקינו עמו שברו חיל נבוכדנצר אח שער מזרחי זה (אולי למען יוכלו להוציא הכלים האלה יותר על נקלה משם) וחזר צדקיתו ותקנו וקדשו (או שחדשו בו שום הנין) לפיכך נקרא חדש. 1 אילי הוא לדעת הוב״ע כמו שער החרש בא לוף ר׳ בדלת כיוו בוולת דישת (דתי״א ו) ת' ליברא י׳ ג') וחילון ש' בשין ומו""ה תרגם שער המזרח לפי ההשמו האיל עליו בבוקר מאלה אבל״א זאבבענשיינטהאר)] ר""ב. כל הדברים אשר שועתם, וכן אמרו גם חכהנים בפסיק י""א „כאשר שמעהם, כי א רצו להוציא שבית מפיהם הדברים תרעים אשר נבא עליהם, וכן גם (בישעי' ל״ז ו׳) אל תירא מפני הדברים אשר שמעת כי לא רצה לשנות דברי חרופים וגדופים של נבשקה. לאמר ה׳ שלחני, כ״ל ולא מלבי הילחתי מלי כאשר חשבתם עלי רעה. טץ. אל הכהנים ואל הנביאים, ר״ל לנביאי השקר כי הם והכהנים לבד היו שינאי ירימי׳ ומבקשי נפשו לספותת בעבור שוא מלא ללכת אחריהם בשקר הם ובפחזותם. ד""ך, אנשים מזקני הארץ. נ״ל הישרים והתמימים אשר עוד נגעה בם יראת אלקים והם הזכירו באזכי שאר העם ומה שכהי׳ בימי חזקיהו שעברו. י״דן. הי' נבא. מלת נבא איני פעל עבר, כי אם הבינוני (וואר ווינזאג נכד) כימי ופרצה חוים (ברא׳ מ״א א') שהוא כמו הי׳ חולם (יואר טרייטננד) כי כן דרך ל""ע להינות באופן זה לפעינים על העבר וכן (בדהי״ב כ״ב ג') „כי אמו תיהם יועלתו לחרשע, ושם ד׳ כי היות היו לו ועלים וכו׳, ולע״ד יורה חיבור זה תמיד על עבר שנשלם כבר מן רב. ויהורגם (בל״א. האטטע געטרייווט, האטטע  אשהעליירט), וכן בדהי״ב האטטע (אדער האטטען) או הם (געראטהען). ו""מן. ויחל את פכי ה׳, יפה העיר החכם בעל ס' ויעתר ילחק כי פעל חלה בבכין פעל יורה על החלשת דבר מה וע""כ בהסמכו אל מלת פנים יורה על תחלשת כעס יקלן) זולתו וריצויו בל״א (בעזאכסט גטע) אבל אחרי אדוני (מ""ב ס׳ ג') וכן חלותי היא (תילים ע״ז) יוצאים מכלל זה אם גם הם שם לשון בקשה או תפלה.  המשך יבא אי""ה."
