article_id,headline,text
021-HZT-1874-09-18-001_Ar_toc_16,מהות ותכונת הארץ," מהות ותכונת הארץ מתולדות הטבע אשר על פני האדמה ובקרבה. (פאן איהרען פראדוקטען) א. המוצאים (ריא מינעראלען) בשם זה יקראו כל אשר יוציאו ממעי האדמה. כנראה גם מלשון הכ׳ (איוב כ""ח א) „כי יש לכסף מוצא"" ובל""א הוא כגזר מפעל „מינען"" המורה על החפירה „אויסגראבען"" כמו המלח והגפרית ושאר דברים הטמונים בארץ כאבכים אשר בהם מעורבים חלקי מתכיות שובות (טהאלע פער שיעדעבער מעטאללע) אשר יוציאו ממצה ויכתנו באש וילדמו אח״כ לגוף אחד הבקרא בשם מחכם (מעטאלל) משורש בתק שמעללען; כי רק על ידי ההפכה יצא  היקר הזה מחזולל! ר""ל מחלקי עפר וחול המחוברים יחד עמו מכל מיני המתכיות האלה ימצא הברזל לבד כמעט בכל המקומות על הארץ, ובזאת נכיר ג""כ חסדי היוצר כל וטובתו אשר הפליא לעשות עם בני אדם, כי בעבור שהברזל הכרחי (איזט כאטהיג) ומועיל מאוד לכל מלאכת מעשה (בו יעדעם האכד וערק) למחדשות ולאתים, לסכינים ולמזלגות, עד שבלעדו לא יוכל האדם לחיות חיים כעימים, ע״כ הכין הי״ח בחכמתו וטובו, כי כמעט בכל מקום עלי ארץ ברזל מעפר יוקח מבלי עמל רב, כי הוא נוצר במעבה האדמה הקרובה אל פכיה, ולא יצטרך האדם ליגיעה רבה לחפרו כשאר מטמונים ממעמקי הארץ, כמו שהוא הכרחי להוציא משם הכסף והזהב הנועדים רק לעשות מהם כלי יקר לתפארת אדם או לעדות עדי על לבושו, או לטבוע מהם מטובעות (מינצען) לצורך המסחר והקנין, (וכעין זה כ׳ גם בעל ס' חובות הלבבות בסוף פ""ה משער הבחינה: שהדברים אשר בהם קיום הגופות והשארם על עניכם וגבולם עד (בוא) קלם כמצאים ברב או במעט כפי הצורך אליהם וכו' והדמיון בזה, האויר הנשאף (דיא אייכ לו אטהמענדע לופט) מפני שאי אפשר לעמוד בלעדו שעה אחת בשום פנים. המציאו הבורא ית' בעולם והזמינו הזמנה שאיכה כמכעה משום אדם באיזה מקום שיהי׳ ובכל עת זמן. ומפכי שהצורך (רב) ג""כ למים וכו' שלחם הבורא על פכי הארץ וקבלם במקום מיוחד שהולכים בע״ח אליו וכו׳, גם המאכנ כמצא הרבה ואינו כמכע כלל (אונד פעהלט כיכבו גאנץ) מבכי אדם וכו' אבל האבכים היקרות והזהב והכסף ושאר מיכי המוצאים מפני שהצורך אליהם בעצמם רק מענט ותועלתם יותר רחוקה אלא מלד ההסכמה עליהם (וועלכע כור בעבוטלט ויערדען ווייל דיא מענשען העריעבער זא איינער איינגעשטי- ממט האבען) לא נמלא מהם אלל המון בכי אדם מה שנמצא ען המאכל אלל אחד מהם וכו' יע״ש. ולי נראה כי בעבור שהברזל והכחושת הדומה לו ג""כ בבחיכת רוב צרכי ותעלתו לבכי אדם, כי ממנו יעשו כלי בישול המאכל כמו היורות ודומיהן ושאר כלי תשמיש ומלאכת יד, הזכיר הכ׳ (דברים ח׳ ו׳) שכי אלה גם בשבח ארץ ישראל ופולדותיה באמרו שם „ארץ אשר אבכיה ברזל ומהכריה תחצוב כחושת"" הזהב לא ימצא למכביר כי אם בארצות החמות מאוד ד״מ באפריקא התיכונה במעקציקא, פערד וקאליפארכיען אשר באמעריקא, וזה מקרוב נמצא זהב לרוב גם באוסטראליען, ומענט מנוכו נמלא גם באונגארן בעיר קרעמנטץ במעלה מ""ח "" 48 42 לרוחב דרומי, ובמעלה"" ל״ג 33 ""32 לאורך מזרחי, שגם שם גדול החום, כי כפי הנראה יוכל רק החוס הגדול להוליד זהב הרבה בבנון הארץ, תחת כי הכסף והנחושת והמלח ימלאו רק בארצות הממוצעות בחום שלהם, גם האבנים היקרות (דיא נדעלשטיינע) והשיש היקר תמצאיכה רק בארצות החמות הרבה. ב. הצמחים קלת מיני צמחים ימצאו כמעט בכל חלק יקלוי הארץ, הלא המה החזרת. התבל (קרעססע) הפרפס (פעטער זיליע) וזעלעריע, וקצתם מלאו רק באותן ארלות אשר מדרגת אומם כאוה וראוי' לסבב גידולם שם, כי ממעלה ע"" 70 גראד לכותב לפוכי עד מעלה ס 60 יגדלו רק עשבים (מאאזע פאררענקרייטער) ושאר למחים כמוכים מאוד, ממעלה - 60 עד מעלה 0 50 יגללו כל מיני תבואה הנודעים, תפוחי אדמה (ערדעפפעל) ופירות ען אבסט, פשתן, קנבוס (האנף) ועלי תבערה (ברען האלץ) ממעלה 0 ב עד מעלה 0 מ יגדלו כוסמים, אורז, מאיים (טירקישע ווייטצען) כרכום (זאפראן) ושרי, עץ היותר מתוקים וערבים לחיך כעכבים, ותותים (מוילבעערען) ועלי טאבאק, ממעלה 8 מ עד 9 ל יגדלו קני לוקקער ולמר גפן ממעלה 0 ל עד מעלה 0 א אשר שם האקלים חם מאוד יגדלו תפוחי אנאנאס, באנאנאס קאקאס ניססע, תמרים פיזאנג, פרי לחם (בראדפרוכט) בשמים, קאפעע קאקאא, וואכילא אסטיס (אינדיגא) שרפי עץ יקרים (דיא עדעלסטען האללע) ועלים נחמדים למראה. ג. חייתי שדה ושאר בע״ח. במדינות הקרות מאוד לא ימלאו חיות נחמדות למראה, גם לא הרבה משאר חיות כמו בארצות החמות, ויש מהן אשר יוכלו לחיות בכל המקומות על פכי הארץ אף כי שונים המה בבחינת החום שלהם, וקלתן אינן יכולות לחיות כי אם באותן הארצות אשר החום שלהם הוא כמו שצריך לגידולם ולקיומם שם. כי ממעלה 0ע עד מעלה 0 ס יוכלו לחיות שם מהולכי על ארבע רק הדוב הלבן, השועל (דער פאלאר אדער שטיין פוקס) הלעמאנג מין השור הנקרא מוסקום אכסע, ובעמאריקא הוואללראס ודב קשים ממעלה 8 ס עד מעלה 0 ב גדלים אלה המכוסה בקו החיות, דער לאבעל, דער פלוס אטטער, דער ביבער דער פיעלפראס, דער מארדער, אונד לוקס, דאס עלענטהיר דאס מורמעלטהיער, דאס ביזאם טהיר, אוכד דער האמיטער. ממעלה 0 ב' עד מעלה 0 מ יחיו שמה דער שפרינג האזע, דער דאמהירש, דאס קאמעל, דיא געמזע, דער שאקאל, דיא היאנע, ובאמעריקא דער ביסאן אונד דער בוקעל אכסע וממעלה 0 מ עד מעלה, א גדלים בארצות התבל הישכה הכ״ל, הכוי דער ביפעל, דאס שטאכעלשויין, דער פאוויאן שהוא מין קוף אייכע ארנו אפפע, דער גיראפפע דער קאמעעלפאנ דער באהירוססא, דער רהיפאצערס הפיל, האריה, והנמר דער פאנטהער דיא ליבעטקאטלע, דאס כילפפערד, ובתבל הנודעת לנו רק מקרוב דער טאפיר, דער זאנואר דאס ללאמא ריא וויקינא, דיא מעער קאטלע, דער אמייזענבעער, דער ארמאדילל, דאס ביזאמשוויין ך גם מעון ככף (פאס געפפליעגעל) יש קצת מינים הנמצאים בכל הארצות, הלא הם האות ובר אוזא, התרנגול הבייתי (דער הויזהאן) דיא האללטויבע, דיא ראבענקראהע דער קאלקראבע, דיא פעלדלערכע, דער שפערלינג, אבל קצתם יחיו רק באקלים הנאות להם, ד""מ ממעלה 0 ע עד מעלה 0 ם תרנגול השלג, האוז האדום, דער איידערפאגעל דער שוואן. ממעלה ים עד 0 3 דער לאממער גייער דער איזפאגעל, דער קראניק. דער שטראך, דיא קראהע דיא דאהלע, דער קראמעטספאגעל, דיא דראססעל, פיכקע, אונד נאכטיגאל, דער אויערהאן תרנגול הבר, דער רעפפהון דיא טראפפע, ממעלה ב עד מדער פאזאן, פפויא, ערוטהאן, דער ארטאלאן אונד אלבאטראס ממעלה מ' עד מעלה א דער שטרויס, באפריקא דער קאוואר, בהודו דעל פאפאגייא פאראדיעס פאגעל, טראביק פאגעל, גאלרפאזאן באמעריקא דער אמעריקאנישער שטרויס, דער גייער קאניג דער קאליברי דיא פעטט גאנז, ובאיסעל דע פראנצע דער חיים יוסף פאללאק אוניאן, אונד איבים"
021-HZT-1874-09-18-001_Ar_toc_17,מכתבי הנעורים. *)," מכתבי הנעורים. *) (בריעפע אוים מיינער יוגענד) ממני חיים יוסף פאללאק: מכתב א'. לרעי המנוח החכם היקר והמושלם כ""ק ק אפל לעמבערגער ע״ה בן התורני המפואר בפי כל, החכם ותשוע מו״ה אברהם הירש לבוב ז״ל בק""ק פרעסבורג. ידעתי אחי גם ידעתי כי אף שהבטחתכי אתמול בלכתכו יחד לשוח על שפת נהר דאנויא לקרוא לאסירים דרור להוציא ממסגר לבך רעיוניך הזכים ולשלחם לי כתובים על ספר, בכל זאת כעבור רגע חלף רוחך וחדלת מעשות זאת, על כן אמרתי: ברזל בברזל ילוטש ופיך בפי יפותח, כי כמטמוכים אשר יסכרו במעבה האדמה, רגל איש כבון דבר כי תעבור עליה יחפור אחריהם ויעלאם, גם פניכים בקרקע הים תהומות יכסיומו אבל משם יד השוחה תקחמו. כן גם רעיוני חכמה אף כי כמים עמוקים במקור לבך התחבאו, אני אדלם תעלומים אוליא לאור, כי את אשר ממני תראה כן תעשה גם אתה, על כן אליג פה לפכך הבות לבי על שקט הליל והמרגוע הפרוש בו על כל יושבי תבל. הכה החושך יכסה עתה פכי תבל, גם אור הכוכבים כהה מהגיה אפלתה, הדומיה שוררת מסביב כחה שקטה כל הארץ והיושבים עליה ירגעו, רוח סועה וסער לא ישמע עוד גם גלי הים ומשבריו יחשו, שאון חייתו יער וזאיבי ערב חדל, גם רגשת פועלי און הוקמה לדעמה, מה כעמת ליל! כגן עדן משכן הנפשות נדמה התבל בעת אשר תמשול, אבל  אם גת תחת שבטך קול נוגש לא ישמע גם קול התור הכעים ידום, אם דמעות העשוקים לא אראה עוד, הלוא גם משוש האריקים כסתר מעיני על כן אמרתי: הנך חסר השלימות ובכל יצורי תבל אין בך מתום (קיינע פאללקאמ, ענהייט) אך שם בעדן גן אלקים מקום המרגעה לבד ורק שם כנוח וכל יקר חבאה עינכו. גם איזה שיבים קטנים הנה הכם לפניך. עורי בת שירתי עד אנה תדומי? א. מסוה הבושה הסירי משפל הרומי חבל המשוררים ראי מכל סביבותיך אלה להתפאר כנורם יעירו. ואלה במחיר למלך ישרים ישירו ואת בטמון הלעולם תחבוש פניך? *) יען כי נדפסו כבר במ״ע „נוגה הירח"" חוברת ב׳ ג׳ ד׳ וה׳ שגיאות רבות בעבור כי הרב החכם המו""ל לא הי' בעת ובמקום הדפיס ג״כ תקנתים להדפיסם שנית פה, אם יראה לזאת:.. המו""ל כ""י עיני במשוררים כי תצפינה כמעט מזהרם הלוא תכהינה אבל תוכם ראיתי בהובם השקפתי אך מרמה בפיהם כזב יתאמרו""   לשינם יחליקון אך שוא ידברו ומעדי מליצותם את קלונם השפתי   לאיש זך הרעיון וכבד לשון. הן לחשוב מחשבות מאוד גדלת   אבל לדבר צחות חדול הדלת ד לו כתפוה זהב בתרשיש ממולא א. אך רעיוניך באומר נעים תמלל מה מאוד ממך הן היה להלל  : מפז תבחר בשוהם לא תסולה על מאמר חכמינו ז״ל „גלגל חוזר בעולם"" וסמכוהו על מאה״כ (דברים ט״ו י) „כי בגלל הדבר הזה״ מה תשתוחחי נפשי על רעות פגעוך? ומה תתהללי אם טובות השיגוך? א הלא תחת מסבות הזמן מתהפכות גם שתיהן . גם רעות גם טובות רגע יעבור ואיניהן. ה. על סכלות קלת מבני אדם אשר הם חסדי דעת ותבוכה אף כי הם יושבים ראשונה על פי מה שיסופר בדברי אימים למלכי מצרים ושריה, וקראתי השיר הקטן הזה בשם „דברי המלך אמאזים אל לבו״. „שרי צוען איך נואלו „הלכו אחרי ההבל ויהבלו „כי זה דרכם למו כסל „לסיר רחצי שמתיו לפסל „סגרו וישתהיו וברכם כרעו „אף, כי מקורו נבזה הם ראו „אבל אותי מאסו ממלוך עלימו. „על כי משפל דרכתי על במותימו. על התקוה בדרך מליצה ובדרך שיר. טוב קוות לאיש נגוע כגשם על גן זרוע דאנה בלב איש כי תשחהו תקוה טובה תשוב תחייהו מה נעים שבטך תקוה באדם כי תמשולי  דל תעשירי חלש הגבירי בו כי תחולי עמך אשחק לפחד כי תשיתהו רבל אבל בלעדיך תוהו הארץ ציה התבל.  המשך יבא אי""ה *) במלמר החכם „מיטיב השיר כוזבו״"
021-HZT-1874-09-18-001_Ar_toc_18,"י דל
רייי ישמח ל - אנוש
13", י דל רייי ישמח ל - אנוש 13  קראתי בספרים יקראו כתובים״ ל היין ישמח את לבבות העצרבים״. אמת הדברים כי כן בעיני ראיתי שתיתי ואשמח עת נעצב הייתי עת נעצב הייתי היין שמחני בוז אמרתי לפיד אותי קראני     כאלים רקדתי חלות במחולות  מדי שתותי מצותי דם האשכולות. : כדם האשכולות ראיתי הרבה דברים א וקים בערים בכפרים וצות בי  בב אנוש משמחים כל עצב יחבשו  יודישו דאגה מלב כאב יכבשו פה עני וכואב צועה בחמת רוח תחת עול סבלו נפשו תשוה אם באמרי נחומים אליו תשוחח כמו ביין אל פיו כן לבו תשמח שם אשה כשית לא תאר לא פנים חשך כשחור תארה על פניה עננים אם בפניה תכזב תאמר כי יפה הן אז תעט השמחה כמו מעטפה שם מחבר עני בדעת וחסר שכל  ידבר תועה על אדני וקודש יחל אם לשקרו תתמכר חכם תכנהו משמחה וגיל אז תאור עינהו שם עשיר אכזרי אויל וגאה לא יחמול על אח לא יחמול על אם חלקות תצמיד ונדיב תכנה אותו היא שמחתו לנפשו וחרות משושו אני באמרי נחומים לעני אשוחה במעט יין אל פיו לבו אשמח ולעני בדעת ואשר תועה ידבר הכם לא אבנה לא אקרא מחבר. גם לעשיר אכזרי אויל וגאה לא יחמול על אח לא יחמול על רעה לא אצמיד חלקות נדיב לא אבנהו גם אם יתקצף ועלי יחר אפיהו לאשה כשית לה אין תאר לא פנים דשך כשחור תארה ועל פניה עננים לא אומר כי יפה לא אתניף אשקר כי בין שהורה ליפה לא אובה אבקר.  היופי לנשים כמו לסוסיה התורים או בחרוזי פנינים על צואר המורים מתג ורסן עדים את פיהם לבלום  ומחסום לפי אשה לבל תדבר חלום  בעריש גאלדע ערג מנוארנאפאל. .
