article_id,headline,text
021-HZT-1874-08-14-001_Ar_toc_13,על דבר האמונה*)," על דבר האמונה*) אם מצוקי האמונה מאבני הפהיליזאפהיע נחלבו, אז היכל האמונה בכוי הוא לתלפיות, ואף כי ראשו מגיע השמימה. מולק הנהו תחתיו, כלו יפה אף כעים, דגול מרבבה. סופה וסערה בל ירופפו עמודיו, רוחי הספיקות אם יכשבו מבלי יביעוהו ממקומו; אמוכה עם פהיליזאפהיע מבלי עוד אמונה, תקרא אך ידיעה (ZBiBen) אבל אי אפשר לידע דבר מבלי להתחקות על שרשיה מוצאיה לחקור ולהגות בה. ולכן כל איש אשר מעט רוח בו, ועוד לא נפל בחיק נכריה להתעלס באהבים עם לשת שאבדנן היא הכפירה, אשר ככפירה תטרוף *) כתבתי זאת בהיותי בירושלים בשנת תרכ""ט לפ""ק. ותשדד לשד חיי אדם עלי אדמות. האיש אשר לא פנה עוד מדרך הישר מחויב לחקור וללמוד בכח שכלו בחקירה עיונית עד שיבא אל הידיעה למען לשאול את עלמו מי אבכי? מדוע נקראתי ולמה? לא כל איש שואל את עלמו ככה. מתי מעט המה האנשים אשר רוח מבינתם תורם לבקש תכלית החיים, ומבשרם יחזו מפלאות אל פלא, הלא כל האדם ישאף להון רב ומטמוכים, יעמלו יגעו, גם בלילה בל ישנו, למען צבור כעפר כסף, וגם בהקיץ חולמים המה להם, ובל יחפצו לדעת מה חייהם? מה תכליתם? אך ישתחו למזל, ויסגרו לגד, ולתאות העפריות, יאמרו אלה המה אלהיך בני תמותה! לו חכמו ישכילו זאת, בינו מטרת החיים ופעולתו ואחריתם מה! כי לא למלא ההכרחיור הגשמיות אשר הולידו בנו העת והמקום, בית האב ומשפחה, זאת תכלית החיים, תכלית ימינו ושנותינו גם יחד, וכאשר יחקורו להבין חלקם בחיים אז בכח החקירה יחפשו גם להתיר שאלות הנסתרות תחת תכלית החיים אשר כמו כד כלבו, וכאבכי נגף הנה בכל מסלות האמונה, כי אין דבר זר וככר אשר יתנכר לחכמת המיהלאזאפיהע אשר בכל מסחרי הטבע תבעה מצפונים, ובכל מחשבים תפיץ אור נגה, יותר משלילת הידיעה. כי איככה יוכל האדם לבחר לו דרך שה בחלד אשר אם בו ילך ירצו פעליו לפני אלהים ואנשים, יאיככה יוכל ליקח לו קו ומשקלת כה לחיות, זאת לעשות, וכה להתנהג במשפטו או בצדק עם אחיו בני אדם, אם עוד בל ידע מי הוא ואכשי חבורתו? מדוע יחיו כלם בחבורה ? ומה תכלית מעשה הכלל ? הלא זאת תראיכו לדעת כי מחויב האדם באשר הוא אדם לילך בכח שכלו על פני שדה החקירה אף אם מלאה מעקשים לנים ופחים, ולבל לרפות עד אשר יבין מה הוא האדם, במה פעולתו פה בחיים! - אך מה מאוד כבד הדבר הזה ורחוק ממנו לבוא במעט הרוח אשר בכו, אל שלימות האמונה הפיהליזאעות, להבין ולהכיר עולם ויצורים, סבה ראשונה וכוחותיה. איככה נעפיל לבוא בפתחי היכל החקירה הזאת אשר מעלותיה בעו גם בדו מיצנו? רבו מאד התועים והמתעים, השוגים וושגיר. לא הרי אפיקור כהרי אריסטו וחביריו, ולא הרי שפיכאזע כהרי וואלטער ורחססא, ואם נלמד בספריהם, הלא חסרון לא יוכל להמכות יכל להלמח מזה, כי כאשר נבאה אל משפטים (זאטצע) שלמים אשר כל כביכם, וכעמול אנמנו לחפש שמה ענין או מחשבה מה, וכאשר ואשר לכו תבוכה למצא את משרין האמיתי של הדברים, כשמח גם מיל פשר כזב ומתעתע כמוצא שלל רב אשר ע״י נשליכה ממכו את לעיף האמונה כנתקה מוסרות יראת העוכש, כי תחת שביכי הידיעה אך חרשי אדמה לא יועילו נמצא. ואז נתקלף חלילה באלוה ונקלל באמונחינו, וממקור משחת הזה. רצוני מעשתני כזב (פאלשיג היפאטעזען) יצאו מים הרעים מיכות ובעירה, רבים שתו בצמא את דבריהם ויצאו לחרפה ולדראון עולם. ולכן תצוה החכמה לבל ילווד אדם דבר הקשה ממנו בטרם, למד דבר הקל, כי אם יתהלך באמונה לאט לאט מקל אל הכבד אז בל יתנגפו רגליו וילך לבטח דרכו, ולזאת הזהירו חז""ל לבל ללמוד מעשה לראשית יומרכבה (כי זאת היא חקירה האלהית) עד שיהיה בא בימים שתול על פלגי האמונה, ולמד כל הדברים הצריכים לזה קודם. כי אם וצא איש ממחשבים, ועיניו אך באפילה זיון רב ראו חשך, והנה כי ביט אל אור הלהרים תבהיכה עיניו מראות, ויהיה מכה סבורים, כן הדבר הזה; כי קרני שמש הפיהלזאמיהע יפילו אור בהיר כוללים מיפעת אלוה, ולא כל עיץ בשר תרהיב עוז להביט בפניהם. וכאשר אמרכו בי אך אם יתנהל לאטו, לרגל האמונה אז גם על פסגת החקירה על הררי עד הפיהלאזאפיהע יעלה. לא כן אם יעזוב משענת האמונה וידלג יקפץ בלי משעכת אז עוד אל חצי המסגה לא בא. והנה יפול הנופל ועד מהרה ימטו פעמנו מאמונה ויראת ה׳, וכמו בכל דבר חבווה אם אך יצעד מעלות מעלות בחכמה אז אשרי וטוב לו כי יבא אל תכלית השלימות. לא כן אם ידלג ממעלה למעלה אז לשוא יעמול בדי ריק עלבונו. המשך יבא אי""ה."
021-HZT-1874-08-14-001_Ad_toc_14,, שנה רביעית גליון 42
021-HZT-1874-08-14-001_Ar_toc_15,דברים אחדים.," דברים אחדים. מאת בעריש גאלדענבערג מטארנאפאל.  המשך מגליון 41 מתוכן דברינו למעלה נראה א״כ שהמושגים כן ובסיס, מטה משען, לחם ומזון, כלי כתישה הכאה וחקיקה, והפעלים המכתעפים מהם, היו לאחדים בלשון. וזאת נחפש לבאר בבאור הברשים השייכים לזה. בהקדים שלא בכל שורש ושורש לריך שנחפש התאחדות בו כל המושגים ההם, כי לפעמים יחכרו חחים אחדים בשלשלת הזאת, ואולי ימצאו החחים החסרים אצלנו בשפות אחרות תהיינה שמיות או אריות כפי שעתנו. *)   ""ה. שק שקק שק שק. עיקר הנחת זה השורש על הרגל ותכן מזה שוק על ירך שוק על מקום הליכת הרגל של הרבה בני אדם, או כמן *) פה אמלא מקום להשיב לידידי החכם המשכיל הר""ר ישעיה גע לבהויז נ״י כי גם אנכי יודע כי צורות שפות השמיות מהאריות שונות, הנה זו מזו. אולם בכ״ז דעתי כי חומרם ר״ל השרשים הקדומים משותפים לשתי סוגי הלשונות השתים באשר ממקור אחד נגזרו שפה קדומה לא  שכתבתי כבר שהעיר היתה כחלקת לג' חלקים כג' חלקי הגוף בבעח״י חלק השער היה נקרא ראש העיר. שאו שערים ראשיכם בלרוף שעל השער עשו להם ראש מצויר בעינים לליור ההשקפה כמו שהראו בהמגיד מש""ז כומ' 21 אחר ראש העיר היה רחוב העיר והוא החלק הרחב ברחבי הגוף בבעח״י ואחרי הכחיב היה השוק מגוף הבעח״י ובהשאלה על העירה ממושג הכן והרגל הועתק אח״כ לפעולת הרגל התלים והתועה והזלה שהיא תולדת התנועה מזה ישתקשקו בכחובות ישוקו ברחובות, השתוקק תשוקה על התאוה אל דבר שנמלץ בלשון ברילה אל הדבר שהוא עלם התשוקה. כאשר היו דברינו למעלה אלל תאוה. בצרוף למה שכתבתי בנגה הירת חו״ב ד""ה, ש״ר שהתשוקה הוא תאוה חווורית אשה לאיש ולוקח הציור מן השוק כעין שאמרו אין אשה מתקנאת אלא בירך חברתה, שקה. השקה על ההזלה והנג רה או הסבת הנגירה אל תוך בעח״י. בשוק על הנגיעה וקרבות שני דברים זה לזה (קיססען, בעריהרען) כי הקורבה עלוירת בנגיעת שני האישים המתקרבים ברגליהם זה אלל זה וכן צירו להם היונים, בצרוף למה שהרגל מצייר המקום שהרגל מתקומם בו, וראשית הקורבה היא הקורבה במקום שממנו הושאלה הקורבה במובן רוחני על הקורבה ביחס או נודעת לכו. ואי""ה בהרחיב ה׳ את גבולי אקח לי פנאי לחבר חבור מיוחד בענין השתוות שרשי לשוננו עם שרשי שאר השפות הנודעות לי, עכ״ה   בזמן. בן משק ביתי, על פיך ישק כל עמי, על המזון והשאר והכלכול בו כי הלחם נעשה בדמות רגל או משען שהוא רגל מלאכותו, כאמור למעלה. וכגזר עוד מזה השורש עשק דריקען כי מושג העלירה כגזר מרגל ע״ש שהדריכה בו ודריכה ועצירה לאחדים בלשון. (שטאמפפען. דריקען פרעססען ינד פאס פוסע אבגעלייטעטע בעגריפסע) הנכלל עוד בשורש בשק, איך נגזר הוא ממושג הרגל עיין למטה אצל  המשך יבא אי""ה כהָה. .  „הערות והארות המשך מגליון 41 בחו״ב ג׳ לר 11. „והכלפע״ד דהכה באמת קשה על הן רטמאו כל השמנים. והרי משכה מפורשת בעדיות דמשקה בי מטבחיא דכן וכו״ לפע״ד נראה ליישב קושיא זו בדרך נכון עפ""י ש""ס ע״ז רכ״ב ע""א, גבי הא דאיבעי לן כלים ששימשו בבית ח מהו שישתמשו בבהמ״ק וכו' עד אר""פ שאני התם רכתי' ובאו בה פרילים וחללוה. ופי׳ רש״י ז""ל מכיוון שנכנסו נכרים להיכל ילאו כליו לחולין וכו׳ יעוי״ש היוב. וא״ב כאן מכיוון שנכנסו הנכרים להיכל לא הוי שוב בי מטבתייא כיון שהכלים נכנסו לחולין ולק״ט. ומדי דברי בסיגיי׳ הנ״ל, אכבד את הקוראי הנכבדי בדבר כחוד שחדשתי שם בדברי מאורינו רש״י ז""ל, שם בר״ה כיתבריכהו פי׳ רש״י ע״י נכרי כדי לבטלן, הנה כוונת רש״י ז״ל, דושראל אסור לבטל ע״א של נכרי, אולם לכאור' יקשה ראינו אלא כדבר בבואה ערש״י ז״ל להוציא הלשון כיתברינהו דמשמע מעלמו מפשטותי'? ואולי ס""ל ר""פ כאביי לעיל דמ""ב ע""א דישרא' יכול לבטל עיי""ש היטיב? לכן הסכת ושמע קורא אהוב! ותראה איך עיכי רש״י ז""ל לופיות תמיד למרחוק, ואין דבר כעלם ממנו, להכה עיל דמ""ז ע""א אית בש""ס כי אתא רב דימי אמר באשירה שבכולה קמיבעי לי׳ וכו' עד דר""פ גופא מיבעי לי׳ מפשט פשיטל לי' וכו' עיי״ש היטב, ובתוס׳ ד״ה אשירה הקשו דליפשוט דאין דיחוי מההיא דהדס וכו׳, ות רלו ראשירה אין בידו לבול, לע״י ככרי צריך לבול, ולא דמי להדס דבידו למעט, א״כ מההכרח לומר דר״פ ס״ל כרבא דישראל אסור לבטל דאל״כ קושי׳ התוס' כמו כד בלבה. ולזאת ההכרח לרש״י ז""ל לפרש ניתבריכהו ע״י נכרי  המשך יבא אי״ה"
021-HZT-1874-08-14-001_Ar_toc_16,"ooooos-—
חזות קשה."," ooooos-— חזות קשה. מאת בעריש גאלדענבערג, רְאִיתִי עץ גָּבוּה נַחַמֵד מראָהו שתול על יוכל לֹא יָבּוֹל עֲלָהוּ וְהִנֵּה בֵּא רוּחַ קְדִים וַיְסַעַר בַּחַמָה ויִקְלֵעַ העץ בְּנוּ אַבן במר מה 2 רָאִיתִי סוחרים גּדוֹלִים בְּנַעֲנִים כְּבוּדים רַקמֶת צבעִים לבושם בזהב אַפּוּדים וְהִנֵּה בֵּא „הַקְרָאַךְ וְבַשְׁבָט עֲבָרָתוֹ הַכָּם חרם לקח מהם עֲמֻדְתוֹ 3 רָאִיתִּי מֵשׁ ע בְּעוֺת דמְיוֹנוּ כִּי רָאָה וּכְבַד תַּלוים לוֹ עַל בְּרוֹנו וכָּל אִישׁ אֲשֶׁר יַעֲבוֹר עַל עֲבָר פְּנָיו יאמר: הֵן דבר אֱמֶת אליך גנב. 4 רָאִיתִּי אִישׁ מִתְהוֹלֵל מִשְהַנֵעַ קֹרֹא יָצָרֵחַ בְּקוֹל לִבָּל אֵדַם פּוֹגֵעַ אלהים אֲנִי רוח קוֹדֵשׁ בִי נָאֱמֶת ואיש ואיש לו ראש יַנַעַגֵעַ יאמר: אמת! 5 רָאִיתִּי אִישׁ סַכָּל צָעָה בּרב כַּח קִים לֹא יָדַעַ בַּחַ  בחוצות כִּי וָאֱמֶר הַלֵּא חוֹקֵר אֲנִי חַכָּם כַּשָׁלְמָה וכָּל אִישׁ בּוֹ פּוֹגֵעַ יִפְתּד- לוֹ כַּחֲָלוֹמו 6 רָאִיתִּי סוּסִים גּדוֹלִים הוֹלָכִי רומה . לשוט רוֹכֵב סוַעֲרִים וְצָבִים כַּחוֹמָה רְבָּבָה וְהִנֵּה נַעַד קָטָן נָה הסוסים הַגַּדוֹלִים כַּחוֹמָה נִשְׁנָרָה . . ד לאַיִתִּי אַנּדָה בְּקִרְיָה מִיּוֹסֵדַת עַל חַקִים נכוֹנִים הַ ן עומדת וְהִנֵּה לָה יֵד קְטְנָה יֵד הַכּוֹתֶבֶת וְהִיּא — לְבָזָה נִפֵּשׁ אִישׁ כַּחַתֵּף אוֹרֶכֶת 8 ראִיתִּי שְׁנֵי אָרַיִם גּדוֹלִים וְחֲלוּדים יְלָכו יִתְרוּעְעו כָּמוּ אַחִים צמוּדִים וְהִנֵּה בֵּא הַחֲמוֹר וַיְפַתַּח פָּיוּ בָּרְנָה וַיָּאמְרוּ הָאָרָיִים; אַתָּה אִישׁ בִּינָה 9 רָאִיתִי עַץ גָּבוּה שׁוֹרֵשׁ בָּאַדְמָה וְקְנִים דַקִים יַכְתִּירוּ גַזְעוּ בַּחוֹמָה הַקְנִים הַדְקִים אֱמֶרוּ גַדָלֵנוּ וְתָּה מִשְׁלְנוּ וְהֵעָץ הַנָּבוֹה   10 .  רָאַיְתִּי נַעַר חסד לֵב וְדַעַת יזו ימין לשמאל אֵין נִפְשׁוֹ יוֹדַעַת 2 ר עם חַכָּם אדוֹן הַהַשׂכָּלָה יאמר גַּם אֲנִי כָּמוהוּ אֶשֶׁכָלָה . א המסך יבא אי״ה.    ."
