article_id,headline,text
021-HZT-1882-07-28-001_Ad_toc_1,, שנת שתים עשרה  איש אשר לא משארי אשר לא יסוד המימי הוא לעיר ועיני האיש אשר אני עמי אשר יא מחירו לשנה בארץ טירקיי 4 מאג'ירי כסף. באסטרייךְ 8 פלארין. בצרפת 20 פראנק. בבריטניא ואמעריקא לירא סטערלינג. ברוסיא 6 רו״כ החפץ להודיע דבר מה לטובתו עליו לשלם בעד כל שורה גרוש וחצי.
021-HZT-1882-07-28-001_Ad_toc_2,, מ״ע יז״ל בכל שבוע יבשר וישמיע כל דבר הדרוש לחפץ לבב איש יהודי. .  מאת שר - - הדר- * י . .3: ישראל פרוס-
021-HZT-1882-07-28-001_Ad_toc_3,," על הר גבוה עלי לך מבשרת ציון; הרימי בכח קולך מבשרת ירושלם, הרימי אל תיראי. : (ישעיה מ׳ מ')"
021-HZT-1882-07-28-001_Ar_toc_4,".•י . • ... - . , .. v, . » : *י t. ;-־ ...", תוכן הענינים. מחשבה בעצה תכון. היהודים בבאלטא. קציר. וארונטום או ליאונטוס. לקורות קיוסטנדשא. קאנסטאנטינאפיל חדשות לב״י. מודעה. 
021-HZT-1882-07-28-001_Ar_toc_5,"למר⸗
מחשבה בעצו, תכון."," למר⸗ מחשבה בעצו, תכון. ודש. כבוד חתני הנכבד היקר באדם בן יהודא. . הרבה דברת יקירי במ״ע בדבר תחית שפת עברית, וכל תך וחפצך להקימה משפלותה ולעשותה ללשון מדברת, והקדשת עתותיך לזה בתחבולות שונות להבקיענה, ועליך יכולים לאמר כי כונתך רצויה אבל מעשיך אינם רצוים. והגם שאוהב אנכי את השפה אהבה בלי מצרים, בכל זאת לא יכולתי לכחד מתחת לשוני ולהגיד לך דעתי בזה. — אם נחקור אחרי הסכה אשר בעבורה יחפוץ האדם הישראלי להחיות את שפתו נמצא כי סבות שונות בה. א) מפני שהיא שפה קדומה ועתיקה, וע״כ לה משפט הבכורה לחלק לה כבוד ולתת לה מהלכים בקרב הארץ. ב) מפני שחכמינו עמודי העולם גם אחרי חורבן בית קדשינו ואחרי אבדן כל מחמדינו היקירוה וקדשוה וחברו בה ספרים הרבה אין קץ והרחיבוה, וא״כ אין לנו לזוז מאבותינו ומחכמינו ומחויבים אנחנו לבקש תחבולות ללכת בדרכי חכמינו הישנים  ובעקבותיהם ולהחזיר העטרה ליושנה. ג) מפני קדושתה, שעל כן נקראת לשון הקדש, ולכן מהראוי . להקדישה ומעלין בקדש ולא מורידין. ד) מפני היתרון הנמצא בה נגד שפות האחרות בקיצור לשונה ובנועם כינויה, ה) מפני קלות הדבר, כי נקל מאד להרימה משפלותה אם אך נאות לפי דעתך להתרגל ולדבר בה איש את רעהו, ומדוע לא? ואז מעט מעט בתקופות איזה שנים תחי מחליה. ו) מפני חביבותה הטבעית שחביבה היא על ישראל, כעל הירא והמשכיל כעל המאמין והכופר, כלם כאחד כפתחם את התנ״ך ישישו לקראתו ויתענגו על הדרו ויפיו, זה חוזה בו מחזה שדי, זה ישביע בצחצחות את נפשו מנועם המליצה ומטוב ההגיון וזה ממוסר ולקח המלא על כל גדותיו, מבעד אשגבי השורות יופיע להם אור בחיר ומבין מהרכיו יציץ למו אור. ז) מפני נקיונה מערבוב שפות אחרות, והוא אות ומופת שמובחרת היא מכל הלשונות וקדומה להם. ח) מפני שתורתינו נתנה לנו בשפתה ונביאנו חזו בה, וכל החקים והמשפטים וקורות ימי עולם יכתבו בה, ואנחנו מקבלי התורה עלינו להחזיק בה והיינו אמה ולשונה עמה ככל אמה ולשון. ועתה נלכה לתור ולדרוש אחת לאחת ונלך מחיל אל חיל. א) מי יודע אם שפה קדומה היא? עפ״י דעות המשכילים שאלפי אלפי שנים העולם עומד ולא רק שתי אלפי שנים, שגם איזה מהמקובלים הודו לזה, כמו מאמר ספר התמונה שהובא ג״כ בספר שערי גן עדן פתח א׳ דרך ב׳, וכדאיתא בספר שערי אורה להמקובל ר״י ניקטליא, ובמאור עינים לר״ע מהאדומים, ובדרוש אור החיים להגאון ר׳ ישראל ליפשיץ, שלפי דעתו גם האדם הוא פה פעם ב׳ אחרי היותו כבר בעולם הקדום שהיה לפני זה העולם, וז״ל שם „מכל האמור נראה ברור שכל מה שמסרו לנו המקובלים זה כמה מאות שנים שכבר היה העולם פעם אחד ונחרב וחזר ונתקומם זה ארבע פעמים כו' הכל התברר עכשיו בזמנינו באמת וצדק כו' השגיחו על הב הגדולה שעמה מתחלת התורה והשקיפו על הד׳ תגין שעליה. ונמסר לנו מהמקובלים שהד׳ תגין מרמזין שכבר ישנו העולם פה הפעם הד׳ עם כל צבאיה, והב׳ הגדולה תודיענו שהגדול שפיצירה הוא נפש האדם השכלי שכבר ישנו פה פעם ב׳, ולפענ״ד שאותן הבני אדם שהיו בעולם הקדום שנקראים פראאדעמיטין, ר״ל הבני אדם שהיו בעולם קודם בריאת האדם הראשון העכשוי, הן הן התתקע״ד דורות שנזכרו בשבת (דפ״ח) והגיגה (די״ד) שהיו נבראים קודם בריאת האדם העתיי, ע״כ, וא״כ האשמה לא גדולה אם נאמין שהעולם עומד יותר מהתרמ״ב כי יותר מגוגה להאמין שנהרב ושב ונהרב וחוזר הלילה, כמבואר במורה ה״כ פ׳ ל׳. ובפרט שבאו לנו מופתים חותכים שאין החי יכול להכהישם, שעברו על העולם הזה אלפי אלפים שנים, ולפי״ז יכול להיות שהיו שפות אחרות קודמות לה בזמן ואחרי שנשכחו היתה כל הארץ שפה אחת ודברים אחדים. וחכמינו ז״ל יחסו את השפה לאדם הראשון מהתחלת הששת אלפים שנה הידועים לנו ולא קודם, באמרם ויקרא האדם שמות שקרא שם לכל דבר בשמו הנאה לו — וכאן ישאל השואל, איך נקראו הנמצאים ואיך דברו האנשים שהיו כמה עשרות אלפים שנים לפנים, אם שפת עברית נולדה על ברכי אדם הראשון למנין שאנו מונין? — ולוא גם היתה קדומה, הלא גם הנחש ובנות לוט ועשו ופלגשיו דברו בה, וא״כ למה לנו דוקא לקנא קנאתה ונפלינו מכל העם, ויוצאי ירך לוט ועשו עזבוה והשליכוה אחרי ניו ויקחו להם שפות מכל אשר בחדו. החוב מוטל על כל האדם בשוה להפיח רוח חיים בשפה מתה להחיותה, ואנחנו רואים שיש עוד שפות אחרות מתות, ובכל זאת העם כלו אין מקרבין את הנהלאה ואין מחזיקין בנושנות לחדשן ולעשותן ללשון מדברת, ואפי לשון רומית שכל חכמת הרפואה מידה היתה לנו, וספרים למכביר חוברו בה, והרופאים עוד היום כותבים בה שמות התרופית העלים הצמחים המלחים היסודים והאוירים, והעולם א״א להתקים ולעמוד בלעדם אפילו שעה אחת, ובכל זאת לא יקשרו קשר להרימה ולעשותה ללשון מדברת. תפארת החכמה להוד, ורפיו השפה להוד, ובאמת מדוע לנו לתקן על מנת לקלקל ? הן רבוי הלשונות הם רק קלקול ובלבול ואבוד זמן, כי טוב ויפה היה אם היתה שפה אחת שאז בלי שפק הגיע האדם לשלמות יותר גבוה כי למה לו לנער בבית הספר ללמוד קרוא וכתוב שפות שונות ולבלות זמן על לא דבר, אם בתקופת העת ההיא היה יכול ללכת קדימה בשפה אחת ולהשתלם בלמודיות הבאות לו אחר זמן. ועפ״י הדברים האלה אין מתעסקים בתחית המתים, ומשבחים את המתים שכבר מתו מן החיים אשר הם חיים עדנה. ב) ידוע מחכמי התלמוד שלא נתנו יתר שאת ועז ללשון הזה עד שפסקו הלכה למעשה שמותר לקרות ק״ש בכל לשון. יאסמכוה אקרא, שמע בכל לשון שאתה שומע, והעקר אצלם דקדוק הלשון מאיזה לשון שהיא, ומה ק״ש שהיא חובת הישראל,  ום יום לקבל עליו עול מלכות שמים חתירו בשפות לועזות, המימי למוד התורה על אחת כמה וכמה, ולזאת כמה חכמים וגאוני עולם חברו ספרים בלשונות העמים, יונית ערבית שפאניש איטליש רומית אנגלית והאלאנדית כמו שהולך ומונה אותם החכם יב״ל, הלא הם יוסף בן גוריון הכהן, הרמב״ם הרס״ג רבינו בחיי, ר׳ אברהם הספרדי וכו׳ ודבור פרטי ושיחת חולין קל וחומר בן בנו של ק״ו היא שאין יתרון לה מלשונות אחרות. וא״כ נראה ברור שגם הם לא הקדישו ולא העריצו אותה לאמר שרעותיה גרועות ממנה, כי אין יתרון לבעל הלשון, ואפי׳ לפני הקב״ה כל השפות שווין לפניו, ושערי תפילות לא ננעלו אם יתפלל האדם לפניו בכל לשון שהוא, ובעשרת הדברות כשבא לדבר עם ישראל, שהיו מורגלים בשפת מצרית התחיל במלת אנכי שהוא לשון מצרי אנוך, כדאיתא בילקוט דמז רפ""ו. ג) מה שנקרא לשון הקדש, ידוע שלא נקרא כן על שם שהלשון בעצמו הוא קדש, כמו שבאר החכם יב״ל, כי אז היה יושה״ כי לשון שם נקבה היא, רק בעבור ראוי לומר „לשון שהדברים הקדושים נכתבו בלשונה, ופירושה לשון של קדש כמו שנקרא שקל הקדש שקל של קדש, שבשקל עצמו אין שום קדושה מיוחדת, ובפי ההמון נתקבל שהלשון בעצמו קדש, כמו שנקרא כתב רש״י היום בפי כל ישראל, לא שרש״י המציא את הכתב, אמנם בעבור שרש״י היה המורם מעם והנכבד בדורותיו והדפים מחברתו הראשונה הנפלאה בפעם הראשון בכתב זה ע״כ נקרא הכתב על שמו, וכמו כן נקרא לשה״ק בעבור קדושת . הדברים שנכתבו בה. ד) אין יתרון לשפה בכנויה וקצוריה על לשונות האחרות והעד שרואים אנחנו מההעתקות שפעמים רבים אם מעתיקים מאמר מעברית לצרפתית יקרה כמה פעמים ששטח כתובת הצרפתית לא די שאיננה גדולה ורחבה מהעברית אף עוד קצרה ממנה, ומי לא יודע שזה לעומת זה נמצאים בהשפות ולא ראי זה כראי זה, כל שפה עניה במקום אחד ועשירה במקום אחר לעומת מלה אחת עברית המכילה בתוכה כשש או שבע מלות לועזות, כמו „ותתעלף״ „והאכלתיך"" שלבארם אשכנזית צריך לזה כשש או שבע מלות, לעומת זה יש מלה אחת משפה אחרת שצריכים עליה כמה מלות עבריות לפרשה, כמו פראגדעסיסטן ליבעראל, פאנאטיק, וכדומה. ה) כבד מאד מאד הדבר להביאנה בפינו ולדבר בה חפשי, כי כל עוד שהאמהות והשפחות והמניקות לא תדברנה בה צחות; לא יתחנכו הנערים בהשפה, וחנוך לנער עפ״י דרכו אמרו המשלים, וחכמז״ל אמרו שגרסא דינקתא הוא דבר השמור והמתקיים, וההכרח ליסדה בפי עוללים ויונקים, ואם אמניהם ודברו בשגגות ושבושים, יעשו ממנה שזארגאן מבולבלת ומטורפת, ויצא שכרינו בהפסדה. — ולהקימה על תילה בכל דקדוקיה ופרטיה בפי השפחות והמניקות צריך לזה זמן רב, בעבור ההרגל שהורגלו בלשונות אחרות הקלות עליהן להוציא בהן כל מחשבות לבבן באין מפריע, אחרי שיחסרון להם שרשים רבים בלה״ק, ובלשונן שהורגלו בה יש לפניהן די והותר. — כי לא תוכלנה להוציא בלה״ק את התוארים המורים על חבה יתירה שבאות בם אותיות נוספות להקטין או להגדיל ובשפת עברית אין הוראה מיוחדת להם, כמו „פערעלע"" „קלייניטשקער"" יבואו בעברית „טרגלית"" „קטן"" ולחכן ינעם יותר לקוראו פערעלע מן פעריל, קלייניטשקער מן קליינער. והדבר הקטון הזה עיקר גדול מאד בשחת הילדים, כי יוצאים מקרב ולב באהבה עזה הנטועה בטבע האדם ושקול נגד כל התנאים והברית אשר תכרות עמהן ובעת שנפשן תצא בדברן, תפרנה דת וחוק. והוא כמו כח העלעקטרי שאין חכם וגבור בעולם שיכול להחזיק המיתרים ולמשול ברוחו לבלתי יסכל בתנועות זרות אשר הנפש תגעל במו ולבלתי יהיה לצחוק ומהתלות בעיני כל רואיו. ו) השפה חביבה היא יען שאיננה שפה מדברת, ואם כלנו יחד הרב הטבח הבורסקי הנקלה האכר והנכבד נדברה בשפת ישעיהו הנביא או בשפת יתר הנביאים אז סרה כל הודה והדרה ותאבד זכותה וחביבותה, עוד היום רואים אנחנו ההפרש בין מ״ע העמים ובין מ״ע העברים, מ״ע העמים אחרי קריאתם המה בכלי אין חפץ בם וקורעים אותם לקרעים לכל תשמישי היל, והם הפקר בצרור כעפר וכקיסם. ומ״ע העברים לעולם שלמים זקימים ומכורכים לרוב, ולא ראיתי מעודי שישתמשו בטו לדבר הכזוי, והוא מהטעם שאמרנו באשר שלא שפתינו היא וע״כ חביבה היא עלינו. ז) בתנ״ך נמצאו ג״כ מלות רבות הידועות ושאינן ידועות לנו מלשונות העמים, כמו והתעמד בו פירש רש״י שהוא מלה פרסית, לטטפת אמרו הכז״ל טט בערבי שתים פת באפריקי שתים, צפנת פענה לדעת איזה מפרשים הוא לשון מצרין פיר הוא מלה פרסית, שמות החדשים העלו מבבל, ומלות שאינ ידועות לנו מהשרשים הבדדים שאין להם חקר במקרא, ויכול להיות שבאו מאיזה לשונות הקדומות, ובא האות והמופתי שבעלי המקרא לא בושו להביא גם מלה זרח בתוך לשונם ולא חשבוה לפיגול נגד קדושת שפתם לפי שאין קדושה מיוחדת להשפה בפני עצמה, וע״כ רבינו הקדש כנה שמות לועזים לאלפי מיני זרעים בסדר המשניות שלו מלשונות העמים, ואין זה פוגם לקדושת תורתינו, ואפשר אם היתה שפת עברית שלמה ולא חסרה כאשר היא עתה אז נמצאו בה בטח מלות זרות אלף . פעמים ככה. ה) ועתה נותרה לנו השאלה השמינית, יען שתורתנו וכל החקים והמשפטים וקורות דברי הימים נתנו בשפת עברית ואולי בעבור זאת מחויבים אנחנו מקבלי התורה לקבלה עלינו לשפה. — והנה מצינו בספרי שהתורה לא נתנה בלה״ק לבד כ״א בד׳ לשונות וקרא הוא דרריש, ה׳ מסיני בא וזרח משעירי"" הופיע מהר פארן ואתא מרבבות קדש, וא״כ מאי חזות לבבר את השפה הזאת על השפות האחרות שבה נתנה? ואם תאמר שלה יתר שאת בעבור הכתב שנכתבה דוקא בכתב זה וכתב אחד פסול, הלא ידוע ג״כ שהכתב הזה לא כתב עברי הוא  אך כתב האשורי, שהחליפו אז את כתב התורה מעברית לאשורית. — ואם באמת חובה היא שהעם יקדיש את שפת המחוקק לדבר בה ולעשותה לשפה, מדוע האלקוראן נשאר E ""  ערבית ובני דתו מדברים תוגרמית, העיואנגעליים סלאוויאנית והעם מדברים רוסית, ואצל הצרפתים הוא רומית והעם מדברים צרפתית?   אמנם כן יקירי! אל תאמר בלבבך שחולק אנכי על הדבר הזה, ואומר שצדק משפטי, חלילה! אנכי באתי רק להוכיח שלא חובה היא אלא רשות, ושלא הכרחית היא, לא על השפה לבדה יהיה הלאם, ולא תרום ולא תגביה קרנינו על ידה בין העמים אשר אנחנו יושבים ביניהם. איוואן וסטיעפאן ישחקו מן גוט מארגין מן באן שזור ומן צפרא טבא בשוה באין הבדל, ולאשרינו קיום אמתינו דרושות עצות ותחבולות אחרות, ובכל זאת לוא שבה השפה לנו כבימי קדם וכשנים קדמוניות, אז גם אנכי ששתי לקראתה, כי מי לא יחפוץ לחדש נעוריו ולמצוא את אבדתו אשר אבד, ומי לא יאות לעזוב לעני שפה ולשון עלגים ולדבר שפה צחה ונעימה שהיא לשם ולתפארת אשר על ברכיה נולדו שפות רבות? — אך ידוע תדע יקירי כי לא זו הדרך להתנחל בה, ולא באמצעים כאלה אשר נדברה איש את אחיו עברית תפול לנו לחבל, לדעתי היה ראוי שיתאספו יודעי שפת עבר המצוינים בה, ויסכימו יחד לעשות אוצר השרשים חדש למלאות חורבנה ולהוסיף לה כל השמות והפעלים החסרים, ולבור מלשונות אחרות מלות כאלה אשר יתאימו עם לשון עברית שלא יהיה בהם יותר משלש אותיות למען לא יכבד על המבטא בהביאנו אותה לאיזה בנין, ולא ירכיבו אותיות כאלה שלא נמצאות בהגזרות שלפנינו לבלתי יוכרחו להוסיף גזרות שאין הצבור .   ר  יכולים לעמוד בהן, ואז אין כל ספק אצלי שכל היהודים כאיש אחד למדו אותו, וסופרים יסכינו אחרי כן להביא את המלות החדשות בכתובתם אחרי שיתפשט הספר בכל הארץ ויוכל כל אדם לעיין בו בפירושו, וב""ה יש סופרים כאלה האוהבים את שפתם ועמם גם יחד ויודעים לשונות העמים היכולים לקחת את המשא הזאת על שכמם ולא אלמן ישראל, ויותר טוב היה שיתאספי יחד במקום אחד אשר יבחרו להם לשבתם, על שנה או שנתים, כי הדבר הזה יעשה בידי שלשה סופרים ובשנתים ומים ולא יותר, ולמותר לבקש הסכמות מהעולם על הדבר החדש הזה, ודי לנו אם מו״ל המ״ע יסכימו לזה, ועוד איזה סופרים המצויינים בנו, ואין כל תפונה כי הסופרים הנכבדים ה׳ י״ל גארדן ויהלל ולילענבלוים לא יעמדו לה לשטן, והחוט המשולש  הזה דיינו! — 4 שפטו נא סופרי ישראל בשעריכם אם נכונה עצתי אם לא, ואם לא תמצא חן בעיניכם, אבקשה תפילה ותחנונים מכם המבקרים שלא תפלו עלי בחרופים וגדופים על אשר הרהבתי בנפשי עוז להתיצב לפני סופרים אשר קטנם עבה ממתני, ולשפוט אודות השפה אם טובה היא אם לא, ולהמציא עצה חדשה שלא עלה על דעת שום סופר עד היום הזה. שנה יאנאס.  a . 1"
021-HZT-1882-07-28-001_Ad_toc_6,," 0 o                     אשר באור. .  מחיר עלה אחד, פיאסטער וחצי-. המאסף חתומים יקבל עשרה למאד) מכתבים בלתי חפשים ישובו לבעליהם."
021-HZT-1882-07-28-001_Ad_toc_7,," Honte sur la plus haute montagne, messagere de Sion  Bleve ta Voix ayec force enyoyee de Jerusalem1 Heve-lact ne erains rien. SaleKL9."
