article_id,headline,text
021-HZT-1874-09-18-001_Ad_toc_1,," שנה חמישית אפירו לשנה בארץ טירקיי  מאגידי כסף: באסטרייך 3 פלארין; בצרפת 20 פלאנק, בבריטאניא ואמעריקא לירא שטערלינג: בספץ להודע דבר מה לטובתו עליו לשלם בעד כל שולה פלוס וחני. ש: . פ""י:"
021-HZT-1874-09-18-001_Ad_toc_2,,   מ . ו שר וישמיע מע יו״ל ב כל דבר הדרוש לחפץ לבב איש יהודי:  כל שבוע יב מאתי ישראל דוב פרומקין בב
021-HZT-1874-09-18-001_Ad_toc_3,," על הה גבוה עלי לה מבשרת ציון; הרימי בכח קולך מבשרת (ישעיה מ׳ יט) רושלם, הרימי אל תיראי? ז"
021-HZT-1874-09-18-001_Ad_toc_4,," Monte sur le plus haute montagne , messagero de Bion, Elewe ta Vois awec foroe, envoyce de Jerusalerul.  Eleve-la et ne erain rien. eaie NI. 9"
021-HZT-1874-09-18-001_Ad_toc_5,," תוכן הענינים. ע״ל עבודת האדמה ומלאכת יד, חודה וברכה, ליין ברציתבכא דברי בבוים, אזמיר, קאנסטאנטינאפיל, רומעניען, חדשות שונות.   פרחי חבצלת לאוהבי ציון, העדה. מכות ותכונת הארץ, מכתבי הנעורים, היין ישמח לבב אנוש. ל. י"
021-HZT-1874-09-18-001_Ar_toc_6,"א
ל
רן
פו⸗
 א'
-
ע דבר!
בודת האדמה ומאת","  ל רן   א'  ע דבר! בודת האדמה ומאת מאת המו״ל. הנה ימים באים נאום ה׳ וכגש חורש בקולר ודורץ כבים במושך הזרע. והטישו ההרים עקים. וכל הגבעות התמוגגבה; ושבתי את שבות עמי ישראל, ובבו ערים כשמות שו גנות ואכלו וים בו. ונטעו כרמים ושתו את יינם. את שריהם: ונטעתים על אדמהם ולא ינתשו עוד וכ (עמוס ט׳ י״ג י״ד ט״ו) ואר״א כל אדם שאין לו קרקע, אינו אדם, שנאמר והארץ כתן לבני אדם: (במות פ״ג) . לקול צללו שפתי השר היקר והנכבד גאבלער. בדבר עבודה וישוב הארץ; — לקול ענה אחרי דבריו הנעימים נגיד עמנו השר הצדיק סיר משה מונטיפיורי הי״ו ובלהבות אש אהבתו לארצנו הקדושה. הרים בשופר קולו; ויעורר את אוהביו לשום לב אל הרעיון הנכבד הזה: — לקול דברי ראשי וועד „חברת שלוחי הקהלות"" הי״ו, ומחשבותיהם הטובות בדבר המפעל הנשגב הזה, (כאשר הודענו במאמרנו „שלום ירושלם"" בגליונים הקודמים) לקול הדברים האלה התעודדנו גם אנחנו. שמחה עזה התבעשה בקרבנו, ורעיונות שונים הסתערו עלו בחובינו מדי העלותינו על לבבנו זכר הרעיון הקדוש והנשגב הזה, אשר טוב אלפי נפשות ישראל צרור בכנפיו. ובידו עוז להביא עזר וישע להארץ ויושביה, לבנות גדריה הפרוצות, לרפאות שבריה, ולגהות ממנה מזור: — אמנם כן הוא! גדול ונשגב הוא הרעיון הזה, ומכל ורעיוני קדש אשר יתחוללו לפעמים בקרב לבות נדיבי עם ה׳ דורשי ציון ואוהביה לטובת מחבקי אבניה ומחונני עפרה, הכי נכבד הוא! אין כמוהו בכל רעיוני צדקה וחסד אשר חלו גם ילדו גדולי ישראל באש אהבתם לציון ועמה; כי אך הרעיון הזה עוז בידו לבנות ערי יהודה ולקומם חרבותיה, לסקל את כל המכשולים ואבני הנגף אשר על מסילת הצדקה, והיה מעשה הצדקה שלום, ועבודת הצדקה השקט ובטח, עם ה׳ הנדבאים והנענים השרוים בלא קרקע בלא טובה, ואל תמיכת אחיהם עיניהם כלות, ישבו בנוה שלום, ובמשכנות  מבטחים, ומנוחה שאננה תשכון באחליהם. רבים מחוקי ה׳ ומשפטי תורתו תלוים בהרעיון הנכבד הזה, ואליו כוננו חוזי ונביאי האל רבים מהצי יעודיהם; אבותינו ואבות אבותיהם התימרו בכבוד העבודה, וגם אחרי הגלותם בבלה ומארצם נדרו הלכו, הופקדו מאת ה׳ ביד ירמיהו חוזהו לאמר: „נטעו גנות ואכלו את פריהן!״ — גם ימים רבים אחרי חרב בית ה׳ השני, עת החשך כסה ארץ וערפל לאומים, עננה הדת עמל ותלאה שכנה על פני ציון, ירושלם לשמה היתה. ושמה לא נודע בגוים, ישראל הלך בגולה ויפוזר לכל קצות הארץ, גם אז לא חדלו אבותינו מחרוש וזרוע, וישדדו את האדמה אשר הגלו עליה; חכמינו — ז״ל — גם אלה אשר חיו בימי חתימת התלמוד, ימים רבים אחרי גלו ישרא? מעל אדמתם הרבו להלל את המלאכה וביחוד עבודת האדמה (כאמרם ז״ל „כל אדם שאין לו קרקע אינו אדם״ וכו'. זרע ולא תזבון"" וכו׳ „קפוץ וזבין אדעא"", וכהנה רבות) וילהיבו על זה לא אחדל מתת לו תורות מקרב לבי, ואני תפילה, כי יעלה מעלה מעלה, יעלה ויצליח להשכיל להטיב לבני עמנו כחפצו הנשגב וכאות נפשו העדינה, במאמר אחר, בגליוניו האחרונים, יעיר אזן כי״ח בדברים קצרים וסתומים, על אשר לה לעשות לטובת הצלחת מעשיה בתרכיה. שם אאמרו זה: „קוסטאנטינופולי, העירות הסובבות לה, והכי״ח"", תוכן דבריו, „מכתבים רבים יבאו אלינו מהעירות הסובבות אותנו, בם כותביהם חמס יצעקו על אי-סדרים אשר בקהילותיהם לא מצאנו לנכון להדפיסם. יען כי עירנו הבירה עודנה בשפל המדרגה מכל הקהילות, וכל עוד אשר האלליאנס לא תשתדל להקים מכת האחדות הנופלת, ולכלכל הדעות השונות בין ראשי העדה, וחפץ הכתות, לא תצליח במעשיה אתנו"" אלה דבריו ולמכינים ינעם. המשך יבא אי""ה."
021-HZT-1874-09-18-001_Ad_toc_7,," גומר 1 . מחיר עלה, אחד פייאקצטר וחלי המאסף חהועים יקבל עשמה  למאה. כתבים בלתי, ממשיה ישובו לבעליהם: ם . "
021-HZT-1874-09-18-001_Ar_toc_8,אזמיר.," אזמיר. אחינו השר באראן ג׳ מארפורגו, א׳ מראשי חברת הללאיד האוסטרייכי, בטריעסט. עבר בימים האלה דרך אזמיר, וטרם עזב אותה, נדב מכספו אלפים וחמש מאות פראנקס לעזר בית החולים החדש אשר יבנו עדת ישראל שמה."
021-HZT-1874-09-18-001_Ar_toc_9,קאנסטאנטינאפיל.," קאנסטאנטינאפיל. ביום השמנה עשר לירח החולף, יצאה אש בהעיר הבירה ותאכל בתים רבים בשלשה רחובות רחוקות זו מזו, הגראנד וויזיר, ורבים מגדולי שרי הממשלה מהרו אל מקום התבערה, ויחזקו לב חיל הצבא מכבי האש, לעשות באמנה מלאכתם, ואחרי אשר נשרפו כששים בתים גדולים, הצליח חפצם בידם והאש נכבה. חלק המעשר אשר להממשלה הרוממה מתבואות הארץ באדריאנאפאלי ובנותיה, נמכר בימים האלה במחיר תשעים ותשעה מילליאן מאה ושמנים ושנים אלף, שמנה ותשעים פייאסטער לפי חוקי הברית החדשה אשר הוכרתה בין ממשלתנו הרוממה, ובין ממשלת ארצות ברית אמעריקא, יוכלו גם אזרחי אמעריקא לקנות למו בתים ואחוזות בתוגרמה, ואלה מהם אשר אחוזותיהם נכתבו על שם אחר, יוכלו עתה לכתבם על שמם ומהיום עד יום השנים עשר לירח פעברואר 1875 לא ישלמו אך אחד למאה ממחיר האחוזה. ואחרי כן יאלצו לשלם בעד שטר המכר שלשה למאה ככל אלה הקונים בתים ואחוזות בכל ארץ תוגרמה. בית מועצת השכלת העם (מיניסטעריום דעס וויסענשאפט) במרה אומר לייסד בהעיר הבירה „בית למוד שוחרי עתיקות. (ארכעאלאגישעס אינסטיטוט) ארבעה שנים יעברו עדי יכלו התלמידים את למודם בבית הספר הזה. ואחרי כן ישולחו מאת הממשלה לתור את הערים הקדומות ועתיקותיהן."
021-HZT-1874-09-18-001_Ar_toc_10,רומעניען.," רומעניען. פאקשאן „יקר בעיני ה׳ המותה לחסידיו״ לא איש מבשר טוב אנוכי היום, ולבי בחלילים יהמה, ובמסתרים תבכה נפשי אל הלקח מעדת רומניק-סאראט את הרב המאוה״ג מו״ה ר׳ יצחק בלומען, אחר שמשו בכתר הרבנות שמה זה יותר מעשרים שנה, אין מלה בלשוני להביע תהלותיו ופעולותיו וצדקתו אשר הרבה לעשות בעדתו: כל ימיו הקדיש לתורה ולתעודה, ולא חלף עליו רגע בלא תורה ומעשים טובים לו היה באמת לב טוב אשר על זה אמר ר׳ יוחנן „רואה אני את דברי בן ערך מדבריכם וכו׳, מעודו לא ענה לאיש אשר בקש ממנו חסד, עשות זאת לא אוכל!. כי כל אשר היה בידו לעשות עשה, ועוד יותר מכחו: ותמיד היה עוסק בנ״ה בגופו ובממונו, הוא היה אבי יתומים במלא מובן המלה, אהב וכבד וראי ד׳ ויודעי התורה: בן ששים וחמש שנה היה בצאתו מחרון אף העולם הזה, ותהום כל העיר במותו, וברגע בא דילג רב לא״א הרב המאוה״ג אב״ד רפה, לבא לספוד לו ועד מהרה נסע א״א נ״י ויחם לי׳ הספידא ונשא עליו קנה ונהי והי בביה״ס הגדולה דשם שלש שעות רצופות, דברים מעוררים לבב השומעים, כל החניות סגרו ביום ההוא ותספוד לו כל העדה ובכו בכיה גדולה, ד׳ ינחם אותם ואת האלמנה ובניו היתומים בתוך שאר אבילי ציון וימחה דמעה מעל כל פנים . הכותב בדמע. יוסף גאלדרינג כן לא״א הרב אב״ד דפה.."
021-HZT-1874-09-18-001_Ar_toc_11,חדשות שונות.," חדשות שונות. מכה״ע „סוריא"" היו״ל בדמשק מודיע, כי במקום לא רחוק. מהעיר האמא מצאו החופרים בימים האלה ארנן אבן-שיש. ובתוכו תכשיט זהב מרובע יקר ונחמד למראה. הדברים האלה הובאו אל מושלי המחוז, ומפני כי החופרים דרשו את החלק. המגיע להם מזה כחוקי הממשלה, ניתנו להמכר באקציאן.  הרב היקר מוהר״ר אברהם מלמד נ״י רב ומורה צדק בהעיר יוסטשוק, השיג רשיום מאת ממשלתנו ללבוש בגדי כבוד. (רעליגיאן אוניפאראס) כא׳ ראשי הדתות השונות אשר בתוגרמה וזה ימים לא כבירים נתכבד גם באות הכבוד מאגיריאי — יהי ה׳ עמו ויעל! — מכה״ע „איל קונייה"" מודיע כי בהעיר ניברשיאיר (מחוז קוניה) פרש הרעב כנפיו, והמון תושביה נודדים ללחם, בחמשים נשים מדלת העם התאספו יחדיו ויתפרצו בשאון ובקול המולה אל בית מועצת הממשלה וישברו את כל חלוני הבית והכלים אשר בתוכו, ויצעקו חמס אל הממשלה כי תרים את המכס מכל תושבי העיר בשנה הזאת, ותתן את חלק המעשר אשר תקח מתבואות השדות אשר סביבות העיר הזאת, לענייה. ובהודע להנשים האלה כי מושל העיר יחפוץ להודיע זאת בטע״ג אל מושל המחוז, מהרו אל בית הטעלעגראף ויעשו גם בו שמות. מכה״ע הנ״ז מודיע, כי מחומות כאלה נקרו ויאתיו במקומות רבות באנאדאל. לרגלי הרעב אשר ירכא לארץ חיתם. והממשלה תעשה בכל אשר תשיג ידה להקים הסער לדממה."
021-HZT-1874-09-18-001_Ad_toc_12,, ירושלם ז' תשרי תרליה
021-HZT-1874-09-18-001_Ar_toc_13,לאהבי ציוי," לאהבי ציוי לַעַת תְּשׁוּבֶת הַשְׁנָה. מיוסד ע""פ א""ב ושם המחבר. חתום בסוף החרתים) (ח׳ תנועות בכל שורה)  ירשלים. אֵם אֶשׁבָחַך. לעת בָּאַפִּי נָשֶׁמֶת חיים, גַּם חֲקוֹתִּיךְ עַל בָּפִים. יֶךְ נִגְדִי תמיד. שוממ שֶׁמֶךְ עַל שְׁפְתִּי בָאַהֲבָה אשא דור לא אמרן דור בְּנֵינוּ. הַבָּל יאמרו תְּקוֹתֵנוּ. וּבְמְנוֺד ראש יַלַעְנוּ עֲלִינוּ מה לנו עוד ולירשָלִים. מָּה לדוֹר דָּעָה הַרְבוֹת ציון""  זה דור דור שוא פתיות כלו. חפְשֵי נהיה, נשבר עלו טמון בַּחוֹל הַזּמֵן קְשֵי סְבָּלוֺ: על כֵּן יאמר בִּנָּבָה רוחוֺ: - עתָּה פְשׁוּה לַעֲמֵי תבל. יִשְׁבָּה יְהוּדָה כִּי מָמָזְרָח. כְּבוֹד אֶל עוֹלֵם עֲלָיו זרָח לַעֲמִי תבל הַגָר בַּעֲרֶך וְנַתֵּן בַּיָדוֹ עַל הַר סֵנִי והוא ישאנו אלפי דורוֺת. מָטוּ הָרִים רַעֲשׁוּ אִרְצוֹת וְהָיוֹ מִמְלָכוֹת לִפְרְצוֹת ספרי תורה, הם בְּמְחֲלָצות נִשָאֲרוּ עֵד הַיּוֹם בַּיִפַּעַתָּם נִשָאֵרוֹ עֲמֵם גַּם נוּשָאֵיהֵם — עֲמֵי הוֺי עוד לא בַּשָׁלו פְּרַיִי עֲצֵךְ — לא נַקְהַלוּ  צבאותיך, ולא נגאָלו.  בִּשְנָאָה לַעֵין כָּל לֹא יָרָדְפּוֹך בְּהַסַתֶּר יֵד כָּל בֵּךְ תִּתַּקְלם  קוֹל בַּת עֲמִי תִּתִּיְפַחַ רְדָמִים תַּדְרוּשׁ מִמְנָצָח. שׁוֹא יִשְׁרָאַל כַּף שׁוטָה: כְּבוֺדוֹ בַּעֲמִים עוֹד יִתְבּוֹלָל כִּי לֹא בֵּא לוֹ עוֹד עַת מְנוּחָה. תְּנוּ יֵד יַחַד נִפּוּצוֹת יְהוּדה. נא: התאחדוּ בְּנַפֵּשׁ צמודָה. ולא תהי ציון עוד פָלָמודה. רק הַשָלוֹם הוּא הָאַקְדָח פַּדְכֵּר שְׁמַשֶכָם לְנָאֲלָתֶכָם לָפָּה שְׁנָה בָּאָה אַחֲרֶת רו — צרעת מִמָאָרֶת קְנָאָה — שְנָאָה אֵשׁ בַּעֲרֶת היא הציתָּה חומות ציון תַּבְנָה אוֹתֵן אֵשׁ אַהֲבָתְּכָם וִתְפַלְתִּי מִקְצָה אֶרץ. אֶל מִשַׁחֵק יַשָׁמֵעַ יֵרָן גע צוֹתָה פרץ יְרַחַיק יתן הַיִיִם לָאהָבִי ציון. פְרוֹח יִפְרָח כחבצלת. תהל השנה וברכותיה ובברכתה (לפ״ק) יבורכו יראי אל ודורשי שלום העיר. *) פעסט. בחדש אלול תרל״ד. - . שמעון ב""ה יצו ויוסף בכרך כי ממיקלא ."
021-HZT-1874-09-18-001_Ad_toc_14,,  שנה חמישית גליון 1
021-HZT-1874-09-18-001_Ar_toc_15,הערה.*)," הערה.*) ודרשו את שלום דהעיר   הגליתי אתכם שמה. (ירמיה כ""טן) מרגלא במומיה דאינשי להביא ראיה שצריך להתפלל בשלומה של מלכות מפסוק זה, אולם כל הרואה המשך הכתובים בירמיה יראם בעין פקוחה כי סיף המסוק „כי בשלומה יהיה לכם שלום"" אינו מוסב רק על ירושלים ולא על בבל השודדה, כי אשרי שישלם לה גמולה, אבל משלום ירושלים יהיה שלום לנו ולבל העמים, וכל ספרי הנביאים מדברים מענין זה וכמ""ש הנביא ירמיה שני פסוקים אח״כ, „אנו כי חושב עליכם פאם ה׳ מחשבות שלום וג' לתת לכם אחרית, ותקוה, והרד""ק המליץ לכן בלשונו לפרש פסוק זה „בשלומה יהיה לכם לשום״. כל זמן מתמשך הגלות, כי בחרבן בבל יהיה להם יותר שלום שיצאו מהגלות"" - זכבר העירו בצדק שני חכמים מפורסמים בלופה למגיד ש״ד (כא יג') הישיש המהולל מוהר""ר ב""ג בעיר מאריס, אשר יערוך לאוהבי האמת והמחקר כתב ג משלחו של מלכים, ומרעהו הרב מוהר"" שניאור זקם אשר פריו יתן בעטו לאוהבי אור, כי מלת אשר הגליתי אתכם שמה היא כמו משמה וכמ""ש פסוק י״ד שם והשיבותי, אחכם אל המקום אשר הגליתי אתכם משם והביאו ראיה ממימרא שב ריב""ל בסוף פלק השלום: אמר להם הקב״ה לישראל אתם גרמתם להחריב את ביתי, ולהגלות את בכי היו שואלים בשלומה ואני מוחל לכם. מ״ט שאלו שלום ירושלים (תהלים קב״ד ו׳) ואומר ודרשו את שלום העיר (ירמיה כ""ט) עכ""ל ממימרא זה אשר הובא ג""כ בסף ספר ווי העמודים בפרק עמוד השלום נראה בעליל כי נבטוו כל נפוצות ישראל באפסי תבל יחד על ידי הנביא ירמיה ז""ל לשאול בשלום ירושלים כי רק בשלומה יהיה שלום לכו ולכל הרבנים לא ישא גוי אל גוי חרב ולא ילמדו עוד מלחמה, ואעידה לי עוד עדים נאמנים מדרשי חז""ל במקום אחר: במדרש תנחומא סון פרשת ויגש כל מה שאירע ליוסף אירע לליון ביוסד ישראל אהב את יוסף), בציון אהב ד׳ שערי ציון, ביוסף ויקנאו בו אחיו, באיון קנאתי לציון, ביוסף לך נא ראה את שלום אחיך בליון ודרשו את שלום העיר, ומדרש תכחומא זה הובא ג״כ בילקוט מלאכי סי׳ תקפ״ט (ואל דרש זה תדמה ג""כ המס״ג על פסוק זה שלום יו״ד חטפין בקריאה וסימן לך כא ראה את שלום אחיך וגו׳) וכן מצאתי בסוף ספר ראשית חכמה פרק כ׳ מאור עולם; ואנו חייבים לדרוש איש בשלום רעהו וכן אנו חייבים לדרוש את שלום ירושלים בית, קדשנו ותפארתנו שנאמר ודרשו את שלום העיר כי בשלמה, יהיה לכם שלום ג""כ .          ע זאת הַשַעֲרְתִּי אָזוב בַּקִיר לִימִי עָצָה בָּאַתִּי וּבַחֲכָמָה צַעִַיר ביקרִי אבין פֵּן אדמה לְבַעִַיר וּבְכָּל לב אַתְּפְּלָל בַּעַד שָׁלוֹם הַעִיר. שמעון בכרך: —"
