article_id,headline,text
044-MGD-1882-02-08-PG001-SINGLE-ORIGNAME_260041_toc_1,," יוצא לאור פעם אחת בכל שבוע. מחירו בארצנו 12 מארק לשנה, 3 מארק לרבע. בעסטרייך 8 פל׳ ע״וו לשנה. 2 פל׳ ע״וו לרבע. בשארי ארצות 20 פראנקס לשנה. כל איש יוכל להשיגו ע״י; כל פאסט-אמס ובוכהאנדלונג בכל המדינות. כל החפץ להודיע! דבר מה ברבים לטובתו עליו! לשלם שכר הדפסה בעד כל שורה 20 פפ׳ ъ — "
044-MGD-1882-02-08-PG001-SINGLE-ORIGNAME_260041_toc_2,," Erscheint einmal 5chentlick Der Abonnementsprels betrzgt 12 Mark shrlich in nlande. Der fnsertionspreis betrsgt Pro Corpusspaltzeile 20 PI. hel Erösseren Insertions- Auftrsgen Wird eli entsprechender Babatt gewwshrt. Alle Annoncenexpeditionen hehmen Inserate für „HAMAGID an. Аdresses Redaction des „HAMAGID, Lyck. Preussen. -"
044-MGD-1882-02-08-PG001-SINGLE-ORIGNAME_260041_toc_3,^וכ1 העגינים ? לפלטת עם ישראל: נס ציונה ...," תוכן הענינים. לפלגות עם ישראל: גם ציונה: מאח אברהם בעד הכהן גאטטלאבער, דייטשלאנד: קעניגסבערג. ענגלאנד: לאנדאן. רוסלאנד: פעטערסבורג. לישוב ארץ ישראל: שבת תחכמוני. אזיען: ירושלים. חדשות בישראל: הודעות:"
044-MGD-1882-02-08-PG001-SINGLE-ORIGNAME_260041_toc_4,"לפלגות עם ישראל.
III."," לפלגות עם ישראל. III. עוד שגגה אחת הוא בפי מתנגדי שטת הלאומות בישראל והיא: כי יאמינו, כי בני עמנו מסיבת פרוד לבבם, אינם מוכשרים לחיות ביחד במקום אחד ולהיות עם. ה׳ שאנטא באחד ממאמריו רמז בדברים מעטים, כי גם בעת שישבו בני עמנו על אדמתם נחלקו לשנים וחק כשמונים שנים היו לעב אחד בימי שאול, דוד ושלמה בנו, ומזה חפץ להביא ראיה להחלטתו, כי אך תקות שוא היא, כי יחדש עמנו כנשר נעוריו. אולם גם בדבר זה שנה והוציא משפט מעוקל, וכל מי שיש לו יד בידיעת תולדת עמנו יודה, כי הדבר ההוא איננו מופת להחלטתו. בצאת ישראל ממצרים, כבר היו נחלקים לשבטים, אם כי כולם בני אב אחד היו, הגזע היה אחד, זאת נראה בשפתם ובקשר תולדתם, אבל בינם לבין עצמם נבדלים היו לכמה שבטים, כמו שנבדלים בני משפחה אחת אם כי יש להם התיחסות וקשר המשפחה. גם בין עמי אייראפא נראה הבדל כזה, וישנו הבדל גדול עדים בין הפולנים והרוססים, אם כי שניהם ילידי הסלאווים המה, וכמה כתות שונות נמצאים גם בין האשכנזים הנוצרים? כל מי שחדר לעומק ספורי תורתנו ידע גם החבדל ופרוד הלבבות ששרר בין אבותינו בני השבטי השונים, עד כי חששו לבלי תהיינה בנות צלפחד לנשים לבני שבט אחר, לבלי תסוב נחלתן לחשבט הזה. יוכל היות שבימים הבאים, כאשר מחקה העת את סמני השבטים השונים, התבוללו זה בזה והתחתנו זה בזה, אבל בתחלה נבדלים היו. וכאשר צוה משה לחלק את הארץ להם בנחלה, לא צוה לתת לכל איש ואיש נחלתו, רק לחלק הארץ לשבטי ישראל. מזה נראה כי מימי משה ואילך היה ההבדל עוד גדול בין השבטים השונים, וכאשר הונה בטבע הדבר, התנשאו זה על זה, וכל שבט ושבט התפאר כי הוא המכובד יותר ולו נאוה כבוד, ולפי הנראה היה שבט יהודה הנכבד ושבט שמעון הצעיר וחדל בין כל שבטי ישראל. סבת ההבדל שהיה בין השבטים חשונים, לא נוכל לדעת, כי אין לתלות הדבר בטבע ואקלים הארץ ששמח ושבו, כי הלא כולם ישבו בארץ גושן צפופים כבהנעטטא באי- ראפא. העמים הקדמונים וביחוד עם מצרים אבה להלוך תמיד בגדולות, וכאשר בנה לו עמודים גבוהים לתמהון בני דורו, כן בנה בהעטטא גדול, לא כבני אשכנז שהכינו רחוב צרה ועקום לנהעטטא. תורתנו תספר כי השבטים יצאו מארבע אמחות; אם כן הבדל השבטים השונים מונח בדם, וזה הוא רעיון נכבד ונעלה. אם כי היו בני עמנו לאחדים, היה בכל זאת הבדל קטון בינב לבין עצמם שמקורו הבדל הדם והנזע מצד אמם. ההבדל הזה נמחה משנה לשנה, כי יען כי נכרים היו אבותינו בארץ כנען ונרדפים מכל סביבותיהם, נלחצו להתאחד להנין על נפשם מול כל צר ואויב מבחוץ. ובימי שאול נראה כי התאחדו כל בני ישראל והיו לעם, לעם נכבד ועצום; וכה הלכו מחיל אל חיל עוד ימי דוד המלך הראשון שהחל להפיץ קולטור, בישראל. המלך ההוא רצוי היה לכל בני ישראל, אם כי היה יליד שבט יהודה שהתנאה תמיד על אחיו, כי המלך הזה היה בעל לב רגש, כאשר נראה משיריו ומתהלותיו הנפלאים, שיהיו למזכרת עולם עוד כל ימי הארץ; ולכן היה מרוצה לכל בני עמו. ע״י הקולטור נחלק גם אז עם ישראל לשתי חלקים, אבל לא ההבדל הישן בין שבט לשבט שרר עוד, רק הבדל חדש יליד הקולטור. אבותינו התחילו אז בימי המלך דוד לשלוח ידיהם באינדוסטריע ומסחר ולהתחבר עם בני צור, לא כבימי שאול אשר הוא רעה צאנו גם בעת היותו מלך על ישראל ולא שנה מדרכי חי ישראל הפשוטים, חיי האכרים הגרים על נאות דשא. בעת החלה הקולטור להתפשט בישראל, נשארו כל יושבי ארץ הגליל במצבם הטבעי ולא שנו מדרכי אבותיהם; עם בני צור לא התערבו וחיי הערים הגדולות לא ידעו ויחיו חיי האכרים הפשוטים והטבעים כמלפנים. — בכל זאת תחת שבט המלך דוד ראו מנוחה, יען כי המלך דוד לוקח מאחרי הצאן להיות מלך על ישראל וגם היה בעל לב רגש ורוח המליצה והשיר הפעימו היה מרוצח בעיני יושבי הגליל הטבעים והתמימים ובכל זאת בסוף ימי מלכותו, כאשר נתרחק מעט מעט מהאכרים בישבו בירושלים עיר המרכולת ומרכז המסחור היה הנקל בידי אבשלום בנו שהחניף לחם ונחג אתם בריעות לנשק להם בבואם שערי המלך לתפוש את לבם למרוד במלכם, כדרך כל בני הטבע שנקל להם להתפעל לדברי חלקות מפי גדול מהם. וכאשר נפל אבשלום, והמלך דוד הראה להם פנים שוחקות, שבו אליו עד מהרה ויתפארו כי עשר ידות להם במלך וגם בדור אף כי בן יהודה הוא. בימי שלמה בנו המולך אחריו, נהיה אחרת. הוא לא טרח לבקש אהבה מבני עמו, רק סמא עיניהם בחצר מלכותו, במעמד עבדיו, משרתיו, נשיו ופלג שיו שמצצו דמי יושבי הארץ, כאשר יספרו כתבי הקודש את רוב המסים שגבה מעמו מכולת ביתו וחצרו, גם לתת במתנה למלך צור, כאלו מעט היה לעם ישראל לכלכל ביתו. גם לעבדים כבש את בני עמו ויעמים עליהם לחצוב אבנים בהר ולבנות אבי אביו ובכל זאת חפץ לפסוע ברגל נאוה על העם ולרדות בו ביד חזקה, ויתן אוזן קשבת להאפרתים הצעירים שהסכינו מנעוריהם להביט בעיני בוז וחרפה על העם, אז נלאה העם נשא העול הכבד וירבעם הערום שהבטיחם להקל עולם פתם ויתפשם בלבם למרוד במלכם. להמעשה הזה הסכימו גם הנביאים כאחיה השלוני, באשר עוד בימי שלמה התאוננו כי יתרחק מדרכי אבותיו ולבו איננו שלם עם אלקיו כלבב דוד אביו הנביאים הקדושים והחכמים היו תמיד שומרים תכונת לאום ישראל ויקנאו להרגש הלאומי כל ימי היות ישראל, על אדמתו. חלוקת עם ישראל לשנים, לא היתה סבת פרוד הדעות בעניני אמונה, רק סבת השתנות דרכי חיי הלאום. אך המלך ירבעם שחפץ להחזיק עמודי כסאו, חטא והחטיא את הרבים, בעשותו מחלוקה מדינית חלוקה דתית והעמיד שני עגלים לעשותם לאלקים. תולדות החטא הזה ידועות ואך למותר למנותן, אך על זאת נחפוץ לרמז, כי במשך הימים נהיה ההבדל המדיני להבדל אמתי, כי נתרחקו שני חלקי העם זה מזה ונהפכו לאויבים, ומזה מצא לו ה׳ שאנטא ראיה להחלטתו, כי גדול פרוד הלבבות בישראל ואי אפשר שיתאחדו להיות עם. אבל דבר אחד שכח כי חלק אחד מישראל והמה עשרת השבטים הלכו בגולה ויאבדו מתוך הקהל. בעת עלה עזרא הסופר ירושלימה, לא עלו אתו רק אנשים מבני יהודה ובנימין, ועשרת השבטים נאבדו מאתנו עד היום הזה, ומי יודע באיזה לו, לא יכלו להתבולל עד עם התבוללו, אבל אלה שלא הת היום הזה, והמה כתובים לחיים בירושלים, והמה עמודי האומה! בימי הבית השני, עשו רק בני שבט יהודה ובנימי חיל. והמה היו כלל האומה, לכן בימי הבית השני. לא לו ארמו נות יפים לו ולבת פרעה. בזאת נפלאו כתבי הקודש, אשר באמת קדושים המה ונכתבים ברוח הקודש. אין לפניהם לא משא פנים ולא הדור פני גדול מותבי ספרי מלכים וחברי   הימים היו מהנהים אחרי מלכות אשר לאור כל בנקל, ובכל זאת חטאת שלמה הגידו ולא סחרו, כי הוא הניח אבן פנה להריסת הלאום, ובשעה שלקח את בת פרעה להוליך שולל את ישראל, נעץ גבריאל קנה בים ועליו נבנתה פור גדול של רומי; משל נעים, להגיד בזה, כי המלך שלמה הניח אבן פנה להריסת לאום ישראל ע״י מלכות רומא. בני יהודה ובנימין שישבו בסביבות חצר המלוכה ונהגו מזהרו, גם התעשרו על ידי המסחר הגדול, אהבו את המלך שלמה, אשר העלה את המסחור למדרגה גבוהה, ובעת שבימי שאול היה רבע שקל כסף די להביא תשורה לאיש אלקים נתן המלך שלמה את הכסף כאבנים. אולם יושבי הגליל האכרים תמימים, לא יכלו נשא עול המסים הכבדים, כי הכסף היה יקר להם כבימים מקדם, וגם המה לא יכלו נשא את ההתרחקות ממדות אבותיהם והתדבקות במדות בני צור ומצרים. כאשר נראה בהריסת כלעם ועם, כי בתחלה יאשם המושל המקשיב על דבר שקר ואחרי כן כל משרתיו חטאים, והמה יחניפו את הארץ והאפרתים יחלו לעזוב דרכי אבותיהם ולשחת את ארצנ ורק בלב העם התמים תשאר האהבה למדות אבותיהם,   נראה בעם ישראל. האכרים התמימים יושבי הגליל עמדו מרחוק ולא התדבקו במדות האפרתים לבנוד בתכונת עמם. כל זמן שהמלך שלמה שסמא עיניהם בתפארת חכמתו היה הי, וגם זכרו עוד בימיו את חסדי דוד אביו שהיה אהוב ומרוצה בעיניהם, לא מרדו בבית דוד. אולם כאשר מת שלמה ורחבעם בנו עלה לכסא תחתיו, ולו לא היה מחכמת אביו ומגבורת נחלק עוד עם ישראל לשתים, אם כי פרוד הדעות בעניני אמונה גדול היה אז ביתר שאת מאשר הי׳ מלפנים. הן תראו קוראים יקרים, שדברי אלה המכחישים בלאומות ישראל, בין אלה שאומרים שחדל ישראל להיות גוי מיום לכתו בגולה ובין אלה האומרים שישראל לא היה עם מעולם, המה בטלים ומבוטלים ואין בהם קורטוב של אמת. בני ישראל ה עם ונשארו לעם בפני עצמם עד היום הזה, וזאת כתובה על ספר תולדתנו בדם על לוחות של אש. שקר ההחלטה, כי בעת הלכו בני עמנו בגולה נתקו בעצמם את קשר הלאום, ורק את קשר הדת השאירו אחריהם. הדת הוא אחד מקשרי הלאום, באשר רגש הלאום נבנה בכמה דברים, בהגזע, בהשפה, בהספרות, בארץ מולדת, באמונה ועוד כמה דברים. הגזע, השפה והספרות של ישראל קשורים באמונתו, כי לו עזבו בני ישראל את אמונתם אחרי עזבם ארץ מולדתם, היו שוכחים שפתם וספרותם והיו מתחתנים בעמי הארץ ודמם היה מתערב בדם אחר. לכן הרו חכמינו שראו למרחוק והצילו את האמונה, והצילו בזה את האומה, ולו לא היו עושים אבותינו כזאת, מי יודע אם היה נשאר לנו זכר. אבל כל מי שיודע ומכיר ספרות הר  ההיא, יראה, אם לא נעורו עיניו מאהבה להשטה המפוארה של פזור ישראל בעמים, כי אבותינו חש את הרגש הלאומי  ק עמוק בלבם, ותמיד נשאו זכר ארץ אבותיהם על שפתם כם, והיו מחבבים ומנשקים עפר ארץ ישראל, ואמרו כל הדר בחו״ל כאלו דר בלי אלוה. כמו כן הקפידו לבלי ימכור איש את נחלתו בא״י ולצאת לחו״ל ושחררו את העבד שנמכר לחו״ל, והפליגו בשבח א״י, עד כי היתה המותה בא״י יקרה להם במאוד. מה יקרה היתה התקופה ההיא, אשר אם כי ה ישראל בגולה, נשא את זכר ארץ מולדתו בלבו, לכן פרח אז רוח ישראל ויעש חיל במדה נפרזה במאוד. תינו עמהם זה אלפים שנים. הרגש הלאומי הזה נשאו אבו הדגל הזה נשאו ולא עזבוהו גם אם הרבו צוררים לשפוך דמם. כאלפים שנים להמו בעד הרגש הלאומי הזה, ואף כי היתה עת צרה אז ליעקב, בכל זאת אל יחשבו לנו קוראינו לעון אם נאמר, כי יקרה היתה התקופה ההיא לישראל! — אז כאשר חשבו בני עמנו את עצמם לבנים לעם אחד, לאחים לצרה ולשמחה, וימהרו איש לעזרת רעהו ויושיטו לו יד עזרה. אחרי לות ישראל מעל אדמתו לא עזבו את הדגש הלאומי אף כרג אחד, רק בעת ראו כי אפשר להם לשמור היטב אותו הרגש מהרו ויטמינוחו באמונתנו, עד כי קשה כעת להבדיל בין הרגש ומי והאמונה. זאת היא תכונת ישראל להרכין ראשו בעת  תעבור סערה להפיצהו אך לא לנפול תחתיו, ומה הקנה במים הגד לבל רוח ואינו נשבר, כך עם ישראל הרכין ראשו פעמים רכות, אך לא עזב את לאומותו. אך בימינו אלה שקמו אחדים מקרבנו ומכרו את בכורתם בעד נזיד עדשים, שמכרו את ודת ישראל ותקותו בעד חיי שעה, עתה יחזו אלה האנשים  בשרם, ויאמרו כי אין לאומות לישראל, יען כי המה בעצמם אינם חשים אהבה לעמם! — אמנם עתנו זאת היא עת צרה ליעקב! מפני שכל ימי לכתנו בגולה, היתה תקותנו מעוזנו ותנחומנו ביום צרה, אך עתה נתחו רבים מגדולינו את עם ישראל לנתחיו וישללו ממנו תקותו ונחמתו וכעת כאשר קרו אותנו כמו אלה, עומדים אחינו בצרה, ויאוש נורא יאכל כעש בם, בלי תקוה ובלי נחמה! את נעוררו אחינו! אלפים שנים נלחמתם ולא כליתם. ועוד חת היה תחיו! - יש תקוה לפעולתך ועוד תשנא ותעשה חיל ושונאיך יראו וילבשו בושת! אל תולדתך הנפלאה הביטה עם ישראל! שלש פעמים הלכת בגולה, שתי פעמים נגאלת כבר, ממצרים ומבבל, וגם הפעם השלישית תגאל. עתה החלו אחינו ועשו הצעד הראשון ליסד קולוניות לעבודת האדמה לאחינו הנרדפים והנתונים בצרה, ואם תעשו אתם מה שלכם, אז צ ישראל וגואלו יעשה מה שלו ויהיה בעזרכם. אל תפחדו מלצני חדור, בוגדי עמכם המלעיבים בנו, כי גם בעלות ישראל מצרים, אמר פרעה: ראו כי רעה נגד פניכם, ובימי עלות עזרא הסופר ירושלימה. באו השומרונים לרפות ידי עובדי החומה וילעגו להם, אבל אבותינו באמת ותמים אבו להגאל, ולא שתו לכם לדבריהם. גם אתם אחינו אם באמת ותמים כב קצה נפשכם לשמוע כל הימים חרפת שונאיכם, לא תשימו לב לדברי צוררינו מבית ומבחוץ. התעוררו אחינו לחיים והיו! כי החפץ להנים הוא החיים! -"
044-MGD-1882-02-08-PG001-SINGLE-ORIGNAME_260041_toc_5,"בס ציונה!
שאו נם ציונה העיזו אל תעמדו כי רעה אנכי מביא מצפון ושבר גדול: (ירמיה ד׳, ו׳)."," בס ציונה! שאו נם ציונה העיזו אל תעמדו כי רעה אנכי מביא מצפון ושבר גדול: (ירמיה ד׳, ו׳). מָה-תַּבְכִּי בַּת עֲמִי מהרִתְשְׁאֵי נְהִי כִּי תִּשְׁמָעִי מִסּבִיב קוֹל קרא: צאי! הָטִי אָזְנֵךְ לְקוֹל יָדִיעַ יָצָרִיח: ִישׁ אֶל בַּשָׁמִים צָדְקוֹת זֹרֵעַ, לו נתכנו עלילות, צפה ידע, ומעמל ואון ישועת מצמיח. לא נואשֶׁה תקוֹתֵך, חַפָּה מִפּשע בַעֲנַיִך הוּא יראָה וְיָחִישׁ לֵךְ יָשׁע. החישי לך מִפְלָט, בת עמִי הַשְׁרוֹדֵחַ! אֶל ארץ אבותיך, אַרְצָה יהודה! אחי ובני עמי, שמעו שמע! הרֵעָה הזאת עֲלִיכָם בְּלָתָּה, דעו איפוא יד יֵי זאת עשתה למען תתעוררו תנועו נגע, מעפעפיכם שנתכם הסירו וּמְצֵב חַיִיכם תַּדְעוּ תַּבִּירוּ. רב לכם פנות איש לבצעו מקצהו, רק מִכר רק קְנֵה וְהַשב עם קנהו. וכי עם אתם הִנֵּה תשכחו שכח, עם מעולם בטרם עמים ילדו, הַחַיִים היוֹם וַאֲשֶׁר כְּבָר נבחדו. עם עולם אשר לא יַחַדַל תַּת כָּח; שִׂכְחותם כִּי חסן עם חכמה ודַעַת הטוֹת לִקוֹל הַזָמן אזן שָׁמַעַת. דובנא, ח״י טבת תרמ״כ. יום מלאת לי וְהִנֵּה הַזּמֵן קרא - מִי לֹא שֶׁמֶע? עת צָרָה לִיַעַקב — מִמְנָה יושע! עת צָרָה כָּמוֹה לֹא נְהַיִתָּה. השאטים מסביב ומכל עבר ישרו צו רִים כַּקָטָב וַדְבָּר, ולכל בְּנִי ישׂראל חשֶךְ עַפַתָּה הַעַת לַחֲשׁוֹת עַת כָּל אָלָה תַּבָּאנָה? האין הקוֹל קרא: שאו גם ציונה! ציוֹנָה! ציוֹנָה! קדְמָה מִזְרָחָה! שם, ישראל, גפן אשרך פרחה, שָׁם עֲרֵשׁ יַלְדוֹתֵך, שָׁם לַעַם הַיִיִת: שם נבאוּ נָבִיאָיך, שם שֶׁריךְ שֶׁרוּ, שריך ומְלָכִיךְ שָׁם קְבָרוּ, שמה היית פרית שרית, שם הזכִּירךְ כָּל מִצְבֶת קְבָר, כִּי עַם הִנֵּךְ וּלֵךְ תַּקְנָה וּשֶׁכֶר. הארץ הַחַדְשָׁה אָרֶץ מִבָּרֶכֶת, אולם לא לף עֲמִי שמה ללכת, כִּי גּר אַתָּה שם, גּר גַם וברח: אבותיף אדמתה לא חַרְשׁו ובעפרה נועיר לא שׁרְשׁו, וְהַיִית שָׁם כּנָטָה לָלוֹן אדח ור יקראַךְ כָּל אָזְרַחַ בָּאָרֶץ. ומי ידע אם לא יבאך שם קרץ. אחת ושבעים שנה. לא כן אדמת הַקְדָשׁ, ארץ כְּנַעַן, שָׁם כָּל כָּפִים מֵעַץ יַתֵּן קוֹל וְיַעַן: אבותיךְ מעולם פה ישבו, ופה נבוֹרֵיךְ כָּבוֹד נְחַלוּ. פה שפךְ גַּם דמֵּם בַּקְרַב כִּי נְפָלוּ, פה עצמותיהם בַּקְבָר יִשְׁכָּבוּ. משפט אזרח לךְ פָּה בצדק ובישׁר שְׁבָה פה אַתְנוּ וּמְצַאת אשֶׁר. וכְּר-נא עמי יוֹם עֲלוֹתֵךְ מבבל, אֲנַח הוֹלִיכוֹךְ עַזָרֵא ורבכל? אַרְצָה כּגַעַן מַעַגַל רְגַלַיִך פָּלָסוּ. ראשי אלפִי ישראל יָקִירֵי הַעֶרֶךְ! דרשי שָׁלוֹם עמכם לנחותם הַדֶּרֶךְ! אַךְ שׁמָה נִדְחִי יִשְׁרָאֶל כְּנָסוּ! אַדְמֶת קדש זאת מעולם אָהֳבוּ, יַעַבְרוּ אדמתָּה וּבַשָלוֹם יָשׁבוּ. אִישׁ וָּקֵן אָנֹכִי וַיָּמִים שֶׁבע,  אם אראה פּדוֺתך עמדי מי ידע! אַךְ יבא היוֹם אם קרוֹב אִינוּ,  עוד רחוק מישועתך דברי שאנתי, וְלֹא אַחֲר בִּתְּלְנוּ עֲמִדְת תַּקְוְתִּי, ויום אולתך לא עתה אשורנו - אכן בא יבא יום שקויתי אני! בא יבא! - יבבאו וזכרתני! - אברהם בעד הכהן גאטטלאכע"
