article_id,headline,text
044-MGD-1876-02-23-PG001-SINGLE-ORIGNAME_200063_toc_14,"אגדה נדרשת.
מאת יוסף כהן צדק"," אגדה נדרשת. מאת יוסף כהן צדק (המשך מגליון 7). ונגד שני אלה דרש רבא את דרשותיו; נגד הראשון אמר „שרי ליה לאיניש לאדם ביקר נפש לאודועי נפשיה!"" עת בפעם הראשון פנים אל פנים יתודע אל מכבדי שמו מרחוק, יש לו הרשיום להודיעם „אני אני הוא... זה שמי! ואם כשמעם מי הוא, כבוד והדר יעטרוהו, בקהל רודפי כבוד לא תחד כבודו. ועליו אמר שלמה בחכמתו יהללך ור, אם אחרי הודיעך את שמך יהללוך זרים ויברכוך טובים, בסוד גאיס לא תבוא נפשך, כי לא אותך כי אם את תורתך יכבדו ויהללו. ואם איש לאיש ישבח מעשיך, ולא פיך לא יחשב כי פיך ענה בך. ועוד דרש, כי גם לגבר דרכו נסתרה ותהלוכותיו את צנועים, בברתו מפני כבוד כמפני הארי, הרשות נתונה לאמר הרבה חורה למדתי, קראת שניתי ושלשתי וגם שמשתי תלמידי חכמים, חנו למשפטי משפט הבכורה בגלל תורתי, וריבו ריבי ראשונה. אני רץ, והם (שאר כתות בעל הריב הנצבים עמכם בזה) רצים, אני רץ לבית המדרש להגדיל תורה ולהאדיר חכמה, והם רצים איש איש לאהלו לסחר מסחר עולם עובר. לא לי, לא לי, כי אם לתורתי תנו כבוד וחושו לדון את דיני בראשונה או לאמר „שרי מסים! עשו ביתי חפשי בישראל בגלל תורתי. כל העם במיטב כספו מס ישקול אל גנזי המלך, ואני וביתי נעבור את ה׳! עבודת הקדש על שכמי, ובכתף לא אשא גם משא מסי מלך ושרים!"" כי בהודיעו דבר גבורותיו בחורה וחין ערכו במדע, לא למענהו כ אם למען כבוד תורתו ולא יחל, יעשה זאת. ועל זה יעמיק רבא שאלה „כתיב ועבדך ירא את ה׳ מנעורי- מאריה דאברהם וכי ניתא להו למרייהו למימד הכי? ומי נתן לעובדיהו את הרשיום לדבר באזני אליהו כדברים האלה? והכתיב יהללך זר ולא פיך, ומאן יימר שאליהו לא הכירו מתמול שלשום? איהו מותיב לה ואיהו מפרק לה, הא באתרא דידעי לי, הא באתרא דלא ידעי ליה, ואליהו לא הבירו, ככתוב „ויהי עובדיהו בדרך, והנה אליהו לקראתו, ויכירהו (לא בהכרת פנים, אף לא בטביעת עינא דקלא, כי אם על פי אותות שערותיו ובגדיו, כי אליהו נסמן סמן בתוך סמן לאיש בעל שער ואזור עוד אזור במתניו *) ויפול על פניו ויאמר, האתה ה אדוני אליהו? (הגידה נא לי אדוני מה שמך? הכרת פניך ואותות נגדיך תענינה בך כי אתה הוא הנביא מחשבי, ואולי באשרי לראות אח הרואה! באשרי? אוי לי כי נדמיתי, כי איש טמא שפתים אנכי, ואח הרב הדומה למלאך ה׳ צבאות (ראו עיני!) ויאמר לו: אני! (מ״א י""ח) והיה באתרא דלא ידעי ליה. ויוסף רבא לשאול: הן עובדיהו לא בא למישרי לו תיגרא ברישא, ולא להפטר מכרגא, ומי נתן לו הרמן ורשותא לאמר ועבדך ירא את מנעורי? וגם לשאלתו זאת מצא מענה מפורשת במקרא „הלא וגד לאדוני"" את אשר עשיתי בהרוג אזבל את נביאי ה׳ ואחביא מנביא ה' מאה איש, חמשים חמשים איש במערה, „ואכלכלם בלחם ומים!""  (שם) לאמר: אדוני הרואה ושומע אמרי אל בלי חפונה יד ה׳ היתה אליך ובמראה אליך כן הודע, או מפי עוברי ארת כבר הוגד לך כי בפרוע פרעות בישראל, בעת צרה ליעקב, עת על גבו חרשו חורש און, ומטעם המלך והמלכה וגדוליהם יצאה דתא מהחצפא כאש חפתה ואבדון לאכול את נביאי ד' בכל פה, קנא איש ירא אלהים מנעוריו קנאת ה׳ צבאות, ואת נפשו שם בכפו להציל לקוחים ממות. מאה חוזי מחזה שדי הציל מחרב היונה, וחמשים חמשים איש החביא במערה, פן יבואו משרתי מושל מקשיב על דבר שקר אל המחנה האחת והכוהו והיה המתנה הנשאר לפלטה, ויכלכלם בלחם ובמים - לא אפונה אדונ כי זה הדבר כבר ה לך, אם כן איפא כבר הללו זרים את ט המעשים האלה לפניך, ובגלותי אזנך כי אני אני הוא בעושה אלה, אל נא תשת עלי חטאת גאוה אשר נואלתי לדבר כדברים האלה, כי לא פי יספר תהלתי ועתה „מה חטאתי כי אתה נותן את עבדך ביד אחאב להמיתני? וגו׳ ועבדך ירא את ה׳ מנעורי!"" (שם) וזה ברור לדעתי בס״ד. ג) זה שנתים אחר הרעש הגדול ההיה בקרית מלך רב וויען בנפול מגדלי השטרות הפורחים באויר ואין להם על מה שיסמוכו ולקול רעם הקורזען רעשה אירופא ורגזה אמעריקא, כי סדנא דארעא חד היא. וינועו אמות ספי בתי הדמים (Börse) מקול הקורא הנפילים בארץ! אפס כסף! אין כסף לאדונים רבים, יד בעלי השטרות על התחתונה הצרור נקוב ושלומים אין! בטלה חזקת אין אדם מעת פניו בפני בעל חובו, פסו אמונים מן הארץ, וגם אנשי אמונים יפשטו לאשר ישו בם את הרגל! הוי שמיטת כספים (באנקראט) נוהגת בכל מקום בזמן הזה! בהמצא מפתח הזהב רנה; ובאבוד הכסף, קונה שערי המעות ננעלון ושערי דמעות נפתחו, בהגלות נגלות כי אין מספר לשטרות שפסלת הבערזע, יען אגודת חותמיהן על רמיה נוסדה — — — הדור! אין אומר ואין דברים להודיע לדור נולד, מה רבה השערוריה במדינות, בימים ההם. ואנכי בדרך נתני ה׳, הלוך וקרוא במו פי ובעטי בשם אל עולם ובעת ההיא נתכבדתי (בערב שבת קדש פ׳ בהר בחוקתי שנת תרל״ג) בעיר אחת רבתי במסחר שטרות, לדרוש למחרתו בתוך ההל ועדה. — ויהי ממחרת, ואני בבואי אל תוך בית האלהים, מה מאד השתוממתי אל המראה בראותי, רק מחצות הקהל נאספים מאשר ראיתי עומדים בבית ה׳ בליל התקדש השבת - וכן ראיתי שערוריה, איש איש באזני אחיו יתלחשו, הש""ץ מתפלל בהוד והדר ושאגה לו כארי, והוא מן הצועקים ואינם נענין, כי אין עונה „אמן״ — הקורא, קורא בתורה ושומע אין לו מרוב שיתם; אף כי בליל אמש ראיתי ההיכל מלא מפה אל פה וכלם עומדים באימה וביראה בחרדת ובחדרת חדש. - ואתקרה לדעת זאת, כי אמרתי בלבי אולי יחד עלי יתלחשון? ואולי בשלי הסער? ויספר לי הרב החכם האב""ד אשר ישב לימיני כדברים האלה „חזות קשה הגיד הדלוג רב מבתי הדמים אשר בוויען פאריז פפד״מ וכו׳. כי בתי מסחר גדולים וטובים נפלו שם לקול רעם ורעש הבערזע מוויען. לא יבנו עוד, כי נוחר השה כסוכה בכרם, והאמתחת כמלונה במקשה - ואנחנו לא נדע מה יולד יום, ובהיות האדם בהול על ממונו יום זה *) כל זומרי זמירות במוצאי שבתות, יזמרו בקול איש הנקרא בעל שער בסימניו והלא כה דברי עובדיהו אל אליהו „חי ה׳ אלהיך! אם יש אוי וממלכה אשר לא שלח אדוני (אחאב) שם, לבקשך ואמרו אין והשביע את הממלכה ואת הגוי כי לא ימצאנה!"" (מ""א י""ח) כי אחאב שלח להו (אל הגוים ואל הממלכות) סמנא „שוטטו בחוצות עיר ועיר, בקרת תהיה גם בכל הבתים, עיני שופטיכם ושוטרכם תהיינה משוטטות בכל ארצותיכם, לבקש איש בעל שער ואוזר עוד אזור במתניו! אם אותו כהיום תמצאון, תפשוהו חיים או חיים תפשוהו, ובכבלי ברזל אל ארצי ואל ממלכתי תסגרוהו, כי חייב את ראשו למלך. השבעתי אתכם כורתי בריתי, כי לא תחס עינכם עליו. כל מוצא אלי יביאהו או יהרגהו... כי בן מות הוא ודמו בראשו!' - ויכר עובדיהו את אליהו על פי סמניו בגופו ובבגדו, והוא (אליהו) לא הכירהו, כי מעולם לא ראהו. וזה ברור. הכותב. אף אם בשבת יקרה איש איש לבצעו. האמנם רע עלי המעשה אשר המה עושים ופעמים רבות הגדתי לעמי פשעם בדבר חלול שבת בבתי ממכר השטרות, ושומע אין לי אף כי בנוגע לשאר מצות ה' כל העדה כלם קדושים על כן עיניך הרואות היום כסאות רבות בהיכל ה׳ מאין יושב, איש לביא מסחרו ישראל, אף כי רבים המה בעירנו המתאוים לשמוע בקול דרושך!"" ועניתי אותו דבר, השלחן ערוך יורה: מעבורין את המת מלפני הכלה; והשולחני (באנקיער) הנמצאים בזה, יורו: מעבירין את השבת מלפני קבערזע! עליתי הבמתה, ואת אשר שם אלהים בפי שמרתי לדבר."
044-MGD-1876-02-23-PG001-SINGLE-ORIGNAME_200063_toc_15,"נסיעה דמיונית במרחבי הבריאה.
(המשך מגליון 7)."," נסיעה דמיונית במרחבי הבריאה. (המשך מגליון 7). והנה אחר אשר הרבה פתחים גדולים ורחבי ידים המה פה, בלי ספק יענה ויאמר כל איש כי נחליף כת ונלך דרך פתח פתוח לרוחה אשר כזה, על פני השמש, ואמנם כן המקום רחב ידים מאוד שמה ודי והותר יהיה לנו למען נעבור בתוכו, כי כל לשוני-ים וכל הטונעלס שבעולם כלם יחד כאפס ואין נחשבו נגד פתח כזה, ועוד בהמאה שעברה כבר נגלה לעין התוכנים כתם אחד על פני השמש אשר גדלו  בחמש פעמים מגודל הארץ, והתוכן הערשעל ראה כתם הגדול מהארץ חמש עשרה פעם, ועוד הבטות התוכן שוואבע כי נמצאו אורים רבים על השלמה האורית מגודל אייראפא כלו. ואם גם אמת הדבר שהפתחים והחורים האלה המה כתבנית משפך צר מלמטה, על כל זאת נכון לבנו בטוח כי נמצא עוד מקום למעננו, לילך בתוכו ולהגיע אל עצם השמש, אך אם כל הדרכים בחזקת סכנה אף כי הדרך הזה ולא נקל הדבר הזה גם לנו אשר בדמיון נגביה עוף לעוף השמימה.  אך אם גם ניגע לבא דרך האש האוכלה ההיא אשר האור והחום שולטים שמה שלטת עד אשר אין להשיגם, חי נפשנו לא נדע מה נעשה ומה נוכל לעשות על פני השמש אשר הכת המושך חזק ועצום שמה עד כדי 350000 פעם מכח הארץ? על השמש הנה יפול הנופל 430 רגל בכל רגע וכבד הוא 30 פעמים מעל פני האדמה ולפי״ז נהיה כבדים שמה 30 פעמים מאשר על הארץ מתחת, וזה הוא אשר אמרנו כי לא דבר נקל הוא: כי אם גם נאמר שכל אחד מאתנו אך ככר אחד משקלו, היו יהיה שמה כאלו ישא עול ומשא כבד 29 צענטנער על צוארו, ראשנו אשר הוא בכובד חמש פפונד יכבד שמה עד אשר נלאה שאתו, והלב אשר כובדו 20 לאטה יהיה על פני השמש כאבן מעשרים פפונד וכן כל שאר האברים יכבדו עלינו עד אשר לא נוכל שאח אותם, ומה נוכל א""כ לעשות שמה? איך נוכל להתנהג בכבדות כזאת? אך באמת עוד יותר מכל אלה המצוקות והתלאות, הנה מנעה אותנו מבוא אל השמש, ידיעתנו כי לא תהיה לנו שום תועלת מהנסיעה המסוכנת ההיא. ואף אם אמנם כי המשפט הזה כמשפט מעוקל יהיה בעיני רבים משוכני מטה, כי (יאמרו) הלא רבים המה אבני השמש צמחיה ועשביה הנמצאים עליה ולא נודעו לנו, הלא כעורים נגשש ולא נדע עוד דבר ברור מהשלמה - האורית אשר סביבה וכן רבים כאלה  כן יאמרו הבריות אך באמת מה לנו לעלות השמים ולחבק זרועות עולם להביא ממרחק לחמנו לחם השכל והתבונה, הלא רבים המה האבנים והמחצבים על הארץ אשר לא נודעו עוד תכונתם וטבעם לרבים, ומה לנו עוד אבני השמש? רבים המה אתנו אשר עוד לא ידעו להבדיל  האבן Augi ובין הבערגקריסטאל ולמה לנו א""כ ליסע נסיעה כזאת להביא עוד משם דברים אשר ""לא נודעו"" הלא נמצאים גם פה חמרים חמרים „בלתי ידועים״? וגם על דבר השלמה האורית אשר להשמש אינ כדאי ליסע למענה דרך מסוכן כזה, כי הכי לא תשלח השמש קרניה לאלפים ולרבבות מיליאנען בכל יום על הארץ ובקרני האור אלה הלא נוכל ללמוד דברים רבים גדולי הערך מהאור ותכונותיו כמו „שבירת האור"" (ברעכונג דעס ליכטעס), „הנטיה"" (בייגונג). „ההתנגדות ועוד רבים כאלה אשר ראוים הם לתת לב עליהם  ויש בהם די והותר ליתן טרף להחכמים מביני מדע שנות מאה ויותר, ואם כן, למה זה לנו לילך להשמש אם היא תבא אלינו? ולכן נחדול נא מבוא אליה ונעמוד על המצפה במרחק 200,000 פרסאות ממנה לראות משם הודה זיוה גדלה ותקופתה  (המשך יבא)"
044-MGD-1876-02-23-PG001-SINGLE-ORIGNAME_200063_toc_16, תיקון סופרים,"  תיקון סופרים מצאתי להעיר על החיקון ווי העמודים שנדפס כבר בווארשא זה זמן לא כביר, ואשר נדפס פעם שנית בווילנא, ואחריו כל אדם אוחז בקמת הסופר לכתוב דף על דף כדמותו, וכתבניתו, ומאתו תצא תורה לשום מעקשים למישור ולסקל כל מכשול וטעות מנהו, והנה מצאתי בו הרבה שמות הערים משתי מילות אשר תתחלקנה לשתי שיטין כמו קריח ארבע, עיין רש״י שם) „בעל מעין"" „רמו פרץ"" „הר הגדגד"" וכדומה „ואם כי אולי אין לנו מסורה ע״ז כמו בעל חנן״), אמנם כמדומה לכתחילה אין לכתוב כן (ולזה העירני גם ידידי הרב הג׳ מ׳ שבתי אב״ד דדיווענישאק) לאשר ע״כ אשאל אח פי גאוני זמנינו אם ימצאו מענה ע״ז ויגילו את כבד הפליאה הזאת מעל החיקון ווי""ה, כ״ד הכו״ח בחודש טבת, תרל״ו למ״ק איוויע מחוז אסמינא דוד שלמה בהרב הגאון מ׳ משה ארי ליב זצלה""ה גראדזענסקי באיוויע. א) עיין פ״ת יור״ד סי׳ רע״ה ס״ק ח׳ ורע״ו ס״ק י״ד ח״ס שם ע״ש"
044-MGD-1876-02-23-PG001-SINGLE-ORIGNAME_200063_toc_17,," הודעות. רלי ר   יקא. שע פאקעטפאהרט- האמבורג א רויו  אל עללשאפט. ה   דירעקטע פאסט-דאמפפשיפפאהרט צווישען ארא אונד אדק האמבורג 9 האפרע אגלויפענד, פערמיטטעלסט דער פראכטפאללען דייטשען פאסט-דאמפפשיפפע 8 מערץ. וויעלאנ צימבריא 22 מערץן שטאק .23 פעברואר. לאל הערדע לע ר 15 מערץ. געללערט 29 מערץ 1 מערץ. אונד ווייטער רעגעלמעססיג יעדען-מיטטוואך. פאססאגעפרייזע: 1. קאייטע 500, מארק. 11. קאייטע 300, מארק. צווישענדעקק 120 מארק. לאדעלפיא ווערדען ביללעטס פיר דיא הין- אונד פיר דיא וועלטאויסשטעללונג אין פה העררייזע אויסגעגעבען. „אונד ווירד דאס דאמפפשיפף האממאניא אם 11 מערץ דארטהין עקספעדירט. געהערע אויסקונפט וועגען פראכט אונד פאססזאגע ערטהיילט דער גענעראלל-בעפאללמעכטיגטע. August Bolten, Wn. Miliers Nachig. in HAMBURG. (Telegramm-Adresse: Bolten Hamburg זאוויא דער קאנצעסס. גענעראלל-אגענט. ווילהעלם מאהלער אין בערלין אינוואלידענשטראססע 121.80, ע. האויבוסס אין שטעטטין אונד רוד שלע- געלבערגער אין קעניגסבערג אין פרייסען."
044-MGD-1876-02-23-PG001-SINGLE-ORIGNAME_200063_toc_18,," ויינע  - כשר וויא: פאנטאק, מוסקאט, פראנץ. פערשניטט דירעקט אויס פראנק- רייך, כשר זיסען טאקיער-וויין דירעקט אויס אונגארן מיט דעם אטטעסט דעס ראבב אויס מארסיילע אונד אוים אפען, וויא אויך מיט דעם אטטעסט אונד דעם זיגעל דעס היזיגען יידישען געלעהרטען העררן לעווינעק, עמפפעהלע אין בעסטער קוואליטעט אונד צו זאלידען פרייזען צוגלייך עדלויבע מיר אללע אנדערן וויינע דירעקט אויס פראנקרייך, שפאניען, אי- טאליען בעצאגען, זאוויא מיין גראססעס לאגער פאן יאמאיקא-רוס, קאניאק, אראק, פראנצי בראנטוויין, עכט ענגלישעס פארטער אונד עכט ענגלישעס אלע אין אריגינאל פעססער דעססגלייכען דאסזעלבע אויך אין פלאשען בעסטענס צו עמפפעלען. Wein-GrosS-Handlung Von r. A. J. Juncke„ onigsberg frFr., Kneiphefische Langgasse Nro. 10."
044-MGD-1876-02-23-PG001-SINGLE-ORIGNAME_200063_toc_19,,"  יין כשר לפסח VIDAL-NAOUET File Aine et Cie MONTPELLIER. יין לבן יין אדום אקוואוויטע מוסקאט עמפפעהלונגען: דיא העררען אבבערראבינע פאן פראנקרייך, אלגיר, רוססלאנד, ענגלאנד אונד הכשר דעם אבערראבינערס פאן מאר- סיליא."
044-MGD-1876-02-23-PG001-SINGLE-ORIGNAME_200063_toc_20,," יי""ש של פסח. הודעה לכל בעלי בריתי במסחור היי״ש ולכל סוחרי יי״ש בארצנו כי גם יי״ש של פסח (ספירטוס) מן פאטיקע של צוקער הכשר לפסח ויש לי תוצאות הואוואר החדש בחצר מעשא, אצל סמארגאן מובחר וטוב זך ונקי ומצוין בריח טוב, ונעשה בהכשר גדול בכל הפרטים והדקדוקים, כד״ת להג הפסח, כפי הוראת והכשר הרב המפורסם מסמארגאן. והפאטיקע ג״כ בהכשר רבני ווארשא המפורסמים והכל נעשה בהאזאוואר על טהרת הקדש בהשגחה ושמירה מעולה ע״י אנשים כשרים זהירים מאד וחרדים לדבר ד'. חיי״ש נמצא לכל דורש ומבקש בהפאד- וואל שלי בווילנא והנני למלאות רצון כל קונה עצהיו״ט ולשלוח לכל אחד באשר הוא שם בלי עכוב כלל, ויפנו אל הדרעססע שלי: אהרן מזל בווילנא."
044-MGD-1876-02-23-PG001-SINGLE-ORIGNAME_200063_toc_21,," ישר ווי נע פערשטייערט וויא אויך צור טראנזיטא פער- זענדונג: פאנטאָק. מוסקאָט, י פראנץ פערשניטט. בשר זיסען טאקאיער ווייי  דירעקט אוים אונגארן, צור שטערקונג פיר מלוני ונא לשום עין על אדרעססע שלי: ייסטער קראנקע זעהר ערווינשט, אללע אין בע קוואליטעט אונד אונפערפעלשט, זינד זאוואהל צור אסטערצייט, אלס אויך צו יעדער אנדערו יאהרעסצייט מיט דעם אטטעסט דעס ראבב אוים מארסיילע, אלם אויך מיט דעם אטטעסט אונד דעם זיגעל דעס היזיגען יידישען געלעהר. טען העררן לעווינעק. עבענזא זינד צו האבע בייא מיד אללע שפאנישע פראנצעזישע אונד רהיינוויינע, אויך יאמאיקא-רוס, אראק, קאניאק אונד פראנצבראנטוויין, ענגלישער פארטער, אלע טראנזיט אויף לאגער. J Leschinsky Königl. Holieferant in Königsberg"
044-MGD-1876-02-23-PG001-SINGLE-ORIGNAME_200063_toc_22,, שלאכטמעססער אין אללען גרעססען פאן פיינסטער קוואלי- B. Grunewald טעט האט אויף לאגער Königsberg in Pr. Munzstr. 10/11
044-MGD-1876-02-23-PG001-SINGLE-ORIGNAME_200063_toc_23,," מודעה מבית חנוך נערים (פאנזיאן). אלה מאחב״י אשר יחפצו לגדל ולחנך את בניהם על ברכי הדת והדעת ורוצים לשלחם לבית הגימנאזיום דפה, או שיכינו פה בהידיעות הנחוצות לקבלתם בבית-ספר- מסחר, יוכלו לפנות אלי וימצאו עבור בניהם מעון וארוחה עצהיו״ט. אנכי אלמוד עם הנערים הדברים הנצרכים לבתי הלמוד וגם הלמודים העברים כיד ד׳ הטובה עלי בזה וכרצון ההורים. את פרטי הדברים אשיב לכל שואל במכתב. ליק, אים פעברואר 1876. D. Lewinski, Frediger und judi- Scher Religionslehrer an hiesigen Koniglichen Cymnasium."
044-MGD-1876-02-23-PG001-SINGLE-ORIGNAME_200063_toc_24,,"  קול קורא. בבית הכנסת (טעמפעל) דפה נפקד משמרת הקאנטאר ויעו את נפשנו לספוח קאנטאר ראשון באופנים הנרשמים למטה:  קולו יהי' ערב גם נעים, ויוכל לנגן מוזיקאליש עם הקאהר, וביחוד יהיו לו יתרון הכשר לנגן במנגינות פאלניש. 2. יהי׳ בר אורין, ולכל הפחות יבין פירש המלות, וינהג את עצמו בדרכי המוסר והמישר, ורצוי לרוב אחיו. 3. חלף עבודתו יהי׳ סך מאתים אדומים מלבד הכנסה אשר תעלה ג״כ יותר מחמישים אדומים לשנה. האיש אשר אתו הכשרון לקבל עליו את המשרה הזאת ויפנה ויבא על האדרעססע הרשומה פה. אונד נור דען אקצעפטירענדען ווירד רייזעשפעזען פערגיטעט. Kraiowa, דען 12 יאנואר 1876 דער קולטוס פארשטאנד אין קראיאווא. (הסמוך לעיר בוקארעשט) אדער געבען A. Bomochis. Ph. Lasar. בוקארעשט Sam. Löbl. דער קונקורם איזט בין ענדע דיאזעס יאהרעק."
044-MGD-1876-02-23-PG001-SINGLE-ORIGNAME_200063_toc_25,,"  אונד 118 פוילארד - טיכער אין גאנגבארסטען מוסטערן עמפפיהלט צו בילליגסטען פרייזען. Samuel Spiero, Prostken."
044-MGD-1876-02-23-PG001-SINGLE-ORIGNAME_200063_toc_26,," עגערס האטעל  בערלין ידוע, ועתה נתקנה עוד ביתר שאת ויתר עז בחדרים מרווחים, וכל מיני מטעמים, מתוקים לחיך ריח ניחוח ובמשרתים ממהרים וחשים למלאות חפץ השואל לכן. באתי זאר הפעם לבקש מעוברים ושבים לסור אל בית שמרי׳ איגר Nro .97 97 קלאסטער שטראססע"
