article_id,headline,text
044-MGD-1880-01-21-PG001-SINGLE-ORIGNAME_240029_toc_1,," יאו אל הים ואבן א בכל שבוע. מחירו! בארצנו 12 מארק לשנה, 3 מארק לרבע. בעסט רייך, 8 פל׳ ע""זו: לשנה. 2 פל׳ ע״וו לרבע. בשארי ארצות 20 פראנקם; לשנה. —"
044-MGD-1880-01-21-PG001-SINGLE-ORIGNAME_240029_toc_2,, — כל איש יוכל להשיגו! ע״י כל פאסט-אמט! ובוכהאנדלונג בכל המדינות. כל החפץ! להודיע דבר מה ברבים! לטובתו עליו לשלם שכר הדפסה בעד כל שורה! 15 פפ׳ —
044-MGD-1880-01-21-PG001-SINGLE-ORIGNAME_240029_toc_3,חדשות וקורות הימים. יגיד ליעקב מהנעשה וה...," חדשות וקורות הימים. יגיד ליעקב מהנעשה והנשמע בכל חלקי תבל בין כל יושבי חלד אשר ינעם ואשר ראוי לדעת לכל איש ישראלי לתועלתו ולתועלת השפה העבריה. מאתי ו אליעזר ליפמאן זילבערמאן. והאמת והשלום אהבו. (זכרים ח'). תר״מ. Lde. Jauar ליק, ח׳ שבט. 1880"
044-MGD-1880-01-21-PG001-SINGLE-ORIGNAME_240029_toc_4,תוכן הענינים., תוכן הענינים. לתורה ולתעודה: עט סופרים: על המדינות בו יאמר: עסטרייך-אונגארן: בודא-פעסט. שוועדען: שטאקהאלם. רוסלאנד: פעטערסבורג. אלה מסעי: מאת יעקב אבערמייער יליד בייערן. חדשות שונות: הודעות: מטמוני מצרים ומסתרי קדמוניותיה: מאת נחמיה דוב האפפמאנן.
044-MGD-1880-01-21-PG001-SINGLE-ORIGNAME_240029_toc_5,לתורה ולתעודה.," לתורה ולתעודה. (מאת פלאי). (המשך מגליון 3). זה פעמים רבות השמעתי אמרותי, וחרצתי משפטי, כי אין את נפשי להתגרות מלחמה ולקרא לריב עם איש אשר אדמה כי חפץ הנהו להטיב לבני עמנו, ורק בשגגה יחטיא את המטרה. הלא שגיאות תארובנה לכל איש בדרכו אשר הוא הולך עליה. שגיאות הן אבני נגף וצורי מכשול לכל איש ילוד איש וקרוץ מחומר, וחלילה לי לירות אבן באיש על שגיאתו. יוכל היות כי גם אני אשנה, מה אומר? יוכל היות? שאלו נא את פי אלה האומרים כי משכילים הם אם בל יקראו כלם פה אחד, כי שונג אני מאין כמוני, כי ארהיב לבי לדבר סרה באליל תאותם וזמתם, הלא חרפה היום להיות איש בעל מדות, וטוב ללכת לבית שחוק והוללות מללכת לבית חכמה ומדע. האין זאת משכילים? והחסידים מה יענו? חוטא ופושע הנני מאין כמוני כי דברתי סרה בנציב אלהי ישראל! לעזוב תורת אלהינו ואמונתו? אין זה רע! ולהכות רעהו בלשון? אין זה רע? ולשים שם ישראל לחרם ולנדופים? אין זה רע! לתת כספו בנשך ולהריח את הרעה על כל ישראל? אין זה רע! האין זאת חסידים? ואם כן גם אני שונה הנני, ובל אוכל לעטות נאח וגאון לאמר: אך אני מצאתי הדרך הנכונה והישרה המובילה להמטרה הדרושה!! — כן בל אוכל לצאת לריב עם איש אשר כמוני טובת עמו הוא דורש, ואם ישנה לפי רוח בינתי, מי זה לידי יתקע, כי לא אני השונה והשני הצדיק בריבו? ואחרי כל אלה רבות חזיתי בחיי-חבלי, כי יתוכחו אנשים על לא דבר, רק באשר לא ימצאו המלות הנכונות הדרושות להם. ולפעמים יראו כי שניחם שגו, ואתם תליי משונתם. כל אלה חשבתי עם לבבי, בטרם גשתי אל המלאכה הזאת ותפשתי את עטי לכתוב הדברים האלה. אך האמת בעצמת רוחה המריצתני לכתוב ככל העולה על רוחי. וכאשר אחזה אני. למרות חפצי ורצוני, תכביד עלי האמת אכפה. להגיד דבר אשר פן ואולי יבולע לי בעבורו; ובכל זאת בל אציל דבר אמת מפי. כי אחרי אשר ערבתי את לבבי לנגוע בסמל מפלצת ההשכלה ובאליל תאותה, ובל נסוגותי אחור גם מפני קול גערת כסילים אשר אין חפצם בתבונה רק בהתגלות לבבם הנשחת והנאלה, אחין עוז בנפשו, להגיד האמת גם ל אשר מבלי משא פנים אוכל להגיד, כי מאשר יקר בעיני אכבדהו, וחין ערכו אדע לחוקיר מאוד, אך בחפצו להועיל ולהטיב שגה בחפזו. ואתו הסליחה, על כי ערבתי את לבבי, להעיר אזנו על השגיאה אשר יצאה מלפניו. אני אדע כי יצאתי ללחום את מושל בארץ החכמה ואדע את אשר לפני; אך להדר פני גדולים בריב האמת, זאת בל אוכל. החכם הגדול הר׳ שאנטא, החל להתגרות מלחמה ביושבי גליציה, ולשא במ״ע „נייצייט"" מדברותיו אודות תכונת היהודים הנמצאים שמה, ואודות המומים הרעים אשר נמצאו בהם. והנה אף כי ממני רחקה שפת חלקות לפזר חונף ליושבי-גליציה, יען כי אדע כי אהבה כזאת המכסה על כל פשעים היא כאהבת הקוף אל בניו, אשר מרוב חמלתו ואהבתו אותמו ידחקם בכח בזרועותיו, עד כי ישים מחנק לצוארם. לכן חלילה לי מנטות מאחרי- האמת, למען אכסה פשעי בני עמי; אבל בכל אלה. איך אחריש ואתאפק בראותי, כי כבוד החכם שאנטא יטפול עליהם עונות וחטאים אשר לא חטאו ולא העוו, ולעמת זה על פשעיהם אשר באמת גדולים המה בל ישים עיניו. להעמיס דעתי על החכם שאנטא רחקה ממני, כי מי אני אשר אפרוש ממשלתי על מחשבות זולתי? אך כל אוכל אתאפק לבל הסיר חרפה מעל אחי אשר לא אשמו בה, ולהעיר את אוזן החכם שאנטא אודות האמת, אולי יקבל דעתי ויתן לדברי צדק, אחרי כי אדע כי רק אל האמת ישים פניו. והנה אף כי כל אוכל כחד כי נעלה החכם שאנטא ברוחו פי-שנים ובמשפטו אשר יחרוץ בכל זאת, לוא רק על יושבי- אשכנז אשר תכן את רוחם הוציא משפטו כי אז החרשתי, כי הוא התחקה על שרשי רגלם, ורוחם לא נכחד ממנו. אך אם על היהודים היושבים בגלי-ציה ישא מדברותיו, יסלח לי אם אומר כי לא כנים דבריו, וכי לא על אדני האמת כוננו אמריו, כי לא ידע שורש דבר נמצא ביושבי גליציה, ולא תכן את רוחם; לכן הוציא משפט מעקל ובחפזו שנה וחטא נגד האמת. — החכם שאנטא הזה יראה ברוחו הנשגבה כי כל הרעות אשר תבאנה לראש יושבי-אשכנז, בגלי ציה ארץ מכורותיהן, שמה תוצאותיהן, ושמה תבשלנה אשכלות מרורותן ותשלחנה פארותיהן על כל היהודים היושבים באשכנז. האמת אגיד כי קסם על שפתי החכם שאנטא וברום לשונו הנעלה, עד אשר נאמין לקולו גם אשר לא יאומן, לכן ימהרו רבים להאמין בקול דבריו, וידליטו ממנו כי כנים המשפטים אשר יחרוץ אודות יושבי-גליציה, כי יטה אותמו בחלקת שפתו הנעלה ובמדברותיו הנאוים והנעימים. אולם אני כל אשא פניו ואוכיח כי לא לאמת הוציא משפט. (המשך יבא)."
044-MGD-1880-01-21-PG001-SINGLE-ORIGNAME_240029_toc_6, עט - סופרים,"  עט - סופרים הבקרת בזמן הזה. *) רבות נדבר ונכתב על דבר הבקרת כמה נחוצה היא לספרות עם ועם, וכמה חביבה היא לכל משכיל דורש על דבר אמת. הכל יודעים וה ל מבינים שהבקרת לספרים כמלח למאכל  בספרים צריך לבקור, ובלעדה תעלה אדמת הסופרים קמשונים, וקוץ ודרדר תצמיח ולא תעשה כל פרי. ויען כי כל העמים הנאורים חלקו לה כבוד והדר לתת לה מקום בראש ספרותם, הלא שבעתים נחוצה היא לספרות העברית אשר בה ופרו וירבו מחברים יום יום. ובכן עלינו להודות ולהלל להמבקרים הנאמנים הישרים בלבותם והמישרים ארחותם, העומדים כצופים על מצפה הזמן לאזין ולקשיב קול מחבר חדש במחנה העברי אז בע נים לא משוחדות, ובדעות תמימות ימהרו להוציא משפטם לפני דעת הקהל, משפט ישר בדעת ותבונה על פעולות המחבר והגות רוחו, ובדברי נחת ישמיעוהו; יושר לבם ברור ימל לשבט ולחסד, ומאשר כי כוונתם רצויה אך לטובת ואושר הספרות וסופריה, לזאת אם גם תחז עינם מגרעת וסלף בדברי ספר *) המאמר נשלח לנו זה כשנתים ימים, ומסבה בלתי תלויה בנו לא נדפס עד היום; ומפני כי מאמר זה, הנה דבר בעתו גם היום ע""כ איננו עובר בבל תאחר. המו״ל. של פלוני, בכל זאת לא ימהרו לדרוך עליו לשונם קשתם שקר לירות חצים שנונים ליות של המחבר על שגגתי לשפוך לארץ מררתו; אך דברי חכמים בנחת נשמעים להורהו איזה הדרך ישכן אור האמת, למען לא יפול ל נבו עליו, ולא ינוס משדה הסופרים כמפני שדה קטל. ואם גם בפעם הזאת לא הצליח לאחוז קסת גבורים קסת סופרים בימינו, אולם ברבות הימים אולי לא תקצר ידו להתחרות את יתר מלומדי מלחמת סופרים אשר בארץ. ובזה תפרח הדעת ותגדל התושיה. ומה נאמנו צדקו דברי ידידי החכם ר׳ משה יקותיאל גאטטליב: (בהמליץ שנה שביעית) „בשעה שהספרים נפתחין לפני המבקר, והוא יושב לעיין בתוכם, ומוצא בספרו של פלוני המחבר דברים מפוגמים ומסוכסכים או שאינם כראים ל שמע לאזני הקורא, באותה שעה ישב לו המבקר (אם הוא מאנשי אמנה) ת הא וסופר ומונה זכיותיו של המחבר ומטה חכף כלפי חסד, לפי שקשה לו למשכיל אונתן של חבריות, אבל האמת מאלצת ודוחקת בו, כלום משא פנים יש בדבר! כלה מלאכתך! ואז לא ברעש וצוחה, לא בסופה וסערה דרכו, אך האמת נו לרגלו; לאורה יסע וילך בספרו של פלוני. אנשים כאלה מתנוססים לשם ו אלה כי תועלתם גלויה לשמחת לב כל שוחר טובת הספרות וסופריה באמת אולם לדאבון לבנו צר לנו לשמוע גם ק ל מדבר בזעם לשונו במחנה העברים, קול פחדים הוא באזני המחבר! בשלום כשודד יבואנו והוא יושב לבטח עמו. אוי לו להמחבר שנפל בידי קרים כאלה. המה בשוט לשונם כי יעברו בספרו והיה למו למרמס, גם כל חלקה טובה במו יכאיבו באש עברתם כי קשתה. גם נפש המחבר לא תנקה. אם מבקר זה מצא חטא ומשגה בספרו אשר לא יעלה לפניו לרצון, אז על המחבר כלו יצא הקצף. מיד ירחיבו עליו פה, יאריכו לשון בדברים פולחים כליות ולב; יחפשו עולות, ידרשו אחרי מומיו אך למען הבזות שמו וכבודו. אשאלה מענה לשון, אם לא די להאמת בדברים אחדים ואמרות ספורות להראותו כי שגה ברואה? ומה חטא המחבר אם רוח הסאטירי נוססה בלבב המבקר, ורוחו כנחל שוטף קסתו דרוכה, וחץ שחוט לשונו. פלוני טעה בספרו, המבקר ימצא דופי בנפשו, על תואר צלמו, אשר אין שום יחוס וקשור אלה לאלה, וכי בשבל שמחבר זה לא הבין רוח השירה, או טעה בחרוזי שור וחמור, חיים, ושמים, בשביל זה נמצא עליו מגרעות בגופו ורוחו ומותר להבזותו נגד השמש, ולמלא עליו פיו בשחוק על כי סובב סובב בספרו מבית לבית ופושט ד ומקבל אחד המרבה ואחד הממעיט, לא נכר לפניו שוע לפני דל. הגידו אם לא צחוק מכאיב לב הוא? הלא תכה עינינו מכעש ממחזה כזאת. לא פה המקום לשחוק ולהביאו לידי בזיון. די לפנינו אם נראהו ספרו בידו. הן אמנם לא נאוה למשכיל להיות כמשא על העם לסובב בספרו ולבוא בטרוניא לאיש אשר אין לו כל ידיעה בספרו. מי בקש זאת מידו? אולם למחזה זאת עלינו לדבר על הכלל ולא על הפרט לשפוך דמו כמים. טובה הבקרת הסאטירית! טובה ותועלת היא להכלל אשר טחו עיניו מראות ולבו צפון משכל, אשר בדברי נחת לא נקרע סגור לבו. לפניו טובה היא להעירו מתרדמתו, ולפקוח עיני עורות. כן עונג הוא להקורא השאנן הסרוח על ערשו להפיל עליו תרדמה, אך לא לפני הפרט להציגהו על הנס לבוז ולחרפת עולם. אך לב מבקר אשר יצוק בו לבו כמו אבן הוא יעש מעשהו מבלי הבט על חרפת רעהו. כן נשמע כעת גם קול מבקרים לרוח הזמן המוצאים מגרעות ונותנים דופי ברבים מסופרי בני עמנו, יען פלוני יושב ודורש בחקרי מלים שרשי לשון עבר, דורש קדמוניות, ישיר בשירים, ימליץ מליצות, עורך מכתבים בספר, גם קורא בשפת עבר, ועל כולמו יעביר עטו בזענ ועתה נראה האם נוכל באמת להחליט כי הפהילולוגים, העקס נעטים, הארכעאלוגים, והבילאגרפים כי כלמו אינם מן הישונ ומכלים ימיהם בהבל, יען כי באותו שעה שהוא עוסק במאמרו שידפיס חבורו בדפוס יש דין קדימה למאמר זה, ובאותו מקום אחד נחוץ מזה המדבר מעסקי החיים ומשאלות הזמן? אמנם גדולה גם פעולת אלה הסופרים הגורמים הרבה או אף מעט איזה תנועה ונדנוד בדעת הבריות במאמריהם הסובבים על ענינים לקוחים מחללו של עולם העשיה, כן גם אלה המפיצים אור בהיר על ידיעות הטבע אשר תועלתם גלויה ומודעת; אולם בכל זאת לא נוכל לבטל בשביל זה חריצות שכל ופעולות יתר הסופרים מכל וכל! הזמן הוא המורה הנגב לאלפנו דעת יתר מאלפי חכמים ונבונים. כל לב יודע תכונת נפשו בלי עזרת המבקרים המורים הדרך הישרה. גם הפיהלולוג לא קצרה ידו מהקל לעצמו כהדורש בשאלות החיים, ומה איכפת לן אם יושב וחוקר בביאורי מקראות או בחקרי מלים, או ישיר בשירים, אם אך כוונתו רצויה להרבות דעת ולהגדיל שפת קדשנו? האם לא גדולי חכמי העמים כן יעשו? האם לא  יחלקו כ וד להשפה העבריה להעמיק חקר בה? ועתה מיו שנתרבו בישראל המבקרים והמעמיקים עצה בשאלות החיים והמשמשים בבתי מדרשי החכמות, בושו הפחילולוגין והעטימי- גין חפו ראשם, ונדלדלו בעלי עקסעגעטין, וגברו בעלי לצון וסאטירין ואין עוד דורש בביאורי מקראות, ואין מבקש חקרי לשון! כן נראה בימים אלה עולם הפוך. לפנים בקרוא מלא מגיד וכיח בשער על קריאת ספרי מליצה ושיר והוגה בשפת קדשנו ויכה בשוט לשונו טבול במוסר רעל את נערי בני ישראל על כי מבלים ימיהם בספרי חוץ, אז מיד השיבו המשכילים חרפתו אל חיקו, ובחצי מהתלות ירו עליו מהררי מ״ע ויתנוהו לשמצה ל ערבו את לבו לדבר סרה על השפה הקדושה ושוחריה; ותה? נהפך המשכיל בשאלות החיים למגיד מוכיח בשער. לחשוך מהעונג הזה את נפשות נערי ישראל בהראותם למו כי לא זאת היא השכלה, לא זו היא הדרך ישכן אור, וכל הקורא במליצה ובשיר לפי דעתם מבלה ימיו בהבל, וכל כותבי ספרי בר מאפס ותהו נחשבו, ילדו לריק ול לה! נראה נא מה ידרשו מאתנו מבקרים כאלה! הודות לאל בכל עיר ועיר שער הגימינאזיום בארצנו פתוחים לרוחה ונערים עברים יבואו בו שגה בשנה, ולוא לא היה המקום צר מהכילם אז נוספו עליהם כהנה וכהנה, ובכן יש תקוה להם כי מהיכלי המדעים האלה יצאו דים למיניהם, אשר שפת קדשנו לא ידעו נצח לנו אנשים מלו ולזאת התקוה הקטנה אשר תנחמנו לראות שפתנו מתהלכת  בין החיים היא אך בין אלה אשר מניעות אחרות יעצרום מהיות למו נים בהיכל הזה. ועתה אם גם אותם נראה לדעת כי דרכם לא יתכן, ונבזה בעיניהם שפתנו הקדושה אז אבדה כל תוחלת למצא בימים הבאים כותב בשפת קדשנו. הן גם בלעדי דבריהם המלעיבים בהשפה ושוחריה נראה לדאבון רוחנו כי שוחריה ימעטו יום יום. מערים רבות נשמע קול תלונה על צעירי הימים אשר עזבו דרכי השפה, ישליכו דברי נביאנו אחרי גום, ולא מצאו עוד תשוקת הנפש בלשון אשר דבר ה׳ אל עמו ואל נביאיו. לזאת באמת החובה על המשכילים הנאמנים החפצים בטובת שפתנו להגדילה ולהאדירה לראות ולהרבות מספר החוגים בה ולא ילילו חלילה בכבודה נגד השפות החיות הדרושות בימים האלה, אשר אולי בזה ירימו קרנה בכבוד. אולם לא כן יעשו המבקרים בזמננו העוסקים  שאלות החיים; קמו לעשות קציר לה ופה ולקרב קצה לאבדה מן הארץ. אי לזאת אמרתי למבקרים כאלה לא זו היא הבקרת הנאמנה אשר תדרוש מכם הספרות העברית. לא בבקרת חצופה וגלויה תרבו סופרים בישראל; לא זו הדרך המובילה אל אושר הליטראטור להגדיל תפארתה ולהרים נסה להתפאר. הניחו לאיש איש לעשות כחפצו ורצון נפשו. המשורר ישיר שירהו, הסופר יכתב ספרהו. בעל החזיון יחזה חזיונות, וזה ידרוש בחקרי קדמוניות, אם אך כוונת כלם לטובת השפה תבוא עליהם ברכה, כי בזה ירימו למעלה ראש סגולת אבותנו היא שפת קדשנו לשמחת לב כל חובב עמו וספרותו באמת, ובתוכם גם אנכי מ׳ פ׳ ה."
