article_id,headline,text
044-MGD-1875-12-15-PG001-SINGLE-ORIGNAME_190417_toc_19,"לקורות אחב״י יושבי ארץ בעהמען
מאת דוד פאדיעבראד מפראג."," לקורות אחב״י יושבי ארץ בעהמען מאת דוד פאדיעבראד מפראג. המשך מגליון 42. בימים הראשונים עד שלא פרצה האמונה השלטת כעת בארץ בעהמען היה מצב היהודים טוב יואוד, כי יושבי הארץ עובדי אלילים בשם אלקיהם הלכו בצל אמונתם יחסיון, מה היו להם לעדער על ישראל אשר צורם רם ונשא אין לו דמות הגוף רואה ואינו נראה, לכן היתה אחוה ורעות עם יושבי הארץ ב״י הנו את דינתם ע""פ התורה ואין מותה Maloreci natu — Cosmos -205 כאשר כתב על זה הכומר  — בשנת 112 נשא הנסיך Wladislaw את היהודי  למשגיח על הוצאות והכנסות המדינה ואוצר הנסיך,  עד שמלשינים שהר פנו בו והדוכם ברחמיו הסירהו מכהונתו וישלח אותו אל ארץ אחרת!). ולא לבד כנענים היו יהודים בארץ גם בוני בתים וחרשי עץ ואבן היו ועושים כל מלאכה, גם אחרי עברו על ראשם גרושים הרבה, ואחד שובם היו עוד עושים בכל מלאכה. Cosmas מודיע שבארץ מעהרען לנה יהודי Podiwa עיר אשר עד היום שמה Podiwin ג ע""פ הודעות כתבי רמש״ק 2) היה במאה הט״ו למנינם יהודי חורש אבן שמו שמואל יום טוב פיגאלית אהוב בין רוזני ארץ ומעשי ידיו נגמלו בכסף מלא, 2) גם מלחים היו יהודים וע״כ פקודת מורי עם שבתו ביום הששי אחר הצהרים ממלאכתם. בבתי מטבע עושים יהודים מלאכה, ו) אך במאה הט״ז התחילה המלוכה לגדור גדר על יהודים עושי מלאכה, ונתנה דת שהיהודים בוני בתים אל יחזקו עוד בדקי בית תפלת נוצרים, וככה הלכו מטה מטה עד שצותה המלוכה שעושי בגדים ומנעלים חורשי זהב וכסף וכו' לא יעשו עוד מלאכה לנוצרים ולא ימכרו מעשי ידיהם רק לאחיהם ב״י, ולא בכל מקום כי אם ברחוב היהודים ?) לא נשאר להם להחיות את נפשם זולת מהמסחור והלואה בריבית אשר השררה החירה להם ליקח ו׳ ממאה, לכן בזדון התנפלו עלינו אובינו לאמור מרפים אתם נרפים. הלא המלוכה נתנה ידינו בנחושתים ואמרה לבו לנוצרים המלאכה ולא לכם, על כן רוב עושי מלאכה מב״י המירו את דתם. Alterthumer 5. 2 126 S. סr. שם שם ככה היה מצב ב""י עושי מלאכה עד שנת תר""ת שבה המלאכה לאיתנה והיהודים עושים היום מלאכתם ביתר שאת. אלו הן הגליות שעברו על ראש אב״י יושבי פראג וארץ בעהמען בשנת תתי״ט 1059 למנינם נגרשו מפראג על דבר עלילות ששרכו בתי תפלת נוצרים*). תת״ן), 1090 אמרה אשת השר ושופט בעיר ברין ראף קאנראד אל בן אחותה הנסיך Wratislaw כדברים האלה: אם יש נפשך לאסוף כסף, הנה היהודים יושבי על רגל הר עיר מבצ  המה מלאים כל טוב בזהב וכסף עליהם תשלך יר ותקח רכושם ילהחיות חיליך, מה שלא רצה האב היה בכח בנו שנת 1097 כאשר כתבתי בהמגיד גליון 35 אחרי שלא קבלו היהודים אמונת הנוצרים נלקח מהם כל רכושם ונסו לארץ הגר. בשנת 1124 שבו, ע״י השתדלות מומר אחד א). שנת ש״א 1541 שריפות רבות היו במדינת בעהמן ולא נודע מי המבעיר ורבו העם עם היהודים לאמור אתם עשיתם הדבר הרע הזה, וענו אותם, ורבים נשרפו קדושת השם בימים ההם, והקיסר פערדינאנד 1 גרש אותם מארצו, עד אשר נתברר ששקר ענו בם ושבו על ארצם ?), החכם ד׳ ג' וואלף הזכיר שני גרושים בשנת 1080 ובשנת 1035 10). ש""ב 1507 על  מריבה גדולה שהיתה בבה״כ אחד פה (אולי היא המריבה בחג השבועות רצ""ת לפ""ק שהי' בין עדת הספרדים ואנשי מלחמה אשר בעבורה נכתבה הסליחה (גזירת פויקר) שמתפללים בכל שנה בא""ח השבועות בבה""כ Digo de הישן אלטשט.) ועל דבר המריבה הזאת צוה שר המליכה  בשם המלך שהיהודים ישלמו עונש 2000 זהובים והיהודים ערכו כתב בקשה שאין לאל ידם לשלם עונש גדול כזה, אחרי שמסי המלוכה לא יעלו בכל שנה יותר מן 200 זה׳, גם העונש לא בא מטעם המלך לכן בטלה הגזירה. 11) אבל לא ארכו הימים והיושבים בסוד מדינת בעהמן חדשו הגזירה ונתנו לו שכל אחד ואחד מב""ב יגיד חילו והינו והשבועה תגיד עליו ישרו, על זה יראו לדעת אם יש בידם לשלם זאת, ואם לא ילכו לדרכם כי כנכסי המלך יחשבון ברצותו יאחזן ברצתו ישלחון. החכם ד׳ וואלף מזכיר שם שמות האנשים הבאים על החתום 12) אבל אחרי שלא עלה כל אלה לסך הנשאל גמרו יועצי המדינה לשלוח היהודים לדרכם, בעת ההיא חבר הגאון מ' אברהם בר אביגדור הסליחה „אנא אלקי אברהם"" נח נפשו כ""ז חשרי ש״ג לפ מנוחת כבודו פה. — בשנת שמ״ט 1559 בא מומר אחד ושמו יודא ד מאנדענא ואמר למלך יהודים עם קשי עורף המה ובגוים לא יתחשב ספריהם מלאים לעג וקלם על דת נוצרים לכן נלקחו כל ספרי קודש הנמצאים פה גם סדרי תפלות שבעים ככר משקלם והוליכם לעיר וויע ואחרי שנתברר כי שקר ענה בם קבלו היהודים ספריהם 13) — בעת ההיא הי׳ תבערה במחוז היהודים פה ונשרפו שבעים בתים, העם בא לשלול ולגזול זרקו נשים, לחיך התבערה לכן היהודים נסו לקולם כי אמרו כלנו מתים, אחרי כן יבא דבר המלכות ונגרשו כל היהודים מארצו אך י""ב משפחות נשארו בפראג, עד כי נכמרו רחמי המלך וקרא להם שלום ?1). — בשנת שכ״א 1561 נשבע הקיסר פערדינאנד הראשון בחלום לגרש היהודים מארצו, ויהיא בבוקר ותפעם רוחו וישלח ויקרא להכומר אשר התודע אליו חטאתו והוא מוחל וסולח, ושאל לו מה לעשות, והוא השיב לו כי שבועת המלך גם בחלום שריר וקים, ע״כ גרש את היהודים מארצו, עד שאזר כגבור חלציו המחוקק הנזכר לתהלה Pius . בשם מרדכי צמח הכהן והלך לרומי והאפיפיור החסד התיר נדר המלך 12) ושבו בנים לגבולם, על מצבת הר״ר מרדכי צמח כתוב, הרבה גרושים בטל, מסר נפשו, ולרומי הלך שבועת הקיסר יר""ה ע״י האפיפיור החיר - בת נפשו שנ״ב. מנוחתו כבוד פה גירוש האחרון בפראג היה בשנת תקה 1745 בשנת תק״א מת קיסר עסטרייך קארלוס הששי ולא הניח אחריו בן יורש עצר כ""א שתי בנות הבכירה מאריא טהערעזיא נשאה בחיי אביה את ההערצאג פראנץ פאן לאטרינגען. לפני מותו אסף אביה איליו את רוזני ארצו וצוה להם כי גם בת יורשת נחלה, לכן בתו חשב על כסאו ועל יבוא זר בנחלת אבותיו, לא כן היתה דעת הנסיך מארץ בייערן כי אמר שהוא נין ונכד ממלכי עסטרייך ולו משפט הירושה ולו העטרה. עמו חברו מלכות פרייסען צרפת ופאלען. ארבעה אלה ערכו מלחמה עם המלכה אשר ישבה על כס אביה כאשר צוה, בשנת תק""ב עלתם מלכות פרייסן ולכדה ערי שלעזיען וחיליה פרצו עד מדינת מעהרן, .Josef 11. בעת ההיא לקחה המלכה את בנה אשר ילדה הוא הקיסר  והלכה לעיר מליכת הגר פרעסבורג ונקבנו שם שרי המדינה, והנה המלכ הראתה להם בנה, ואמרה רבים קמים עלי, לכן עמי אחסה בגלם וחוסו עלי ועל בני, אני אהי׳ לכם לאם ואתם תהיו לי לעם. רוזני המדינה נשבטו כולם פה אחד להיות לה לעם בכל נפשם ובכל מאודם נתנו כתר יילכות על ראשה ועל ראש בנה הקטן, לכן חילי הגר באו לה לעזר וערכו מלחמה עם מלכות פרייסען, אגל גם הנסיך מבייערן וחיליו עם חילי צרפת באו בעת ההיא לארץ בעהמן ולכדו עיר פראג המלכה עשתה שלום עם שונאיה לכן עזבו כל ארצה כאשר המה בכתובים. (סוף יבא). lor. G. Woli Verurcibung der bohn. Juden 1745. Alterthtiner nach Cosmae. Wolt Vertreibung Her Juden 3. "" 10 „צמח דור ח״א Austr. der Juden aus Böhien 1745. 1. Wolf. Wahrheit. Nro. 45. למת דוד ח״א עד 15 184 שם "" .101 עמק הבכא 12"
044-MGD-1875-12-15-PG001-SINGLE-ORIGNAME_190417_toc_20,," הודעות.  קול קורא לאסוף את „המגיד"" לשנת 1876 היא שנת העשרים למנות ימי היותו. גם באחרית השנה הזאת, שנת 1875, הנני קורא אליכם אחים נכבדים, בעלי בריתי מאז וחדשים מקרוב יבואו, אשר תואילו לתת ידכם לי ולקדם פני עם המחיר לשנה החדשה בטרם תצא הישנה, למען אדע להכין עלים ומצא לכם, ואני כאשר שמרתי את תפקידי עד היום לעשות כרצון איש ואיש ככל אשר מצאה ידי, אשתדל גם מעתה לעשות לטוב בית „המגיד"" למען הפיק רצון מאת הרב הדר. המו״ל ומאת כל לוקחיו על ידי, וגם סוכני הפרטיים פה בעיר ובמדינה ישמרו לעשות גם הם כאשר עם לבבי וכל לוקחי „המגיד״ על ידי או ע""י סוכני אשר שמי בקרבם ישבעו רצון ולא ידעו דבר רע. אך לדבר הזה יסלחו לי גם אלה מבעלי בריתי הקרובים מאדו Bartenstein, bei Königsberg בפי ובלבבי אם לא יגיע „המגיד"" לידם אחרי תום זמן חתימתו, בטרם ישלחו כסף מחירו, כי לא אחת ושתים דברתי: אשר לא אשלח לאיש בטרם דרשו את „המגיד"" מפורש מידי, לא מפני חסרון אמונה חלילה, רק מפני אשר חזק שמתי לי ולא אשבור עלי חקי זה כל הימים, ולישרי לב סליחה! ווארשא, בחדש כסלו תרליו לפ""ק. אליעזר יצחק שפירא. L. J. Schapiro So. Jurskaia N. 22. Warscha wa"
044-MGD-1875-12-15-PG001-SINGLE-ORIGNAME_190417_toc_21,, Crliner Knaben-Erichungsanstalt.  את בית חנוך הנערים אשר לי העתקתי ממשכני הראשון אל מבחר חלקי העיר. והנה זאת אדרעססא שלי עתה: Habbiner Bpr. A. EErIich. Direcior Berlin W. Linkstrasse 23.
044-MGD-1875-12-15-PG001-SINGLE-ORIGNAME_190417_toc_22,," הודעה. אנחנו קהל עדת ישראל מעיר סימפעראפיל העומדת בחצי האי קרים ברוסיה מבקשים היום איש רב תבונה ביראת ה׳, איש אשר חכמה דעה בינה גם אמונה חוברו בו יחדיו, איש טוב ומטיב אוהב שלום ודובר שלום ומעורב בדעת לדרוש לעדתנו לעת מצוא בדברי אגדה ומדרש, וגם הדרת שיבה זרקה בו, מבן ארבעים שנה ומעלה וקלסתר פניו יעיד על כל תהלוכותיו ונכתר בכתר הסמיכות מגאוני זמנינו היודעים לנו לשם ואשר סמכו ידיהם עליו כי מצאהו נכון ומוכשר לשרת בקודש. גם ליודע דעת להשיב לשואליו דבר בחוקי שלום המלכות בהזדמן לפעמים להתיצב S. Kacperowski in Sche zuezy לפני גדולים במענה לשונו לתפארת. ואחרי הדרישה והחקירה כי המעלות הנזכרת נצמדו בו לאהבה אז ימצא עונג ונחת להשיבו על כסא הרבנות בראש עדתינו ולעטרהו בעטרתה ומשכורתו תהיה שלמה מאתנו כיאות לכבוד התורה ולכבוד חכמיה ודורשיה! כל רב ומ״ץ החפץ במשרה הזאת ישלח לנו העתקות הסכמותיו ממי נסמך ולהודיענו דברים השייכין לפרטים דמי השכירות שנה בשנה ואז נקדמנו פניו במכתב תעודה נכונה על אדרעס גבאי דבהמ״ד קלמן העלפינבייי יהושע בן שאול יחיאל ראש דבהמ״ד. קלמן בן יחיאל מיכל הכהן העלפינ. ביין גבאי דבהמ״ד הגדול. אברהם כן יוסף פרעשקואף גבאי דבהמ״ד הגדול."
044-MGD-1875-12-15-PG001-SINGLE-ORIGNAME_190417_toc_23,," מודיי- עת רבה לסוחרי ספרים הנני מודיע בזה לכל אלה אשר דבר מסחר הספרים מגיע, כי לבד הפלאטטען - מנהנים ורמזים ע״פ הנגלה והנסתר של כרכי הש״ס שנדפסו ע״י גראסמאן בשטעטין הקנוים לי מאז התגלגלו ובאו לידי גם הפלאטטען של חצי הש״ס שהדפיס המנוח א׳ זאלאמאן מטילזיט בבערליי שני הש""ס האלה מפורסמים בטובם יפים ומיטב מידת גדלם, אך יי כי חיינו פדין הבן ובכור בהמה ודיני חלה מחש""ס ואלא מאן נחלקו כרכים לאלפים, ע״כ גמרתי בעזרת ד׳ הגומר עלי לגמור יע ולחיים והקבה וראשית הגז וטומאה זו של זאלאמאן עם כל המעלות שהיו בכרכים הקודמים, ועוד נוספו עליהם הגהות וחידושים לרבינו הגר״א ז״ל על מס׳ ערכין תמורה, ועוד מעלות בקודש, במשך לא יותר משתי שנים. לתכלית זו כבר הוצאתי לאור כרך קדושין סוטה, אשר יצא ראשונה אין בידי גם אחד) אשר יטעמו גם מספרי במספר מועט, וכרך נדרים נזיר, ועוד מעט יוגמרו כרך ב״ק, ב״ב, שבועות. ולבד כל אלה נמצאים בידי כל הכרכים הראשונים, והי׳ כל הדורש אותם יפנה אלי וישיגם, ולסוחרים ינתן ראבאט הגון! הש״ס יהי׳ מחולק בעשרים וחמשה כרכים, ואלה המבקשים להשלים הש״ס של גראסמאן יפנו אלי, ויודיעוני הכרכים שיחסרון למו, ואדפים אלה הכרכים משם זאלאמאן על פארמאט של גראסמאן, למען עשות כרצון איש ואיש. ווארשא. בחודש מרחשוון תרל״ו. וואלף יעבץ. אדרעססע שלי Woli S. Jawitz, Warschau."
044-MGD-1875-12-15-PG001-SINGLE-ORIGNAME_190417_toc_24,,"  משוררים 4 גוטען טענאר 1 גוטען באסס,  2 זאפראניסטען מיט קרעפטיגען שטיממען. דיא אויך דיא נעטהיג ענגטניססען דער מוזיק האבען. זיך אן דיא אונטערשטעהנדע  וואללען אדרעססע ביס דען 15 טען יאנואר ווענ- דען. דער געהאלט פיר יעדען משורר פאן  20 ביס 30 טהאלער מאנאטליך אונד וואהנוג antor A. M."
044-MGD-1875-12-15-PG001-SINGLE-ORIGNAME_190417_toc_25,," הנני מודיע כי יצא לאור ספר: מביא המשנה כולל תולדות גדולי תורה מימות עזרא עד סוף המשנה ודרכי למודיהם מאת יאקב ברילל רב דק""ק קאיעטיין והוא להמכר אצלי במחיר ד׳ רייכסמארק א. ברילל. A. Brull, Frankturt a. M. Sandweg"
044-MGD-1875-12-15-PG001-SINGLE-ORIGNAME_190417_toc_26,," מודעה. כבר הודעתי בהמגיד (נומער 44 ש״ע) שאוכל להמציא לכל דורש כל מיני ספרים ספרי מוסר, דרוש, בקורת, מליצה ושיר, ש״ס וספרי לומדים אחרים מדפוסים רבים. ועתה אתכבד אני להודיע שמאז ועד היום נתוספו לי ביה עוד ספרים רבים מדפוסים שונים והכל במקח השוה. גם אוכל להמציא לכל מבקש טליתים. וספרי תורות גדולים וקטנים עם הכשרים מרבנים מפורסמים, ואקוה כי אפיק רצון מכל איש אשר ישא ויתן עמי. שלמה קאצפעראווסקי מ""ס מעיר שצוצין. האדעססע אלי: Polen."
044-MGD-1875-12-15-PG001-SINGLE-ORIGNAME_190417_toc_27,," ספר כתר כהונה (מהמחבר ספר שלחן הקריאה) בו נכלל כל תורת כהונה הנהוג בזה״ז, היינו ברכת כהנים בנשיאת כפים לעם הישראלי (כהנים בעבודתם ולוים בדוכנם וישראל במעמדם) ע״פ ההלכה ברורה מפוסקים ראשונים ואחרונים עם שו״ת ראו א עד (ועד בכלל) שו״ת גאוני זמנינו, אשר המה חיים עדנה יאריך ה׳ ימיהם בטוב ושנותיהם בנעימים) כפי יד קט שכלי משגת כאשר עשינו בחיבורינו שלחן הקריאה. גם מתנות כהונה וטהרה כו׳ וכו, ושאלתי ובקשתי לעם ה׳ ולמו״ס אשר הריצו אלי אגרותיהם בדרשם את ספר שלחן הקריאה כי אשלח להם, כתר כהונה הנ״ל ויאמרו, כי גם הוא טוב מאוד, והנה תואמים מבטן אחד יצאו וכמעשהו בראשון, כך מעשהו בשני, ונא שלא לעבור על בל תאחד מלאספהו אל תוך ביתם הברבה הזאת למען החסרון לחמנות. ויתברכו בברכה המשולשת בתורה ומפורשת באר היטב בס׳ כ״כ אשר יצאמאת המחבר דובער דוד ריפמאן בבער לין שפאנדויער בריקקע:."
044-MGD-1875-12-15-PG001-SINGLE-ORIGNAME_190417_toc_28,", ־ •) ט^ון ^> ^רן גזרס (וקרי?ט''ן כ(3"" ..."," *) מלשון אל ארץ גזרה (ויקרא ט״ז כ״ב) והמה מידך נגזרו (תהלים פ""ח ו׳), אסור למקום המוכנת להכניע שמה האויב ולגרשו הלאה. הנ""ל א) הנני להודיע כי מכיר אנכי בטוב העלה הישר כמר אלי׳ עקיבא זימאן בהנגיד המפירסס מור"" שמואל יצחק מק״ק סלאבדקי אשר העלם הוא ממשפחה ראוי׳ והולך בדרך הישר כדרך בני הנעורים אשר מתנהגים בדרך הראוי׳ והרצויי׳, לפני ד' ואנשים ולאות אמת באתי על הקתום קאוונא, ב׳ כ״ד מ״ח תרל״ו. נאום יצחק אלחנן החופ""ק."
