article_id,headline,text
044-MGD-1880-08-11-PG001-SINGLE-ORIGNAME_240265_toc_12,רומעניען.," רומעניען.  מכתבים מבוקארעסט (מאת יחשוע חלוי ס״ט). (סוף מגליון 31). ולכן התלמידים האלה שלמדו תחת המורים הנזכרים כאשר יחנו בלי ידיעה הרבה מלשון עבר כן יסעו לפארים וכן רצים ושבים, וכאשר הוכחנו לדעת מהמורים הראשונים אשר הכרתים וידעתים ובחנתים, כי לא הבינו את מחשבת הח׳ כי״ח כי ללמו טוב תורה כל מגמתם ועל ידי למוד לשון צרפת עם דרך ארץ, יהיו לאנשים להתחבר לחברתם, וראשי החברה חשבו כי מורים עברים ימצאון בכל ערי ישראל לרוב ונשאר להם למלאת החסרון, רק מורים צרפתים, ולכן עשו ויסדו ב״ס הנז׳ ללמד המורים לשו צרפת מבלי לחקור ולדרוש אם נמצאים מורי שפת עבר היודעים ללמוד וללמד, רק הניחו את דבר כל הלמוד ביד מנהל הצרפתי לעשות כטוב וכישר בעיניו, ואם נמצא אחד בעיר או שנים במדינה מורה אשר ראוי היה להיות מורה שפת עבר אם לא אכף את ראשו למצא חן בעיני המורה ומנהל הצרפתי, אז רע ומר היה גורלו אחר שראשי העדה מענים אותו בענוים קשים ומרים והנה גם הפקידים הוסיפו יגון על יגונם ומהרו אסונם וגרשום ממעונם והשאירו הרבה פעמים ללמד כמה מאות ילדים על ידי בערים מנוערים. ולכן נשארו התלמידים ממששים בצהרים כעורים. כאלה וכאלה הן הנה הסבות אשר הסבו את לב בני ישראל לפנות עורף לשפת עמם. ואם ידרשו ממני עדים נאמנים על כל אלה מוכן אנוכי להניף עטי ואשיב לשואלי דבר כי על אדני הצדק הטבעו דברי, והחברה כי״ח מוציאה עד היום הוצאות מרובות ובידנו אין מאומה לחזק את דתנו ושפתנו ולהיות לאחדים כל בני ישראל אחים ידידים על ידי קשר החזק אשר עוד היא אופן החיה, השפה העבריה הגפן אשר ממצרים ה׳ הסיע עודנה פוריה ורשפי דת קדשנו שלהבתיה ואחר היות נטע השורק כלה זרע אמת ואיך יהפך בזמננו ואולי יותר ויותר לאחר כמה ימים לסורי הגפ נכריה זאת היא עצתי הנכונה, יסודה היא נאמנה. להביא מזור להמחלה הזאת אין דרך אחרת רק ליסד בית למוד כללי גבוה (סימינאר) כבירת תוגרמה קאסטאנטינופול, או בירושלים, בהוצאות ותחת השגחת החברה כי״ח, ועל יסוד נאמן קרן הקימת מהשר וגדול ליהודים הטוב והמטיב הדואג תמיד להיות מושיע לאחיו היושבים בשפל המדרגה, ולכן ראינו הראשון שהתנדב סך גדול אלף אלפים פראנק ליסד בתי ספר בתוגרמה, ועוד ידו נטויה בכל מקום אשר ידרשו עזרתו כאשר ידענו ושמענו כי בטח ישמח הוא וגם כל החברים להח' כי״ח כי הונחה אבן הפנה לבית ישראל להצמיח ישועה לדתו ואמונתו ולהיות עמוד התוך לכל בתי הספר המיוסדים שמה בארץ גדולה בארץ תוגרמה ללמד מורים בידיעת וחנוך לשון עבר בדקדוקיה וטעמיה חקי התורה שבכתב ובעל פה וכן ללמוד שפת המדינה הנחוצה מאד לדעתה, כאשר ראינו כי חכמי ספרד הראשונים והאחרונים בגלותנו שמה גדלו ונשאו להיות בין רוזני ארץ וקציניה כאשר ידוע. וכן ללמוד לשון צרפת על תקונה ומכונה ואחר מדרגות ללמד המורים יהי כן מדרגה למעלה ללמד להיות רבנים מופקדים מצד הממשלה נכתרים בתאר דאקטאר כאשר עשו ויסדו בתי למוד גבוהים בכל ארצות הנאורות הידועות לכל קרא משכיל בכה״ע. ועל ידי בית למוד כזה למודים ולרבנים יהיו מלומדים בלשון עבר וכן בשפת המדינה אשר יגורו שמה ושפת צרפת וכן שכר המורים ללשון עבר ישולם מן החברה, כאשר משלמים להמורים ללשון צרפת הנשלחים עד עתה מפאריז ולא כאשר עשו עד כה להניח דבר המורה לשון עבר לשלם מקופת הקהל ואז נשאר מורה העברי „עורי"" משתי עיניו חשך משחור תארו לא זכר לו בחוצות מרוב עניו ולחצו ולכן לא די שלא יכלו לעשות מלאכתם באמונה כי נפשם שבעה ראש ולענה. בית המלמד הוא רק נהרס נגש ואין חונן ומרחם. בני ביתו כמה מים עטופים ברעב והוא מתגרת יד המושלים נענה. צועקים ובוכים להשיג מאביהם פרוטה קטנה ואין מענה בפיהם להשיב נפש עולליהם, הצועקים כבת יענה וזה הדבר גם כן היה בעוכרינו! כי ברחו כל איש ישר ונכון דבר מלהיות מורה שפת עבר, הוא או את בנו בראותו כי רע ומר יהיה גורלו אם ירהב בנפשו עז להגיש להצרה הזאת. ידע כי ירעב יחרפהו בשם מלמד הוא וכל בני ביתו ישא חרפת מלאכתו וכל הימים יהיה נעלב אוי לו ואויה לו אם יבקש להיות לו תורתו אומנתו, כי נכונו לו שפטים מידי אדונים קשים בהיותם המטרה לחציהם השנונים נשפטים, וורק אם אכף עליו הזמן יכרע ברך לפני תלאות היום ומצבו נורא ואיום, אז יכוף ראשו כאגמון בשברון, אחר היותו סוחר הוכה במסחרו, בחסרון, אם למד או לא למד הרבה בנערותו דבר מה! אז יהיה מלמד ובטח לא יצא מתחת ידם דבר מתוקן כי הרבה מסוכן! (סוף יבא)."
044-MGD-1880-08-11-PG001-SINGLE-ORIGNAME_240265_toc_13,עול קקסטי חכוחי ^י6 6קי£. סקקן ל0גי3 6רכ..., עוד משפטי וזכותי לאיש אחר. כל החפץ להביא ברכה אל ביתו יפנה Bisig Graber Frzemysl :בטובו אלי במכתבו על האדרעססע Ga וישיג על אופן הנאות. הכותב. *) בית זו אשה.
044-MGD-1880-08-11-PG001-SINGLE-ORIGNAME_240265_toc_14,ידיעות אחרונות.," ידיעות אחרונות. מדברי כל מכה״ע בפאריז נראה כי אין ברצון עם צרפת להתערב Temps בפועל בעניני תוגרמה. רוח כל העם דובר במכה״ע האומר בגליון האחרון: אנחנו הצרפתים אוהבים את הגריכים, אך אהבתנו ההיא לא תוכל להסב מבטנו מעניני ארצם וטובתה. צבאות ארצנו אינם נועדים רק למטרת תועלת ארצנו. מ רתם היא להגן על גבולות ארץ מולדתנו ולא לשפוך דמם בעד הרחב יל גריכענלאנד ומאנטענעגרא. ארצנו נסתה פעמים רבות להריק חרבה לטובת עמים אחרים, ומה היתה התודה לנו בעבור זאת? כאשר היינו בצרה ובאו מים עד נפש, ענו ואמרו לנו כי כל ארץ עליה לדאוג רק לטובתה ולא לטובת ארץ אחרת. הבה איפא, ככה נעשה גם אנחנו. אמנם כן שלחנו מלאכנו בסוד הקאנפערענץ, וגם אניות מלחמתנו תלוינה ליתר אניות המלחמה לשלחן לחופי ים תוגרמה אבל לא נתן לשפוך אף דם אחז מצבאותינו לטובת אחרים״ עכ״ל. לפי הידיעות האחרונות מלאנדאן הציעה ממשלת ענגלאנד אל תר הממשלות אשר כלן תחתמנה ידן אל פראטאקאל מיוחד טרם תשלחנה אניות מלחמה לתוגרמה, אשר בכתב ההוא התחייב עצמה כל אחת מהן שלא לשמש בענין ההוא לטובתה הפרטיר ולהרחבת גבולה ע""י השנויים שחיו נעשים בתוגרמה. ממשלת ענגלאנד תשען בהצעתה זו על דבר דומה לזה בשכבר הימים. אז כאשר נועדו הממשלות האדירות לפרוק עול התוגר מעל צוארי הגריכים חתמו כלן פראטאקאל כזה, וכן היה הדבר כאשר שלחה רפת צבאותיה לסוריא נגד הדרוזים, התחייבה עצמה ג״כ בכתב מיוחד שלא לקחת לה אף מדרך כף רגל וכו׳, מזה נראה כי גם ענגלאנד לא תאמין ברעותיה אשר כלן תעשינה מה שתעשינה רק למען המצוה. — מצב השר גלאדסטאן הולך וטוב. — על השאלה שנשאלה ממשלת ענגלאנד בבית הנבחרים על אדות הנאטען שנשלחו אל הסולטאן ותוצאותיהן, ענה שר המלוכה דילקע, כי ששת הממשלות האדירות נועצות יחד כדת מה לעי תה ביחוס שאלת גריכענלאנד אחרי שלא יחפוץ הסולטאן למלא רצון הקאנפערענץ. כרגע לא יתכן להודיע הדבר ברבים. בנוגע מאנטענעגרא השיב השר כי הממשלות הציעו עתה אל הסולטאן שנים אופנים שונים לשים על ידם את המעקשים למישור, ויש תקוה כי יסכים הסולטאן לאחת מהם. ואם יקשה ערפו וימאס בשניהם, אז יבא הזמן להמתיק סוד מה לעשות גם אדות השאלה ההיא. מאתונא בירת גריכענלאנד מודיעים כי ההכנות למלחמה לא תגמרנה שם טרם עבור שבועות רבים, יען מספר הצבא יתרבה בכפלים. — ראשי הליגא האלבאנעזית בעיר פריזרענד, צוו אל ראשי שבטי הארנויטים להכין עצמם לצאת המערכה. ה שלח אל ראשי הליגא סך שמונת עשרה אלפים לירא שטערלינג במדינת בעלגיען פרץ ריב בין הממשלה והאפיפיור. ימים רבים היו הממשלה ורב באי כח העם שם מבעלי ברית האפיפיור וקד  ע״כ עשו תמיד את רצונו. עתה נשתנה הדבר ע״י הבחירה החדשה אשר רוב הנבחרים הם מהליברלים, וע״כ הפקיד המלך גם שרי מלוכה מהליברלים אשר טובת ארצם ולא טובת האפיפיור וקדושיו הם דורשים. השנוי הזה הסב שנאה בין הממשלה והאפיפיור עד כי החליטה הממשלה להפריד ההתחברות הדיפלאמאטית בינה ין האפיפיור, ותגרש את מלאכו מחצר המלוכה. בהאסיפה האחרונה של נבחרי העם שאל אחד מהנבחרים היושבים מימין הבית והם בעלי ברית האפיפיור את הממשלה על אדות דבר הריב. השר היושב ראשונה במלכות ענה כי יש בידו חבילות ראיות ומופתים כי מלאכו של האפיפיור התאמץ להעיר מהומות ומנוכות בקרב הממלכה, והשתמש בערמות ושקרים. בסוף דבריו אמר השר כי כל היוצא מפי המלאך שקר וכזב הוא, יען גם אדונו מקשיב על דבר שקר. הועד. אך רוב הועד הצדיק את הממשלה בריבה עם השחורים. לפי הידיעות האחרונות על דברת מפלת חיל ענגלאנד באפגאהאניסטאן, ברור הוא כי רק שר הצבא אשם בדבר האסון הוא העלים עיניו (או מחסרון ידיעה) מכל דבר הנחוץ למפקד גדוד חיל ומבלי ראות הנולד, רק אסר המלחמה בלי דעת ותבונה, ע״כ הדביקתהו הרעה לכלימת עולם לצבא ענגלאנד. — שר הצבא ראבערטס עזב את קאבול בראש עשרת אלפים איש והול לעומת קאנדאהאר. איוב קהאן גם הוא מאסף אל דגלו צבא רב לחדש המלחמה על אויביו."
044-MGD-1880-08-11-PG001-SINGLE-ORIGNAME_240265_toc_15,בנוגע לחטןרעח בגל>ון זח לראש השנת ביחוס ...," בנוגע להמורעה בגליון זה לראש השנה ביחוס פתקי-ד ברכה גראטולאטיאנסקארטע) אשר הכין ה. מאקס פיקטאר בעיר קעלן מצאנו לנכון להעיר כי לפי הפתקאות ששלח אלינו לדגמא ראינו כי נעשו בטוב טעם ודעת בכשרון המעשה ומאד דרושים לחפצם. טוב ויפה אשר כל החפצים להשמש בפתקי-ברכה לר״ה לשלחם לרעיהם ומיודעים, יקנום מאת הנ״ל וימצאו בם חפצם."
044-MGD-1880-08-11-PG001-SINGLE-ORIGNAME_240265_toc_16,בקרת ספרים.," בקרת ספרים. וצר הספרים. ספר ערוך לידיעת ספרי ישראל נדפסים וכתבי יד עד שנת התרכ״ג לפ״ג (1863) יגיעו למספר שבעה עשר אלף (17,000 כסדר א״ב. מטעם הלעקסיקאנע הנבחרים למצא דברי חפץ מאת הרב החכם וסופר הביבליאגראף המובהק יצחק אייזיק בן-יעקב ז״ל מווילנא. ישי גם הגהות והערות הרב החוקר המפורסם דר׳ מ ניידער הש ני׳ מבערלין. יוצא לאור בפעם הראשונה על ידי בנו יחידו יעקב יעקב בווילנא, בדפוס האלמנה והאחים ראם בשנת תר״מ. מכלכל חלקים על אקטאף גדול (לעקס׳ פארמאט). כי התבוננתי על אוצר הספרים הלזה קראתי עליו אוצר נחמד בנוה חכם (משלי כ""א כ'). הן בגלל חמשה דברים ראשים נחמד מאד להשכיל. וטוב ונכון אפוא אשר כל חכם יאספהו אל תוך נוהו. ואלה חמשת הדברים הראשים אשר בגללם הנו נחמד מאד להשכיל. 1) על פיהו יודע יקר תפארת ישראל. הן בהפיקו מען אל זן ספרי חושיה ומזמה לאלפים ולרבבות מחכמיו הוא מראה עושר ספרוחו, ועושר ספרוח עם הוא עד נאמן על שפעת חכמיו ומרבית נבוניו, וברב חכמים ונבונים רב-צדק ומשפט ומשרים בקרב ההמון, כי יותר שהם חכמים עוד ילמדו דעת את העם לזכות את ארתו ולפלס מעגלותיו ולרעות תם וישר ובזה רבה תפארת העם ויקרו ישגא מאד. 2) הנה רבים מרפים ידי המשכילים, ומבהלים אותם לשמור מזוזת פתחי החכמה באמרם: כל הלוחמים בלחמה אהבו מות כי מות בסירה. ובאוצר ההוא תחזקנה דיהם, הן יראו בו המונים המונים ספרי חכמה אשר בעליהם היו גדולי תופשי תורה ורבי יראי ד' והחכמה לא פרעה פרעות כל מאומה בתורתם וביראתם, אך להפך היא הוסיפה למו עוד אומץ ונהרה, ולכן אמר ר' אלעזר בן עזריה: אם אין חכמה אין יראה (אבות פי״ג מי״ז). בסוף מסכת דרך ארץ זוטא: הדר תורה חכמה וכו' חכמה ויראה צדיק גמור עכ״ל. והראב״ע כתב בפירושו על התורה (שמות י""ח כ""א): כי לא יתכן להיות ירא שמים כראוי רק מי שהוא חכם, עכ״ל. ובספר מוסר השכל המיותם לר׳ האי גאון: וכל גב. אשר אין לו תבונה, הלא הוא כבהמה באמונה עכ״ל. ועוד מאמרים רבים כאלה נמצאים בספרים דגולים מרבבה, אך אין פה מקום. 3) לכותבי תולדות חכמים יועיל האוצר הזה עד מאד, כי על פיהו ידעו את הספרים אשר יסד כל חכם וחכם, וגם ידעו ממהות הספרים הרשום שם מהות בעליהם, אם תכם תורה ותעודה, אם חכם למודיות או טבעיות או אלהיות, אם חכם שיר ומליצה, ואם בעל הגיון, ועל תועלת ידיעת תולדות חכמים כבר נכתב למכביר מחכמים רבים כבירי כח לב. 4) לכותבי תולדות הספרים וקורותיהם, ואף גם להוגים בספרים בעין חדרת ודורשים אחר הנוסחאות השלמות וחפות מסגים ובדילים, יש מועיל רב באוצר הזה עפ״י רשימת הדפוסים השונים מכל ספר וספר הנמצא בו, כי יש שנוים גדולים בין דפוס לדפוס ומדפוסים הראשונים נשמטו הרבה מאד בדפוסים האחרונים, אם למען המעט הוצאת הדפוס, ואם למען העלים דברים אשר הם למורת רוח המתקדשים והמטהרים אשר בימי המדפיסים האחרונים, ויש בין הנשמטים דברים רבים אשר הם יקרים ומועילים במאד מאד. יעוין לדוגמא התשובה היקרה על אדות הקראים הנמצאה בשו״ת ר׳ בצלאל אשכנזי דפוס ראשון ותשובה קב״ו משו״ת הרמ״א ונשמטו בדפוסים אחרונים. ועוד הרבה תשובות ומאמרים והקדמות ושירים ומליצות השמיטו המדפיסים האחרונים גם כי יקרו מאד אך למען בצוע בצע. ובלעדי זה עלו רבים מהדפוסים האחרונים חדולים וכסו פניהם שגיאות. ולכן כל החפץ להבין את הספרים לאשורם ולראותם כהויתם ביום הולדם ידרוש אחר דפוסים שונים וביחוד אחר הד שים הראשונים אשר לא קרו אותם עוד מקרים ממקרים שונים כבדפוסים האחרונים, ולזה יעזור הרבה האוצר הזה. 5) האוצר הזה מודיע לנו, כי רבו כמו רבו חכמים גדולים אשר עמלו ויגעו להבין דברי הראב""ע בפירושו על התורה וחברו עליו פירושים, וזה מועיל מאד להרים קרן הראב""ע בכבוד ולשום לאל דברי מחרפיו וביחוד דברי המחרף האחרון בעל אמונת חכמים אשר פער פי עטו לבלי תק ולבלי דרך ארץ וכנהו בשם: כופר ופש, ובע״ה אהיה מגן בעדו במאמר מיוחד. ובעבור חמשת חמודותיו אלה איעצה לכל המשכילים על דבר המתרפקים על דודי חכמת ישראל לקנותו, ומחירו ליחידים, עם פארטא: ברוסיא, רו״כ 4, באשכנז מארק 12. בצרפת פראנק 15. בבריטניא ואמעריקא שיללינג 13. — באוסטריא פלארין 7. והמחיר הזה הוא מצער מאד לפי גדל כמוחר ואיכותו, וידעו להם אמונה אשר יש יתרון לאוצר הטוב והמועיל הזה מן כל האוצרות אשר לפניו גם בכמות גם באיכות. יתרונו בכמות נראה כל איש, ויחרונו באיכות הוא באשר נכתב בעמל כביר ובדקדוק רב וברוח מחקר ובקרה, כנראה ממחקרו בהרבה ספרים על אדות מחברו האמתי ומדברים אחרים, והמשכילים יבינו. ומלבד אלה היתרונות הפנימים אשר לו הנה הוא עולה על כולם גם ביתרונותיו החצונים, המה: סדר הנכון ותפארח הדפוס הלוקחים עינים ולבות. ואשר יהי את נפשו לקנותו ישלח את הנ""ל אל המוציאו לאור הוא בן המחבר אשר תוו היא: Jacob Beniacob, in Wilna, )itussland, sirotskaga Nro. 27/10 Per Warschau. ומדי דברי באיש ההוא היקר מחכמה מכבוד ברך אגרכנהו נגד השמש כי יגמלהו אל גמולות בצדקו וכבור ידיו ויתן לו משנה שכר תחת החסד אשר עשה עם אביו המחבר בהוציאו בעמל אין חקר לו את אוצרו הטוב אשר הניח אחריו ברכה ועם ספרוח עמו בהראותו את כבוד עשרה ורוב מכמניה ותיקר גם בעיני חכמי העמים המבינים לשון עברית ולרגלה אף העם אשר בו חוללה כסא כבוד ינחל, כנ״ל. יעקב רייפמאנן."
044-MGD-1880-08-11-PG001-SINGLE-ORIGNAME_240265_toc_17,," Ganz neul לראש השנה hochelea מיינע מיט אונגלויבליכען ערפאלג זייט יאהרען איינגעפיהרטע גראטולאטיאנס קארטען מיט בריפטעקסט בעווייזען צור געניגע, וועלכער גראססען בעליבטהייט זיך זאלכע ביים פובליקום ערפרייען. דענזעלכען האבע איך אין דיעזעם יאהרע איינע נייהייט הינצוגעפיגט, דיא געוויסס יעדערמאנן וויללקאממען זיין ווירד. דיעזעלבע בעשטעהט אויס קונסטפאלל אויסגעשטאטטעטע גראטולאטיאנסבריפע, אונד קאררעספאנדענצקארטען מיט עם העבר. מאנאגראמס, ערסטערע מיט קאררעק וח. געגען פארהעריגע פראנקא איינזענדונג דעס בעטראגעס אין באאר אדער בריפמארקען פערזענדע איך פראנקא; 1 דטצ. האכפיינע גראטולאטיאנסבריפע אויף פיין ווייס בילעטל טפאסט מיט לוח צו 1 מארק — אדער 60 קרייצער עסטרייכישע וועהרונג. 1 דטצ. האכפיינע גראטולאטיאנסבריפע אויף האכפ. פארב. דאמאסטפאפיר מיט לוח וא ! מארק 30 — אדער 75 קרייצער עסטרייכישע וועהרונג. 1 דטצ. האכפיינע קאררעספאנדענצקארטען אויף פיינסט. פארב. עלפענביינקארטען מיט מאנאגר. צוא פפענ. — 90 אדער 55 קר. עסטרייכישע וועהרונג. מיט איינדרוקק דעס וואהנארטעס אונד נאמען דעס אבזענדערס פפענ. 60 — אדער 30 עהר פער דוטצענד. וויעדערפערקייפער פאן 10 דוטצענד אן ,25% ביי 40 דוטצענד 13 33 ראבאטט. בעשטעללונגען געגען נאכנאהמע ווערדען ניכט עפפעקטואירט Max Wictor, Cöin a. RE."
044-MGD-1880-08-11-PG001-SINGLE-ORIGNAME_240265_toc_18,," כשר Seebad Ostende. Hotel Palk כשר 108  מהרהר האטעל פאלק, אסטענז ע פיליאלע פאם האטעל פאלק אין עלבערפעלד רוע דוא נארד 4 אונד רועד  עטעס הויז עספאגנע 12 געבען דעם האטעל דע פרוססע. גאנץ נייא איינגערי   אם שט זראנדע מיט אויסזיכט אויף דאסס מעער. יעדען פרייאטאג אבענד אונד זאנ. גאבענד מארגען גאטטעסדיאנסט אים הויזע. בילליגע פרייזע יע נאך לאגע דער ציממער; פראכטפאללער אויסזיכטסטהורם אונד טערראססע צור פערפיגונג דער בעזוכער. טאבלע דע האטע אום! אוהר אונד 61 אוהר א לא קארטע צוא יעדער טאגעסצייט. דייט ושע בעדיענונג. 6 פרעמדע שפראכען  האטעל פאלק, אסטענדע פיליאלע פאם האטעל פאלק אין עלבערפעלד. פארהעריגע אגמעלדונגען אן האטעל פאלק עלבערפעלד"
044-MGD-1880-08-11-PG001-SINGLE-ORIGNAME_240265_toc_19,," הודעה. רפואה בדוקה למחלות חולה-נופל ולתהלואי העצבים אחרים (גערווענקראנק- הייטען) המציא הרופא הנודע הרב דר׳ ישו מיכל ראבינאוויטץ בפאריז (מעתיק ספרי התלמוד ללשון צרפת) רפואותיו בדוקות ממהרות לרפאות. כל מי שיחפוץ לפנות אליו לדרוש עזרתו יכול לכתוב לו אדות פרטי המחלה בכל לשון אשר שומע הכותב. כתובתו היא: Dr. Michel Rabinowicz in Paris, 63, Rue de Seine."
