article_id,headline,text
044-MGD-1882-02-08-PG001-SINGLE-ORIGNAME_260041_toc_10,אזיעז," אזיעז ירושלים, שבט, התרמ״ב. להרב בעל „המגיד"" שלום! מיום עמדי על דעתי, לא עלה על דעתי לרכוש לי כבוד סופרים להודיע מהנעשה והנשמע בעיר קדשנו, כי זמני לא ירשני לזה אף אמנם, כי אקח לי מועד בעתות הפנויות לי, למקרא מכתבי עתים, וביחוד את מכ״ע היקר „המגיד"", אשר בו ידובר נכבדות ע״ד ישוב ארה״ק וכלו אומר כבוד לציון וירושלים, ע״כ תהי לי עת קראי בו לעונג ושעשועים, בכל זאת לא הרהבתי עז בנפשי לעלות על במתי מכתבי עתים להודיע מירושלים חדשות ולתאר מצבה החומרי והמוסרי, כי ראיתי אשר כבוד המו״ל העמיד למצפה בעירנו להיות צופה ומגיד קושט אמרי אמת מכל הנעשה והנקרה בעירנו בעתים לא רחוקות. והנה לעת כזאת, עת רבה השערוריה בעיר קדשנו, נחבאו מלי הצופה פני ירושלים ושוקט במכונו, ולא אדע מדוע לא הודיע עד כה *) מהאש אשר יצאה מבית הרב (או הרבנית) מבריסק ותאחז בכל פנות ירושלים, ותהי ללהב ואין מכבה. ע״כ באתי במקום סופרך הנכבד „הצופה פני ירושלים להודיע פשר דבר השערוריה. עטי ירעד בין אצבעותי עת כתבי זאת אך למען כבוד ציון וירושלים השקט לא אוכל ויעבור עלי מה לפני שבועות אחדים הגיע ליד הרב החה״ש מהרי״מ פינס מעיר אחת באויסטראליען מעשיר אחד סך מסוים ליסד בחברת „אבן ישראל"" מנין קבוע להתפלל וללמוד שיעור גפ״ת. הר״ס פינס נעתר לבקשת הגביר בשמחה וטוב לב לזכות את הרבים לבל יצטרכו לילך בקור וגשם למקום אחר וייחד בית מבתי החברה הנ״ל, למטרה הנ״ל. והנה אתה! מי האמין כי מזה יתעוררו הקנאים בחמתם עד להשחית? מי מלל אשר מזה תצא אש המחלוקת באין מכבה? ומי אשם בזה? בשל מי הרעה אם לא „הרבנית ריסק"" אשר מיום בואה לעיר קדשנו עשתה אותה כמרקחה עזרת חסידיה הפראים עושי רצונה, המחרחרים ריב ומדון ומחריבים את ירושלים, הלא המה החצופים הגדולים: אורינשטיין ובנו, משפחת לעווין, ועוד אשר נקבו בשם „בהלבנון"", הם הם המהרסים והמחריבים אשר מקרבנו יצאו! בהודע להם דבר הביהמד״ר נתקנאו ההוללים האלו, וימהרו לבית הר.. להתיעץ איך להפריע את ה׳ פינס ממחשבתו הטובה. חיש מהר יצאו רחופים ומבוהלים לקרא עצרה מכל מנהלי עירנו רבניה ורבנ דרבנן קנאיה וכל כת-דלהון, וגם הרב מבריסק הופיע בעצמו ובכבודו אל האסיפה הגדולה ההיא ויקרא בקול: אחי ורבותי! הידעתם למה נתאספנו פה כלנו היום? אתה! זה האיש פינ אשר זה לא כביר נידן על דבר מחברתו הארורה „ילדי רוחי״ בשם מין וכופר, האיש הזה יסד לו ביהמד״ר לפי דברו, ע״כ הבו עצה איך להפריעהו ממחשבתו זאת כי עוד מעט יהפך לבית ספר ר״ל (שקאלע) ומה נעשה אם לא נעצרהו עתה מהפיק זממו!? חושו הבו עצה איש איש כפי חכמתו הרבה. (?) בני האסיפה החשו ולא ענו. אחרי הדומיה התעוררו אחדים מהנאספים ויאמרו לשלוח אחרי הרב הגאון כמה״ר שמואל סאלאנט ני׳ להביאו אל האסיפה, אך חמש פעמים שלחו אחריו ולא בא, כי איננו מתערב עם אלה הרודפים חנם לאיש הרמם על לא דבר. גם אחרי הסופר לכל „הכוללים"" הידוע בשם ר״י ריבלין שלחו ולא בא אל העצרה הצרה הזו בהשיבו להשלוחים כי מפני כבוד התורה היקר אצלו לא יוכל לבוא, בידעו כי בבואו ידבר את הנאספים קשות בהראותו להם כי יעקשו הישרה ואין הצדק אתם; אבל השלוחים הוסיפו על דבריו כהנה וכהנה, לעורר עליו חמת הקנאים ומעשה שטן הצליח בידם. בלילה נגמרה בהחלטתה להחרים את הביהמד״ר וכל הנמצא בו (גם ספרי הקודש) יחד את הבאים להתפלל בו. בהפרדם הלכה הכת האחת לבית חרב הגאון מחרש״ס לצות עליו בשם הרב מבריסק, כי יצוח לה׳ פינס לבל יביא עוד אליו (לרמז כי הוחרם) אך הרה״ג מחרש״ס בקש מהם שירפו ממנו ולבל יחללו את כבוד ירושלים במעשיהם הרעים וכי בשום פנים לא יאות להם, ונהפוך אם יבוא לא ירחיק מביתו. בשמעם הדברים אשר יצאו מפי הגאון המו״צ מהרש״ס נמלאו חימה ואמרו לו: „עוד תתחרטו על תשובתכם הזאת"" וילכו. הכת השניה הלכה ללות את הרב מבריסק חדר מחוץ לעיר ובשובם נכנסו לביהמד״ר אשר לחברת „משכנות ישראל״ ויחרימו את ה׳ רבלין על אשר מאין לבוא אל האסיפה ועל דבריו אשר השיב להשלוחים. למחרת האסיפה ביום ו׳ נודע למשפחת רבלין כי הוחרם ויאלצוהו לילך להתנצל לפני הבד״צ, אך כל התנצלותו לא הועילה לו ויכריחוהו לקבל „נזיפה״. צחוק עשה לנו ה׳ ריבלין כי ה׳ בשבט נהפך לו לט׳ באב כי הוכרח לישב על הארץ בחילוץ נעלים ולחכות באגרופו על הזהו באמרו „אמנם חטאתי'. שומו שמים! ה׳ רבלין אשר בכל עת נלחם נגד דורשי טובת ירושלים אן אולי מיראתו חמת הקנאים ועבראם כי קשתה. המו״ל. ישב לארץ ויקבל „נזיפה"", והקנאים נקמו בו נקמתם! אך לכל זמן ועת לכל חפץ"" אמר המלך החכם מכל אדם. — בו ביום אשר הקנאים נקמו נקמתם בה׳ ריבלין, לעת ערב עת קבלת השבת אחר אשר גמר החזון לנגן שיר „לכה דודי"" והנה קול קורא על הבמה הם! המתפללים שמו אזניהם כאפרכסת וישמעו קול קורא: „אחי ורבותי! היות כאשר מיכל פינס יסד ביהמד״ר להתפלל, הנה ידוע כי מאותו רע לא יצא טוב ע״כ הוסכם מטעם הרבנים אשר נתאספו תמול כי כל איש אשר יזיד לבוא להתפלל הן ללמוד בבית מדרשו של פינס הנהו מובדל ומופרש וכו' וכו מעדת ישראל, והשומע תבוא עליו ברכה. למחר ביום השבת רצו להכריז גם בביהכ״נ הגדולה „בית יעקב"" אך הנבונים עצרו בעד המכרין מלהכריז. זאת העלה חמת הקנאים מאד, ויתאספו שנית ביום א׳ עשרה בטבת, לשלוח אחרי האנשים אשר עצרו בעד הכרוז ולקנסם, גם בו ביום מצאו זמן מוכשר להכריז גם בביהכ״נ „בית יעקב"" באין מעצור ומפריע, ועוד ידם נטויה לבו ולהשחית את כל אשר לא יאמר כשר לאשר יאמרו הם קשר. גם על הרב הגאון מהרש״ס הי״ו ידברו דברים אשר לא כן וחותרים בכל עז תחת כסא ההוראה אשר יושב עליו זה ארבעים שנה להורידהו על אשר לא הסכים לדברי הרב והרבנית מבריסק להרחיק את ה׳ פינס מביתו. בין כה וכה תתגבר המחלוקת מיום ליום. אסיפות אחר אספות יאסף ועוזרי הקנאים ישוטטו בחוצות להסית את ההמון בהגאון מהרש״ס ובה׳ פינס. הה! כל כך גדלה המהומה והמבוכה עד כי יראים אלה אשר יבינו דבר לבל יבוא לידי הכאה. ועליך כבוד המו״ל „המגיד״! עליך נוטל החוב להרים כשופר קולך אל רבני וגבאי אה״ק בחו״ל כי ימהרו להזהיר את מהריבי עירנו לבל יחללו את כבוד עיר הקודש במעשיהם ונכליהם, לעת כזאת, עת אשר רבים החלו להתעורר מתרדמתם להעלות זכרון ארץ הקדושה על לוח לבם הטהור. לעת כזאת אשר הרעיון הנכבד ע״ד „ישוב ארה״ק"" נתעורר בכל תפוצות אחינו שבגולה, מה יענו בשמעם דברי הריבות? הלא ירפו ח״ו מרעיונם הטוב! גם אליכם רבני וגאוני חו״ל, אליכם אקרא! חושו עושו! השקיעו אש הקנאה והשנאה הבוער בכל פנות ירושלים והעבירו ריב ומדון מקרבנו, אל תאחרו כי עוד מועד טרם לא תוכלו לכבותה! הכותב בדמי לבבו והמצטער על כבוד ירושלים לצאת י״ד'י׳ ה׳ש'ל""וים״.  כי חולל! (הערת המו״ל). הבאנו את דברי הכותב הנ״ל אף כי ידאב לבנו להשמיע ברבים מעלילות עול אשר נעשות לפעמים בקרב אחב״י בירושלם ת""ו, ולא מפני כי חסים אנחנו על כבוד האנשים הרעים מחרחרי הריב שם, רק מיראתנו פן יבולע להעניים האומללים הרבים באשמת הקנאים. — אבל הנבלה שנעשתה שמה בדבר החרי״מ פינס ני׳ נודעה ברבים בכה״ע, ואין לכסות עוד על פשעי האנשים המחללים כבוד עה״ק ונותנים שם ישראל לשמצה. אבל מה ומי יכול להושיע ולשים מתג ורסן בפי הקנאים? הרבנים בחו״ל? — ידענו גם ידענו כי נמצאים שם בין הרבנים עיני העדה אנשים ישרים צדיקים ותמימים אשר מאד מצטערים גם הם על ל הנעשה שם, והסרים למשמעתם לא ישעו בדברי שקר ולא עשו עול. — אבל מי יעצור בעד הקנאים שם וביחוד מכוללות אונגארן? אלה בחו""ל אשר יתמכום ויכלכלום לא יעשו את זאת ולרבנים אחרים זולת רבניהם לא ישמעו. ואם הם הרבים שם אז ידם על העליונה. — הכותב הנכבד יפחד פן ע״י מעשים כאלו תרפינה ידי המשתדלים בישוב ארץ ישראל. לפי דעתנו נהפון הדבר. כל המבין דבר לאשורו יודע כי רק ע״י ישוב א״י ע״י ובדי אדמה ובעלי עבודה, יתרפא הנגע הצרעת שם. לאה״ק לא לכו אוהבי עצלות ובטלה, האוכלים ואינם עושים, ותוקעים בשופר להחרים ולגדות את אלה אשר לא יחשובו כמוהם. לא ילכו לשבת בירושלם תו״ב בקרב הקנאים העצלים מגרי מדון. — שם ילכו אי""ה אנשים אוהבי אה״ק באמת ותמים לעבוד אדמתה ולשמרה, כי מה יעשו ראשי הקנאים הבטלנים העצלים אשר לחמם נתן מאחרים, ולא יחטאו להרחר ריב ולהרבות מחלוקת? אם תה עבודה ומלאכה לאחב״י באה״ק אי״ה, לא ישעו בדברי שקר והכל!"
044-MGD-1882-02-08-PG001-SINGLE-ORIGNAME_260041_toc_11,חדשות בישראל .," יקצר הגליון, יען יכילו ספר שלם; רק זאת נודיע כי המדברים היו כלם נוצרים מגדולי האמונה, מגדולי החכמים ומגדולי הממלכה בכלל, ונזכיר אחדים מהם: א) השר הגדול גראף שאפטסבורי הנודע; ראש נשיאי האמונה הפראטעסטנית בלאנ- דאן; הקארדינאל מאנינג, ראש אמונת הקאטאליקים; הכה הראש ,Farar! הפראפעססאר בריים, בחיר העם היושב בבית המחוקקים; השר סטאנליי ועוד. תמצית דברי כלם היתה, כי מטרת האסיפה היא רק להודיע לבאי עולם כי כל יושבי ענג- לאנד בלי הבדל דת ועם מרגישים בצרות בני ישראל אשר התרגשו עליהם בזמן האחרון ב סיא, וכי חלילה להם לחפוץ להתערב בענינים הפנימים ברוססיא. כלם חלקו כבוד מאד נעלה לקיסרי רוססיא ולמשפחתם הרמה: כן דברו על מה שכתוב בכה״ע הרוססים המחליטים כי ההודעות ממה שקרה ליהודים ברוססיא הפריזו על המדה ורובן בשקר יסודן. המדברים אמרו כי אם נניח כי כן הוא ויש בזה הפרזה במדה גדושה, בכל זאת אף אם רק המקצת אמת ממה שנודע ברבים מצרות ישראל, די הוא להעיר עליהם רגשי חמלה וחנינה בלב כל אוהב אדם.  מכה״ע ברוססיא מחליטים כי אלה שהתעוררו כעת בענגלאנד בדבר היהודים אינם עושים זאת מאהבת- אדם ורגש חמלה על ישראל, רק דבר מדיני יצוק בזה להניח מכשולים על דרך השר גלאדסטאן, ראש שרי המלוכה שם על כי אוהב הוא לרוססיא על זה ענו המדברים, כי רוב הנאספים והעומדים בראש הדבר הם רק מאוהבי גלאדסטאן ובעלי בריתו, ובתוכם גם הנל פאן וו. סטמינסטער מבית המלך ואוהב נאמן לגלאדסטאן, ואלה הלא לא יעלה על דעתם להרע לו וכו׳ כולם החליטו ואמרו כי אין כאן לא שנאה לרוססיא ולא תחרות לממשלתה, רק רגש החמלה המפעם את לב כל איש אשר נשמת שדי תחייהו באהבה לבן אדם נברא בצלם. גם לא מאהבתם הפרטית הודים דוקא עושים זאת, יען כן היו עושים כן אף אם העשוקים היו עובדי אלילים ומדוע לא יחוסו על היהודים גם כן? האם אי נם ברואים בצלם אלקים כהנוצרים וככל אדם על פני האדמה? — סוף האסיפה היה כי נמנו וגמרו על החלטות אלו: א) בעלי האסיפה מחליטים פה אחד כי הרדיפות שנעשו ליהודים במקומות שונים במלכות רוססיא במשך הירחים האחרונים, הן מתנגדות להציוויליזאציאן הנוצרית, וכל איש ישר עליו להתאבל על מקרים כאלה. ב) חלילה לבעלי האסיפה לחשוב כי יש להם הצדקה או כי חפצים הם להתערב בענינים פנימים אשר בממלכה אחרת, ונהפוך הוא, הם חפצים כי האהבה השוררת בין עמי ענגלאנד ורוססיא תשאר באיתנה, בכל זאת עליהם להודיע דעתם בי הל רב כי סיבות הרדיפות הן המה רק החוקים ברוססיא המגבילים את זכיות היהודים והם משפילים מאד את כבוד היהודים בעיני עם הארץ עד כי לא לעול יחשב לו להתנפל עליהם ולכלות בם את חמתם הנובעת ממקור אי ידיעתם. ג) בעלי האסיפה נמנו וגמרו להציע דבר היהודים לפני ממשלת בריטאניא ולבקש ממנה אשר לעת מצא תדבר וב על היהודים להטות את ממשלת רוססיא בדברי אהבה כבוד להאיר פניה אל האומללים, ולהגן עליהם שלא תאונה להם רעה לימים יבואו. — ד) בעלי האסיפה נמנו וגמרו ליסד ועד כולל לאסוף נדבות לתמיכת האומללים ברוססיא להושיעם ממצוקותם. איתן מושב הועד לאסיפת הכסף יהי׳ בהיכל העיר תחת השגחת שר העיר. בעצם היום ההוא התנדבו: השר ראטה שילדט עשרת אלפים לירא שטערלינג; האדונים ל. כהן, שמואל מאנטאנו, בעדינגטאן, והאחים זעלינמאנן, כל אחד אלף ל״ש; השר הענרי ווארמם ג׳ מאות, השר ג. דע ווארמס מאה; ה. ל. גאלדבערג ב׳ מאות ועשרה. ד. גאלדבערג מאח, נתן יוסף מאה ל״ש. — טרם נפרדו בעלי האסיפה הודיע להם ראש העיר לאמר: ברגע זה קבלתי טעלעגראמס מעיר נויארק באמע- ריקא כי בעצם היום הזה היתה גם שם אסיפה כוללת גדולה מגדולי ונכבדי כל ארצות הברית, ובראשה השר גראנט שהי׳ מקודם נשיא ארצות חברית (פרעזידענט). באסיפה ההיא העריכו מחאה נגד השערוריות שנעשו לב״י ברוססיא, ודרשו מן הממשלה שם לעשות כל אשר בכחה לטובת האומללים״! — השומעים קראו: „הידד״! — חדשות בישראל . ביום הראשון לירח זה היתה האסיפה הגדולה בעיר לאנדא בירת מלכות ענגלאנד, אשר נאספה ע״י ראש העיר בהי העיר, למטרת חות-דעת הקהל על אדות אחב״י ברוססיא. עוד לפני ארבעה עשר יום ערכו רבים מגדולי המדינה בקשתם אל ראש העיר (לארד מאיאר) לאסוף אסיפה גדולה וכוללת למטרה הנ״ל. ההיכל הגדול הי׳ מלא מפה לפה. ראש העיר אמר, אחרי אשר שם עיניו על הנאספים, כי מיום הוסדה מלכות ענגלאנד לא היתה עוד בהיכל העיר אסיפה כזו בנוגע למספר גדולי, נכבדי וחכמי הממלכה אשר נקבצו באו כולם אל האסיפה הזו. אחרי שדבר דבריו מענינא דיומא קרא לפני הנאספים מכתבים הרבה מרבים מגדולי הממלכה אשר התנצלו לפניו כי ע״י סיבות שונות נמנעו מלבא אל האסיפה וכלם הודיעו כי גם הם לבם יכאב וידאב מאד על גורל היהודים כרגע וכו׳. אז קמו ראשי המדברים וידברו מסדר היום. אם אמרנו להביא דברי כלם,"
044-MGD-1882-02-08-PG001-SINGLE-ORIGNAME_260041_toc_12,," הודעות. קייזערליך דייטשע פאסט האמבורג - אמעריקאנישע פאקעטפאהרט- ורודי- כולל אקצי געזעללשאפט. )17( דירעקטע דייטשע פאסט-דאמפפשיפפאהרט צווישען AAMPORG una NEW. YON.A רעגעלמעססיג צווייא מאל וועכענטליך יעדען מיטטוואך אונד יעדען זאנטאג- מארגענס, דורך - פאסאשען נאך אללען פלעטצען דער פעראיינינטען שטאטען נעהערע אויסקונפט וועגען פראכט אונד פאססאזע ערטהיילט דער גענעראל-ב עפאללמעכטיגטע AHZust BBolten, Wm. Miliere Nachiolser dmiralittein a 33/34הבחור הנ״ל. המעתיר, Rudolf Schlegelberger in Königsberg in Freuss. זאוויא דער אגענט הנוסעים ימצאו מנוחם בשבתם בהאמבורג בבית מלון שלי הנקרא: גאסטהויז צור שטאדט קעניגסבערג. שלמה מארקעל קראיענקאמפף 8 אין האמבורג. S. Markel, Kraienkamp S in Ham burg."
044-MGD-1882-02-08-PG001-SINGLE-ORIGNAME_260041_toc_13,,"  השתיה כדת שפירט וליקער של פסח. להתודע ולהגלות לכל סוחרי יי""ש בארצנו ובארצות אחרות, כי להנחיל אוהבי ס יי״ש לי שפירטוס של פסח, מובחר וטוב, מן פאטיקע של צוקער הכשר לפסח, דעסטיל-א לירט גם על 90 גראד, זך ונקי, ומצוין בריחו הטוב, גם כל מיני ליקערע של פסח, טוב ערב ומועיל, כפי שנודע ומפורסם כבר הוצאות בתי חרושת מעשי היי״ש שלי לשם ולתהלהה בכל הארץ, וכל זה בכל מיני הכשר, כראוי ונחוץ לחג הפסח, כפי הוראת והוראותל הרבנים הגדולים גאוני המו״צ דפק״ק יע״א, אשר עדותם נאמנה מאד כי הכל נעשה במשמרת למשמרת עפ״י שימת עינם ובדיקתם ובקורתם המובהקה, כמעט מדי יום ביומו. גם משגיח נכבד מיוחד מצדם על משמרתו יעמוד במקום המעשה, החוקר ובוחן ובודק בשבע עינים, ליתרון הכשר על טהרת הקדש, וכי עושי המלאכה אנשים כשרים המה, אם כשיביא ראי׳ שהוא בא מבית מסחרנו. יראים וחרדים, זהירים וזריזים, בכל חוקי הפסח, פרטיהם ודקדוקיהם, כד״ת. גם יי״ש לי רב משנים הקודמות, וכל דורשי טוב ומתוקן ישהרונני, בפאדוואל שלי בחצר ברחוב כי אם בהפאבריק במאמבאך על פי השגחתנו. ווילנער פה ווילנא. דוד בר׳ אפרים ליפסקי."
044-MGD-1882-02-08-PG001-SINGLE-ORIGNAME_260041_toc_14,,"  קול קורא. הקאמיטעט מבית הכנסת הגדול מאכט בע- קאנט דאסס מאנן באנעטיגט איין קאנטאר וועל- כער זאל זיין מוזיקאליש אונד אויך יודיש זינגען אונד דער יעניגער וואם דאצוא פעהיג איזט קאנן קאממען פראבע אבלעגען. דעם אקצעפטירטען ווערדען אויך דיא רייזע שפעזען פערגיטעט. יוסף ליב ברוינשטייי יצחק סג״ל. אדרעססא: J. L. Braunstein, Str. Palastina 11. Bukarest, Rumsnien."
044-MGD-1882-02-08-PG001-SINGLE-ORIGNAME_260041_toc_15,," רפואה טובה למחלות חולה-נופל ולהחלואי העצבים אחרים (גערווענקראנקהייטען) נותן הרופא הנודע הרב דר׳ ישראל מיכל ראבי- גאוויטץ בפאריז (מעתיק ספרי התלמוד ללשון צרפת) רפואותיו בדוקות וממהרות לרפאות. כל מי שיחפוץ לפנות אליו לדרוש עזרתו יכול לכתוב לו אדות פרטי המחלה בכל  לשון אשר שומע הכותב. כתובתו היא: Dr. Michel Rabinowitz in Parls, Rue de Seine. ,63."
044-MGD-1882-02-08-PG001-SINGLE-ORIGNAME_260041_toc_16,," החפצים בהמגיד בממלכת ענגלאנד, יפנו בטובם אל ידידנו הרב הנכבד מהר״ג ליפפ- מאנן ג׳ ראש השו״ב בלאנדאן."
044-MGD-1882-02-08-PG001-SINGLE-ORIGNAME_260041_toc_17,," כשר — תמצית-חומץ — כשר אם ינתן בתשעה ושלשים ליטער מים ליטער בימי הפסח. התמצית חומץ כשר, הנשלח אחד מתמצית-חומץ הזה, יצא ממנו ארבעים  ליטער חומץ טוב טעם למאכל, וימכר בב לאן מארבעים או ששים קילאגראם אצל הוגא באנדי וחבריו במאינץ Hngo Bondi et Cle in Malnz. במקח הזול, והחפץ לקנות מתמצית חומץ הזה יפנה אל האדרעססע הנז׳ ויקבל תשובה ברורה בכל הפרטים . תמצית חומץ הזה או הממוזג ממנו יעמוד ימים רבים מבלי יתקלקל טעמו, וערוכה נתונה בעד נקיותו. ועל השגחת הבשרות הוא הרב דר׳ לעהמאנן. גם תמצית חומץ בלתי כשר נמצא בבית מסחר הנז'."
044-MGD-1882-02-08-PG001-SINGLE-ORIGNAME_260041_toc_18,," החפץ דירה נאה בחדרים מהודרים מיוחדים וארוחת תמיד בכשרות ובזול, הוא יסוד רן בשנה שעברה. להרא״ד בפא״ל: הנומ' אל בית אכסניא של ר׳ מרדכי ווייסמאנן חיות (מו״ה), ויפיק רצון עצהיו״ט. וכן הבא לדרוש שם ברופאים או ע״ד מקח וממכר וכדומה, עצתו במישור תנחהו וכל משאלתו ימלא. האדרעססע שלי: Marcus Weissmann in Wien  I, Herminengasse Nro. 6"
