article_id,headline,text
044-MGD-1875-12-15-PG001-SINGLE-ORIGNAME_190417_toc_9, רוסלאנד,"  רוסלאנד מכתבים מווארשא. (לגומלים חיישינן) הראיתם קוראי המגיד כי מלאה עירנו ווארשויא דעה? קמו נערים „גמולי מחלב״, ויצחקו לפנינו, „לגמול״ ולענוש קשה בלשון מדברת גדולות, את כל הקרב לחוות דעת על במח „המגיד"", וכמעט יפצה איש נבון פיו בדברי בקורת, למען העיר למוסר אזני המטים עקלקלותם, והנה „גמלים באים״ לרפוש ברגליהם את עין הבדולה, ממים החיים הנובעים ממקור לא אכזב, ממקור אהבה נאמנה לבני עמו. ולו ראיתי כי הם „גמלים מיניקות"" אשר להם המשפט לחלוץ שד לצעירים מהם לימים, או „גמלים נושאים נכאת צרי ולוט״ לריח נהוח באף הקוראים, כי עתה החרשתי. אמנם איככה אוכל וראיתי בבוא לים הוללים אשר לא רוחצו למשעי עדנה מחלאתם,  ע ובשפתים מלאים עוד חלב שדים, בוטאים הם כמדקרות הרב כעל גמולות כעל ישלם״. לשום לאל דבר דבור על אפניו, ולהתכבד בקלון רעיהם הטובים מהם, ולהשפיל לארץ עד עפר. כבוד אנשים ישרים ותמימים, אשר אינם שווים להעלותם על „דל"" שפתם. כי ראו נא גם ראו, בא אלינו בנומ׳ 37 נער אחד במאמרו „גמולו בראשו״ לחרף אלפי אנשים עברים, רחמנים „גומלי חסדים המקיימים בכל לבבם נפשם ומאדם את יסוד התורה ועמוד המצוות כלם, הלא היא מצות „ואהבת לרעך כמוך הרבה יותר משאר המפלגות אשר בקרבנו, ואיככה יעוז נער עול ימים לשום את שמם לשמצה על לא דבר על כי גומל נפשו איש חסיד״, ותורת „הנסתר"" לא מצאה חן בעיניו ואם טובה לו תורת נגלים רבים אשר נגלה נגלו לעיני כל באחד הריקים. ישמח בחלקו וידום, ואל יבוא בראש הומיות לשום תהלה באחיו בני עמו אשר לא כמחשבותיו מחשבותיהם! הלא עינים לו לראות כי אין מקום בהמגיד בעד שנאת הכתות ומעולם לא נתן בעל המגיד יד לפושעים להפריד בין אחים חנם. וכמשכיל דורש אלהים באמת הנהו טלרגת יקר הסוב כל הכתות, ואוהב את כלם אהבה שלמה בעבור המדות הטובות אשר תמצאנה בכל אחת ולמען דרכו זאת הטובה אהוב הוא באמת לכל המפלגות גם יחד וזכה לשם טוב בכל תפוצות ישראל. ותחת אשר עלינו לתת שבח והודיה לאלקי הרוחות אשר „גמל עלינו, ונתן בלב בעל המגיד לאחד לבב בני הכתות הרבות אשר בקרבנו לאהבה איש את אחיהו, ולגדור את הפרץ הרחב אשר פרצו הדורות הראשונים בכרם ה׳ צבאות הנה „גמול ידו הדה׳ להוסיף פחם על הגחלים, ועל שפתיו כאש צרבת להרחר ריב בעברת זדון. ומה גם כי לא כימים הראשונים הימים האלה לחסידי ארצנו. הם לא יצוררו את ההשכלה האמתית אשר לא עבטה אורחותיה נגד דת קדשנו, ואשר „נמלתהו טוב ולא רע"". וכבר נמצא גם בין רבניהם יודעי דקדוק. שפת עבר, וכתבי הקדש ערוכים על שפתם; וכמעט אין אחד בחסידינו אשר לא ילמד את בניו השפות המהלכות במחוזנו? ועתה היש לו עוד צדקה לזעוק חמס עליהם? אם לא תדע לך „הגומל לחייבים וטובים כאחת״. צא לך בעקבי המ״ע, יקרא שמה מאמרי „צעירי החסידים ערוכים בטוב טעם ודעת, וכתובים בלי עזרת רב ומורה. „רכב חמור ורכב גמל כמאמרך, ואז תדע להזהר מפנוע בכבוד אנשים יראים ושלמים גם יחד מה לצעירימים כמוך ולמאמרי בקורת? להביא במשפט עם רב. אשר לא זכית עוד להבין ולהכיר את מדותיהם הטובות? שקט ישאנן „שב עד יגמל"" עטך ועד יצמח זקנך! השמר והשקט לבלי דבר סרה על נקי חנם „אם לא גמלך רע״. וכל זה בא לך, מקנאתך כי רבה בבן עירך! המשכיל בממ״ק אשר העביר תחת שבתו (במאמרו הנכבד „גמול הסופרים״) את המשכילים המשחיתים דרכם לבשתם ולבושת ערות עמנו, וגמלם עוד כרחמיו״. לא כפרי מעלליהם המתועבים. ולכן קמת גם אתה להדמות אליו ותחגור הרב הבקורת על מתניך, והנה היא לא כמדך ולא נסית בכמו אלה, ותחין עוד להגדיל עליו עוד ולטפול עליו שקר בנאוה ובוז חרפתו וגדפתו בעלילות עמל ואון ושכחת ליטול קורה מבין עיניך טרם הזכרת אותו ליטול קיסם מבין שניו. בקצרה אענך כי תחת אשר אמרת כי דברי מאמריו לא לרצון המה לכל קוראי המגיד, אנכי היודע ועד כי רבים וכן שלמים בעירנו נתנו לפעלו צדק, וגם מרחוק באוהו מכתבי תודה ותהלה על דבריו המשרים והנאמנים ורק אלה אשר לא הבינו לאשורם, ועמהם גם נלוזי דרך מאלה אשר הוכיחם בשבט עטו, הם רעמו פנים על דבריו הנכחים. ואשר יתאוננו עליו רעיו המשכילים כי פגע בכבוד האיש השם במי האגדות נתיבה, על זה אשיבך, כי לא לך להתעבר על ריב לא לך. הלא כה יאמרו הפולאנים להאדון יכרע אישריבו ברך, והאכר. יוכה שוט על ירך! האין זאת? ולו ראיתי כי אחד המשכילים האמתים תבע את עלבון הגעלב החרשתי. אמנם אתה הנך מתנגד מקצה האחרון המתלבש בעזר משכיל לשליש ורביע למען כלות חציך בחסידי הפי הפשע כת עברתך. לכן שנסתי מתני „להשיב גמול על גאים"" להגיד בפניך קשט אמרי אמת, ולתת לך „כגמולך שגמלת"" לנאמן רוח המגלה סוד מחברים המחבלים כרם הליטרטור, בשיתם ושמירם. ותקותי חזקה כי הלקח הטוב הזה אשר הנני נותן לך היום, ישאר בזכרונך לארך ימים כמשפט גירסא דינקות"", ואם תבוא חכמה בלבך עוד תברכני על תוכחת שפתי לעת כזאת אמנם, שמור פתחי פיך ואל תשכח כל גמולי"" יאתה המגיד דבריו ליעקב! הגד לעמך משפט צדקך, והורם את הדרך הטוב אשר בחרת לבל יבוא עוד כל לץ ונרגן בקהל לך לסכסך עררי צאן מרעיתך איש באחיו, יהיו חסיד מתנגדים או משכילים, אם אך אהבתם שלמה לאחיהם בני עמם, ובשו והסבלנות הברוכה נר לרגלם. כלם אחיך יקראו עצ הם ודגל שלומם עליך אהבה״: כי בגלל הדבר הזה ברכך ה׳ והארכת ימים מכל בני גילך. צמרגליות המכונה ה׳ פערלא."
044-MGD-1875-12-15-PG001-SINGLE-ORIGNAME_190417_toc_10,1ג) ע5 סרוג 0^ > ^עחוח ס^ו ימי 36חס ע^ כ...," 21) על הרוב לא ארכו להפחות האלו ימי שבתם על כסא השררה כי ערבו לדם זה לזה והבלבול והמלחמות הפנימיות מכתות שונות רבו אז בבגראד. וראיתי, רשימה מהפחות אשר שררו בבגדאד משנת אלף קמ״ג למספרם עד זמן הגיעת סלימאן פאשא בשנת אלף קצ""ו על כסה השררה והנה חלפו בזמן הקצר הזה כ""ד פחות ונמצא כי הגיע לכל אחד כשתי שנים ימי משרתו. 22) אחרון הפחות הממלוכית האלו הי׳ דאוד פאשא יליד טפליז בגעארגען והוא משל בבגדאד י״ז שנה והי׳ מציין באוון רוח ועריצות נפש עד כי באחרונה חשב מחשבות להפרד מעל התורקיא וליסד בעראק ממלכה בפני עצמה כמו שעשה מחמדי עלי פאשא במצרים וכמעט גבר ידו על הממשלה בקנשטאנטינופל לולא הדבר הכבד אשר פרצה בבגראד בימי האביב משנת תקצ״א לפ""ק ובחברותה גם הישטף הנורה מהחדקל אשר בעקב המכות השתים האלו חלק רב מבנדאד נתרבה ושתי שלישיות מיושביו מתו אזי עלו משתנות דאוד פאשא לאפס כי נשאר עזוב מעוזריו ועל פאשא הוואלי המשולח מאת הממשלה בקונשטנטינועל גבר ידו עליו ולקח ממננו המשרה."
044-MGD-1875-12-15-PG001-SINGLE-ORIGNAME_190417_toc_11,אזיען.," אזיען. שלשה הם אבירי משפט ישר והנהגה טובה: הוואליים אשר הצטיינו מתוך אחיהם ואשר זכרם לא ימוש מקרב בני בגדאד. הראשון שבוואליים אשר נשלח לבגראד, אחרי שנשמרו היא יטשארים הוא עלי פאשא והוא הגבור אשר החל להכיר את אנשי בגדאד ולהתנהג בנחת, הוא אשר טרח להשקיט קנאת הדת ובעקבתה השנאה אשר שררה אז בקרב בני נגדאד השונים זה מזה באמונה ודת. השני שבגדולה הוא רשיד פאשא הישר באדם המעמיד המדינה על קוי המשפט, המגרש הרשעות והמשלם טוב להולכים בטוב. אמנם השנים אל השלישי לא באו הוא השר הנאור החכם הישר מדה אט פאשא אשר זה כששה שנים בא אל בגדאד. הוא החל הנהיג המדינה ע״פ חוקים חדשים אשר צמחו וגדלו על אדמת אדום ואשר ממקור חרות הדעות נבעו וראשם פונה אל שווי זכיות מדיניות אל כל שוכני הארץ! הוא מדהאט פאשא אשר תקן בתי צדקה וגמילות חסד ואשר הרים דגל המלאכה והמסחר ואשר יסד בתי מדרש לחכמה ולמדע ולקנין מדות טובות. הוא מאדהאט פאשא אשר שם פאר להעיר בבנינים מפוארים וברחובות יפים ונטע נני חמד לשמח בו אלוקים ואנשים. זכר מדהאט פאשא לא ימוש מפי שוכני בגראד ושמו הטוב יחולל תמיד על שפתי כלם! בזמן הזה הוא רדף פאשא היושב על כסא השררה בבגראד והוא עד עתה לא הראה עוד כשרונות לעלות במעלות על המון שרי ממשלת תירקייא ובאג- ראד עמדה מלכת קדימה, ועמידה כנסוגה לאחור דמיא. אה! המעט שהבאתי במאמרי זה בזכרון קורות היהודים כבגדאד הכל לקוח מתוך ספרי הערביים והפרסיים, כי קצר קצרה ידינו מהשיג כל זכר למו בתוך ספרות העבריות כי מזמן בנימין בן טלדלה והלאה נסתם כל חזון ונסגר המדבר על בני יהודאי בגדאדאי. זמן ממשלת התתארים ותימורלק ועד זמן טלטול וצרות לבית יעקב מימים רבים. וימים רבים לא שכן ישראל בבגדאד ) גם בזמן ממשלת העתמאניים בעוד אשר בתירקייא האיראפית והאזיאתית זרחה שמש התורה ופרחה ספרות היהודית, אז פה בגדאד כפראים ישבו היהודים. זקנים ספרו לנו כי מזקנים שמעו איך נעדרה אז פה מבת יהודה כל חמדת התורה והעבודה ודרך ארץ. ראינו איזה שטרות באגדאד (המשך מגליון 47) אמנם הישרים אשר ישבו מאז בפקודת שולטאני תוגרמה על כסא הממשלה עבריות פסקי דינים מסביב שנת ת""ן לפ״ק ומסגנון הלשו והגיון פסק הדינים נכר עניות כותביהם עוד ראינו פה שני ספרים בכ״י „קהלת יעקב״ „וכנפי יונה"" והם העתקות מהלכות העבור, חוברו סביב אותו הזמן ואין בהם במה להזכירם אם לא כי מחבריהם השנים המו מבית אדוני והיתה המשפחה ההיא מושלת איזה דורות על כסא התורה בבגדאד וממנה יצאו הרבנים אשר בימים ההם הי׳ רוב עסקם בקהלתם לכתוב קמיעות ולעשות סגולות וכדומה. **) מלבד שני הספרים האלה לא נודע לנו מפה שוב דבר מספרות יהודית. אמנם זה ב״ז שנה התעוררה קהל בגראד והבינה עניותה ופנתה אל האליו בעיר בנדאד היו על הרוב בני ארצות קאווקאז וארץ אלבאניע אשר אחרי שהיו עבדים לגדולי עתמאניים שוחררו ונתן להם המחוזות הרחוקים מעיר הבירה בגדאד לשמרן ולשפטן ועל כלם עלה חסן פאשא מהכפר ברכיל באל- באניע אשר האריך הוא וזרעו ימים רבים על כסא השררה בעיר באגדאד. ואחרי אשר התירקייא נעשתה כלי חפץ ליאניטשארים שחקו גם פה השרים האלו ולקח המשרה בידו כל מן דאלים והמלוכה בקנשטנטינופל נתנה בחפץ טוב אמן אל הפריץ הזה אם אך שלח!״) לה בכל שנה הסכום המוטל עליו לשלם אל תוך אוצר המדינה. אמנם אחרי שנכרתו היאניטשארים זה ודמשק להביא משם מורי הוראה והראש והראשון שבהם אשר רד מחאליב בבלה הוא הרב הגדול מר צדקה חוצין אשר רבות וגדולות עשה בקחילתו וממנו התחיל זמן חדש ליהודי בגדאד כי התחילו גם הם לעסוק בתורה מורשה ולהבין בתל חזר להם עד כה ולזקק מעשיהם ע״י התעוררות הרבנים, ורבי משלוחי א""י אשר יבאו לפה שנה בשנה. מבני בגדאד הצטינו בזמן האחרון הרב הצדיק חכם ששון מרדכי משה ז""ל וחבירו הרב הדיין חכם משה חיים ז״ל, הראשון הצטין בנועם דרשותיו על פסוקי תנ״ך ומאמרי חז״ל וביופי שיריו המיוסדים על תוכחת מוסר ויצאו חבוריו בדפוס, ורבים במדינות האלו יחנו לאורם, והשני נאמר עליו כי הי׳ מאד בקי בהלכות והתנהג בחסידות. (המשך יבא). כחמשים שנה בזמן השולטאן מחמוד כאן בא גם "") לבגראד זמן הגאולה מרשעת הפריצים הממלוקים (ר״ל בני העברים) האלו ותחל הממשלה בקנשטנטינופל לבחור מתוך בניהם השרים לשלחם בגדאד בשם וואלי ר״ל ממלא מקום גבוה. מעת ההיא נעשו גם בקצה ארץ תירקייא, בארץ עראק, סדרים נכונים בהנהגה המדינית והעם כולו נח מהאנחות אשר אנחו בה בזמן האי סדרים אשר משלו עליו השרים הממלוקים האלו."
044-MGD-1875-12-15-PG001-SINGLE-ORIGNAME_190417_toc_12,הרשות שונות ? סכום הכסף שנאסף עד חיום ע'...,"  חדשות שונות. סכום הכסף שנאסף עד היום ע""י הועד שנוסד לכונן דבר טוב למזכרת השר מונטיפיורי הי""ו עולה לסך עשרת אלפים ל""ש (בערכך שבעים אלפים ר""ט). בגוף הענין לא נעשה עוד דבר, יען כי מחכה הועד על הצעת השר בענין זה, לפי תוצאות נסיעתו האחרונה לאה״ק. — סי׳ לוצאטי היו אחד מאחב״י באיטליען נתמנה מאת ממשלת ארצו לכרות בשמה ברית מסחר חדש עם מלכות ענגלאנד בקרב הימים יסע ללאנ- דאן למטרה זו. — שנים עברים אחים, שמואל ורפאל לבית שענמאן היושבים בעיר איסטאן באמעריקא, נתעשרו בימים האלה פתאום לרגלי ירושה שנפלה להם במות אחות אביהם בלאנדאן והשאירה להם ב׳ מילליאן דאללארס. — בעיר לאנ- דאן בונים כעת בהכ״נ חדש לאחב״י היושבים במערב העיר. אדוני בית המסחר ג. מ.. ראטהשילד ובניהם. נדבו לזה סך אלף לירא שטערלינג. — בימים האלה הלך לעולמו בעיר לאנדאן איש עשיר אחד ה. Hall והניח כל הונו סך שמונים אלפים לירא שטערלינג למעשה הצדקה בעיר בלי הבדל-דתי."
044-MGD-1875-12-15-PG001-SINGLE-ORIGNAME_190417_toc_13,' חמ ( 88 ידטגו ט 6ררו חי3ן 3גל*>ל עי ור..., 23) ידענו כי אררו חרבן בגראד ע״י חמודלק עברו יותר ממאר שנים אשר לא שכנו בה יהודים. 24) והי׳ רוב עונם בספרי מעשיות ומוסר בפרושים קלי הבנה על התומש וכדומה.
044-MGD-1875-12-15-PG001-SINGLE-ORIGNAME_190417_toc_14,"דזיאלאשיצע (גוב.קיעלעצקא,(לאדוני המו'ל ש..."," דזיאלאשיצע (גוב. קיעלעצקא), לאדוני המו״ל שלום עד בלי ירח! לפני שבועות אחדים כאשר נהרס הביהמ״ד בק""ק פינטשוב הקרובה אלינו בפקודת הממשלה הרוממה יען נטו קירותיו לנפול. ויהי כראות הישיש רב אליהו ראפאפארט הנכבד לעדתו בעשרו ותורתו את עני עמו. התעורר ונדב מאמתחתו סך אלף 1000 רו""כ במזומנים למען החל להוציא את מעשה הצדקה לפעולת אדם, וכן נעשה. ועתה דעת לנבו נקל כי התחברו אליו עוד רבים וכן שלמים והפרישו מרכושם איש איש נדבתו כפי השיגה ידו! כי קנאת ישרים תרבה צדקה! עד כי כסף המורם היה די והותר להוצאת הבנין הבהמ״ד הזה ונגמר ת״ל ובת פינטשוב היקרה הנכתהו ביום הדין העבר, בעליזת נפש וטוב לב, וברכה בשמחה על המוגמר! יעקב צבי בר״ש וועקסלער"
