article_id,headline,text
044-MGD-1877-07-04-PG001-SINGLE-ORIGNAME_210237_toc_1,, שנת העשרים ואחר — יוצא לאור פעם אחת! בכל שבוע. מחירו בארצנו 12 מארק לשנה. 3 מארק לרבע. בעסט- רייך 8 פל׳ ע״זו: לשנה. 2 פל׳ ע״וו לרבע. בשארי ארצות 20 פראנקם  .
044-MGD-1877-07-04-PG001-SINGLE-ORIGNAME_210237_toc_2,," No. 26. S כל איש יוכל להשיגו ע״י  כל פאסט-אמס, ובוכ- האנדלונג בכל המדינות. כל החפץ להודיע דבר מה ברבים לטובתו! עליו לשלם שכר הדפסה בעד כל שורה 15 פפ׳ —"
044-MGD-1877-07-04-PG001-SINGLE-ORIGNAME_210237_toc_3,," חדשות וקורות הימים. יגיד ליעקב מהנעשה והנשמע בכל חלקי תבל בין כל יושבי חלד אשר ינעם ואשר ראוי לדעת לכל איש ישראלי לתועלתו ולתועלת השפה העבריה. מאתי ידרי אליעזר ליפמאן זילבע, מאן. והאמת והשלום אהבו. (זכרים ה')."
044-MGD-1877-07-04-PG001-SINGLE-ORIGNAME_210237_toc_4,"1877 .טנ&י 4- ט47** , (16 ליק י כ'נ תמוז..."," ההורא Lyd. Juli ליק, כ״ג תמוז. 187 תוכן הענינים. על המדינות בו יאמר: דייטשלאנד: האמבורג. עסטריוך-אונגארן: וויען. הארשין. ענגלאנד: מכתבים מלאנדאן. שוועדען: שטאקאהלם. ידיעות אחרונות: ציון לנפש. הצופה: פרחים שונים: מאת יעקב רייפמאנן. דברי אברהם: מאת אברהם אליהו הרכבי."
044-MGD-1877-07-04-PG001-SINGLE-ORIGNAME_210237_toc_5, על המדינות בו יאמר,"  על המדינות בו יאמר (דייטשלאנד). המלחמה בין רוסלאנד והתוגר באיירפא וארצות הקדם, מושכת עליה כעת עיני כל באופן אשר לא ישימו בני האדם לבם כראוי על ענינים אחרים שיקרו ויאתיו במקומות אחרים. לאחד מענינים ההם נוכל לחשוב גם הפרץ הרחב שפרץ כ ת בחומת אחדות האמונה הפראטעסטנטית השוררת בארצנו פרייסען, ביחוד בין יושבי בע לין עיר הבירה. מלבד אשר ידי הממשלה מלאות עבודה להקים לדממה את סער הריב הגדול בינה ובין בעלי אמונת הקאטאליקים בארצנו המתחולל ברעש זה שנים הרבה, נלוה לזה גם פירוד הדעות בין בעלי אמונתם, שהולך וגדול מיום ליום. כבכל אמונה תחת השמש, כן נמצאו גם בין בעלי האמונה הפראטעסטנטית דעות שונות בנוגע לעקרי האמונה ומנהגיה ופקודיה. אלה מזה מחזיקים בנושנות ומאמינים לכל דבר המסור להם בנוגע לאמונתם; מאמינים בכל הנסים והנפלאות באמונתם אשר השכל וכחישם. אלה מזה הולכים לרוח הזמן הפונה קדימה הזורקים הלאה את קליפת האמונה וחיים עפ״י רוחה הפנימי. לא בין התושבים לבד, אבל גם בין כהני האמונה נמצא פירור הדעות הנ״ל. יושבי בערלין יש להם קהלות שונות ולכל אחת כהנים מיוחדים. לכל מחוז יש ועד מיוחד שנבחר מאת העם לפקח על עניני האמונה. מלבד זה נמצא ועד עליון העומד על כלם, וגבוה מעל גבוה הוא המלך בעצמו וכבודו שהנהו גם ראש האמונה ועל פיו יצאו ויבואו כל עניניה עפ״י עצת הועד העליון. בימים האלה בחרו בני עדה אחת. היותר גדולה ונכבדה בכל עיר הבירה איש אחד לעמוד בראש עניני אמונתם (כי בארץ זו יכולים בני העדה לבחור להם לכהן איש הישר בעיניהם, בהסכמת הועד העליון.) הכהן החדש ההוא בדרשתו שדרש טרם שנבחר אמר בדברים ברורים כי איננו מאמין באמיתת כל הכתוב בספר ברית החדשה לאמונתם; איננו מאמין באלקות משיחם ישוע, רק לפי דעתו היה אדם כאחד האדם בארץ; איננו מאמין כנסים ובנפלאות; איננו מאמין כי ישוע משיחם נולד רק עפ״י רוח הקודש ככתוב בתורתם; קנצי למלין הנהו עומד בעניני האמונות והדעות על מצב החכמה והידעות של זמן החדש, וכופר בכל עקרי אמונתם. כל זאת הודיע בדרשתו הראשונה, ובכל זאת בחרוהו בני העדה הגדולה לעמוד בראש עניני אמונתם, וגם בני ועד המחוז הסכימו לבחירתו. מובן הדבר כי אלה מקרב העדה ההיא מכת המאמינים צעקו חמס על בחירה כזו, אך שומע לא הי׳ למו מאת רוב העדה. ראש ועד הקאנסיסטאריים, הדר׳ העגעל (בנו של הפלוסוף הנודע העגעל) הודיע אל הקיסר כי חפץ לסגת אחור מפקודתו, מפני כי הבט לא יוכל אל חלול האמונה. הקיסר כתב אליו ויבקשהו מאד שלא יעזוב עתה משמרת פקודתו בעת שסכנה רובצת על פתח האמונה, וגם עשה שלום בינו ובין ראש ועד העליון שגם הוא חפץ לסגת אחור אך לא מטעם הראשון. הקיסר טרם ם הרחצה, קרא אליו את כל שרי המ נסע לעמס. מק  וימתיק עמהם סוד כדת מה לעשות לגדור הפרץ ולהגין על האמונה שלא יהרסו שתותיה; כי הקיסר הנהו אדוק מאד באמונתו ומאמין בכל עקריה בכל לבו ונפשו. הדבר הזה הסב רעש גדול בעיר הבירה ובכל המדינה. לפי הנראה לא יסכים ועד העליון לבחירת הכהן ההוא. ואם ככה יהי׳ הדבר אז אולי יעזבו הרבה רבבות אנשים בעיר הבירה וביתר ערי המדינה את אמונתם ויפנו אליה עודף. עכ״פ זאת היא עצת כתבי-העת בארץ באמרם כי לא יוכלו התושבים לקבל אלוף לעניני אמונתם את איש אשר לא כמחשבותיהם מחשבותיו, איש אשר הממשלה תבחר בו, כן לא יתכן לבעלי הרוב להכריח את המעט. כי אין כפיה בעניני, אמונות ודעות; ע״כ אין דרך אחרת להמלט מן המבוכה הנוראה הזו רק שיתפרדו בעלי הריב זה מזה. ומפני כי הממשלה עומדת לימין המחזיקים בנושנות ע״כ על ההולכים לרוח הזמן לעזוב את אמונתם, וזה יוכלו לעשות עפ״י החוק החדש שנעשה אז לטובת הקאטאליקים החפצים להפרד מאמונת האפיפיור. בנוגע להפירוד, גדולים חקרי לב. רבים וכן שלמים אומרים כי כאשר בכל הענינים במדינה הולכים אחרי הרוב, כן נחוץ אשר גם בעניני האמונה יהי׳ העיקר הזה לעינים, ורק אחרי רבים להטות; יען כי אם יחדל המשפט ההוא, אז לא תוכל כל מדינה להתנהג כראוי. עניני המדינה הלא מתנהגים רק עפ״י רוב דעות. כל החוקים בבתי נבחרי העם נעשים עפ״י רוב דעות. כל עניני כל עיר ועיר נעשים עפ״י רוב דעות עניניה על כל דבר נמצאים מ נבחריהם שנבחרו לג דים אך המועט מוכרח להטות אחרי הרוב ורק עי״ז תוכל האחדות להתקיים ולעמוד; ומדוע איפא לא יהי׳ כזה גם בעניני האמונה על זה משיבים אחרים ואומרים: אין המשל דומה לנמשל. אמנם כן, בכל הענינים אשר בין אדם לחבירו מחויב המיעוט לכוף ראשו אל החלטת הרוב מפני כי המיעוט לא יוכל לעמוד לבדו עד״מ בעניני החוקים וכדומה. בעלי המיעוט הלא לא יוכלו לעשות למו חוקים מיוחדים להם לבדם ולכונן למו ממשלה מיוחדת בתוך הנהגה הכללית. כל החוקים הנעשים במדינ המתנהגת גם עפ״י באי כח העם, הם חוקים שנעשו עפ״י הרו ותמיד הי׳ להם מתנגדים ובכל זאת מן הנמנע להמתנגד לעבור את החוק אחרי שנעשה בהסכמת הרוב, כי לא יכול לעשות לו לבדו חוק אחר. לא כן בעניני האמונה. אם יפרוץ פירוד ודעות בעניני האמונה אז אין דרך אחרת לצאת מן המנ  רק ע״י ההפרד בין הדבקים. עניני האמונה המה רק דב  המסורים אל הלב פנימה, ואין הצדקה אל הרוב לאכוף את המועט לכלא בקרבו את רוחו. הענינים אשר בין אדם למקום אין למו כל הצטרפות עם אלה אשר בין אדם לחבירו. כל אחד וכול להאמין מה שיחפוץ ולעבוד את בוראו כפי דעתו, רק לותיו הדתיות לא תתנגדנה אל חוקי המדינה אשר באופן שפע מפיהם חיים הכל. לפי זה אין מקום לענינים כאלה לכפית הרוב. יהי׳ איך שיהי׳ מהדבר הזה אין רוח הממשלה נוחה הימנו, מפני כי קשה מאד לדעת תוצאותיו. הפירוד הגדול בין המאמינים הבלתי מאמינים איננו רק בקרב יושבי עיר הבירה, אבל הנהו סואן ברעש בקרב כל יושבי ארצנו זה שנים רבות, ותוצאות ריב-אמונה קשות הן מתוצאות כל ריב אחר בין בני האדם תחת השמש. (עסטרייך), עתה כאשר עברו הרוסים את נהר הדאנויא ופרצו בממלכת התוגר למלחמה כבדה; עתה תחדש השאלה מה תעש עסטרייך-אונגארן לקדם פני הרעה שתוכל לבא לעניניה לרגלי הרמת דגל הסלאווים הרבים מסביב לגבולותיה? לפי הנשמע לדבר ברור, כבר מנויה וגמורה בסוד ממשלת עסטרייך-אונגארן מה שעליה לעשות. — בימים האלה קראה מדים הממשלה אליה את שרי הצבא ראדיקס ומאלינארי הל בראש החיל אשר על גבולות תוגרמה, להמתיק סוד עמהם. שרי הצבאות ההם נצטוו לעמוד הכן עם צבאותיהם לפרוץ להערצאגאווינא ובאסניען ולתקוע יתדם שם לעת מצא. מתי יחי' הדבר הזה? זה תלוי בתוצאות הענינים של רוסלאנד מעבר לנהר הדאגויא. ברור הוא כי עסטרייך תשלח צבאותיה לשתי המדינות הנזכרות והיא רק שאלת הזמן על השאלה: אם עסטרייך תעשה את זאת לטובת התוגר למען הצילו מכף רוסלאנד? על זה נשיב: היא תעשה זאת ברצון והסכמת רוסלאנד. - זה כמה יצא הקול כי רוסלאנד ועסטרייך כבר באו לעמק השוה ביחוס הפאליטיק האריענטלית. הן אמנם כה״ע לממשלת עסטרייך כחשו את זאת, אך האמת כן הוא, כי כבר מדובר הדבר בין שתי הממשלות האדירות. כאשר נסע מושל זערביען לפלאיעשט להראות עם קיסר רוס- לאנד, ידע השר אנדראשי היושב ראשונה במלכות עסטרייך- אונגארן, מה שידבר ומה שיענה לו הקיסר. ידע מראש כי הקיסר וצוה את מילאן מושל זערביען להכבד ולשבת בביתו ולא להתערב עוד בדבר זה, יען כי זה נגד רצון עסטרייך. כבר מנויה וגמורה בסוד עסטרייך ורוסלאנד כי תשאר זערביען במנוחה תפריד בין צבאות עסטרייך שיעמדו בהערצאגאווינא ובאסניען ובין חיל רוסלאנד שיעמדו בבולגאריען. עי״ז לא תחי עסטרייך מוכרחת לתקוע יתרה בזערביען ולהעיר עליה חמת הסלאווים אשר במלכותה, וזאת שנית כי בעמדה בהערצאגאווינא ובאס- יען יש לה ערובה בטוחה כי לא תאונה לה כל רעה מהם לאווים יושבי המדינות ההן אם היו יכולים לעשות כטוב בעיניהם אחרי שיוסר עול התוגר מעל צוארם. ובשכר זה, ר״ל בשכר העמידה מנגד, תבא גם זערביען על שכרה אח״כ כי יוסיפו לה חלק ממחוז זערביען הישנה אשר לתוגרמה להרחיב את גב תיה. הענין השני אשר נמנו וגמרו עליו הוא: כי לא תתנגד עסטרייך  אם נחוץ יהי' אח״כ לרוסלאנד לעבור גם דרך מדינת זערביען לתוגרג אך לפי הנראה לא יהי׳ דרוש זה עוד לחפץ רוס- לאנד, אחרי כי הצליח לה לעבור הדאגויא ברומעניען ודרך רחב לפניה כעת לבקוע ללב תוגרמה דרך דאברודשא. וסטרייך - אונז ארן התחייבה לשמור את המדובר: להעמיד  צבאותיה רק ב  רוסלאנד צאגאווינא ובאסניען, כל זמן  אריען. אך תמלא הבטחתה לעשות סדרים חדשים רק בבוי אם רוסלאנד תחפוץ לנטות ידה גם על קאנסטנטינאפעל, ר״ל: להרוס שתות מי ת התוגר, אז גם עסטרייך תעשה כל הדרוש זובתה ולעניניה. — אם ישאר הדבר כפי המדובר בין שר הממלכות, ואחרי נצחון רוסלאנד תתאספנה הממשלות האדירו בועד מיוחד לעשות סדרים בתוגרמה, אז תשאר עסטרייך עם רוסלאנד בעצה אחת ושתיהן כאחת יוציאו בזמן אחד את וגע לאזיען הבטיחה עסטרייך צבאותיהן ממדינות התוגר. לרוסלאנד שתניח לה לעשות שם כ וב בעיניה ותוכל לקחת שם לאחוזה ככל הטוב בעיניה. מובן הדבר כי כל פרטי הברית החדשה בין עסטרייך ורוס- לאנד לא נודעו עוד, רק תוכן הענינים שזכרנו גלה איש אחד היודע מה שנעשה מאחורי הפרגוד, ויש ידים לאמיתת ההודעה ההיא, אם לא נשכח כי כבר באו ברית שלשת הקיסרים רוסלאנד עסטרייך ואשכנז, להיות בעצה אחת, וכל עמל ביסמארק היה מקודם וכן גם עתה לפשר ולצדד בין רוס  ועסטרייך, ואין ספק כי חפצו יצליח בידו. (פראנקרייך) הפרעזידענט מאק-מאהאן ובעלי בריתו חסרים למשמעת האפיפיור וקדושיו, הצליח חפצם בידם להטות את רוב בעלי הזענאט לתת לו הרשיום להתיר אגודת באי כח העם אשר רובם הם מהרעפובליקאנים. ועד הזענאט ברוב דעות מלא רצון הפרעזידענט. עתה מסור הדבר בידי בני העם להראות ע״י בחירתם החדשה אם עומדים הם לימין רוב הנבחרים שלהם אוהבי השלום והחירות, או ימסרו הנהגת המדינה בידי החשוכים, עבדי האפיפיור אשר כל ישעם וחפצם להחשיך זהר החירות דעת ולהביא אסון איום על צרפת על ידי מלחמה חדשה לטובת האפיפיור וקדושיו. לשוא התרו אלה משרי הזענאט הרעפובליקאנים את הועד שיזהר למלא רצון הפרעזידענט ולהביא אסון על הארץ. כל דבריהם לא הועילו, יען רוב הזענאט הם ג״כ מבעלי ברית האפיפיור. ה. זימאן שישב ראשונה בסוד שרי שלה והוסר עתה מפקודתו יושב ג״כ בסוד הזענאט, וידבר הממ דברים נמרצים מאד נגד שרי הממשלה החדשים. בתוך דבריו אמר: „הפרעזידענט בהסירו אותי ואת חברי מפקודותנו, נתן טעם למעשהו באמרו, כי מלאנו רצון באי כח העם יותר מהדרוש אל החפץ, באמת לא כן בדיו. יש לאל ידי להראות בעליל כי נהפוך הוא. בענינים הרבה נסגו הנבחרים אחור מדעתם ורצונם רק למענינו. אך הבל הוא להחליט כי בעבור שמלאנו רצו הנבחרים יותר מהראוי הוסרנו מפקודתינו. הסיבה האמתית היא, יען כי נשארה רוחנו נאמנה עם ממשלת הרעפובליק, וזה הי' לקוץ מכאיב בעיני הפרעזידענט של הרעפובליק ובעלי בריתו. כל חטאתנו היתה יען שהיינו בעצה אחת עם רוב באי כח העם הרעפובליקאנים, מפני שגם אנחנו שרי הממשלה הננו רעפובליקאנים. האם לא ידע זאת הפרעזידענט מראש? כאשר קראני אז אליו להפקיד אותי לראש שרי הממשלה, אמרתי לו „עליך לדעת כי אנכי מכת הרעפובליקאנים המשמאילים והוא ענה ואמר לי: „ידעתי גם ידעתי'! אמנם שגה הפרעזידענט ברואה בהאמינו כי יצליח לו להסיר את לבי מאחרי הרעפובליק. בראותו כי נשארה רוחי נאמנה עם הרעפובליק הסירני מפקודתי, יען היא שנואה בעיניו. זה פרי כל חטאתי. עתה מתירים הם אגודת באי כח העם ומטרתם לעשות קץ לממשלת הרעפובליק ולמשול אח״כ כרצונם; אקוה כי לא יצליח חפצם בידם, יושבי  הארץ יודעים כי רק ממשלת הרעפובליק תוכל להרים קרן ארצנו בכבוד. אם אנחנו הרעפובליקאנים נעשה עתה מעשינו במתו שינו יהי' בהשכל ולא ברעש; אם נחי' בעצה אחת וכל מו ותבונה, אז כל עמל אויבינו יעלה בתחו ויאבד וחפצם הרע 141 לא יצליח להם""! זה הי׳ תוכן דברי השר זימאן שישב ראשונה בסוד שרי הממשלה. הבחירה החדשה תהי׳ בסוף ירה סעפטעמבער שנה זו. בין כה וכה תעש הממשלה כל אשר ביכלתה למען תהי הבחירה לפי רצונה. כעת הבאנאפארטיסטים, הלעגיטימיסטים, והאר- לעאניסטים כלם בעצה אחת רק לשים קץ להרעפובליק השנואה להם, וראשי הכהנים נלוו להם בהשתדלותם זו לטובת האפיפיור. ברור הדבר כי יושבי העירות יבחרו את הרעפובליקאנים, אך אין לדעת איך תהי הבחירה של יושבי הכפרים (והם רוב יושבי הארץ) אשר עפ״י רוב ממלאים רצון כהני האמונה, ואימת פקידי הממשלה עליהם. — (ממערכות המלחמה) שר המלוכה בתוגרמה המופקד על עניני חוץ, הודיע אל מלאכי ממשלתו היושבים בחצרות המלכים וסים את נהר הדאנויא בשני מקומות, בין מאטשין כי עברו שא וכן אצל קארא-אגאטש במורד הירזאווא. ממשלת ואיז רוסלאנד הודיעה אדות ההעברה ההיא לאמר: מטרתנו היתה ראשונה לעבור את הדאנויא לעומת עיר גאלאטץ וללכוד את כליל הגבעות על יד בודיאק שהתבצר, שם התוגר מעבר הנהר ם ושנים לירח זה (יוני) עברו עשרים גדודים מצבא יום העי את הנהר באניות. בהציגם כפות רגלם היבשה „ערכו התוגרמים עליהם מלחמה כבדה. צבאותנו נלחמו ברוח גבורה ויסתערו על הגבעות הנ״ל ויגרשו משם את האויב. אז התפרצו הרו מחיל האויב ויתנפלו על האגף הימיני של צבאותנו, אך הוכו אחור. המלחמה נמשכה משעה השלישית קודם עלות השחו עד השעה השביעית בבוקר. אז חדשו התוגרמים את המלחמה על האגף הימיני שלנו אחרי שבאו גדודים אחרים לעזרתם. המלחמה נפרצה אז בהימה שפוכה עד חצות היום. ומפני כי ים ולא קני רובה גדולים, ע״כ נאלצו לא היו לנו אז שם לא ר הרגלים לבדם להלחם עם רוכבי האויב בחרבותם ולא יכלו לו. אחרי חצות היום העבירו גם קני רובה גדולים את הנהר, ואז נשתנה הדבר לטובתנו. התוגרמים הוכו אחור. בין כה וכה באו גם לעזרתם גדודים אחרים מעבר הנהר וילכדו את הגו על יד בודיאק ויתבצרו שם. ביום העשרים ושלשה בא שר הצבא ציממערמאן בראש חילו לעיר מאטשין שעזבוה צבאות תוגרמה. יושבי העיר הנוצרים קבלום בשמחה רבה. מצבאותינו נהרגו במלחמה הנ""ל שבעה פקידי חיל וארבעים בעלי מלחמה ושמונים ושמונה אנשי חיל עם שנים פקידים נפצעו. בלילה ההוא בא הקיסר ויורש העצר לעיר גאלאטץ וילך אל בתי החולים שהובאו שם הפצועים וידבר אתם טובות ויכבד את אלה ש צטיינו בגבורתם, באותות כבוד"" עכ״ל. למחרת היום ההוא הודיע השר אדלערבערג שלישו של קיסר רוסלאנד, אל שר הצבא מאלטקע בבערלין, כי אנשי הגדוד הנקרא על שמו (של מאלטקע) נתכבדו מאת הקיסר בהעברה ראשונה לעבור הנהר והם הצטיינו מאד בגבורתם והקיסר מודיע זאת אל שר הצבא למען ישמח לבו גם הוא. לפי הנשמע מנויה וגמורה בסוד המצביא על כל חיל ו  שלא לעמוד נגד הרוססים במערכה דאברודשא, רק לעשות בראשונה כל מה שבכחו להפריעם מעבור הנהר, ובעברם, סגת אחור עד המקומות הנקראים בשם: „סוללות-טראיאן"" והם גבעות בצורות מאד, ולערוך שם עמהם מלחמה כבדה להפריעם מעבוו הלאה למדינת בולגאריען. מפני זה כבר עזבו התוגרמים גם את הערים הבצורות איזאקטשא וטולטשא, ונסוגים אחור. כן נראה כי העברת הדאגויא הראשית לא היתה עוד על יד גאלאטץ, רק תהי' במקומות אחרים ושם מחכים התוגרמים עליהם בעם כבד ויד חזקה להפריעם. ברור הוא כי עוד ישפך דם רב ע״ העברת הדאגויא, אך הרוססים יעברו ואין לאל יד אויביהם להפריעם מזה. המלחמות העקריות תחילינה על גבולות בול גאריען. — מה שיעשו צבאות רומעניען, אם ילכו גם הם למלחמה על התוגר עם הרוססים או ישארו בארצם, עוד לא נודע. — בין כה וכח הורידו התוגרמים גאון עוז יושבי הרי החושך (מאנטענעגרא) ויכו את כל צבאותיהם מכת חרב הרג ואבדן ופורצים ביד חזקה לעומת צעטיגיע עיר הבירה. אשת מושל מאנטענעגרא וכל ביתו עזבו את עיר הבירה ונמלטו לנפשם. עקבות המושל לא נודעו. הקול יצא כי צבאותיו המיתוחו. גם באזיה הקטנה פרצה עתה המלחמה בעז זעמה בין הרוסי והתוגרמים. על יד דעליבאבה הוכו התוגרמים מכה רבה. לעומת זה מודיעה ממשלת תוגרמת כי במלחמה גדולה על יד באטום הוכו הרוסים. על המבצר קארס צרים הרוסים בעם כבד וינסו זה פעמים אחדות ללכדה ברעש ולא עלתה בידם."
