article_id,headline,text
044-MGD-1876-08-23-PG001-SINGLE-ORIGNAME_200283_toc_1,, שנת העשרים   — יוצא לאור פעם אחת: בכל שבוע. מחירו בארצנו 12 מארק לשנה.  3 מארק לרבע. בעסט- רייך. 8 פל׳ ע״זו לשנה. 2 פל׳ ע״וו לרבע. בשארי ארצות 20 פראנקס לשנה.  
044-MGD-1876-08-23-PG001-SINGLE-ORIGNAME_200283_toc_2,, חדשות וקורות הימים. יגיד ליעקב מהנעשה והנשמע בכל חלקי תבל בין כל יושבי חלד אשר ינעם ואשר ראוי לדעת לכל איש ישראלי לתועלתו ולתועלת השפה העבריה. מאתי ליזד אליעזר ליפמאן זיל עו מאן. והאמת והשלום אהבו. (זכרים ח').
044-MGD-1876-08-23-PG001-SINGLE-ORIGNAME_200283_toc_3,תוכן הענינים., תוכן הענינים. על המדינות בו יאמר: דייטשלאנד: בערלין. עסטרייך-אונגארן: וויען. ענגלאנד: לאנדאן. רוססלאנד: משא יהודי קרים (קרימצאקים) בקראסובאזאר. טירקייא: נסיעה אל חרבות בכל ומגדל דור ההפלגה. ידיעות אחרונות ממקום המלחמה: הצופה: גם אלה דברי ביג: מאת ב״ג. הערה קצרה: מאתי. מ. צונן. זאת ליהודה: מאת דובעריש בר״ז ירוחמזאהן. הערה קטנה: מאת המבשר לאנדויא.
044-MGD-1876-08-23-PG001-SINGLE-ORIGNAME_200283_toc_4,על המדינות בו יאמר," על המדינות בו יאמר (דייטשלאנד). באי כח העם כלו מלאכתם בבית המחוקקים וישובו איש איש למקומו, מפני כי כלתה כעת גם זמן בחירתם, ע״כ תהי בחירה חדשה, לפי הנשמע בירח אקטאבער שנה זו. רוח הממשלה איננה נוחה מרצון אלה הנבחרים ששולחו לבית המחוקקים במלאכות אלה מיושבי הממלכה הפונים קדימה. מעריכי כתבי דברי הימים אשר להממשלה מתחרים כעת לדבר דופי על הנבחרים ההם המתנגדים לרצון הממשלה בהרבה ענינים הנוגעים אל הכלל, ודורשים מאת העם שלא לבחור עוד אנשים כאלה להיות להם לפה רק אלה שיהיו עמה בעצה אחת. לפי הנראה לא תפיק הממשלה חפצה בזה מפני כי אלה מיושבי הארץ אשר בחרו אנשים כאלה יודעים כי נבחריהם מלאו מלאכותם באמונה כרצונם ואין כל ספק כי יבחרום עוד הפעם נגד רצון הממשלה. כעת מריבים כה״ע אשר רוח אלה מבני הממלכה ההולכים לרוח היום דובר בם עם כה״ע להממשלה אדות הענין הזה. תוצאות הבחירה תראינה לדעת יד מי תהי על העליונה. בנוגע לדעת הנשיא ביסמארק ביחוס הפאליטיק שלו בריב תוגרמה, גדולים חקרי לב. שונות הן מאד ההשערות והחלטות של יודעי בינה לעתים בענין זה אך אין להציל דבר אמת מפי כלם. הנשיא ביסמארק סך בענן לו מעבור דעתו ורצונו בין החפצים לדעת. מסכה נסוכה על מחשבתו בזה ולא הצליח עד היום לשום איש להפיץ אור על זה. בהיות הנשיא אחד מראשי המדברים כעת בענינים העומדים ברומו של עולם המדיני, בהשענו על אשכנז הנותנת כרגע חתיתה על הגויים והממלכות, ע״כ עיני כל עליו תלויות לראות אל מי יטה הוא בהסכסוך המדיני הגדול ההוא אשר על תוצאותיו תלוי שלום אייראפא כלה. מבערלין מודיעים כי באמצעות ביסמארק באו קיסרי רוסלאנד ועסטרייך בעצה אחת באופן כזה: רשות תהי נתונה לתוגרמה לדרוש ולקחת ערובתה מאת הזערבים שלא יוסיפו עוד לימים יבואו למרוד בה ולהביא מלחמה בשעריה, אך הערובה לא תהי ע״י זה שתוכל תוגרמה לקחת לה חלק ממדינת זערביען לאחוזה גם לא להציג משמר מאנשי חילה במבצריה, רק ישאר הדבר כמו שהי׳ קודם המלחמה והממשלות האדירות תערובנה ערובתן בעד זערביען שתשקוט במכונה. מלבד זה מודיעים כי יצליח חפץ ביסמארק בידו לשים למישור גם המעקשים ופירוד הדעות בין רוסלאנד וענגלאנד בענין זה. כל זמן אשר לא הובאה גם ענגלאנד בברית יחד עם רוסלאנד ועסטרייך, לא תוכלנה גם הן להתערב בריב זה ולשים קץ לשפיכות הדם על שדה המערכה, מפני כי ההתערבות בזה מצד אחד תוכל לסבב מלחמה כוללת בשערי אייראפא, ומלחמה כזו איננה דרושה לחפץ אשכנז. (עסטרייך). מוויען מודיעים כי עתה מנויה וגמורה גם בסוד ממשלת עסטרייך שלא לתת יד לתוגרמה לעשות בזערביען כטוב בעיניה אף אם תכח אותה במלחמה עד רדתה. מכה״ע בוויען אשר רוח השר אנדראשי דובר בו מודיע כי כזה, עסטרייך עם רוסלאנד בעצה אחת שלא לתת להתוגר להניח שבטו על גורל זערביען כטוב בעיניו. על פי סיבות שתים שנתה עסטרייך את דעתה ותט אחרי רוסלאנד. האחת היא: אכזריות ותועבות הטשערקעסים במדינת בולגאריען. אחרי אשר גם ענגלאנד המגינה על תוגרמה באמת ותמים, החלה לפנות עורף מעט אליה מסיבת התועבות ההן, לזאת איפא לא תוכל גם עסטרייך להעלים עינה מזה. הסיבה השנית היא פירוד הדעות השורר בין שרי המלוכה העומדים כעת בראש ההנהגה במלכות התוגר. — מודעת זאת כי בנוגע להטבת מצב המדינה של העמים הנוצרים בתוגרמה, כל הממלכות בעצה אחת. גם ענגלאנד ועסטרייך תמיד הודיעו רצונן לטובת הנוצרים. כל דרשו מאת ממשלת התוגר להטיב עם הנוצרים יושביה ולהסור על ידי זה את הסיבות המניעות אותם תמיד למרוד בה ולהפריע שלום הארץ. הממשלות נפרדו בדיייסירי היוגע ל- דרך המובילה למטרה זו. רוסלאנד עסטרייך ואו  והה בבערלין). לעשות בעצמן הסדרים החדשום בהושימה לטובת הנוצרים שם ולדרוש מאת התוגר למלא השאלתן. ענגלאנד לעומתן, בידעה כי לא תוכל תוגרמה למלא כל משאלות הממשלות ההן, ועיז תוכל לפרוץ מלחמה כוללת באשא. ע״כ לא נתנה ידה לההצעה הנ״ל ואמרה כי נחוץ לחכות על תוגרמה בעצמה שעומדת הכן בעצמה לשים כל המעקשים למישור לטובת הנוצרים. ומפני כי אחרי מות הסולטאן עבדול עזין חפצה ממשלת תוגרמה, עפ״י עצת אחד מראשיה השר מידהאט פחה, לתת קאנסטיטוציאן דרשה לטובת כל ישפי תוגרמה באין הבדל בין המושלמנים והנוצרים ע״כ נסגו גם רוסלאנד ועסטרייך אחור מחפצן ונמנו וגמרו לחכות על אחרית הדבר. והנה ברור הדבר כי אם לא קראה זעדביען מלחמה עליה. כבר היתה הקאנפטיטוציא לחזק ולא יעבור בתוגרמה ואיש איש על מקומו היה בא בשלום. המלחמה ההוא הפריעה עצת הממשלה אשר לא יכלה להפיק חפצה ההיא בעת רבים קמים עליה להשמידה. והנה עלינו לדעת כי רבים מיושבי תוגרמה ובתוכם אוהבי ובעלי ברית הסולטאן עבדול-עזוז שונאים את הנוצרים תכלית שנאה ולא יעלה על דעתם לתת להם תורת האזרחים ולהק עולם, וכהני האמונה נלוים להם בדעתם זו; אך אחרי מות הסולטאן הנ״ל רפתה ידם, ויד אלה החפצים בתקונים חדשים לרוח הזמן הפונה קדימה היתה על העליונה, ע״כ נסגו אחור ונאלמו דומיה. עתה כאשר החלו צבאות תוגרמה להתגבר על הזערבים ולהכותם אחור, הרימו אלה ראשם עוד הפעם. גלוה להם גם השר היושב כעת ראשונה במלכות המתיצם לשטן למחשבות השר מידהאט פחה, ומעשות תקונים חדשים לטובת הנוצרים לא נשמע דבר. ברור הוא כי אם תתגבר תוגרמה על אויביה במלחמה, אז יהיו שונאי הנוצרים ראשי המדברים בהנהגת המלוכה שם. לפי זה נכונה גם עסטרייך בלי חמדה לנטות אחרי רוסלאנד לעמוד לימין זערביען, יען בגורלה תלוי גם גורל כל הנוצרים בתוגרמה. ע״כ כל הדברים יגעים, כי לא נודע אם תתרצה תוגרמה לסגת אחור לפקודת הממשלות האדירות ולהניח חרבה מידה בלי כל שכר לעמלה ונצחוניה. ואם לא תחפוץ לעשות זאת, מה תאמר ענגלאנד לזה? ע״כ כרגע עיני כל לענגלאנד נשואות. אם יצליח לביסמארק לצדד הדבר גם עמה, אז יבא הקץ להמלחמה ותוגרמה תה מוכרחת למלאות חפץ כל הממשלות האדירות. — (פראנקרייך). באי כח העם כלו מלאכתם באסיפתם האחרונה ושבתו לזמן קצוב להנפש מעבודתם. מכל הנעשה בבתי המחוקקים שם עד היום נראה כי גם רוב שרי הממשלה החדשים ידם תכון עם בעלי הזענאט ההולכים לאחור. חוקים חדשים הרבה שנמנו וגמרו עליהם רוב נבחרי העם לטובת המדינה וחירות יושביה לא הסכימו להם בעלי הזענאט. בכ עומדים הם לשטן לכל דבר טוב ונחוץ לטובת הרעפובליק נפש העם מרה מאד על הממשלה והזענאט ומי יודע מה ילד יום? — (ענגלאנד). ביום החמשה עשר לירח זה כלו בחירי העם עבודתם בבית המחוקקים ושבו לבתיהם. טרם נפרדו מהועד נקראו לפניהם דברי המלכה שערכה אליהם בנוגע לפעולתם ולהפאליטיק של ממשלתה. ביחוס עניני חוץ תאמר המלכה עם הספר כי שלום למלכותה עם כל יתר הממלכות האדירות וכן יש תקוה כי ישאר השלום על מכונו גם לעתיד השתדלות ממשלתה בחברת יתר הממשלות להסיר הסיבות ופירוד הדעות בין ממשלת תוגרמה והנוצרים במדינת הערצאגאווינא ובאסניען, לא הוציאה פרי עד היום. לחמרידה שפרצה במדינות החן,  התחברה גם המלחמה בין התוגר וזערביען ומאנטענעגרא. כבא. שעת הכושר תתאמץ ממשלתה בחברת הממשלות האחרות לעשות שלום גם בין הלוחמים ההם. ממשלתה יודעת מה שמוטל עליה לעשות לטובת הנוצרים האומללים בתוגרמה, מבלי להעלים עין גם מחובתה האחרת המוטלת עליה לעשות לטובת וקיום מלכות התוגר עפ״י אופני חברית משנת 1856. (טירקייא). בימים האלה הוציא הסולטאן כתב מחילה וסליחה להנוצרים המורדים במדינת בולגאריען, וזה לשונו: „הוד מלכותו הסולטאן באהבתו וחמלתו על הנוצרים יושבי 2 רדים אשר עוד לגארייי׳ נתעורר לסלוד לפשעי כל אלה כ י אשפטר לו לגמר כהלכתו. כלם חפשים יהיו שניתם ולא תאונה למו כל רעה. יוצאים מהכלל הזה הם כל אלה אשר כבר נחרץ עונשם גם אלה שעמדו בראש המרידה והיו מהמסיתים והמדיחים את העם. כל האסורים האחרים יצאו לחפשי אחרי תתם ערובתם. כל בתי המשפט החדשים שנוסדו לשפוט את המורדים יתבטלו מהיום והלאה. זה הוא תוכן כתב מסליחה. מקאנסטנטינאפעל מודיעים אודת זה, כי כל הענין בהבל יסודו, ולא נעשה רק לנקר עיני שרי הממשלות האדירות באייראפא. הסעיף מכתב הסליחה המוציא מהכלל את כל אלה שכבר נחרץ משפטם והמפיתים, הפעיף הזה מבטל את כל הסל ויחה, יען כי מי יציב גבול בין המסית והמוסת? הכל תלוי ברצון השופט וכל אחד יהי׳ מהמסיתים . ממקום המלחמה). המושל מילאן בא בימים האלה לבעלגראד בירת ממשלתו. סיבת בואו היתה כי אשתו ילדה כן זכר! היולדת שוכבת על ערש דוי והרופאים הגידו נואש לחייה. דאגותיה ויגונה מסיבת המלחמה הרסו עמודי בריאותה עד היסוד בראשונה היה ברצון המושל לשים קץ להמלחמה ולהשלים עם תוגרמה. דעתו זו כבר הודיע אל הממשלות האדירות, שרי ממשלתו החפצים במלחמה היו נכונים לסגת אחור. פתאום באה הבשורה מהמערכה כי במקום אחד הנ צבאותיו את חיל תוגרמה מכה רבה, ע״כ שנה המושל את רצונו וגמר בדעתו לנסות עוד הצלחתו במלחמה. שרי ממשלתו נשארו בפקודתם והוא שב למקום המלחמה. כן מודיעים מבעל- גראד מיום החמשה עשר לירח זה. עד היום לא הודיעו כה״ע מפרטי הנצחון הנזכר של זערביען ואם אמת נכון הדבר. — ממשלת זערביען העריכה ספר - גלוי לכל הממש ת בנוגע לאכזריות ותועבות חיל התוגר במלחמה הזו, ומודיעה כי בכל מדרך כף רגלם על אדמת זערביען הרסו ושרפו את כל מקום לא יחיו כל נשמה. במלחמה הורגים גם את הנפצעים והשוכבים בבתי החולים וכדומה. ממשלת תוגרמה הודיעה גם כן כי אין נכונה בפי ממשלת זערביען. הן אמנם שרפו צבאותיה כפרים אחדים, אך נאלצו לעשות זאת בעת המלחמה, אבל הכפרים ואשמת האחרים לאנשרפו והפצועים לא נהרגו. ממשלת תוגרמה מצדה את צבאות זערביען ואומרת כי בזמן שעמדו הם על אדמת תוגרמה שרפו והחריבו ששים כפרים והרגו כל יושביהם התוגרמים, ואשר עשו הם אינם מודיעים. כן הודיעה ממשלה תוגרמה ברבים. אמנם בענין זה יאמנו דברי ממשלת זערביען כאשר מודיעים גם סופרי מכתבי-עת כאלה הנודעים לעומדים לימין צדקת תוגרמה בריבה עם זערביען. כן מודיע סופר מכה״ע eurמזערביען לאמר: לב איש יתר ממקומו בשמע מעללי חיל תוגרמה במלחמה זו על אדמת זערביען. לפי הנודע, כל חיל החלוץ של צבא תוגרמה העובר לפני כל המחנות הם מבני הערב-רב אשר בתוגרמה וביחוד מבני האספסוף הטשער- קעסים שנתנה הממשלה חרב בידם והם מפנים לצבאותיה הדרך על אדמת האויב. אנשי חיל החלוץ ההוא משאירים אחריהם בכל מקום בואם רק מדבר שממה. רשמי דרכם נכרים ע״י גל אפר וגויות אדם. מגראנאדא עד מעבר לעיר קניאזעוואץ ומשם בכל המקומות עד באניא לא נשאר בית שדה וכרם אחד על תלו. כל הנעשה בידי אדם נהרם עד היסוד בו. אם תמשך המלחמה עוד שבועות אחדים וחיל התוגר יוכלו להבקיע עד בעלגראד עיר הבירה, אז לא ישארו מכל מדינות זערביען רק ערמות דשן ומשואות חרבות. בין כה וכה וצבאות תוגרמה פורצים הלאה בזערביען כשטף מים כבירים באין מפריע. שרידי צבאות זערביען נסגים אחור עד עמקי נהר מאראווא ושם מקוים להתבצר ולעצור את האויב במהלכו. התוגרמים חודרים הלאה בפנים הארץ בדרכים שונים שר הצבא דע רוויש פחה הולך ומתקרב לעיר הבירה דרך יאוואר: אחמוט איוב פחה על הדרך העולה באניאה, ושר הצבא אסמאן פחה לכד כבר את עיר ראדויעוואץ הבצורה, שלשת המחנות ההן תתאחדנה על יד בעלגראוי לשבור שם גאון עוז הזערבים אם לא יעמוד להם ריוח והצלה ממקום אחר. תקות הזערבים האחרונה הם המקומות הבצורים מאד על יד הנהר הגדול נאר מאראווא אשר אין דרך אחרת לצבאות התוגד לבא לעיר הבירה רק להדור דרך עמקי נהר מאראווא. ממני זה נאספים שמה כל צבאות זערביען לעמוד שם על נפשם נגד האויב. שני המבצרים העומדים שם, והם דיליגארה ואלעקסינאץ נתבצרו מאד בימים האחרונים האלה. — המבצרים ההם עומדים על גבעות גבוהות. על יד דילינארד נשפכו תשע עשרה סוללת ועליהן חמשים קנה- רובה גדולים אשר משם יוכלו לשלוח חצים ומות על כל הקרב אליהן דרך העמק. גם אלעקסינאץ נתבצרה כעת ביתר שאת ועוז. בשני המבצרים הובאו עתה צרכי אוכל נפש לשלשים אלפים בעלי מלחמה על משך שנה אחת. שר הצבא טשארניעף שנתמנה עתה מהמושל לעמוד בראש כל צבאות חילו, עומד כעת במקומות ההם בראש שבעים אלפים שולפי חרב לסגור הדרך בעד צבאות תוגרמה. התוגרמים מתקרבים אל המקומות ההם בראש מאה וחמשים אלפים אנשי חיל. בקרב הימים תפרוץ שם מלחמה כבדה ונוראה אשר תכריע הכף. ממקום המערכה בין תוגרמה ומאנטענענרא במדינת הערצא גאווינא, היתה שמועת שוא כי הוכו צבאות מאנטענעגרא אחור. מצב הדבר הוא כי עד היום הזה עודנו שר הצבא מוקטהאר פחה סגור בתוך המבצר טרעביניע ועוד לא התמסר בידי הצרים עליו. הן אמנם צבא רב מחיל התוגר תחת פקודת שר הצבא דערוויש פחה הולכים ומתקרבים דרך באסניען להציל את מוקטהאר פחה. מושל מאנטענעגרא גם הוא עומד שם בראש חילו. גם שם תפרוץ בקרוב מלחמה גדולה."
044-MGD-1876-08-23-PG001-SINGLE-ORIGNAME_200283_toc_5,," No. 33. — כל איש יוכל להשיגו ע״י כל פאסס-אמס ובוכ- האנדלונג בכל המדינות.; כל החפץ להודיע דבר; מה, ברבים לטובתו עליו לשלם שכר הדפסה! בעד כל שורה 15 פפ׳ е"
