article_id,headline,text
044-MGD-1880-07-28-PG001-SINGLE-ORIGNAME_240249_toc_1,,"  יאמיניסטערייט יוצא לאור פעם אחת בכל שבוע. מחירו בארצנו 12 מארק לשנה, 3 מארק לרבע. בעסטרייך 8 פל׳ ע״וו לשנה. 2 פל׳ ע״וו לרבע. בשארי ארצות 20 פראנקם לשנה. כל איש יוכל להשיגו ע״י כל פאסט-אמט ובוכהאנדלונג בכל המדינות. כל החפץ להודיע  דבר מה ברבים לטובתו עליו לשלם שכר הדפסה בעד כל שורה? 20 ספ' —"
044-MGD-1880-07-28-PG001-SINGLE-ORIGNAME_240249_toc_2,," מיניסטערייט Erscheint einmal gchentlich. Der Abonnementsрreis betrsgt 12 Mark Jshrlich in Inland Der fnserationspreis betrsgt  Pro Corpusspaltzeile 20 ק bei Bröseren insertions- Auftrsgen Wird ein entsprechender Rabatt gewshrt. Alle Anonncenexpeditionen Rehmen Inserate für „HAMein an. Adresse Redaction des „HAMAGID,  Lyck. Preusscn. ."
044-MGD-1880-07-28-PG001-SINGLE-ORIGNAME_240249_toc_3,יגיד ליעקב מהנעשה והנשמע בכל חלקי תבל בי...," יגיד ליעקב מהנעשה והנשמע בכל חלקי תבל בין כל יושבי חלד אשר ינעם ואשר ראוי לדעת לכל איש ישראלי לתועלתו ולתועלת השפה העבריה. (נוסד על ידי אליעזר ליפמאן זילבערמאן). יוצא עתה אור מאת דוד גארדאן. והאמת והשלום אהבו. (זכרים ח'). L. Ju ליק, כ׳ אב. תר״מ. אה"
044-MGD-1880-07-28-PG001-SINGLE-ORIGNAME_240249_toc_4,חוכן חעגיגים. לפני עשר שנים: על המדינות ..., תוכן הענינים. לפני עשר שנים: על המדינות בו יאמר: עט-סופרים: מאת שוחר תושיה. דייטשלאנד: קעניגסבערג. אויגסבורג. עסטרייך- אונגארען: קראקא. פראנקרייך: חג הלאומי בצרפת. פאריז. ענגלאנד: אויסטראליען: באללאראט רומעניען: מכתבים מבוקארעספ רוסלאנד: פעטערסבורג. חדשות ב שראל: הודעות:
044-MGD-1880-07-28-PG001-SINGLE-ORIGNAME_240249_toc_5,לפני ע'שר שנים. ביום תשעה עשר לירח זח (י...," לפני עשר שנים. ביום תשעה עשר לירח זה (יולי) לפני עשר שנים הודיע הקיסר נאפאלעאן השלישי (שהוכה אז בסגורים) אל מלך פרייסען כי יקרא עליו מלחמה. עשר שנים עברו מיום ההוא. בכל שנה ושנה מעריצים האשכנזים את היום ההוא ויעיר ויחזק בקרבם האהבה למלכם ולארץ מולדתם לגדולתה ועוזה וכבודה. קריאת המלחמה ההיא הוציאה אור את אחדות כל ארצות אשכנז, ותעל אותה אל מרום עוזה ותפארתה. מה שלא יכלה לעשות כל ההשתדלות של חכמי וגדולי אשכנז במשך שנות מאות רבות עשה נאפאלעאן השלישי ברגע קרא מלחמה על פרייסען. — עברו עתה עשר שנים למן היום אשר קרא נאפאלעאן מלחמה עליה לאסונו ולאבדן כבודו וגדולתו, וכבוד היום עודנו חדש בלבות האשכנזים אשר יזכירם כי בזמן ההוא חדל בין האשכנזים כל ריב פנימי ופרוד הדעות בעניני המדינה והאמונה. כלם כאיש אחד התעוררו לצאת המערכה נגד המושל הגדול, אשר אמר אני ואפסי עוד, ולהענישהו כיד פשעו להוריד לארץ נצחו. בפעם ראשונה אחרי עבור שנות מאות הרבה הרגישו האשכנזים בלבם רגש לאומי ואחדות, רגש אהבה ואחוה-לאומית. אז נשבעו בקרב לבם שלא להפרד עוד איש מרעהו, ולעמוד תמיד הכן כאיש אחד נגד הצר והאויב אשר הרחיב עוז לפרוץ בגבולם. הקיסר נאפאלעאן בטח לבו על שריו ויועציו ושרי צבאיו שהבטיחו כי הכל מוכן למלחמה לחכות את הפרייסים עד חרמה כנטות ידם עליהם. לשוא בקש אז השר טהיער הנודע, בקש ויתחנן אל באי כח העם בצרפת שלא לתת יד להחפצים במלחמה באמרו כי היא לא תצלח. — לשוא קרא מנחמת לבו: „נגדה נא לכל יושבי תבל הודיע עתה מלך פרייסען כי ש""ב הנסיך מן האהענצאללערן לא יקבל עטרת מלכות שפאניען, ומה אתם דורשים ממנו לעשות עוד? אתם חפצים לחלל כבוד וגאון פרייסען, ולאכוף את מלכה להריק חרבו נגדנו נגד רצונו? טוב איפא! אנכי רוחץ בזה בנקיון כפי. מלאתי חובתי הקדושה לארץ מולדתי והזהרתי אתכם להשמר ממלחמה זו, ורק אתם תאשמו. לפי דעתי תסכילו עשה עתה לצאת המערכה נגד פרייסען. גם לי לבב כמוכם, גם אנכי נצטערתי על מה שעשתה פרייסען בשנת 1966. אז היתה לנו שעת הכושר להתראות אתה פנים בתקות נצחון. אבל עתה? כבר עברנו המועד. עתה נפל נפול לפניה ונביא על ארץ מולדתנו רעה לא נוכל לדעת שחרה!"" כן דבר אז הזקן החכם הגדול שראה את הנולד, אל בני עמו, למלטם מאסונם, אך שומע לא הי' לו. לשוא מלא אחריו גם הש קרעמיע ז""ל ויתחנן אל בעלי הועד לחוס על ארצם ולסגת אחור מחפץ נורא כזה. לשוא שחתו הזקנים החכמים ההם את דבריהם. רוח עועים אחזה את הקיסר, את יועציו ואת באי כח העם. הזקן טהיער קרא אז בסוף דבריו בין הרעש וההמולה הגדולה: „אתם תראו אחרית הדבר ותתנחמו על אולתכם בעת שלא תוכלו עוד לתקן עותתכם!"" דבריו היו כקול קורא במדבר. — על ידי המלחמה ההיא הגיעו האשכנזים אל מטרתם הנשגבה אשר אליה היו נשואות עיניהם ועיני אבותיהם ואבות אבותיהם זה שנות מאות רבות; זה עשר שנים שהגיעו לנחלת האחדות האשכנזית, ובטחון גבולות ארצותיהם, ולהעמידה ברשות עצמם. למטרה זו הגיעו „בעזרת דם וברזל"", כפתגמו של הנשיא בים- מארק. אבל, אם כי האחדות-הלאומית יפה היא ומאד נעלה, בכל זאת מחולים בכוס שמחת האשכנזים גם נטפי תוגה ומדירות חלב, יען כי החרות שהיתה ראויה לחיות קשורה בעקבות האחדות, עוד לא נפלה לחבל להאשכנזים במדה אשר קוו לה. כל הנצחונות הגדולים והנמרצים לא הולידו. עוד ההתעלות- הרוחנית של העם, ותחתה נראו אותות „הרעאקציאן"" (החליכה לאחור ולא לפנים). מה תתמרמר נפש כל איש איש באשכנז חובב עמו וארצו באמת ותמים, לראות את הצרפתים המנוצחים והמוכים, מחדשים כנשר נעוריהם ועולים מעלה מעלה בחירותם החומרית והרוחנית, מאושרים הם ומוצלחים, נהנים מטוב הארץ באין שטן ומפריע, ובשמחת לב ועליצות נפש יכלו לחוג את יום הארבעה עשר לירח זה, יום חג-לאומם בו יצאו לחרות, יען באמת הנה הם כעת בני חורין, ונהנין מברכת השלום וההצלחה. ומה רואים אנחנו כעת באשכנז? במקום החרות הושמה מועקה בצואריהם. ע״י חוקים חדשים נגבלה חרות המסחר והקנין, נגבלה חרות המלאכה וחרשת המעשה; כל גם. צרכי אוכל נפש נתיקרו על אחת חמש מסיבת חוקי המ ההוצאה מרובה על ההכנסה. אוצר המדינה ריק, יען צרכי הצבא בולעים כמעט כל ההכנסה, בולעים ואינם פולטים. — המיליארדען שנלקחו מהצרפתים לא נודעו כי באו אל קרב הממלכה. המסים נתרבו ומתרבים מיום ליום, ויושבי הארץ רובצים תחת משאם. האחדות טובה היא מאד אבל אחדות באין חרות ובאין לחם במה נח-יה? המשכר משתבר ובכל יום עוזבים - אל אנשים צעירים את אל צרור נקוב מקום מוצא לחית נפשם מעבר לים ואיים רחוקים. הארץ לבל יושבי המחוזות המזרחים הולכים ודלים מיום ליום. שכר האדם איננו והתלונה תגדל מיום ליום. נוסף לכל זה התעוררה בימים האלה גם שנאת בעלי הדתות זה על זה. הקאטאליקים עוינים את הפראטעסטנטים, הפראטעסטנטים שונאים תכלית שנאה את הקאטאליקים, והקנאים משתי כתות-האמונה הנ״ל צוררים את היהודים, ומתחרים להשפילם לעפר. ככה הוא כעת מצ נז אחרי כל הנצחונות והרחבת הגבולות, אחריכ ממלכת אש המיליארדען והאחדות הלאומית! ומי אשם בדבר? הליברלים מאשימים את הנשיא ביסמארק ואת הקאנזערוואטיפים אשר התחבר אליהם בזמן האחרון, והוא ובעלי בריתו מאשימים את הליברלים. בין כה וכה והעם רובץ תחת משאו, והעם באמת אין לו צדקה לזעוק ולקונן, כי בדרך שאדם רוצה ללכת מוליכין אותו. העם בחר באנשים כאלה אשר הסכימו לכל החוקים החדשים אשר הסבו רבות מן הרעות עליו, ורצונו של אדם פרטי, אף כי רצונו של עם כלו, זה הוא כבודו. — אלה ה המחשבות העולות בלב האיש אשר עומד בתוך בין שתי המחנות ורואה בעין פקוחה על כל הנעשה."
044-MGD-1880-07-28-PG001-SINGLE-ORIGNAME_240249_toc_6,על המדינות בו יאמר," על המדינות בו יאמר (עסטרייך-אונגארן). מלחמת הלאומים השונים החוסים תחת שבט ממשלת עסטרייך לא נחה עוד מזעפה, והאשכנזים ומתנגדיהם יתהרו להרבות אש ועצים על מוקד השנאה אשר תבער בכל פאתי- הארץ. ביותר ידאב לב האשכנזים אוהבי החרות ושווי הזכיות בראותם כי בין כל השרים היושבים ואשונה במלכות, אין גם אחד אשר ישמיע בעדם את קולו כי מלבד חברי הטשעכים הפולנאים ובעלי בריתם ישבו בסוד הממלכה גם שלשה אנשים ההיו מלפנים פקידים בארץ מטעם הממשלה, והמה ככדור משחק בידי הממשלה הרוצה לשחק בהם, ועל מי יוכלו האשכנזים להשען? ים לא הניחו את רוחם בכל נתן להם עד אמנם גם הטש הנה, כי יותר שיתנו להם שרי הממשלה זכיות אשר לא שערו מלפנים, כן יוסיפו ויקשו לשאול. ותהי הנקל להם, כי הוציאה הממשלה חוק חדש לאור, אשר לפיחו ינתנו לשפתם מהלכים בכל בתי-הספר והמשפט אשר בארצות בעהמען ומעהרען, כי יבקשו עוד מאתה להושיב להם אנשים יודעים את שפתם בבתי-המשפט העליונים בעיר-הממלכה וויען. וכה ילכו בדרכו אשר נפשם חפצה עד אשר ימלאם לבם לחפוץ כי לא ידבר כים יאמר מה״ע „טאגע לאטט״, הקיסר כי אם שפת הס אכן האשכנזים יקוו, כי כמקרה שנת 1871 יקרם גם עתה. גם אז האמינו הטשעכים, כי בקרב הימים יצלחו למשוח עליהם את הקיסר „למלך הטשעכים״, אולם אחריתם נכרתה, ובין לילה ואבדה תקותם. (פראנקרייך). הצרפתים מלאים עוד רגשי שמחת אשר נתן הג־הלאומי ביום הארבעה עשר לירח זה בלבם. כל חפצי הרעפובליק ודורשי שלומה לא יכלאו את שפתם מלספר את כל הגדולות אשר נעשו ביום ההוא בארץ צרפת בכל עיר ועיר ובכל פלך ופלך. דגל הרעפובליק אשר היה מרחף על בתי הצרפתים ביום ההוא, הוא גם רגל השלום אשר חופף על אדמת צרפת מיום הוסדה הרעפובליק ועד הנה, כאשר אמר הנשיא גרעווי לשרי הצבא הנאספים לקבל את דגליהם החדשים מודו ביום החג. גם גאמבעטטא הקדיש את קרואיו כמאה ועשרים איש כלם גבורים אחוזי-הרב ומלומדי מלחמה (ביום הששה עשר לירח זה). — בתוך מדברותיו אשר נשא אז על עם צרפת, תאר בדברים נמרצים אשר ישרטו בלב השומעים שרטת, את מצב ארץ צרפת הנורא אחרי המלחמה הנוראה בשנת 1870 אשר הביא עליה הקיסר נאפאלעאן השלישי כחי אשר הביא השלום ב בזדון לבו, ואת אשרה ועשרה ה נפיו. מכל אלה נראה בעליל כי נפקחו עיני עם צרפת לדעת מה טוב להם, וכי רק על-ידי השלום יבואו להצלחתם. האמתית. אכן גם הש נה תשכון בתוך קוצים כסוחים אשר יסבוה מכל עבריה מס ושנה בין החוחים כן אוהבי הרעפובליק ב. כי ין חפצי המס נה מעבר מזה, ושואפי החדשות מעבר השני. שני אלה יחפצו להביא רעה על הארץ אשר לא תוכל למיש ממנה את צוארה, ויעשו מעשיהם זר מעשיהם. אוהבי הגראף שאמבארד התקבצו ביום החמשה עשר לירח זה לכתוב מכתב לום ואמת „לאיש הנושא על שכמו את זכיות הצרפתים חרותם ותקותם גם יחד"", ולהודיעהו כי בשמעם לקול העם אשר בקרבו המה יושבים „יבואו להשתחוות לפני הדר כבוד מלכותו ולהבטיחהו כי רוחם נאמנה אתו כל ימי חייהם על הארץ. — אמנם כן! הבורבאנים עינים להם ולא יראו אזנים להם ולא ישמעו. השמן לב האנשים ואזנם הכבד משמוע את ק הע המדבר אליהם מתוך חצוצרות התרועה ומתוך להבות אש מתלקחות בתוך חלוני הבתים. ואם קול העם מדבר מתוך גרונם,  מדוע לא פתחו פיהם בחכמה להודיע ולגלות את שמחת עולם אשר על ראש העם ביום הזה? גם שואפי חדשות, ובתוכם האיש הענרי ראשעפארט, השב מגלותו ועיר מקלטו גענף, בחמלת ה ולה עליו ועל אחוזת מרעהו, גם המה אסרו את המלחמה על הממשלה וביותר על  זא, האיש הדגול מרבבה, על דבר סליחת-פשעם, גאמב ויתנוהו לשמצה בקמיו, לאמר: רודף הוא אחרי הממשלה הבלתי מגבלה, ורק זאת הוא מאויי- לבו סלה. אמנם כי אליהם לא ישיתו הצרפתים את לבם, ואחרי ימים לא כבירים ישכחו כמת מלב, וארץ לעולם עומדת ב ום ושלוה. (טירקייא). בימים האחרונים נמסר כתב הפרטי-כל החתום בידי צירי כל ממשלות אייראפא לשרי ממשלת הסולטון בקאנ סטאנטינאפעל, ובזה הגענו למצב חדש בשאלה האריענטאלית אשר עיני כל יושבי אייראפא אליו נשואות זה חמש שנים עד כי נלאו נשוא אותה, שאונה והמונה גם יחד. ואם נחקר דעת מה הועילו הדיפלאמאטים הנאספים באספת הקאנפערענץ תקנתם, לא נוכל לתת על זה מענה נכונה וברורה. הן אמנם הצליח בידם להתות תו על הגליון ומפת הארץ את הגבול לאנד. אכן מי זה לידם יתקע כי החדש בין תוגרמה וגריע קבלו התוגרמים את משפטם ברצון טוב כאשר קבלוהו היונים? היונים בבא כתב הפרטי-כל לידי השר היושב ראשונה במלכותם (ביום הששה עשר לירח זה), שמחו אלי-גיל ויהללו את אלקיהם גם האירו את כל חלונות בתי העיר אטהען בנשף בערב יום. והתוגרמים מה המה אומרים? מכל הנשמע עד הנה נוכל לשפוט כי אין את נפש הסולטון לתת אף מדרך כף רגל ליונים הרוצים לבוא על שכרם בגלל הנצחונות שלא נצחו מעולם ולקרוע את ארצם לקו ם. מכתבי-העת מביאים את פתשגן שני המכתבים אשר מסר ציר תוגרמה בברלין בימי 22—28 לירח העבר, תוכן לאספת הקאנפערענ דבריהם הוא בקצרה: „שמוע שמעתי מאנשים פרטים, ותרגז בטני, כי יחפצו צירי הגוים הנאספים בברלין לחלק ליונים את ארצות ממשלת הסולטון עם ערי יאנינא ולאריססא. אולם לא רק משפטי הדיפ- לאמאטיע יאסרו עלינו אסר לבלתי הנחיל את ארצות נחלתנו טרם מותנו, כי אם גם חקי הסטראטעגיע יצוו עלינו במפגיע בלתי לכת אחרי צו הדיפלאמאטים ולקבל את הגבול הזה אשר ברצונם להציב בין תוגרמה ויון. לכן באתי בזה לבקש מכם, אלופי הנכבדים! לבל תמהרו להוציא משפט מעוקל טרם תחקרו לדעת מה טוב ובטרם תדעו נאמנה אם יהיה לאל ידנו למלא אחרי דבריכם, ולמה לכם להביא את אייראפא בסכסוכים רבים חדשים מקרוב באו אשר לא שערום הדיפלאמאטים מראש״? הלא הראינו לדעת כי אבדה תקות אלה המאמינים, כי עוד יצלחו שרי ממשלות אייראפא על נקלה להטות את לב הסולטו לחפצם. אמנם חטאו הדיפלאמאטים חטאה גדולה לא ידעו כפרה, כי מהרו להוציא משפטם על גוי ועל אדם יחד בטרם ידעו אל נכונה אם יש לאל ידם להעיק את אנשי הריב תחתם ולחלצם בחוזק יד לקבל את דבריהם אם יעלה בלבם מחי בות להתיצב נגדם ביד רמה. הלא גם איש פרטי אשר ישימוהו אנשים נצים לשופט ולמוכיח ביניהם לא יעשה בנפשו שקר למהר ולשפוט טרם ידע אל נכונה כי לא ישחית את אמריו לשוא. ולא זאת בלבד עשו הדיפלאמאטים, כי עוד יתרה עשו להביא על חצי האי הבאלקאן רעה לא ידעו שחרה. המה הציתו את אש הקנאה והתאוה בלבות כל העמים היושבים על חצי האי הזה, ויתאבכו נאות העשן. שמיר ושית תאכל יחדו ואין מכבה. הבולגארים יקראו בגרון בלי חשך, כי לא נופלים המה מן היונים החוסים תחת שבט הסולטאן וכי גם להם נאוה להתחבר לאחדים תחת מושל אשר מקרבם יצא, ולהם הצדקה לקחת אליהם את כל ארץ רומעליען - המזרחית מולדת הקאנגרעסס בברלין בשנת 1878 אשר כנגע צרעת נראתה להם. האלבא- גיזים יקראו לקראת נשק ללחום נגד מאנטענעגרא וגריעכס לאנד גם יחד. ב שבוע העבר התנפלו על המאנטענעגרים החונים נגדם במערכה ויכום מכה רבה, עד אשר נסו לארצם ולא הרהיבו בנפשם לשוב שנית המערכה. אמנם מי מאתנו יוד עד מה יובילנו הריב הזה? הן כבר הסכן הסכננו לראות חדשה בממלכת הטירקייא, כי מזיק אחד יצא להב אוכלה סביבה מנפש ועד בשר תו ה. רבים יאמינו אמונת אומן כי נכונות כל ממשלות אייראפא לשלוח את אניותיהם לחפי תוגרמה להאיץ בה בחוזק יד כי תמלא אחרי דבריהם ולחופי גריעכענלאנד להיות עליה סתרה ביום זעם. אולם עוד זה מדבר להבטיח על נכונה כי כן הוא, והנה זה בא להפוך את דברי הראשון מן הקצה אל הקצה האחד יכחיש את דברי השני, כי ענין רע נתנה הקאנפע לדיפלאמאטים ולכותבי דברי הימים לענות בו. לכן נחכה לימים יבואו, והמה יודיעונו את אשר תקנו בעלי הקאנפערענץ התולדה שופטת רמים הוא, לא תשא פני כל איש ואל אדם לא תכנה, ורק מפיה אנו חיים."
044-MGD-1880-07-28-PG001-SINGLE-ORIGNAME_240249_toc_7,עט־ סופרים ? על דבר ישו3 הארץ ( יו&ח עוו...," עט-סופרים. על דבר ישוב האר- (מאת שוחר תושיה) (סוף מגליון 29). ה. ולציון יאמר איש ואיש ילד בה תלים פ״ז). כתוב אחד אומר מגדיל ואחד מגדול א""ד יודין לפי שאין הגאולה של אומה זו באה בבת אחת אלא קימעא קימעא מדר״ר). מן האמור עד הנה יראה הקורא וידין להוציא משפט כי שקר אומרים אלה החפצים לרפאות שבר ארצנו על נקלה ועוד ה׳ לא צוה. ההצעה לכונן קולוניות בעד היהודים הוא בודאי דבר נשגב; כי גם אם נאמר שהעובדים והעמלים לא יראו עוד בטובה, בכל זאת ייטיבו מצב בניהם אחריהם ודור אחרון יקום ימצא את האדמה מתוקנת ומוכשרת לקבל שפע רב. אך להחליף בזה את רעיון עבודת האדמה לישראל ברוססיא היא טעות גמורה, ובזה לא צדקת בן יהודה, כי זה לחוד וזה לחוד ולא ראי זה כראי זה! מאמינים אנחנו בתקות ארץ ישראל לעתיד, כי אחרי בלותה תהי׳ לח עדנה וערבתה כגן ד׳, אך תקותנו מי ישורנה?... וברעיון עבודת האדמה ברוססיא מלבד הצלת נפשות רבות מעני וחסר מעולף עוד ענין נכבד כאמור: להסיר מעלינו דבת הסופרים הכותבים עלינו מרורות, והעיקר — להגיע לאט לאט להמתקת הדינים. ומה נועילה קורא יקר אם נשלח את היהודים לעבוד את האדמה בארץ הקדושה? — כידוע אין לה לחרשות אלא מה שעיניה רואות פה במדינה ולא נוכל להרחיק עדותנו. לא כן אם נכונן פה במדינה קולוניות אז תצא טובה כפולה ומכפלת. לא המדרש עיקר בענין הזה אלא הלמוד המביא לידי מעשה; וראוי הוא כי גם אלה המתאמצים לחקים סכר דוד הנופלת קודם זמנה וחפצים להצטרף למשל בקנית ארץ ישראל משום שרואים בזה תקות הגאולה"" יתנו ידים לעזו לכונן קולוניות במדינה, ולא נקפה שכר שיחה נאה מדברי פנחס ז״ל מקארעץ: כי כל גאולה מן צרות ורעות היא בבחינת גאולה העתידה (מדר׳ פנחס). יתר הדברים מניח אני לסופרים השלמים וטובים ממני לבוא עד חקר הדבר למען, נבוא לכלל דעה אחת ונוכל להיות כל איש מעירו לעזור בענין הנכבד הזה. גם אתה קוראי אל תקפץ ידך מדבר הזה עשה כל אשר ביכלתך לטובת הענין ושלום על ישראל."
