article_id,headline,text
044-MGD-1876-08-23-PG001-SINGLE-ORIGNAME_200283_toc_13,הצופהלהמגיד,"  גם אלה דברי ב״ג (המשך מגליון 32). הצופהלהמגיד ד' מדרש בראשית רבא פרשה ששית עושה שני משלים אחרים מחמה ולבנה, ללמד לאדם יראת אלקים. האחת הוא שלא יכנס אדם בגבול חבירו ולא יבקש מוחרות ויסתפק במה שחננו י""י והשנית היא שיתן האדם ל לבו שלא יקנא באדם הגדול ממנו כי אל אמונה ואין עול והוא שופט צדק וימלא חסרון הקטון מצד אחר וזה אשר כתוב במדרש. ויעש אלהים את שני המאורות הגדולים רבי יודן בשם רבי חום בר׳ הייא ורבי פנחס בשם רבי מימון אמר מאחר ש קורא אותן גדולים הוא חוזרו ם אותם את המאור הגדול פוגם לממשלת היום ואת המאור הקטוי לממשלת הלילה אלא על די שנכנס בתחומו של חבירו (ר״ל שהקב״ה העניש את הלבנה שקרא אותו בשם קטון מחמת שלא היה מסתפק בממשלתו המיוחדת לו ללילה ויתראה לפעמים גם ביום שהחמה מושלח אז ועם כל זה מבקש הקב״ה כפרה בעבור שפגם בכבוד הלבנה וקרא אותה בשם קטון ולא מחמת שהיתה הלבנה תחלה גדולה כחמה ואח״כ הקטין כמותה על דרך מליצת חכמי תלמוד בבלי בשבועות פרק ראשון: אמר רבי פנחס בכל הקרבנות כתיב שעיר עזים אחד חטאת ובראש חד נתיב שעיר עזים אחד חטאת לי""י אמר הקב״ה (הביאו כפרה עלי שמעטתי הירח המלות האלי אינם נמצאים במדרש כ״י בפארים) אני הוא שגרמתי לו להכנס בתחומו של חבירו ומה אם זה  שנכנס ברשות כך פגמו הכתוב הנכנס שלא ברשות על אחת כמה וכמה. והנה בעבור זה חטא הקטון כביכול שחטא הקב""ה שפגם בכבוד הלבנה וקרא אותה מאור קטון ציה להקריב שעיר חטאת בעבורו עוד לים חסרונה בכפלי כפלים וכאגב אמר זה במדרש אמר דבי אחא אלך שהיו לו שני אפיטרופים אחד שולט בעיר ואחד שולט מדינה אמר המלך הואיל ומיעט עצמו זה להיות שולט בעיר וור אני עליו בשעה שהוא יוצא תהא כל אוכלוסא יוצאה עמו ובשעה שיהא נכנס תהא בולי ודיו (Soul 2di O7kon( ום נכנסה עמו. ה׳) האדם היא בחיר מעשה בראשית ועליו נאמר ותחסרהו מעט מאלקים, אך הבדילו העושה מעשה בראשית, כי לא טוב היות אדם לבדו, ולא יכול לחיות לבדו בלי עזר כנגדו, כאשר יחיו הבהמות והחיות ולא יכול לחיות ראובן בלי שמעון ושמעון בלי לוי ולוי בלי יהודה וקין בלי הבל והבל בלי קין כי קין יהיה עובד אדמה והבל רועה צאן הבל יאכל מפרי האדמה אשר תוציא לקין וקין ילבש בגדי צמר אשר יגת הבל וישתה חלב צאנו ויאכל גם בשר צאנו, אך יצר לב אדם רע מנעוריו אשר אין יצר כמוהו לחיה ולבהמה כי לא יטרוף ארי את ארי אהיו ולא זאב לזאב רעהו כאשר עשה קין להבל אחיו כי בהיותם בשדה הרג קין להבל אחיו ויאמר בלבו אני אוכל פרי אדמתו לבדי וגם חלב צאני ובשרם אשת אוכל ועל זה אמרו המושלים, בלשון ארמי כזה כלבא שקל בשרא טבחא ועבר נהרא הזא טלני אתה וצל הבשר) לבשרא סני נא מן הוא דלבך שבק ורהט בתר ב ניתא וכדהפך כלבא  אשכח מדם לנפשיה אמר שפיר גדשן [טוב הוא אשר קרנין דכד לסני אתרגנית (תסקתי להרבה) אף הוא קליל דלביך הות אזל מנא אי גם המעט שהיה לי הלך ממלין וכזה קרה לקין הורג כי אמר י״י לקין (בראשית ד׳, י״ב) כי תעבד את האדמה לא חסף תח כחה לך נע ונד תהיה בארץ. אך במה ייטיב אדם את דרכו ואיך יעשה מיצר לבו הרע טוב ולמדו חכמי ישראל במשליהם ויאמרו אם יראה אבנים על הארץ וירמוס עליהם למוד מהם מיסד, וזה אשר ספרו מאבנים [חילין פרק גיד הנשה) כתיב ויקח מאבני המקום דכתיב ויקח את האבן אמר רבי יצחק מלמד שנתקבלו כל אותן אבנים למקום אחד וכל אחד ואחד אמר עלי יניח צדיק זה ראשו תנא וכלן נבלעו באחד. אנחנו רואים כי האבנים היה להם מחלוקת לשם שמים וכל אחד רצה להכנינ אורח הנכבד הזה ואין אחד מאנשי העיר הגדולה לוז עשה כמוהם, ויהי שכרם כי העושה מעשה בראשית עשה מהם אבן אחד גדול ויהי למופח ולאות לבני מרי שישובו מדרכם הרעה ולא יריבו זה עם זה אך לשם שמים כבית שמאי ובית הלל. מדברי מדרש בראשית רבא נראה והנתל) מה לכם מרתתים עץ מכם אל יכנס בו ואין אחד מכם ניזוק. ז') לא טוב היות אדם לבדו אם לא יהיה לו עזר כנגד ואם יהיה חכם כשלמה, וגבור כשמשון, כי חסרוניו רבים ומי ימלא חסרונו אם לא אדם אחר כדמותו וצלמו, ראובן יביא לתם לאוכל לשמעון אחיו ושמעון יבוא מים לראובן לשתות אך יצר לב אדם רע מנעוריו ובין אחים יחלוק ראובן ואמר אני הבאתי לחם רב מאשר הבאת אתה מים להרוות צמאוני ושמעון יאמר לראובן אם לא הבאתי לך מים לשתות היית מת בצמא, וכמהם, וכמהם דברי ריבות, עד כי תתפרד החבילה וילך איש איש לדרכו, ומה יהיה אחריתם ראובן ימות בצמא ושמעון יגוע ברעב, ובטרם ימותו יתודו על עונותם, ויאמרו אין שלום אמר י""י לרשעים. ח׳) וישאו חכמי ישראל במשל פיהם, ויאמרו לולב וערבה מ״ח]: הנהו תרי צדוקי חד שמיה ששון וחד שמיה שמחה לא היי ילא בראו אלא למשל היו) אמר ליה ששון לשמחה אנא עדיפנא ממך כתיב ישעיה ל״ב) ששון ושמחה ישיגו אמר ליה שמחה לששון אני עדיפנא ממך דכתיב (אסתר ח׳) שמחה וששון ליהודים אמר ליה ששון לשב תיך [כנ""ל בגמרא שם מ""א חה חד יומא שב נקא (י""ל אנשי הצבא לקחוהו יום אחד הנחתיך ללכת בלעדין ושויוך נ והכריחיהו להורות להם הדרך) דכתיב ישעיה נ״ח) כי בז מחה תצאו אמר ליה שמחה לששון חד יומא שבקתיך ומ  מיא דכתיב ושאבתם מים בששון.  (המשך יבא)"
044-MGD-1876-08-23-PG001-SINGLE-ORIGNAME_200283_toc_14,"הערה קצרה.
."," הערה קצרה. . ידידי הרב ר״י רייפמן כתב בהצופה (נו' 30) כדברים האלה: יחוש תרגום תורה לאונקלם הגר הוא אך עפ""י מאמר ר""ת ב""א: תרגים של תורה אונקלס הגד אמרו מפו ר״א וד״י (מגילה ג'), והנה המאיזר הזה הובא בירושלמי שם על עקילס הגר ועל תרגום יוני, ויש ספר איפוא על שני הנוסחאות ההם איזה מהם יוכשר הנוסח הבבלי או הנוסח הירושלמי, ולא יחכן לומר שניהם כאחד טובים, וכי היו שני מתרגמים לתורה, אונקלס בארמית ועקילם ביונית, הן רחוק במאוד מאוד להקרות שני מתרגמים שוים בשמות י(כי עקילם ואונקלס שיים מאוד זה לזה) ובנרות ובתרגמם מפי ר״א ור"" עכ״ד. והנה בעיני מאוד יפלא שעשה את עצמו כמתעלם ממה שהעלו החוקרים בימינו כי עקילם ואונקלם אחד הוא, ועקילם חרגם את החורה ביונית, ועפ״י תרגומו נתחבר אח״כ התרגום הארמי מלה במלה בלי שום הוספה, ונחיתם ג״כ על שמו, והשם אונקלם הוא עצמו שם עקילם, כי במבטא בני קדם נמשך אות נון אחר הברת אות עין; ראש וראשון של הדיעה הזאת היא הגאון שי״ר (ערך מילין ערך אתרוג וכרם חמד ה׳ ו׳ ע' 223 ובמכתבו בראש ס׳ הגיין הנפש ע' 43), ואחריו נמשך הרב בעל בקורת התלמוד (ערך אונקלס), לא כדעת הרב בעל מאור עינים (פ' ט׳ ומ״ה) ואחריו הרמבמ״ן (באור לנתיבה) והחכם רשד""ל (אוהב גו נחיב ל״ב) ששנים היו; וכל קורא מבין יתן הצדק לדברי שי""ר והנמשכים אחריו, וגם אנכי יש לי ראיות רבות ע״ז במחברתי אגרת בקורת סי׳ י״ג ואכ״מ. י. מ. צונץ. קראקא, בחודש אב תרל״ו."
044-MGD-1876-08-23-PG001-SINGLE-ORIGNAME_200283_toc_15,זאת ליהודה.," זאת ליהודה. כבוד החכם יהודה ליבוש אישלער המכונה: דר׳ יל״א „באמרי יהודה״ נהצופה לשנה עברה נומ' 27 החליט לדבר ברור ולמעלה מכל ספק דמה שאמרו במדרש רבה אמור: „ועוף השמים יוליך את הקול זה העורב וחכמת הטיירין"" משגגת המדפיסים נכחוב כך, יען כי הנוסחא העברית היא: „זה הערום בחכמת הטיירין"" והוכיח כן מצד שאלתו: „דמה נשתנה העורב הזה מכל שאר העופות שבאמר עליו דוקא שהוא וליך את הקול? - וכשאני לעצמי אומר זה גירסא הנכונה היא כמו שהוא לפנינו, ואעידה לי עדים נאמנים דבריהם ז""ל בכמה מקומות המדברים בסגולות העורב היודע עתידות, ומגיד לפעמים, האוחיות לאחור למבין בניב נאומו ושריקות שפתיו, וראה אמרם ז""ל (שבת דף ס״ז ע״ב) „האומר שעורב שרק ושעורבת שריקי והחזיר. לי זנביך לטיבה״ וכו׳ וע' עוד (סנהדרין ס״ה ע״ב) „מנחש עורב קורא לו מאחריו"" וע' במעשה דעילוש (גיטין מ״ה ע״ב) וע׳ בהכותב סוף מס׳ שבת. מכל אלה נראה ברור דאין לשבש הניסחא כמו שהיא לפנינו, ואין להוציא ישן מפני חדש במקום שרוח חכמים נוחה מן הישן כמו שהוא. — דובעריש בר""ן ירוחמזאהן. לאדוזין מחוז פאדאליען."
044-MGD-1876-08-23-PG001-SINGLE-ORIGNAME_200283_toc_16,הערה קטנה.," הערה קטנה. בסמאמר משא יהודי קרים בנומ' כ״ה בהמגיד ש״ז, כותב החכם אדי""ר באות יודז שם העלם ברכה וכו' יעידו כי קראי הוא, יען לא נמצא ברבנים שם עצם כזה וכו׳, נעלם ממנו כי בספר נחלת שבעה בשמות נטין לאנשים מובא בשם רש״ל: ברכה שם זה ניוצא לאיש ולאשה יעיי""ש, והמהרש""ל לא כתב מאומד הדעת, כי ספרא דווקנא הוא בענינים כאלה כמו שתראה מחשובתו בתשובות רמ""א סימן, ו..  המבשר לאנדויא."
044-MGD-1876-08-23-PG001-SINGLE-ORIGNAME_200283_toc_17,," הודעות. הודעה נכון אנכי לקבל בהפענזיאנאט שלי לנערי אחינו בני ישראל יושבי רוסס- לאנד ופאלען עוד נערים אחדים לגדלם ולחנכם בביתי ותחת השגחתי עצהיו״ט, כן לאלה המקשיבים לקח בלימודי חול בהגימנאזיום אשר בעיר מושבי, וכן להכינם לבית ספר מסחר, כרצון ההורים. זה שש עשרה שנה מעת יסדתי הפענזיאנאט שלי, ותודות לד׳ גם לולבים ירוקים ויבשים עם הדמים כשרים. הצליח חפצי בידי להפיק חפץ ההורים כיד ד׳ הטובה עלי בידיעת החנוך. רבים מהנערים שנתגדלו בביתי נהיו לאנשים המוצאים חן בעיני ד׳ ואדם. מהם סוחרים ומהם רופאים, נכבדים וישרים. בביתי מגודלים הם על ברכי דת קדשנו. כל השתדלותי לטעת בלבב הנערים האהבה לדת קדשנו ושמורת פקודיה ולטעת בקרבם כל מדה טובה אשר תפארת ובמהרה הנני לשרתם עצהיו״ט כאות נפשם. לה מן האדם. על לימודיהם, כן לימודי חול וכן הלימודים העברים תנ״ך, דקדוק גם תלמוד, וביחוד בידיעת שפת עברית, אשגיח בעין פקוחה, וכל צעדיהם אשמור. לרצון ההורים יכולים הנערים ללמוד רק בביתי גם שפת ארץ מולדתם, היא שפת רוססיא הנחוצה להם מאד בימים האלה ובזמן הזה, יען כי במקומנו רק אנכי לבדי יודע ומבין גם השפה, אויך אין דיזעס יאחר האבע איך איין לאגער ההיא. עפ״י הנסיון העומד לימיני אוכל לתת עצה לההורים החפצים לשלוח בניהם אלי שיפקידו בידי רק נערים מבני תשע או עשר עד י""ב שנים, כי אז על נקלה להטותם בדרך ישרה בדרך העולה בית-אל בכל ענין הנחוץ לאדם וליהודי נאמן לדתו ועמו. הזמן לקבלת הנערים בביתי הוא עד חודש מרחשון שנה הבע״ל. פרטי האופנים מוכן אנכי להודיע לכל שואל אשר יפנה אלי במכתבו: דוד גארדאן (עוזר להמו""ל המגיד). האדרעססע אלי בלע״ז: Literat D. Gordon, Mitarbeiter des „Hamagid Lyck in Freussen."
044-MGD-1876-08-23-PG001-SINGLE-ORIGNAME_200283_toc_18,,"  Berliner Ruaben-frzichungsanstalt. - בבית חנוך הנערים אשר לי יש עוד מקום לנערים אחדים. Habbiner Bbr. A. BErIicin, Director. Berlin W., Linkstrasse 23."
044-MGD-1876-08-23-PG001-SINGLE-ORIGNAME_200283_toc_19,," מודעה אכבדה בזה להודיע כי נמצאו בבית מסחרי במקה הזול כל מיני ספרי תורת וחכמת ישראל, סידורים, מחזורים, חומשים, נ״ך עם כל הפירושים, ש״ס ומפרשי הש״ס, שלחן ערוך שו״ת, ספרי מוסר וקבלה, ספרי חקירה וחכמה, ספרי השכלה ומליצה, ספר עברי דייטש וסיפורי מינשיות, וכן כל מיני ספרי אשכנז ופאלניש וספרי בתי הספר (שול ביכער), טליתים, טליתים קטנים, טירקישע טליתים, ציצית, תפילין, מזוזות כשרים, ובפרט ליעפערט פערצאללט אונד פראנקא נאך הכינותי על הנוראים והטובים הכע״ל כל מיני סידורים ומחזורים וסליחות עם פירושים ובאורים והעתקות אשכנז ועברי דייטש, בכריכות שונות ויפות מאוד במקח הזול, והנני מוכן למלאות רצון קוני על צד היותר טוב. A.Paust, Buchhandlng, Krakau, Galizien"
044-MGD-1876-08-23-PG001-SINGLE-ORIGNAME_200283_toc_20,," ברורול וררי קעטפאהרט- ריקאנישע פ האסור אכען דרולי-רולדולל   אקצי - געזעללשאפט. דירעקטע פאסט-דאמפפשיפפאהרט צווישען אונד  ד ע אדק זאמבורג האפרע אגלויפענד, פערמיטטעלסט דער פראכטפאללען דייטשען פאסט-דאמפפשיפפע: געללערט 23. אויגוסט. זועוויא 6. זעפטעמבער. וויאלאנד 20. זעפטעמבער. פאממעראניא 30. אויגוסט. לעססינג 13. זעפטעמבער פריזיא 27. זעפטעמבער. אונד ווייטער רעגעלמעססיג יעדען-מיטטוואך. פאססאגעפרייזע: 1. קאייטע 500, מארק. 11 קאייטע 300, מארק. צווישענדעקק 120 מארק. פיר דיא וועלטאויסשטעללונג אין פהילאדעלפיא ווערדען ביללעטס פיר דיא הין- אונד העררייזע אויסגעגעבען. נעהערע אויסקונפט וועגען פראכט אונד פאססזאגע ערטהיילט דער גענעראלל-בעפאללמעכטיגטע. m. Mer achig. B , פלאשע 3 מארק, יאמאיקא - רוס-עס- Admiralithitstrasse No. 33/34. Telegramm-Adresse: Bolten Hamburg J. S. Caro in Thorn. זאוויא דער קאנצעסס. אגענט"
044-MGD-1876-08-23-PG001-SINGLE-ORIGNAME_200283_toc_21,," פאבריק געגרינדעט 1862  פראנצעזישע מיהלשטיינע זויבער אין צעמענט געארבייאטעט אונד אונטער גאראנטיא פארציגליכסטער לייסטונג, פערנער שלעזישע זאנדשטיינע, ענגלישע גרויפשטיינע, קאטצענשטיינע, גוסשטאהל- פיקקען אונד וייאדענע מיהללערגאצע עמפפיהלט Hugo Strebel in Ragnit (Eisenbahnstation TIsit( Provinz Ostpreussen."
044-MGD-1876-08-23-PG001-SINGLE-ORIGNAME_200283_toc_22,," אחרונים כשרים ומובחרים מגנות פארגא עצמה עם הכשר מהרב דקארפו ומהרב דטריעסט גם אתרונים מקארזיקא עם חותם מהרבנים דשם וישנם אצלי גם בשנה הזאת למכור במקח השוה כבכל שנה ושנה, הקונים מהסביבות יודיעני ע״י מוקדם ממבוקשם ממינים הנ״ל P. Berlstein, Lemberg."
044-MGD-1876-08-23-PG001-SINGLE-ORIGNAME_200283_toc_23,," אתרונים לולבים פאן ארט אונד שטעללע קארזיקאנער קאליב- רעזער אתרונים לולבים ירקים אונד יבשים אונד עמפפעהלע צו בילליגסטען פרייזען. אויפר רעגע ערביטטע איך רעכט צייטיג קעניגסבערג, פרייסען, פארדערע פאר- שטאדט נו׳ 77 Aron Rosenkranz"
044-MGD-1876-08-23-PG001-SINGLE-ORIGNAME_200283_toc_24,, מודעה בפ׳ קרח נגגב בפה עירנו מבהמ״ד אחד שני ספרי תורות האחד חדש מחודש והשני ישן קצת מחירם עולה 600 רו״כ. לכן אבקש מימקוראי המגיד אשר יודע לו מהשוד הנורא ויכירם אם במקחם אם במכרם נא להודיע על אדרעסע הרשומה מטה ובטח לא יקופה שכרו. אדרעססע שלי: טשערקאס פלך קיוב אפריים ראכינאוויץ.
044-MGD-1876-08-23-PG001-SINGLE-ORIGNAME_200283_toc_25,," ויי וואללקראטצען, אייזען אונד מעססינגרראטהגעוועבע יעדער אייזענבאהנשטאטיאן אין רוססלאנד צו בילליגען פאבריקפרייזען. Paul Moritz Levinsohn in Königs- berg in Preusseu."
044-MGD-1876-08-23-PG001-SINGLE-ORIGNAME_200283_toc_26,," דיא דאמפף- זירופ פאבריק  פאן Diewel und Comp. in 1tiga עמפפיהלט אירע פאבריקאטע, אללער גאט- טונגען זירופ, האכפיינער אונד איינפאכער וואארע, צו זעהר מעססיגען פרייזען. פערזאנד אין שטארקען פעססערן פאן 10 בין 20 פוד."
044-MGD-1876-08-23-PG001-SINGLE-ORIGNAME_200283_toc_27,, המגיד משנים שעברו היקרים במציאות אמכור כל שנה שלימה מחיר 4 פל׳ וכן יש לאל ידי למלאות עלים החסרים לכל איש A. Paust Buchhandlung Krakau.
044-MGD-1876-08-23-PG001-SINGLE-ORIGNAME_200283_toc_28,," אונטערצייכנעטער אפפערירט: העמיש פרעפארירטע האלצקאהלען צוא ענטפוזעלן פאן שפיריטוס פרא ברוטטא-צענט- נער אינקלוזיווע פאסס 12 מארק, פערנער רוס-עססענץ פרא ליטער אינקלוזיווע סענץ 4 מארק, מאריענע-רוס-עס- סענץ 6 מארק, צוקער-קאולער פרא צענטנער 30 אונד 36 מארק, רום- קאולער 80% בלאנק פערבענד, פרא צענטנער 32 מארק, בעסטען דיסיעהריגען קירשזאפט בילליגסט. Julius Dumcke Königsberg in Freussen."
