article_id,headline,text
044-MGD-1882-08-30-PG001-SINGLE-ORIGNAME_260253_toc_15,ועד הקהלות במחוז אסט - פרייסען.," גם בזה הורה הנסיון כי לא אלמן ישראל בכל מקום מאנשים אוהבי עמם ודהם, רק הרוח המאחד והמקשר את הנפרדים חסר להם. עתה ע״י האסיפות יתבררו הדברים ויתלבנו, ויתעורר הרגש והאהבה אל היהדות ורוח הלאומי. — מטרת הועד היא: א) שימת עין על בתי הספר לילדי ישראל, הטבת דרכו הלמודים, האהבה להדת ושפת עברית. ב) הטבת מצב המורים אשר בודם מסורה ההצלחה הרוחנית של העם. ג) ליסד מקור מוצא לכסף לתמיכת המורים הזקנים בכלות כחם. ד) התיסדות בית ספר לחנוך מורים. אלה הם הענינים העקרים אשר קבל הועד עליו לשים להם את לבו לטובת העם. והנה מובן הדבר כי בזמן הקצר מעת הוסד הועד (זה רק שנתים ימים) ולפי האמצעים המונבלים אשר לעזרתו כרגע, מן הנמנע הי׳ לו להוציא כל הדברים הנזכרים לפעולת - אדם הדורשים זמן וכסף הרבה; בכל זאת יכולים אנחנו להחליט כי גם בזמן הקצר הזה רב טוב פעל ועשה הועד לשמחת לבנו, ויש תקוה כי אם כעת ראשיתו מצער, אחריתו ישגה אי״ה, יען הרב דר׳ באמבערנער שהנהו רוח החיה באופניו עושה כל אשר בכחו להגיע להמטרה שהציב לו, ודבר נכבד כזה לא בין לילה נעשה. כן ראוים לתהלה שנים עשר האנשים שנבחרו מן הועד לנהל כל עניניו, וביחוד העומד בראשם הסוחר הנכבד ה. עלעססער מעיר אינסטרבורג העושה מלאכתו באמונה ובאהבה רבה לעמו ודתו. בהאסיפה הנזכרת בעירנו נקבצו ובאו מלאכי שמונה עשרה קהלות ועוד חברים פרטים להועד. אחרי שנתן ראש הועד חשבון פרטי מכל פעולות הועד בשנה שעברה והגזבר הודיע מעניני ההכנסה וההוצאה של הועד, הודיע הרב דר׳ באמבערגער מדבר אסיפת-המורים מן מחוז הנ״ל שהיתה ג״כ ע״י השתדלותו בשנה זו בעיר קעניגסבערג. בדברים חוצבים להכות אש האהבה לדת ועם ישראל דבר על דבר תעודת אסיפות המורים שתהיינה מעת לעת, ומרב הטוב הצפון בהן לטובת החנוך בכלל והרמת כבוד המורים בפרט, נמנו וגמרו בעלי הועד על אדות ענינים שונים שהוצעו לפניהם מן הועד המיוחד ואנשים פרטים. כן נמנו וגמרו פה אחד לשנות סעיף אחד מן תקנות הועד, והוא הסעיף אשר על פיהו קבל עליו הועד להיות בתומכי חברת חברת „כל ישראל חברים בפא- רין"" בכל יכלתו. את הסעיף הזה הסירו מספר התקנות ונמנו וגמרו אשר הועד ישים כל מעינו רק על עניני הקהלות והחנוך פנימה, ולהתרחק מכל עניני פאליטיק וריב הכתות והאמונות. כן נמנו וגמרו להפקיד משגיחים שונים על עניני החנוך בכל בתי הספר, לשים עין על סדרי הלמוד ועל המורים אם עושים מלאכתם באמונה. בכלל נדברו בעלי הועד יחד על דבר ענינים שונים הנוגעים לסדרי הקהלות ובתי הספר ועניני היהדות בכלל. אח״כ נאספו כלם אל המשתה שנעשה בעבורם, ונפרדו אח״כ שמחים על פעולתם והשתדלותם לטובת הכלל. ואנחנו תפלה כי חפץ ד׳ יצליח בידי הנכבדים ההם המתעסקים בצרכי צבור באמונה, ויפעלו רב טוב לבני עמם כרצונם הטוב. ועד הקהלות במחוז אסט - פרייסען. ביום השמיני לירח זה (23 אויגוסט) היתה בעיר מושבנו ליק האספה הכוללת השנית של הועד לקהלות ישראל אשר בנוף פרייסען מזרחה. מן האספה הראשונה של הועד הנזכר שהיתה בשנה שעברה בעיר לעטצען הי׳ מדובר בהמגיד בעתה. מיסד הועד ומוציאו לפעולת - אדם הוא הרב החכם דר׳ באמבערנער, רב ומטיף בק""ק קעניגסבערג. בפעולתו הנכבדה הזו הסב הרב הנכבד הנ״ל רב טובה וברכה לבני עמו יושבי המחוז הנזכר, ועוד תגדל ותרבה התועלת לימים יבואו כאשר נקוה. הן אמנם נוסד זה שנים רבות ועד כולל לכל קהלות ישראל באשכנז, אשר איתן מושבו הי׳ לראשונה בעיר לייפציג. (ובשנה זו קבע ישיבתו בעיר ברלין הבירה) מפני זה הביט אז הועד הכולל, וגם רבים אחרים בעין בלתי-יפה על השתדלות הרב הנ״ל ליסד ועד חדש פרטי במחוז פרייסען מזרחה; אך בהמשך הזמן ראו ונכחו כלם לדעת כי השכיל לעשות בזה, ומלבד שלא יזיק הועד החדש אל הועד הכולל, עוד מועיל הרבה לבני עמנו במחוז הנ״ל בפרט. כחכם הרואה את הנולד, ידע הרב דר' באמבערגער כי מסיבת רחוק מקום מושב הועד הראשי קשה הוא אשר כל מלאכי הקהלות ואנשיה הפרטים יוכלו להתאחד כפעם בפעם לדבר ולהמתיק סוד ע״ד עניני הקהלות, כאשר הורה הנסיון. מלבד זה ראה הרב כי ביהוד חסר בכלל בקרב אחב״י יושבי המחוז הנ״ל רוח ורגש היהדות באופן כזה אשר ביחוס היהדות היו רגילים בני עמנו החרדים לדבר ד׳ לקרא את המחוז הנ""ל בשם: „ערות הארץ״. לדבר זה שם הרב את לבו לתקן המעות כפי יכלתו, וגם הצליח חפצו בידו למצא הדרך הישרה להגיע במשך הזמן למטרת הנכבדה הזו, והוא הועד לשלוחי הקהלות אשר ידיו יסדו אותו. *) אך לא לפי המעשה כאשר יראו הקוראים הלאה במאמרנו. משה קליין."
044-MGD-1882-08-30-PG001-SINGLE-ORIGNAME_260253_toc_16,חדשות בישראל.," חדשות בישראל. (צוררי ישראל בבערלין) בהאסיפה האחרונה להאנטיזעמיטים בבערלין ביום העשרים לירח זה, היה ראש המדברים בה דר׳ הענריצי הנודע, כדרכו תמיד. אחרי שחרפו וגדפו מערכות ישראל, ככל העולה על רוחם באין מפריע, ואחרי שהבטיח הענריצי להנאספים כי לא יחשה עד אשר כלה גרש יגרשו היהודים מאשכנז, נמנו הנאספים פה אחד להערך מכתב בקשה אל שרי המלוכה לתת צו לכל הפקידים בממלכה שלא להדפיס הודעות הממשלה בכתבי העתים המדברים טוב על היהודים, רק להמציא השכו הזה לכה״ע שונאי ישראל. (ערבי-ביי והיהודים) מעיר קאהירא, בירת מצרים, מודיעים, ני הרב מוהר״ר ישראל יום טוב, אבד״ק הגל דבר עם ערבי בי ע״ד בני עמו יושבי העיר. השר ענה לו כי נכון הוא להגין על אחיו היהודים בכל כחו וגם במסירת נפשו. — כאשר באו היהודים העניים ילידי רוסיא היושבים שם אל ערבי והודיעו לו כי קצרה ודם לעזוב את העיר והארץ ומוכרחים לשאר בעיר, נתן להם 780 פר׳ גם צוה לנהלם בלחם כל ימי היותם בעיר. (היהודים בעיר מיהאלי) מעיר מיהאלי מחוז עדענבורג באונ- גארן מודיעים לאמר: זה ארבעה עשר יום אשר נסבול בזה הרבה רעה מן צוררי ישראל. בראשונה הסתפקו לשבור את חלונות ביהכ״נ שלנו, אבל היום בלילה שברו גם את חלונות כל בתי ישראל בעיר, והיינו שרוים בסכנה גדולה. גם בהמקומות קאפו- ואר, ב״ס מיקלאש וזיראק פרצה השנאה באופן גדול. מן המקום הנזכר אחרונה ברחו כל היהודים על נפשם. — כרגע עומדים בעירנו אנשי חיל, אבל כפי הנשמע ילכו להם להמערכה, ומפני זה גדול הפחד מאד בקרבנו מגורלנו אחרי שיעזבו אנשי הצבא את העיר. — (גולי אמעריקא). מקראקויא מודיעים כי במקומות הרבה בגא- ליציען, וגם בעיר קראקויא תופשים השוטרים את היהודים האומללים השבים מאמעריקא וישימום בבתי האסורים. לבקשת הועד בעיר ברעסלויא פנה הועד בקראקויא בבקשה אל הממשלה שלא תושיב במאסר לכהפ""ה את האומללים שיש להם תעודה מן הועד בברעסלויא כי הם מהגולים חשבים מאמעריקא. (גולי מצרים) רבים מאחב״י שנמלטו מאלכסנדריא של מצרים וערים אחרות, באו לעיר ליוותנו באיטאליען בחסר כל, והממשלה תכלכלם ותמלא מחסוריהם. גם למאלטא ולאנדאן באו הרבה מהאומללים אשר אחינו שם דואגים להם. בעיר טאנטא במצרים עשו התושבים הרג רב בנוצרים ויהודים היושבים שם. מספר גדול מהאומללים הובאו יחד אל רחוב העיר הגדול; ואחרי אשר ענו הפראים את הנשים והבתולות, הרגו טבחו והתכו לחתיכות ממש את כל האומללים לא היו כל נשמה. (נשואי תערובות). מכה״ע Jud. Presse מודיע: בעיר ברלין ארש לו סוחר נוצרי בתולה עברית. בכתב האדירשרות נ סעיף אחד אשר על פיהו מחויב צד העובר לתת לצד המקיים סך תשעים אלפים מארק, ר״ל הצד אשר יבטל את ההתקשרות. הבתולה באהבתה להמארש ובחפצה לעשות לו נחת רוח, עזכה את אמונתה ותקבל עליה את אמונת אוהבה היא האמונה הקא- טאלית. בין בה וכה מצא האיש אחרת נאה הימנה, והחיר את הקשר יען עפ״י החוק תמורת האמונה היא סיבה לבטול התנאים. מפני כי קבלה עליה אמונה אחרת אף כי אמונתו היא, ע״כ יכול להתיר האגודה. כן הביאה במשפט לשלם לו הסך הנ״ל, ויצא זכאי בדינו. הבתולה אבדה אמונתה, אבדה את כספה וגם אבדה את אוהבה. (חברת ביל״ו). הרי״ב, אחד מראשי האגודה „ביל״ו"" מודיע לנו מעיר יפו, כי בירח תמוז באה ליפה המחלקה הראשונה מהחברה הנ״ל ליפו, והם עשרים אנשים, שמטרתה להתישב באה״ק לעבודת האדמה, ובקרוב יתאספו כל יתר החברים. הועד הראשי עודנו בקאנסטנטינאפל יען יש לו דברים עם הממשלה שהבטיחה לתת להחבורה אדמה בחנם. בין כה וכה מחנכים החברים עצמם בעבודת האדמה בהאחוזה „מקוה ישראל"" אשר לחברת כי״ח."
044-MGD-1882-08-30-PG001-SINGLE-ORIGNAME_260253_toc_17,לישוב ארץ ישראל.," לישוב ארץ ישראל. מכה״ע Jew. Chron. מודיע בגליונו האחרון לאמר: החברה שנוסדה בעירנו להושיב את בני ישראל על אדמת אבותם  בסוריא, ואשר השר שעפטסבורי Barl of Schaftsbury עומד בראשה אספה כסף בימים האלה די להושיב קולוניא קטנה. בצפון סוריא קנתה אדמה טובה ופוריה בקרבת חוף הים התכון, וביום השני לשבוע תשלח ארבעים וחמש משפחות מב״י גולי רוסיא להושיבן על האדמה שם. כל בעלי המשפחות הם מאלה השדודים בנגב רוסיא. אחרי עמל גדול הצליח להאומללים לבא הנה ללאנדאן אחד אחד, בתקותם למצא בזה עזר ותשועה מן אחיהם בזה, אבל תקותם עלתה בתהו ותאבד. ראשי הועד לתמיכת גולי רוססיא אשר בהמענשאנהויז לא חפצו לתמכם לסעדם, מפני כי לא נמצא אף אחד מן האומללים שרצה ללכת לאמעריקא רק לארץ אבותם עינם ולבם כל הימים. — מאה משפחות כאלו נמצאו בלאנדאן ואין אחת שחפצה ללכת לאמעריקא. ויהמולו שרי הנוצרים עליהם וייסדו חברה למצא משען כסף להושיבם בסוריא. מן מאה המשפחות בחרו לע״ע ארבעים וחמש לעשות בהן ההתחלה להישוב. — רובם מן הנבחרים הם יודעי עבודת האדמה, אבל כן נמצאים בתוכם בעלי מלאכה שונים עד״מ: בוני בתים, חרשי עצים ובעלי מלאכות אחרות הנחוצים בכל מקום מושב וקבוץ בני אדם. החבורה עשתה תקנות המושב כדרוש להחפץ, וכלן נתקבלו באהבה מן הגילים. החבורה תבנה בעד הקולוניא ביהכ״נ, בית מטבחיים, בית המרחץ וכל ענינים האחרים הדרושים לחפצם. ואחרי אשר הוכן הכל למסעם ערכו האומללים בקשתם אל השר הנזכר, לקנות להם טרם צאתם גם ספר תורה הנחוץ ג״כ לכל עדה, ואין ידם משגת לקנות להם. השר הנכבד ההוא בנפש חפצה נדרש גם לבקשתם זו, וקנה להם ס״ת מהודר מאד, והגבירה העדינה האלמנה פין, אחת מראשי החבורה הגישה להם את התשורה היקרה ההיא, בשם החבורה. ראשי הקולוניא הנ״ל נאספו בהיכל הכבודה ההיא ביום הרביעי לשבוע זה, ואחד מהם היודע לקרות בתורת ד׳ קרא פרשה אחת מענינא דיומא, ואח״כ מסרה הכבודה את סה״ת ליד הרב והזקן שבחבורה, אשר קבל אותו בעינים זולגות דמע. —הנאספים כלם הורידו דמעות שמחה, ויברכו ויודו למטיביהם בדברים נמרצים וילכו להם. רבים מהם בכו משמחה כאשר דברו מתקותם שתדרוך כף רגלם בקרוב על אדמת ארץ אבותיהם. כלם הגישו ברכתם מעומק לבם אל הנוצרים אשר בטובם וחסדם חמלו עליהם יושיעום בעת צרתם"" עכ״ל. — כזאת מודיע בקצרה מכה״ע הנזכר. גם סופרנו בלאנדאן הודיע לנו מזה בארוכה מפרטי הדבר, וגם התקנות שנעשו בעד המושב, ונביא דבריו אי״ח גליון הבא. לדבר הזה שמח לבנו וגם התעצבה רוחנו גם חד. נשמה לראות כי נמצאים בין הנוצרים אנשי חסד נדיבי לב יקירי רוח אוהבי ישראל וארץ אבותם, המתחרים להשיב כנים לגמולם, כאשר חזו לנו נביאינו מראש. לעומת זה יתעצב לבנו לראות איך גדולי עמנו עומדים מנגד להענין הגדול והקדוש הזה אשר אליו עיני ולבות רבבות אלפי ישראל בכל ארצות פזורם. מי לא ידע כי השרים הנוצרים שעומדים בראש הועד הגדול בלאנדאן היו עושים ברצון כל אשר היו חפצים אחינו הגדולים חבריהם; אבל מאה המשפחות שלא חפצו ללכת לאמעריקא, נענשו קשה על חפצם הקדוש ללכת לאה״ק, ולא חפצו לתמכם. רק שרים נוצרים אחדים חמלו על האומללום וימלאו רצונם! — ומה הועילו גדולי אחינו אלה בשלחם את הגולים לאמעריקא? הן לא נוכל גם אנחנו לשים אשם נפשם על כי לא שלחו את כל הגולים לאה״ק. דבר זה מן הנמנע הי' בעת הבהלה והמרוצה. אבל מן הרבה האלפים ששלחו המדברה מעבר לים הלא יכלו לבחור אחדים מתי מספר מוכשרים להתישב באה״ק. גם זה לא עשו משנאתם לאה״ק! ד' הטור יכפר עונם ונסלח להם. — לפי הנראה כלימה תכסה פניהם בראותם עתה מעשה הנוצרים. — על זה יעידו דברי מכה״ע  אשר רוח גדולינו בלאנדאן דובר בו. — תחת להודות להנוצרים על כי יגדילו לעשות עם האובדים, מתאמץ לחשדם במה שאין בם באמרו כי אולי כונתם להעבידם מדתם! הכל הבלים! — על זה יעיד הסעיף הכ״א מתקנות המושב האומר: „שלוחי המסיתים אסורים לשבת בקרב הקולוני א״. יש תקוה כי כאשר תצליח אי״ה הקולוניא הקטנה הזו הראשונה כאשר נקוה, אז ייסדו השרים הנוצרים עוד קולניות אחדות על יד על יד, ושונאי ציון יראו ויבושו, ואז אולי ישובו גם הם מדרכם ויאירו פניהם להדבר הגדול הזה. להסופרים הנכבדים אשר שלחו לנו מאמריהם בדבר השאלה אשר יתעסקו בה כעת רבים מנכבדי סופרינו, והיא: על אדות התקונים בדת ביחוסם אל שיבת ציון, נשיב בזה, ונבקשם כי יסלחו לנו אם לא נתן מקום לשקלא וטריא כזו בהמגיד. לפי דעתנו אין בזה כל תועלת, ותחת לתקן עוד נקלקל אם נתחיל לדבר עתה מזה. למותר הוא לדבר מן הרובים אם אין עוד יער. למה נהי׳ כחולמים? נצא מעולם הדמיון לעולם העשיה. לא המדרש הוא העיקר אלא המעשה! ינעם לנו לראות חמשה בתי אבות יושבים על אדמת אה״ק וממלאים ידיהם בעבודת אדמתם מאלף פלפולים בתקוני הדת. התקונים הנחוצים היו נעשים מאליהם בעת שיהיו מושבות. הפלפול בזה כעת הוא בנין באויו יהי׳ איך שיהי׳. עכ״פ ישמח לבנו לראות כי נעשתה התחלה בישוב א״י, ואף אם היא קטנה כרגע, נקוה לד׳ צור ישראל כי תשגא באחריתה בסור כל המכשולים. עתה נוסדו שלשה מושבות לאחינו ב״י. האחד ע״י הועד ברומעניען; השני לחברת „ראשון לציון"" ע״י החרז""ד לעוואנטין, והשלישי עתה ע""י השרים בלאנדאן. שנים הראשונים הם באה״ק, והשלישי בצפון סוריא. כל זה נעשה למרות כל המכשולים והמפריעים. ואיזה כאשר יוסדו המעקשים, אז יגדל הענין ויתרחב ביתר שאת ועז, אם רק לא נואש אנחנו בעצמנו, ולא ננוס מן המערכה כמוני לב. — מדי דברנו על אדות המושב „ראשון לציון"" שנוסד ע״י ה. לעוואנטין בקרבת יפו, עצור לא נוכל מלהעיר דברים. אחדים בזה. בזמן האחרון נמצאו אנשים שהחלו להוציא רבה על ה. לעוואנטין ולחבאיש ריחו ולהשרחו במה שאין בו. אחרי החקירה והדרישה בזה נודע לנו ברור כי רק שקר טפלו עליו שונאיו תחת רדפו טוב; ונהפוך הוא כי ראוי, הוא לתהלה ולברכה על השתדלותו הנמרצה במשך ירחים הרבה, אשר עמל ויגע בלי הרף לטובת הענין הגדול, ות״ל חפצו הצליח בידו ליסד המושב הראשון; ואנחנו תפלה כי יצליח בדרכו להיות למופת לאחרים ממנו יראו וכן יעשו. כן נבקש מכל אוהבי שערי ציון לתמוך את ששת המשפחות העניות אשר הוקצה להן מקים בהמושב ראשון לציון אך יחסיו להם הענינים האחרים, ונכונים אנחנו לקבל נדבות נדיבי לב למטרה זו. — בדבר הטעלעגראם שחבאנו בגליון שבוע העבר מנאלאטץ. הודיעו לנו כעת מן הועד הראשי, כי אלה ב׳ מאות ועשרים ושמונה האנשים שנשלחו לאה״ק, אינם ממאינעשט לבד רק חם ממקומות שונים ששלח הועד הראשי על חשבונו. הועד מחכה רק על ההודעה כי הגיעו למחוז חפצם בשלום ובמישור באין מפריע ולקחו להם את אדמתם לאחוזה ואז ישלח את האורחה השנית. — העולים קבלו כתבי-מסע מן הקאנזול למלכות תוגרמה היושב בנאלאטץ. מכל זה נראה כי אין ממש בהאיסור, יען אז לא היה הקאנזול התוגרמי נותן להם כתבי מסע. ימים יבואו יפיצו אור על תעלומות דבר האיסור; עכ״פ רואים אנחנו כי האיסור לא יפריע את הדבר — זה המקום להעיר כי לא היתה כונת הרב פרומקין ני׳ בהמגיד גליון 32 כי אחינו ב״י ברומענין ישלחו נדבותיהם לישוב א״י לבערלין והאלבערשטאדט. דבר כזה לא יעלה על לב. אחינו ברומעניען יש להם על מי לסמוך בארצם; וכאשר עד היום לא דרשו עזרת אחרים להענין הנשגב ההוא (וזה תהלתם ותפארתם!) כן אין להם כל סיבה לשלוח נדבותיהם מחוץ למדינתם וד״ל.."
044-MGD-1882-08-30-PG001-SINGLE-ORIGNAME_260253_toc_18,," אתרוני מאראקא. באתי להודיע לאחי בני עמי הקרובים והרחוקים כי יש בידי אתרוגי מאראקא מהמקור הראשון הנשלחים אלי מהגביר הר׳ משה קורקום ני' אשר הרב דק""ק מוגאדור נותן תעודתו *) רק לו לבדו ומעיד על הכשרם. והמה באים אלי חבושים בארגזים, ובכל א׳ וא׳ מחמשה ועשרים עד חמשים אתרונים לא פחות ולא יותר, ונכון אני להוזיל המחיר ככל אשר תמצא ידי, והחפצים לקנות ממני ימהרו להודיעני וישלחו כסף מחירם, ואמלא שאלתם בלי אחור. לאנדאן, חמשה עשר באב, תרמ״ב לפ""ק האדרעססע שלי: Mr. M. Lewvy, Chre of fer J. J. Hirschbein, 8 Scarborougb. St. Goodmanstelds London, E."
044-MGD-1882-08-30-PG001-SINGLE-ORIGNAME_260253_toc_19,," *) וזאת התעודה: בעה״י, דא תהי למיקם לראי׳ ולזכות ביד החכם הגביר כהר׳ משה קורקים נר""ו אשר זה כמה שנים מתעסק במסחר אחרונים כל מצוה הבאים מכפר אשאט אשר הם בחזקת כשרות כידוע. וכהר׳ משה הנז׳ מוחזק בכשרות ואיהו גופי׳ צורבא מרבנן וזריז ובקי בבדיקה האחרונים וכל אשר שולח מכאן לכל ערי אייראפא אינגלאטיררא וכל ערי אשכנז וכו׳ הם בחזקת כברות ולראי׳ בידו וביד חביריו המקבלים, כחבתי וחתמתי במי פה מוגאדור בח׳ תמוז תרמ״ב לפ""ק. יוסף אלמא יח. H"
044-MGD-1882-08-30-PG001-SINGLE-ORIGNAME_260253_toc_20,הורעדה., הורעדה.
