article_id,headline,text
044-MGD-1876-08-23-PG001-SINGLE-ORIGNAME_200283_toc_9, רוסלאנד," לנו בספרו הנורא ס׳ יד החזקה כי מנהג זה הוא מנהג קדום בספרד וז״ל הטהור בפרק י״א מהלכות תפלה דין ה׳ „ונוהנין כל ישראל בספרד ובמערב בשנער ובארץ הצבי להדליק עשישיות בביהכנ״ס ולהציע בקרקען מחצלאות כדי לישב עליהן ובערי אדום יושבים בה על הכסאות״ עכ״ל הזהב. והעיני בשר לו עיניו תחזינה משרים כי רוח הקדש הופיע בבית מדרשו לחרות דברים אלו על ספרו אשר איננו רק לפסק דין, ומה לו להודיע מנהג המקומות בענין זה, אם לא להודיע לדור אחרון שלא יוציאו לעז על הנוהגים כה וכה כי מנהגי אבותיהם בידם, ב) אשר אין להם לשון יהודית לעצמם, הנה נמצא כמו כן עיירות גדולות אשר אין להישראלים בני אותה העיר לשון לעצמם רק לשון האומה אשר יסתופפו בצל קורתם, הלא המה צרים ואכסנדריאה של מצרים (היא נא אמון) בירוט, דמשק הנקר׳ שאם, ארם צובה הנק׳ חאליב, ואנפיהן אשר היהודים שם מדברים רק בלשון ערבי כלשון הגוים ששוכנים ביניהם ואין להם לשון יהודית לעצמם, וגם באה״ק לולא נפוצו שם מבני הגולה המדברים בלשון אישפאניאל, היו גם הם מדברים בלשון ערבי, ולכן אין מזה שום מופת כלל כמובן. (המשך יבא).  רוסלאנד משא יהודי קרים (קרימצאקים) בקראסובאזאר (מאת אפרים דיינארד המכונה אדי״ר). (המשך מגליון 25). א) אשר היה המנהג לשבת על הארץ בבית התפלה אין מזה שום מופת כלל, כי הדבר ידוע כי כן הוה ורגיל אצל הספרדים במלכות תוגרמה אשר גם עירות אלו (ר""ל ערי קרים היו תחת ממשלתו מאז, ואני מבני ציון עיר הקדש ירושלים תוב״בא היא עיר מולדתי ובה נתגדלתי וראיתי שם כמה בתי תפלה אצלינו הספרדים מתנהגים כן ומתוכם קהל חסידים אשר מתפללים שם בעלי הקבלה החסידים הספרדים ונקרא בשם ביהכנ״ס בית אל, שם יושבים בבית התפלה על הארץ ע״ג ברים וכסתות כאשר היה המנהג אצל הקרימצאקים (לדעת אבן רשוף), ואינני מוכרח עוד לכתוב משאר עירות גדולות אשר ראו עיני ואשר באזנינו שמענו, כי די לי בעדות ברורה מאשר נמצא על ארצנו ונחלת אבותינו ציון הוא עיה״ק ירושלים תוכב״א, והחלק יעיד על הכלל כלו שכן מנהג פשוט בבני ספרדים שבערי תוגרמה, וההבדל שבין בני ספרד לב״מ הוא כבימה אשר באמצע ביהכנ״ס כי אצל בני מקרא אין בימה ואצל הרבנים יש בימה באמצע בכל בתי כנסיותיהם, וכן היה המנהג אצל הקרימצאקים אף בזמן שהיה המנהג לישב על הארץ ולא היה שום זמן בהכנ״ס בלי בימה באמצע כאשר העידו לפני סבי דאזלי אתיגרא המופלגים בזקנה מהחכם החוקר הנ״ל, ואינני מוכרח להמציא טעם על מה ועל מה נהגו נן בבית התפלה כי זה ידוע כי כך הוא מושב הספרדים בערי תוגרמה, גם בבתיהם ואולי בעת התפלה תכון יותר הוראת קצת הכנעה ושפלות. בואו ונחזיק טובה להנשר הגדול ראש המדברים גדול אדונינו רבינו משה בר מיימון ז״ל כי הסיר חרפה סתם פי מקטרגים. אף הוא ביטל את המעוררין באשר הודיע"
044-MGD-1876-08-23-PG001-SINGLE-ORIGNAME_200283_toc_10,טירקייא.," טירקייא. נסיעה אל חרבות בכל ומגדל דור ההפלגה מאת יעקב אבערמייער יליד בייערן המתגורר בבגדאד. (בגדאד המשך מגליון 30). ונקים מאבי גריב ואפגע בהוד הפרינץ לנסוע מעט לאורך נהר מלכא אשר לפנינו ותקותי אולי אמצא דבר הנוגע לקדמוניות היהודים. ונסע כשלש שעות על צד שרידי הנהר המפורסם הזה ועל עבריו מזה ומזה הרבה גלי חרבות ולבנים מגוללים כה וכה אך מכל זה לא השגנו דבר שוה ונאה לדרישתנו. ונחזור ונפן דרומה ונלך כמה שעות עד כי באה השמש ונט את אהלינו בתוך מדבר שממה ונחנו מעמל דרכינו. ונקום למחרתו לנסוע עוד דרומה אל מטרת חפצנו וכמעט לא שבתנו כל היום עדי הגענו לפנות ערב אל מסילת מים היוצאת מפרת ונקראת „מחאוויל"" ומצאנו נחת כי לא רחוק מפה מתחילות חרבות בכל מטרת נסיעתנו. וגלין על יד חוף נהר מחאוויל וערבה שם שנתנו ויהי אך עלו מפני המזרח נצי החמה עברנו נהר מחאוויל ונלך הלאה דרומה והנה כל הככר ההוא שנה מראהו מכל הככרות אשר עברנו עליהם עד כה. שרידי תעלות וצינורות אין מספר אשר חפרו הראשונים ועתה נהיו לחרבוה עוברים לפנינו אל כל עברים. בכל מקום אשר שם בת עינינו צופי׳ והנה תלים וגלים שרידי החרבות. גם נהר פרת אשר על צדינו נראה לנו כמשונה ממעשה בראשית כאלו בני אדם חפרו מסילתו והגביהו על שני עבריו מסגרות (דעממע) למנוע השטף. 1) הכל לפנינו מודיע קרבת עיר גדולה או שרידי חרבותיה. ונבא אל כפר הנקרא אבן נאיב וילדים רבים מתוכו רצו לקראתנו וקראו אלינו „אללה יעטיכום אלקוה"" (השם יתן כח לכם) ואחרי כי ידענו כי שרידי הרבות בכל מאד קרובים לפנינו לקחנו מאותו המקום שני אנשים מורי הדרך. ונעבור בתוך איזה גני עצי תמרים אשר מאחורי הכפר ההוא ואך יצאנו מתוך סכסוך העצים ראינו לפנינו במרחק כשעה אחת גבעה גבוהה ותלולה ויקראו אלינו מורי הדרך „האדי באבל אלמנכלבה״. (זאת היא בכל הנהפכה). זאת היא שארית עיר בבל, קראתי אל נפשי! העיר העליזה תפארת גאון כשדים המחרבת ארצות המחוללת ממלכות; העיר העתיקה אשר האריכה ימים בהדר ותפארת יותר מכל העירות בתבל. זה יותר מארבעת אלפים שנה יסדה נמרוד גבור ציד, ואחרי אלפים שנה להוסדה התגאה עוד בתוכה נבוכדנצר מלכה ואמר הלא דא היא בכל רבתא די אנה בניתה לבית מלכו בתקף חסני וליקר חדרי. זה יותר מאלפים שנה היתה בכל לגלים מעון תנים שמה ושריקה מאין יושבי כי ה׳ שלם לבת בבל את גמולה אשר גמלה לעם עקב. ברוך שהחריב בכל הרשעה! — אמר הכותב. סופרי יון בהעראראט ודיאדארוס וסטראבא ועוד 1) פרק הרואה דף נ""ט הרואה פרח אגשרה רבבל אומר ברוך עושה בראשית ואידנא דשניוה פרסאי מבי שבור (אולי פרוזשבור) ולעיל 288 אחרים יציירו לנו פאר וגדולת עיר בכל בימי קדם, ודבריהם מועתקים בספרי דברי הימים ללשונות החיות והרוצה לדעת יראה משם ואנוכי לא באתי פה אלא להגיד מה שראיתי משרידי הרבות העיר העתיקה הזאת. במהלך שעה בצפון לעיר היללה יש שם על יד חוף השמאלי של נהר פרת כברת ארץ באורך שעה וחצי ועליו תלי חרבות וגלים נצים עם בצעי חומות ושאר בנינים, ונקרא המקום מאת הערביים „ארץ אלבאבל"" ואלו הן שרידי החרבות אשר זכרו רז״ל במסכת ברכות דף נ״ז וז״ל: הרואה בכל הרשעה צריך לברך חמש ברכות ראה בבל אומר ברוך שהחריב בכל הרשעה וכו׳ וכן זכרם ר׳ בנימין בן (?) טלדלה בספר מסעותיו וז״ל: ומשם (גאה יאגן) יום לבבל הוא בכל הקדומה החרבה והיא במהלך שלושים מילין ברחובותיה, עד כאן. וגם חדרו לשם בזמן האחרון הזה חוקרים אחדים ומצאו כתבות כשדיים על לבנים ושאר אבנים וכולן מראין ברור כי של בבל הן, ואמנם נבוכו הנוסעים להכיר שרידי החרבות האל איזה מהבנינים אשר בא זכרם בכתבי היונים הם. זה אומר בכה וזה בכה ואין צד שוה בהם. והנה אזכיר לך קורא יקר אחת לאחת שרידי החרבות אשר ראיתי. (המשך יבא)"
044-MGD-1876-08-23-PG001-SINGLE-ORIGNAME_200283_toc_11," ידיעות אחרונות ממקום המלחמה.
לפי הידיעה האחרונה מהמלחמה בזערביען, נראה כי אנשי","  ידיעות אחרונות ממקום המלחמה. לפי הידיעה האחרונה מהמלחמה בזערביען, נראה כי אנשי חיל גדוד אחד מצבאות זערביען קדמו את האויב ויתבצרו בעיר מילאנאוויץ על גבול נהר הדאגויא למזרח עיר בעלגראד. מפני זה נוסדה הודעת תוגרמה על שקר בהודיעה לפני שמונת ימים כי צבאותיה לכדו את העיר ההיא. כן מודיעים כי גדודי המורדים בבאסניען צרים כעת על המבצר באניאלוקה שם ללכדה. בכל יתר מקומות המלחמה בזערביען עד היום יד התוגרמים על העליונה, וחודרים הם בעם כבד ויד חזקה לעומת עמקי נהר מאראווא ששם נסגו כל חיל זערביען אחור והנה במדה אשר פנתה ההצלחה עורף אל זערביען במלחמה הזו, כן תאיר פניה אל מאנטענעגרא אשר תמיד יד צבאותיה רוממה על אויביהם אשר לא יוכלו לעמוד בפניהם. אחרי שהוכו צבאות תוגרמה מכה נצחת תחת פקודת שר צבאם מוקטהאר פחה בין טרעביניע ובילעק, ואשר על ידי זה נאלץ להמלט עם שרידי חילו אל המבצר טרעביניע ולהסגר שם, ומושל מאנטענעגרא סוגר עליו הדרך העולה מאסטארה שלא יבא עזרו משם, חתרו עשרים אלפים מחיל התוגר לפול בגבול מאנטענעגרא מצפון מדינת אלבאניען, תחת פקודת שר צבאם מחמוד פחה. מושל מאנטענעגרא העמיד על הגבול ההוא, כי פאדגאריצא ופונדינא חמשת אלפים איש מחילו לעמוד שם על המשמר ביום החמשה עשר לירח ההוא פרץ שר הצבא מחמוד הנ״ל בראש כל חילו מעיר פארגאריצא על הדרך העולה מעדונא ויחפוץ לפרוץ דרך שם בגבול מאנטענעגרא וללכוד את צעטיגיע עיר הבירה. בין פונדינא ופאדגאריצא פגע בחיל מאנטענעגרא במספר חמשת אלפים, ויסתער עליהם, והם מיהרו לסגת אחור והאויב אחריהם המאנטענעגרים נסגו אחור רק למראית עין, ומטרתם היתה לטמון פחים לרגליו, יען נסגו אחור על הגבעות הגבהות והרודפים חתרו אחריהם בתוך העמק. אז נהפכו פתאום הנרדפים לרודפים ויסובו את חיל התוגר מכל צד ולא היה למו דרך לנטות ימין ושמאל. המלחמה היתה נוראה, ומכל צבאות התוגר לא נשארו רק לערך שמונת אלפים איש שהצליח למו להמלט מתוך ההפכה, ויתר החיל נהרגו ונשבו ונפצעו. כל הכבודה נפלה בידי המאנטענעגרים, כל כלי הקרב וכל צרכי אוכל נפש וכל דגלי האויבים. — כן מודיעים עתה כי מושל מאנטענעגרא פנה עתה בראש חילו לעומת גאקטווארפאליע לצפון טרעביניע, בהיותה הנקודה התכונה שמשם יוכל לסגור הדרך בעד צבאות תוגרמה שינסו לבא לעזרת מוקטהאר פחה הסגור בטרעביניע. הנצחון החדש הנ״ל של מאנטענעגרא חזק את לב מושל זערביען וגמר בדעתו שלא להניח עוד החרב מידו. מלאך מאנטענענרא היושב בחצר מושל זערכיען הודיע עתה ברבים את תוכן בריתת הברית בין מאנטענעגרא וזערביען לאמר: מושלי זערביען ומאנטענעגרא עם ממשלותיהם, ונלוו להם יושבי באסניען והערצאגאווינא באו כלם בברית יחד שלא לעשות שלום עם תוגרמה כל זמן שיעמדו צבאותיה על אדמת זערביען, או לא ישאר איש אחד מכל עם זערביען. בעלי הברית ילחמו עד שפך טפת דמם האחרונה. הנוצרים הסלאווים בכל העולם יתמכו בידם במשען כסף למלחמה זו. כרגע אין כל סיבה לדרוש את השלום. על די זה שלכדו התוגרמים כפרים אחדים על אדמת זערביען, לא לכדו עוד את כל המדינה. צבאות מאנטענעגרא יכו את חיל תוגרמה תחת פקודת שר צבאם דעליאדין פחה ההולך לעזרת מוקטהאר, ואז יפרוצו בגבול זערביען ויתנו יד לחיל י""ל. זערביען ויחד ידברו את האויב בשער ו מה בלכ ים עיר זאיטשאר מוויען מודיעים כי צבאות תו הרגו שלש מאות פצועים מחיל זערביען שנשארו שם. מבוקא- רעסט מודיעים כי צבאות תוגרמה לקחו בשבי את הרופאים והעוזרים על ידם, שבאו מרומעניען לעזר פצועי המלחמה בזער ביען, ויהרגו את כלם ולא היו כל נשמה. ממשלת תוגרמה  העמידה חמשים אלפים אנשי חיל על גבול רומענ ולטאן הוציא עתה קול קורא אל יושבי זערביען ואומר כי אין ברצונו להרע ליושבי זערביען השוקטים במכונם, רק מטרתו להעניש את אלה שיוצאים בחרב לקראתו. הנהו אב רחמן לכל יושבי מלכותו כהמושלמנים בבעלי יותר האמונות. דבר צוה לחילו שלא יגעו לרעה באלה מיושבי זערביען היושבים במקומם ואינם אוחזים בחרב. נתן פקודה נמרצה לשרי צבאותיו להגן על הונם וחייהם. מי יתן ויאמנו דבריו. לפי הנראה, צבאותיו אינם נותנים לבם לפקודה זו. מבעלגראד מודיעים מיום השמונה עשר לירח זה כי ראש הגדוד הארוואטאוויץ לכד את עיר טאפלא מידי חיל תוגרמה, והחלוץ של מחנה איוב פחה הוכה אחור. מצעטיגיע בירת מאנטענעגרא מודיעים כי שר צבא מחנה הנגב של מאנטענעגרא ה. פעטראוויץ שהכה עתה את התוגרמים מכה רבה על יד פאדגאריצא פורץ הלאה בראש חילו לעומת שקוטארי במדינת אלבאניען באין מפריע, מפני כי אחרי מפלתם האחרונה לו נמצאו עתה בכל מדינות אלבאניען מחיל תוגרמה לא יותר מאלף בעלי מלחמה. ממשלת ענגלאנד נדרשה להצעת יתר הממשלות האדירות לנסות דבר השלום עם בעלי הריב, ומלאכיה בתוגרמה וזער- ביען דברו אל ממשלות הארצות ההן על אדות השלום, אך כתוגרמה כזערביען לא הטו אזן קשבת להם ומנויה וגמורה כסודן שלא להניח עוד החרב מידן. כה״ע מביאים עתה את דברי המכתב שערך מושל מאנטע ל חיל תוגרמה תחת נעגרא, אחרי נצחונו הגדול הראשון פקודת מוקטהאר פחה, אל שר צבא התוגרמי ההוא בנוגע לקבורת החללים שנשארו על המערכה. וזה לשונו: „אל שר הצבא מוקטהאר פחה בעיר בילעק! אף אם רוב הנופלים במלחמה ביום 28 יולי נקברו בידי צבאות חילי, בכל זאת נשארו עוד רבים מהם מונחים על המערכה בקרבת עיר בילעק, צבאותיך לא יתנו להקוברים לקבור המתים. בתקותי כי נכון הנך למלא חובתך המוטלת עליך בתור שר צבא, הנני מציע לפניך האופנים שעל ידם נוכל לקבור את החללים כן אודיעך כי לדאבון רוחי נמצאה גם גוית שר הצבא זעלים פחה בין הנופלים במלחמה הנזכרת, ואנכי צויתי לקברהו בכבוד כראוי לגבור כמוהו. כן אודיעך בזה כי שר הצבא אסמאן פחה *) מצבאות חילך נפל שבי בידינו בעת שהתאמץ לעצור את צבאות חילך ממנוסתם ממערכת הקרב. הנהו בריא ושלם ישלחתיו לעיר ממשלתי צעטיגיע. הנני וכו' י יקאלויס מושל מאנטענעגרא. המלאך שהוביל את המכתב ההוא למסרהו לידי מוקטהאר פחה לא יכול למלא שליחותו מפני כי כאשר הקריב לבא לשערי עיר בילעק ירו עליו חיל תוגרמה מן החומה, וגם נס-השלום אשר בידו לא פתח לו שערי העיר."
044-MGD-1876-08-23-PG001-SINGLE-ORIGNAME_200283_toc_12,"•) (הערת חמויל"".(כחג י10לזי ?68161 1*1^0..."," *) (הערת המו״ל). וכתב העתי Fester Llyod היוצא אור בעיר פעסט באונגארן מודיע אדות שר הצבא הזה, אסמאן פחה, כי הנהו יהודי מלידה, יליד אונגארן ושמו: וואלף פארקאט. בשנת 1848 לחם בצבא ההאנווערס האונגארים נגד צבאות עסטרייך בעת המרידה תחת פקודת שר הצבא בעהם הנודע. אחרי שהוכו כל צבאות אונגארן. נמלט גם וואלף הנ״ל בחברת יחר הפליטים, למדינת תוגרמה. שם המיר דתו באמונת מחמוד. בהיותו יודע ומבין לשונות שונות נתמנה מורה בבית הספר לחניכי המלחמה בקאנסטנטינאפעל, וגם נפקד למורה לשונות לבני הסולטאן. במלחמת-הקרים, היה הוא החלין בין צבאות ענגלאנד, צרפת ותוגרמה. אחרי מלחמת קרים נתעלה למעלת שר צבא (פחה.) בעיר פעסט חי אחיו ה. בערנהארד וואלף, אחד מנכבדי קהלת ישראל שם. —"
