article_id,headline,text
044-MGD-1874-01-13-PG001-SINGLE-ORIGNAME_180015_toc_1,," שנת שמנה עשרה . יוצא לאור פעם אחת;  בכל שבוע. מחירו בארצנו  4 ר״ע 4 ""ג לשנה. 1 ר״ט 1 ז״ג לרבע. בעסטרייך 8 פל׳ ע״וו:  לשנה. 2 פל׳ ע״וו לרבע. בשארי ארצות 20 פראנקס; מ —"
044-MGD-1874-01-13-PG001-SINGLE-ORIGNAME_180015_toc_2,, .  כל איש יוכל להשיגו ע״י כל פאסט-אמט ובוכר: האנדלונג בכל המדינות. כל החפץ להודיע דבר: מם ברבים לטובתו! עליו לשלם שכר הדפסה  בעד כל שורה 1 ז״ג פרייסים.   .
044-MGD-1874-01-13-PG001-SINGLE-ORIGNAME_180015_toc_3,, ם חדשות וקורות הימים. יגיד ליעקב מהנעשה והנשמע בכל חלקי תבל בין כל יושבי חלד אשר ינעם ואשר ראוי לדעת לכל איש ישראלי לתועלתו ולתועלת השפה העבריה.  מאתי א אליעזר ליפמאן זילבערמאן. י : והאמת והשלום אהבו. מכריה ח').
044-MGD-1874-01-13-PG001-SINGLE-ORIGNAME_180015_toc_4,תוכן הענינים.," תוכן הענינים. דבר בעתו: על המדינות בו יאמר: דייטשלאנד: דרעזדען, אלטונא. עסטרייך-אונגארן: מכתבים מאונגרן: בודאפעסט. אזיען: סיון. חדשות שונות: הצופה. גם אלה דברי ב״נ: מאת ב״ו, דברים אחדים: מהגאון שי״ר, תשובה   למשיגי: מאת יעקה רייקמאן. תשובה מאהבה. מאת משה אליעזר פאסטעלבערג אגרת בקורת: מאת מו״ח. הודעות. הוספה: ירושלים: ירושלים: ירושלים: הודעה בדבר הנשרפים באניקסט ושאוועל. מתן תודה: חוסו על אשה ובתה. לתקנות בנות ישראל. את דודי אני מבקש. להתודע ולהגלות. מלואים."
044-MGD-1874-01-13-PG001-SINGLE-ORIGNAME_180015_toc_5,דבר בעתו.," דבר בעתו. ראדום, (המשך מגליון 2). עתה אחר אשר עלה בידינו ב׳ מיני החובה נקל להבין כי כל איש אשר יצא מגזע יעקב ובשם ישראל יכונה לא יוכל להסיר מעליו עול התורה, כי האיש המאמין בתורת ה׳ עליו חוב פרטי לשומרה מטעם אמונתו. אמנם גם האיש אשר לא יאמין בה, גם הוא אינו חפשי מעולה מטעם החוב הכללי, כי כמו הפרת חוקי המדינה יהיו נסיבה להריסת המדינה, כן עזיבת משפטי התורה יסבו הריסת העם הישראלי א״כ איפה כאשר נתחובבו אנשי המדינה לשמור את חקותיו לאושר המדינה, כן נוטל חוב כללי על כל אשר יתיחס למשפחת ישראל, לקיים את כל מצות התורה לקיום העם כולו. וזה הורו לנו חכמינו ז״ל באמרם (שבת דף פ״ח ע״א) מלמד „שכפה עליהם את ההר בגיגית ואמר אם אתם מקבלים התורה מוטב ואם לאו שם תהא קבורתכם״ כונתם, אם תקבלו את התורה יהי׳ קיום ומעמד להעם ואם לאו, כללית הלאום ינתק אגודתו ובתוהו ילך, ויכוסה שם העם בחושך כקבור בתחתית האדמה, כי רק רוח התורה הוא המקשר ומאחד את מצב הלאום, ובאין תורה או כאשר יהי' תורת כל אחד בידו להוסיף ולגרוע כחפצו, יכלה העם באין תקוה. הן בעוד היו ישראל על אדמתם, עם לבדד לבטח ישכון, ובגוים לא התערב, גם מושליהם מקרבם יצאו, הורה לנו הנסיון כי המפלגות השונות אשר לא התאחדו בפרטי המצות, הם היו בעוכרנו, והורידו לעפר קרן ישראל, וכאשר הזה הנביא עליהם ברוח קדשו ואמר „חלק לבם עתה יאשמו"" אף כי בעת אשר אנחנו בגולה, וזרע יעקב נחפור בכל קצות הארץ, רק רוח היהדות הוא המקשר ומאחד את לבותם בארצות פזוריהם, אבל באין יהדות אין יהודים. הדברים האלה אשר חשיבותים לאחד ממשכילי העם על שאלתו, לא יכחישם כל איש אשר לו שכל ישר ואוהב את האמת. ועתה איך לא האבל נפשנו. הן זה אלפים שנה אשר על שם ישראל ותורתו נשפך דם אבותינו כמים. עבור השם הזה שמו ניום למכים ולהייחם למורטים, כל תלאות הזמן והמון גליו הי׳ להם למשחק. במנוחה והשקט נשאו כל חרפות ונאוצי שונאיהם מגדיהם. עתה כאשר האיר השחר גם לנו, וקרני אור השמש גם עלינו יהלו, ולא עוד ישא ישראל חרפה בגוים באין מכלים דבר, אבל ישוב שבעתים   אל חיק המכ כהו — עתה! עתה! יקומו אנשים מתוכנו, וידעו לנו מכל צר ואויב, לנדע קרן ישראל באין תקוה חלילה. הן אמת כי מכור העוני יקל לאדם לצאת שלם, אבל לא על נקלה יצא בשלמותו מכור העושה, ואם נקח מעשה אבות לסימן לבנים כאשר הורגו חז״ל, יתכרר לנו אמיתת דבר זה גם מן התורה, והוא במאה״כ (בראשית ל״ב) ויותר יעקב לבדו ויאבק איש עמו עד עלות השחר וירא כי לא יכל לו ויגע בכף ירכו ותקע כף ירך יעקב בהאבקו עמו״. פה הרים ה׳ את המסכה הנסוכה על פני העתידות ויעבירם לפני יעקב במחזה בפנים גלויות, והוא, בימי הבינים נותר יעקב לבדו בחשכת ליל הגלות, וצורריו אכלוהו בכל פה, עכ״ז באשר התאבק איש עמו — (יצרו הרע מבפנים וצורריו הרבים מבחוץ— להמיד את דתו, לא יכול לו, כי שם ערפו כברזל ומצחו כנחושה וימת מות גבורים על ה׳ ועל תורתו אבל עת עלה השחר, לו את יושבי תבל באור הדעת, כי כל הנבראים בצלם אלק"" אחים המה, וחלק כחלק יאכלו בטוב הארץ וגם לבני יעקב הי׳ אור מושבותם, והרבה מהם עלו בגרם המעלות, אז נסה היצר ליגע כף ירכו — (כינוי לתאוה ועונג כמ״ש בסוטה דף ח׳ בירך תחילה בעבירה כו׳) — אז נקעה כף ירך יעקב בהאבקו עמו, ויבן לו היכלות (התענוגים) ויטוש את אלק׳ עשהו. על כן אם האנשים האלה הי׳ רק אשר התירו לנפשם ליקח מתענוגי העולם מדה גדושה, לא כתורה, ואולי גם יתר על החפץ הדרושלאושר האדם השלם, לא הי׳ לנו כל זכות להוכיחם על זה, כי מצבם הגבוה בחברת מרום עם הארץ נעלה הרבה ממצבנו, ואל תדין את חברך עד שתגיע למ קומו. זאת לא זאת, בחירה חפשית נתונה ממעל כל איש לעשות ככל העולה על רוחו ואם הוא עוד בבחירתו, האלק׳ יביאהו במשפט, ולא לאדם דרכו. אבל לפרוץ ביד רמה את כל יסודי הדת ולהכרית את תקות ישראל האחרונה, זאת היא טאת אשר לא יוכלו כפרה. האם לא גם תורת הפילוסופים הורה לנו אשר כל איש נתחובב לשמור את חוקי העם אשר על ברכה נולד ואף למסור נפשו עליהם, האף אין זאת אדונים נכבדים? י אם התבל משחקת לפניכם, ולמרום הר ההצלחה עליתם, ולא סר לכם דבר אשר למענו תצפו לישועה, וכבר אכלתם ימות המשיח, אבל האם בשרכם נחושה ולב אבן לכם מלעורר אף זיק המלה על אלפי אלפים מאחיכם בכל ארצות פזוריהם, אשר עודם בצרה גדולה ומנוס אבד מנהם, וכל נחמתם ושמרתם, משוש רוחם ונפשם היא תקותם, אשר עוד ישובו לכבודם הראשון בבוא משיח צדקנו? עוד ישבו בהשקט ובטח בחוצות ירושלים להתענג על רב טוב, ואתם רוצים לעשות תקותם למפח נפש, ולהשריש כל נוחם מלבבם, האם לא נפשות אחיכם האומללים אתם עושקים? (סוף יבא)."
044-MGD-1874-01-13-PG001-SINGLE-ORIGNAME_180015_toc_6,על המדינות בו יאמר," על המדינות בו יאמר (דייטשלאנד). ההכנות לבחירה החדשה לבית באי כח כל עמי אשכנז, תעשינה עתה בכל ההשתדלות מכל הכתות המדיניות השונות באשכנז. יום הבחירה יהי׳ בעשירי לירח זה, העומדים בראש האמונה הקאטאליקית עושים כל אשר ביכלתם להטות לבות הסרים למשמעתם לבחור רק אנשים כאלה אשר יעמדו נגד ממשלת פרייסען בשנאתם עליה ע״ד אחדות אשכנז וגדולתה, ורדיפתה את כהני אמונתם. בהיות כי רבה היא פעולת הכהנים על רוחות המון העם, ע״כ אין ספק כי בהמחוזות אשר רוב יושביהם הם קאטאליקים שם יבוחרו אנשים מתנגדים להממשלה, בכל זאת רוב הנבחרים יהי׳ מהעומדים לימינה בריבה עם האפיפיור וקדושיו, יען מספר כל הקאטאליקים באשכנז הוא רק שש עשרה מיליאן ומספר יושביה בכלל הוא ארבעים מיליאן נפש אדם. — קיסר אשכנז שב לאיתנו מחליו אשר חלה בו זה ימים רבים, וזה ימים אחדים הנהו עובד עבודתו עם שרי מלכותו, והרופאים נתנו לו הרשיום לעזוב את חדר משכנו. — בין הקרואים הרבים הגדולים והנכבדים שנסעו בימים ההם דרך עיר קעניגסבערג לפעטערסבורג ליום חתונת בת קיסר רוסלאנד עם בן מלכת ענג- לאנד, היו גם יורש העצר (קראנפרינץ) מפרייסען ורעיתו עם אחיה יורש הכסא מענגלאנד. לפי המובא בכה״ע אשר לממשלה מוכנת היא להציע לפני נבחרי העם סעיפים חדשים נוספות על חוקי האמונה שיצאו אור בשנה שעברה. בין הנוספות ההן יחשובו, א) אם ימרה הכהן את פי הממשלה ולא ישמע לקול החוקים, אז בפעם ראשונה יהיה עונשו עונש כסף, ואם העונש ההוא לא יועיל ויחטא עוד, אז יושם בבית האסורים, תחת אשר לפי החוקים משנה שעברה, רק אז הושת עליו עונש השביה אם אין כסף לאדון ההוא לשלם את אשר הושת עליו בפלילים, עתה יאסר בכלא אף אם כסף תועפות לו לשלם אשר נוטל עליו. הסיבה שהגיעה את הממשלה לשנות החוק באופן הנזכר הוא הדבר אשר ראתה כי עונש הכסף לא ישיב את הכהנים הקאטאליקים הראשים מדרכם הרעה, יען כי כסף לא יחסר להם לעולם. אם אפס כסף בכיסם, אז ישיגו מנ  אחר ככל משאלות לבם. עתה בידעם כי לא יועיל למו כל ה ביום עברה, אולי יתעשתו ולא יזידו עוד להתנגד אל חוקי המדינה, כי גם כהן ראשי קאטאליקי לא יתענג לשבת בבתי כלאים. — ב) אם יובא אחד מהכהנים הראשים או הקטנים לפני בית דין הגדול שנוסד עפ״י חוקי האמונה לחרוץ משפט בענינים ההם, והשופטים יחרוצו עונשו להסירהו מפקודתו והוא בכל זאת ישאר "" במרדו ויעשה פקודת משמרתו, אז יושם בכלא לשבת בו כל ימי חייו, או כלה גרש יגרש מן הארץ. (פראנקרייך). כה״ע בצרפת, כבכל מדינה ומדינה, משימים מבטם לאחור על מקרי השנה שעברה בנוגע לארץ מולדתם אם לשבט אם לחסד. מכל מה שהביאה השנה העברה בעניני המדינות, רק על זה שמחים הצרפתים כי בשנה שעברר נקרא דרור לאדמת צרפת מצבאות אשכנז. זה הוא הענין היותר גדול ונכבד שהשאירה למו השנה שעברה. בנוגע לימים הבאים מתנחמים הצרפתים בתקותם לשוב לאיתנם ולתת עוד חיתיתם על העמים כמקודם. כן רבים הם האנשים בצרפת המתאמצים להעיר ולעורר שנאת העם על אשכנז, לפנות הדרך עי״ז למלחמת הנקמה לעת מצא. עוד בסוף השנה שעברה דברו הכהנים הראשים קשות, במכתביהם הגלויים אל בני העם, על אשכנז ואיטליען ויפיחו בלבם אש המשטמה על הארצות ההן בדברי חרופין וגידופין, עד כי מצאה הממשלה עצמה מחויבת להזהירם ולבקשם שלא יוסיפו לעשות כן, למע לא תעלה חמת הממשלות הנזכרות על צרפת. לפי הנשמע נתעוררה ממשלת צרפת לזה ע״י ציר אשכנז היושב בפאריז. כאשר באו פקידי הצבאות, העומדים על המשמר בפאריז, אל נציבם העומד בראשם, בראש השנה למספרם לב רכהו כנדוג, דבר אליהם דברים נמרצים וידבר טובות על אנשי הצבא בכלל, ובסוף דבריו אמר להם כי יושבי הארץ גדלה תקותם ואמונתם בצבאות החיל כי עוד ישיבו את הארץ לגדולתה הראשונה, ובעזרתם תהי עוד יד צרפת על העליונה על כל הגויים והממלכות כמקדם. והנה נקל להבין על מה ירמזון דברי שר הצבא ההוא. בין ממשלת פארטוגאלוענגלאנד פרץ זה כמה סכסוך אחד בעניני המדינה, עתה נמנו וגמרו שתי הממשלות הנ״ל לסמוך בריבם על פסק הדין של הפרעזידענט מאק-מאהאן וכאשר יגזור הוא כן יקום. — (שפאניען). בימים האלה נתאספו באי כח עם שפאניען לבית ועדם אחרי שביתתם זמן רב. לפי הנודע נתנו הנבחרים טרם עזבם את ישיבתם בפעם האחרונה, להשר קאסטעלאר שעמד בראש הממשלה אז כח ועוז למשול כאות נפשו במשך הזמן מיום הפרדם מאגודתם עד האספם מחדש, לעשות כל אשר ימצא נכון לפניו להקים סערת המרידה לדממה ולרפא פצעי המדינה עפ״י האמצעים הדרושים למטרה זו. לפי הנודע המרידה בשפאניען עתה היא כפולה ומכופלת. הקארליסטים מזה המשתדלים להושיב לכסא את דון קארלוס אוהב האפיפיור וקדושיו, ורבים מהרעפובלי. קאנים מקצה האחרון אשר בהרבה מקומות מרדו גם הם בהממשלה יען בחפצם ליסד ממשלת רעפובליק מקצה האחרון אשר אין רוח הממשלה ורוב העם נוחה ממנה. — הפרעזידענט הנכבד והישר באדם קאסטעלאר, הנודע לתהלה ותפארת בכל הארץ, רבו זעל ועשה במשך הזמן ההוא לטובת ארץ מולדתו. אף אם עוד לא הצליח בידו להקים המרידה לדממה, בכל זאת רב טוב עשה לארצו בענינים רבים, וגם מלט בחכמתו את שפאניען מבא בדמים גם אמעריקא בדבר הריב אדות האני׳ ווירגיניוס כנודע. כן הצליח לו להקים השלום הפנימי ולאחד כל הכתות להיות בעצה אחת נגד המורדים הנ״ל. כן גדול הי׳ כבודו בעיני הממשלות באיי- ראפא היודעות להיקיר תכונות רוחו היקרה. אם הי׳ נשאר בפקודתו הגבוהה לעמוד עוד בראש שפאניען היו גם יתר הממשלות מאשרות מקימות את ממשלת העם בשפאניען. ויהי בהתאסף ראשי העם ובית ועדם בימים האלה, נתן הפרעזידענט קאסטעלאר דין וחשבון לפניהם על כל מה שעשה במשך הזמן שהי׳ הכח בידו לעשות כטוב בעיניו, והציע לפניהם כל מה שנחוץ עוד לעשות להשבית המרידה ולכונן את ממשלת העם לימים יבואו על יסודות חזקים בל ימוטו. — רוב הנבחרים היתה הפעם רוח אחרת אתם ויודיעו דעתם כי אין רוחם נוחה מהפרעזידענט קאסטעלאר ויפקידו תחתיו איש אחר מתוכם את ה׳ זאלמעראן, ג״כ מכת הרעפובליקאנים. בתוך המהומה שנעשתה עי״ז הביא פקיד חיל אחד מכתב מאת זר הצבא המצביא על החיל אשר בעיר הבירה, אל ראש הנבחרים בפקודה אשר נבחרי העם יתירו אגודתם וישובו לביתם. בראות הנבחרים כי רעה נגד פני כלם, דרשו מאת קאסטעלאר לקו  המשרה בידו כמקדם לעמוד נגד המורדים החדשים, אך הוא לא להם. בין כה וכה באו גדודי חיל אל תוך בית הועד אבה שמו ובחרבות שלופות גרשו את באי כח העם מבית ועדם. שר הצבא זעראנא Serano הנודע עמד בראש ההנהגה המדינית ויפקיד שרי ממשלה כטוב בעיניו. הדבר הזה נעשה בפתע פתאום עד כי לא יכלו יושבי עיר הבירה להתעורר מהשתוממותם, ע״כ שוררת עוד שם דממות מות מפחד יום הבא. המארשאל זעראנא הוא האיש אשר הוריד את המלכה איזבל מכסאה לפני שנים אחדות עזרת חבירו שר הצבא Frim אשר נהרג אח״כ מידי מרצחים הוא משל על שפאניען כל הזמן מן המרידה הנ״ל עד אשר הושיב על כסא המלוכה את בן מלך איטליען. אח״כ כאשר עזב מלכם את כסאו מרצונו באין אונם כנודע, נוסדה ממשלת רעפובליק בארץ וקאסטעלאר עמד בראשה. שר הצבא זעראנא בחלה נפשו עפובליק וחפץ בממשלת מלך. אם יצליח עוד הפעם חפצו שיבהו על כס שפאניען או ישים עטרת בידו למצא מלך לה המלוכה על ראשו בעצמו וכבודו, זאת אין לדעת מראש. ראשית ובית את המרידה בארץ, אם לא יתעוררו בני מלאכתו תהי׳ לה העם להוריד גם אותו מגדולתו טרם יגיע למטרתו. בין כה וכה ושרי הממשלה החדשים, באי כח עצמם, הודיעו אל העם במכתב גלוי כי ישימו כל מגמתם להקים השלום הפנימי בארץ ולכלות המורדים מתוכה, ואח״כ יקראו אל העם לכונן ממשלה כטוב בעיניו. רוסלאנד). מכה״ע מודיעים מהחיק החדש בנוגע לעבו הצבא ברוסלאנד כאשר נמנו וגמרו עליו עתה שרי בית המועצות, כי ביחוס זמן העבודה, יפרדו בני הנעורים באי בתי הספר לשלש מפלגות. א) אלה אשר הקשיבו לקח בבית ספר החכמה (אוניווער. טעט) יעבדו רק שלשה חדשים אם יתנדבו מרצונם לעבוד א, ואם יפול הגורל עליהם אז יעבדו ששה חדשים, 2) אלה תלמידים אשר השלימו חוק לימודם בגימנאזיום בשש מדרגות, עברו ששה חדשים אם יתנדבו לעבוד ברצונם, ואם יעלה עליהם הגורל, יעבדו י""ח חדשים. ג) אלה הצעירים אשר יעמדו על המבחן בלימודיות הנחוצות, כן בלימודי האוניווערזיטעט או הנימ. נאזיום, אף אם לא הלכו מעולם לבתי ספר הנ״ל או למדו בחוצה לארץ, יעבדו ב׳ שנים. הזמן אשר עוד מחויבים לעמוד בצבא אף אחרי עבדו זמן הקצוב עפ״י החוק, בעת הדרוש לצאת לקר עזערווע) הוא עשר שנים. במשך הזמן ההוא יקראו לצבא רק עת מלחמה. בעת השלום אז כל בעלי שלשת המפלגות הנזכרות הם פקידי החיל (אפיצירע) בחיל הרעזערווע."
