article_id,headline,text
044-MGD-1874-01-13-PG001-SINGLE-ORIGNAME_180015_toc_12,דברים אחרים. מהגאון שייר* (ס&פך מגליון ....," דברים אחרים. מהגאון שי״ר. (המשך מגליון 2). מגדלא עיר סמוכה לטבריה. ומגדלאי שאלו לרשב""ל מהו ליקח אבנים מעיר זו ולבנות בעיר אחרת (ירושלמי רפ״ג דמגילה) ופ""ג דמעשרוו ה״א: היה לו ב׳ חצירות אחת במגדלא ואחת בטבריה וכו', ובב""ר ע""ט ומ' קהלת פ׳ ופורץ גדר: רשב״י כי עבר קומי מגדלא שמע קליפי דספרא אמר הא בר יוחאי מדבי טבריה. ומשם ר' יודן מגדלאה ו""ר יצחק מגדלאה (סה״ד), ומפני הזנות נחרבה, איכה רבה פ' בלע פ׳, בירושלמי פ""ה דעירובין א""ר ירמיה מעשה ברועה אחד זקן שבא ואמר לפני רבי זכור אני שהיו בני מגדל עולין לחמתה (בשבת) ומהלכין את כל חמתה והתיר רבי שיהא בני מגדל עולין לחמתה ע״י הגשר, ועוד החיר רב שיהיו בני גדר יורדין לחמחה ועולין לגדר ובני חמתה אין עולין לגדר, ע""ש הטעם מפני שאנשי עיר גדולה (גדר) מהלכין את כל עיר קטנה חמתה - ולא להפך, מזה נראה: א׳) תמתה היתה גבוה יותר ממגדל, שהיו עולין ממגדל לחמתה, וגדר גבוה מחמתה, שהיו יורדין מגדר לחמתה ועולין מחמחה לגדר, וכ״כ רש״י עירובין ס״א ד״ה לאו משום: גדר ותמתן יושבין בהר בשיפוע גדר למעלה ותמתן למטה, ונראה שכתב כן עפ״י הירושלמי הנ״ל. ב׳) חמתה סמוכה מאד לטבריה עד שנעשה אח״כ לעיר אחת ומגדל סמוכה לחמתה. ג') חמחה סמוכה לגדר כחות מאלפים אמה תחום שבת וזה שלא בדברי המבוא לנסיעת בורקהארד בהקדמה שכתב שמרחק חמתה מגדר היה כחמשה פרסאות. ד׳) נכונה גי' החוס׳ עירובין ס״א ד""ה ועוד ולא כמו שרצה בתחלה למחוק מלת ועוד, וע""ש שכתב שיש תוספתא שכתב בה בחר עדותה ורועה המיר ד׳ וכו׳, והנה לפנינו בירושלמי כמו בתוספ׳ ההיא, ושם מחולקים רש״י ותוס׳ על מה דאמרינן שם עיר העשויה בקשת אם הכוונה על תמתה או גדר וקרובים יותר דברי החוס׳ שהכונה על גדר. ועוד שם: כי אתא רב דימי אמר הטעם שאין בני חמתן עולין לגדר משום דמטטרגי להו (מכים) בני גדר לבני חמתן ומקשי כי אזלי בני גדר לחמתן נמי מכי לבני חמתן ומתרע כלב בלא מחיא (עירו) שב ענין לא נבח, ומ""ש שבת, משום שכרות, והשתא נמי מטטרגי בני חמתן לבני גדר, כולי האי לא כייפו להם ע״כ. ונ""ל הטעם בכל זה משום דגדר היה עיר של יונים עוד מכבר, מעת לקח אותה קיסר רומי מארכילוס ונתנה לכוריא, ע׳ קדמוניות ליוסיפון סי״ז פי״א סי׳ ד׳ וקחשיב שם ג׳ ערים שלקח הקיסר ועשום לערים יונים והם עזה גדר והיפפאס והיא סוסיתא הנחשבה גם בתלמוד לרובה של עכו״ס (ע׳ בערכו) וכמו כן בל״ס גם גדר, וגם לפני אלכסנדר ינאי היתה גדר עיר של יונים וסורים והוא כבשה מהם (שם סי״ג פי״ג סי׳ ג') וא״כ יפה פחדו שלא ילכו יהודים מחמתן לטייל בגדר מפני שיכו אותם הנכרים דשם, ומ""ש שבת משום שכרות ר״ל שכרות של היהודים ועי""ז יתנו יד למריבות המביאות לידי מכות והריגות. מדי, מדי בתלמוד נראה שר""ל הצפונית הבלתי נודע גם ליונים ורומים (ע׳ פינקע) וחשבו בא״י גינזק של מדי לרחוק הרבה, (מעשה ומת אביו של ר״צ בגינזק והודיעוהו לאחר ג' שנים (מו״ק כ'), ונ״ל שזה הפ״ יוליכנו אחריו למדי, ואין אנו צריכין למה שנאמר בשם הגאון מווילנא ששם הזהב בזול ע""ש המקרא הנני מעיר עליהם את מדי אשר כסף לא יחשובו, שזה רק על רוב אכזריות שלהם ולא על כי שם הזהב הרבה מה שלא נמצא בשום קדמון, ור""ל יוליכנו אחריו אפילו למקום רחוק כמדי. בכ״ז במלכות מדי היו הגדולים מפונקים מאד ולבושיהם רחבים והיו קושרים אותם בהרבה קשרים מרוקמים ושלשלאות, וזה שאמרו בשבת ס״ה: המדיות יוצאות פרופות ע""ש ברש״י. ובקידושין ע״ז: עד היכן היא בבל רב אמר עד נהר גינזק והוא מדי וא״ס שהנהר הסמוך נקרא ע""ש העיר,  והוא נהר עזק בגמרא ויתכן שזה מחילוף הברת עין בג""נ כנודע בפי הספרדים. ובירושלמי שם הנהר יזק וזה מהברת הגימל בפי הרומים ויזק כמו נזק והוא Gazaca וזה אמרם ג""כ ספ""ק דיבמות נהר גוז והגינזק, ומזה נראה ג״כ שהרחיבו גבולי בבל לענין יחוס. — שם נמצאו הרבה מחוזות יבשות ובלתי פוריות כמדבר ועכ""פ אין מגדלים שם חמרים הרבה כמו בפרס, ובזה נבין מאמר שמואל בקידושין י""ב: קדשה בחמרה חיישינן שמא שוה פרוטה במדי, לפי ששם התמרים אינם מצוים כל כך ונמכרים ביוקר, גם יש לפרש על רוחק המקום שמא שם שוה פרוטה. ונראה מזה שלא כדברי הרמב״ם פ״ד מאישות שאם אינו מתקיים עד הגיע למקום השוה אינה מקודשת, שהרי המרחק רב בל״ס למדי ובודאי אין התמרה מתקיימת באריכת הדרך ואעפ״כ אמר שמואל חישינן."
044-MGD-1874-01-13-PG001-SINGLE-ORIGNAME_180015_toc_13,ת^ויבה למ^יגי. (.1 כהצו6ח ^סמגיל (פגת פג...," חשיבה למשיגי. 1.) בהצופה להמגיד (שנח שבע עשרה כו' 44 מאמר: תתן אמת ליעקב): וממני נפלא הדבר איך לא ראה בפי׳ רש״י שם במקומו, ומה שטען עליו הרמב""ן ז""ל בפירושו, ועיין במזרחי שם עכ״ל. איה השם? ואיפה הבמקומו? הכי בפי׳ רש״י על החורה (ויקרא י""ח י""ז ו״ה זמה)? מה כתוב שמה יותר מבפירושו על ע״ז? הלא גם שם לא כתוב כי אם: זמה, עצה כתרגומו עצת חטאין שיצרך יועצך לחטא עכ״ל. ומה יתן לנו ומה יוסיף לנו זה לשום בו לאל שאלתי ? ופ הרמב""ן והמזרחי אין עמדי עתה.. 2) שם: מתרגום אונקלוס מובאים ט""ו דברים בתלמוד הבבלי ע""כ. כפי הרשום על זכרוני יש להוסיף עוד פ""א והוא מ""ק ב' ומתרגמינן (ואתה עיף ויגע דברים כ״ה) ואת משלהי ולאי והערוך (ערך שלח ה׳ והרמב""ם (בפי׳ המשניות) גרסו ומתרגמינן (והוא עיף בראשית כ״ג) והוא משלהי וכו' וכו׳ גם ממנו, (תרגום נביאים המיותם ליוב""ע) י""ד דברים בתלמוד הבבלי ע״כ יש להוסיף עוד ג׳ דברים ואלה הם. א׳) מו״ק ב׳ וכו׳. ב׳) נזיר ג' כדמתרגם ר׳ יוסף (ושולח מים על פני חוצות איוב ה׳) דכד משקין מיא לפירי. ג') שם ס״ו ומתרגמינן (ומורה לא יעלה על ראשו ש״א א׳) ומרות אינש לא תהי עלוהי עכ״ל. בשני מאמרים (אשר שם האחד: קבוצת דברים שונים, ושם השני: עוד פרחים שונים, וגם שניהם עומדים לצאת אור בתשועת רב להושיע) מניתי אנכי בעצמי כל חסרון גם בדברי תרגום תורה גם בדברי תרגום נביאים, אולם לא מחשבותיך מחשבותי ולא דרכוך דרכי. הן בדברי תרגום תורה הבאתי, אנכי בראש המאמר האחד הנ""ל מאמר: דכתיב יירש הצלצל (דברים כ""ח מ״ב) ומתרגמינן וחסניניה סקאה (ב״ק קט״ז ב׳) תתת המאמר ממ""ק ב' אשר אתה הבאת. והמאמר ממ""ק ב' הבאתי אנכי במאמר השני הנ""ל בבין דברי תרגום נביאים, יען אשר בררתי שמה היטב, כי תחת: ואתה עיף ויגע או: והוא עיף צ""ל: והנה עיף (ישעיה כ״ט ח׳) הקרוב לנוסח הערוך. ושני מאמרי נזיר הנ״ל לא חשבתי לחסרון כי האחד מלבד אשר גם לפי נוסחת: כדמתרגם ר' יוסף הוא אך מתרגום כתובים ולא מתרגום נביאים המיוחש ליוב""ע שידבר בו במאמרי, הנה נראה עוד בעליל מפי׳ רש״י שם, כי לא היה גורם: כדמתרגם ר׳ יוסף. וכי לדעתו אין מאמר: דבר משקין ליה מיא לפירא ורבי מן התרגום רק מן הגמרא עצמה יעו""ש היטב. ובאמת אין שמץ מנהו בתרגום איוב אשר לפנינו. וכן בגליון כתוב שם: בס״א ל״ג. ולפי דעתך היה טוב יתר מאד לך אשר תשיג מזה על רש״י שכתב במגלה (כ""א ב׳ ד""ה ועשרה מתרגמין): לא גרסינן שאין תרגום בכתובים עכ״ל. ובלי ספק ר״ל שלא היה תרגום על כתובים בימי הגמרא, יען אשר אין זכר לו בכל הגמרא כאשר יש זכר בה לחרגום תורה ותרגום נביאים. אבל בימים שאחרי הגמרא היה תרגום על כתובים, כאשר יובית התרגום על אסתר המובא במסכת סופרים. וגם בידי רש״י היה תרגום על כתובים, כי בפירוש על חגיגה (כ״ב ב׳ ד״ה ויצבט) מובא תרגום רות, ובפירושו על התורה (דברים ג׳ ד'.) מובא תרגום אסתר ובזה מיושבת קושית התוס׳ במגלה שם עיין שם. ואשר כתוב בתוך פירושו על ש״א (י""א ח׳): ותרגים כצרור אבן במרגמה (משלי כ״ו ח'): היך בזקא רכיפא בקלעא עכ״ל איננו מרש""י עצמו כי אם ממעתיק אחד אשר לקחו מערוך (ערך בזק), ורשום שם: סא״א שהוא ר״ת: ספרים אחרים איננו. ואולי לא היו מצוים בימי רש״י כי אם תרגומי חמש מגלות בעבור היותן נקראות ונלמדות יותר מכל ספרי כתובים והרבו בגלל זה הסופרים לעשות העתקות מתרגומיהן ולחלקם באנשים החפצים מאד אם להבין את המגלות ואם להשתעשע באגדות המושכות את הלב האצורות בהם, ולכן לא זכר רש״י כי אם תרגומי מגלות. ומי יוכל לדעת ברור תעלומות כאלה? והשני בעבור אשר הוא אך נוסחת עין יעקב וילקוט (שמואל) ובגמרא שלפני איננו, ובח״א לרש״א שם כתוב: כדמחרגם ומרות איניש לא תבא עלוהי. ובנוסחת ע״י הוא כן בלשון המשנה, ובכל נוסחת גמרות ישנות אינו עכ״ל. וכן במשנה אשר בירושלמי איננו. וגם אין דרך המשנה להביא תרגומים, ומלבד פה לפי נוסחת ע""י וילקיט אין עוד שמן מהחרגומים בכל ששה סדרי משנה, ואך האמוראים אשר אחרי המשנה החלו להשפיק בילדי התרגומים ולהביא ראיות מהם, ולפרש דברי התנאים על פיהם (עיין סי׳ צ') וביחוד ר׳ יוסף. (סוף יבא)."
044-MGD-1874-01-13-PG001-SINGLE-ORIGNAME_180015_toc_14,"תשובה מאהבה , •סחי ר £סרן טעגגע3ויס קר6 ..."," חירה לדברי אם אלישע הנביא אמר לנעמן הלוך ורחן פעמים וכו' או ישעי׳ אמר ישאו דבלת תאנים, הלא עתה אנשי אמונה אבדו וגם תכז״ל נתנו כמה פעמים עצות טובות והודיעו כמה רפואות כמו בע״ז  אין מעמידין כ""ח א׳, ואם רצונו לחוות דעתו בשער בת רבים מויכותי עם הנוצרי, היה נכון לו להביא מאמר מיוחד, ולא לחלק על דברים שאיננו פסק דין ולא גמר הלכה שלא אליבא דהלכתי׳ ומה לתבן את הבר? מי פתי יכפור כי מי יחיה ומי ימות איננו מידי השמים? לכן בראותי כי בעל החילק לא הבין דברי ע״כ אבאר היום עוד הפעם עצת תכז״ל בברכות ה׳ א׳ אם יסורין באים עליו יפשפש במעשיו שנאמר נחפשה דרכנו ונחקורה וכו' דברי הנביא לחוד ודברי התנא לחוד שתי  מיני מחלות הנה מחלת הנפש ומחלת הגוף ודעת לנבון נקל כי נפש החוטאת חולנית היא, והבדל רב בין שתי המחלות, כי במחלת הנפש וכל להיות הגוף בריא וחזק ואמין כח, אך לא בהפך, וזה הצד השוה שבהן כי בשתיהן למען להגיע לרפואה שלימה צריכה בדיקה דרישה וחקירה אחר מקורן להסיר המכשול. הנביא ממחלת הנפש מדבר והתנא ממחלת הגוף מדבר והראה לדעת כמו במחלת הנפש נחפשה דרכנו לשוב לד׳, כן במחלת הגיף יפשפש במעשיו לכן התקינו הראשונים בתפילה על הרפואה לאמר תמיד רפואת הנפש ורפואת הגוף והמשכיל יבין. ואם ברצון השמיט שם אחד משמי על כי משנת אליעזר קב ונקי ורצונו עוד הפעם לסחור דברי לא אשיב עוד, כי בוויען אין משיבין על הדרוש. ולך קורא יקר! עוד הפעם עוררתיך על שמירת הגוף ואף אם ת""ל המחלה הנוראה חלי רע כלתה ב""ה אך המחלה קאטארהע שוררת בימים שהחורף יצא על הארץ מכל אשר מביא התקדרות הגוף השתמר. אל תאכל צונן, ואל תשתה קרים. מנע הלוך בפסיעה גסה המביא חמימות ולסיף התקדרות. הבט נא וראה בבהמה חי׳ ועוד אין מחלה שוררת באשר אין להם יצר, ועושים מה שטבע מחייב, לא כן האדם, הבעל בחירה, כל המחלות באות אשר לא ידע להזהר, ויצרו מתגבר על שכלו לכן בכל מעשיך ובכל דרכך השמר מאד מאד, ותמיד רק לבריאת הגוף הבט ואל תפן ליצר. — כבודו ימחול לי באמרי כי טעם באמרו ויין ישמח לבב אנוש כתוב בנביאים, כיא בכתובים, ומה ורבים כמוה. וויען הבירה ירח בול תרל״ד לפ""ק. משה אליעזר פאסטעלבערג.  תשובה מאהבה.  הח""ר אהרן טעננעבוים קרא עלי תגר בגליון 44 ש""ע ויצא ללחום בנגדי על שהרהבתי בנפשי לזרוע עצה טובה"" בשדה הצופה בגליון 34 ובין שורותיו אמר באר הטיב מה לסופר חדשות בתוכנו? הגם שאול בנביאים? — כלך מדרך זו ולך בשדה אחר בשדמות החדשות, ודברי בכתבם כאילו היתי מועיל בקודש חלילה לעשות קודש לחול, וכאיל ברצוני לעקור מצוה שבתורה, או להחיר אסור נטיעת אשרה אצל המזבת מק""ן טעמים שבתורה, והראה לדעת כי העצה שנתנו לנו תכז""ל לא מצאה חן בעיניו בהוסיף עלי׳ „קמל״ן"" וכל המוסין גורע ואומר, אולם לא כן עמדי. מי יודע אם יבא לימי הגבורה אם לא אז יסכים עמדי, והנה בתשובה באהבה שלשה שאלות לי לשאלו: א) למה הביא ממרחק רב ראייות לסתור מבעל עקדה ובחר ב״ד פסיקים מי״א המתחילין ומסיימין בנו״ן, מה יעשה עם הפסוקים האחרים? או מה יעשה עוד עם הפסוקים  המתחילין ומסיימין בכ""ף? למה לא תרץ הקושיות ולא השיב השאלות אשר אני שאלתי שם? ולדעתו אם יפשפש במעשיו קודש הוא. לפי זה כרכפתא דלא מנת תפילין יחוש בראשו או כאב יד יבא עליו? וכל האוכל טרכות יחלה במחלת בני מעיים, או יתש בפקעי? ואם יתרץ אף קושי׳ אחת אשר שאלתי שם אז מובילנא לי׳ מנא לבי מסוחא. ב) וכי ידו של משה עושות מלחמה או שוברות מלחמה או וכי נחש ממית או נחש מחי'? אמרו תכז""ל אלא בזמן שישראל מסתכלין כלפי מעלה וכו' ולמה לא נתנו לנו תכז""ל טיעם לשבת בהנס בפתיחת כי האחון? הלא כל הניסים שהמה מחוץ לדרך הטבע שווים המה? אלא כל דבר ודבר שיוכל לקרב אל השכל מותר הוא, ואם בתורתנו הק׳ מותר הוא בגמר׳ לכ״ש. ג) מה"
044-MGD-1874-01-13-PG001-SINGLE-ORIGNAME_180015_toc_15,אגרת בקורת," אגרת בקורת ידידי חכם גדול יוסף כהן צדק ני׳ לפ""ק. טארנאוו, כסלו תרל״ד. כאשר ישמח לבב אנוש התועה בישימון והוא עיף ויגע ולשונו צחה צמא, לעת מצוא מקור מים חיים נוזלים להשביע נפשו השוקקה, כן רויתי עונג ונחת ותחי רוחי הצמאה לדבריך בהגיע אלי מכתבך היקר הבא מכ״פ דמיין לוויען. מבין שורותיו נועם ידידות וענות-תן נשקפו, ובו הראת לדעת כי רק הדרך מפריד בינינו ונפשן העדינה עודנה קשורה בנפשי בעבותות אהבה נצחת לא במהרה ינתק והיה כזה ששון לבי גדול יתר מאד בשלחך לי הנה העלים לתרופה כתנות אור תורה, ולך בשורה מוצאת כי הנך עושה חדשה מכתב עתי בשפת עבר לתורה ולתעודה ולכל דבר חכמת בינה, ובנך יחידך הנותן אמרי שפר הרב וכו' מו""ה דוד ני' הראה אותי גם את זרע תנובת תבונתך פרי קדש הלולים כלו אומר כבוד לשמך ולזכרך, האח! ראתה עיני כי עוד יוסף חי ותלמודו בידו לטעת חיי עולם בקרבנו, והכהן צדק עוד יכהן פאר בהיכל הליטעראטור העברית וישר במשא דבר ה' בכל מסעיהו, ובכל מקום שהולך לפניו ילך ענן הכבוד, ואחריו יאיר נתיב עמודי דנהורא, אורה זו תורה! לא עליך אמרו חז""ל: הדרך ממעטת את השם וכו׳, ולא עליך יאמר ההמון: למה כתוב „אשרי יושבי ביחך"" בחד אפי, והקאפיטל „אשרי תמימי דרך"" בתמניא אפי? ותירוץ עמו; לפי שהיושב בביתו ובעירו אינו צריך להראות כי אם דמות פנים אחת כאשר הוא באמת, אבל ההולך נע ונד ומתערב עם שונים: ההכרח יאלצהו לפעמים להראות כמה פנים בשנותו את טעמו לפי המקום והזמן, והוא מסבות מתהפך לבקש אהבה ולמצוא חן וחסד בעיני כל הכתות למיניהם - ומה אחרית אלה? הנה אשרי יושבי ביתך, חותם בברכה „תהלת ה׳ ידבר פי, ואשרי תמימי דרך, סוף דבר נשמע „תעותי כשה אובד!״ — - לא כן אתה אדוני ש""ב, לא שנית דרכך הטוב גם בלכתך בדרך, עודך מחזיק בתומחך ושונא תהפוכות, תורת ה' בלבך ותהלתו בפיך תמיד ויהללו בשערים מעשיך! גם אני אודך הפעם ואהללך שבע כי אראה שמך מעשה אצבעותיך, עתה תצמח ותשמח תכרת ותגל חכמת ישורון, ויוסף יוסיף תת כחו ה להגדיל עצה ולהפליא תושיה. אבל, איש מכאובות אני חבור עצבים אחוז בחבלי טרדות, ראשי ורובי בטארנאוו ושלחני בוויען - בימים האלה אבדו עשתנותי כי לא מצאתי מרגוע, ואין מלה בלשוני לתאר לפניך עזוז רגשותי והתפעלות רוחי בקראי דבריך הנאהבים, המזהירים ככוכבים החוצבים להבים, ע״כ יהיו דברי מעטים כעת עדי ירוח לי מעט מעצבי ורוע מצבי, וכי אקח מועד אשפט על פועל כפך כי טוב ואתהלך ברחבה. אפס כי עזה אהבתי ותשווקתי אליך ולעשות רצונך חפצתי, אציגה נא בזה איזה הערות קצרות על ספרך הנכבד, ואם תראה כי טובות הנה תכין בטובתך להן יד ושם הלא בספרחך: (סוף יבא)."
044-MGD-1874-01-13-PG001-SINGLE-ORIGNAME_180015_toc_16,," הודעות. ד זה Baltischer Lloyd. דירעקטע פאסט - דאמפפשיפפאהרט צווישען - . Stettin und Now-YOTE 4 פערמיטעלסט הער נייען פאסט-דאמפפשיפפע 1 קלאססע: Ernst Meritz Arndt, Frankiin, Hamboldt Washington.  נעכסטע עקספעדיטיאנען. 19 מערץ 2 אפריל 16 אפריל או. ז. וו. פאססאגירפרייזע אינקל. בעקעסטיגונג: קאיטע פר. צטר 80, 100 או. 120 טהלו. צווישענדעק פר. צטר. 55 או, 65 טהלר. וועגען פראכט אונד פאססזאגע ווענדע מאן זיך אן דיא אגענטען דעס באלטישען ללאיד, זאוניא אן דיא דירעקטיאן דעם באלטישען ללאיד אין שטעטטין. —"
