article_id,headline,text
044-MGD-1880-07-28-PG001-SINGLE-ORIGNAME_240249_toc_8,דייטשלאנד," דייטשלאנד קעניגסבערג, בחודש יולי תר״מ לפ""ק. כשהייתי בדרכי בק""ב לבקש תרופה לחולשת גופי באת לבית הרופא החכם המפורסם זאניטעטסראטה דר׳ זאמועלזאהן ני׳ Dr. Samelsohn ומצאתיו לשמחת לבי בריא אולם מקודם, אחרי שהיה הוכח במכאוב הלב זמן רב והיה בעיר אחרת. עתה נרפא ב״ה ושב כעת לעירו ק״ב ודעתו להשאר כעת בק״ב ולרפא כל חולה המבקש עזרתו ועצתו. ואחרי כי אמרו עליו שלא ישוב עוד לפעלו ולעבדתו, מצאתי לנכון לטובת אוהביו ומכבד חכמתו הרבים בין אחב״י, להודיע זאת ברבים למען ידעו כל החפצים בו. נאום אליעזר ליפמאנן זילבערמאנן. תקת ספר ר ברעסלויא *) ה בימים האלה יצאה אור ב הזכרונות שלה. וויענגעווסקי לקורות ה סיה הנוצרית - העוואנ. ען געמיינדע"" בעיר קרא געלית „קראניק דער עוואנגעלי יא, ע״י ראש האמונה ה. סופעראינטענדענט דר׳ אלטמאנן בעיר ברעסלויא Dr. C. P. W. Altmann. בספר הזכרונות הנ״ל נמצא פרק מיוחד המדבר מרדיפות היהודים בעיר קראקויא. אשר לפי הנודע לנו לא בא זכר המקרה עוד בס׳ קורות בני עמנו, ומפני זה מצאנו לנכון לתרגם את הפרק ההוא ללשוננו למען קוראי המגיד, וז״ל: הריגת היהודים באכזריות נוראה בעיר קראקויא בשנת 1637 ביום החג לנוצרים הנודע בשם „היממעלפאהרטסטאג״ „ויהי ביום הששי לשבוע למחרת יום חג מ השמים בשנת 1637 באו שנים תלמידים קאטאליקים מהמקשיבים לקח בבית מדרש החכמות בקראקויא, אל בית איש יהודי לשתות משקה הנקראת בשם Mech. אחרי כלותם לשתות לא חפצו לשלם הכל, ובעל המלון לא הניחם ללכת עד כי נאלצו לשלם כראוי. בעת המריבה היתה מהומה בבית היהודי והתלמידים נדחפו הנה והנה. ויהי בעזבם את בית היהודי הגידו לחבריהם מה שעשה להם היהודי, וחבריהם לא היו טובים מהם. אז נאספו כל התלמידים ויתנפלו על היהודים בקרב חוצות העיר, ורע ומה חיה גורל כל יהודי אשר נפל בידם. זאת היה ביום ערב שבת בשוב היהודים מבתי כנסיותיהם לבתיהם. לשוב לבתיהם היה מן הנמנעות להם, ע״כ נסו ברחובות העיר כל אחד להמלט על נפשו באשר מצא מקום מחבא ומפלט, וכה נשארו בפחד ובלחות מות כל הלילה מחוץ לבתי מגוריהם. ויהי בבוקר למחרתו הצליח להם להטות את לבות שומרי בית מדרש החכמה ושופטיו בעד בצע כסף. לעמוד לימינם להגן עליהם, בשובם לנויהם. אך התלמידים חכו על בואם ויתנפלו עליהם בחמה שפוכה ויענום וימיתו רבים מהם בלי חמלה. מלויחם ברחו לנפשם ויעזבום בידי הורגיהם. האומללים אשר לא יכלו לשוב לבתיהם והתלמידים הורגים בהם ברחו איש לנפשו ויתחבאו בבתי הנוצרים להמלט, אך הרוצחים חפשו אחריהם בתוך הבתים ויסחבום החוצה ויהרגום באכזריות חימה. רבים מהנוצרים הטובים והישרים בלבותם, גם מקרב עדתנו העוואנגעלית המלו על האומללים ויסתירו אחדים מהם בתוך מרתפות בתיהם עד יעבור זעם. סוף סוף אחרי שחרגו התלמידים את האומללים בטוב בעיניהם, באו אנשי- חיל שומרי היכל הנשיא ויביאו את אלה מהאומללים שנשארו בחיים, אל בתי מגוריהם. התלמידים לא שמו לבם גם לזה ויתחרו עוד הפעם להתנפל עליהם, ואנשי ""( Breslau bei Alex Schlesinger neue Paschen-Str. 82 KII und 152 S. Se Preis 3 Mark. הצבא המיתו שנים מהתלמידים. אז בערה חמתם עד מאד ולא נחו ושקטו עד המיתו עוד רבים מהיהודים האומללים, אף כי באו גם חיל הרגלים של שר צבא הרוססי לעזרתם. בזמן המהומה והמבוכה הנ״ל הגדיל ד׳ חסדו על יראיו בעלי עדתנו העוואנגילים ואיש לא נגע בם לרעה, יהי שמו מבורך״. עכ״ל הסופר בספר הזכרונות העתיק ההוא. בכלל ראוי לשום לב לס׳ הזכרונות הנזכר עפ״י העתקת ה. אלטמאנן הנ״ל, כי נמצאים בו דברים הרבה יקרים לדורשי קדמוניות. אויגסבורג, מנ״א. למעלת מו״ל המגיד! מענה. בהמגיד משבוע העבר נדפס ארטיקעל אחד לקוה ממכתב העתי היוצא לאור במאנדעבורג (דיא איזר. וואכענשריפט) אשר בו איש אחד בלי שם מברלין כתב עלי מרורות, דרך קשתו נגדי ויציבני כמטרה לחץ להלשינני בדברי מינות אשר כל שומעם תצילינה אזניו. השתוממתי בקראי דברים כאלה אשר אין להם שחר, ואמרתי גדולה השנאה שמקלקלת השורה; בפרט מה שספרו עלי שהתרתי לישראל לישא נכרית. זה שקר גמור וכזב הוא. חו״ש מעולם לא עלתה על דעתי כזאת, וסחדי במרומים שלא אמרתי דבר הבאי כזה, ואין זה אלא דבה שהוציא מתנגד אחד עלי, ורחמנא שרי ליה שעבר בלאו לא תלך רכיל. עצור במילין מי יוכל לכן באתי בדברי אלה להתודע ולהגלות על האמת בשער בת רבים. נאום הצעיר חנוך המכונה דר׳ גראס רב דק״ק אויגסבורג. בחדש מנחם אב שנת תר״ס לפ""ק. Dr. Gross Distriktsrabbiner."
044-MGD-1880-07-28-PG001-SINGLE-ORIGNAME_240249_toc_9,עסטרייך-אונגארען," עסטרייך-אונגארען קראקא, יום ג׳ מ״א בשנת „טוב המגיד אדם ישרו"" לפ""ק. חדשות אני מגיד היום; חדשות אשר לשמע אזן תעלוזנה כליות כל משכיל על דבר טוב. הנה בימים האלה הצליח בידי הרב הדרשן דר׳ דושאק ני׳ להוציא פה דבר נחוץ ונכבד לפעולת אדם, ליסד ולכונן חברה מסתעפת לחברה יקרה, צפירה תפארה, מאד נעלה ומהוללה „כל ישראל חברים, בוויען. ביום מנוחה לסדר „בקנאו את קנאתי"" קנא קנא בדרשתו מעל הבימה להתיסדות הפיליאל וידבר אדותו בקול חוצב להבות אש הדתי והלאומי ודבריו הכו שורש בלב השומעים עמוק עמוק. אם כי מספר האנשים שכתבו ידם לה כעת מצער הוא, אבל ימים לא ימשכו וירבו נספחים אליה ויכירו ויוקירו רבים את חין ערך ורב טוב הצפון בחברת „כי״ח העומדת בראש כל חברות והכנות ההטבה לתועלת כלל עמנו עם קטן ודל, עם אין רגע בלי פגע, עם אין לך יום שלא ידברו ולא יכתבו עליו מרורות ושטנה ככל העולה על רוח שנאת וקנאת אנשי תככים, אשר קרבם הוות, תוך ומרמה; וחברת „כי״ח"" בפאריז ובוויען, הקשר הגדול והאמיץ המקשר ומאחד את בני עמנו בכל ארצות פזוריהם, הוא הרוח החיה באופני מצבם המוסרי והחומרי, והוא המוציאם והמביאם למרחב בכל מקום שהם, בעזרת מלכי החסד והצדק בימינו אלה עינה ולב על אחינו להטיבם בכל הנדרש, והיא צלם על יד ימינם, מליץ ישרם ומגינם, בכל עת וצרה שלא תבא. לדבר ברחבה לאיזה תעודה כבודה מגמת פניה מועדה, אחשוב אד למותר ואך כשונה ענינים ישנים, כי בלעדי אגיד, ומי לא ידע מגודל תכליתה ומפעלה, אשר כמעט אין על עפר משלח. אמנם אנו אין לנו כי אם להודות להמיסד הנכבד על אדות השתדלותו הנשגבה בעד פעולתו. עוד בשורה מוצאת בפי; בשורת ספר חדש והוא יסודי התורה"" לשד״ל ז""ל אשר כבדני המו״ל ידידי הנכבד וכו' שאלתיאל אייזק גרעבער ני' בפרשעמישל. אחרי כי המחבר נודע לאביר הרועים בשדה הספרות העברית, מובן מאליו כי הספר הוא כלו ממתקים וכלו מחמדים; כלו דברים יקרים העומדים ברום עקרי האמונה אשר על יסודותיה נשען כל בית ישראל. ולא נשאר לנו כי אם לאמר להמו״ל: לך בכחך זה! חוסף נא להעלות פנינים ספונים ממצולות ים הנשיח, להפיץ אור על מצפוני ספרים יקרים לא נודעו. מי יתן והיו עיניו רואות פרי ישוה לו ויביא פעם בפעם ברכה לבית ספרתנו הנשארת לנו לפליטה גדולה מכל שכיות החמדה, חמדת ימי קדם. פייבל הירשוועטטשטיין"
044-MGD-1880-07-28-PG001-SINGLE-ORIGNAME_240249_toc_10,פראנקרייך.," פראנקרייך. חג הלאומי בצרפת. פאריז חגנה אתמול 14 יולי חג גדול, כי ביום הזה בשנת 1789 התאספו הצרפתים אל המשמר הנורא בית העמל הנקרא בשם באסטיל והרסוהו עד היסוד והוציאו משם את האומללים הן הם פושעי הפאליטיקא וינתקו את כבלי הברזל מהנדחים, מהם היו אשר לא ראו אור השמש שלושים שנה. אם אבא לספר לכם, קוראים יקרים, את דברי הימים להבאסטיל המגואלה אזי לשפת יתר תחשב כי הדברים האלה כתובים בספרי דברי הימים לכל עם ועם; אך זאת אספר לכם מהחג הנפלא הזה אשר כלם כאחד יעידו ויגידו כי כמוהו עוד לא היה בצרפת, ואת אשר חזיתי אספרה. אך! אל מה אדמה לך, קורא נכבד, ההוד והתפארת אשר התראו ביום הזה בפא- ריז המעטירה? אלף אלפי אלפים דגלים התנועעו בראש כל חוצות כנוע נסי האניות במים אדירים; מראה הדגלים כמראה הקשת: אדום - לבן- לת, ופתילי זהב מסביב להדגלים, נרות שונים למיניהם אין קץ האירו את פני הרחובות ככוכבי נשף יהלו את הים רחבת ידים. קול רנה נשמע בכל שערי העיר ובכל מרומי קרת. „תחי הרעפובליק"" „תחי צרפת"" נשמע מכל עברים, פרחים ושושנים מצבעים שונים כסו את פני הרחובות בכל עבר ופנה.! — מה דמות אערוך לכם מהמחזה הנפלא הזה אשר כל עט סופר ילאה לתארו! בזה היום חוקמה מצבת הרעפובליק והיא תמונת אשת חיל, מעשה מקשה מנחושת רל לל, שבע אמות קומתה; כתר זהב על ראשה ובידה ענף עץ עבות סמל השלום והשלוח. על ימינה מתחת יושבת החופשה למה רכה וענוגה מאבן שיש ובידה אור גדול, ומשמאל להרע- פובליק יושבת השווי ופלס בידה כי משפט אחד לכל יושבי הארץ. אריה כרע רבץ תחת רגליהן סמל העז והגבורה. הגברים ונשותיהם, הבחורים ורעיותיהם רקדו כאלים בשוקים וברחובות, והילדים כבני צאן. המית התופים, תרועת החצוצרות, צפצוף החלילים, קול המזמרים והמנגנים השמיעו קוליהם כנהמת בני מרום. ששו צרפתים! שמחו בני פאריז! אבותיכם משנת 1789 השאירו לכם מורשה יקרה: המורשה הזאת היא החופשה! הבאסטיל האיומה נהרסה ועמה גם עול העבדות והבערות, עול העמל והלחץ, עול האון והמרמה ויופיעו שני המאורות הגדולים בתבל: חשווי והחופשה אשר עליהם העולם עומדת. ואען ואמר: תמו לנצח, תוך ורצח, עמל ולחץ, בני שחץ. החופשה גברה, והפיצה אורה; וגם לישראל, אורה יהל. כי גם אנחנו היהודים היינו למשיסה ולבוזזים קודם שנת 1789 ומיום שנהרסה הבאסטיל האדירה חוקה אחת לנו בצרפת ובשאר ארצות ביהודי כנוצרי, חלק כחלק נאכל. מה צדקו דברי החכם ר׳ מיכאלערלאנגער באמרו לי כי גם לנו יאה לחוג חג 14 יולי לזכרון חרותנו״. עתה קורא יקר בא נא אחרי ואנחנך מעט בגן טילערי הוא הגן הנחמד אשר מלפנים ישבו בו מלכי נפוליון לבית בינופארט. מהראיתי בהגן הנפלא הזה? נרות לאלפים, מאורות אדמדמים, קולות וברקים (פייערקונסט), ומחזות ירקרקים הפיצו קרניהם עד רום השחקים, וכל הגן כאש נגה לו מסביב. שני מאות מנגנים השמיעו שם זמר (קאנצערט) נפלא ובראשם היה זמרת „כוכב הצפוני )uverture der Nordstern) אשר יצר אביר המנגנים בן בריתנו מאיר-בער מנוחתו כבוד. *) מה אומר לכם מחזמר האלקי הזה אשר כל פה וכל לשון יעריצוהו ויקדישוהו? אזכרה (כי הזמר עוד יצלצל באזני) עת החצוצרות והתופים נאלמו דומיה וינועו קשתות המנגנים לאט לאט על כנורותיהם ומיתרי הכנור צפצפו צפצוף רך ונעים, השמינית (באס) גם היא המליטה אנחה כבדה וגלמודה כאנחת *) מאיר-בער, מת בפאריז בשנת 1868 והיה הקאמפאזיטאר היוחר מפורסם בדורנו ברוב נגינותיו (אפערן) אשר השאיר אחריו. ג״ז. יונה הבודדת על חגג..... הם!!! התופים הקיצו מתרדמתם ויריעו כל החצוצרות כתרועת בני אלקים, הקשתות ירוצו על הכנורות ומיתריהם רעדו. כמאת אלף איש (לכל הפחות) ימחאו כף וקול ענות גבורה bravo lbravol יצלצל ב ל המחנה. אשריך מאיר-בער, אשריך שם בעמקי הרפאים מקום העתקת אהלך זה שתים עשרה שנה! מבין הכוכבים תשיש נפשך הטהורה והנשגבה, עודך חי! כן, עודך הי מאיר-בער! כי מתק זמרותיך ונעם נגינותיך האדירות והנעימות אשר השארת לנו למורשה הן הן תעידנה כי עוד חי הנך. סוף דבר החג הלאומי הזה כמוהו עוד לא היה באייראפא כלו.  בכתבי הטורים האלה אחרי שובי הביתה זכרתי כי היום יום ו׳ לירח אב... וזה כאלפים שנה אשר נחוג חנינו ומועדינו על אדמת נכר. זה כאלפים שנה שנות חושך ואפלה אשר לא יראה דגל ישראל בארץ הצבי וכנורותינו תלויים על נהרוח בכל כנורות ציון! הל כה תתלו בערבות בבל ותאלמו סלה געציל זעליקאוויץ (איש ריטאווין)."
044-MGD-1880-07-28-PG001-SINGLE-ORIGNAME_240249_toc_11,ענגלאנד," ענגלאנד בימים האלה שאל הנבחר מאחב״י ה. סערשעאנט סימאן הי״ו בבית נבחרי העם את הממשלה אם יש לאל ידה להודיע אל הועד את תוצאות אסיפת באי כח הממשלות במאדריד שנועדו שם (כפי הנודע) לעשות סדרים בנוגע לדבר מחסה הממשלות על יושבי מאראקא; וישאל, באזיה אופן שנו את הדבר מאשר היה עד היום בנוגע להענין הנזכר; ואם נכתבו הסדרים החדשים בספר, אם תאות הממשלה להציע את דברי ספר הברית אל הועד. ויוסף לשאול אם כנים הדברים המובאים בכתבי דברי הימים כי באי כח הממשלות ערכו כתב-הנשתון בשם כל ממשלותיהם אל סולטאן מאראקא אשר בו דורשים ממנו לתת תורת חשווי בזכיות הממלכה גם להנוצרים וליהודיים יושבי מלכותו. ואם אמת נכון הדבר, אם תאות הממשלה ציע לפני הועד את נוסח כתב הנשתון ההוא. על זה ענה השר Dilke המזכיר בהמיניסטעריום לעניני חוץ כי ספר הברית שבו כתובים הסדרים החדשים שנעשו ע״י הועד במאדריד עוד לא הגיע לידי הממשלה, וחיש כאשר יהיו כל הכתבים ופרטי הכל בידיה, תמהר להציעם אל באי כח העם. בנוגה להשאלה האחרונה, השיב השר כי אמת נכון הדבר אשר טרם כלו בעל הועד במאדריד מלאכתם באו על החתום בכתב מיוחד אשר נספה אל כתבי פרטי-הכל אשר בו דורשים מהסולטאן להשוות את כל יושבי מלכותו במשפטי המדינה וזכיותיה. בא כח הסולטאן קרא אח״כ באזני הועד דברי המכתב מן אדונו הסולטאן אשר בו מודיע אליו כי כבר שלח פקודה נמרצה לכל שריו ופקידיו בכל מלכותו לבלי נגוע לרעה ביהודים בארצו יען בזכיות הארץ שוים גם הם אל יתר יושביה המושלמנים. במכה״ע Times מן יום החמשה עשר לירח זה נדפס מכתב מאת הרב החכם מהר״א לעווי ני׳ עשRevd. A. L5, סופר  להחברה ה' בדה „אגודת אחים"" בלאנדאן (Jew. Assoc) וזה לשונו בתרגום עברי: ראש חברת אגודת אחים, אשר בשמו אכבדה לערוך אליך, אדון נכבד, את הדברים האלה, נודע לו עפ״י הודעות רבות שכלן עולות בקנה אחד, מתועבה איומה שנעשתה בימים האלה לאיש יהודי כמאראקא, ואשר יבוקש להודיע הדבר ברבים, וזה הדבר: איש יהודי שמו יעקב אראהאן תושב עיר קטנה במאראקא שמה ענטיפא Entita חמל בשנה שעברה בשנת חבצורת על אשה מושלמנית אחת ואספה אל ביתו ויכלכל אותה בזמן הרעב, והיא בתודתה על טובו עזרה בעבודת הבית לאשתו. להעיר הנ״ל בא נציב חדש. ויהי בהודע אליו כי הרחיב איש יהודי להחזיק אשה מושלמנית בביתו ולכלכלה בשכר עבודתה, גמר בדעתו להעניש קשה את היהודי למ ישמעו אחיו וייראו ולא יזידון לעשות עוד תועבה כזו. ויצו לחבר את גוף היהודי אל הקרקע במטילי ברזל, ולחכותו בלי חמלח. משרתיו מלאו חפצו ויכו את האומלל עד כי מפלי בשר נתפרד מגויתו. ככה ענו אותו במשך שש שעות עד צאת נפשו. את גוית המת צוה להשליך בארוות סוסיו, עד כי נתנו לו בני העדה שמונים דאללאר, ואז נתן להם את אחיהם המת להביאו לקבר. מלבד זאת החרים את כל רכוש הנהרג ושם בכליו. והנה לפי הנשמע הבטיח סולטאן מאראקא זה מקרוב אל באי כח הממשלות במאדריד להגן גם על היהודים ונוצרים במלכותו שלא תאונה להם כל רעה. אולי ע״י פרסום התועבה הזו באמצעות מכתב עתך, יודע להסולטאן מעללי נציבו בעיר הנזכרת ואיך ממלא הוא רצונו״. עכ״ל ה. לעווי מדי הזכירנו את האיש הנכבד ה. לעווי הנזכר, עצור לא נוכל לברכהו ולהללהו ברבים, יען להשתדלותו הנמרצה לטובת זות כל בני עמו הנתונים בצרה, אין קץ; לא ייעף ולא ייגעלע אשר בכחו לטובתם, והוא רוח החיה באופני החבורה הנכבדה הנ״ל אשר רב טוב תעשה לבני עמנו. זכרה לו אלקי לטובה ולברכה."
044-MGD-1880-07-28-PG001-SINGLE-ORIGNAME_240249_toc_12,אויסטראליען," אויסטראליען באללאראט, סוף סיון תר״ס. לכבוד בעל המגיד! כבר חשבתי להודיע לקוראי המגיד חדשות מהנעשה בישראל בארץ הרחוקה הזו מעבר לים, אך לא מצאתי דבר הראוי להשמע בקהל. לדאבון לבי עתה בשורה לא טובה בפי זו: כי הרב הגדול החכם הנודע הרב דק""ק „מקוה ישראל"" במעל בורגע וראב״ד דכל ארץ אויסטראליע כש""ת מהו׳ ר׳ משה במהו׳ מאיר הכהן דינטעל זי״ע איננו כי לקח אותו אלקים. ביום כ״ח אייר עלה משה למרום, ונקבר למחרתו. כבוד גדול שה לו בלויתו לבית החיים. לא לבד מאחב״י גם מאנשים גדולים ונכבדים מא״י, כי האיש משה גדול וחשוב הי׳ בכל אויסטראליא וג״כ במדינת אחרות. מושלם הי׳ בכמה מעלות טובות, עמל וטרה מאוד לעזרת עניים בצרה. בן שבע וחמשים שנה הי׳ במותו. המנוח נולד בעיר הבירה עדינבורג במדינת סקאטלאנד בבריטאניא הגדולה. אבל אביו ואמו באו ממדינת הערצאנטהום פאזען. הי׳ במצב טוב, ועזב אחריו נחלאות וכסף הרבה לאשתו החשובה ותשעה בנים המתאבלים עליו בשברון וכאב לב. הוא הי׳ הרב הראשון הבא לאויסטראליא בסמיכת הרב הכולל בארץ בריטאניא דאקטאר הערשיל ע״ה. — ועמד לשרת בקודש במדינת האלו יותר משלשים שנים ת'נ״צ' ב״ה. גם אודיע למע״כ שהיתה בימים האלה בחירה חדשה במדינתנו לבית ועד הלאומי, ובין הנבחרים נבחרו ג״כ שני יהודים שם הא׳ הוא הסוחר הנכבד מיסטער אפרים זאקס והב׳ מיסטער לעוזין. נחמן שפיעלפאגעל יליד קאלאמעא בגאליציע."
