article_id,headline,text
044-MGD-1882-08-30-PG001-SINGLE-ORIGNAME_260253_toc_6,דרכי הרפואי)?מאת הרופא ל.גראססבערגער.( א...," דרכי הרפואה (מאת הרופא ל. גראססבערגער). אופן תרופת קדחת עזה.  המשך מגליון 25). הסמור (פראסט ה״ה הרגשת קור) הקל צריך, חולה הקדחת להרגיש טרם יעלה מן האמבטי מחגבר ועולה לעתים אחרי הושכב החולה למטתו עד אשר שניו וארכובותיו דא לדא נקשן (שיטטעלפראסט) עד אשר מוכרחים אנשי ביתו להדק אותו אל המטה, אע״פ שלמראה הזה ישומן הרואים ויאחזם שער בכ״ז אין בו שום חשש סכנה, כי אחרי עבור תני שעה או שעה יחם בשר החולה ויפלו חבלי שנה על עיניו ולעתים גם יזיע בשנתו שזהו סמן טוב לו. אם כן יפול הדבר, אז נשתה גבורת המחלה והחולה נמצא במדרגת קדחת הפשוטה והולך ושב קו לקו לאיתנו. אם קרות רגלי החולה אחרי עלותו מאבטי הרחיצה אז ישימו פוזמקאות לחים על רגליו — אחרי ששפשפו אותן (את הרגלים) ביד עד שנתחמאו מעט - ועליהם פוזמקאות נגובות א׳ או ב׳ צמדים. ואם בכל אלה נשארו הרגלים קרות אז יניחו כדים מלאים מים חמים אצלן. ללמאון החולה ישקוהו מים חיים (לא קרים מאד), ואם לא יצמא החולה יש להשקותו ג""כ כה וכה מעט מים חיים. על הרוב די בשתי רחיצות באמ. בטי במעל״ע, רחיצה אחת בבקר ואחת בערב, או אחת אחרי חצות היום ואחת כחצות הלילה, ובקדחת שהתום עולה למעלה ראש (40-41 גראד צעלזיום) כמו בטיפוס וכדומה די בארבע רחיצות, אחת לכל שם שעות. ואם עוסקין לרפאותו בכריכות לחית אז כורכין אותו עד בתי חלתי קודם הצהרים (בשעה שע״פ הרוב אין חום הקדחת גדול ומניחין אותו בתוך הכריכה הזאת ב׳ או ג׳ שעות. עד שיתם היטב, (אחרי עבור השעה הראשונה מניחין איזי פעמים תחבושת קרה על מצחו כדי לקרר את ראשו) ואחרי הצהרים, לפנות ערב, בשעות שהקדחת מתחלת לענות את גוף החולה כורכים אותו ג' או ד׳ פעמים זה אחר זה ומניתין אותו בכריכה הראשונה ברביעית שעה ובשנית כחצי שעה ונשלישית כשלש רביעיות שעה וברביעות כשעם, ואז לוקחין תחת סדין לח אחד שני מדינין שנטבלו במים (לערך 14 גראד) וכורכין אותו בהם אז יכולים להניחו בתוכם כפלים כשעור הכתוב. בכלל יש לשים עין על החילה בשעה שהוא כרוך בתוך הפריכה. אם רואים שהתחיל להתנודד בה וכה ושלחייו מתאדמים, ורקותיו דופקות אז נחוץ להוניאו מתוך הכריכה הלחה ולשפשף את בשרו במים. ובשעות שבין רחיצת אמבטי לרחיצת אמבטי או שבין כריכה לכריכה - נקוט הקורא, כלל זה בידך כי דבר גדול הוא! - ישימו על גוף החולה השוכב פרקדן מטפחת כפולה הטבולה במים (של 14 גראד או קרוב להם) ונסחטה מעט, מצוארו עד ארכובותיו ותכסה גם את הצלעות) ועליה ישימו מטפחת נגובה ועליה כסוי קל ומניחין אותה עליו עד שתהם היטב. אז מסירין אותה מעל החולה ומוציאין אותה החוצה (למען לא ישתח אויר החדר המשכב אנדיפתה) ורואצין אותה במים (בכל כריכה וכריכה צריכים לרחיץ ולנקות את הסדינים מהחלאה הדבוקה בהם) ומשימין אחרת על גוף החולה. בקאמפרעססען הלחים הגדולים האלה אשר הרופא המפורסם דר׳ גלייך במינכען הבינם וגם חקרם ויכניסם בשטת ההידראפאטהיע אחרי הצליח לרפא בהם לבד חולי טיפוס רבים צרורה מרפא יותר מבכל סמי רוקת שבעולם. גם אנכי הצלחי על ידן לא אחת ולא שתים חולי קדחת או דלקח אשר קרבה לשחת חיתם. ובפרט בבני אדם חרושים מאד שאין יכלת לרחצם באמבטי או לכרכם בסדינים לחים מרוב תולשתם, גדולה מאד מאד התועלת של הקאמפרעססען הלחים הארוכים והגדולים, השוים לפעמים גם יותר מכל אופני שמוש המים לרפיאה, והוא בזמן שאין כח החולה מרשה לעשות לו אופן תרופה אחר במים כאשר נוכחתי הרבה כעמים בהפראקסים ישלי. בקדחת הפשוטה והעזה בטותה פעולת המים לרפאות בהם אח החולה וכבר הורה זקן ההידראפאטהיע דר׳ מונדע: „עד מדרגת קדחת העזה בטוחה פעולת המים לחיים והנני מחשב לחרפה לתת למור תולי כזה״. לא כן במדרגת הקדחת החלושה. אמנם גם אז הגם עוד המים האמנעי היותר נבחר להשתמש בו לרפואה, אבל פעולתם איננה בטותה כמו במדרגות הקדחת הקודמות, כי במדרגות הקדחת הפשוטה והעזה שבהן תום עודף יותר מדי נמצא ונכר בגיף המגבר חילים (רעאנ- גירט) אז דבר קטון הוא להוריד מעלת חומו ולהסיר עי״כ כל סכנה מהאברים, הפנימים שהנשמה, תלויה בהן; לא כן במדרגת הקדחת החלושה שבה כת פעולת המיחרים (נערפענקראפט) כאין וכל רעאק- ציאן איננה נכרת בגוף, בזה כבד להגיד האותיות מראש ולהצליח תמיד בעסק הרפואה. בקדחת הפשוטה, והעזה משתמשים במים שנתמזנו על 18—14 גראד. אולם בקדחת החלושה (Torpor) שבה כחות הגיף נוטים לנפול דרושים לשמוש הרפואה מים קרים, מפני שבה תשש כת הרגשת העור ומים פושרים אינם פועלים עליו מאומה. אם החולה מתנודד באין מנותה למרות חלושתו ועיפות נפשו אז עושטין את כתנתו מעליו ומניחין אותו על גבי מדין על מצע רך (לא של נוצות) ורוחצין אותו במהירות אך משך רגעים אחדים במים קרים מאד (לערך 6 או 8 גראד רעאומיר) [בקיץ משימים קרח בתוך המים) באמצעות מטפחת שנטבלה בהם ולא נסחטה היטב או בספוג. בתחלה רוחצין את פניו, צוארו חזהו, זרועותיו בטנו ורגניו, אח״כ הופכין אותו באמצעות המדין שהוא שוכב עליו על נדו ורוחצין את ערכו ואת גבו מל צדו ורוחצין את ערפו ואת גבו מלמעלה עד מטה. שני ב""א דוחצין באחת כדי שירותן גופו ברגעים אחדים. אחרי הרחיצה הזאת עוטפין במהירות את המדין שהחולה שוכב עליו סביב גופו ומכסין אותו במכסה המטה. תכלית הרחיצה הזאת במים קרים היא לגרות ולהחיות את העור החסר רגש ולהשפיע אל תיכו דם (לרגלי החום שיולד בו אחרי הרחיצה בקרים) מעודף הדם המתנמצם אז באברים הפנימים. על כל פנים תשיג הרחיצה הזאת את נפש החולה לכהפ""ח על רגעים אחדים. אח״כ ממתינין עד שיתם כל הקף הגוף חתת מכסת המטה. ואם כחוס עור החולה תשוב גם אי-מנוחתו אז אוזרין ורוחנין אותו כמשפט הראשון אף אם לא עברה עוד מרחיצה הראשונה יותר מרביעית שעה, ואף אם מראה החולה לדעת כי קצה נפשו ברחיצה הזאת. ואם נראה שאחרי התחמם, הגוף אחרי הרחיצה הרגיעה גם נפש החולה ועורו מתחיל להיות רך ונודף ונשימתו כסדר ומראה פניו הוטב אז יחדלו לרחצו עד שיעברו הסמנים הטובים האלה. ואם כ""כ בטלה הרגשת החולה עד שהרחיצות הקרות האלה אינן פועלות על גופו מאומה אז מביאין אותו לתוך אמבטי שנתנו אל תוכה מים של 10 גראד בגובה חצי רגל ושופכין עליו איזו דליות מים מטעמפע- ראטור דומה (של 10 גראד) מגובה איזו טפחים, וב"" ג׳ או ד' ב""א משפשפין ותוככין אותו בכח במים הקרים האל עד שיראו בו אותות הרגשה ושיבת השכל לאיתנו. אז מעלין אותו מתוך האמבטי, ועוטפין אותו בלתי מנוגב בסדין ומשכיבין אותו במטה ומכסין אותו היטב וממתינין על הרעאקניאן של הגוף (עד שיתם עורו היטב) הבאה על הרוב אחרי עבור רביעית או חצי שעה. אם התחמם גוף החולה ובכ״ז עוד אבדו עשתנותיו אז תוזרין ושונין את המרחץ הקר ואת הערוי במים קרים. *) אבל אם הצליחה להשיב רוחו אליו והסכנה היותר גדולה חלפה, אז חוזרין ורוחצין אותו כקודם על גבי המטה במים קרים ובמהירות משך רגעים אחדים ככתוב. ואם החל עורו להיות רך ולהזיע ורוחו שבה אליו, שזהו סמן טוב, אז חדלו לרחצו עד שיזיע דיו ויבקש שתחדל הזעה. אבל אם נשארו חוסר ההרגשה והשכל גם בבא חזיעה, אז יכירו וידעו כי היא זיעת המות ואין תרופה לו. בקרחת החלושה אין צמאון להחולה, ר״ל איננו מבקש לשתות כי ביום ההוא אבדו עשתנותיו, לכן אל יחדלו אנשי ביתו להשקותו לעתים איזו כפות מים חיים. *) כמשפט הזה יעשה לו ב׳ ג' או ד׳ פעמים, הכל לפי אומדנא, ר״ל לפי אותות חיים הנכרים עוד בהחולה, ואם כל אלה לא הועילו לו להשיב אליו רוחו ונפשו אז אין ישועתה לו."
044-MGD-1882-08-30-PG001-SINGLE-ORIGNAME_260253_toc_7,דייטשלאנד," דייטשלאנד זאלצברונן, מ׳ אב תרמ״ב. לבעל המגיד! בטורים המעטים האלה, אודיע למרנא בעל המגיד היקר כי באתי לבקש רפואה ותעלה, ממעיני הישועה שתי עינות מים, למכאובי לב וצואר סם חיים, באר-מלח העליונה (אבערברונן) לשתיה רפואה טובה, ומים אחרונים חובה, באר רחים (מיהלברונן) מועלת היא לשטיפה. וזה האות שלא תהי׳ השטה מוחלפה, סימנא מילתא „רחים על צוארו׳, לכל השומע אל פקודת הרופא והמקיים מאמרו, וגם יש פה מרחץ הנקרא באר העליז""ה, לעצמות יבשות טל ותחי׳ גנוזה. גם בשנה ההיא רבו מספר החולים, והמבקשים מרגוע מערכי הגדולים, ובתוכם מספר רב עניים ואביונים, ואנשי גומלי חסד אנשי חיל יסובבו מבית לבית כמבקשי מטמונים, אבל אין הבור מתמלא מחוליתו. כי לרוב מתאמת בתר עני׳ אזלא עניותא — הוא האיש וזוגתו. גם גדולי ערך ומופלגי- תורה מקצות הארץ פה רחוקים נעשו קרובים, בתוכם יזהירו בשמותם כותבים וחוקרים ומליצים לקוראי המגיד ערבים, הרה״ג שטראשון מווילנא, החה״ג י׳ ב׳ וואלף מקאוונא הה״ג האחים וועכסלער מגאליציען ועוד מאורות אחרים וברורים מפאזען ברעסלוי ברלין וכל עברים. כל זה כתבתי בחצר — ולא אאריך כי הזמן קצר, וד׳ יתן למכאוב צוארי רפואה, ולכל חולי ישראל ישועה, ויסיר מעלינו שנאה ומשואה, ונשמח במקדם לקרא טורי המגיד ותהי׳ טובה השמועה. מוקירו כערכו הרם שב""ה."
044-MGD-1882-08-30-PG001-SINGLE-ORIGNAME_260253_toc_8,ענגלאנד," ענגלאנד לאנדאן, עש""ק כי תצא תרמ״כ. כחק שנון פלחה כליותי השמועה האיומה, כי יד״ג הרב החכם המשורר הנשגב מהו׳ חיים וואסערצוג ז״ל נאסף אל עמיו ביום אתמול ט׳ אלול בעיר ברייטאן מקום - הרחצה. עטי בידי ירעד על-מות האדם הגדול הזה אשר בהאלמת שפתיו נדמו מנצחי נגינות בישראל. — במדותיו היקרות היה צבי תפארת יהודי רוססיא ורצוי לרוב אחיו האנגלים, במשך הארבע עשרה שנה שכהן פאר במקדש ד׳ הוא ביה״ת איזלינגטאן. כבן ששים שנה היה במותו ויניח אחריו משפחה גדולה ד׳ יחייה, ואך למותר להעיר את בעלי חיים שיעשו חסד עם משפחתו היקרה גם אחרי מותו, כי נדיבי עם אלקי אברהם בפה יודעים את המוטל עליהם. שאי נהי „קאנין״, קנה והנה „לאמזא״, התאבלי , ווילנא"". הלילי „לאנדאן״ עלהקול קול יעקב הזה אשר לא תוסיפו לשמוע עוד עד אשר יקיצו ורננו שוכני ארץ. — ד׳ ישלם נחומים לאבליו ובתוכם גם לי הכותב בשברון מתנים משה קליין."
044-MGD-1882-08-30-PG001-SINGLE-ORIGNAME_260253_toc_9,פראנקרייך.," פראנקרייך. פאריז, ה׳ אלול תרמ״ב. לבעל המגיד! כאשר לא שבעה עיני מראות חזיונות יקרים במרוצת ימי מסעי בארצות הרבה: פה התולדה עם כל הודה התיצבה נוכח פני ושם שכיות החמדה מעשה ידי אמן הרהיבו את עיני; פה דבר חדש ומפעל נשגב השביע בצהצחות נפשי, ושם מנהגים זרים והליכות פראי אדם הרנינו את לבי, כן מחזה יקר ראתה עיני בעיר פאריז אשר אנכי יושב בה כעת, וכאשר נסיתו אז להודיע במכתבי העתים שמץ מחזוונות מסעי, כן אשמח אלי גיל כעת לדבר נכבדות בדבר אנשי אמונתי, ילידי ארצי, היושבים עתה בעיר פאריז. הן מודעת זאת כי אחינו אשר באו במרוצת הימים מארצות פולוניא ורוססיא עירה פאריז, הנה הנם לעדה כיום הזה וכמספר קהלות עיר ההיא תחד כבודה; רק בזאת היא מהן נבדלת, כי כל עדה ועדה אשר בזה היה לה מראש מנהל ורועה אשר הורה להן הדרך אשר ולכון והמעשה אשר יעשון, אבל יהודי רוססיא ופולוניא היו פה עת כביר כאניה בלב ימים באין משוט ובאין מלה ובצאן בלי רועה ואיש הישר בעיניו יעשה. ואל יפלא בעיניכם מדוע היו עד כה באין רב ומה שורש דבר נמצא בם? הלא לכו זמן ועת לכל חפץ, ומי יודע אם לעת העברה הגיעו למנהיג  כאשר דרוש לחפ ים, והנה עתה כאשר באה העת כי רב גדול בישראל נוהג בם אשר בכבודו יתימרו, מה מאוד ינעם לי להביע דברים על אודות המסיבות אשר התהפכו בתחבולות להביא את העדה הזאת עד הלום. זה שנים אחדות יושב בעיר פאריז איש חמודות מנכבדי עם ברלין ושמו יהודא שטערנ. היים ני' דאקטאר דער פילאזאפהיא; האיש הזה אחרי אש עשה לו שם בברלין בפעולותיו היקרות לטובת אחיו אשר אמנה רוחם עם אל, עזב את ארצו ואת מולדתו ואיה פאריז למושב לו. והנה גם בימי מגיריו פה ידיו לא תרפינה מעשות הטוב והישר כאשר יעידון ויגידון בתי הספר אשר יסדו ידיו להורות בם דת תלמוד ואמונה, כתוב וקרוא בשפת לשוננו העברית את ילדי ישורון. האיש היקר הזה בהתבוננו על יהודי פולוניא ורוססיא אשר ישבו ימים רבים באין מנהל ורועה, ודאג על אחיו כי יתעו בתוהו לא דרך, אז גזר אומר כי עת לעשות לד׳ ולאמונתו, ולבש עוז להעיר את הנשר הגדול מן קנו, הוא הגאון הגדול וצדיק נשגב כמהר״ר ישראל סלאנטער ני׳. כי יבא הלום למען תחיינה עיניו צופיות הליכות העדה ההיא והמכשלה הזאת תהי תחת ידו.  הרב הגדול ההוא בא אל עיר פאריז. שתי שנים תמימות התהלך לפני עדת רוססיא ופוילין, ובכל העת הזאת היה כעמוד האש להאיר לה באש דת ונר מצוה והטיף להם אמרות אלוה, וישם עין על דרכיהם. כה עברו שנתים ימים ור׳ ישר גע לשוא במשך העת למצוא איש כלבבו להקימו על, אשר יהיה בו כח להתהלך לפני בני פולין ורוססיא בפאריז, לפלס להם דרך והגד למו חוק ומשפט; זאת לא זאת, לא היה מוצא כסף הדרוש לחפץ הזה, והמעט אשר אסף הישר באדם דאק- טאר שטערנהיים ני׳ לתכלית הזאת לא מצא לו. והנה ידיד ואוהב מנוער היה לר׳ ישראל בעיר ווילנא ושמו ר׳ יהושע העשיל הלוי ני׳ חתן בן הגאון מהו' יצחק בן הגאון המפואר מהו' ר' חיים מוולאזין נ״ע. האיש הלוי הזה אשר חלה פתאום בשבתו במאריענבאד, שם לעיר פאריז פעמיו, מטעם הרופאים אשר החליטו כי אויר ארץ צרפת יהיה צרי מרפא למחלתו. ויהי בבוא הלוי שערי עיר פאריז וישמח ר׳ ישראל על האורח וידידו הזה שמחה גדולה, וישיש כי מצא עתה את האיש הדרוש לחפצו. ובאמת אחרי אשר בקש ר׳ ישראל ויפצר מאוד בידידו לרעות פה את עדת רוססיא ופולוניא כרוחב חכמתו יגורל צדקתו, נעתר לו ידידו לקחת את המשרה הזאת על שכמו. סוף דבר ר׳ ישראל הקים את ידידו הזה על, ועדתו מלאה אחריו בנפש חפצה, וילך ר׳ ישראל כאשר בצע את מעשהו מעיר פאריז, ור׳ יהושע העשיל ני' הוא שאול למשמרתו פה משמרת ד׳ והנה לשפת יתר יחשב להשמיע את תהלת הרב הגאון הגדול מחו׳ יהושע העשיל לעווין ולפאר את שמו בכבוד, יען כי זה כבר עשה לו שם כשם הגדולים אשר בארץ ביקרת ספריו וביחוד בספרו: „ציון יהושע״, אשר בו הראה לדעת את ידו החזקה על שדה התלמוד בבלי וירושלמי; אולם אשר חזיתי אנכי אספרה: ראיתי כי חכמי ונכבדי עיר פאריז יבואו לראות פניו ונותנים כבוד לשמו; בקרתיו במעון ביתו להתענג על נועם שיחו, וארא כי הנני נצב לפני חכם מלא ברכת ד׳, לפני איש שחוברו לו יחדיו תורה חכמה ויראת ד׳; הלכתי לעתים בהיכלו לשמוע את מדברותיו אשר נשא במקהליו, והנה קסם על שפתיו, מוסר ויראת שדי תבענה שפתיו בלשון למודים בדעה והשכל, וברוב לקחו התורה והחכמה, האמונה והמדע אחת באחת יגשו, משלכות אשה אל אחותה יתלכדו ולא יתפרדו. זאת תורת האדם המעלה ר׳ יהושע העשיל הלוי, אשר ידיו תעשינה תושיה לטובת עדתו ולכל גולי רוססיא הבאים הלום, בהתאמצו להחזיקם באמונתם בטהרת הקודש. אשרי עדתו כי חבלים נפלו לה בנעימים. מיכאל זלמן קראלל איש קאליש."
044-MGD-1882-08-30-PG001-SINGLE-ORIGNAME_260253_toc_10," 
שוועדע","   שוועדע שטאקהאלם, בירח אב. המ״ע באונגארן כותבים כי ראשי העפאנגעלישעס גימנאזיום בעיר Szardas גזרו שהתלמידים היהודים ישלמו את שכר הלמוד (שולגעלד) כפליים, ל הסך של התלמידים הג וצרים; זאת הוא צדקת הארץ החפשה  ארן! — היהודי מאזעס ראצשא באונגארן אשר נשא אשה נוצרית ואשר הוכרח אחרי מות אשתו לגדל את בתו בדת הקאטהיליקית המיר דתו למען לא יפרד בענין האמונה מבתו. הקיסר מאשכנז נתן רשות להנבחר הנודע לודוויג לעווע לשא את אות הכבוד מענודיע ארדען ממדרגה שניה אשר כל מאת השולטאן. — החכם דוד ראדנער בווארשויא  ק כעת להעתיק ללשון עברי את הספר: לעהרבוך דער יידישען געשיכטע אונד ליטעראטור מאת ד׳ דוד קאססעל בעיר שטיינאמאנגער באונגארן התחילו צוררי יהודים לעשות מהומות כדרך ארעא בימים האלו, אבל פקידי העיר שלחו אחרי אנשי מלחמה והכניסום בבתי יושבי העיר (בירגער) ומיד ושו הבירגער את הפקיד היתה עול הפרנסה כבד מנשוא ו (אבערגעשפאנן) להוציא את אנשי המלחמה מן העיר והפקיד רצה  ולאות את הבקשה אך בתנאי שהאזרחים יהיו ערבים לקיים את שלום יושבי העיר, ולמען לסיר מעליהם את עול החיל יסדו חברה פאליצייא קאמיטע מש מונים חברים וגם המכבי אש (פייערוועהר) אמרו לתמוך את אוהבי שלום והאחדות בעיר הנ״ל. — בעיר Lausanne בצרפת נוסד ועד לתמיכת גולי רוססיא והאיש הנודע Victor Hugo אוה לישב בראש Torduemada הוועד (פרעזידענט) ושלח את ספרו הספור להיות בין הדברים אשר יפילו עליהם גורל והסך הנגרל יבוא לקפת הוועד. — בבית החולים לישראל בברלין נמצאה הולנית מארץ פאלען ונודעת לכל בשם: „אונזער לינכען, הנה זה כשלושים שנה אשר הובאת להבית החולים ומשך שתים עשר שנים לא עזבה את ערש דוי, ובכ״ז לא כהתה עין שכלה ולפעמים תענה בדברי שחוק (איראניע) אם נשאלה על איזה דבר. המ״ע מהללים אותה על שלות נפשה בעוד גופה סובל מכאובים קשים. — היהודים הפולאנים בעיר עסטערזונה במדינתנו יסדו חברה לסעוד ולתמוך את האביונים בהעיר ובהגליל; המיסדים שלחו אלי את התקנות לבהון ולתקן אותן לפי ראות עיני, ושמחתי מאוד לראות כי אהבת רעים מצאה קן בכל מקום, בכל מושבות אחינו ב״י. אחר העיון וההבחנה Lowysohn. אשלח התקנות לבעליהן."
