article_id,headline,text
044-MGD-1876-02-23-PG001-SINGLE-ORIGNAME_200063_toc_10, חדשות שונות,"  חדשות שונות אחד ממה״ע הצרפתים לקח לו עת לתור בדברי ימי העולם ולמנות, כי מיום מלוך מלך בארץ מלכו 2540 מלכים על ששים וארבעה עמים. מן המלכים האלה נהדפו 299 מכסאותם. 64 לא חפצו בעצמם להחזיק עוד יותר השרביט בידם, עשרים טרפו נפשם בכפם, עשתי עשר השתגעו, מאה מתו במלחמה 123 הלכו שבי, עשרים וחמש מתו אחרי סבלם ענויים קשים (מערטירערטאד), 151 הומתו על ידי כלי מות, 62 על ידי סם המות ומאה ושמנה נחרץ משפטם למות. — בארץ רוססיה למדו בשנת 1875 מאה ושבעים ואחת נשים את חכמת הרפואה, 102 מאלה הנה מבנות האצילים, 17 ממשפחות גדולי הסוחרים, 1 מבנות יושבי החנויות, 12 מבנות הקדושים (גייסטליכע) ועשרים וארבע מבנות אזרחי הארץ מן הנשים האלה 23 הנה מבנות ישראל, 12 ארמעניות, שלש פראטעסטאנטיות ויתרן הנה מאמונת הארץ. 23 מאלה נשואות הנה. — 53 מהנה קבלו מן הדעקאן התעודה כי עשו חיל בלמודן. ש״א. קאוונא. (ספרים הנדפסים) בארץ בריטאניא יצאו לאור מבתי הדפוס 5,200 ספרים, מהם חדשים מקרוב באו 3,587, אשר דפסו בהוצאה חדשה 1,330. 311 אשר הובאו מארץ אמעריקא. 556 יכילו בקרבם בעניני האלהות, 664 ספרו ליטעראטור, 445 ללמד להועיל ,490 ספרי מסעות, קורות הימים. (מעשה השכר באנגליא) פאבריקא אחת עושה שכר בלאנדאן שלמה במשך שנים עשר חודש, למסילת הברזל בעד חובלת דברים הנצרכים למעשה השכר 42,000,000 פראנקס מזה נראה עד היכן מגעת מעשה השכר באנגליא. (שדה גפרית) על הרי הומבאלדט באמעריקא הצפונית לא רחוק ממסילת הברזל נמצא גפרית למרבה עד כי לפי השערתם. תוכל להיות למסחר בעד איירופא ואמעריקא על איזה מאות שנים. נוסף לזה כי גפרית ההוא זך ונקי. יוכל תומ״י לבוא במכירה. מ״ע „ווראצ. וויעד."" מודיע, כי אלה אשר שלמו חק למודם בבתי מדרש הרפואה, ואשר הפיקו רצון בעיני המורים, מהיום והלאה, יהיו לרופאים מבלי לעמוד על המבחן פעם שנית, בתנאי וויען לרגל למודיו, חש כעל כנפי נשרים לעירו למקום המהפכה אשר היה למשכן רפאים. עד עתה לא צלחה עדנה לפקידי הפאליצייא להתחקות על עקבות המרצחים ושודדי ליל, אשר במחשך עשו מעשיהם, ולתור את מקום תחנותם. דוד הלוי בירנבוים.  וועו הנעדניעפראווסק (מחוז יעקאטערינסלאוו), בחדש שבט. שבעה וויארסט הרחק מעירנו בכפר רים בבית המשתה נהרגו בליל ארבעה עשר לחדש יאנואר אם על ארבעה ילדיה באכזריות נוראה. נוצרי אחד אשר בא אל הבית לשתות משתהו ראה והנה כולם פגרים מתים, בעלת הבית שוכבת שחוטה, ושני נערים בן שלש עשרה שנה ובן ארבעה וילדה בת שש שוכבים שחוטים. ילד רך כבן שנה מתבוסס בדמו בטנו בקוע ומעיו נעקרים. הנוצרי יצא החוצה ויצעק צעקה גדולה, ויאספו כל בני הכפר לקולו, עד מהרה הודיעו לשר העיר ולאב האובד אשר להצלחתו או לרעתו לן בעיר בלילה הוא. ולא אחרו השרים מלבא, ואחרי חקרם ודרשם היטב מי ומי הי׳ שם בלילה ההוא הפילו עין חשד על נוצרי אחד תושב הכפר, אשר היה שם עם איש לא נודע. והוא הודה על זעליג ראבינאוויץ חטאתו אשר עשה. פוחאף, א״ך טוב לח׳ שבט תרל״ז לפ""ק. אזהרה בענין הכשרות לחגא דפסחא, בעוד שהוא עת להזהיר, לקהילוו הקדושות ולהרבנים העומדים על המצפה יצ״ו! הנני מוכן בזה, כפי שהוא בידי, וכפי שעומד תחת משמרתי ליתן את עיני עליו, שלא יארע חיו מכשול: המה המשקה יין שרף שנקרא סליוואוויט וקראנאוויץ. ופירות היבישים, דרמסקן (שנקראו צוועטשקן) ואנסים (בירנע) ותפוהים יבישים שמתיבשים לרוב בגליל שלי, כי לדאבון נפשי, המה רוב עם המתפרצים בדבר כן הבעלים כמו הקונים מהם, שרוצים להשביר את מכרם למכור ביוקר לשיהי׳ מי שיהיה, אומרים שנעשו בשמירה מעולה. לכן קמתי אני החתום מטה להזהיר שלא יתן שום בר ישראל נאמנות לאיש שאין לו כתב תעודה בידו, שנעשו הדברים הנ״ל כדין וכדת בהכשר גמור, בלי שום חשש חימוץ. ולא לבד ממני, כ״א או מהרב הגאון דק""ק טרענשין ואיללאווע, או מהרב הצדיק דק""ק וואג ביסטעריץ. השומע לדברי ולא מסיר אזנו מהם ישמע גם השי״ת לתפלתו אכי״ר. שמואלדייטשלענדער רב ומו״ץ בק""ק פוחאף והגליל. אם יביאו ליום הכסא בבית מדרש הרפואה, שימת עין עליהם (דיסערטאטיאן) מרופא מומחה. א-ע-ז. ד פאדבראדז. עיר מצער קרובה לווילנא כחמשים וויארסט שפטה ד׳ באש, אשר יצאה בסוף חדש טבת, ואכלה הרבה בתים. כשנים עשר משפחות יצאו ערומים מבלי לבוש ובחוסר כל והאחרון הכביד, כי בית המדרש האחד שמגדלין בו תורה ותפלה היה לשרפת אש עם כל מחמדיה ספרי קודש הנדפסים אשר בתוכו. ויען כי אין לנו לחכות שימלא החסרון מנדבת אנשי עירנו, ומהקרובים לה בעת רעה, לכן הננו מודיע צערינו לרבים, לעורר רחמי בני ישראל המרובים להיות לנו לעזר ביד נדיבה להסיר חרפת רעב מהעטופים ברעב, ולהקים בית המדרש מחדש, למען יהי׳ מקום לשפוך שיחנו לפני ד׳, החפץ שלוח נדבה ישלח על אדרעסס הרב הגאון מוה׳ יצחק אליהו לנדא מ״מדק""ק ווילנא. דברי המעתיר שלמה גדול החונה פה ק״ק הנ״ל. מנסק, י״ט שבט. מכ״ע ממאסקו ומפ״ב מודיעים: כי הממשלה תיחד אספה מיוחד באחד מבתי משפט הגבוהים, אשר מטרתה תהיה אך לשום עין פקוחה על כל דרכי העברים במלאותם את חובם בעבודת הצבא הכוללת, כי ימלאוהו באמת ואמונה. — אין כל ספק כי תכסף נפש כל איש מאה״בי לדעת מה עול מצאה הממשלה בנו כי רחקה ונשתה אמונתה ממנו, אחרי אשר ראינו כי בכל עיר ופלך באו בני הנעורים בלב שלם ובנפש חפצה מקצה ארץ רוסיא ועד קצה! אל בית האסף לעבודת הצבא, גם הבנים היחידים לאבותיהם, אשר עפ״י החוק נקיים המה לביתם ולא יצאו בצבא, באו להמועד הנכון; ואך שקר בדי מה״ע ומחזות- מהתלות שוא חזו מוציאי דבה עי בנ״י בטרם החל חוק עבודת הצבא הכוללת לצאת לפעולת אדם. — אך אחרי כי עיני הממשלה משוטטות בכל ועיניה פקוחות על כל דרכי העברים ומעלליהם נוכל, לדאבון לב כל אוהב עמו לדעת כי חפצה להוסיף שומרים גבוהים מעל גבוהים, כי מצאה בערים קטנות אחדות, כדרכן תמיד לסכסך שם איש ברו  שרשים פורה ראש ולענה: אנשים המבקשים תואנות להבדל לחפשה מכל עבדי רוסיה להמלט מעבודת הצבא. לכן לא למותר יחשב בעיני להודיע זאת, למען יחפשו אנשים כאלה דרכיהם, ולא יוסיפו, בחטאתם, להביא תלונת הממשלה שלום לאסיצער. וקצפה על כל עדת ב״י. קראקא, בירח שבט תרל״ו. ביום אתמול בא הנה הקאר. דינאל לעדאכאווסקי אשר לפני ימים אחדים יצא לחפשי מבית האסורים אשר ישב שם ימים רבים, על עשה מעשים נגד חקי הממשלה, ונתקבל בכבוד גדול מאת הקאטאליקים דפה. בחצר מסילת הברזל חכו לקראת בואו הבישאף וכל הכמרים דעירנו ואנשים למאות ולאלפים, ומכל עבר ופינה התנוססו דגלים מצבעים שונים ובעת ירד מעגלת הקטור צללו אזנינו מקולות הפעמונים אשר צללו לכבוד האורח הזה. כפי הנשמע בדעתו להיות פה ימים אחדים! עוד מודיע מה״ע הנ״ל כי בעיר סטרי נסגרו מטעם הממשלה כל החדרים, ועל ידי זה נתרבה מספר התלמידים מבתי הספר אשר להם בערך שלש מאות. שאול בן זאב שודמאק. קראקא מעיר טשערנאוויץ מודיעים למ״ע נייע פרייע פרעססע מהרצח הנורא שקרה בעיר איסמאיל במאלדוי הקרובה לעיר ההיא. כחצות חלילה באשון חושך ואפלה באו אנשים רוצחים ושודדי ליל, ובמסכה נסוכה על פניהם, בבית הרופא הנודע דר׳ ראזענטהאל ואחרי עשותם את מזמתם הרעה לחכות את נפש הרופא וכל משפחתו אשתו ושלושת בניו מכת מות, שדדו ישימו בכליהם עשרים אלפים אדרכמונים (?) וילכו לדרכם. כאשר פרשה לה השמועה הזאת כנפים בעיר טשערנאוויץ הסמוכה לשם, כל גבר שמח ידיו על חלצים, וכל לבב דוי, כי כשמן תורק שם הנרצח כי נכבד ונודע לאיש יקר היה לכל מכיריו. כשמע זאת בנו האומלל המתגורר כעת בקמ״ר"
044-MGD-1876-02-23-PG001-SINGLE-ORIGNAME_200063_toc_11,שאוועל.ביום ז' שבט שבק חיים לכל חי הרב ח...," שאוועל ביום ז׳ שבט שבק חיים לכל חי הרב הג' סו״ה הר״ר חיים בהרב הגאון הצדיק הנודע ומפורסם ברוב צדקתו וחכמתו הר״ר אייזיק ראבינאוויטץ זלה""ה. הרב הנכבד הזה ישב על כס הרבנות בשאוועל ומלא מקום אביו זה כחמשה עשר שנים והיה אהוב ונכבד בעיני כל אנשי העיר, כי היה אוהב את חבריות ומקרבן לתורה ולחכמיה, ויצאה נשמתו בטהרה בשנת ארבעים וחמשה לימי חייו. כבוד גדול עשו לו אנשי העיר שאוועל, כל החנויות סגרו על מסגר ומקטן עד גדול נאספו לבהמ״ד לגמול לו החסד האחרון. הרבנים הגאונים הר״ר מיכאל בהר״ד והר״ר אליעזר לונץ ספרוהו כהלכה בבהמ״ד פנימה, והרב זכולון ליבבריט מקראז ועוד עמק הבכא מ״מ לעדת הסגדלרים ספרוחו בחצר בית המדרש ולא נתקררה דעתם של הקהל עד אשר שלחו טעלעגראממע להרב הגדול בתורה ובחכמה הר״ר צבי הירשכהנא מ״מ דק""ק קאוו נא. ואנכי זכיתי לשמוע את ההספד אשר נשא עליו הרב בחנא ביום י״א שבט, צוף דבש תחת לשונו, וה׳ נתן לו לשון לימודים לדעת איך לכלכל דבריו במשפט וידרוש גם בכבוד מלך ודבריו חוצבים להבות אש. ואני תפילה לנורא עליל שיזכנו לשמוע ולהשמיע ישועות ונחמות ויתן לנו שנת חיים וברכה שנת פרנסה והצלחה כחפץ המתאבק בעפר רגלי החכמים כל הימים. הכו״ח פה יאנישאק י״ד שבט תרל״ו. יהושע בן חיים הלוי המכונה יח״ס מז""ח."
044-MGD-1876-02-23-PG001-SINGLE-ORIGNAME_200063_toc_12,"סופרי-רומי העתיקים ובני ישראל
מאת חג ווידאווער הלוי."," סופרי-רומי העתיקים ובני ישראל מאת חג ווידאווער הלוי. (המשך מגליון 7). אכן כל קורא בעין בקורת את קורות ב״י וקורות הרומיים בימי הקסרים בפרט, ילמוד עד מהרה לדעת שלא מחסרון ידיעה דברו חכמי רומי רעה על ישראל ודתו, אדרבה יותר אשר למדו לדעת מהות דת ישראל כי נשגב ומאד נעלה הוא על כל דחות בימיהם, יותר אשר למדו לדעת, חין ערך תורת ישראל כי בחכמה יסודה ובאהבה מקורה, יותר האריכו לשונם ויפטירו בשפה וישפכו בוז ולעג על אמונת היהודים! יען מה? יען כי אש הקנאה קדחה בלבם, וחמתה בערה בם! ואם תשאל אותי לקנאה מה זו עושה? אען ואומר לך: דע שלמן היום אשר נפלה ממשלח הרעפובליק לארץ, ורומי היתה לגברת-קסרית, גברת ממלכות, נפלה ג״כ קרן עבודת-האלילים (היידענטהום) פור התפוררה הר אלימפוס ויהי כגבר אין איל. בין הסבות הרבות אשר הסבו מפלת ההיידענטהום היתה ג""כ עבודת החכמים המשוררים והפילוסופים אשר ברוב שקידה הפיצו אור התבונה בקרב ההמון, ורובם ככלם ירו חצי לעגם והתלתם על האלילים הרבים והשונים, וכהניהם הגדולים והקטנים על העבודה הזרה והנבערה, על האולת אשר במו צרורה, ועל הערמה )ato( אשר לפניהם למטרה, עד כי מרגלא הי' בפי כל דברי קטא לאמר „שני כהני אליל לא יוכלו להביט איש בפני רעהו, מבלי מלאות שחוק פיהו״. האמנם, שמאד נקל הי׳ להמשוררים והפילוסופים להבזות אמונת הבל ואין מועיל, מאד נקל הי׳ להם להראות לההמון שהולכים אחרי ההבל ויהבלו, שכל חלומות האורקיל שוא ידברו, שהכהנים לוקחי נפשות וצודי לבבות ולובשים אדרת שער למען כחש, כן הוא, נקל הי' להם, להסיר החבלול מעיני העם ולהראות להם שהם עירומים ואין אמונה נאמנה להם וכי כל האידולטריא על קורי עכביש וקוי תוהו ובוהו נבנתה ודברים שאין ממש בה, וכל בר דעת ירחק נפשו מנחכה, אכן החכמים האלה שכחו שכאיל תערוג על אפיקי מים כן נפש האדם תערוג לאמונה, ובאין חזון האמונה יפרע האדם ויהי' לפרא מדבר והפילוספיא לבדה לא תוכל להפיק כל רצונו, ולא תוכל לשבור כל רעבונו! על כן לא תחמה על החפץ לראות בימי הקטרים הראשונים, המונים המונים מאנשי רומי, גם ממרום עם הארץ, גם זקנים (סענא- טארען) ונשי-חיל קבלו עליהם דת ישראל ברוב ששון. גם רבים אשר לא נכנסו בבריתו של אאע״ה לא נמנעו מתח כבוד בפרהסיא לאמונת היהודים, וגם רבים מהם שמרו את יום השבת, וישלחו תרומותיהם ומתנותיהם קודש למקדש ירושלים, גם אוגוסטום ואשתו עשו כן. (עי' גרען ג') אבל מספר-הגרים נתרבה מיום ליום, והגרים מילידי רומי אשר עלו לרגל ירושלימה עם יהודי רומי היו רבו מארבה (או""ג, מפעלות ג׳, יוסיפון מלחמות, ז׳, ג׳,) ועתה צא וחשוב והגע בעצמך אלו היתה אמונת היהודים אמונה - פרופגנדית, אז מה נקל הי׳ להרחיב גבולית ולהרים שבטה על כל הארץ, אבל אמונת-ישראל לא היתה מעולם רודפת אחרי גרים, ונהפוך הוא עוד תזהיר ותאיים הבא אליה להסתפח בנחלתה ובותנת ובודקת למצא לדעת אם לא שמץ פסול השיא אותו או אותה להחגייר „באיש שמא נתן עינו באשה, ובאשה שמא נתנה עינה בבחורי ישראל״. ככה היתה מעולם — היודאיזמוס לא אלץ לשום אדם לבא ולחסות בצלו. אבל יהיה איך שיהי', אמת ויציב הוא שבימי החסרים הרומיים, כדגון אשר נפל לפני אדון ד׳, ככה נפלה אמונת-האלילים, לפני אמונת הישראלים, נפלה ולא תוסיף קום! וגם אחרי אשר מקדש אל הי' לבער ובת ציון הלכה שבי לפני צרדרומי, בכל זאת רבו המתיהדים וסגרים, כל כך. שהסופר סיניקא אמר עם הספר „ראה והשתומם, הנכנעים (בעזינטע) מושלים על מכניעיהם, ונותנים חוקים לנוגשיהם זאת, רק זאת הפיחה אם הקנאה והשנאה בלבות הסופרים החכמים, וכל דברי מלשינותיהם מלאי ארס הקנאה הקשה כשאול! החכמים ההם דמו בנפשם כי בגרשם האמונת האלילית מקרב הארץ, גם כל חשק וחפץ לדעת אלקים, כלה יגרש, ואז רק חכמתם בחוץ תרונה, ויד חכמתם תהיה על העליונה, ועתה תקותם מפח נפש היתה, ואשר לא פללו לראות עינם ראתה, שברגע אשר העם בכלל החלו לגרש ענני האלילים אשר כסו שמי-חייהם, מיד ראו והתבוננו כי לבני ישראל הי׳ אור במושבותיהם, וכל איש בהם החפץ חיים ישרים ותמימים החזיק בכנף איש יהודי לאמר „לכה ונלכה באור ד' אלהי ישראל"", זאת היטיב חרה להפילוסופים מנהלי העם, ולכן בקשו תואנה לשפוך בוז על אמונת ישראל ולהגיד נגדה נא כל עם רומי שלא לבד בהמיטולוגיא היונית ורומית נמצאות דברי הבל ורעות רוח אבל גם באמונת ישראל נמצאות אמונות טפלות, ודת-ישראל נתיסד על דברי-רות! ככל החזיון הזה חזו חכמי-רומי למען הבאיש ישראל ודתו בעיני ההמון ולתת היהודים לשמצה לפניהם, אף כי ידעו היטיב שהיהודים היו אנשי תמימי-דרך בכל עסקיהם עם הרומיים ואשר לכן נתנו להם מראש ומקדם שווי-זכיות (יוסיפון קדמוניות י, ו, י""ד) וכאשר העיד על ישראל כמפיום טריגוס Justitia בימי אוגוסטוס לאמר שצדקת ב״י נוסדה על צדקת אמונתם  oruבכל זאת מרוב קנאה ושנאה חרשו רע וא  על תכונת נפש ב״י לתת אותם לאנשי בליעל. אף כי ידעו היטיב שאין ליהודים כל פסל וכל תמונה ועבודת-אלהי ישראל טהורה היא, ותפלת ישראל זכה, תפלה לאל אמת אשר אין לו גוף ואין דמות נערך לו, וכאשר העיד הסופר הרומי הקדמון ברא (Varo) באמרו „שמנהג ישראל הוא לעבוד ד׳ בלי שום פסל ותמונה, והלואי הי'. המנהג הזה שורר ג״כ. בין הרומיים כי עתה עבודתם היתה ג״כ בלי חלאה"" וגם טציטוס בעצמו אמר עם הספר ""שפמפיום בבואו למקדש ישראל בירושלים השתומם לראות שאין בקדשי קדשים שום פסל ותמונה"" בכל זאת הקנאה קלקלה השורה והפיתה כזבים בפי טציטוס, ועשה לשקר עטו, וסוחר דברי עצמו ובפה מלא רשעה אומר במקום אחר „שהיהודים עובדים לחמור, כי ראש- חמור נמצא במקדש ישראל״! (סוף יבא)."
044-MGD-1876-02-23-PG001-SINGLE-ORIGNAME_200063_toc_13,הצופה להמגיד, קנאה בבוערים. הצופה להמגיד
