article_id,headline,text
044-MGD-1883-03-14-PG001-SINGLE-ORIGNAME_270083_toc_1,," שנת העשרים ושבע  ויאמר י. יוצא לאור פעם אחת בכל שבוע. מחירו בארצנו 12 מארק לשנה, 3 מארק לרבע. בעסטרייך 8 פל׳ ע״זו לשנה. 2 פל׳ ע״וו לרבע. בשארי ארצות 20 פראנקם לשנה. כל איש יוכל להשיגו ע״י כל פאסט-אמס ובוכהאנדלונג בכל המדינות. כל החפץ להודיע א דבר מה ברבים לטובתו עליו!  לשלם שכר הדפסה בעד כל שורה? 20 פפ׳ ."
044-MGD-1883-03-14-PG001-SINGLE-ORIGNAME_270083_toc_2,תוכן הענינים," תוכן הענינים מצב השנאה לישראל כעת. עט-סופרים: בן שלשים וחמש שנה אנכי היום. דברי שלום ואמת: על המדינות בו יאמר: ענגלאנד: מאנשעסטער, רומעניען: גאלאטן. הערה ואזהרה: רוסלאנד: גרעזי. אזיען: חיכו. חדשות בישראל: מגיד משנה: הודעות."
044-MGD-1883-03-14-PG001-SINGLE-ORIGNAME_270083_toc_3,"מצב השנאה לישראל כעת
(סוף מגליון 10)."," מצב השנאה לישראל כעת (סוף מגליון 10). ב) אלו היינו יכולים לקות שצוררינו משפט ויושר דורשים יק ישגו במשפטם, היינו שמים לפניהם השאלות ששם לפניהם הסופר הנאור בערנע: מדוע תמאסו ברופאים יהודים? ומדוע לא יהיו יהודים יודעי-דת-ודין? האם יכתבו הרופאים היהודים את פתקאות-הרפואות בשפת עברית? האם ירפאו היהודים את נגעיצרעתכם ע״פ תורת כהנים? האם יעשו מלטה ויקחו נשך ברפואותיהם? האם ילמדו היהודים את דיני וחוקי הארץ מספרי התלמוד״? — אך אם נשאל כזאת לא נמצא מענה. התשובה האמתית היא פשוטה: רופא יהודי יעבוד כל היום מבוקר ועד ערב, לכן יגדל עלינו; חכם יהודי נעלה הוא ברוחו עלינו, לכן הוא עלינו למשא; המליץ - בבתי-המשפט העברי פי שנים לו ברוחו עלינו, לכן יעלה מן הארץ. זאת היא התשובה האמתית על שאלתנו ונגדה לא יועיל שום הגיון ומליצה; קשר השנאה הוא קשר של-קימא והוא לא יותר רק ע״י החרב! שנאת ישראל בהתמונה הזו תשאר לעולם, או לכל הפחות עד הימים שעליהם נבאי חוזי-עליון, אשר כפי הנראה, לא יבאו בקרוב. בכל זאת יש הבדל גדול אם ישנאונו צוררינו במקום דרכם ללכת ולחזיק לנו או במקום שאינם גורמים לנו היזק בכל שעה. גם עם צרפת איננו אהוב בעיני עם אשכנז, אך את לא תזיק לו מאומה. כל העמים עינם רעה בעם ענגלאנד החרוץ במלאכתו, אך אם ידברו בגנותו המה דומים להכלבים הנובחים נגד הירה; - הירה יקר הולך ולא ישים לבו לקול נביחתם. אם ישפיל טרייטשקע כבוד חכמי ענגלאנד לא ישימו המה אליו לב; אך אם ישפיל כבוד חכמי ישראל, הרי הוא משפיל אותם בעיני עם הארץ ומפריע אותם להתקרב אל העבודה שבח בחרו. בעת פרצה השנאה, חרבו הרבה לדבר משנאת-הדת. עתה לא ימצא עוד אף אחד שבינה ישרה בו, שיחשוב התנועה נוכחית לתנועה-דתית. דורנו הוא דור השכל ודעה והנהו וחוק מהדת. מקור ההתחרות והשנאה הוא רק הקנאה בבעל חכים בכלל, וגם כהני- חדת בברלין החסידים וחותיקים לשם ממון מתכונים. מסיבה זו נפקחו עיני ממשלות רבות להבין כי תנועה זאציאליסטית מניעה גם תנועת האנטיזעמיטים, ולכ החלו לשים מתג ורסן בפי הצוררים. מה שדבר הענריצי בפומבי לא נועזו לדבר גם העזים שבהזאציאליסטים, אך הענריצי דבר בשם שנאת- היהודים בעוד שהאחרונים דברו בשם השנאה לבעלי הכיס בכלל, ולכן שמה הממשלה עיניה בהתנועה ההיא. השנאה לא תמות, אך החברה הנוכחית מחויבת גם לטובת בטחונה להגין על היהודים. החרב שלוטשים שטעקקער ומרעיו נגד היהודים מוכנת הוא לכל בעלי הכיס. באותו ההגיון שיכנה שטעקק את חכמי וגדולי ישראל עם חכמי וגדולי הליבעראלים בשם יהודים ובני בריתם"" יכנו אחרים את כל בעלי הכיס בשם „יהודים ובני בריתם"" בלי הבדל בין אמונה ואמונה. הקאנזער- אטיפים אמנם מאמינים לעשות רעה להיהודים, אם הציעו להטיל מס כבד על אילי הכסף באי כח הבערזע; אך בזה לא ידעו רק ליהודים פרטים שהתעשרו על הבערזע ולא לכלל האומה. אך אם יוסיפו להסית העם בהעשירים היהודים ישכחו בני העם הכנוי יהודים"" והשנאה תצא על כולם. הזאציא- ליסט ליעבקנעכט הלא אומר, כי אחת היא לו אם נמצא העושר בכסף (כהיהודים) או כי נמצא בנכסים (כבעלי האחוזות הגדולות מבעלי ברית הממשלה). זאת ישימו בני חברת שטעקקער אל לבם! במדינת אונגארן נראה את שנאת ישראל במקומה הראוי לה, בחברת הזאציאליסטים! השר טישא בשם הממשלה ובשם החברה הנוכחית משתדל בכל כחו לעצור בעד הרעה. הוא האחד שהבין להיכן הדבר נוטה; אולם ספק גדול הוא אם יעמדו כל בני העם לימינו לאורך ימים. סכנה גדולה היא לישראל בשאלת היהודים. כל זמן שיהיו בני ישראל נפזרים ומפוררים לא תוסר הסכנה הזאת מעל ראשם. אם תתפרץ מלחמת אזרחים באיזו מדינה ויהרסו אשיות החברה, יהיוהיהודים ח״ו הראשונים להרג ואבדון! זאת ברור הוא, ואלה מאחינו המאמינים לשבת במנוחה, יען כי כבר נאלמו שונאיהם, מביאים אסון לעצמם. בצדק אמר הסופר ווילהעלם חויף בספורו „היהודי זיס"" (אפפענהיים), את החוטאים הנוצרים הצילו מקרים שונים, קשר משפחה, השתדלות ידידים ואוהבים ורחמי בני ברית; אבל היהודי שחסר לו אוהב ומציל נלקח בעד כולם שנאת ישראל במקומה עומדת; התמונה שנתה מעט פניה. אך חלילה לנו לחכות עוד הפעם עד כי יקרמונו ימים רעים. את זאת מבקשים אנחנו מאחינו שימנו מספר חללי עמנו שנהרגו במשך אלפים שנים וכי ילמדו מה מספר התולדה; עליהם להשתדל למצוא תרופה כוללת, לא לסתום מקור המשחת, מקור השנאה, כי זה מן הנמנע, רק להתרחק מהסכנה. אחינ אומרים: מה נעשה? על זה נשיב: השתדלו לכוין את השעה שעת הגאולה, ועשו הצעד העקרי להושיע את ישראל בתשועה נצחת. אל תישנו רוחכם בזרועות התרדמה כמלפנים לחלום חלומות נעימים מתקות השכלת המאה הי״ט, רק עשו מעשים נמרצים לישועתכם. עזרו לכם בעצמכם ואני אעזור על ידיכם, יאמר צור ישראל וגואלו; אם רק תשתמשו אתם בכל האמצעים לצאת מן המיצר לבקש לכם מקום מקלט מצר יחלצכם צור ישראל ממצוקותיכם. ואתם גדולינו ועשירינו, התעוררו מתרדמתכם; חדלו לכם להלום חלומות נעימים כי שלום יהי לכם! הפכו כמעט רגע עיניכם מתענוגותיכם; השקיפ בעין חודרת על מצב העם אשר אליכם עיניו נשואות. בידכם לעשות הרבה, להביא ישע אם רק תחפוצו. כן ידעתם מה לעשות (אך הנכם עושים עצמכם כאלו לא תדעו). עשו בעוד יום. עמדו בראש העם ושמכם יהי׳ לברכה עד סוף כל הדורות הקיצו, פקחו עיניכם בעוד מועד!"
044-MGD-1883-03-14-PG001-SINGLE-ORIGNAME_270083_toc_4,," י  alrzang ד יישטעטטי Erscheint einnal öchentlich. Der Abonnementspreis betrzgt 12 Mark Jshrlich 1m Inlande. Der insertionspreis betrsgt pro Corpusspaltzeile 20 PI. bel gresseren insertions- Auftrsgen Wird ein entaprechender Rabatt gewshrt. Alle Annoncenexpeditionen hehmen 1nserate für „HAMAGID"" an. Аdresse: Redaction des „HAMAGID. Lyck. Preussen. —"
