article_id,headline,text
044-MGD-1880-01-21-PG001-SINGLE-ORIGNAME_240029_toc_14,אלה מסעי," אלה מסעי יעקב אבערמייער יליד בייערן. (המשך מגליון 3). אז בהיותי ברוסטשוק איזה חדשים (לפני פרוץ המלחמה בין רוסיא ותורכי) היתה בה מהומה גדולה מ אנשי חיל אשר בה ומהמלאכות הרבות אשר נעשו בהמבצר ולבבות הישמעאלים הי' בוערות ללחום נגד הכופרים וההבערה ללהב הפאנאטיסמות וצאה. והיו אז ימים קשים לרוסטשוק. בבוקר אור לארבעה עשר שבט יצאתי מעיר רוסטשוק על מסילת הברזל ובערב הגענו אל ווארנא ולמחרתו נסעתי על ספינה אנגלית אל עיר בירת סולטאן  הישמעאלים. — באתי בשלום לקונשטנטינה (קאנשטאנטינאפעל או שטאמבול) העיר בעלת שבע גבעות אשר בין שני ימים ובין שני חלקי תבל יושבת. לפנים השני׳ לדומה ועתה השני׳ למעקקא; העיר אשר ממנה יצא צו להכין מחסה אל פליטת אחינו ממגורשי ספרד ואשר אח״כ הגדילה גבורים הם החכמים אשר האירו בתורתם את עיני הגולה, העיר אשר הורו בה הרמים והריב״ל והמהר״ימט ועוד כמה וכמה משרי ישראל. — סרתי אל בית ידידי האדון רעשיה עפפענדי (בן להמורה הגדול לדת הישמעאלים (מופטי) אשר בגראד) אשר גר אז בקונשטנטינה וביתו בלב העיר באחת מהרחובות היותר יפות שם והתאכסנתי אצלו כי אמרתי להתמהמה בעיר הזאת ירחים אחדים להתבונן על תהלוכות אנשיה וללמוד לשון תורכית ועל הכל לראות בעקדי ספרי הישמעאלים. וביש בבית האדון הנ״ל נודעתי עם גדולי העיר ויכולתי להוציא מחשבתי אל הפועל. — מי שראה קנשטנטינה לפנים ויראה עתה יתפלא איך בהש נים האחרונות האלה נשתנתה לטובה צורת העיר. — לא בד במגרשי פערא וגאלאטא אשר שם מושב האיירופיים ורוב נוצרים אלא גם בשטאמבול מקום משכנות הישמעאלים נשתנו מראות החוצות בטוב הבנינים ורוחב הרחובות ושאר דברים ליפוי ותיקון המקום. ברחובות רבות מהקריה נעשו מסילות הברזל ועגלות רבות הולכות ובאות בכל עברים ואם מתחילה הנוסע האיירופי הי׳ משתומם על העדר מציאות הנשים בחוצות שטאמבול הנה היום הצנועות הישמעאליות מתערבות בחוץ בקהל הגברים ולא עוד אלא לובשות כפי מנהגי בנות איירופא ובאין צניף מגלות כמעט כל היקף פניהן. אז בהגיעי לקנשטנטינה הי׳ ימי מהומה רבה לתורכי׳, המלחמה רבצה על מפתן שערי הארץ. מידהאט פאשא גורש מארצו ואין איש בארץ לעמוד נגד הזמן הקשה. הסולטאן מאין חפץ בהתרגשות העתים התמיד לנוח בחיק נשיו ופלגשיו וחזרה הנהגת המדינה אל תוך החארים (arem) ומהנשים תצא תורת הפאליטיק ובא שוד ושבר על ארץ רבה. — אך אנוכי לא אל כל אלה פניתי בבי ולא הרביתי קרא בעלים הפורחים (Zeitungen) שם המרבים הרהור בערוות הזמן והשוללים זהב העת מאת המרבים להגות בהם. — אנוכי כל ימי שבתי בקנשטנטינה הי׳ ידי מלאות עבודה להגיע אל המטרה אשר שמתי לי כזכור לעיל וכן לא הרשה לי הזמן לגשת אל אחי בני ישראל אלא אך בעתות התפלה לברך את ה׳ במקהלות ולהדר את עוז מלכותו ברוב עם. אכן בהגיע חג הפסח בקשתי את אחי לשמוח בחגי עמהם ונכבדתי לחוג את מועד כאורח רצוי בבית הגבירים הנכבדים האחים שבתי ושלמה אסייו יצ״ו (Asse0) והיו לי ימי שבתי שם כאח כריע בקרב האחים כי בטובם לא ידעו די להראות לי אותות אהבתם. מספר היהודים בקנשטנטינה לערך חמשים אלף נפש והם נפוצים בחלקים שונים מהעיר ורובם בשני המגרשים אשר שם האחד כסכוי (Haskol) ושם השני באלאט (Balat) ותכונת שניהם בקצה )Goldenes העיר במקצוע העליון מזרוע הים הנקרא קרן הזהב  זה לעומת זה ורק מימי הזרוע ביניהם. רוב דלת העם גרים בבאלאט ומושב נגידי העדה הוא בכסבוי והיא היפה והטובה שבמחנות היהודים בקנשטנטינה, ותכונתה על שני מורדי הר בצורת Amphitheater זה לעומת זה. ובלילה ראשון של פסח הביאני בעל אכסניא שלי, אשר מושבו במורד הר האחד אל חלון החדר — ומה מחזה ראיתי? מורד הר השני אשר כנגדנו מתחתיהו עד מרומו כולו אור מאיר מאלפי הנרות אשר הדליקו אחינו לכבוד החג, ומחזה כזה בחשכת ליל מאוד רוממה וברגש לב קראתי ליהודים היתה אורה! — היהודים בקנשטנטינה כרוב אחינו ממגורשי ספרד אשר בתורכי׳ לא שנו עוד לשונם אשר הביאו עמהם מארץ היספאני׳ כי עדיין היא המדוברת ביניהם ואף כי שכחו ממנה מלות רבות והשחיתו קצת את טעמיה ודקדוקיה אכן עדיין תספיק להם להשתמש בה די והותר בכל צרכיהם בלי תערובת רב ממלות זרות לקוחות מלשונות העמים אשר יושבים ביניהם. ויש להם ספרים רבים קדשין וחולין מחוברים בשפתם זאת או מתורגמים אליה, וכן השכילו כבר נבוני יהודה בקנשטנטינה אשר הריחו בבשמי הצוויליזאטיאן החדשה לתרגם אל לשונם שירי דבורים (Theatersticke) ממבחר משוררי איירופא כשעקספיר וראסין ודומיהם ויעבירום על במתי השחוק לעת מצא והיו תבואותיהם לדבר צדקה וגמילות חסד. ובדרך מקרה ראיתי בחול המועד דפסח מחזה אחד ltomeo C Juliet מהמשורר האנגלי שעקספיר אשר שחקו בו בחורי קנשטנטינה בלשון ספרדית המדוברת ביניהם והשתוממתי לראות איך השכילו לתרגם בשפה ברורה וצחה כל המליצות הנשגבות הנמצאות בשיר דבורי ההוא, ואיך ידעו בטוב טעם ודעת להנעים הדברים ולהחיות המחזה קבל עם  אכן לא בזה ישמח ישראל בחגו — ואך המקרה הביאני לשם ומפני גדול כבוד הבריות ישבתי והטיתי אזני אל המשחקים. (המשך יבא)."
044-MGD-1880-01-21-PG001-SINGLE-ORIGNAME_240029_toc_15,דוריות שונות* (נשרים עשויים מזכוכית.(באר...," חדשות שונות. (גשרים עשויים מזכוכית). בארץ ענגלאנד הצליח עתה בידי ממציא אחד להכין בית קשה כאבן באופן אשר נסו במסח לעשות גשרים מזכוכית ההיא ועלתה בידם. הזכוכית היא יותר קשה ומתקימת מברזל יצוק (גוססאייזען). מלבד שמחיר הזכוכית קטן יותר ממחיר עצים וברזל, גם קיום הבנינים העשוים מהזכוכית יותר קים, מפני כי איננה מעלה חלודה כהברזל ולא יעלה בה רקבון כבעצים. מעתה לא יצדק עוד המשל ההמוני הקורא את כל דבר שאיננו עומד ומתקיים, בשם: „גשר של זכוכית״."
044-MGD-1880-01-21-PG001-SINGLE-ORIGNAME_240029_toc_16,," הודעות..  השתיה כדת  שפירט וליקער של פסח. להתודע ולהגלות לכל סוחרי יי""ש בארצינו ובארצות אחרות, כי להנחיל אוהבי יי״ש לי שפירטוס של פסח, מובחר וטוב, מן פאטיקע של צוקער הכשר לפסח, דעסטיל לירט גם על 90 גראד, זך ונקי, ומצוין בריחו הטוב, גם כל מיני ליקערע של פסח, טוב ערב ומועיל, כפי שנודע ומפורסם כבר הוצאות בתי חרושת מעשי היי״ש שלי לשם ולתהלה בכל הארץ, וכל זה בכל מיני הכשר, כראוי ונחוץ לחג הפסח. כפי הוראת והוראות הרבנים הגדולים גאוני המו״צ דפק״ק יע״א, אשר עדותם נאמנה מאד כי הכל נעשה במשמרת למשמרת עפ״י שימת עינם ובדיקתם ובקורתם המובהקה, כמעט מדי יום ביומו. גם משגיח נכבד מיוחד מצדם על משמרתו יעמוד במקום המעשה. החוקר ובוחן ובודק בשבע עינים, ליתרון הכשר על טהרת הקדש, וכי עושי המלאכה אנשים כשרים המה, יראים וחרדים, זהירים וזריזים, בכל חוקי הפכח, פרטיהם ורקדוקיהם, כד״ת. גם יי״ש לי רב משנים הקודמות, וכל דורשי טוב ומתוקן ישהרונני, בפארוואל שלי בחצר ברחוב וילנער פה ווילנא. דוד אפרים ליפסקי."
044-MGD-1880-01-21-PG001-SINGLE-ORIGNAME_240029_toc_17,," פאוילוס קאססעל ווידער היינריך פאן טרייטשקע. זאעבען ערשין אין מיינעם פערלאגע אונד איזט פאן מיר דירעקט זאוויע דורך יעדע בוכהאנדלונג צוא בעציהען: ווידער היינריך פאן טרייטשקע פיר דיא יודען פאן פאוילוס קאססעל, פראפ. דר׳ טהעאל. פרעד. אן דער קריסטוס קירכע אין ברלין פרייז 60 פפ. Friiedrich Stahn, Verlagsbuchhandluug, Berlin S. W., Wilhelm Strasse 122 5."
044-MGD-1880-01-21-PG001-SINGLE-ORIGNAME_240029_toc_18,," לבן-שנים (מילך-צאהנע). זה לי שש עשרה שנה אשר הודעתי בעלי הכרמל (שנת תרכ״ד נומ׳ 17) כ. נמצאו בידי הרבידים עלעקטרא- מאטאריש להוציא את שני הילדים בלי כאב ובלי אסון, ומידי הממציאים באו אלי, ואין ערמה ומרמה בהם, וכבר קנו מידי לאלפים אבות ואמהות הרבידים על שלום עולליהם, ושלחו להממציאים ולי מכתבים המלאים תודה וברכה (וחפש הוא לכל הבאים בביתי לקנות רביד, לקרות בהם כאות נפשם), ועתה כל החרד לשלום בניו ובנותיו ויאבה להצילם מחולי ומפגע בימים אשר תצמחנה שניהם, ישלח אלי א׳ רו״כ ויודיעני את האדרעסס שלו, ואז יקבל בין אם הוא יושב מקרוב או מרחוק. והקונה מידי עשרה רבידים יחד אנכה לו 257 ראבאט. Ch. H. Rodkin. Deutsche Strasse, Hause Klotz. "
044-MGD-1880-01-21-PG001-SINGLE-ORIGNAME_240029_toc_19,," בר הודעה הרב החכם הרופא כמהרי׳ מיכל ראבי- נאוויץ היו בפאריז זה כבר המציא מזור למחלת חולי נופל, כל אשר ידרוש עזרתו יוכל לפנות אליו וישיג מבוקשו אם ישלח לו עשרה רו״כ או עשרים מארק, וישיג פיללען לשלשה חדשים, אך נחוץ שיודיע אם החולה זכר או נקבה, בתולה נשאת, מעוברת או מיניקת, כמה ימי ש חיי החולה, וכמה פעמים קרה לו האסון בשנה הזאת וכמה פעמים בשנה שעברה; אם יש לו מחלה אחרת, ומה המה עסקיו, אם בלמוד או במלאכה. יכולים לכתוב אליו בכל לשון, גם בשפת עברית ושארגאן. האדרעסע אליו היא: Le docteur J. M. Rabbinowicz 63 rue de Seine, Paris Frankreich. (הערת המו״ל). בעבור זה לא כביר הרופא הנכבד ההוא, דר׳ ראבינאוויץ דרך עיר מושבנו נתכבדנו להכירהו, ונוכל להעיד עליו כי איש יקר נכבד ונאמן הנהו, ובר סמכא לשלוח לידו כסף הדרוש בעד רפואתו; כן ידענו כי חולים רבים נושעו על ידו כי רפואתו היא בדוקה."
044-MGD-1880-01-21-PG001-SINGLE-ORIGNAME_240029_toc_20,," פיר יידישע רוססישע יונגע לייטע בעגיננען אם 1 טען יעדען מאנאטעס נייע קורזע אין איינפאכער, אונד דאפפעלטער בוכפיהרונג, רעצימאלרעכנען, קויפמעננישען רעכנען, דייט- שער שפראכע אונד שרייבען קויפמעננישר J. Jtaliener, דייטשער בריעפע Königsberg in Preussen. Kneiphötsche Langgasse 46/47."
044-MGD-1880-01-21-PG001-SINGLE-ORIGNAME_240029_toc_21,," הודעה אונטערצייכנעטער אפפערירט: העמיש פרעפארירטע האלצקאהלען צוא ענטפוזעלן פאן שפיריטוס פרא ברוטטא-צענט- נער אינקלוזיווע פאסס 12 מארק, פערנער רוס-עססענץ פרא ליטער אינקלוזיווע פלאשע 3 מארק, יאמאיקא-רוס-עם סענץ 4 מארק, מאריענע-רוס-עס סענץ 6 מארק, צוקער-קאולער פרא צענטנער 30 אונד 86 מארק, רום- קאולער 80% בלאנק פערבענד, פרא צענטנער 32 מארק, בעסטען ריסיעהריגען קירשזאפט בילליגסט. Julius Dumcke„ Königsberg in Preussen."
044-MGD-1880-01-21-PG001-SINGLE-ORIGNAME_240029_toc_22,," ספרים יקרי המציאות נמצאו אתי למכירה אחד אחד מכל מין וכל הקודם זכה במקחו ואלה הם: „בכורי העתים"" 12 שנים קאמפלעט 15 רו""כ. המבשר והנשר 6 שנים קאמפלעט 12 רו״כ. דקדוקי סופרים ראבינאוויץ 8 כרכים קאמפלעט 15 רו״כ. ראוסוויעט (השחר) בשפת רוססיא שיצא לפנים באדעססא ע״י ה׳ ראבינאוויץ 8 רו""כ. (מזה נמצאו את עקזעמפלארען אחדים). יעוורייסקא ביבליאטיעקא בשפת רוססיא 6 שנים 12 רו״כ. אוצר השרשים ב״ז ג׳ חלקים 6 רו״כ. תולדות הטבע ג׳ ח׳ עם כל הציורים 6 רו״כ 50 קאפ׳. שלום על ישראל צוויי- פעל ד׳ ה׳ 3 רו״כ. השחר סמאליענסקי 5 שנים (ד׳, ה׳, ו׳, ז׳, ח׳), 25 רו״כ. אלו״ס יש״ר 3 רו״כ. מחיר כל הנ״ל הוא עם דמי הפאסט חפשי. אליעזר יצחק שפירא. ווארשויא, בחדש יאנואר 1880 L. J. Sehapira, Nalewki Nro. 24, Warschau."
044-MGD-1880-01-21-PG001-SINGLE-ORIGNAME_240029_toc_23,," הודעה נודיע בזה כי הפקדנו לסוכן כללי „על השערי ציון"" בארצות רוססיא ופאלען את הר׳ החכם הנעלה סופר מהיר מהו׳ יעקב מהרש״ק הי״ו בווארשא וכל איש החפץ לבוא אל השערים האלה; או כי יהיה לו דבר אלינו יפנה בטובו אל הרה״ח הנז׳ וישיג מבוקשו. כן הננו לחלות פני חכמי עמינו אשר אהבת ציון תוקד על מזבח לבבם לתמוך אותנו במאמרים טובים ומועילים לחברת האדם. האדרעססע: Jacob Marschak, Buchandler, Nalewke Str. Nro. 19. in Warschau, Russ. Polen."
044-MGD-1880-01-21-PG001-SINGLE-ORIGNAME_240029_toc_24,," זא עבען איזט ערשינען אונד פאס פער- פאססער, זאוויא אויך יעדע בוכהאנדלונג צוא בעציעהען: רעאל ענציקלאפעדיע פיר ניבעל אונד טאלמוד אבטהיילונג .11 העפט ץ פאן דר׳ י. האמבורגער, לאנדעס- ראבבינער אין שטרעליטץ מק קלענבורג. פרייז 3 מארק. דיא הויפטארטיקן על דיעזעס העפטעס זינד: קולטוס, לויבהיטטע לעבע עוויגעס, לעהרער, לעהרהויז לייכע, לייכע לייכענ ליעבעס- וטיאן, ליידען עדע ליליטה, לאהן אונד שטראפע, ווערקע. מאגנעט, מאמזער, מעהילטא, מעכאזא, נגליעבע, מערהייט, מיינאייד, מענש, מענ מעססיאס, מעססיאמצייט, מעססיאנישע בי- בעלשטעללען מעססאיא, מעטאטראן, מישנא,  מישעהע, מיסטיק. דר׳ י. האמבורגער."
044-MGD-1880-01-21-PG001-SINGLE-ORIGNAME_240029_toc_25,," מודעה לכל הנוסעים לווי מי בכם החפץ דירה נאה בחדרים מיוחדים מהודרים וארוחת תמיד בכשרות גמור, הוא יסוד לבית אכסניא של הרה״ח מרדכ ווייסמאנן חיות (מו״ה), בצל קורתו ימצא קורת-רוח כל הבא לרגל מסחרו או לדרוש שם ברופאים ובכל ענינים יפיקו האורחים רצון ע״צ היו״ט. האדרעססע: M. Weissmann, Wien, Leonold. stadt, Obere Donaustrasse 55. -"
044-MGD-1880-01-21-PG001-SINGLE-ORIGNAME_240029_toc_26,," האיש הרוצח לכתוב אלי יכתוב כפ האדרעס אשר לפניו פה: itabb. Dr. L. Silbermann, in Lyck in Preussen."
