article_id,headline,text
044-MGD-1879-08-13-PG001-SINGLE-ORIGNAME_230257_toc_1,," שרים ושל  . יוצא לאור פעם אחת; בכל שבוע. מחירו! בארצנו 12 מארק לשנה,  3 מארק לרבע. בעסט רייך 8 פל׳ ע״וו: לשנה. 2 פל׳ ע״וו לרבע.  בשאריארצות 20 פראנקם לשנה. т"
044-MGD-1879-08-13-PG001-SINGLE-ORIGNAME_230257_toc_2,, חדשות וקורות הימים. יגיד ליעקב מהנעשה והנשמע בכל חלקי תבל בין כל יושבי חלד אשר ינעם ואשר ראוי לדעת לכל איש ישראלי לתועלתו ולתועלת השפה העבריה. מאת רייד אליעזר ליפמאן זילבערמאן. והאמת והשלום אהבו. (זכרים ח').
044-MGD-1879-08-13-PG001-SINGLE-ORIGNAME_230257_toc_3,על המדינות בו יאמר.," על המדינות בו יאמר. (היהודים ברומעניען). שר המלוכה החדש על ענינים הפנימים ברומעניען, ה׳ בערעסקו דבר שלח לכל מלאכי ממשלתו, היושבים בחצרות הממשלות האדירות, אדות שאלת היהודים ברומעניען. תמצית כל דבריו המאריכים למעניתם בלשון מדברת גדולות מבלי כל טוב טעם ודעת, היא: רומע- ניען לא תוכל למלא רצון בעלי הקאנגרעס בנוגע ליהודים, לפי הסעיף הארבעים וארבעה מספר ברית-השלום. שר המלוכה אומר כי הן אמנם גם ממשלת רומעניען מסכמת אל העיקר- המדיני אשר החליט עליו הקאנגרעס כי אמונת האיש לא תוכל להיות לו לצור מכשול בזכיותיו המדיניות, אך יוסיף לאמר כי בנוגע להיהודים ברומעניען אין מקום לעיקר זה, ולא תוכל הממשלה להוציאהו אל הפועל; יען מה? יען כי אז תקום סערה גדולה ברומעניען ויושביה יתעוררו למרוד בהממשלה וכו׳. מלאכי רומעניען מסרו העתקות מכתב ההוא אל הממשלות. ימים ידברו מה תאמרנה הממשלות האדירות לדבר זה אשר אין לו שחר. לשמחת לבבנו נודע לנו כי אחב״י ברומעניען התעוררו עתה מתרדמתם לעשות גם בעצמם דבר מה לטובתם, מבלי להשען רק על השתדלות אחיהם מחוץ. סוף סוף הכירו והבינו נחיצת הדבר אשר הם בעצמם יענו הורפיהם דבר, ויתחרו לשים לאל את דברי שונאיהם וטענותיהם נגדם בדבר שווי זכויותיהם. היהודים ברומעניען ערכו עתה „מעמאראנדוס"" אל כל הממשלות האדירות אשר בהכתב ההוא עונים על כל פרטי טענות ממשלת רומעניען נגד נתינת שווי הזכיות אליהם, ומראים אל הממשלות כי באמת אין כל יסוד מוסד לטענותיה וכי רק מרשעת לבבה תתחרה להוליך שולל את אייראפא בדברי הכל ורעות-רוח. על החלטת ממשלת רומעניען אשר היהודים באו לרומעניען לשבת בה זה זמן לא כביר, מראים הכותבים בראיות ברורות מקורות ימות עולם כי ההחלטה ההיא בשקר יסודה, וכי עוד בהתחלת המאה השש עשרה כבר ישבו יהודים רבים בהארצות על יד נהר הדאנויא. על החלטת ממשלת רומעניען כי מנתינת שווי הזכיות ליהודים ברומעניען תוכל לבא סכנה גדולה לכל יושביה, עונים כי מן הנמנע הוא, וכל איש מוכרח להודות כי ב׳ מאות וששים אלפים יהודים המפוזרים ברומעניען בין חמש פעמים אלף אלפים מספר יושביה, לא יוכלו מעולם להרע ולהביא סכנה על הארץ, ובפרט כי מן מספר היהודים ההוא לא כולם הם רומענים, יען חצים הם מהסרים למשמעת ממשלות אחרות, ונשארים רק לערך 135,000 יהודים רומענים או כ״ז אלפים בתי אבות, ומהם לא כלם רק לכל היותר החלק השלישי מהם יש להם זכות הבחירה לפי חוק המדינה, ואם אולי ישב יהודי אחד בין ב׳ מאות נבחרים נוצרים בבית המחוקקים, היתכן אשר זה האחד יחריב ויהרוס את ארץ רומע- ניען עד היסוד בה לפי החלטת הממשלה? ואיה איפא מקום מוצא לסכנה לכל המדינה? היהודים משלמים כל המסים המוטלים עליהם גם עובדים בצבא ככל יתר התושבים, ובכל זאת נגרעה זכותם בכל זכויות המדיניות ותורת האזרחים. בעבודת הצבא לא יכול איש יהודי לעלות למדרגת פקיד חיל, וק כיוצא מן הכלל נתמנה בעל מלחמה יהודי אחד, ה. בראנ- צינא למעלת פקיד חיל, וזה יען כי האיש ההוא השיג אות  כבוד בעבור גבורתו במלחמת פלעוונא מן ממשלת רוססלאנד האדירה. הממשלה אומרת כי מפני זה אשר לפעמים בעתותי מחומות ומבוכות ברומעניען העמידו שם עצמם תחת מחסה הממשלות האחרות להמלט מידי מבקשי דעתם, בעבור זאת אבדו זכיותיהם המדיניות. על זה עונים ואומרים כי מה יכלו האומללים לעשות בעת אשר קמו עליהם יושבי הארץ להשמידם, והממשלה עומדת מנגד מבלי עשות דבר להצילם, אם לא לבקש מחסה בכל אשר ימצאו? חכי מפני היותם רומענים עליהם לתת גיום למכים ולהושיט צוארם לטכח לידי אחיהם הרומענים הנוצרים מבלי נסות דבר להמלט ממות? הזאת לחטאה תחשב להם, לעון גדול מנשא אשר בעבודו יאבדו זכיותיהם המדיניות? שומו ישרים על זאת! הם מזכירים את ממשלת רומעניען כי לפני עשרים שנים צעקו רבים מיושבי הארץ הדומענים הנוצרים ובתוכם שרים רבים ונכבדים, חמס אל ממשלות אייראפא על ממשלתם אז אשר הכבידה אכפה עליהם, ודרשו עזרת הממשלות האחרות נגד ממשלתם; ומדוע איפא לא יאבדו עתה גם הם את זכיותיהם מטעם הנזכר? מדוע רק על היהודים יצא עתה הקצף לשלול מהם כל זכותם רק בעבור זאת אשר קרה לפעמים כי אחדים מהם שהיו נתונים בסכנת נפשות והממשלה לא חפצה למלטם, פנו בבקשתם אל הממשלות האדירות להציל לקוחים למות ומטים להרג על לא חמס בכפם? בכתב ממשלת רומעניען אל הממשלות האדירות כתוב כי היהודים בארצה אינם מוכשרים לקבלת הברכה של שווי- הזכיות יען מואסים הם בחכמה ומדע, יחד יבערו ויכסלו, דבר אין להם עם הציוויליזאציאן מואסים במלאכה ועיניהם רק אל „השאכער״. (מסחר הקטן) והתרמית תלויות וכו׳ ע״ז עונים היהודים בהמע- מאראנדום הנזכר כי בכל ארץ רק בתי הספר הם האות לא יכזב על נטית העם לחכמה ומדע. והנה השטאטיסטיק של בתי הספר ברומעניען תוכיח ברור כשמש, לפי עדות הממשלה בעצמה כי בכל בתי הספר נמצא מספר ילדי היהודים מששים עד תשעים למאה מכל מספר שוקדי דלתותיהם, מן מאה תלמדים עולה מספר ילדי ישראל ששים עד תשעים! וזה הוא למרות רוח האי-סבלנות השורר בבתי הספר נגד ילדי ישראל כן מצד המורים וכן מצד התלמדים הנוצרים. היש לנו עדות יותר ברורה על אהבת בני ישראל לחכמה ומדע! גם בנוגע לבעלי המלאכה תראה הסטאטיסטיק לדעת כי מן מאה בעלי מלאכה ברומעניען, שבעים הם יהודים; ועתה מי הם אלה האוהבים את המלאכה יותר? הרומענים הנוצרים או הרומענים היהודים? — זה הוא תוכן דבריהם. שר המלוכה בערעסקו נוסע כעת ללאנדאן, פאריז וברלין לנסות עוד הפעם דבר אל הממשלות האדירות שם אדות שאלת היהודים להטותן לחפץ ממשלתו. אם יצליח חפצו בידו? ימים דברו. — ממשלת מדינת זערביען חפצה בראשונה למלאות פקודת הקאנגרעס ולתת החרות המדינית ליהודים בארצה; אך בראותה מה שנעשה ברומעניען, חדלה גם היא מלהוציא הדבר אל הפועל, ותחכה על תוצאות הענין ברומעניען, באמרה אם יצליח לרומעניען להטות את הממשלות אליה, אז גם היא תהי לה הצדקה שלא לתת ליהודים חירותם."
044-MGD-1879-08-13-PG001-SINGLE-ORIGNAME_230257_toc_4,תוכן הענינים, תוכן הענינים על המדינות בו יאמר: פראנקרייך: מכתבים מפאריז. רוססלאנד: ווארשא. רומעניען: יאסי. בולגאריען: סופיאה. טירקייא: קאנסטאנטיננאפעל. הצופה. מגלה סוד: מאח ב״ג. הוספה ותשלום למאמרי „עצרת״: מאת אלכסנדר הלוי לאנגבאנק. למען האמת: מאת זלמן יוסף קראגען. הערה: מאת י. נוסינאף. הודעות:
044-MGD-1879-08-13-PG001-SINGLE-ORIGNAME_230257_toc_5,, — כל איש יוכל להשיגו! ע״י כל פאסט-אמס: ובוכהאנדלונג בכל  המדינות. כל החפץ להודיע דבר מה ברבים! לטובתו עליו לשלם שכר: הדפסה בעד כל שורה! 15 פפ׳  
044-MGD-1879-08-13-PG001-SINGLE-ORIGNAME_230257_toc_6,פראנקרייך," פראנקרייך מכתבים מפאריז. (פאריז), אויגוסט. כעת שמכתבי עתים מפאריז ימלאו את עמודיהם הארוכים מקצה לקצה מריב המפלגות: הבונאפארטים גם הם נתפרדו והיו לשתי כתות, כי מהם יחפצו בנאפאלעאן ומהם ביורם בנו, אף כי הנצחון אי-אפשר להבונאפארטים אשר תקותם תולה על בלימה, בכל זה מפלגתם עומדת עתה לשטן לשלות הרעפובליק וזה מעט היה בעיר לי אן מריבה גדולה ביניהם: הבונאפארטים בצאתם מבית תפלתם שנקבצו לספוד את נאפאלעאן הרביעי התנפלו על הרעפובליקאנים אחדים שעמדו על פתח הבית ויבזו אותם ויצעקו בקול המון חוגג יחי המלך! והרעפובליקאנים ענו אחריהם יהי הצולים! (כנודע חצולים חרגו את הפרינץ) ומספר רב משרי- צבא אשר יקבלו משכורתם מהרעפובליק שלחו ידם גם הם בהמרידה ההיא ויכו פצע וחבורה את העורך מה״ע le petit Lyonais אשר היה בקהלם, כי הסופר של מה״ע הנ״ל בא בבית תפלתם להתבונן על מספר הבאים ושמותם להודיע את קוראיו הרעפובליקאנים. — החכם הנכבד ר׳ מיכאלערלאנגער חבר לחברת „חברים כל ישראל"" בפאריז אשר נסע בירושלים לשים עינו על מצב אחינו מעיר הקדושה, התעכב שמה כשני ירחים וחצי, והגיע היום פאריזה. זה פעם שנית שהנכבד הזה שם פעמיו ירושלימה להרים קרן ישראל ומלבד זה יקדיש עתותיו גם בפאריז אל כל דבר הנוגע להיהדות. לא במאמר קטן כזה נוכל לרוות צמאון אלה המשתוקקים לדעת גדל ר׳ מיכאל ערלאנגער ופעולותיו הנמרצות אשר פעל ואשר יפעול יום יום עם בני עמו. מלבד ידיעתו העמוקה בהספרות העברית והתלמודית הקדיש גם עתותיו אל המדעים ויש לו כשרון נשגב בלשונות כי ימהר לדבר צחות בצרפתית, אשכנזית, אנגלית, איטלקית וערבית כאחד מאתם. ואם ירושלים בכתה מר על אבדן הח׳ המנוח ר׳ אברהם הכהן ,Albert Cohen תתנחם עם ר׳ מיכאל ערלאנגער אשר יששכר הבולון נצמדים בו. — חדשות באו לי מעיר פיטעווע (עיר קטנה קרובה למע- מעל) ע״י א""א הרב המפורסם ר׳ דוד זעליקאוויץ כי בני אגינסקי היושבים בעיר הנ״ל סגרו שנית את בית המדרש בעדם; זה שנים אחדים אשר האצילים (פירסטען) האלה כבר בקשו תואנה על היהודים על לא דבר הרסו בתיהם, הסיגו את גבולם וסגרו בית מדרשם הבנוי זה עשרים שנה מנדבי ישראל, וינחמו על הנבלה אשר עשו והשיבו להיהודים בית תפלתם, וזה מעט סגרו שנית את בהמד""ר ויושבי ריטעווע העשוקים, אשר דתי המלך אינם יודעים ושפת המדינה כל אתם יכרעו ברך לפני לוחציהם. געציל זעליקאוויץ"
044-MGD-1879-08-13-PG001-SINGLE-ORIGNAME_230257_toc_7,רוסלאנד," רוסלאנד ווארשא. לכבוד הרב המגיד שלום וכט״ס. (עולם הפוך ראיתי, זה חזיתי ואספרה). הנה ב״ה פה ווארשא נמצאו איזו מאות בתי מרזה, יין ושכר ויי״ש, ואעפ״י שאמרו הכז״ל ובפרט ר״ש אין משתמשין באשה כלל, ועל זה דוה לבנו ועל אלה חשכו עינינו, וידוו כל הדואבים כי שערורית נעשתה בישראל, ורבים מאחב״י אשר ר״ל אין ידם משגת להחיות נפש ביתם ימכרו את בנותיהם נערות בתולות לבתי מסחר כאלה, ולא דעו ולא יבינו, כי רשת מכונה לרגלן ושחת להטביען, כי במקומות כאלה באים לשתות מאינם בני ישראל, בני נבל גם בלי שם ובני בז, ורק עבדים פחותים של בוני בתים, פועלי סנדלר וחייטים, ישתו וישכרו וימלאו פיהם שחוק והוללות ונבלות, כי קבר פתוח גרונם ומרורות פתנים בקרבם, והנערה כל יום ויום עין רואה ואזן שומעת וכל מעשיהם נחקקים ברעיונה וכל דבריהם לא יצאו מזכרונה עד כי אם משחקת עמהם, וביניהם היא תתבולל; ולא כן במסחרי יי""ש לנוצרים, אעפ״י שאינם מדקדקים הרבה בין זכר לנקבה, ומותר בעיניהם להשתמש בנשים, בכל זאת למסחרים הנ״ל משתמשים בנערים ולא בנשים. וזהו שאמרתי עולם הפוך ראיתי, כי עי״ז אומרים אוי לעינים שכך רואות ואזנים שכך שומעות, נערה שנתפתתה, כי מעט מעט שפל ערך כזה ידבר עם הנערה בלשון חבה, ובחבלי אהבה ימשכנה אחריו, עד אשר נתרצה לדבריו כי נשים דעתיהן קלות, ונפשה אותה ותעש וממירה דתה, רק למלאות חשקה ותאותה, או לקנות בכסף אמונה, ודת בעבור מגדנות ומתנות. ולמה הדבר דומה, לארח בא לחנות ויקנה חפץ, ויקרע הסוחר גליון מספר אחד ויחתל בו את החפץ, ויתמה הארח וישאל את הסוחר ויאמר איך לא תחוס על ספר טוב כזה ותשחיתהו בידיך? ויען הסוחר ויאמר: אחת, אין לי צורך בספר כי אינני יודע לשונו, ושנית כי קניתיו רק בעבור הנייר אשר נצרך למסחרי. — כן הדבר הזה, כי פעמים המפתה ופעמים המפותחופעמים שניהם אינם יודעים לשון וספר, ונערה שנתפתתה אף שאינה יודעת להבחין בין דת לדת ובין אמונה לאמונה תמלא רק נפשה בקברות התאוה, ויש נערות אשר לאביהם רכוש וחון יגנבו ויגזלו כל אשר לאביהם ותאמרנה אין און, ויברחו עם האוהבים למרחקים, ועי""ז נודעו בשם גנבים ונגרשו מלבוא בברית אמונת נוצרית, ובנות העניים כונתם לבדה התשוקה כי נפשן קשורה בנפש בני בליעל, ומי יעמוד נגד היצה״ר נערה פותח נבערת מדעת, ואם לכח אמיץ הנה, ומי יקום בת יעקב כי קטנה היא. ועוד גדולה מזו ראיתי ונפלאת היא בעיני, על המסייעים לדבר כזה ומזילים זהב מכיססן.. ודבר נכבד הוא בעיניהם להביא כאלה בברית אמונתם? — ודברי הכז״ל קשים גרים וכו׳ וגם בכל העולם כלו, ביח כל המלכים והשרים יר״ה מלאים רחמים, אוהבים את עמם וצא מרעיתם ולא יכרחו להמיר דת חלילה, והנערה כזאת התאוה הוא ההכרח ואין כונתה שלמה ורצוי'."
044-MGD-1879-08-13-PG001-SINGLE-ORIGNAME_230257_toc_8,"ע^כ אחי ביי האהובים,כל.טי אשר נגעיראתאלק..."," ע״כ אחי ב״י האהובים, כל מי אשר נגע יראת אלקים בלבו, הרחיקו בנותיכם מבית מסחר כזה, ולא תלכדו ח״ו בעונותן ולא תאמרו חלילה, בנותינו חטאו ואינן ואנחנו עונותיהן סבלנו. וכל הנצרך לדבר ילמד את בתו אומנות או מלאכה, כי ב״ה המלאכות רבות וטובות הן, ומחי' את בעלי׳, ויגיעה כפה כי תאכל אשרי וטוב לה ויהללו בשערים מעשי׳ לא רחוק מוולאדזימיר וואלינסקי בטשעכין אשה ילדה תאומים והיינו ב׳ בנות אשר אין להן אצבעות הרגלים וזכר באצבע אחת בכל רגל, ושלשתן מתו בימים אחדים, והאם בריאה וחזקה במחוז לאמזא בפאלען אשה ילדה ב׳ בנות לויות יחד עם בטן אחד ואחרי איזו שעות מתו. בגבולות נעוויא רק מצאו נחש בן ב׳ ראשים, ואינו בעל ארוס. מ״ע מראטיבארז יום ג׳ יולי מודיע, אשר המניסטראט נתן פקודה, כי בבתי מרזה המשתמשים בנשים מחוייבים לסגור החנויות בשעה עשירית בלילה, ואם יחליפו האמהות על עבדים (נקבה תסובב גבר) הרשות להם להיות פתוחות עד חצי הלילה ויותר. — מנעוויארק מודיעים מ״ע אשר לפי הדת החדשה מחוייב להיות בכל מדור ומדור בבית, אויר בעד כל איש ואיש סך 700 רגל קוביק, כמספר נפש וכל רוח סימן. אהרן טענענבוים."
