article_id,headline,text
044-MGD-1880-01-21-PG001-SINGLE-ORIGNAME_240029_toc_7,"מטמוני מצרים ומסחרי קדמוניותיה.
(פרק אחד מספרי „מסע מצרים"" אשר אתי בכתובים).
מאת נחמיה דוב האפפמאנן.
(סוף מגליון 3)."," מטמוני מצרים ומסחרי קדמוניותיה. (פרק אחד מספרי „מסע מצרים"" אשר אתי בכתובים). מאת נחמיה דוב האפפמאנן. (סוף מגליון 3). על המקום הנורא והנפלא הזה, התמהמהנו ימים אחדים, ורבת שבעה לה נפשנו עונג ותמהון יחד על מראה שני העמודים הנשגבים האלה אשר גם הזמן האכזר אשר לא ישא פנים ולא יהדר את כל היקום, שנה אותם לטוב ושיניו תקהנה למען יהיו לברות למלתעותיו החדים והשנונים להצעידם למלך משואות וחרבות נצח. עזבנו את המקום הזה ואחזנו את דרכנו הלאה, ובעוד זמן לא  כביר הגענו אל המקום הנקרא בשם „עמק-רפאים המשתרע בקרבת העיר העתיקה נא-אמון (טהעבן) והמתפשט עד רצועות „הררי-הנילוס"" (נילגעבירגע). כאשר תדרוך כף רגל הנוסע על אדמת העמק הזה בפעם הראשונה בימי חייו, אזי אימת מות יבעתהו ופלצה נצחת עם רגש נשגב ומאד נעלה יתגנב במשבית לבו, רגש אשר לא ידע שחרו, ובשומו על לב כי במקום הזה תחת סעיף האדמה, ינוחו מלכי מצרים האדירים, והמהוללים ושרי צבאיהם, אשר קנו להם שם עולם, שם לא יכחד ולא ימחה מעל ספרי דברי הימים ע״י גבורתם העזה ועריצת רוחם הנשגב, על מרומי שדה קטל בנפלם כגבורים משכילים בהלחמם בדמם ובחלבם בעד ארץ מולדתם ירגז תחת מקומו, ורגש שדי הנשגב יתגבר בתוך חדרי לבבו. גם הדומיה הנוראה והמנוחה השאננה המרחפת על המקום הנורא הזה, גם אלה ישיתו נוספות על העצב הנורא ואימת המות העוללים גם יחד נורתות לנפשו! — כאשר יפנה הנוסע את פניו לפאת מערבית משדה רפאים זה, ופגע בחרבות ומשואות שרידי בנינים עתיקים אשר נהפכו לעיי מפלה וגלים נצים, ואשר עקבות רחובות והשוקים גדולים עוד נראו שם, אשר בטח התנוססה פה לפנים לפני אלפי שנים משנות עולמים עיר עליזה והומיה עם תשואות אדם רב, אשר טירותיה הנשגבות, ומגדליה הנשאים התרוממו בחוסן תפארת עוזם והתגאו בהדרם ויפעת זהרם. משואות נצח אלה תשתרענה עד הררי הסלע (פעלזגעבירגע) המתנשאים שם לפאת קדמה מזרחה. — רבים מחוקרי קדמוניות יחליטו, כי על מקום ההרס הנורא הזה התנוססה לפנים העיר טהעבען הנודעת  בספרי דברי הימים העתיקים לעיר גדולה לאלהים אשר מאה שערים היו לה ומקדשי מלכי מצרים כללו את יפיה*) אשר היתה בנויה בכברת ארץ רבה בין שני טורי ההרים הסוככים את היאור, ותהלתה מלאה כל התבל בימי דורות עולמים.  כאשר נלך לדרכנו הלאה, נגיע אחרי עבור זמן מצער את מקומות כאלה אשר ילפתו ארחות דרכם מבין נקיקי  סלעים וחרבות משואות נוראות המטים עקלקלותם הרחק *) הסופרים העתיקים יעידו ויגידו כי עשרים אלף רכבי ברזל (קריעגסוואגען) ושבע מאות אלף אנשי מלחמה היו תמיד בעיר טהעבען עיר עז הלזו. אם נכון הדבר בפי הסופרים ההם לא נוכל לדעת אל נכון, אך שרידי החרבות ואלפי התמונות הגדולות והנפלאות אשר שרד עוד בתוכה, יתנו עדיהם כי היא היתה עיר גדולה ורבתי עם מא כמוה בכל ערי החבל בימים ההם. הכותב נדח״ס. בעמקים וגיאיות בתהו יליל שממה, מקומות הדת פלצות שממות נצח, בתהו ושאיה יוכת שער וישימון המרגיז לב ונפש ההולך באופן מאד נורא. השואה והשממה ישליך שם הם ודומית מות שוררת שמה; כי רק סלעי מגור וצירי מכשול, גלים נצים ועיי מפלה, משוהות מצבות נתוצות המתגוללות שמה, שרידי ספינקסען רמי קומה כבני ענקים, שברי עמודי עוז ועוד חרבות רבות עד אין מספר המפוזרות הנה והנה ומכסות את האדמה אשר נפלו ונתצו בתגרת יד הזמן ובזדון ידי אדם ארצה תחזינה עינינו ונפש חיה לא תרחה בכל המקום הנורא הזה מסביב. בישימון נורא ומקום בלהות כזה תעינו זמן כביר באין מעצור עד כי דמינו בנפשנו כי בארץ צלמות יובלונו רגלינו, ותלאות רבות מרבה להכיל מצאנו בדרכנו הנוראה הזאת, עד חשר הגענו למחוז חפצנו בדרך המפנה אל היאור נילום. בלכתנו זה כשלש שעות רצופות, הגענו עד המקום אשר מערות ומנהרות עמוקות תחדורנה שמה, ואשר תוכם הובאו ארונות החנוטים. גם פה יוכת שאיה וצלמות, ציה ושממה בכל מקום אשר יפנה הנוסע את מבטי עיניו, עד כי חרדה וזועה יפיץ עליו החזיון המבהיל הזה, כי הטבע לא מצא שם מנוח להרנין ולהשקיט מעט את לב הנוסע הנפעם והנדהם ממחיתת מות אשר תאפפהו מכל עבריו יגסביב; ורק קברי מתים החצובים בסלעי מגור והערומים מכל צמח דשא ועשבות ירק, יתיצבו לנגד עינינו. גם כל צפור כל כנף ועוף השמים הרחיקו נדוד משדה הרפאים הזה באשר לא ימצאו מנוח לכף רגלם בין הרי הסלעים האיומים המתנשאים עד העבים והנחפים בירקרק דשא מכף רגלם ועד ראשם מרוב הזקנה החופפת עליהם עד כי לא נכר מראיתם הידועה. גם על אדמת צלמות הזאת תשתרר מנוחה קדושה ואין מי אשר יפריע את הדממה האיומה, ובלבב ההולך יתעורר מחדש רגש נעלה ונשגב, בשומו על לב כי פה במקום הזה אשר עומדות רגליו היום, חצבו למו קבר אילי מצרים ומלכיה האדירים אשר עשו להם שם אל מות ע״י גבורתם גם חכמתם ופה בעפר מת גזעם לנצח! ואך שמץ דבר נגלה את אוזן הקורא מקברי המלכים אשר רבות יתנו מאתם סופרי דברי הימים. מקום קברי מלכי מצרים האלה, ישתרע לפאת מערבית לעיר טהעבען הגדולה, ורחוק הוא כתצי פרסא מהיאור נילום. בכל ארך המסילה ההיא יעמדו עמודים רבים גבוהים ויגדרו גדר בצלעי הדרכים המובילים את הנוסע למערת הקברים אשר נחצבו מסלע גדול ורחב ידים. תחת מערות עמוקות האלה והארץ אשר נבובה שמה בנויים חדרים ותאים במלאכת בנין העתיקה ונפלאה מאד להלל. בתוך חדרים כאלה ינוחו מלכי מצרים החנוטים (מומיען) אשר רופאי מצרים השכילו ביד חכמתם לחנוט אותם בדברים המקשים בשר המת למען לא תשלוט בו יד הכליון ולנצח ישכון בשרו לבל יעלה בהם רקבון. אם איש אייראפאי יבא בתוך החדרים האלה, אז אימת מות תאחזוהו והגיונות נוראות ימלאו סרעפיו, עת עיניו צופיות על הארונות הגדולים, והרחבים העשוים מאבן שיש או מאבן גראניט, ומראות נפלאות רבות וכן שלמות יחזה בתוך שערי מות האלה. על קירות החדרים מפותחים ציורים שונים ונפלאים וייישי ידי אמן נפלא אשר ישוו נגד עיני המביט עליהם דמות פני המלכים אשר מצאו פה קברם לפני אלפי שנים, ומעבר השני עומדים סלעים רחבים וגדולים אשר המה יכסו פתחי הקברים לבלי יעוז שום איש לשלוח יד ולחלל את כבוד המלכים הנרדמים אשר יעריצום, ויקדישום ביראת הכבוד. על הסלעים האלה יוכל ההולך לראות ג""כ תמונות שונות וציורים נפלאים משוחים בששר ובשלל צבעים שונים המרהיבים בת עין  באופן נפלא בתארם מלחמות תנופה מהמלכים ונצחונתיהם אשר עשו כל ימי חייהם; וערים רבות אשר לכדו בחרבם הקשה מפותחות ומתוארות במראות וציורים בולטים עד להפליא. גם ספונים טמונים שם במטמוני מסתרים כתובות רבות בכתב-התרטומים. המה יכלכלו בתוכם כל קורות וחיי המלכים האלה וכל הליכות דרכיהם אשר עשו כל ומי חייהם. התמונות והציורים האלה אף אם עבר עליהם אופן תקופות אלפי שנים, בכל זאת עודם נצבים כמו חי לפנינו, והצבעים עודם יזהירו ויתנוצצו בברק יפה ונחמד מאד, כי לא אבדו עוד את יפעתם ואורם מידי הזמן אשר חלו בהם, עד כי המביט ידמה עליהם כי ביום אתמול יצאו מתחת ידי הצייר האמן. ביחוד משך את לבי תמונה אחת נפלאה מאד בתכונתה אשר התמהמהתי להתבונן עליה זמן כביר; והיא על קבר אחד תעמוד אבן אחת גדולה ורחבה מאד, ועל שטחה מפותח בפתוחות בולטת תמונות מחוטבות מעשה ידי אמן נפלא, איך המלך (Hamses Sestorus ( רעמסס-זעסטארוס השלשי ושב על כסא המלוכה ועטרת זהב על ראשו, ושרים רבים מאצילי מצרים יעטרוהו כדור מסביב וחרבם שלופה בידם, ויכתירו אותו למלך עליהם וישימו את כתר המלכות על ראשו. המלך החזיק בידו הימנית את שרביט הזהב, ובידו השמאלית כוס מלא יין אדום, ויושט בידו לשתות לכל העומדים לפניו. על יד ימינו נצבת שגל אהובתו ביקר תפארת גדולתה ובהוד והדר מלכותה: זר מקלעת פרחים שונים ושושנים נחמדים למראה סביב על ראשה, עלי הפרחים, והשושנים האלה נדמו כאלו יפריחו בהודם ובתפארת מראיתם. — כן התמהמהתי, להתבונן על המערה אשר שמה נמצא ארון המלך רעמסס, וביותר התפלאתי על שרידי חרבות היכל מלכותו. הקירות הרמים והנשאים אשר נותרו עוד מההיכל ההוא, יפליאו עד היום את עיני הרואים, כי הם נחפים בציורים יפים ונחמדים מעשה ידי חכמי חרשי צירים, אשר צבעיהם עודם בעצם תומם, וביפעת זהרם כיום צאתם מתחת ידי הצייר, ולהט השמש גם יד העת לא יכלו להפיל אור פניהם. על הקירות ההם יראו גם תמונות, ותבנית אדם ובהמה מחוטבים במלאכה נשגבה עד להפליא, אך מרבית חדרי ההיכל, תאיו ואולמיו, עמודיו וספיו וכפתוריו הרוסים ונתוצים וחרבותיהם נפוצות ופזורות על פני האדמה. גם מצבת המלך רעמסס אשר שלשים וחמש רגל קומתה, התפוצצו לשברים רבים ומשואתיה מתגוללות בחצר החצונה. המצבה ההיא גדולה ורחבת ידים מאד עד כי בין כתפותיה היה ריות עשרים ואחת ורגל. האח! מה נשגבו ונפלאו מפעלות ידי האדם! ילא כל עט סופר מהיר לתאר ולצייר כמו  את כל התמונות הנפלאות האלה אשר כלולות הנה מאד בהדרן וכולן אומרות כבוד!  הן אלה קצות מפלאות שרידי מצרים העתיקים אשר השאיר הכליון השורר תחת השמש מימי עולם ושנים קדמוניות. ולוא אמרנו לתאר בפרט את יתר היכליהם וטירותיהם, מצבות עוזם וחוסן יפעת עמודיהם, היכל חמדתם ומקדשי מלכיהם, ומשכנות מבטחם כלילי היופי הנהדרים בכל פאר והדר כבוד, כי עתה נסב, ורחב מאמרנו זה ונהפך לספר שלם, והננו להבטיח את הקוראים כי עוד נוסיף לראות פניהם בענינים כמו אלה, ואם אך יואיל הרב המו״ל לפתוח את שעריו למאמרים כאלה, כי עתה לא נתמהמה לקדם את פניהם עם עוד איזה פרקים מועילים אשר נעתיק מספרנו „מסע מצרים"" אשר אתנו בכתובים."
044-MGD-1880-01-21-PG001-SINGLE-ORIGNAME_240029_toc_8,על המדינות בו יאמר," על המדינות בו יאמר בימים האלה נתאספו בכל ממלכות אייראפא האדירות (מלבד בענגלאנד) באי כח יושביהן לבתי ועדם להמתיק סוד עם הממשלות אדות עניני הכלל. ומפני כי כרגע שורר שלום אמת ויציב בין כל הממלכות האדירות ואף עננה קטנה בלתי גראית בשמי הפאליטיק אשר יש בכחה להקדיר זוהר השלום באיי- ראפא, ע״כ מדברים כעת מעריכי כתבי דברי הימים רק מענינים הפנימים בארצותיהם. מהפאליטיק החצונית נשמע רק מעט מזעיר ואלה מהמו״ל אשר מדברים עוד מפחד מלחמה בארץ, או חולמים הם בהקיץ, או בודים דברים מלבם בכונה מיוחדת לעשות נחת רוח לקוראיהם תאבי חדשות וצמאים למלחמה. כל דבריהם והלכות הפאליטיק שלהם בשקר נוסדו וכלם ישא רוח. כרגע אין מקום מוצא למלחמה לא בין אשכנז וצרפת ולא בין רוססלאנד ואשכנז. גם בשאלות תוגרמה האייראפית אשר עוד לא נפתרו, אין אחת מהן שיש בכחה להרגיז עמודי השלום באייראפא. הממשלות האדירות אשר אשרו וקיימו את ספר הברית של הקאנגרעסס בברלין, עומדות על המצפה לראות כי כל הכתוב בו יצא מכח אל הפועל מבלי אשר תהין אחת מהן להפר דברי הברית. ביום השלשה עשר לירח זה נאספו באי כח עם צרפת לבית ועדם, וה. גאמבעטטא נבחר גם לשנה זו לשבת בראש הועד, אך מספר בוחריו היו מעטים ממספר אלה שבחרו בו בשנה שעברה. דבר זה לאות כי כבודו איננו גדול עוד בעיני באי כח העם כמקודם. שרי הממשלה החדשים כבר החלו לעשות תקונים בסדרים הפנימים בארץ ועוד ידם נטויה לתקן את אשר עותו ההולכים לפניהם. מפעולותיהם אשר כבר פעלו ועשו ומן מחשבותיהם לימים יבואו, נראה כי ישתנה מצב הרעפובליק לטובה בענינים הפנימים. לפי הנראה נוכחו שרי הממשלה החדשים לדעת כי לשוא יהיו כל התקונים החדשים אשר בדעתם לעשות אם הפקידים הנועדים להוציא פקודותיהם לפעולת אדם לא תהי רוחם נאמנה עם הרעפובליק וסדריה, יען בין הפקידים נמצאו עוד רבים מאד אשר נשארו באמנה עם משפחת הקיסר נאפאלעאן השלישי או נוטים אל ממשלת מלך, והצד השוה שבהם כי שונאים את הרעפובליק ואינם עושים מעשיהם באמת ואמונה; נוכחו לדעת כי לא תוכל ממשלת רעפובליק להתקיים אם לא ינוח רוחה על כל פקידיה הנועדים להשריש שרשיה בארץ. מפני זה החלו שרי הממשלה החדשים לבער את „החמץ״ מקרב קהל הפקידים, ולהסיר את כל הפקידים הקטנים עם הגדולים הנודעים להיות מאויבי הרעפובליק. כאשר באו פקידי אוצר המדינה אל סגן האוצר החדש ה. מאגנין לברכהו לפקודתו הגבוהה, אמר אליהם בדברים ברורים ונמרצים לאמר: „מהיום והלאה נדרוש מן פקידי הרעפובליק שיראו אהבתם אל הרע- פובליק בפועל, בכל שיש לאל ידם, ולא יצאו ידי חובתם עוד בשב ואל תעשה; ואלה אשר ירחבו בנפשם עוז להתיצב לשטן נגדה יוסרו מפקודתם בלי חמלה ורחמים״! סגן האוצר הראה לדעת כי מנויה וגמורה בסודו להוציא דבריו אל הפועל בהסירו רבים מפקידי האוצר אשר נודעו לו כי אין רוחם נוחה מהרע- פובליק. כן מודיעים כי בדעת הסגן ההוא להציע חוק חדש לפני הנבחרים אשר על פיהו לא תנתן עוד גביית המסים בחכירה לזה שמרבה לשלם בעד זה, אך יופקדו פקידים מיוחדים לגבות המסים. גם שרי הממשלה האחרים החלו לעשות כמעשי סג Farre האוצר, וביחוד שר המלחמה החדש, הוא שר הצבא אוהב נאמן לגאמבעטטא, שהחל להסיר מקרב חיל הצבא כל שרי הצבא הגדולים והקטנים אשר עוינים להרעפובליק. שר הפנים הסיר מפקודתם שבעה עשר נציבי המחוזות ושלשים פקידים אחרים גבוהים, וששים יועצי הנציבים. לפי הנשמע יוסרו ב' אלפים פקידים מפקודותיהם לרגלי השנוי שנעשה בפקודות שרי הממשלה בצרפת. ה. הנודע יצחק פעריירע בפאריז הודיע בימים האלה במכתב העתי Liberte כי קצב סך מאה אלפים פראנקים לתת לאלה האנשים אשר ימצאו הדרך היותר ישרה ומוכשרת להטיב מצב"
044-MGD-1880-01-21-PG001-SINGLE-ORIGNAME_240029_toc_9,"הבא). לפי הנשמע מנויה וגמורה בסוד מושל בולגאריען לרדת
מכסא ממשלתו ולשוב לארץ מולדתו אם יושבי הארץ יבחו
עוד הפעם את האנשים שהתיר אגודתם, אם לא יתרצו למלאות
רצונו לשנות את הקאנסטיטוציאן לפי חפצו. באמת כל
עט מי
הנמנע להמושל למשול על העם הפרוע לשמצה בבולגאריען
ואיננו ראוי ומוכשר לברכת הקאנסטיטוציאן אשר טובה היא
מאד בי
צמה, והיתה מביאה שפע ברכה והצלחה ליושבי הארץ
אם היו מוכשרים לה. יושבי בולגאריען אינם מוכשרים עוד
לקחת חלק בעניני הממשלה. האכרים הם נבערים מדעת ואינם
יודעים עד מה מספר הקאנסטיטוציאן אשר כספר חתום הוא
-
להם, ואלה מהיודעים ערכה, הם אנשי מזמה וערמה אשר רק
טובת עצמם דורשים ולא טובת העם, וקשה למשול על עם כזה."," הבא). לפי הנשמע מנויה וגמורה בסוד מושל בולגאריען לרדת מכסא ממשלתו ולשוב לארץ מולדתו אם יושבי הארץ יבחו עוד הפעם את האנשים שהתיר אגודתם, אם לא יתרצו למלאות רצונו לשנות את הקאנסטיטוציאן לפי חפצו. באמת כל עט מי הנמנע להמושל למשול על העם הפרוע לשמצה בבולגאריען ואיננו ראוי ומוכשר לברכת הקאנסטיטוציאן אשר טובה היא מאד בי צמה, והיתה מביאה שפע ברכה והצלחה ליושבי הארץ אם היו מוכשרים לה. יושבי בולגאריען אינם מוכשרים עוד לקחת חלק בעניני הממשלה. האכרים הם נבערים מדעת ואינם יודעים עד מה מספר הקאנסטיטוציאן אשר כספר חתום הוא - להם, ואלה מהיודעים ערכה, הם אנשי מזמה וערמה אשר רק טובת עצמם דורשים ולא טובת העם, וקשה למשול על עם כזה. החומרי של דלת המון העם כי ברע הוא מאד, היא השאלה הסאציאליסטית המרגזת כעת את אייראפא כלה. היא השאלה אשר ממנה יצאה האלה לכל הארץ, רעת הסאציאליסמוס והניהי. ליסמוס וכל משלחת מלאכיהן הרעים. לפי דעת המנדב מן הנמנע להכרית את הפויפעריסמוס (הדלות והעניות) מן הארץ ע״י מעשי הצדקה והחסד לבד, רק נחוץ למצא תחבולות אחרות לדבר גדול כזה, עד״מ הרחבת הדעת והידיעות הנחוצות ביי בני דלת עם הארץ, התיסדות חברת הלואות גמילות חסד לכל וחרים הקטנים באין יוצא מהכלל, הכנת בעלי המלאכה וה בתי מקלט לכל האנשים העניים אשר מפני בואם בימים לא יוכלו להחיות עצמם מיגיע כפם. — בארץ בולגאריען החדשה כל הדברים יגעים. נבחרי העם שולחו לבתיהם והס מושל נתן צו אשר הבחירה החדשה תהי׳ ביום העשרים לירח זה. הנבחרים החדשים יתאספו לבית ועדם בשוב המושל אלכסנדר הראשון מפעטערסבורג אשר נסע שם לחוג את חג מלאת עשרים וחמש שנה מיום שבת הקיסר אלכ- סנדר השני יר״ה על כסא מלכותו (החג הגדול ההוא יהי׳ בירח"
