article_id,headline,text
044-MGD-1876-02-23-PG001-SINGLE-ORIGNAME_200063_toc_1,, שנת העשרים . יוצא לאור פעם אחת  בכל שבוע. מחירו בארצנו 12 מארק לשנה. 3 מארק לרבע. בעסט- רייך 8 פל׳ ע״וו לשנה. 2 פל׳ ע״וו לרבע. בשארי ארצות 20 פראנקס  בעיר איי
044-MGD-1876-02-23-PG001-SINGLE-ORIGNAME_200063_toc_2,, חדשות וקורות הימים. יגיד ליעקב מהנעשה והנשמע בכל חלקי תבל בין כל יושבי חלד אשר ינעם ואשר ראוי לדעת לכל איש ישראלי לתועלתו ולתועלת השפה העבריה. מאתי ייר אליעזר ליפמאן זי  מאן. והאמת והשלום אהבו. זכרים ח').
044-MGD-1876-02-23-PG001-SINGLE-ORIGNAME_200063_toc_3,תוכן הענינים.," תוכן הענינים. דייטשלאנד: בערלין. עסטרייך-אונגארן: וויען. רוסלאנד: מכתבים מהוראדנא. קאוונא. אזיען: באגדאד. חדשות שונות: עמק הבכא: הצופה: קנאה בבוערים: מאת פנ״ש. סופרי-רומי העתיקים ובני ישראל, מאת חג ווידאווער הלוי. אגדה נדרשת: מאת יוסף כהן צדק. נסיעה דמיונית במרחבי הבריאה: מאת יעקב ווערבער בהרב המעריך מכ״ע ע״א מבראדי. תיקון סופרים: מאת דוד שלמה גראדזענסקי. הודעות: הוספה: קאלוואריע. הודעה. כחמש מאות מיני ספרים. מודעה. נדבות ליישוב ארץ ישראל: בקשה עבור עגונה. את בני אנכי מבקש. אחי אחי איכה. את בעלי אנכי מבקש. קול שועת עגונה, תשובה כללית:"
044-MGD-1876-02-23-PG001-SINGLE-ORIGNAME_200063_toc_4,דייטשלאנד," דייטשלאנד ברלין, סוף שבט. — מרבים העם בני מדינות אחרות לבוא הנה זה בספרו וזה בתלמודו וזה במקלו ותרמילו, הצד השוה שבהם כי כלם באים להיות נושעים ורובם תוחלתם נכזבה ונפשם ברעה תתמוגג. על זה לבי עלי דוי ואומר להזהיר את כל איש מצוק וכל איש מר נפש לבלתי יבואו הנה אם אין בידם להחיות נפשם פה או הבטחת איש עשיר ונשוא פנים אשר יש לאל ידו גם אמר מראש להצילם ממצוקותיהם. יש אשר יבואו הנה וידמו בנפשם להושע ביד חברת כל ישראל חברים. ידעו נא כי החברה הזאת לא נוצרה לכך להחזיק יד עני ואביון. אחרי אשר הופרה עצת החפצים לחפרד מעל קהל החברים אשר בפאריז ולעשות להם חברה לבדם באשכנז, הנה החברה אשר בזה תלויה בדעת החברה הראשה אשר בפאריז נשלח שמח כל כסף תבואת השנה. אם כן אל ישיא לב האמללים אותם כי ימצאו פה הרוחה. השומע ישמע והחדל דמו בראשו פן יביא עליו רעה אשר לא יוכל כפרה ואין מושיע. איש נוצרי הביא לפני השופטים את ריבו אשר רב עם איש יהודי, ובתוך דבריו אשר ערך אליהם בכתב אמר: „בא היהודי ויאמר כי לו הצדקה״. בית המשפט שלח העתקת המכתב אל הנתבע היהודי כנהוג, והוא התאונן רע באזני הפלילים כי חרף הנוצרי את אמונתו בקראו לו במכתב ההוא שם יהודי להכעיסו. אולם שופטי העיר גזרו אומר כי לא מן השם הוא זה להכלים איש וכי לא היה את נפש התובע להכלימו יען לא ידע מראש כי תנתן העתקת המכתב על יד הנתבע. אכן רוח היהודי לא היתה נוחה מן המשפט הזה, ועל כן הגיש דברו עד בית המשפט הגבוה. השופטים האלה חרצו משפטם לאמר: אין ספק כי היה עם לבב הנוצרים לגדף את היהודי בשם ההוא, ולכן יענש הנוצרי לשלם חמשה עשר מארק או יאסר שלשת ימים בבית המשמר. באחד בתי הלמוד אשר לנערות ובגימנאזיום אחד אשר בזה שחקו שני מורים על אמונת התלמידים היהודים להכאיב את לבם. הדבר בא עד זקני עירנו ויאמרו לחקור הדבר, והיה אם ימצא כי אמת הדבר והוכיחו את חטאת המורים על פניהם לבלתי יוסיפו לעשות כדבר הרע הזה עוד פן רעה תהיה אחריתם. אחרי אשר פתח שר הלמוד את הדרך אשר על פיו ילמדו האמונה הישראלית אף בבתי הלמוד אשר לעיר גם החלו ראשי העיר להפקיד מורי האמונה הישראלית בבתי למוד אחדים אשר לעיר, אמרו רבים מבני עירנו כי אין צורך עוד לעדת ישראל אשר בזה להחזיק לבדה בתי למוד לנערים ולגערות. הדבר נתן על יד אנשים עתים לבחנו היטב, והם חוו דעם בספר אשר כתב ה׳ פרופיסור שטיינטה אל בשמם לקים עתה את בתי הלמוד אשר לעדתנו לאמר: „בית הלמוד אשר ליהודים הוא הבית אשר יערה שם הרוח האשכנזי על בני משפחות היהודים אשר באו הנה מארצות נכריות להאחז פה, גם הוא הבית האחד אשר יחונן את הילדים האלה לבלתי הכביד אכפו עליהם ולחנכם על פי דרכם עד הגיעם אל מחזו חפצם״. שר הלמוד גזר אמר כי במחלקות התחתונות לבתי הלמוד הגבוהים יוכלו להפקיד מורה יהודי אשר השלים חק למודו בבית חנוך המורים למען יורה שם את אמונתו את התלמידים בני ישראל, אכן במחלקות העליונות לא יורו בלתי אם מורי אמונת ישראל ומשפטיה אשר שמום הקהלות אלופים לראשם, הם הרבנים והדרשנים. אך ראשי הלמוד לא יוכלו לדרוש מעם הקהלות להביא לפניהם עד על כשרון המורים ההמה ללמד תורת האמונה.  פקד שר הלמוד לאמר: בבו העניי העליונות אשר יורו בם אמונת ישראל לא יבחנו התלמידים בצאתם את בית הלמוד אם הצליחו בלמוד האמונה למדי, כי למוד האמונה הישראלית תלוי ברצון התלמידים ואין מכריחם ללמדה בבית הלמוד ואם כן לא יכתב משפט מורה האמונה על התעודה אשר תנתן על וד התלמידים יוצאי הבית. רק אם יחפוץ אחד התלמידים יוכל מורה האמונה לתת מכתב בידו להעיד על ידיעתו אולם הדבר הזה איננו מעלה ומוריד משפט שאר ידיעותיו ואין משגיחים אליו המזל 158 אשר מצא ה׳ דר׳ קנאררע פה (ככתוב במגיד 4) נקרא בשם .Coronis. בששה ועשרים יום לחדש יאנואר העבר מצא ה Paul Her בפאריז זה פעם רביעית עוד מזל חדש, ואם כן מספר כוכבי הלכת הקטנים עתה 159. דר׳ עהרליך"
044-MGD-1876-02-23-PG001-SINGLE-ORIGNAME_200063_toc_5,," No. 8. - כל איש יוכל להשיגו ע""י! כל פאסט-אמט ובוכ- האנדלונג בכל המדינות. כל החפץ להודיע דבר! מה ברבים לטובתו עליו לשלם שכר הדפסה בעד כל שירה 15 פפ׳ —"
044-MGD-1876-02-23-PG001-SINGLE-ORIGNAME_200063_toc_6, עסטרייך-אונגארן.,"  עסטרייך-אונגארן. וויען. (סוף מגליון 7). אבל מה שנעשה במחנה העברים בדבר צדקה מיחידים מאנשים פרטים או מחברות שונות, הן הנסתרות לד׳ אלקנו והנגלות לנו להודיע, האחים גוטמאנן מוכרי גחלים נתנו לראשי העיר לחלק לעניי עיר וויען 600 ככרים גהלים, החברת נשים הנקראת טהערעזיען קרייצער פעראיין המתנהגת בכל שנה בימי חנוכה להלביש ילדים עניים. בשנה הזאת קדמה החוק, כי זריזין מקדימין למצוה, וביום 2 טען דעצעמבער לפני חנוכה, לבשה 600 ילדים במלבושים חדשים בהיכלים הגארטען - בויא-געזעללשאפט. החברה הזאת נתיסדה לפני 26 שנים וגם מטרתה להחזיק בית ספר לנערות ללמד נערות ב״י מלאכת יד, וביום 26 טען הוא יום השני מאידיהן, ואחד מימי חנוכה, חגגו ראשי העדה חנוכה ועשו משתה להילדים הרכים בבית למודם בלעאפאלדשטאדט, הנקרא קליין קינדער בעוואהראנשטאלט, במספר 230 ילדים ונתנו להם בגדים וחלקו ונתנו להם חפצי שעשועים כדי ששאלו. ויותר ממעשה הצדקה אין לי להגלות. כראות הרב המשכיל הדרשן דר׳ שמיעדעל ני' בפינפהויז, כי קול הצדקה נשמע בעירנו, עוררני ודבר על לבי לעשות גם דבר בעד יישוב ארץ ישראל. לא לדפוק על פתחי הנדיבים, כי הזמן לקבץ נדבות חלף ואננו וכן לא יעשה במקומנו לתת לדבר כזה, אשר לדבר מותרות יחשב, רק לכתוב מכתב בקשה לראשי החברה כי״ח בוויען. ואני בשמחת לבבי מלאתי אחרי דברו, והוספתי מדעתי לכתוב עוד מכתב בקשה לראשי העדה, באמרי טוב שנים מאחד, כי ראשי העדה מוויען שם עולם להם במעשה הצדקה, ואין צבור עני. אנכי השתי ולא התמהמחתי לכתוב השני מכתבי-בקשות והודעתי בהם היקר ערך מהדבר ישא״י וגודל התועלת לאב״י באדמת ק' ושמתי מכתב אחד אל אחד ושלחתי שניהם לראשי העיר ביום 15 טען נאוועמבער ש״ע כאשר ראשי העדה המה גם ראשי החברה כי""ח פה. גם כתבתי עוד ביום הזה שני מכתבים להרבנים והדרשנים דהעדה לה׳ דר׳ גידעמאנן ני׳ ולה׳ דר׳ יעלינעק ני׳ כי יתמכו בבקשתי כי ידעתי כי לא נעשה דבר צדקה מראשי העדה בלתי אם גלו סודם להנביאים, *)ובקרבי שמחתי, להודיע להקוראים הנכבדים מעיר וויען, ולקרא:. „העברים הביטו לראות! מה שנעשה בוויען בדבר יישוב ארץ ישראל בשנת רדף צדק ימצא טוב לפ""ק"" אך רבות מחשבות בלב איש, מיום 15 טען נאוועמבער 1875 עד היום הזה 21 יענער 1876 נסתם כל חזון, איי קול ואין קשב, אין מענה ואין תשובה, לא מאלה ולא מאלה, נאלמו דומיה כלם ולכן אמרתי נואש, כי בפעם הזאת השתיקה לא כהוראה דמי, ועל סיג להחכמה דראשי העדה אוכל לאמר: אולי יישוב ארץ ישראל הוא כאהבה שהיא תלוי׳ בדבר בוויען, או מטעם: אולי גם באוצר העדה נראה דעפיציט כמנהג וויען, על כי גם רבים מאב״י קראו לקאנקורס בשנה הזאת, בסכומים גדולים ממאה אלפים ולמעלה, ופסקו מלשלם ולא הביאו תרומתם לקופת העדה, אך על ראשי החברה *) כדעת רש״י בהפסוק „ואהרן אחיך יהי' נביאך"" ובלע״ז קורין לו „פרעדיגער״. כי״ח, אשר שמם מורה על מהותם, וסוככים בדומיה ואשר אוצרותם מלאים כעגלה המלאה לה עמיר, ונברכו בהברכה ואחצרות, אמלא עליים האל לאמר דברי הנבחר ה׳ פלענער בבית המחוקקים „אדון! נא סלח להם כי לא יבינו מה המה עושים"" הן חון רב פזרו עבור יהודי רומעניען, ובברית המסחו עוד הרע הרעו לעם הזה וחצל לא הצילו עם היהודים! וחלילה לי לנגוע בכבודם אף באצבע קטנה, ידעתי, כי אנשי שם המה ובשמים עדי ועד בשחק נאמן סלה, כי אין כונתי לחלל כבודם אף שמץ מנהם. אך צר לי מאד על השמחה הכוזבת אשר שמחתי, והאמת נתן לכתוב. וצר לי מאד כי עבור רומעניע הרבו בצדקה ובעד יישוב ארץ ישראל אין דורש ואין מבקש וצר לי מאד על מה שמם ומה אומר עליהם? כי״ח בוויען  Alieraelite Wien אבל, עוד חזון למועד, ועוד במהרה ישמע בערי יהודה ובחוצות ירושלים מהנעשה בוויען בדבר יישוב א״י אז בעזרת האל. לא אמנע מלפרסם ברבים.) ואודיע מפעליהם בצדקתם לפ״ק. ולהרב המשכיל ידיד נפשי דר׳ שמיעדל ני׳ עקב רוח אחרת אתו בדבר יא""י לכן בקהל עם אביע לו ברכתו כי יזכה לאריכת ימים ושנים בנעימים, וד׳ ברחמיו יתן מעדנים לנפשו כל ימי חייו, וגם אחרית טוב לפ""ק. עוד דבר לי אליך אדון המגיד! אם המצא ימצא בשרי אומר בין אמרים טעות או שגיאות הדפוס, הרוב מקוראי המגיד רואים להלב ולא לעינים, לא מדקדקים כ״כ מדלגים עלי שורה, ושגיאות מי יבין, והמאמר לא פג טעמו וריחו לא גמר. אך אם בעל מסדר האותיות שלח ידו במלאכת רעהו, לקלקל הפרט, פעם להאריך ופעם לקצר, אז רע רע יאמר הקורא, כי בכל דבר ודבר חייב אדם לתת חשבון צדק, לכן העתו נא לבקשתי, למען והייתם נקיים מישראל ומקראי המגיד, לתקן טעות הדפוס בהפרט בגליון האחרון נומ׳ 50 משע שם כתבתי באר הטיב באותיות גדולות, הפרט „ה׳ ישמרהו ויחייהו"" לפ""ק וזה הפרט משנה הזאת תרל״ו והוא קצר במקום שראוי להאריך והדפיס „ד׳ ישמרהו ויחייהו לפ״ק, והוא כלפני, שש עשרה שנה „כתר' לפ""ק. גם בגליון האחרון נומ׳ 50 מש״ע צד 441 נדפס, „בשנה ע׳ בראשית ל״ח נאוועמבער נתחנך פה השדה קברות החדש (צענטראל פריעדהאף) ובעת ההיא מספר הקברות יותר מאחד ועשרים אלף מלבד המתים וכ״"" והי׳ ראוי׳ להדפיס: בשנה עברה בראשית ל״ח נאוועמבער נתחנן פה בוויען השדה קברות החדש (צענטראל פריעדהאף) ובשנה הזאת 1875 בח׳ הזה נאוועמבער הנהו מספר הקברות יותר מאחד ועשרים אלף מלבד המתים. לכן גם לבעל מסדר האותיות הנני אקרא במטותא מיניכו! לפקוח עין במלאכת הדפוס, למנוע מהאלאה כל טעות וכל שגיאות הן בהצופה והן בהמגיד, הן בהכלל והן בהפרט, ואז תבא עליו הברכה  „טוב עין הוא יבורך משה אלי עזר פאסטעלבערג."
