article_id,headline,text
044-MGD-1882-08-30-PG001-SINGLE-ORIGNAME_260253_toc_1,," מאמיניסטער מיטט וצא לאור פעם אחת בכל שבוע. מחירו בארצנו 12 מארק לשנה, 3 מארק לרבע. בעסטרייך 8 פל׳ עיו לשנה. 2 פל׳ ע״וו לרבע. בשארי ארצות 20 פראנקם לשנה. כל איש יוכל להשיגו ע״י כל פאסט-אמט ובוכהאנדלונג בכל המדונות. כל החפץ להודיע! דבר מה ברבים לטובתו עליו; לשלם שכר הדפסה בעד כל שורה 20 פפ׳ )"
044-MGD-1882-08-30-PG001-SINGLE-ORIGNAME_260253_toc_2,," Erscheint einmal Wöchentlich. Der Abonnementaрreis betragt 12 Mark Jshrlich im lnlande. Der insertionspreis betrsg pro Corgusspaltzeile 20 PI. bei Erusseren 1nsertions- Auftrsgen Wird ein entsprechender Rabatt Bewshrt. Alle Annoncenexpeditionen  Dehmen userate für „HAMAGID"" an. Adresses Redaction des „HAMAGID, Lyck. Preussan.  "
044-MGD-1882-08-30-PG001-SINGLE-ORIGNAME_260253_toc_3,תוכזהעניגים שיבת ציון ג ל^ח יי' 1י£? גי^..., תוכן הענינים. שיבת ציון: מאת דר׳ ליפא ביאססי. על המדינות בו יאמר: דייטשלאנד: זאלנברונן. ענגלאנד: לאנדאן. פראנקרייך: פאריז. שוועדען: שטאקהאלם. רוסלאנד: הוראדנא. אזיען: יפי. אפריקא: אלכסנדריא. אנה אנחנו עולים: ועד הקהלות במחוז אסט-פרייסען: חדשות בישראל: לישוב ארץ ישראל: מגיד משנה: מאת ל. גראססבערגער. הודעות.
044-MGD-1882-08-30-PG001-SINGLE-ORIGNAME_260253_toc_4,שיבת ציון (מאת דר׳ ליפא ביאססי).," שיבת ציון (מאת דר׳ ליפא ביאססי). יאססי, לפי הנראה רק מעטים מכתבי ישראל היוצאים בשפת עבר באייראפא מגיעים לעבר ים אוקינוס, וגם קוראיהם לא ירבו מאוד, והרעיון הנשגב ההולך ומתפשט בישראל, בכל תפוצות אייראפא, לשוב לארץ הקדושה לא נודע לאחינו בא- מעריקא. בגליון 10 של מכה״ע „צייטגייסט"" היוצא לאור בעיר מילואקע באמעריקא, קראתי מכתב ראשי בראש הגליון רשום: „שמועות על דבר היציאה מארץ ראמאניא"". המקרה אנה ליד הכותב מחברת הראשונה של „האורי, ויתמה האיש מאד על המחזה הנפלא, כי יש מכתב אחד (2) על פני הארץ המעיר את היהודים ללכת לשבת בארץ הקדושה, ועוד הוסיף להשתומם. שיש ארץ אשר הדעה מצאה בה מהלכים, ועל כלם כי נמצאים עוד בדור הזה אנשים חוזים רודפי רוח, אשר בלבם מצאה קן הדעה המשובשת הזאת, אחר שרבים וגם שלמים כבר הרימו קולם והוכיחו כי מן הנמנע ליסד קולוניות בארץ הזאת. בקראי את הדברים האלה לא יכולתי להתאפק משחוק על פתיות וסכלות הכותב והמעריך גם יחד. מי הגיד להם כי המכתב „האור"" הוא הראשון אשר החל להפיץ הרעיון הנשגב הזה בישראל? אם העמיק בשאלה הזאת אז היה נודע לו כי הרעיון הזה כבר נשתרש בארצנו עוד טרם צאת פתשגן הכתב של ה. קארל נעטטער להפיץ בארץ כל דברי בלע אשר שמע מאביוני ירושלים. ומי המה החוזים? מי המה רודפי רוח? האם משתדלים אנחנו להקים דבר שלא היה ולא נברא? הן הארץ אשר אבותינו ישבו בה מלפנים עפר מן האדמה היא ולא רוח ודבר ישוב א״י לא חדש הוא כי כבר היה לעולמים, עתה הארץ הזאת לפנינו היא, וקוראת בקול, קומו בני, בואו עדי והאחזו בו. עוד מעט ודבר השתדלתנו יצא לפעולת אדם. מי המה החוזים הלא אלה אשר נשענו על משענת ההשכלה השוררת באיברופא ואמרו בצלה נחיה? אלה המה רודפי רוח אשר השליכו כל יחכם על רוח העת, והוא חוליך אותם שולל, אך לדאבון לבנו שגו בראה, ומשונתם אתם תלין, כי אומות העולם מלאו דעת כרמון, אך גם כרסם מלאה שנאת אחים. שנות מאות עברו מן היום אשר החלו עמי איברופא לעזוב אמונת אלילים רבים, — ולמדו לקרא בשם ד׳ ולהגות בספר תורתנו, בכל זאת לא כלם הרגלו ללכת בדרכיה, לאהוב את חגר, ולא לתעב את היהודי אשר מידו היתה להם כל תורתם וממנו למדו דעת אלהים בארץ. — ואנחנו בתום לבנו הלכנו אחריהם ולמדנו ממעשיהם כי דמיונות שוא התעונו ימים רבים ומראות כוזבים הוליכונו שולל, כי אמרנו, שמש השכלה יצאה ממערב ורוח צח לפניה ילך, רוח חופש ודרור, רוח חכמה ודעת, רוח אהבת בני אדם המשוה קטון וגדול, ורוח אחוה המקרב את הרחוקים והמקשר את הנפרדים, וקרני אורה יאירו חשבת בני האדם, וכל דעה קדומה וכל הנה עקש ורעיון נפתל ימוסו כהמס דונג מפני האש. ואז אמרנו האח ראינו טוב. — אך מקרי הזמן הנוכחי הורונו לדעת, כי תוחלתנו נכזבה, כי קר ההשכלה והבל החכמה, ורק תקון המדות הוא יתהלל. כי גם למדנו להבין כי עמי אורופא הפליאו להתחכם והרבו דעת אין קץ, אך חכמתם לא עמדה לכלם לתקן מדותיהם, וכל ידיעותיהם לא השפיקו להמס לב אבן אשר בקרבם. כי כמעט לסרה מהם יראת מלכות, ונוטל מהם שבט נוגש. עד כי חיש מהר ישובו להיות פראי מדבר כאבותיהם בימי הבינים החשוכים. אז במלוך הקיסר נאפוליון השלישי בארץ וממשל רב משל ממערב על כל מלכי איברופא, רוח לאומי קם והתהלך בכל הארצות, והעיר לאום על רעהו, ועם בעם סכסך, וממקור משחת הזה פרצה עלינו הרעה. אך דעת הקהל היתה אז שוררת בארץ וכל רשעה ותרמית נסוגו אחור מפחדה, ורק בלאט עשו מעשיהן. עתה כרע נפל מלך פראנציא, וביסמארק לקח מקומו, והניף ידו החזקה מצפון. דעת הקהל סרה, הרשעה יצאה ממחבואה ותשתרע לעיני השמש, ושבט הרשע ינוח על גורל הצדיקים. ואחריו שבים עמים רבים ללכת עד לימי הבינים. נקומה נא ונעשה גם אנחנו כמעשיהם ונשובה ונלכה אחריהם, אך לא לימי הבינים, כי לא לנו הם כי אם נפסוח עליהם ונצעד צעד הלאה ונגיע עד לימים הקדמונים, עת ישבו אבותינו על חופי אזיא והאירו משם את הדרך לעמי הארצות, — אשר בו ילכו לפני אלהים ואדם. נשובה- נא אל הארצות אשר שם היה ישראל לעם עד אשר אויביו גרשוהו משם בחזקת היד. כי עזה כמות בארצנו השנאה לישראל, וקשה כשאול הקנאה לבני שם. — למרות רוח ההשכלה פרצה האיבה בכל הארץ ותמלא הארץ. חמסו ישראל ושדדו משכנות יעקב. גם עמים נאורים המתימרים בכח סבלנותם, ואושר עמים ישאו כל היום על פיהם, גם המה חשקונו מי רוש, ויתעללו בנו כל עם ועם כמזגו ומדותיו. הגרמני בדרשותיו, הצפוני במחלומותיו והרומעני בערמה יעשה מעשהו. חוק על חוק לאסון ישראל יחזקו ואין חוק שאין רשעתו גדלה מרעהו, וגזרח רעה על גזרה רעה יגזורו, המלכות לחוד, וזקני הערים לחוד וגם הפקידים והעם יכופו אכפם על היהודים, עד אשר נלאו מנשא. וישראל ברומעניען נתן לשמצה, יום יום הולך ודל; ברעב יגועו לאלפיו, ולרבבותיו ירדו מנכסיהם, הריש והעוני גברו בארץ, והמסחור בעיר מושבי יאסי עיר רוכלת עמים מלפנים, ירד פלאים. עשרה קבין עניות גרמו הרומענים להיהודים בארצם — ותשעה מהם הטילו על יושבי יאמי. אלה אשר מלפנים ישבו בכפרים וערי מצער לרגלי מסחרם ושמחו בחלקם, עתה בחוצות יאסי יתהלכו נודדים ללחם, ישאפו לעבודה ואין, יבקשו לעבוד עבודת פרך בשכר שכיר למען לא יגועו בחוסר ובכפן, ואין מאספם יום יום יבואו לדפוק על דלתותי לאמר, שלחנו- נא אל ארץ ישראל או לארץ גזרה אולי נמצא שם אוכל לפינו ולא נסכול חרפת רעב. לכן יום יום יעזבו המונים המונים את העיר, ויען כי לא יספיק להם ממונם די שלום מסלת ברזל. לכן ילכו בעגלות ולא יספיקו העגלונים להגולים כי רבו מאוד. — גם על הערונים עבר כוס התרעלה, כי ערי מצער רוששו ויהודים בכפרים אינם, והנוצרי הכפרי צרכיו אין. — לכן חדלו הסוחרים לבוא העירה לעשות מסחר וקנין. ודרכי המסחר אכלות, כי אם אין יהודים אין מסחר, ובמקום המסחור בא המחסור כי גדול עון בת ראמאניא, והטאה (סוף יבא). ישגה מאוד."
044-MGD-1882-08-30-PG001-SINGLE-ORIGNAME_260253_toc_5,על המדינות בו יאמר," על המדינות בו יאמר בכל מקום בארצות אשכנז עושים התושבים הכנות לחוג את יום השני לירח זעפטעמבער הבא בשמחה והמון חוגג כאשר עושים מדי שנה בשנה. מודעת זאת כי כעצם היום ההוא בשנת 1870 נשבה הקיסר נאפאלעאן השלישי עם כל חילו על יד המבצר זעדאן, ושם הורד גאון עזו ויד אשכנז על צרפת רוממה. על כן יום זה נזכר ונעשה ליום טוב בכל אשכנז מדי שנה בשנה ונקרא בשם: חג-זעדאן. רבים מכה״ע בצרפת, בדברם מן ההכנות להג הנזכר מדברים רתת על אשכנז ומתהרים לחלל כבודה. והנה אין לתמוה על כה״ע אשר רוח אוהבי הקיסר נאפאלעאן דובר בם בעשותם זאת, וכי תכה מכעש עינם בהעלותם על לבם אחרית בית הקיסר הנזכר לרגלי הנצחון של האשכנזים על יד זעדאן; אבל נפלאת זאת בעינינו לראות כי גם רבים מכה״ע אשר להרעפובליקאנים צרה עינם בחג-הזעדאן. לפי דעתנו עליהם לשמוח ליום ההוא אשר בו נמלאו כל משאלותיהם. ליום אשר לרגלו באה להם הממשלה הרעפובליקאנית אשר כלו עיניהם מיחל לה שנים רבות, ואשר רבים מהרעפובליקאנים סכלו בעבוד חפצם זה צרות רבות ותלאות איומות! יום זעדאן הסיר מעליהם את עול הקיסר ששנאוהו תכלית שנאה שהי׳ איש ריב ומדון לכל אייראפא, לפי דעתם. עתה יכולים לשמוח בממשלתם ולחיות בשלום ושלוה באושר והצלחה אשר כמוהם לא היו למו בימי הקיסר נאפאלעאן. ועתה לתוגה זו מה זו עושה להם? לפלגות יושבי צרפת גדולים חקרי לב! — כל הענינים האחרים באייראפא נסוגים אחור כרגע לרגלי המלחמה במצרים. במה נחשבו עד״מ רציחות - החדש במדינת אירלאנד, ריב הכתות המדיניות בצרפת ואשכנז, וההכנות להבחירה החדשה להועד המדיני בפרייסען, והסכסוכים הקטנים  המלחמה בטריעסט ודומיהם לעומת התוצאות שיכולות להולד מ במצרים? — הן אמנם כרגע המלחמה מוגבלת בין ענגלאנד מהמצריים; אבל פוטר מים ראשית מדון, ואם כרגע ראשיתו מען יודע אם אחריתו לא ישנא מאד לסכסך ממלכה בממלכה? הן אמנם נכתבו „התנאים"" בין ענגלאנד ותוגרמה אשר על פיהם תהיינה „הנשואין"" בין שתיהן על אדמת מצרים; בכל זאת עוד לא נוכל לקרא: מז״ט! לדבק הזה. התנאים אמנם נכתבו אבל עוד לא נחתמו, והזווג איננו עולה יפה. הסולטאן חפץ לשלוח חילו גם הוא למצרים להיות לעזרה להיל ענגלאנד לקרא מלחמה על ערבי-ביי, אבל עוד לא התאחדו וחד על אדות האופנים והתנאים קודם למעשה. הסולטאן חפץ אשר צבאותיו ירדו היבשה על יד אלכסנדריא, וענגלאנד אומרת כי רק בחוף פארט-סאיד יעלו. ענגלאנד דורשת אשר חיל תוגרמה יעמוד תחת פקודת שר צבאה, והסולטאן יחשוב את זאת להלול כבודו. הסולטאן נלחץ בין המצרים. בתור סולטאן עליו להעניש את ערבי-ביי אשר ימרה את פיו, אבל בהיותו גם קאליף, (ר״ל ראש האמונה) קשה לו לערוך מלחמה על בני אמונתו הנלחמים נגד הכופרים אויבי דתו. נלוה לזה נטית המושלמנים בסוריא ובארצות ערב אל ערבי ביי ואשר רוחם סוער כים נגרש על הנוצרים. קשה הוא לכל שליט לעשות מלחמה נגד רצון בני עמו, ואף כי להסולטאן אשר נוטל עליו ללחום נגד בני אמונתו. ע״כ כל הדברים יגעים, וכפי הנשמע אין אחדות גמורה בענין זה גם בין יועציו ושרי מלכותו. ענגלאנד מצדה לא תשים ידה בחיקה לחכות עד אשר ילוו אליה צבאות תוגרמה, רק צועדת קדימה בדרכה מבלי הבט ימין או שמאל. בעוד אשר בעלי הקאנפערענץ המתיקו סוד ונועצו על צפונות הדבר, ובעוד עושי דברה מתוכחים עם ממשלת הסולטאן על אדות התנאים ודברי הברית, מהרה להביא ברשותה את תעלת ים-סיף. מטרת הקאנפערענץ העקרית היתה מראשית כזאת למנוע את זאת, יען צרו עיני כל מושלי אייראפא בענגלאנד, ותמיד פחדו פחד שלא תנחת ידה לבדה על התעלה, שהיא המסלה לסחר כל הגויים והממלכות. ענג- לאנד היתה מוכנת לתת יד גם לממלכה אחרת לתקוע יתדה בהתעלה; אבל אחרי ראתה כי כלם רק מדברים ואינם חפצים לעשות מאומה, והענין הי׳ נחוץ לחפצה, תקעה, יתדה לבדה בהתעלה. רבים אוסרים כי אחרי עשותה את זאת, לא תוציא עוד בלעה מפיה, וגם אחרי תום המלחמה תאמר: „פה אשב כי אויתיה״! אבל אין לנו עסק בנסתרות ולהגיד עתידות. עכ״פ ברור הדבר כי הבאת התעלה לרשותה נחוצה היא כרגע לענגלאנד לרגלי מכסיסי מלחמתה במצרים. זאת יודו כל יודעי מלחמה. שתי דרכים לחיל ענגלאנד להבקיע אל מחנה ערבי-ביי שהתבצר על יד קפור-דאווער בין אלכסנדריא וקאהירא. האחת היא מאלכסנדריא אשר שם תקעה יתדה, והשנית מעבר השני דרך פארט מאיר ואיסמאיליא. הדרך הראשונה מלאה חתחתים צורי מכשול רבים. תעלות רבות ואגמי ביצה ממלאים את כל הדרך, עד כי קשה מאד לצבא רב לעבור שם. לא כן הדרך השנית. הדרך ההיא קצרה וישרה היא. אבל ללכת בדרך ההיא הישרה נחוץ היה שתוכל ענגלאנד להשתרר בתעלת הים סוף כחפצה באין מוחה ומפריע. לזאת איפא לקחה לה את התעלה לבדה, ושר צבאה וואלעסליי פורץ בראש חילו דרך איסמאיליא להבקיע אל המחנה הגדולה של ערבי ביי. ביום העשרים וארבעה לירח זה פרץ שר הצבא הנ״ל בראש חמש עשרה אלפים רגלים, וגדוד רוכבים וששה עשר קני רובה גדולים, ויסתער על החלוץ של ערבי ביי שעמד על יד האלענקא, בין רעמסס ומאגפר, ויכהו. למחרתו לקחו חיל ענגלאנד את המקום מאהוטא מן צבאות ערבי ויתבצרו שם. על אדות התגרה ההיא מודיע המצביא וואלעסליי הנזכר אל ממשלתו לאמר: „חיל המצריים התבצרו במאהוטא ומספרם עשרת אלפים איש, בעוד אשר מצדנו נלחמו שם רק אלף וחמש מאות איש. מטרתי להסתער על האויב מצד האנף השמאלי עמדה לי ביום ההוא. צבאותי נלחמו כל היום ההוא, ויכו את האויב אחור אחרי שנפלו בידם חמשה קני רובה גדולים עשוים בבית מלאכת קרופפ. גם שבעים וחמש עגלות טעונות צרכי אוכל נפש וכלי מלחמה. מחילי פלו ונפצעו רק חמשה עשר איש, ועשרים סוסים נהרגו. ביום ההוא נחלו 48 מחילי במלחמת דקירת השמש מהחום הלוהט, ואחד מהם מת במחלה ההיא"" עכ״ל. והנה הדרך אשר בה מתקרב שר צבא ענגלאנד אל מחנה אויבו היא הדרך אשר כה הלך גם נאפאלעאן הראשון בסוף המאה שעברה בהלחמו עם המצריים ויוכל להם. ואף כי קשה להאמין להודעת שר הצבא אשר בכל המלחמה שנמשכה כל היום, ומספר האויבים הי' עשרת אלפים איש בעוד אשר מספר חילו הי׳ רק ט״ו מאות איש, לא נפלו מחילו רק ט""ו איש, ואין כל ספק כי ערבי ביי יודיע באופן אחר, בכל זאת ברור הוא כי היתה יד חיל ענגלאנד על העליונה בתגרה הנזכרת. כן הודיע שר הצבא הנ״ל כי משם יפרוץ הלאה לעומת מחנה ערבי הגדולה. ברור הוא כי סוף סוף יתגברו צבאות ענגלאנד על המצריים, יען מן הנמנע לעם קטן כהמצריים לקום נגד ממלכה היותר אדירה ועצומה תחת השמש כממלכת ענגלאנד; אך השאלה היא: מה תהי אח״כ? התרת השאלה הגדולה הזו עוד בערפל חתולתה."
