article_id,headline,text
044-MGD-1880-08-11-PG001-SINGLE-ORIGNAME_240265_toc_1,," anen in  מחירו בארצנו 12 מארק לשנה,  3 מארק לרבע. בעסטרייך 8 פל׳. ע״וו לשנה. 2 פל׳ ע״וו לרבע. בשארי ארצות 20 פראנקם לשנה. כל איש יוכל להשיגו ע״י כל פאסט-אמט ובוכהאנדלונג בכל המדינות. כל החפץ להודיע דבר מה ברבים לטובתו עליו לשלם שכר הדפסה בעד כל שורה 20 פפ׳  "
044-MGD-1880-08-11-PG001-SINGLE-ORIGNAME_240265_toc_2,," Erscheint einmal öchentlich. Der Abonnementspreis betragt 12 Mark Jshrlich im nlande. Der Insertionspreis betrsgt pro Corpusspaltzeile 20 B hei Ergsseren 1nsertions- Auftragen Wird ein entsprechender Rabatt gewahrt. Alle Annoncenexpeditionen hehmen Inserate für resse „HAMAGID"" an Redaction des „HAMAGID, Lyck. Preusscn.  "
044-MGD-1880-08-11-PG001-SINGLE-ORIGNAME_240265_toc_3,יגיד ליעקב מהנעשה והנשמע בכל חלקי חבל בי...,"  יגיד ליעק — מהנעשה והנשמע בכל חלקי תבל בין כל יושבי חלד אשר ינעם ואשר ראוי לדעת לכל איש ישראלי לתועלתו ולתועלת השפה העבריה. (נוסד על ידי אליעזר ליפמאן זילבערמאן). יוצא עתה אור מאת דוד גארדאן. והאמת והשלום אהבו. (זכרים ח'). Lde. Agst ליק, ד׳ אלול. תר״מ. 180 "
044-MGD-1880-08-11-PG001-SINGLE-ORIGNAME_240265_toc_4,חוכןהעגינים> על המדינות בו יאמר ר : עט־ס..., תוכן הענינים. על המדינות בו יאמר: עט-סופרים: משברי עם: מאת חיים בן שבתי מעסקין. ע״ עבודת האדמה: עסטרייך-אונגארען פרסעמישל. רומעניען: מכתבים מבוקארעסט. אהב את המלכה ושנא את הרב ות: מאת אליעזר יצחק שפירא. בקרת ספרים: שטאקהאלם. מאת לעווינזאהן. בקרת ספרים: מאת יעקב רייפמאן. ידיעות אחרונות: הודעות:
044-MGD-1880-08-11-PG001-SINGLE-ORIGNAME_240265_toc_5,על המדינות בו יאמר.," על המדינות בו יאמר. (דייטשלאנד). כתבי העתים להממשלה מודיעים כי בקרוב יועדו יחד קיסרי אשכנז ועסטרייך-אונגארן במקום הרחצה אישעל (Jsch1). בעת ההיא ילוו להם גם מושלי זערביען ורו- מעניען. ברור הדבר כי גם דבר מדיני יצוק בראית פנים ההם, ואיננה מולדת המקרה לבדה. האות על זה כי את קיסר עסט. רייך יבאו גם השר היימערלע היושב ראשונה במלכותו, ו  ריים מלאך אשכנז בוויען. מלבד השרים ההם יבואו שם להמתיק סוד גם שרי המלוכה בעסטרייך טאאפע ופאטאצקי. אין תפונה כי יועצו יחד על אדות עניני תוגרמה. רבות הן ההשערות הנשואות על כנפי הרוח על אדות ראית פנים ההיא וחציר אשר עליו יסבו דברי שני המושלים מצוקי אייראפא ההם. מכל הנשמע מזה יש לתת היתרון לההחלטה כי לא ימתיקו סוד על דבר מצב שאלת האריענט בכלל, רק יטכסו עצה בדבר בולגאריען. מודעת זאת כי גם הבולגארים מתעוררים כעת לשים עיניהם על ארץ רומעליען - המזרחית, ומתחרים בכל עז להיות לעם אחד עם אחיהם שם, בעוד אשר לא לרצון הוא רצונם זה אל עסט. רייך, אשר הדבר דרוש לחפצה שלא תתנשא ממשלת בולגא. ריען ממצבה הנכחי ולהרחיב גבולות ארצה. ומפני כי ברית כרותח בין עסטרייך ואשכנז, ע״כ יועצו מושליחן יחד כדת מה לעשות להקדים פני הרעה, הנשקפת לעסטרייך מבולגאריען. בל״ס ידברו גם על אדות מצב זערביען אשר לפי הנסיון שלת הארץ ההיא, אין לה לחשען רק על עסטרייך. שעשתה מ (ענגלאנד). בימים האלה נחלה השר גלאדסטאן היושב ראשונה במלכות ענגלאנד, במחלה מסוכנת היא מחלת - הריאה. לפי ההודעות האחרונות כמעט עברה הסכנה, בכל זאת אין להחליט עוד כי יקום מחליו זה, בהיותו כעת בן שבעים ושבע שנים. השמועה ממחלתו עשתה רעש בעולם, לא מפני המקרה מפאת עצמו, כי אין זה חדש תחת השמש. גם שרי מלוכה יחלו וימותו, ובפרט איש זקן בא בימים כגלאדסטאן. הרעש שהסבה מחלתו הוא מסיבת מצב מנ כת ענגלאנד ברגע זה ומתוצאות מותו לעניני ארצו. זה שנים רבות שלא היתה ענג- לאנד במצב מדיני מסוכסך כמצבה כעת, וכמעט מעולם לא היתה נחוצה לה עצת איש חכם ונבון דבר כעצת והנהגת גלאדסטאן בימים האלה. מפני זה אולי יהי אסון גדול לענג- לאנד כמות גלאדסטאן העומד בראש הנהגתה. והנה אין להכחיש כי דרכי הדיפלאמאט הגדול הזה לפעמים מלאים התחתים, וחכמתו בהלכות הפאליטיק איננו שלמה ושגיאות רבות לא יבין. חסרונותיו נובעים מתכונת רוחו המחיר והנבהל בכל פעולותיו, ולא יוכל להתחשב בין חכמי הדיפלא- מאטיע הגדולים הרואים את הנולד טרם יעשו מעשיהם והוא נמהר להוציא כרגע מן הכח אל הפועל כל אשר יורהו רוח מבינתו. מותו היה נחשב לאבדה גדולה לא לבני ארצו לבד אבל גם לכל אוהבי החרות באייראפא כלה. כל ימי חייו שמר את הפערפאססונג החפשית בארצו מכל משמר, ולא נתן לנגוע בה לרעה. תמיד נלחם לטובת החרות בכלל ולטובת בני עמו יושבי הבורים האויר הבאים ואחרי ראיתי באני זמן שארצם תתנהג עפ״י חוקי החרות והקאנסטיטוציאן. בכל זאת היה מותו כרגע דרוש לטובת ארצו ביחוסה להפאליטיק החצונית וכבודו היה מונח במקומו. בעלי בריתו מכת המדינית הנקראים בשם „ווהיגס"" היו מתאבלים עליו כעל מורה דרך דורש אמת וחפץ להטיב ותמים במעשיו. גם מתנגדיו הטאריעס היו נותנים כבוד לשמו על אשר הצליח לו עוד בסוף ימיו לעת שיבתו להוריד את השר ביקאנספיעלד מגדולתו, את ביקאנס- פיעלד, שר המלוכה היותר גדול ומצליח בכל דרכיו מכל שרי המלוכה בענגלאנד שו בוא לפניו.  אמנם למצב הפאליטיק של ענגלאנד ביחוסה לארצות איי- ראפא בכלל היתה צומחת טובה בלתי נערכת אם חדלה כרגע פעולת גלאדסטאן עליה להיות רוח החיה באופניה. — מכל פעולותיו בהפאליטיק החצונית בארצו מיום שבתו על מקום ביקאנספיעלד עד היום, נראה בעליל לכל איש אשר עינ מישרים תחזינה כי הוא איננו האיש המוכשר לנהל את אנית ארצו דרך גלי ים הפאליטיק הזועף ול הביאה לחוף בטוח. — רבות הן שגיאות הפאליטיק שלו, רבות ונמרצות מעת שנתמנה לשבת ראשונה בממלכת ארצו. ביחוד תרבינה בנוגע לעניני חוץ. מדבר בקשת סליחתו מן קייזער עסטרייך עד עצתו בנוגע לין ושליחת אניות מלחמה לחופיים תוגרמה להקאנפערענץ בב כלן הן שגיאות גדולות בפאליטיק של ארצו אשר לא לכבוד ולא לתועלת תהיינה לה. הן אין להכחיש כי תמים הוא במחשבותיו ובפעולותיו, ובלב ולב לא ידבר, פיו ולבו שוים ות הדיפלאמאטיע. התמימות למעשיו; אך זה חסרון גדול ב היא מדה נכונה ויקרה שאין למעלה ממנה, בחיי האיש הפרטי, אבל עתה בקרב הלכות הדיפלאמאטיע יפקד מקומה. ידי הדיפ- לאמאט התמים דובר אמת בפיו כאשר עם לבבו, לא תעשינה תושי׳ בין חבריו האחרים, אם לא תתחבר תמימות היונה לערמת הנחש. גם אוהביו היותר נאמנים מודים ואומרים כ גלאדסטאן תמים דעים הנהו אבל התבונה והערמה הנחוצות להדיפלאמאט תחסרנה לו מכל וכל מסיבת תמימותו וחסרון ערמתו עומדת ענגלאנד כעת בודדת במועדה בעניני הפאליטיק החצונים. צרפת בל תחפוץ לשית אליה ידה, גם רוב הממלכות האחרות לא ישרה דרך גלאדסטאן בעיניהן. ברור הוא כי אם תהי ענגלאנד נאלצה לצאת המערכה מסיבת הפאליטיק של העומד כעת בראשה, אז לא תמצא כל עוזר ותומך בין ממלכות אייראפא, והדבר יהי מוטל עליה לבדה לצאת מן מבוכתה. למלא סאת מבוכת ענגלאנד נלוה עתה גם האסון שקרה לה באפגאהאניסטאן, אשר צבאותיה הגבורים הוכו עד חרמה מידי נבאות האזיאטים הרחוקים מידיעת טכסיסי המלחמה באייראפא. ממשלת ענגלאנד באזיה נתונה בסכנה גדולה כעת, ויוכל להיות כי בעוד אשר מתאמץ גלאדסטאן בכל יכלתו לשים קץ לממשלת תוגרמה באייראפא, יבא הקץ לממשלת ארצו באזיה, וכל זה הרה של השר גלאדסטאן השוכב כעת באשמת הפאליטיק ד על ערש דוי. (רוססלאנד). על אדות דברי הריבות בין רוססלאנד וממלכת חינא מודיעים כה״ע כי יש תקוה אשר יושמו ד שים לטישור בין שתי הממלכות גם בלי חרב מלחמה. קיסר חינא שלח בימים האלה את אחד משריו הגדולים מארקי טזאנג במלאכות מיוחדת לפעטערסבורג להשתדל אדות השלום. בקרב הימים נג המלאך לפני הוד הקיסר. בין כה וכה ושרי המלוכה מדברים עמו אדות מלאכותו, יען כי גם רבים מגדולי המלכות  ברוססלאנד אין חפצם במלחמה עם חינא אם רק המצא תמצא הדרך הישרה לצדד הדבר ולהסיר המכשולים. לפי השמוע האחרונות עלה בדעת רבים מהנוגעים בדבר למסור דבר הריב בידי שלישי המכריע בין שתי הממלכות. ההצעה ההיא נעשתה. אם תקובל משני הצדדים עוד לא נודע. באמת לא דבר חדש הוא וכבר הי' לעולמים גם בזמננו זה ואין בזה כל חלול כבוד אם שני בעלי הריב מסכימים להשען על שלישי מכריע ביניהם. כנודע מסרה גם ממשלת ענגלאנד את דבר ריבה עם אמינריקא אדות שאלת אלאבאמא, בהסכמת ממשלת אמעריקא, ביד וקשים למישור לרצון באי כח ממלכות אדירות והם שמו הם שני הצדדים. אלה הן הידיעות האחרונות על דבר הענין ההוא. בין כה וכה לא תחדל חינא מלעשות הכנותיה למלחמה. בימים האלה קנתה כלי קרב הרבה בבית מלאכת כלי הקרב אשר בשטיר. — (טירקייא). עניני תוגרמה לא חדלו אף רג למשוך עליהם עיני כל יושבי תבל. הן המה הציר הראשי אשר עליו יסבו כל פעולות הדיפלאמאטיע וכל דברות והשערות חוזי עתידות והמאמינים לדעת בינה לעתים. כרגע ידי הדיפלאמאטיע מלאות עבודה לערוך מכתבים „נאטען"" אל ממשלת הסולטאן. בראשונה הודיעו אליו בכתב שתון את תוצאות הקאנפערענץ בבערלין ודרשו ממנו למהר להסגיר אל גריכענלאנד שלשה ממח מלכותו היותר טובים. תשובתו על זה הלא נודעת. בדבר כבוד אשר בנחת נשמעים מסרב למלא רצון אייראפא. עתה ביום הששי לירח זה ערכו אליו הממשלות האדירות מכתב אחד לשים קץ אל דבר הסכסוך אשר בינו ובין מאנטענעגרא, למסור לה את המקומות כאשר יצא פסק דינם של בעל הועד שנועצו אדות זה בירח אפריל שנה זו. במכתב ההוא נותנין לו זמן שלשת שבועות, ואם לא יעשה המוטל עליו אשר במשך הזמן ההוא, אז דורשים ממנו לתת ידו להן בכ תעשינה אח״כ נגד האלבאנעזים שאינם חפצים לתת למאנטע- געגרא אף מדרך כף רגל מארצם. מה אשר בדעתן לעשות בנוגע לשאלת גריכענלאנד, עוד לא נודע אל נכון. כרגע נשמע רק מדבר „הדעמאנסטראציאן"" נגד תוגרמה ע״י אניות מלחמה להפיל פחד אייראפא עליה. גם ענין זה עוד בערפל חתולתו זה אומר בכה וזה בכה, ואין להציל מפי כל השמועות דבר אמת. כי אין להחליט אם הממשלות הן בעצה אחת בנוגע להדעמאנסטראציאן ההיא. ואם תפיק חפצה גם בצאתה אל הפועל? זו שאלה אחרת העומדת ברומה של הפאליטיק.  עניני מאנטענעגרא וגריכענלאנד, הן שתי שאלות נפרדות זו מזו, וטרם תפתר הראשונה תנוח השניה על משכבה בשלום. מקאנסטנטינאפעל מודיעים כי יש תקוה שלא יפריע השלום ענלאנד, אם רק הגריכים יבינו להבליג ברוחם בין תוגרמה וגריס שלא לצאת המערכה ראשונה, ואם האלבאנעזים מצדם לא יקשו ערפם כ״כ כאשר עשו עד היום. בנוגע להגריכים יוכל להיות כי ישקוטו במכונם ולא יתחילו בריב וישמעו לעצת הממשלות האדירות הדואגות לטובתם. לא כן האלבאנעזים. הם אין להם על מי לסמוך רק על עצמם וגבורת ידם, ויודעים הם כי אם יוציאו ה כם מתערה נגד מאנטענעגרא, אז גם הסולטאן יעמוד לימינם. הם דורשים ממנו לפתוח בריב תחלה. אמנם הוא יזהר מעשות את זאת אך בסתר עושה גם עתה כל אשר בכחו לחזק את ידם ולאמץ רוחם. בימים האלה הודיע הסולטאן אל כל האלבאנעזים המשרתים בהיכל מלכותו, והם שש מאות איש, כי ישובו לארץ מולדתם להיות לעזרה לאחיהם חמה אשר תפרוץ בקרוב ביניהם ובין גריכענ- בארץ מולדתם בכ לאנד, וכי מחויבים הם להלחם בעד קיום ארץ מולדתם וממשלת אדונם (הסולטאן). לכל אחד מהם נתן מאוצר הסולטאן ארבעה לירא זהב, ושמלות וכלי קרב, וכולם נשלחו לארצם על הוצאות הסולטאן. בעיר ארגיראקאסטראס באלבאניען נאספו בימים האלה ראשי הליגא האלבאנעזית להועץ כדת מה לע  במלחמה על גריכענלאנד בעת תחפוץ לקחת לה לאחוזה את מחוז עפירוס גם ממשלות ארצות זערביען ובולגאריען בל תשקוטנה במכונן כעת. גם הן לוטשות עיניהן על תוגרמה להבנות מחורבנה אם מעט אם הרבה ומחשיבות עצמן גם הן בין ורשיה. זערביען תחפוץ לקחת לה את מדינת באסניען אשר תנבל בה לאחוזה. זה אומר בבירור מכה״ע Sostawa היו״י בבעלגראד הנודע למגלה סוד ומודיע ברבים מזה אשר שאר כה״ע שם מחרישים. אך הזערבים לא יפיקו חפצם ההוא, רק ע״י מלחמה כוללת באייראפא, יען עסטרייך תקעה יתדה בבאס ניען. הבולגארים לוטשים עיניהם על רומעליען המזרחית להתחבו עם אחיהם שם להיות לבשר אחד. ממשלת גריכענלאנד נתנה צו להעמיד כל צבאה בקשרי מלחמה להיות נכונים לצאת המערכה. גם ממשלת תוגרמה בל תשים ידה בחיקה, ומאספת כעת חמשים אלפים מאנשי מלחמתה במחוז טהעסאליען על גבול גריכענלאנד להיות נכונה גם היא בבא הזמן. ככה תעשינה ההכנות למלחמה מכל עבר ופנה בעת אשר הממשלות האדירות מתאמצות ל קיט הסער על ידי שפיכת דיו בכתיבת „נאטען״. מי יתן ויצליח חפצן בידן בעזרת הדיו ולא ע״י דם. Völkerrecht בימים האלה שגורה מאד המלה „משפט העמים בפי הדיפלאמאטיע, ורק על היסוד הגדול ההוא „משפט העמים״. אומרת לבנות כל החדשות בעניני הממלכות והארצות. והנה אין להכ כחיש כי ההנהגה המדינית בתוגרמה רעה היא ונשחתה עד מאד, ותועלת גדולה תצמיח להציווליזאציאן בכלל אם תשבת ממשלת התוגר באייראפא; בכל זאת על כל איש אוהב אמת להודות כי עם התוגר אינן מתנהגות עפ״י מדת משפט העמים רק על פי העיקר החדש: „כל דאלים גבר״, באי כח ממשלות האדי ת נאספו בבערלין ונתנו צו שימסור הסולטאן אחדות מבחירי ארצותיו אל גריכענלאנד. נצייר נא ברוחנו אם עד״מ היו מלאכי עמים נאספים למקום אחד ופסקו דינם על קיסר אשכנז, — אשר לא נקרא אל האסיפה, למסור שתים מארצותיו אל אחד המלכים שכניו והיו כותבים אליו „נאטע״ ארוכה להוכיח לו כי נחוץ הדבר לטובת אייראפא וכו'. — מה היתה תשובתו על זה? האם לא הי׳ עומד נגד כל הנוגע לרעה במלכותו עד מקום שידו מגעת? ממלכה כזו אשר לא תבחר להגן על עצמה בכל יכלתה, נואשה היא מקיומה בכלל ומתחיבת בנפשה. והנה ברור הוא כי אייראפא לא תדרוש דבר כזה לא מאשכנז ולא מן ממלכה אחרת אדירה — אך מן התוגר דורשת היא, יען מה? יען כי חולה הוא, שוכב על ערש דוי ואין אונים לו לדון עם מי שתקיף ממנו! עכ״פ אין תמוה אם גם החולה, כל עוד נפשו בו, מסרב לקרב קיצו בידיו. אם סוף סוף לא יגוע באין אונים? היא שאלה אחרת — אך על משפטרה מים איננה מיוסדת. בעת מלחמת רוססלאנד בתוגרמה, אז היתה שעת הכושר לשים קץ לממשלת התוגר באייראפא. אז הגיע לשערי האבדון, ורוססלאנד אשר גברה ידה עליו בשפיכת דם מבחר בניה, היתה לה עכ״פ הצד  צדקת המנצח במלחמה, לדרוש ולעשות מה שחפצה לעשות. אבל אז באה אייראפא ותאמר: „עד פה ולא תוסיף? עתה כאשר החל החולה לשאוף רוח מעט ואותות חיים מתראים בקרבו, תצוינה עליו כמפגיע לאבד עצמו לדעת, בשלום ובמישור בנחת ולא בצער. נפלאים דרכי הדיפלאמאטיע! —"
