article_id,headline,text
044-MGD-1878-09-11-PG001-SINGLE-ORIGNAME_220281_toc_15,"הנפט.
מאת ש-א—ן."," הנפט. מאת ש-א—ן. (סוף מגליון 34). משנת 1861 מעת החלו לשאב בסדר נכון, החלו גם הערים אשר הזכרנו להתנהג בסדר ובמשטר יותר מכבראשונה. — מסחר הנפט הביא רב עשר בהערים קלעוועלאנד, פיטטסבורג וביותר בעיר פילא- רעלפיא. — פענזילוואניען הוא עד היום העומד בראש כל מ  הנפט. בשנת 1859 שאבו משם 335 חביות, אחרי שתי שנים עלה המספר עד 134,927 תביות ומיום ליום יתרבה המסחר שמה. אחרי פענזילוואניען המחוז היותר גדול במסחרי הנפט הוא קאנאדא. המעין הראשון מצאו שמה בשנת 1850 ברחוק שנים עשר מיל מוויאנינג. אחרי לא כביר חגרו החופרים שארית כחם למצא שמה עוד נפט ועוד בשנת 1862 שאבו שמה ממאה בארות לערך, ועתה ישאבו רק מחצי האי שמה המוגבל והימים עריע והוראן והנהר סט. קלער. המרכז מהמחוז ההוא היא העיר O11-8prings לפאת צפונה עומדת העיר פעטראלית אשר גם בסביבותיה נמצאים מעינות טובים. אך קטן מהם הוא המחוז אשר לא רחוק מאשר הזרם סט. לארענן. — ילידי ארץ קאנאדא ידעו משמן האדמה זה כביר, ויסחירו את המקום אשר ימצא שמה, אשר נגלה להלבנים בשנת 1866 על האי מאניטולין בים ההעראנען. רבים יחליטו כי הנפט אשר בקאנאדא טוב יותר הנהו מאשר בפענזיל - וואניען, יען כי אורו חזק ואין בו כ״כ משום סכנת הנפוץ (עקספלאזיאן). בדרום סט. פראנציסקא, אשר בקאליפארניען, ישנם אוצרות נפט רבים, אשר אך מעט ישאבו מהם, במחוז Neuyork נמצא רק ככו ארץ אחד שיש בו חשיבות אשר על יד הגבול פענזילוואניען. גם באהיא, יעללינאס, מיססורי, קענטוקי, טענעססע ואינדיאנא נמצא נפט, אם גם משלשה המחוזות האחרונים לא שאבו עד עתה עוד מאומה, ובכלל לפי הנראה שפונים טמונים בחיק אמעריקא הצפונית אוצרות נפט הרבה מאד, כי גם בקאלאראדא, אוטאה ומחוזות אחרים נראו עקבות השממנונית הזאת. בשנת 1859 הוציאה אמעריקא הצפונית 82,000 באררעלס (מדה, כ״א לערך 150 ליטטער), בשנה השנית 500,000 בר׳, ובשנת 1870 עלה המספר עד 6,500,000 באר׳, ועתה יוציאו משם בכל שנה יותר מכדי עשרה מיליאן באררעלס, אשר יותר משני שליש מאלה יובלו מחוץ למדינה. בשנת 1872 שאבו בארצות אמעריקא הצפונית במספר הזה שנה כמעט 14,500 צענטנער נפט, אך אין לאל הנפט הזה להחדמות אל הנפט האמעריקאנית. בארץ אשכנז ימצא מחוז הנפט על יד הנחל אללער אצל הנובר, אשר כנראה נמצא שמה הרבה מאד ממנו. גם בממלכות ברוינשווייג, בייערן, בריטאניה, שאטטלאנד, צרפת, ספרד, איטאליה, יון ובארץ שווייץ נכרו אותות שממנית האדמה, — ובכל זאת תתנשא עדי עד אמעריקא הצפונית על כל חלקי התבל לראש באוצרותיה הרבים והמלאים בפענזילוואניען 6,539,000 באררעלס, קאנאדא 530,000 בר׳, וירגיניען המערבית, אהיא, קענטוקי ויתר המחחות 325,000 באררעלעס, ביחד 7,394,000 באררעלס. גם באמעריקא הדרומית לא יחסרו אוצרות נפט במעמקי האדמה. ריכארד בורטאן הראה לדעת כי במחוז סט. פאלא אשר בבראזיליען נמצאים מעיני נפט אשר לא יכזבו משמנם, אך לדבריו אלה לא מצא שומע. במחוז באליוויא נמצאים שלשה מעינות גדולים בקוארוראטי, בפלאטא ובפוגאיראנדי, אשר ישטף שמה כעין נהר שמן בעומק 17 לעצטימעטער, וברחב 212 מעטער. בפערי תוציא חברה אחת עוד משנת 1866 בכל שנה יותר משלש מאות חביות. גם בממשלת הרע- פובליק הארגענטינית ועל האי טרינידאד ימצא השמן הזה Jrawaddy, באזיה הזכרנו כבר את המעינות אשר משמאל הנחל הנפט הזה, אשר ישאבוהו מחמשת אלפים בארות, יקחו למרבית למשת בו את העצים אשר לבנין הבתים למען לא תקנן בם הנמלה. גם בארץ המינים, על יד ים הכספי ובקוקאזום נמצאים אוצרות נפט. ויותר מכלם ברכה שם הטבע את חצ-האי אשעראן בשמן הזה. לפאת צפונה מעיר באקו (על יד הכפר באלאתאנא) ישאבו נפט מיותר משלש מאות בארות פשוטים, לבד אלה הבארות אשר יעשו במרצע עדי רגע. ולפאת צפונית מזרחית מבאקו, (על יד הכפר זוראחנא) ישאבו גם כן שממנית האדמה. הטאטארים ישתמשו בזה למרבית לשרפת המיד. גם באפריקא לא יחסר הנפט, אם גם ענפי המסחר לא הגיעו עוד שמה. ולאייראפא, חלק הארץ אשר אנחנו יושבים עליו, גם לו חלקה הטבע אוצרות נפט למנה. בגאליציען והוואלאחיי ישאבו הרבה נפט, ומתחתית הרי הקאראפאטהען לפאת תימנה תמצא כברת ארץ ארוכה, אשר בקרבה שפונים טמונים אוצרות השמן הזה. אצל באריסלאוו ישאבו בכל"
044-MGD-1878-09-11-PG001-SINGLE-ORIGNAME_220281_toc_16,," הודעות.  כשר  כשר Hotel de Saze  בורגשטר בערלין . נומ׳ 20 onnibus an Bahnhol. צימם. פ. מארק נעבען ד. בערזע. 50 ,1 אן"
044-MGD-1878-09-11-PG001-SINGLE-ORIGNAME_220281_toc_17,," מודעה. איין טיכטיגער יונגער מאנן דער דיא ראפפעלטע בוכפיהרונג פער- שטעהט, דייטש אונד העברעיש קאררעספאנדירט ווינשט שטעל- לונג. הערר האנדעלסלעהרער J. Jtaliener, in Königsberg I. Pr. Anelphafshe Langgasse Nro. 46,47 ווירד אויף געפעלליגע אנפראגאן אויסקונפט ערטהיילען."
044-MGD-1878-09-11-PG001-SINGLE-ORIGNAME_220281_toc_18,," לשואלים ודורשים בדבר הפענסיאן אשר יסדתי פה אודיע בזה: כי הנני מקבל אל ביתי נערים באי בתי הגימנאזיען פה או באי בית-הספר-לעברים במין גימנאזיום אשר נפתח בימים האלה? או נערים אשר יחפצו להכין את עצמם בביתי לאחד מבתי ספר אלה. בביתי ימצאו הנערים משכן רחב ידים, שלחן ערוך בטוב טעם השגחה על כל דרכיהם. מורים מובהקים לידיעת שפת עבר ולידיעות בתי הספר עומדים לימינו והנערים יגיעו לשלמותם בזמן קרוב לשמחת לבב הוריהם. ע״ד פרטי התשלומים הודיע במכתב לכל שואל. זמן קבלת הנערים הוא בכל זמן ועדן. ווארשא, בחדש אלול תרל״ח. אליעזר יצחק שפירא. L. J. Schapira, Sto. Jurskala Kro. 22, Warschawa"
044-MGD-1878-09-11-PG001-SINGLE-ORIGNAME_220281_toc_19,בשורת ספרים לוח לשנת תרל*ט# ^ ^י 3ס^תל5ו...,"  בשורת ספרים לוח לשנת תרל״ט. יצא אור בהשתדלות ובית הדפוס של ה. מארטין פהיליפזאן. האמבורג 1878 מלבד מה שנמצא בלוח הזה כל מה שכתוב בלוחות אחרים לבני עמנו, מובאה בו רשימה פרטית מכל מעשי הצדקה לאחב״י בעיר האמבורג, ועוד ענינים אחרים לתועלת הכלל. לוח עברי בשפת רוססית לשנת ה׳ תרל״ט לבריאה עם הוספות נחוצות ומועילות הנוגעות לבני ישראל בארצנו ובחוץ לארץ, מאת ח""י נורלאנד, ווארשא תרנ""ח. הלות הזה הנהו רב הכמות והאיכות. בין הענינים הרבים הטובים והמועילים הבאים בו נזכיר: מספר היהודים בארץ רוססיא לפי גלילותיה; זכרון המשפטים הטובים אשר שם המלך אלכסנדר השני יר״ה, לפני ישראל שם; מספר בתי הספר והמדרש לישראל ברוססיא; חדשות שונות וציונים לנפשות ישראל ברוססיא וחוץ לארץ."
044-MGD-1878-09-11-PG001-SINGLE-ORIGNAME_220281_toc_20,," מודעה פיר רוססישע יונגע לייטע בעגיננען נאך דען סכות פייערטאגען נייע קורזע אין בוכ- פיהרונג, רעכנען אונד קאררעספאנדענץ. J. LLAеег Handelslehrer Königsberg i. Pr. Kneiphoische Langgasse 46/47 הערת המו״ל. המורה הנכבד הנ״ל כבר העמיד תלמידים הרבה אשר היו לאנשים בבתי מסחר גדולים ועושים פעולתם לרצון בעליהם, כי ידו רב לו בזה ועושה ועוסק באמונה ובכשרון וראוי לסמוך עליו. —"
044-MGD-1878-09-11-PG001-SINGLE-ORIGNAME_220281_toc_21,," ואתא השוחט. איש מילידי עיר קדשנו, הרבני המופלג רא ושלם מ׳ חיים צבי ני׳ מגזע בעל הלבושים). למד מלאכת הקודש השחיטה והבדיקה מהשו״ב המובהק בעה״ק צפת, וכתב לו ספר תעודה ונתן בידו. וגם הרבנים מצפת מטברי׳ ספרדים ואשכנזים סמכו ידיהם עליו וחתמו על תעודתו, והאיש במבחר שנותיו ובעל אשה ובנים, (גם ש״ץ וקרוא מקרא בתורה יוכל) ומפני לוחצו יחפוץ לצאת מקודש לחוץ, ויסע חיים צבי לכל הארצות לעמוד לשרת בעיר אשר ימצא חיית ידו לפי הטף, העדה אשר תחפוץ למלא את ידו, ישלחו דרכם אלי. דוד שיפמאן בעה״ק טברי׳ תו״ב. האדרעססע: Msca Jedd fur David Schifrinann, Beiruth Syrien."
044-MGD-1878-09-11-PG001-SINGLE-ORIGNAME_220281_toc_22,," הודעה  בבית חנוך הנערים שלי יש עוד מקום לנערים אחדים מן ירה מרחשון הבא. הנערים ושיבים לקחם בלימודי חול בהגימנאזיום אשר בזה, או אבינם להיות מוכשרים לבתי ספר המסחר הכל כרצון ההורים, ולמודים העברים ילמודו בביתי. פרטי הדברים נכון אנכי להשיב לכל שואל. ליק, אלול תרל״ח. דוד גארדאן. D. Gordon, Literat. Mitredacteur des Hamagid. Lyck, Preussen."
044-MGD-1878-09-11-PG001-SINGLE-ORIGNAME_220281_toc_23,," Die Muhlstein-Fabrik Von Hugo Strebel in Ragnit, Ostpreussen עמפפיעהלט איהר פאבריקאט פרא   אויס דען בעסטען אונד מאה  ויושיעי קאררעאויקס אונד מארקעאויקס אנגעפערטיג- שער מיהלשטיינע, זאוויא שלעזישע זאנד- זיינע, ענגלישע גרויפשטיינע קאטצענ- שטיינע צו וועללעגלאגערן, גוסשטאהל- פיקקען אונד מעססערפיקקען."
044-MGD-1878-09-11-PG001-SINGLE-ORIGNAME_220281_toc_24,,"  תשובה כללית. לכל אוהבי ודורשי שלום וטובת חברתנו מק״נ אשר שאלונו אם ומתי תקום עוד הפעם לתחיה, הננו להגיד היום בקצרה: כי לדאבון לבנו לא וכלנו עד כה לעשות דבר בזה אף לא יכלנו להודיע מזה ברבים דבר מה, כי מן השמים עצרונו, כאשר נספר לכם את הכל בארוכה ברצות ד׳ דרכנו. אחרי ימי הנוראים והטובים הבע""ל נתחיל בעזה״י לעסוק גם בהענין הזה. ונודיע לכם ותדעו את הכל ונקוה לד׳ כי ישלח לנו עזרתו, ונבצע פעולתנו לשמחת לבב כלנו. בעת הננו מבקשים סליחה ומחילה מכל מאהבינו החכמים, אשר ערכו לנו מכתביהם, ולא השיגו עוד מענה עליהם ובקרוב אי""ה נתקן את הכל ויהי ד׳ עמכם ועמנו כחפץ המו״ל."
044-MGD-1878-09-11-PG001-SINGLE-ORIGNAME_220281_toc_25,נוספות לרשימת ספרי," הוספה להמגיד נומ' .36 Lyck, den 11. Dezember. 1878 .ליק, י״ג אלול התר״לח ליצירה. שנת העשרים ושתים נוספות לרשימת ספרי ומחירם ליחידים עם דמי הפאסט בכל הארץ. „המוריה"" כתבים בודדים מאת רמ״א גינצבורג ז״ל 30 קאפ׳. זרבבל עם ספר הזכרונות"" הוצאה שניה 1 רו""כ 75 קאפ'. בית יהודה ריב״ל 2 ח׳ המצאה חדשה 1 רו״כ. תולדות שם הנ״ל 80 קאפ׳. „הדבוק"" או השקפה כללית על התפתחות האמונה בגלגול הנפשות רודערמאנן 50 קאפ'. „חזון"" בנימין בן יוסף ממטה השקדים שלשה חלקים בשם „חזון למועד"" 1 רו״כ. 50 קאפ׳. עלילות שוא ספור 15 קאפ׳. „החזה חזיונות בארבעה עולמות"" 50 קאפ׳. „בבטן האדמה"" מאת מחבר ספר „במצולות ים"" 50 קאפ׳. איש יהודי"" מחזה השעשועים 25 קאפ׳. מוסר אב או חיי עמנואל 15 קאפ׳. כשרון המעשה ארבעה שירים מאת יה״לל 25 קאפ׳. סדר כפרות לבעל טאקסע"" או שבע תועבות בלבו 20 קאפ׳. „כתר כהונה"" או דברי הימים לכהני האמונה הישראלית מאת אלכסנדר הלוי צעדערבוים 50 קאפ׳. „התועה בדרכי החיים"" ד׳ ח׳ 2 רו״כ 40 קאפ׳. „מצוקי ארץ"" אז יסודי ידיעות הגעאגראפיע הטבעית 40 קאפ׳. תולדות ישראל סאלאנאוויץ המצאה חדשה 50 קאפ׳. „לוח עברי בשפת רוססית מאת ח״י גורלאנד 17 קאפ׳. בוסתנאי 15 קאפ׳. „מסתרי הגוים הקדמונים"" 40 קאפ׳. חטאת נעורים 2 ח׳ 60 קאפ׳ (לפנים 80). ספרי זארגאן: עווגעניע אדער דיא געהיימניססע פאן דעם פראנצעזישען הויף 4 ח׳ 80 קאפ׳. „אהבה בתענוגים״ 50 קאפ׳. הנאהבים והנעימים 2 ח׳ 50 קאפ׳. יעקעלע קונדאס 25 קאפ׳. משלי קרילאוו 12 קאפ׳. סטאליעטניק 12 קאפ׳"
044-MGD-1878-09-11-PG001-SINGLE-ORIGNAME_220281_toc_26,נוספות לרשימתי.," נוספות לרשימתי. חוץ המינים הנרשמים ברשימתי הנספחת בשבוע זו להמגיד יש לי עוד אלו המינים: מחזור פעריל מכל השנה ג' חלקים עם העתקה אשכנז גאלד- שניט 1 פל׳ 80 קר׳, דיט ב״ח ר״ה יו״כ מכורך 1. 30. מחזר 9 חלקים רעדילהיים יידישע לעטערן עם ביאור רוו״ה בלי 6 פל׳ מכורך ליינוואנד 8 פל׳, מחזור מכל השנה עם מטה לוי ולקוטי צבי והוספות דברי מוסר ודינים מכורך עוד 1 .50 דיט. ג״ש .1 .80 מחזור עם ביאור רוו""ה ועוד הוספות ווילנא מכורך ג' חלקים .2 .20 מחזור ב״ח תבנית קטן עם מטה לוי ולקוטי צבי ועוד הוספות ווילנא מכורך .2 .20 מחזור ה׳ חלקים מטה לוי בלי מעשי אורג עברי טייטש בלי .2 .50 מכורך עור 3 50. דיט ב״ח 14 בלי 2 פל׳ מכורך .2 .90 דיט ה״א בלי.1 פל מכורך .1 .45 (שאר מיני מחזורים נרשמים ברשימתי). סדר נהורא השלם עם דה״ח ופי׳ על התפלה ויוצרות וסליחות מאת יעב""ץ ועוד הוספות בלי .1 פל מכורך .1 .35 דיט אשכנז בלי .1 .20 מכורך.1 35. דיט עם תהלים ומעמדות מכורך .1 .80 סדר ראבן עם ע״ט בלי 40 מכורך 55. סדר בתבנית קטן אותיות גדולות עם תהלים ומעמדות מכורך .45, דיט בלא מעמדות מכורך .40. סדר בלא תהלים מכורך 18. חומשים עשרה פירושים. רש״י ש״ח ג׳ תרגומים בעה״ט. רמב״ן, פי׳ על רמב״ן. אור החיים. ספורני. כלי יקר מכורך 5 30. חומש וויע מכורך 35. דיט אותיות גדולות 50. תנ״ך וויען מכורך 75. דיט אותיות גדולות 1. 30. נ״ך עם פי׳ מלבים 8 פל׳. קהלת משה, עה״ת לקוטים מרבינו יהונתן וכו׳ ונוסף לזה לקוטי בן ארי׳ מבעל חת״ם סופר ועוד גדולים 20. מבוא המדרש כולל פסקים מאמרים מעשיות ומשלים הנמצאים במדרש רבה עה״ת חמש מגלות מסודר בסדר נפלא מאוד 60, משלי יעקב קיצור אוהל יעקב 70. קול שמחה עה״ת מר״ב מפרשיסחא 15. הגיון הנפש מר״א בר חייא לייפציג 40. סיפורי אלישיב מר״י אנדרעס 25. חמודי דניאל על יור״ד מובא בפתחי תשובה 40. לקח טוב מר״א יגל עם צוואת הרמב״ם ווילנא 8. זוהר הרקיע על הזהר 1. 40. ברכת ראש על מס׳ נזיר ווארשא 1. 40. מקל נועם חלק ד׳ שירים ע""ט ולה״ק מאת זבארזער 40. משניות נר נשמה עם ברטונורא וע״ט 18. התאבקות עם שפת אמת מאת יעבץ, כולל המחלוקת שהי׳ בינו ובין רבינו יהונתן בדבר הקמיעות 1. 20. תלמוד לשון עברי מאת כן זאב 70. מעריך המערכת, והוא אוצר השרשים החדש מאת ברד״ח 1. 50. שער הציון מכל סוגית הש״ס 40. יד או  מבעל עקידה על משלי לייפציג 1 פל׳. גן צבי על בראשית ווילנא 50. אוצר אגדות מפתח על אגדות הש״ס בסדר א״ב 50. אילת השחר עם לוית אור על מגלת אסתר. מהגאון בעהמ""ח ספרי פלגי מים. קרי הנאמנה וכו׳ 50. ספר הישר עה״ת 25. אוצר המילין שטערן 40. קובץ מעשי ידי גאונים עם חידושי רב האי על סדר טהרות 70. ריטב״א על מס׳ גדה נדפס מכת״י 70. זכרות תורת משה על תריג מצות 6. עיר הצדק תולדות רבני קראקא מאת צונץ 60. אמרי בינה מהראב״ד נדפס מכת״י 10. חידושי אנשי שם על הלכות גיטין מהמגיד מבראד 1 פל׳ שפת הים פירוש על מלות הקשות בש״ס 20 שו״ת ר״ח אור זרוע 1. 25. שו״ת זכרון יהודה מבן הרא״ש 70. צוואה מבעל כנסת יחזקאל 8. שירת משה מבעל חתם סופר 20. מכתבי וברית וויען לעטריס 60. אלפא ביתא דבן סירא בערלין 30. שיטה מקובצת על בבא קמא. ב״מ ב״ב 3. 50. קשות מיושב על הש״ס מהגאון מר״י פיק 60. אהלי שם על הלכות גיטון מד״ש גאנצ- פריד 1 60. אפריון עה״ת מהנ״ל 60. בגדי שרד על טרפות ושבירת עצמות מבעהמ""ח ציון לדורש 40. אגרות רבינו מאיר הלוי פאריז 80. מאמר הייחוד להרמב״ם עם מבוא מאת שטיינ- שניידער 40. תולדות ר״מ סופר מאת לאנדעסבערג 20. פרחי נעורים שירים מר״צ מאשקעויטץ 40. אוצרות חיים רשימת ספרי ר׳ חיים מיכל עם הערות מאת שטיינשניידער וצונץ 1 פל׳. ספר המדות מהמגיד מדובנא 50 תולדות בעלי שם טוב מהמו״ל „הקול"" 70. תולדות עמודי החב״ד הנ״ל 55. שארית ישראל מהרב מוויל- עדניק 70. זכר רב מוספיא עם העתקת אשכנז 30. יערות דבש מרבינו יהונתן 75. גבורות ה׳ מר״ל מפראג 50. חיי אדם 60. דיט׳ עם נשמת אדם 90. כסף נבחר על סוגיות הש״ס 1. 90. פני יהושע על הש״ס 7 פל. שואל ומשיב מהדורא רביעית מהגאון אב״ד דלבוב 3. 30. הוראת שעה על המהרש״א 35. מדרשים עשרה פירושים ישנים גם חדשים: מר״ש שטראשון מרד״ל. וקיצור נזר הקור ווילנא 7. 9. כרתי ופליתי על היור״ד עם תפארת ישראל על הלכות גדה מרבינו יהונתן 2. 80. תולדות יצחק עה״ת מזקנו של הב״י 75. עצמות יוסף על מס׳ קידושין 40. הוראת שעה על המהרש״א 30. ספר המלים קאנקארדאנץ החדש מאת שבי״ל ווארשא 2. 50. ברוך שאמר 45: אבקש מהסוחרים מחו״ל שישלחו לי רשימת ספרים עם המקחים אולי אעשה עמהם איזה מסחר עקב עהרענפרייז מדפיס ומוכר ספרים בלעמבערג.*) בית מסחרי הוא בבית ה׳ דאקטר לעטץ נגד סקארביקס הויז."
044-MGD-1878-09-11-PG001-SINGLE-ORIGNAME_220281_toc_27,,"  קול קורא לסוחרי אתרוגים אתרונים כשרים ומובחרים מגנות פארגה עצמה עם חותם והכשרים מהרב טריעסטע ומהרב דקארפא גם גענויער לולבין מגנות גענוא זינד בייא אונז פאן בעסטער קוואליטעט און אלס ערשטע עמפפענגער צוא בילליגסטע מקחים צוא האבען. אויפטרעגע ערבעטען געפעליגסט אן אונזער אדרעססען: פיינין בערלשטיין לעמבערג. P. Berlstein, Lemberg. P. Berlstein, Brody. P. Berlstein, Friest."
044-MGD-1878-09-11-PG001-SINGLE-ORIGNAME_220281_toc_28,," אתרוגים כשרים ומובחרים מגנות פארגה עצמה עם חותם מהרבנים דקארפאה וטריעסט, גם לולבין ירוקים מגנות גענאא כשרים ויפים מאוד, זינד בייא אונס אלס ערשטע עמפפענגער צוא האבען צוא מעגליכסט בילליגסטען מקחים. — וויר האבען אונז שנה זו מיהע געגעבען אונד מגנות פרגא מייסטענס דיא שענסטע מובחרים אבגעשלאססען, וויר האפפען דאסס אונזערע אלטע סוחרים, גם סוחרים חדשים פאן אונזער אויסוואהל בעזאנדערס צואפרידען זיין ווערדען, אויך בעמערקען וויר, דאסס אויסער החתימה מהרבנים הנ״ל איזט צור זיכערהייט אונזער אייגענער חותם „מאחים לופט"" אויף יעדען קעסטעל פערזעהען. אויפטרעגע ווערדען בעסטענס אויסגעפיהרט. אדרעססע: Gebruder Lntt, Lomberg. Gebruder Luft Triest. *) המדפים והמו״ס הנ״ל נתרצה בטובו להיות סוכן מכתבנו העתי „המגיד״ עמ׳ שלא לק״פ, ע״כ כל החפצים בהמגיד בלעמבערג וסביבותיה יפנו בטובם אליו וישיבו חפצם. חמול."
044-MGD-1878-09-11-PG001-SINGLE-ORIGNAME_220281_toc_29,, הודעיה. ים) אונד פאלמענצווייגע (לולבים) ריטועללע מירטהען (הד גיבט. וויעדערפערקייפערן ליעפערט צום לויבהיטטענפעסטע L. Williain in ErYurt. ראבבאט.
044-MGD-1878-09-11-PG001-SINGLE-ORIGNAME_220281_toc_30,," להתודע ולהגלות כי נמצאים תח״י אתרונים מובחרים מכל המינים השונים, וכן לולבים ירוקים ויבשים וגם הרסים טובים ומובחרים, ואבקש מאת הקונים לפנות אלי, כי סמוך לבי ובטוח אשר ימצאו חפץ בסחורתי, האדרעס שלי: ויקנו הכל במקח הזול. אברהם צבי בערלינסקי בעיר סובאלק רחוב סאדאווע."
