article_id,headline,text
044-MGD-1880-07-28-PG001-SINGLE-ORIGNAME_240249_toc_15,חדשות בישראל," חדשות בישראל בשוב הנסיך א לכסנדר הראשון מושל בולגאריען ממסעו אשר הלך לגמול החסד האחרון עם דודתו אלכסנדרינה הקיסרית, לא מנע הרב ר׳ רפאל גבריאל אלמושנינו מסופיא משאול את הנסיך הרם אם רצונו לקבלהו. המושל הזה, אשר ימהר תמיד למלא חפץ הרב הנעלה, ענהו כי יואל לבוא אליו ביום המחרת. למועד הנועד, בקר הר׳ רפאל בהיכל הנסיך אשר קרבהו בימין צדקו, קבלהו בידידות אהבה ויקר וישאל לו לשלום. כרבע שעה נדברו יחד וישב הנסיך תודות אל הרב על כי רואה הוא כי בני ישראל המסתופפים תחת צל ממשלתו לא ימנעו מהראות אהבתם העזה והנאמנה למושלם ולארצם וכי בכל עת מצוא המה הראשונים המתאמצים להגיש רגשות לבבם אליו. טרם הפרד הרב מעליו, נשא ידיו אל האלקים ויברך את הנסיך בברכה המשלשת נובעת מקרב ולב עמוק. המושל ככף ראשו בענות חן עד כלות הרב מקרוא ברכות שמים מעל על קדקד הוד הנסיך אלכסנדר הראשון יחיה. על אדות פגישה קיסר אשכנז ווילהעלם יר״ה עם אחד מהרבנים הזקנים במקום הרחצה עמם, בימים האלה, ואשר מסופר מזה בכה״ע בנוסחאות שונות, יש לאל ידנו להודיע לקוראינו קשט אמרי אמת כאשר הודיע לנו אחד משם לאמר: הקיסר בהיותו עתה בעיר עמם נודע לו כי בין האורחים נמצא רב יהודי זקן מופלג בן מאה וחמש שנים. הקיסר בקש את הרב ע״י אחד משדיו רואי פניו לבא לבקרהו. הרב הזקן בא אל הקיסר אשר קבלהו בכבוד וידבר עמו משך רבע שעה באהבה וחכה. אחרי צאת הרב מאת הוד פני הקיסר פנה המושל אל שריו ויאמר אליהם: „אין דיעזעם מאננע האבע איך מיינען מייסטער געפונדען״ ר״ל: בהאיש הזה מצאתי מורי ורבי) כונתו היתה כי מצאראיש נעלה עליו בזקנה מופלגת. כנודע הקיסר הוא כעת בן שמונים וארבע שנים. עוד יזכורו קוראינו מה שהודענו ברשית שנה שעברה, בעת גירוש אחב״י מהרבה מקומות ברומעניען והממשלה הודיעה אז ברבים כי המגרשים היו רקים ופוחזים ולא שוה הי׳ לה להניחם בארץ, אז התעוררו אחדים מבני עמנו ויכינו לוח פהאטאגראפהי אשר מצוירים היו עליו כל האומללים המגורשים אסורים באזיקים, ואשר ממלבושיהם וחזות פניהם הי׳ נכר כי לא היו פוחזים ורקים אבל אנשים נכבדים. ממשלת רומעניען, בהודע לה את זאת חפצה להעניש את מכיני הלוח הנזכר בתור בוגדים בארץ מולדתם, אך הם הקדימו פני הרעה (והם חמשה במספר) ונמלטו על נפשם לארצות אחרות, ונענשו שלא בפניהם אין קאנטומאציום לשבת שנים רבות בכלא. עתה, בהשתדלות האלליאנס בוויען מחל מושל רומעניען לחטאתם וישובו לארץ מולדתם. — מן השמונה מאות בעלי מלחמה מאחב״י ברומעניען אשר הסכים ועד באי כח העם לעשותם לאזרחי הארץ בשנה שעברה, לא השיגו באמת את שוי הזכיות רק שלשה מהם, והנותרים לא השיגו הדיפלאם המיוחד אשר להם לקבל מאת בית המשפט לפי החוק. איש יהודי אחד מעיר מעליטין באזיה הקטנה ירד באחת האניות באות ממצרים ללכת לדרכו. אחד מסרסורי חברת- האניות למצרים, נוצרי-גריכי שמו יעאן פהילאריך הביא דבתו רעה על היהודי ההוא כי שחט שני ילדים נוצרים לקחת דמם להג המצות. ראשי העיר מבלי כל חקירה ודרישה שמו את האומלל כבוד בכבלי ברזל ומענים אותו שם בענוים קשים ומרים. ראשי החבורה המסתעפת לחברת הכ״י) באיזמיר וקאנסטנטינאפעל משתדלים אצל הממשלה להוציא את האומלל ממאסרו ולהעניש את המלשין. הרוצח בעיר טריפאלים אשר הרג היהודי רחמים עידון. נענש עתה לשבת ט״ו שנים בבית הסוהר לעבוד עבודת פרך. זה נעשה בהשתדלות הנמרצה של הקאנזולים למלכות צרפת ואיטליען בטריפאלים. זכרה להם ד׳ לטובה."
044-MGD-1880-07-28-PG001-SINGLE-ORIGNAME_240249_toc_16,," יצא לאור ספר אוצר הספרים. לידיעה ספרי ישראל מיום שנכתב ספר עברי על הארץ עד התרכ״ג (שנת האסף המחבר אל עמיו), נדפסים וכתבי יד. חובר מאת הרב החכם וסופר הביבליאגראף המובהק והנודע מהו׳ יצחק אייזיק ז״ל בן-יעקב מווילנא. את כלם יפקוד בשמותיהם, שמות מחבריהם, יבאר תוכן עניניהם, מקומות וזמני הדפסותיהם, תבניותיהם ותולדותיהם, ועלו ובאו בו חקירות מאנשי מופת בעלי אסופות ישנים גם חדשים על כל אודותם והבדעת המחבר. הכל בסדר יפה ומועיל עפ״י א״ב מטעם בחירי הלעקסיקאנע ללשונותם למצוא דברי חפץ. מות הוא האוצר שכבר נגלה ברום עולם החקירה והדרישה לחכמת רשימות ק ספרי ישראל, וכל חכמי הדור אשר ידעוהו ושמעו את שמעו עודנו בכ״י מלאו פיהם תהלתו: כי לא בא עוד כאוצר הזה באוצר ספרת ישראל, יוקירו מאד את חין ערך פעולת המחבר ועבודתו הנכבדה והכבדה, (כמבואר בהסכמות הגאונים ומכתבי חכמי הדור  הנדפסים, מעט מהרבה, בראש הספר) בהיותו פנה יקרת ידיעת הביבליאגראפה ישועה וחוסן רב לתורה ולתעודה ולכל חכמה חמודה בכלל גם לתולדות ב״ע וגדולינו בפרט נדפס כלול בהדרו, בשלשה חלקים, לעקם. פארמאט (אקטאף גדול). מחירו ליחין ים עם פארטא: ברוססיא 4 רו״כ 60 קאפ׳; באשכנז 15 מארק; בצרפת 18 פראנק; בבריטאניא ואמעריקא, 15 שיללינג; באוסטריא, 8 פלארין. החפץ במכורך יפה עליו להוסיף עוד 65 קאפ׳ על המחיר הנ״ל. לסוחרי ספרים יותן ראבאטט נכון. החפץ בו יפנה אל בז- המחבר הוא המו״ל על הוצאותיו: .J. Beniaccb, in Wilna, ussland, Sirotskala Str. Nro. 27/10. .P. 8 החתומים זכו כבר במקחם שנקצב להם בשנת תרל״ז ע״י מכ״ע, וימהרו נא במחירם כי נדפסו עקזעמפלארען במספר מעט."
044-MGD-1880-07-28-PG001-SINGLE-ORIGNAME_240249_toc_17,," כשר Scebad Ostende. Hotel Palk כשר ההול האטעל פאלק, אסטענוע פיליאלע פאם האטעל פאלק אין עלבערפעלד רוע דוא נארד 4 אונד רוע עספאגנע 12 נעבען דעם האטעל דע פרוססע. גאנץ נייא איינגעריכטעטעס הויז אם שטראנדע מיט אויסזיכט אויף דאסס מעער. יעדען פרייאטאג אבענד אונד זאנ- גאבענד מארגען גאטטעסדיאנסט אים הויזע בילליגע פרייזע יע נאך לאגע דער ציממערן פראכטפאללער אויסזיכטסטהורם אונד טערראססע צור פערפיגונג דער בעזוכער. טא גלע דע האטע אום:1 אוהר צייט. די ושע בעדיענונג, 6 אונד 612 אוהר א לא קארטע צוא יעדער טאגע פרעמדע שפראכען  . רון האטעל פאלק, אסטענו ע פיליאלע פאם חאטעל פאלק אין עלבערפעלד. פארהעריגע אנמעלדונגען אן האטעל פאלק עלבערפעלד."
044-MGD-1880-07-28-PG001-SINGLE-ORIGNAME_240249_toc_18,," הודעה רפואה בדוקה למחלות חולה-נופל ולתחלואי העצבים אחרים (גערווענקראנק- הייטען) המציא הרופא הנודע הרב דר׳ ישראל מיכל ראבינאוויטץ בפאריז (מעתיק ספרי התלמוד ללשון צרפת) רפואותיו בדוקור וממהרות לרפאות. כל מי שיחפוץ לפנות אליו לדרוש עזרתו יכול לכתוב לו אדות פרטי המחלה בכל לשון אשר שומע הכותב. כתובתו היא: Dr. Michel Rabinowicz in Paris, 63, Rue de Seine."
044-MGD-1880-07-28-PG001-SINGLE-ORIGNAME_240249_toc_19,," דיא געמיינדע דער גר. זינאגאגע (ארטע- דאקס) זוכט איינען חזן ובעל קורא. געהאלט 150 אדער 3000 מ. פעראננא. פעהיג בעווערבער וואללען זיך אונטער איינזענדונג איהרער צייגניססע (קאפיען) אנגאבע דער אלטערס אונד פאמיליענצאהל אן דען אונ טערצייאכנעטען פרעזידענט ווענדען. President of the Hebrew Congrega- tion, Jork Str. Great Synagogue Chambers Cheethan Hill Road, Manohester., Bngland."
044-MGD-1880-07-28-PG001-SINGLE-ORIGNAME_240249_toc_20,," אין איטליענער״ס פריוואט האנדעלסשולע אין קעניגסבערג פרייסען, קנייפהעפשע לאנג נאססע נומ׳ 46,47 בעגיננען אללמאנאטלי נייע קורזע אין בוכפיהרונג, קויפמענ.. רעכנונג אונד קאררעספאנדענץ."
044-MGD-1880-07-28-PG001-SINGLE-ORIGNAME_240249_toc_21,," נאטירליכע מינעראל וואססער אונד קוועלל פראדוקטע.  ללע געברייכליכען, נאטירליכען מינעראל וואססער זינד אין פרישע פיללונג שטעטס פאררעטיג. עבענוא דיא עכטען באדע זאלצע אין דער ניעדערלאגע בייא С. Pr. M. Hagen, Kgl. Hof Apotheke, in Königsberg in Pr."
044-MGD-1880-07-28-PG001-SINGLE-ORIGNAME_240249_toc_22,," הודעה הדאקטאר וואלנער מוויען, שפעציאליסט במחלות חלישת העצבים ומחלות נשום אני גערווענשוועכע אונד פרויענו הייטען נכב במשך ימות הקיץ הזה במקום המרחץ ל סמוך לריגא ברוססלאנד, ואלה החפצים לדרוש עצתו, יפנו אליו כפי האד- רעססע שלמטה וימצאו מזור ותרופה. אדרעססע: Doctor N. Wollner, in Dubbeln, bei Riga, Karlsbader Strasse 11. Hotel Petersburg. (הערת המו״ל). הרופא המחולל  הנ""ל נקרא ע״י מכתב מן שר אחד בארץ רוססיא לבוא אליו לרפאותו ממחלתו, ובעברו דרך פה ראינוחו גם אנו והכרנוחו לאיש ישר ונאמן בדבריו ובמעשיו וחזקה שלא יוציא מת״י רק דבר מתוקן, ולכן ראוי הוא לסמון עליו, כי כבר אתמחי גברא בחכמת הרפואה"
044-MGD-1880-07-28-PG001-SINGLE-ORIGNAME_240249_toc_23,," Champagner .כשר אויף פיעלזייטיגעס פערלאנגען, בין איך נונמעהר ווידער אין דער לאגע מויססירענ- דען כשר וויינע אין פארציגליכער פרימא ואליטעט צוא ליעפערן, אונד ביטטע איך דיא געעהרטע העררען קאממיטטענטען, אויף .J. S. כשר Monopole דיא עטיקעטטע  זא וויע אויך אויף דיע אויף  דעם שטאפפען איינגעבראננטע גלייכלויטענדע מארקען גענויא צוא אכטען. רעפערענצען איבער כשרות דער⸗ זעלבען, געבען בערייטווילליגסט דיא אנער- אנגט שטרענג רעליגיעזען העררען ראב  טליך אוהרע עהו ווארונטער נאממע  דיא העררען ש. ר. הירש נרו ראבבינער היע ולבסט אונד דר. הילדעסהיימער נרו ראבבינער אין ברלין. .J. S. Alexandre, Weinhandlung in Frankfurt aM, und in Reims )Cham-pagne(. dn Bordeaux Pual Durieux C Cie., duai des ueyries Nro. 5. .P. 8 טיכטיגע אונד קויציאנספעהיג הגענטען ווערדען אים אין- אונד אויסלאנד, געגען האהע פראוויזיאן אנגענאממען."
044-MGD-1880-07-28-PG001-SINGLE-ORIGNAME_240249_toc_24,," הורעה המו״ס אהרן פויסט בקראקא הדפיס רשימה מכל ספרי בית מסחרו. כל החפץ ברשימה ההיא ישלח 20 צ״ל ע״פ אדרעססע דלמטה וישיג הרשימה פראנקא. A. Paust, Buchandlung Krakau, Galizien."
044-MGD-1880-07-28-PG001-SINGLE-ORIGNAME_240249_toc_25,," צום אקטאבער, אויף וואונש אויך פריהער, פינדען נאך אייניגע יונגע מעדכען, מאזאאישען גלויבענס, וועלכע אין קעניגסבערג ש  אדער זעלעקטא בעזוכען וואללען, פריינד ליכע אויפנאהמע אין מיינער פענזיאן. נע- הערע אויסקונפט ערטה. גיטיגסט הערו ראבבינער דר׳ יער אונד הערו באמבע ע זאניטעטסראטה דר׳ זאנ אהן. Anna Michaelson, Neue Dam. asse 11 קעניגסבערג דען 22 טען יולי 80."
044-MGD-1880-07-28-PG001-SINGLE-ORIGNAME_240249_toc_26,אץ דער אלטען בעטשולע איזט דיא שטעללע איי...," אין דער אלטען בעטשולע איזט דיא שטעללע איינעס מוזיקאליש געבילדעט אטען קאנטארס וואקאנט, אונד זאלל אג עזיכט דעס פראיעקטירטען נייבויאעס איי- נער גראססען זינאגאגע פראוויזאריש בע- זעטצט ווערדען ון נעבסט צייגניססען ווערדען אנמעלדו צוא הענדען דעס העררן איזראעל פריד- ער היר ערבעטען. - פארשטאנד. פאזען אים יולי 1880."
044-MGD-1880-07-28-PG001-SINGLE-ORIGNAME_240249_toc_27,," מעות לתקן. בהמגיד נומ׳ 26 צד 217 נדפס בטעות „בחדשות בישראל"" שבווירצבורג נבחר ל רב דאקטאר גרעץ, וכל השומע יניע ראש לדר׳ גרעץ אשר לא עלה על דעתו להיות ""ב בווירצבורג. ובאמת נבחר שם דאקטאר קארעף שהוא כעת רב בראוויטש בפל פאזען, והוא ג״כ חתן השמש דפה קהלתנו האלבערשטאדט. זאת אמרתי לתקן. יוסף ליב פעטוהאווסקי."
044-MGD-1880-07-28-PG001-SINGLE-ORIGNAME_240249_toc_28,, האדרעססע אלי היא: Redacteur D. GHDr in Lyck in Preussen.
