article_id,headline,text
044-MGD-1877-07-04-PG001-SINGLE-ORIGNAME_210237_toc_12,ציון לנפש.," ציון לנפש. בדברי קדמונינו אם נדקדק נמצא לפעמים בתוך ספורי דברים איזה דבר קטן שאמרוהו בדרך גדרא, והוא עיקר כונתם אשר דר בעבורו ארגו כל היריעה במעשה רוקם לצייר בה ציור פרח אחד מאד נעלה. אמרו רז״ל בברכות, זעירי הוה מפקיד זוזי לגבי אושפיז כתי׳ עד ראתא ואזיל לבי רב שרירא אזל בהדא לחצר מות אמר לה זוזי היכי אמרה לי׳ זיל שקלינהו מתותי צינורא דרשא בדוק פלן ואימא לה לאמא תשדר לי מסתקאי וגובתא דכוחלא בהדי פלניתא דאתיא למחר, ופי׳ רש״י ז״ל בשביל שמתה ילדה אמרה הכי לעגמת נפש, הורו לנו רבותינו בזה שיש למת נחת קצת באם החיים מצטערין על מותו, ומפני כן החיוב על קרובי המת להתאבל עליו כי בזה עושין נחת רוח להנפטר, ומעמידים ציון לנפשו בלבבם, מלבד שזה ג""כ יקרא דחיי ומנהג קדמון לעשות זכרון להמת בכל שנה ביום מותו (בנדרים, שהתפים נדרו ביום שמת בו אביו ואמו), ואמרו חכם שמת הכל קרוביו, עוד אמרו שקולה מיתת צדיקים כשרפת בית אלקינו, ולכן הפייטן בקינתו מי יתן ראשי מים העיר לקונן על קהל אשפיר״א, ורמיז""א, מגנצ״א ולעורר לויתן ביום הממשמש לבא, בתשעה לחדש החמישי, ויש שקורין איכה ומתענין גם למחרתו ביום העשירי כי הבית לא נשרף עד שקיעת החמה של עשירי. והנה כבד אשר ידענו אותו ואת שיחו אשר טרח שתים עשרה שנה בליטראטור העברית, הוא הרב החכם מוהר״ר ברוך ווערבער זלה״ה מבראדי, הוא המעריך המ״ע היקר עברי אנכי עזב אותנו והלך לחסות בצל כנפי שדי בעשרה ימים לחדש החמישי בשנה העברה בדמי ימיו, וכל שנותיו לא הגיעו רק לארבעים שנה על זאת דוה לבנו, ואם בחייו לא יכלנו עשות מאומה לטובתו, החוב על כל אחד מאתנו החובב חכמת עמו וחכמיו וסופריו, להאציל ביום ההוא שמתאבליו קצת, גם בעבורו אנחה אחת השוברת כל הגוף, לזכור כל צדקותיו שעשה לעמו, כי כ  דברי תורה וחכמה נשתכחו לולא טרח בעבורם הרב המנוח הנ״ל לחקקם בספר לזכרון, ולכן גם שמו וזכרו לא יסוף מקרב לבנו כל הימים, וינוח בגן עדן עם שאר החכמים והסופרים אשר השאירו מישו״ב. אחריהם ברכה, אמן."
044-MGD-1877-07-04-PG001-SINGLE-ORIGNAME_210237_toc_13,הצופהלהמגיד," הצופהלהמגיד פרחים שונים (המשך מלליון 25). ו) מנהג אמירת: לחיים במשתה היין נובע לדעתי מהכתוב ביומא (ע״ו ב׳): זכה משמחו לא זכה משממו עכ״ל. ומבקשים אפוא שיהיה השותה מן הזוכים. ז). אודיע לך מה שאמר לי אחד מאוהבי על מה שהקשית על הרא""ה שכתב בספר החנוך (מצוה צ״א): שלא הזכרו פירות אחרים חוץ מאלו בתורה בשום מקום עכ״ל: הלא נזכרו בתורה בטנים ושקדים (בראשית מ״ג י״א). ופרי עץ הדר שהוא אתרוג (ויקרא נ״ג מ')? שיש כאן טעות ושגגת המדפיסים כי היה כתוב: חוץ מאלו בחורה בי ש״מ. וחשבו המדפיסים שהוא ר""ח: בשום מקום, וכתבו כן אח""ז בפירש בלא יחות מרגלים. דאמר משה רבנו ר""ח, אבל באמת הוא ר״ת של: בש ע״ה: ולקחתם מפרי הארץ סתם ולא פירש מאיזה פירוח יקחו והם הביאו ענבים תאנים ורמונים ולא שום פרי אחד, משם יש ראיה, כי פירות סתם הנזכרים בתורה על פירות ארץ ישראל אינם פירות אחרים חוץ ממה שנשתבתה בהם א״י. וזהו שכתוב בחנוך: וצונו ב""ה להביא מארצנו בכורי פירות סתם באמת יש לדון כי על הפירות שהודיענו בתורה שהן בארץ (כונתו על הפירות שנזכרו. בשליחות מרגלים). וששבתה בהן היינו בפסוק ארץ חטה ושעורה וגו׳) על אותם צונו (וילמד סחום מן המפורש) עכ״ל. ועל כל פנים ההערה הזאת חדשה היאו להבין דעת. נפשי איננה אליה בעבור טעמים רבים ובכל זאת הבאתיה למען שמוע דעת הקהל עליה אולם הם הפרחים הקטנים, אשר קטפתי מאגרותיו ולגדולים צר המקום פה. ולהנוגעים בדינים: והלל אין מקום במ״ע. ומדי דברי בו זכור אזכור את ספרו: מבוא המ המכלכל תולדות גדולי תורה מימות עזרא עד סוף המשנה ודרכי למודיהם, ויצא לאור בפ""פ ענ""מ בשנת תרל״ו. רב ברכה בו, ואוצר בקרבו מתקו חכמים ומחכימים וראוי אשר כל חכם לב המתחקה ועל שרשי תולדות גדול מורינו ומאורינו ועל ארחות למודיהם לאספו אל תוך ביתם ולהגות בו בשום שכל. או אז מלבד מחקרים ערוכים אשר ימצאו בו יתעוררו עוד על פיהו להוסיף חקור ודרוש ותרבה ותפרה הדעת. ורבות עמי על הספר היקר הזה. אולם פה קצר המצע מאד, ואף גם יומי קצר עתה עד בלי די ואחשוך את הן לעת ירתב גבול עתותי בעזרת צורי וגואלי אשר אך אליו אשא עיני ונפשי. אזי אטיפה מלתי גם על ספרים אחרים אשר עלי לדבר  על אדותם עתה כרמי שלי לפני. עתה בו אשות כמעט רגע ואקטפה מנהו פרחים אחדים ואשימם לפני הקוראים המבינים. אולי יהיו אצלם שעשועים והיה זה שכרי. ואלה הם: 1) מדרש אגדת בראשית מודיענו דבר חדש אשר לא נראה ולא נשמע לפניו. והוא, כי הנביאים לא היו מתנבאים רק על פיב""ד של שבעים ואחד. יעוין בו (פי״ד): עובדיה לא נתנבא אלא בפני זקנים גדולים. שנאמר חזון עובדיה כ""ה אמר ד׳ (עובדיה א׳) הרי מפי הקב״ה. מפי סנהדרין מנין? שנאמר שמועה שמענו (שם). אף ישעיה נתנבא מפי מנהדרין. שנאמר ואשמע את קול ד׳ אומר את מי אשלח (ישעיה ו׳ ח') מפי הקב״ה. ומי ילך לנו (שם ושם. ושם) מפי סנהדרין. שאע״פ שהיה מתנבא מן הקב״ה אלו היתה סנהדרין זזה הימנו לא היה לו רשות להתנבאות לכך אתה מוצא את מי אשלח מפי הקב״ה, ומי ילך לנו מפי סנהדרין. ולכך נתנבאו שניהם בחזון, שחזון גימטריא שבעים ואחד, שנתנבא שניהם בשבעים ואחד עכ״ל. ושני אלה הם בלי כל ספק כבנין אב משני כתובים ללמד על כל הנביאים שלא התנבאו גם הם כי אם על פי ב""ד של שבעים ואחד. הן מה נשתנו שני אלה מכל הנביאים? על מה התיחדו אך שני אלה בקבלת רשיון מן הסנהדרין להתנבאות? וכן יוכיח הכתוב בתרגום שני על אסתר (ד׳ א׳): חגי זכריה ומלאכי. דיתבין בלשכח הגזית מקום הסנהדרין] ומתנבאין תמן עכ״ל.  (המשך יבא)."
044-MGD-1877-07-04-PG001-SINGLE-ORIGNAME_210237_toc_14,דברי אברהם.," דברי אברהם. ו). בשנת תרל״ד (1874) נשלחתי מהממשלה יר""ה לסלע היהודים בקרים לבקר את אוצר הספרים כ""י מעזבון המנוח אבן רש""ף ולחוות דעתי עליו, ולבקשתי נתן לי לעזר חכם נוצרי אחד, ה׳ סטראק שמו ראשר חשבתיו אז לאיש מהימן, ואח״כ השחית את דרכו על הארץ למען יבדוק את כ״י תנ״ך בפרטות, אשר שעתי לא הספיקה בידי רק לדרוש אחריהם בכללות. ואחרי משך שני ירחים אשר עברו עלי בסלע היהודים בדרישה וחקירה שבתי לפעטערסבורג ונתתי דין וחשבון אל  השר המיניסטער אשר שלחני בראפורט (Rapport) אשר ערכתי אליו על דבר הכ""י הנזכרים; ואחרי כן נמשך הדבר במשא ומתן עם היורשים אודות המחיר, עד כי בשנה העברה קמה האסיפה להממשלה למקנה במחיר 68,000 רו״כ ונספתה אל בית אוצר הספרים הקיסרי בפה. והנה עד הנה נודע רק מעט מזעיר אודות האסיפה הזאת, וגם הרא⸗ שורט אשר זכרתי על כי נכתב בשמח רוסיא לא נודע כלל וכלל; נוסך לזה בדברי אל שר נוצרי הוכרחתי לקצר בדברים הנוגעים רק לחכמה שראל ולשום עיני ביחוד על התועלת הכללית אשר תצא מכ""י אבן רשן להרחבת גבולות המדעים וכדומה. לכן אם על בעל המגיד טוב אפרסס בע״ה את דברי הראפורט הנזכר פרקים פרקים במ״ע זה, עם נוספות ע״פ הרשימות ולקוטים אשר קבצתי כעמיר גורנה מתוך הכ""י, ואין בית המדרש בלא חדוש (הלא ידעת כי דבריך יקרים לנו ולקוראינו הנכבדים ולכן עשה כתבונתך, המו״ל). וכגון דא צריך למודעי, כי רוב הכ""י הוציא אנן רשף מגניזות הרבנים והקראים במצרים, בארץ הקדושה, בדמשק וחלב (ארם צובא) ובעיר הית על נהר פרת, *) לכן באו בערבוביא וחסרים בראש או בסוף, גם נמצאו בחבילה אחת לפעמים עלים שונים מחבורים נפרדים וכדומה, והמלאכה לסדרם כנכון ולהבדיל בין החבורים השונים ולקרוא להם בשמות אשר קראו להם מחבריהם ארוכה מאד, לא לשנה ולא לשנתים. וברצון הממונה הראשי על האוצר הספרים קיסרי החלותי מלאכתי בספרי התורה והתנ״ך הרבים, ומיום בוא האסיפה הנה לא הספיקה השעה בידי לעיין בכ""י הרבנים והקראים כבדים לקחת רק באקראי ולעתים רחוקות; לכן אבקש מהקוראים ה' מידי לרצון את ההערות הקטנות אשר אתן לפניהם, והנה תהיינה רק כמפנות דרך אל הקאטלוג אשר אפרסם ברצות האל אחרי בדיקה בפרטות כל החבילות הרבות. כל האסיפה נחלקה בראפורט לתשע מחלקות, ואלו הן: 1 כ״י תנ״ך ומסורה. .11 ספרי דקדוק ושרשים. .111 פירושי תנ״ך. .1 כ""י הנוגעים לקורות הימים ולחכמת הגעאגראפיע. . ויכוחים בעניני אמונה. .71 ספרי שיר ומליצה. .V11 ספרי דינים והלכה,  ספרי פלסופיא וחכמת הדת; איזה מכ""י שומרונים. .12 ספרים שונים, כמו בחכמת הטבע, ברפואה, וכו'. בפעם הבאה אדבר אי""ה ממחלקה הראשונה ואחרי כן על המחלקות הבאות כסדרן. ז). באחת מהערותי במחברת אלטאידישע דענקמעלער (צד 282) הבאתי דברי חכמי הקראים המחירים ההליכה בשבת; אולם בכל זאת נראה כי איזה מחכמיהם הבינו הכתוב אל יצא איש ממקומו ביום השביעי שמות ט״ז כ״ט) כפשוטו, כי ר' אברהם חיים ויטרבו מויניציא יאמר בס׳ אמונת חכמים בוכותו עם הקראים: „גם הקבלה שלהם בענין השבת משובשת היא שאינם יוצאים מבתיהם והכתוב אומר אל יצא איש ממקומו שהוא על חתום שבת"" (טעם זקנים צד 37). ואולי נתחלפו הקראים על החכם הזה ביהודים אחרים היושבים במדינות הרחוקות ולא הגיעו אליהם דברי חכמי התלמוד, כן למשל יעיד הנוסע ר׳ יוסף הלוי כ הפלשים בני מדינת כוש לא יצאו מפתח ביתם ביום השבת כי אם בהכרת וצורך גדול (לבנון 7,479). אברהם אליהו הרכבי. *) ומצאתי בסלע היהודים את הקריאה אשר קרא אבן רשף באזני הקראים יושבי עיר הית להערים ולעוררם שיתנו לו את הכ""י הנמצאים אתם, וזה נוסחה: „ב""ה היום יום ששי ט""ו לחדש כסלו שנת תרכ״ד לפ""ק פה ארם זרנו בני בריתנו בעלי מקרא קהל קדש היו בא יע״א. שלום רב לאחינו יצ""ו מנ לם ומד קטנם ה' עליהם יחיו ולאלפי רבבה יהיו אמן אמן. ידיע מוניות כם כי אנכי שלומי אמוני ישראל החתום מטה הדורש קדו הוא לכו אבותינו הקדושים זה שלשים שנה וכאשר שאלתי על בית הכנסת שהיה לנו עיר דמשק מימי רבנו ענן הנשיא ע""ה הודיעוני שהוא נמכר לארמניים ע""י ה״ר אברהם לוי פקיד ירו׳ תוב״ב ויעשו ממנו בית עבודתם ועל זה בביתי תמרורים כהמר על היחיד ונתעוררתי ובאתי מעיר המלוכה פטרבורג פה חליב ומכאן אנכי מוכן לנסוע לעיר דמשק להשתדל בכל לבבי ובכל נפשי ובכל מאדי תון לי מאת המלך סלטן עזיז בקושטנדינא להציל מיד הקונים בכח הפיו קדשנו ותפארתנו אשר הללו בו אבותינו את ה׳ י""ת. לכן אם יש את שלחו מכם איש פקיד לעזרתי כם ש מצוה זו אבל  לבבכם כמוני לדבר מדינה ומקהל מצרים יצו. ואני על משמרתי אעמודה כמו שעתיד לבוא מקהל ר  לותינו הק' אשר תחת מלכ נשק ואצפה לביאת הפקידים מק בכה ב  עאל כי לא אוכל לעשות דבר זולתם הואיל כי אני מבני מקרא שתחת ואם בטוח אני נכון לבי כי בעזרת ה׳ חילים נגבר ונצ  מלכות רוסייא וב לדבר לפועל כי הדין עמנו. ואני לא אחוס על כספי ועל טרחי עד נוציא  את ה׳ צבאות תעשה זאת. רק אתם ברוכי ה' מהרו לשלוח את פקידל ומה טוב ומה נעים יהיה אם יבוא כהר׳ שלמה הלוי חזנכם יצ""ו אם עודנו בחיים אותו תשלחו. ואולי נציל גם את רחוב הקראים ואת בית הכנסת אש כם להודיעני אם יש את לבב בחברון מידי הרבנים בעז""ה. וזאת שנית אבר לשלוח פקידכם אם לא שלא אהיה בתוחלת ממושכה מחלת לב בדמשק ולהודיעני כמה בעלי בתים אתם וכמה מספר נפשותיכם הזכרים לחוד והנקבות לחוד. ואם בכם נשיא מזרע ענן הנשיא ומה שמו. וכמה בתי כנסיות וכמה ספרי תורה וכתר תורה ואיזה ספרי קדמונינו כתבי יד נמצאים אצלכם ומה שהותם ושמות מחבריהם זצ״ל. וכל זה במהרה למען השם כי לא אוכל ל כב זמן כם יצי הרבה לאבד את זמני והוצאות כספי חנם. ובזה שלום שלום לכל קהל מפי אני אברהם ירו' בן שמואל פי קוויץ נ""ע ומפי אהובי ניני כ""ר שמואל ליל יצ""ו הנוסע עמי ומפי כ""מ שמחה הלוי ירו' אשר בא מירושלים ו׳ המשכ זרתי יצ״ו. ואם יש תחת ידכם אי זה חוגיט כתב זכותן נתון ממלכות ישמעאל על שם בני מקרא יביא פקידכם עמו לחזוק הדבר או תשלחו בתוך ברת על ידי איש נאמן. ואם תשלחו הפקיד או האגרת שלחו לבגדר לאיו סנדר קונסול של רוסייא והוא ישלחהו פה חליב לקונסול של רוסייא דל  והוא יעהו לי לעיר דמשק בשלום בלי שום ספק. ושלום שנית"" עד הנה תביו אלי שמעו ה דברי מכתבו, וכפי הנראה מ אים אשר בהית לקולו ושלחו עם איש מיוחד את (כל? הנותר אצלם לפלטה מכ""י קדמונים בעבריר וערבית, ונכללו באסיפתו השניה אשר אני עוסק ברשימתה. ואחרי כן בראשית שנת תרכ""ה נתקשר חתנו ר׳ גבריאל פירקוויץ עם נוסע מפורסם אחד מאחב״י לנסוע בארצות מצרים תימן והודו עם סחורות איירופא ולקנות במחירן סחורות אזיא וכדומה ג״כ ספרי כו'; אך כפי הנראה לא יצא הדבר מכח אל הפועל, כ״פ לא נודע לי מאומה מתוצאות הדבר."
044-MGD-1877-07-04-PG001-SINGLE-ORIGNAME_210237_toc_15,," כשר Hotel de Saxe כשר Berlin C. Burgstr. hro. 20. פארציגליכע רעסטויראטיאן. ציממער פאן 1 מארק 50 פפ. אן. J. Cohan, Traiteur."
044-MGD-1877-07-04-PG001-SINGLE-ORIGNAME_210237_toc_16,," הודעה ע״ד מסחר אתרונים. נודע ברבת בני עמי כי יש לי כ״ה שנה בשנה מסחר גדול באתרונים מכל הסארטין מגינת קרפו פארגער, גענעווער, קארסיקאנער, ומאראקער, גם לולבים והדסים לחים, ובן אחי הרב הגאון אבד״ק סמאלעוויטש נוסע תמיד בכבודו ובעצמו לטריעסט וגענווא, ויש לנו ב״ה קאמיסיעם מרבנים וסוחרים גדולים ורבים, וכן לא יגרע אי״ה גם בשנה זו, וכל החפץ יוכל לקבוע אצלי לקנות למענו בתורת קאמיססיאן בעד שכר טרחתנו דבר קצוב, ויפנה אלי על אדרעסס שלי שהוא כחתימתי ממש, (כי המלות „משכיללאיתן"" הוא כנוי הפאמיליע שלי גם בכתוב עמים) וימולא אי״ה חפץ כל אחד עצהיו״ט.  נפתלי משכיללאיתן בעיר גובערני מינסק"
044-MGD-1877-07-04-PG001-SINGLE-ORIGNAME_210237_toc_17,," הודעה צו דער אם 11 אונד 12 יולי שטאטט- פינדענדען ציעהונג 2 קלאססע 272 האמ- בורגער שטאדט-לאטטעריע, עמפפעהלע זייט לאנגען יאהרען שטעטס פאם גליקק בע גינסטיגטע קאללעקטע בעסטענס. וויעדערפערקייפער ערהאלטען פראוויזיאן אונד אנגעהמבארע בעדיענגונגען. הירצו עמ- פפעהלע אריגעינאללאזע 1 4 18 מארק 12 4 9 מארק 1 4 4 מארק 50 פפעניגע. Pinkus Heller Haupt-Collecteur der Braunschweiger Landeslotterie und Hamburger Stadtlotterie. HABuPR"
044-MGD-1877-07-04-PG001-SINGLE-ORIGNAME_210237_toc_18,," אל אחב״י יושבי רוססיא ופולין. סורו נא בבית אכסני׳ שלי האטעל וואר- שויא קלאסטער שטראסע 51/50 אשר הכינותי פה בערלין זה שנים, להפיק רצו כל אורח הבא בצל קורתי הן בחדרים מפוארים, והן במאכלים ערבים לחיך טועמם וכשרים כדת. שבתי מאיר בר״ז ליפשיץ. דעפעשע אלי „חאטעל ווארשויא בערלין, דוי בכך."
044-MGD-1877-07-04-PG001-SINGLE-ORIGNAME_210237_toc_19,," האפאמירק  של האדון קאמינסקי ברחוב שוויענטאיאנסק האט אב גיקויפט אפאטייקער ה׳ גינזבערג אונד האט שוין איבערגינאמען אונטער זיי פעוואלטונג, אלזא חאבען מיר נאך איינע אפאטייקע אין ווילנא וועלכע אן איין אידען גיהערט ז״ה מווילנא."
044-MGD-1877-07-04-PG001-SINGLE-ORIGNAME_210237_toc_20,," הודעה. סורו נא לבית אכסניא שלי בהרבה חדרים וגם יש לי שיפס קארטין ביליגער לאמעריקא ולענגלאנד ולשוויידין וגם אקבל קאמיסיאנס גישעפט ולשמור בדרך ופה בבואם ג״כ מן הרמאים אשר יתימרו בשמי רק פרעגין יצחק שורסקי. ומעיד עלי הרב הגאון הגדול יצחק אלחנן יהי׳ אב״ד מקאוו נא. יצחק טורסקי בהרב ר׳ חיים שור זצ״ל, אב״ד בקארעליץ ואח״כ בווילנא בקלויז ג״ח בעהמ""ח ספר טוב החיים אדרעססע שלי: יצחק טורסקי אייכין הארץ 23 האמבורג."
044-MGD-1877-07-04-PG001-SINGLE-ORIGNAME_210237_toc_21,," עֲנֵק לְגרגרוֺת הַיָּלָדִים והוא: עלעקטרא-מאטארישע צאהנהאלס בענדער להקל מחלת השנים לילדים רכים ולהסיר מהם כל נגע הבא לרגלי המחלה ההיא, נמצא אתי למכירה לכל דורש בכל הארץ במחיר רו״כ אחד עם הפארטא. לקונים עשרה ענקים פעם אחת אנכה 23/6 ראבאטט ואשלח ג״כ חפשי לידם. ווארשא בחדש אייר תרל״ז. אליעזר יצחק שפירא. L. J. Schapira Sto. Jurskaia Nro 22 Warschawa"
044-MGD-1877-07-04-PG001-SINGLE-ORIGNAME_210237_toc_22,," מודעה. כל המוכים במחלות אשר מוצאן מימי הילדות כמו חסרון כח המוליד וחלישת העצבים (אימפאטענץ אונד גערווענשוועכע) וגם המוכות במחלות נשים. ימצאו מזו ותרופה על ידי. גם לחולים מערים אחרור או מארצות רחוקות אמציא מזור ותרופה בכתב, אחרי אשר יודיעוני מחלתם וכל אשר יחסר להם בכתב, אשיב לאיש ואיש ככתבו וכלשונו (ר״ל בלשון עבר, אשכנז או צרפת). אדרעססע: N. Wollner, Doctor der Modicin und Chirurgie, Aocoucheur in Wien, Stadt, Adler- Passe Nro. 8. (הערת המו״ל). הרופא המחולל הנ״ל נקרא ע״י מכתב מאדון אחד באר- רוסיא לבוא אליו לרפאותו ממחלתו. ובעברו דרך פה ראינוהו גם אנו והכרנוהו לאיש ישר ונאמן בדבריו ובמעשיו וחזקה שלא ציא מת״י רק דבר מתוקן ולכן ראוי הוא לסמוך עליו, כי כבר אתמחי נברא בחכמת  הרפואה."
