article_id,headline,text
044-MGD-1882-08-30-PG001-SINGLE-ORIGNAME_260253_toc_11, רוסלאנד,"  רוסלאנד הוראדנא. לבעל המגיד. פה עירנו קרה מקרא נורא, כי ביום ב׳ כ""ה לירח מנחם אב בשעה הששית אחר הצהרים, נשמע פתאום בעיר קול נורא כקול רעם בגלגל, מקדקר קיר ומשבר חלונות למאות, ויתאבכו נאות עשן. כל לבות בני עירנו רגזו לקול ההמולה הזאת ותהום כל העיר, וגם אנשי חיל המכבים זו לבא למקום המהפכה, ויודע הדבר כי באחד מבתי אוצר בלי ברזל היה ספון אבק-שרפה בעת אשר שני נערים באו אל הבית בפקודת אדוניהם לעשות מלאכתם, ויגיעו את הברזל ויצא נצוץ ויגע באבק-השרפה, אשר התלהט וינפץ את הבית לרסיסים, וגם את בית חומה הקרוב לו, וכל מטילי הברזל וקירות הבית וקירותיו רצו, עפו, ברוח בגלגלי-סופה, וחמשה אנשים נפזרו אבריהם לכל עבר לפינה, וברחובות קריה הרחוקים ממקום המהפכה נמצאו חתיכות בשר מגויות הנהרגים. נורא היה המראה לראות אברי אנשים מתבוססים בדומן על פני האדמה, ורבים אומרים כי עוד פגרי אנשים נמצאים תחת ערמת עפר. ברוך ה׳ כי הפליא חסדו לשלש עשרה ילדים קטנים אשר למדו בבית הזה, ובאיזו שעות קודם לא הניחתם בעלת הבית ללמוד במקום ההוא, כי פתאם נפל בנה למשכב ויצאו מן הבית וכה נצלו מן המהפכח לשמחת לב חוריהם. ב קרד״ס."
044-MGD-1882-08-30-PG001-SINGLE-ORIGNAME_260253_toc_12,אזיען.," אזיען. פעה״ק יפו תובב״א כ״ד מ״א התרמ״ב. — אדון נכבד! הועד מתכבד להודיעו כי אחרי עמל ותלאה רבה הצליח ה׳ מעש ידינו, וקנינו לנו אחוזה באה״ק כברת ארץ טובה דשנה ופוריה סמוכה מהלך שעה ורביע ליפו וקרובה לדרכי המלך לירושלם ועזה, ובישע ה׳ החלנו ליסד עליה המושב הראשון לעבודת האדמה אשר קראנוהו בשם ראשון לצין אנטין נ״י הראשון למיסדי המושב הגביר הנכבד מוהר״ר צבי לי הזה, הואל למסור חלק מהאדמה לשש משפחות עניות מפליטי רוסיא, כי ישלמו מחירם מעט מעט במשך חמש שנים, והיה הכסף להוצאות הדרושות לעדת המושב. אבל עוני משפחות האלה גדול מאד כי המה משדודי ערי המהומות, ובידם אין כל כמה לבנות בתים ולקנות הדברים הנחוצים לעבודתם.  כי על כן בשם אהבת אדם מחלים אנחנו פני כ׳ הרם להושיט עזרתו להאומללים האלה, לתמכם ולסעדם בהשתדלותו בי מיודעיו לחמול עליהם, וה׳ כגמולו ישיב לו, שמות המנדבים יזכרו לטובה, וחשבון הנדבות והוצאותיהן ודפס גלוי במכ״ע העברים. בשם הועד ז. ד. ליעוואנטין (ראש הועד). הנדבות ישולחו על אדרעססע: H. An zalak Esd. V. Consul, Jafa. Palastine. בעד ה׳ פיינבערג סוכן עדת ראשון לציון."
044-MGD-1882-08-30-PG001-SINGLE-ORIGNAME_260253_toc_13,אפריקא.," אפריקא. ב״ה יום ר״ח אלול התרמ״ב פה אלכסנדריא של מצרים. — (משא מצרים) לכבוד מ״ע מו״ל המגיד הי״ו. באתי להודיע בקצרה מכל אשר קרנו בימי המהפכה. מיום ב׳ קודם יום המלחמה עליתי עם כל אשר אתי לאנית מלחמה של אמיריקניתי. יום ג׳ בבוקר התחילו להשמיע קולם כל אניות של בריטניה ומקולם אשר מעתי בפתע פתאום נבהלתי ונחליתי ועתה ב״ה שבתי לאיתני ביום ו׳ אחר שירדו חיל הבריטנים לעיר ירדתי לעיר, גם אני, וראיתי ב״ה כל אשר לי שלום. וביום המלחמה עשר שעות רצופות בלי הרף ירו זה על זה. —סוף סוף המצודים והסוללות נהרסו. וכאשר ראה עראבי-באשה כי ידיו וחילו לא הושיעו לו ונפלו מחילו ב' אלפים ביום ד' בשבוע, צוה לצבאיו שלא יורו כלל וצוה לחילו לנסוע אחריו הרחק מן העיר ערך ד' שעות ונתבצר שם עם כל חילו, וגם העביר קול ברחובות הישמעאלים כי בדעתו לשרוף העיר, ואז יצאו כבהלה ובחפזון כל הישמעאלים. אנשי החיל התחילו לשבור הבתים והחנויות לשלול ולבוז והרגו כל השומרים אשר על החנויות ואח״כ שרפו את מבחר חלק העיר ואותם היהודים אשר פגעו על דרכם המיתו, ונוצרים רבים אשר היו נחבאים בבתים המיתו אותם. כדורי הבריטנים לא עשו נזק לעיר כ״א איזה בתים אשר פגעו בהם הכדורים עשו חלל ולא יותר ויום ה׳ קודם הערב ירדו הבריטנים לעיר החרבה והשוממה וג׳ ימים נמשכה השריפה. הבתים היותר גדולים אשר כל א׳ מחזיק השמועות הרגו יהודים אשר בכפרים ושללו שללם וגם שרפו ס""ר והדרן סגור ומסוגר אין יוצא ואין בא מפחד עראבי באשה אשר עומד על אם הדרך, ויש אתו כ״ה אלפים אנשי חיל מלומדים וחמשים אלף מן בני האספסוף, וחיל הבריטניה לא יותר מן י אלף איש ומצפים יום יום על חיל הסולטאן ועל חיל הודו לבא. ברצונם לערוך אתו מלחמה פנים ואחור. איך שיהיה עתה כל הדברים יגעים. מבא המים סגור על העיר וכמעט אין מים לשתות, וגולים רבים באים יום יום לראות בתיהם וחנויותהם. הצירים נתנו צו שלא יביאו האניות עוד מן הגולים מחסרון המים. והבריטנים לא כבשו עדין כ״א אלכסנדריא לבד ויש פחד שלא יפול עראבי באשה עם חילו על העיר, אם כי עשו הבריטנים כל דבר אשר ימנע האויב לפול על העיר ומי יודע איך יפול דבר. זה הוא מצב העיר. כרגע אין דעתי מיושבת עלי לכתוב בארוכה והנני מקצר ואומר שלום ידידו פרג חיים מזרחי ס״ט."
044-MGD-1882-08-30-PG001-SINGLE-ORIGNAME_260253_toc_14,"אנח אנחנו עולים? (מאת משה קליין).
ג."," שקול הדעת שרכשנו לנו מן התולדה והנסיון. (שטת אדמת אמעריקא גדולה ארבע פעמים כאירופא, ומספר תושביה מאת אלף אלפים נפשות). והקאנטינענט הזה יכונה תמיד בשם עולם החדש, מבלי ידעו רבים על מה ולמה? - הסבה ראשונה לזה, היא: יען שלא נודע מקדם*). ב) על ידי סגולות נפלאות חדשות שמצאו בה בני אירופא. חדש או צעיר הופיעו לעיניהם פניו החצונים, בין במה שנגע לטבע אדמתו, ובין במה שנוגע לתכונת הטס שתנה עליו, כי שטחיו הרחוקים לא נזרעו רק עיר שם זעיר שם, בקעות בנה ואגמים שוממים עם יערים עתיקים פרשו את מוטות כנפיהם במרחב האדמה אין קץ, ועין אדם לא חדרה במקדש הטבע האיום והנורא ההוא; מרוץ הנחלים ושטף הנהרות בגלו בלי סדר ומשטר נכון ותמיד עברו את גבולותיהם וישימו אדמה לאגם מים. אוצרות המתכות היו טמונים בבטן האדמה, ויד אדם לא שלטה בהן, שבטי העמים תושביו מקדם היו בעצם ימי עלומים ונתגדלו על ברכי הטבט אם כל חי. כל אלה שהיו במצב הילדות, הורו כמעט באצבע על עת יצירה חדשה! ואם ממצב-נקודת- הקולטור שזרעו עליו נודדי עמים רבים, נשקיף עליו, אז נוכל להצדיק ביתר שאת את השם „תבל- החדשה״. לטומת עולם החדש הזה תחשב אירופא שלנו לעולם הישן, יען כי דברי ימים חשתרגנה הלאה מגבולות אלפי שנים אחדות, ובחרות גוייה בלעת בתהום העבר. רך השמרו לכם קוראים לחשוב בהמלה „ישן גיעה עיפה, עמלה, פסיקת-הכת, עמידה מלדת גדולות בכל ענפי ההמצאות, והנחת-דממת-הרוח (גייסטעס שטילשטאנד), כמו שרוח האדם ינות מזטף הבחרות לעת זקנותו! - אם אמנם: הקולטור ההמוניח תדמה להסב את כדור הארצי ממזרח למערב, אך אם יחשוב האחד כי תעתק הקולטור מאירופא ותשקע באמעריקא ושם תבנה בית זבול לה ותכונן בתבונה כסאה, אז, אף אם יצלצלו דבריו בצלגל נעים לאוזן שומעת, בכל זאת האמת תחסר להם, יען כי גרעין אירופא לא נרקב עדין. אנגליא וצרפת מלאות כח עלומים ומלכותן בקנה, תבל מושלת במקדם. השכלת אירופא הבשילו אשכלותיה ענבי החכמה והמדע ותמלא פני תבל תנובה; פרוסיא שהחליפה כתה זה מעט ותפרוץ ימה וקדמה צפונה ונגבה, נותנת החיתה בארצות החיים ובכל מקום מוגש לשמה מנחה טהרה, ורוב עמי אירופא ילכו במסלת הקולטור ולא יגעו ירוצו באורת האינדוסטריא ולא ייעפו. כל אלה יתנו עדיהן, שאירופא לא בלתה עוד מזוקן, ועוד תחלופנה עדן ועדנים עד שתתנשא אמעריקא בצדק עליה; הכלל הזה יהי׳ לכלי המדה בידכם: כל עוד שתצעד אירופא בצעדיה הנוכחים קדימה, והדעספאטיזמוס האזיאטי, וקנאת הדת הרומית ילכו כענן מעליה כל עת ההיא לא תנום ליחה ולא תכהה עינה מאור פני אמעריקא. ואם נבין בהמלות ישן וחדש ספרות ולשונות חיות, אז לא נוכל לכנות את התפתחות האמעריקאנית „חדשה"" רק  המשך מהאירופאית! ההבדל שבין אירופא לאמעריקא). מעולם לא עלה על אירופא עול עמי קונטור זרים. צור מחצב עמי אירופא לא נכחד מתחת שמיה, או נדחף ע״י עריני גוים מעולם. שפות אשורית, פרסית, מצרית, לא התערו כאזרחים רעננים על אדמת חלק התבל הזה, רק התחרות להתפתחות כותותיהם הרוחניים, קבלו פראי-אירופא מארצות הקדם, אבל בחיי האזרתי והמדיני, בלשונות וספרות, השכילו את עצמם בלי מורים מעמים אחרים, מלבד כתבי קודש שלמדנום אנחנו לא בחרב ובאש רק בשם ה׳ התופף עליהם. — אחרת נחזה באמעריקא: שם לא תשלוטנה השפות והליטערטורען של שבטי הנאדאוועסים, קאריביזים, אביפאנוזים, מעקסי- קאנים, כי הם סבלו בדומיה את שנטלו האורחים עליהם, ולא עמדו על נפשם כשנגרשו על ידי האירופיים, ששתלו את לשונות ואמונות אירופא על חבל ארצם, ולפי זה יחשב עם האמעריקאני לילד אירופא, וזה מקרוב לבן שעשועה, המשתדל לכלות את שהחל באירופא לעשות, ובן יקר הזה משיב אהבה אל חיק אם הורתו ע""י המסחר הגדול. (תושבי אמעריקא) הסבה להתפתחות המדינית איננה תלויה בטבע וצירת אדמתן בלבד, כי חלק גדול מהן אחוז ומשולב בעקב השתלשלות העם מראשיתו; גזע יון שלח ענפים אחרים משורש מצרים. לעולם ישתנו מדינות גרמניא מארצות אנגליא, הכת ההודית האדומה ששטה בחור דיגים על חופי הים ושפתי נהרות, או הצטידה ביערות עתיקות לצוד ציד בהמה חיה ועוף, היתה עם לא בינות להשתמש באדמה ואויר, נחלים וימים, לנחותם אל מחוז חפצה. היא לא היתה מיסדת לעולם מדינות קולטוריות, או ארצות חפשיות כאלה היום; יצירות כאלה לא יכלו להיות רק פעולות בני אירופא שפעלו באופנים שנים. 1) ע""י חינול את ילידי אמעריקא בחינוך אירופי, ויציקת רוחה עליהם, 2) ע״י קנית האדמה, או גם לכבשה מהם ביד חזקה כשפרבו להקשיב למוריהם. והאופן השני היה העיקר, כי החלק גדול שבהם מכרו אחוזותיהם בכסף *) הדעה האמיתית בתכונה החדשה שהארץ כדורית היא וסובבת במעגלה את השמש נמצאת מפורש בהזוהר ויקרא דף יוד ע״א באמרו: ובספרא דרב המנונא סבא פרש יהיר, דהא כל ישובא מתגלגלא בעיגולא ככדור, אליו לתתא, ואלין לעילא, וכל אינון בריין משניין בחזוויהו משינויא דאוירא, כפוס כל אחד ואתר, וקיימין בקיומייהו כשאר בני נשא, ועל דא אית אחר בישובא, כד נהיר לאלין חשיך לאלין, לאלין יממא, ולאלין לילא, ואית אחר דכוליה יממא ולא אשתכח ביה ליליא, בר בשעתא חדא זעירא, והאי דאמר בספרא קדמאי ובספרא דאדם הראשון, הכי הוא עכ״ל. והוא פלא, כי עוד האמינו אז עמים רבים בדברי האמער ראש משוררי יון כי השמש אל השמים יבוא בערב אל תוך הים, ובבוקר יעלה מן הרחצה וישוב אל אוהל השמים וישיש כגבור לרוץ אורח, או בדברי העראדאט, שצחק על אלה שהחליטו כי הארץ כדורית בשאלו איך לא יפלו הברואים ממנה? אנח אנחנו עולים? (מאת משה קליין). ג. בטח ישתוממו רבים על שאלה זו ששאלנו זה כעם השלישית בפתחי מאמרנו שנראה ממנה כי נתכיצה אירופא ולא תכיל אותנו בקרבה עוד, ואמעריקא גם היא, אין אדמתה מחזקת את גולי רוססיא, ואם איפא ארצות אירופא ומטר פולין שלהן שראינו בהן חיים הרבה מאות שנה ובפרט מאז נהרסו „הגעטות"" שהיו „כגט כריחות"" להבדיל אח מושב עם ישראל ממושבי שכניו הנוצרים!? או איפא היא אמעריקא שנגלתה בשנת הגלה יהודה מספרד אשר על דעת חכמים רבים כהיינע וסיעתו אצבע אלקים היה המקרה ההוא לתור מנוחה לעם ממושך ומורט בין שבטי עמים שנרדפו גם הם על צוארם באירופי. הן ה׳ ווענעציאני אמר לחלק את הגולים באירופא, וה׳ אייזענשטיין מושך אותם לאמעריקא, א״כ אין לנו הצדקה לזעוק עוד בראש הומיות „אנה אנחנו עולים?״. שאלות אלה וכאלה יערימו עלינו חמרים חמרים עד כי נרבץ תחת משאם, ולצאת מן המצר אנוסים אנחנו להסב עיננו על זמן מה משאלה הנ״ל, ולשאת השקפתנו על טבע והשתלשלוח ארצות הברית, אח״כ נטיף דברים אחדים על דבר מצב עמנו באירופא ונשפוט עליהן בלו נטיה צדדית, ואז יוכחו הקוראים כי שאלתנו מיוסדה על והנשארים אשר גם בזה לנו חפצו, נהדפו מנחלותיהם בחזקה וכלם העתיקו נויהם חימנה, והתערבות לא היה בינם ובין בני אירופא. — מבני אירופא הצטיינו האנגלים שהיו שם במספר רב להיות אדוני הארץ. לכת הבריטות נאוה תהלה, כי ידה יסדה ארץ החדשה וימינה טפחה שמי החופש! ומה רב טוב אשר צפנה היא לכל העמים בהושיטה את שרביט מלכותה שמה ! כי לו כבשוה הפורטוגעזים, או הספרדים, אז היו מביאים גם הם אתם בהמות ביתיות מלאכת ידים, מלאכת הכתיבה, ובלי חפונה היו שותלים על אדמתה גם מדות טובות אחדות כמו: סדבי המדינה (שטאאטסארדענונג) ערים וכפרים ובתי ספר, אך חיי הפנימי והחצין היו לובשים צורות אחרות, בגדי אבל, ועל שכם יעטו, כי אח רוח האדם היו סוגרים בכלוב, ועל כל אומר והגה הפקידו אורבים. קנאת הדת היתה מושלח בחרב דם ואם כבערי שפאניא מקדם, כאשר יורנו דברי הימים כי היהודים הראשונים שנאחזו באמעריקרא במדינות שנחשבו אז לספרד ופורטוגאל, נאלצו לברוח מקרבן ולהשתקע באמסטרדם החדשה הלא היא נוי-יארק; החופש והאור השוררות על חצי הקאנטינענט אשר רבים יאותו לאורן, הנה: אך קרני עם אנגליא הנאור, מידיעתו הרבה בחכמת כלכלת המדינה, מהשקפתו על משפט האזרתים, והכנסת הנוגרת מוצאה. בכל זאת ישנם ענינים מחמיהים המבדילים בין אנגליא העתיקה לאמעריקא הצעירה ומהפכים את טבעי האם ובתה כססגונא.  ככה נמצא דרך משל את הדעמאקראטיא שולטת באמעריקה בממשלה בלי מכרים, בעת שלא חדלה עדין האריסטאקראטיא למשול באנגליא ממשל רב. והסבה לזה היא: כי נודדי אנגליא הראשונים לא היו מבני עליה, כי כל איש שמצא פרנסת ביתו בארצו לא לקח לו מקלו ותרחילו לעבור ארחות ימים, ורוב הנודדים היו אנשים שסלו למו מסלות חדשות בדרכי האמונה כמו כחות: הפרעסביטאנים הפיריטאנים, והדיסענטעריס, שעזבו את ארץ מולדתם בראותם כי המה כמעט בבשר החי להאמונה הכללית, וינועו לאמעריקא במאה השבע עשרה למען יוכלו לעבוד שם את היונד כחפצם וכהעולה על רואם בלי מפריע, אף אם בזעת אפיהם יביאו לחמם. מובן הדבר כי מרי נפש ההם לא שמו בכלי גולים שעליהם מעט צרי ולוט האריסטקראטיא יען יכלו לחיות גם בלעדה, ותחתה הציבה להם שלושה עמודים שעליהם העולם קים הלא המה: „ליבערטי. איגאליטי, פראטערניטי"" או במלים אחרים: „חופש, שויון, אחוה״. את רוח צפונית מזרחית המלאה בחופים רבים, ואשר החום לא יבעיר בה באש לא נפת, אוו למושב להם, ויקראוה „אנגליא החדשה"" ובעזרת השם הזה הגליתו בכשרון המעשה ובהתפתחות כחותיהם מולדת אנגליא, ויתקעו להם יתד במקום נאמן במערב לנהרי האדסאן, דעלעוואדע, והן המה הרוח החיה באופני חצי הקאנטינענט. דעמאקראצי אנגלית יסוד הטבעי היא „להאנגליס- האמעריקאנים"" חוקיהם ומשפטיהם ממע אמם יצאו, ובהם הלקח חוקיהם ספון. את חופש האמונה שמו לחוק עולם ולא יעבור, ואין יתרון לאחת על רעותה לפי דברי ספר החוקים שלהם *). לכן תתגאה אנגליא עם בחה הצעירה והיפיפיה המושלח על שתים וחמשים אלף אלכים נפש אדם מכל משפחות האדמה יושבי על חצי קאנטינענט ההוא. ואם בגדה בה זה מאה שנה, וחצא לנפשה למרות רצון אמה שקראה אליה שובי והתענו תחת ידי, הלא בכל זאת האירה פניה אליה ותתקשור אתה במעדנית אהבה ע״י שהשליטה אח שפתה וספרותה בארנות הברית, גם על ידי שכרתה אחה ברית המסחר שאין בתבל משלו. ובצדק נוכל לקרא אליה: אשרך בריטאניא כי חננך ה׳ בבת חמודה כזו. יהי לבך נכון ובטוח כי כאשר יפקד עליך פקודת כל העמים, אז לא יסוף שמך וזרעך לדור דורים."
