article_id,headline,text
044-MGD-1875-12-15-PG001-SINGLE-ORIGNAME_190417_toc_15,"לאמזא,כ""ג מרחשוון.בשנת 1870 היה מספר גרי..."," לאמזא, כ״ג מרחשוון. בשנת 1870 היה מספר גרי ארץ רוססיא 35,465,345 זכרים 36,265,700 נק׳, בס״ה 71,730,980 במספר זה נמצא אנשים מבני אמונת רוססיא 54,888,091 נוצרי רומי 7,494,516 יהודים 2,759,811 מחמדים 2,364,080 עוואנגעלים 2,683,303. ועתה זה לא כביר הוציאה לאור החברה הגעאגראפית הרוססית מפה מארץ רוססיא האירופית, כפי הודעתה מדת שטח ארץ רוססיא האירופית 90,000 פרסאות מרובועות, 75 מילליאן נפשות מספר תושביה. ממספר זה מדברים 75 בשפת רוססית 6% בלשון פולנית 3% יהודית אשכנזית וכו׳. בימים האלה יתחילו בארצנו ימי הגורלות לעבודת הצבא התמידות. כפי אשר יודיעו המ״ע בארצינו יהיה מספר האנשים אשר ילקחו לצבא התמידית בשנה הזאת מכל ארץ רוססיא האירופית 180,000, שלושים אלפים יותר מבשנה הקודמת, לפי זה יעלה ממחוז ווארשא 1,878 אנשי חיל, קאליש 1,408, לאמזא 1,003, לובלין 1,516, פלאצק 1,004, ראדעס 1,035, ווילנא 2,329, גראדנא 1,569, קאוונא 2,698 וכו׳ בימים האלה נגמרה רשימה ממספר האנשים הנמצאים בארצות בריטאניא אשר בהודו, לפי הרשימה הזאת עולה מספר תושבי ארצות ההם לערך 238,830,958 נפשות, לפי החשבון יעלה על כל פרסא אנגלית 21 נפשות, ממספר זה יתחשבו 149,500,000, בראמאנים 40,750,000. מחמדים 9,500,000, יהודים, בודדיאנער, פערסיאנער וכו׳ בנסיעה האחרונה של המלך שוועדין באשכנז בקיץ הזה. קרה ענין נפלא ומתמיה כל שומע, על התחנה של מסילת הברזל בערלין והאמבורג בוויטטענבורג. המלך ובני לויתו ירדו שמה לסעוד את לבם בסעודת הצהרים אחר הסעודה הושיט לו בעל הבית חשבון ההוצאות על סכום גדול ונפלא אשר לא נשמע עד עתה. בעד עצי גפרית לבד נחשב מאה טהאלער! ועתה יכול הקורא לחשוב בעצמו עד כמה יוכל לעלות סכום הכללי מכל הסעודה. המלך אסקאר השני עשה א״ע כלא מתבונן וצוה לפקידו לשלם את הכל, וכאשר שב מנסיעתו לארצו שלח את החשבון הנפלא הזה לקיסר אשכנז ותומ״י חוסר הרעסטאראטאר ממקום משמרתו. הנשיא וואללי נוסע כעת בחודו האזיאטית, ביום 1 אקטא- באר עזב את לאנדאן ביחד עם אחוזת מריעיו. לפני ירחים אחדים עזבו את אדעססא עשרה נערות צעירות ב״י אשר גמרו חוק לימודן בהגימנאזיום דשם ונסעו לפעטערס- בורג להשתלם שמה בלימודים באקאדעמי מעדיצנע-חירורגיצנע. על שער המצבה (וועלטאויסשטעללונג) אשר יהיה בשנה הבאה בפילאדעלפיא באמעריקא, תהי׳ שם (כאשר כבר נתפרסם אודות זה במ״ע), אסיפת משחקים בשחוק השאך. האשכר הראשי שהוקצב לאיש שיצטיין ביתר עז עולה לסך 20,000 דאללאר (בערך 30,000 רו״כ), אם באמת יהיה אסיפה כזאת ואמר מ״ע .W .6 אזי מוכנת ווארשא לשלוח לשם כפי הודעת .K. W את בן עירה המשחק המפורסם הוא אחינו העברי שמעון ווינאווער אשר כבר הצטיין במשחק הזה על שער המצבה בפאריז לקבל מתנה ממדריגה שניה. בשנת 1873 היה מספר תושבי אדעססא 193,513 נפשות מהם 19 125,3 נוצרי יוני 8,616 נוצרי רומי 51,337 יהודים 1,140 קראים 184 מחמדים וכו׳ 142 ,8 מספר בתיה 7 בהכנ״ס 27 בתי תפלה לנוצרים. בפאריז נמצא 9,619 רחובות 61,622 בתים 24 נשרים 67 בתי תפלה לנוצרי רומי 8 לוטערני 2 בהכנ""ס 37 בתי תיאט- ראות 16 בתי חולים 6 ביבליאטעקען הפתוחים לרבים, 6 בתים לגידול וחינוך היתומים. האדון הטעהנאלג טעפלאוו לפני איזה חדשים המצא נפלאה. לעשות נופת (צוקער) מתפוחי אדמה, וזה לא כביר הציע המצאתו זאת לפני אנשים חכמים בפעטערסבורג ומצאו כי דומה הוא בטעם ובמראה לנופת העשוי מבוראקעס, בדעתו ליסד בית מלאכת נופת כזאת בסבבות פעטערסבורג, ומבטיח שלא יעלה יותר מעשרה קאפ׳ הליטרה. המקרות הלא- טובות אשר קרו עלי מסלות הברזל ברוסלאנד 376,996 Gon. Urzed. בשנה העברה היו לפי הודעת מ״ע אנשים מתו 620 נפצעו. ידוע כי כפי שתרבה בארץ מרוצת מכתבים וטעלעגראמיס כן ירבה ויפרוץ מעשה המסחר והמלאכה, ע״כ לא למותר יחשב להביא בזה לפני הקוראים הרשימה הזאת: באנגליא עולה שנה בשנה על כל תושב אחד 30 אגרות, שווייץ 28, אמעריקא הצפונית 19, אוסטראליע 16, אשכנז 13, עסטרייך 11, צרפת וקאנאדזיע 9, ספרד ונארוועגען 4, ברוססיא עולה מכתב אחד על חמשה תושבים! בשווייץ יפול על כל מאה אנשים 81 טעלעגראס אנגליא 54, נידערלאנד 51, בעלגי 47, ספרד 6 רוססיא 5. מספר האנשים המאמינים בדת הבודדיהסמוס *) הם בערך 405,610,000, נוצרים 399,300,000, נוצרי רומי לבד יתחשבו לערך 20,000,000, בראמאנים 174,200,000, מחמדים 96,000,000, יהודים 5,000,000. האדון קלאסטערמאן דירעקטאר הגימנאזיום אשר בפה, נתן צו לפני שני חדשים, כי אלה התלמידים העברים המקשיבים לקח בהגימנאזיום החוב מוטל עליהם לכתוב גם ביום השבת כבימי החול. ויהי כאשר מיאנו בזה האבות התלמידים ולא שלחו את בניהם לבתי הספר ביום השבת, צוה הדירעקטאר לגרש כל הגימנאזיסטען היהודים מהגימנאזיום, לבד עלם אחד ב. לאפ, אשר ישב במדריגה השישית, אשר ירא שלא יהיה לו זאת למכשול עלי דרכו אשר יצעד הלאה הקשיב למצור הדירעקטאר וכתב ביום השבת כדת וכראוי, ע״כ נשאר על מקומו כמקדם. כשני שבועות אחר זה חזר הדירעקטאר מדעתו והרשה לתלמידים לבקר את בתי הספר כמקדם. שונות הנה ההשערות אודות זה ואנכי שמעתי ממקור נאמן כי חסיבה לזה היא יען כי נודע לו כי מוסכם אצל אבות התלמידים להשתדל בכל כוחם להשיג רשיון משר ההשכלה בפעטערסבורג שיוכלו בניהם לבקר את הגימנאזיום מבלי שיכרחו לכתוב גם ביום השבת ע״כ בטל דעתו מפני דעתם."
044-MGD-1875-12-15-PG001-SINGLE-ORIGNAME_190417_toc_16,ענס (? ?וי* ס&יזונס נלזני&ח £>נג> וי ז^ט...," *) „הוא האמונה במציאת עצם נשגב, ומלאכים טובים ומלינים ושרים ומלאכי חבלה המריעים ומשחיחים, גם יאמינו בגילגול הנפשות לכן לא יאכלו בשר רק בעלי כנף ודגים, ובעבור חמונתם כי הנפשות אחרי התגלגלם בברואי השמים ממעל וביצורי שאול מתחת, ישובו אל תבל ארצה, ויתגלגלו בברואי חלד לכן לא יתאבלו על מת וכו'"" עיין שבילי עולם מאת שב""ה ח״ר בארצות הודו ודעת לנמשך ינעם. צה""ק."
044-MGD-1875-12-15-PG001-SINGLE-ORIGNAME_190417_toc_17,"שיר חנוכה .1 בכוכבים בלילה אור יזהירו, ו..."," שיר חנוכה ככוכבים בלילה אור יזהירו, ופני הארץ מנגה נגדם יאירו; עת האהלה חלפה לה שמש, ותשלח תחתיה אפל ואמש.  ככה על החלונות בתי ישראל, מדי שנה בשנה הגר חנוכה יהל עת נשקע השמש פה בשפל. ושמי יעקב אתה כסה ערפל. כי אם רבו צרי יעקב תחת השמש, ומצור ומצוק ויגון ממנו כל ימש; בימי חנוכה כל איש מלבו עצב שוכה ואך באלקים סמוך לבו, בישועתו בוטה! כי העברי בחדליקו את הגרות. המה לו להזכיר להאיר ולהורות כי יודה אל פעולת ה׳ אלקי צבאות! על הנסים התשועות והנפלאות! 5. לכן עת לבשה נפשו ענני תוגה ועצבת וכמעט כבה נר ישראל מחשכת צלמות וככל זאת העברי לא יפחד יבהל — כי זכר יזכר מדוע זה הגר חנכה יהל. אפס אם רבו השנים הימים ארכו, מול העברי הגוים קרב נורא ערכו; עתה עמים ישכילו ותבונה שוררת, ושם ישראל בעמים לגאון ותפארת. עתה זכרון לבני ישראל עת על החלונות הגר חנכה יהל כי שנות אפל עוד אינם, המקו עברו, פצו העננים, ושמי יעקב טחרו. יוסף גיביאנסקי איש ליפסק. הצופה להמגיד"
044-MGD-1875-12-15-PG001-SINGLE-ORIGNAME_190417_toc_18,"השערה חדשה במובן הכתוב גל עיני ואביטה
נפלאות מתורתיך, ועוד בשאר דברים יקרי
הערך אל הספרות העברית."," השערה חדשה במובן הכתוב גל עיני ואביטה נפלאות מתורתיך, ועוד בשאר דברים יקרי הערך אל הספרות העברית. כל המשים עין כקותה על המזמור קי״ט בתהלים, יכיר בו שני ענינים אשר כעין תקות חוט השני סובבים והולפים על פני כל המזמור היקר הזה מתחילתו ועד סופו. הראשון הוא שנתחבר המזמור הזה בעת צרה לישראל שהיה חי על אדמת נכר בקרב עם לועז, ואולם ההגיו בתורה, הגיון בלי הרף ובכל מאמצי כח, וכן קיום מצותיה בכל לבבם ובכל נפשם היה אז נחמתם ושעשועם בענים. וזאת שנית שקיום המצות ולימוד החורה בימים ההם לא היה עומד אצל התורה הכתובת לבד, כי אם היה מקיף גם ההלבות ופירושי המצות המקובלות איש מפי איש, אשר אינם כתובים בספר ואשר עליהם נאמר: דברים שבעל פה אי אתה רשאי לאמרם בכתב. — ועל זה אולי כוון המזמור באמרו: „בשפתי"" ספרתי כל משפטי פיך, ר""ל לא מתוך הכתב אקרא ברבים אלה ההלכות ופירושי המצות, כי הם דברים שצריך ללמוד וללמד אותם בעל פה דוקא. וכן „בלבי צפנתי"" אמרתך למען לא אחטא לך, ר״ל בהיות שההלכות האלה לא ניתנו להכתב על ספר על כן צריכים שיהיו צפונים וטמונים בקרב איש ולב עמוק, כמשמרות נטועים שמורים ונטועים בזכרונו. ואמשר שזה גם כן כוונתו באמרו: אתה צויתה פקודיך „לשמור מאד״. ועל פי זה נראה שהמזמור הגדול הזה (גדול לא לבד בכמותו שסכום בסוקיו כסכום הימים בחצי שנת הלבנה חסר אחד, עד שהשתמשו לפנים בזה המזמור, לפי דעת הח׳ רמ״ד ז״ל, כעין לוח השנה, כי אם גם גדול באיכותו, כי כמה שביבי אם של רעיונות רמות ונשגבות מבין שורותיו יצהירו, כמו שכתב הח׳ הניצרי עוואלד בפירושו על תהלים צד 384). נתחבר בזמן גלות בבל""), כי כל הבקי בקורות הזמן ההוא, ידע כי שני הענינים אשר הזכרנו בזה, הם הם סימני היכר לזמן הגלות ההוא. וכן נראה לי שאחד מן החכמים המפוארים הנקובים בזמן ההוא בשם „סופרים״, ואשר גם עזרא הסופר היה אחד מהם, היה מחברו של המזמור הנעלה הזה. ואולי שזה המזמור בעצמו נותן כעין טעם לשבת לזה השם סופרים במה שיאמר. בשפתי „ספרתי"" כל משפטי פיך (מיט מיינען ליפפען צעה לע איך אללע דיינע געטטליכען זאצונגען) והוא כעין הטעם שנתנו בעלי התלמוד לזה השם שהיו „סופרים"" האותיות שבתורה, או מפני שעשו את כל התורה „ספורות ספורות"", כגון אבות מלאכות ארבעים חסר אחת, וארבעה אבות נזיקין, וכיוצא בהן. עיי' קדושין ל׳ ירושלמי שקלים פ״ה. חגיגה ט״ו: סנהדרין ק״ו: והנה עסק זה של הסופרים היה ללמד את העם החורה שבכתב ולחבר עם הלימוד הזה של המקרא תיכף גם לימוד ההלכות המקובלות או פירושי המצות (וכמו שהראה לנו הרמב""ם ז""ל בהקדמתו נסדר זרעים הדוגמא על זה, שכחה חבילות של פרטי ודקדוקי המצות חוברו עד״מ אל זה הפסוק האחד: בסכת חשבו שבעת ימים, שהסכה הזאת חובה רק על הזכרים, ושאין החולים, והולכי דרך חייבין בה, ושלא תהיה סכוכה אלא בצמח הארץ ולא יסככנה בדבר המחובר לארץ ולא בכלים אפי׳ מאשר תצמח הארץ, ושהאכילה ושתיה ושינה בה כלו חובה, ושלא יהיה בחללה פחות מ""ז טפתים אורך על ז' טפחים רוחב, ושלא יהיה גובה הסוכה פחות מעשרה טפחים). והם הראו שפירושי המצות האלה אע""פ שאינן כתובים בפירוש בתורה בכל זאת אינן פורחין באויר כי אם ממעין המקרא הם נובעים, או מייתור לשון מה או מקל וחומר או מגזרה שוה או מכלל יפרט, וכיוצא בזה. ומן זה הדרך אשר הלכו בו הסופרים עוד נשאר לנו רושם בשלשה הסופרים אשר גם הם עלו במסילה הזאת להוציא ההלכה מן המקרא ולחבר לימוד התורה עם לימוד פירושי המצות והיה המשכן אחד, ושלשה ספרים האלה הלא המה: המכילתא הספרא והספרי. וכן במשנה שלנו עוד נשארו לנו איזה משניות השנויות על הסגנון הזה (עיי׳ נגעים פ״ב מ""ה עד ס הפרק) ואשר עין בעין נראה שהן ישנות מאד וכאלו יצאו עוד מפי הסופרים. עיי׳ פראנקעל בס׳ דרכי המשנה דף ה'. והנה אע""פ שמדרש הלכה של הסופרים בלי ספק עוד יותר פשוט היה ועוד יותר קרוב אל הפשט ממה שראינו באלה שלשה ספרים הנ״ל, בכל זאת זה הדרך של לימוד המקרא לפרש החורה ע״פ ההלכה ולהוציא מן כל פרשה ופרשה ולפעמים אפי׳ מן כל פסוק ופסוק שלה תילי תילין של הלכות (ואשר על זה אפשר שמוסב הפסיק: לכל תכלה ראיתי קץ „רחבה מצותך מאד״), זה הדרך בודאי לא נקל היה אפילו לפני חכמים גדולים ומפוארים כמו אלה הסופרים, כי היו צריכים לזה חריצית נפלאה וחידוד השכל ועיון עמוק וגדול שאין למעלה הימינו, ועל זה כוון לפי דעתי מחבר המזמור בזה הפסוק שהצבנו בראש מאמרנו זה: כל עיני ואביטה נפלאות מתורתיך. ר״ל תפלה לאל חיי שיזדכך רוחי וייגלו אורי עיני שכלי, להוציא מן תורת ה׳ התמימה (חיץ מעומק פשוטו של מקרא) עוד „שמוני טמוני הלכות"" הנובעות לפעמים מן מלה אחת יתירה, או אפילו מן יחוד של אות אחת שבתורה. ועל זה הענין מוסב ג״כ הכתוב"" ברוך אתה ד׳ „למדני חוקיך״ (וכמה וכמה פעמים נאמר ונשנה זאת בזה המזמור עיי׳ פסוק כ״ו, *) וארהיב בנפשי עוז לאמור שבמזמור היה נמצא גם רושם מה מן המאורעות המפורסמות שאירעו בגלות בבל כפי מה שהוזכרו בס' דניאל (ואם גם יהיה כדעת המבקרים שהס' הזה לא נכתב בזמן הגלות כי אם לאחר מזה בזמן החשמונאים, הלא עכ״פ תוכן המאורעות ההן בלי ספק נשאב מקורות דברי הימים ההם, ועוד חיות היו בעת הכתיבה בזכרון כל האומה) זן בעתי בני ישראל אשר לוקחו אל היכל המלך נבוכדנצר ללמדם שם ספר ולשון כשדים ואשר מינה להם המלך משולחנו מאכל ומשתה למען היום מראיהם טוב ובראי בשר. ואולם נערים ישרי לב ביניהם שמו על לבם לבלת התנאל בפת בג המלך ואפי׳ ביין משתיו ועל המאורע הזה אולי כוון המזמור באמרו: במה יזכה בער את ארחו לשמור כדבריך, וכן: צעיר אנכי ונבזה פקודיך לא שכחתי. ובן זה הפסוק אשר כל המבארים נלאו למצוא דלה להבנתו: טפש כחלב לבם אני תורתך שעשעתי, אפשר שכוונתו על אותן נערים בהיכל נבוכדנצר שאכלו משולחנו של מלך למען הצהיל פניהם משמן למו חלב ודשן תשבע נפשם, לא כן הנערים תמימי דרך, שהם לא אכלו כי אם זרעו ים ושתו רק מים ובכל זאת היה נראה מראיהם טוב ובריא אולם, וזאת לפי שתורת ה׳ היתה שעשועם. וכן יסופר שם שהמלך היה נותן להם מלמדים, הם החרטומים, להורותם חכמת הכסדים, ולמקצת הימים כאשר אמר המלך להביאם לפניו, וימצאם בכל דבר חכמה ובינה עשר ידות על כל החרטומים, ועל זה אולי יכוון המזמור הזה באמרו: מכל מלמדי לתי כי עדותיך שיחה לי ר״ל לימוד התורה המאירת עיניים, היא תה מחדדת את שכלו ללמוד בנקל גם שאר דברי חכמה ובינה הרבה יותר מרבותיו. וכן: ואדברה בעדותיך נגד מלכים ולא אבוש, אפשר שמוסב על איש חמודות הזה אשר התיצב לפני מלכים, נבוכדנצר ובלשצר, ולא בוש להוכיחם על פניהם, עיי׳ דניאל ד׳, כ״ד, ה׳, כ״נ. וכן: שהם רדפוני חנם ומדברך פחד לבי, מוסב על שרי המלך דריוש שבקשו להשחיתו ולא מצאו עולה נגדו כי אם זאת שהוא ירא וחרד על דבר ה׳, עיי׳ שם ו׳, ה׳, ו׳. וכן גם: כרו לי זדים שיחות, שהשליכוהו לנוב אריות. וכן עוד הרבה שם. מ״ד. ס״ח, ק״ח, קב״ד, קל״ה, קע״א), שפשוטו של מקרא אינו צריך לימוד כל כך, וביחוד בימים הקדמונים ששפה העבריה בלשונה של תורה עוד שגורה היתה בפיהם הרבה יותר ויותר מבזמננו זה. אולם להוציא ההלכה מן המקרא זה צריך לימוד גדול ולזה התפללו להם עזר וסיוע ממרומים. ושני הפסוקים האלה, ר״ל: גל עיני וגו׳ וברוך אתה ה׳ למדני חוקיך, נראה שהיו כעין תפלה קצרה טרם התחילו להורוח את תלמידיהם „משרש ההלכה״. ועתה שמע נא ידידי הקורא! הלא כבר גלוי וידוע לפניך שלזה הסגנון לפרש התורה ע״פ ההלכה ולהוציא ההלכה מן המקרא היו קוראים בשם מדרש הלכה („להיפך מן מדרש האגרה״). אולם מאין יצא להם זה השם „מדרש״ על ההוראה הזאת? לפי דעתי גם זה יצא ראשונה מן המזמור הזה, שכן נאמר ונשנה פה: ואתהלכה ברחבה כי פקודיך „דרשתי"" לך אני הושיעני כי פקודיך „דרשתי״, וכן: רחוק מרשעים ישועה כי חוקיך לא „דרשו״. ולזה אחבר עוד השערה אחרת, והיא שאולי כבר בימי ירמיה הנביא היו הולכים חכמי דורו בזאת המסילה לפרש המקרא ע״פ ההלכה, ולזה היו נקראים כבר בימים ההם בשם „סופרים. ואולם בפרוע פרעות בישראל בזמן ההוא של ירמיה התחה וילכו אחרי ההבל ויהבלו, לא הטר אזנם אל דברי הסופרים האלה, ואדרבא לצים לצון חמדו להם על הסגנון הזה להוציא ההלכה מן המקרה, באמרם הלא גם לנו לב לדעת ועינים לקראות ולהבין ולהשכיל בחורת משה המסורה בידינו כמו בידיהם, ואנחנו לא מצאנו דבר ולא חצי דבר מכל תילי תילים של הלכות ופירושי המנוות אשר יוציאו אלה הסופרים ע""פ דרשות רחוקות מן המקרא הרחק מאד מן עומק פשוטו של הכתוב. ולזה אולי כוון ירמיה ח׳, ח. באמרו: איכה תאמרו חכמים אנחנו ותורת ה׳ אתנו אכן הנה לשקר עשה עט שקר „סופרים״. ר״ל זאת יגידו אנשי דורו, שגם הם חכמים ונבוני דבר להבין ולהשפיל בתורת ה׳ ועל פי זה יכירו וידעו ששקר בפי הסופרים שדורשים התורה ע״פ ההלכה. ועל זאת השיב להם שם ירמיה: הובישו חכמים חתו וילכדו הנה בדבר ה׳ מאסו וחכמת מה להם, ר״ל שלא יתהללו אנשי דורו בחכמתם, כי הם לא לבד בפירושי המצות של הסופרים ימאסו כי אם גם את התורה עצמה הכתובה לפניהם ישליכו אחרי גיוום וכל מי שתורה אין לו גם חכמה אין לו. והנה ידעתי שלפי פירושי זה יקשה מה כחיב כאן „עט שקר סופרים״, והלא אמרנו לעיל שפירושי מצות לא ניתנו להכתב על ספר, אולם ידוע הוא שדוקא בפומבי היה אסור לקרותם מתוך ספר, אבל לצורך עצמם הסופרים היו עושים להם מגלות שקורין אותן מגלות סתרים״. עיי׳ הרמב״ם בהקדמתו הנזכרת. סוף דבר, שהמזמור גדול הכמות וגדול האיכות הזה, זה המזמור קי״ט בתהלים, כלולים בו לפי דעתי גדולים חקקי לב, דברים העומדים ברומה של הספרות העברית, עד שכל הקורא בו בעיניים חודרת יתפלל גם היא בערך אל המזמור הזה: גל עיני ואביטה נפלאות מתורתיך! פינפהויז, הסמוכה לוויען עיר המלוכה הק׳ אברהם שמיעדל רב דק""ק הנ״ל והגליל."
