article_id,headline,text
044-MGD-1878-09-11-PG001-SINGLE-ORIGNAME_220281_toc_1,," — יוצא לאור פעם אחת! בכל שבוע. מחירו בארצנו 12 מארק לשנה, 3 מארק לרבע. בעסט- רייך 8 פל׳ ע״זו: לשנה. 2 פל׳ ע״וו לרבע. בשארי ארצות 20 פראנקס; לשנה. -"
044-MGD-1878-09-11-PG001-SINGLE-ORIGNAME_220281_toc_2,, — כל איש יוכל להשיגו! ע״י כל פאסט-אמס; ובוכהאנדלונג בכל המדינות. כל החפץ? להודיע דבר מה ברבים: לטובתו עליו לשלם שכר הדפסה בעד כל שורה! 15 ספ׳ —
044-MGD-1878-09-11-PG001-SINGLE-ORIGNAME_220281_toc_3,חדשות וקורות הימים. יגיד ליעקב מהנעשה וה...," חדשות וקורות הימים.  וייכל. יגיד ליעקב מהנעשה והנשמע בכל חלקי תבל בין כל יושבי חלד אשר ינעם ואשר ראוי לדעת לכל איש ישראלי לתועלתו ולתועלת השפה העבריה. מאתי ריידר⸗ אלוה ל ל. אליען ליפמאן זילבע מאן. ם והאמת והשלום אהבו. (זכרים ח'). Lyd. Septemer ליק, י״ג אלול התרלה. 1878"
044-MGD-1878-09-11-PG001-SINGLE-ORIGNAME_220281_toc_4,תוכן הענינים., תוכן הענינים. על המדינות בו יאמר: דון יוסף הנשיא מלך קפריסין (perenע) עסטרייךאונגארן: מכתבים מוויען. טארנאוו. שוועדען: שטאקהאלם. אפריקא: אלגיר. חדשות שונות: הצופה. ספר יהודית: מאת מ׳ ש׳ י. מכתב מהרב הגאון שי״ר זצ״ל. הנפט: מאת ש—א—ן. בשורת ספרים: הודעות. הוספה להמגיד:
044-MGD-1878-09-11-PG001-SINGLE-ORIGNAME_220281_toc_5,על המדינות בו יאמר.," על המדינות בו יאמר. (דייטשלאנד), יושבי ארצות אשכנז חגגו אמנם גם בשנה הזו את יום השני לירח זה (זעפטעמבער). החג הלאומי הזה נקרא בשם „חג-זעדאן"" יען בעצם ההוא נשבה הקיסר נאפאלעאן השלישי וכל חילו בהמלחמה הגדולה על יד המבצר זעדאן בשנת 1870, ואז נשבר גאון עז הצרפתים בידי האשכנזים, אך השמחה לא היתה כוללת בפעם הזו, ולא כל התושבים חו בה חלקם. מלבד הקאטאליקים שלא החלו לחג את היום ההוא מיום נעשה לחג. לרגלי הריב אשר פרץ בין הממשלה ובין האפיפיור חיש אחרי תם המלחמה, כנודע, נוספו עליהם בשנה הזו גם הסאציאליסטים הרבים בממלכה אשר שמחת היום היום ההוא לא תעלה על ראשם, מסיבת החוקים הנמרצים הנועדים לשים קץ למעשיהם הרעים ומחשבותיהם הנפסדות. גם בין אלפי רבבות יושבי הממלכה מכת חליברלים נמצאו הרבה מאד אשר לא יכלו לחג את החג ההוא בלב שלם. בלבות מלאי דאגה משקיפים על העתיד. חפץ הנשיא ביסמארק להשלים עם האפיפיור וקדושיו חשביתה השמחה מרוחם בידעם כי אם יפיק חפצו ההוא אז סכנה נשקפת לחירות העם בכלל. בכל זאת חגג רוב עמי אשכנז את החג בשמחה ולב שלם יען סוף סוף לרגלי הנצחון הגדול ההוא על יד זעדאן נתאחדו כל ארצות אשכנז ונהיו לממלכה גדולה ועצומה תחת השמש הנותנת התיתה על הגויים והממלכות וכבודה גדול מאד. יודעים חם כי גם פירוד הדעות השורר כרגע בין הממשלה וחלק גדול מהעם, גם הוא יעבור ויחלוף, ולא יהיה למחתה ולצור מכשול לחירות העם. — בנוגע להשתדלות הנשיא ביסמארק להשלים עם האפיפיור הונה למצער רוח העם אחרי אשר נודע כי כל מה שעשה הנשיא בדבר זה לא היה נגד רצון שר ההשכלה דר׳ פאלק, והכל נעשה ברצונו ושאלת פיו. זאת להם ערובה בטוחה כי השלום לא יגע לרעה בחירותו. הקיסר יר״ה עזב את טעפלי' והנהו כעת במקום הרחצה גאסטיין. מצב בריאותו הולך וטוב מיום ליום. כל פצעיו נרפאו והולך בחוץ על משענתו, ואין כל ספק עוד כי ישוב לביתו, בעזרת העליון בריא אולם וישוב לאיתנו כבראשונה. גם מצב בריאות הרוצח השני דר׳ נאבילינג חוטב מאד בימים האחרונים. ולפי הנשמע יוצג בקרב הימים בשערי המשפט לשאת עוגשו על פשעו. ביום הרביעי לירח זה נבחרו בבערלין הבירה שנים אנשים לשבת בבית הועד הלאומי, במקום השנים שנבחרו מקודם שם גם במקומות אחרים וקבלו הבחירה במקומות ההם, ע״כ נבחרו אחרים תחתם בעיר הבירה. גם הם כההולכים לפניהם הנם מכת חליברלים ההולכים קדימה, ואחד משניהם, ה. ל. לעווע. הנהו אחד מאחינו בני ישראל. גם בהועד החדש ישבו ששה יהודים כבהועד הקודם. — (עסטרייך-אונגארן). במכה״ע אשר להממשלה מובאות עתה הודעות אחדות שהודיע ה. וואססיטש, הגענעראל קאנזול לעסטרייך שישב בזעראייעווא בירת באסניען אל השר אנדראשי עוד טרם באו צבאות עסטרייך אל הארץ ההיא. בהודעתו מן כ""ח לירח מאי אומר כי צבאות המתקוממים בבאסניען שנלחמו לפני שנתים ימים נגד חיל תוגרמה, נהפכו כעת לגדודי שוללים וצלמות ולא סדרים בכל דרכהם. ביום השלשים הודיע כי אנשים אחדים מרבי המדינה הוציא קול קורא ברבים להעיר את כל יושבי באסניען והערצאגאווינא לאחוז בחרב ולהגן על הארץ נגד מאנטענעגרא, זערביען ועסטרייך-אונגארן גם יחד, ולהתאמץ אשר באסניען והערצאג- אווינא תעמודנה ברשות עצמן ואין לזרים חלק בהן. ביום העשרים ואחד לירח יוני מודיע הגענעראל קאנזול כי לפי דעתו יתיצבו יושבי הארץ בחרב שלופה נגד צבאות עסט רייך בבואם שם. בתוך דבריו אדות זה אומר המודיע: „לפי דעתי נמצאים כעת בבאסניען והערצאגאווינא חמשה ועשרים אלפים שולפי חרב העומדים הכן להתיצב ביד רמה נגד צבאותינו. אם ינגפו הילינו בראשונה באחד המקומות לפני המתקוממים אז יהי׳ זה להם למכשול לימים יבואו, יען אז יתחדש בקרב העם רוח נכון למלחמה ויניחו מכשולים רבים על דרך צבאותינו. הן אמנם לרגלי האסון והעני אשר כתומם באו על המושלמנים יושבי הארץ זה שנתים ימים נפל לבם בקרבם ואומץ רוחם חלף ועבר; אך אם ינגפו הילינו בראשונה אז יתעורר רוחם עוד הפעם לאחוז בהרב. המחמודני מטבעו איננו רואה את הנולד ואפשרות סוף מעשהו איננה עולה במחשבתו תחלה. הלא ככה היה הדבר בעיר קאנסטנטינאפעל טרם פרצה המלחמה עם רוסלאנד. המחמודים שם חפצו במלחמה, וכאשר נגפו צבאות רוסלאנד בראשונה אז האמינו המושלמנים כי עשוים הם לבלי-חת ואין מי יעמוד כנגדם עוד; החליטו אז כי כבר גברה ידם על רוסלאנד וע״כ באה עליהם הצרה האיומה כיום הזה. כן יאמינו גם המחמודים בבאסניען אם ינגפו צבאותינו ראשונה, ויאחזו כלם בהרב מבלי העלות על לבם כי סוף סוף מרה תהי אחריתם ויאבדו הם וכל אשר להם״. — כן כתב. הקאנזול טרם בא צבאות עסטרייך לבאסניען. לפי הנודע כן היה כאשר הזה מראש. אחרי שנגפו הצבות במקומות אחדים, קמו כל יושבי הארץ ואחזו בחרב ומניחים מכשולים רבים ע דרך בני החיל; אך אין כל ספק כי סוף סוף יאבדו המתקוממים נצחם ואחריתם תהי מרה. מגאווי-באזאר מודיעים כי מדי יום ויום באים שם הרבה אנשים מזוינים בכלי קרב; גם הזקנים הגורים חרבם על ירכם, ומכינים עצמם למלחמה על צבאות עסטרייך ההולכים וקרבים אל העיר ההיא. לפי הנראה תהי אחרית העיר ההיא באחרית העיר זעראייעווא. הנוצרים יושבי העיר סגורים בבתיהם ויראים לצאת החוצה ומפחדים מיום הבא. ראשי המתקוממים הודיעו אל הנוצרים כי רק אם יתחברו להם להלחם יחד נגד עסטרייך תהי נפשם להם לשללי ואם יעמדו מנגד אז כלם לטבח יכרעו. (ענגלאנד). לפי הנודע הציעה ממשלת ענגלאנד אל ממשלת תוגרמה תקונים וסדרים חדשים הנחוצים לפי דעתה להיות נעשים בקרב המדינות אשר לתוגרמה באזיה, למען הפיח בקרבן רוח חיים חדשים. לפי הנשמע מסרב הסולטאן לשמוע בקול ענגלאנד בזה, באמרו כי אמנם יודע גם הוא כי נחוץ לעשות סדרים חדשים שם, אך יעשה זאת מרצון עצמו ולא על פי פקודת ענגלאנד. — גם בדבר גריכענלאנד עוד לא הושמו המעקשים למישור. על הפצרת ממשלת גריכענלאנד למלאות מצות הקאנגרעס בדבר הרחבת גבולה ענתה ממשלת תוגרמה כי כל זמן שלא תקבל מענה מן הממשלות האדירות על דבריה שערכה אליהן אדות הענין ההוא, לא תעשה בזה דבר. גם ביחוס מאנ- טענעגרא הדבר יתנהג בכבדות. מושל מאנטענעגרא דבר שלח אל הסולטאן כי אם לא ימהר לתת לו את חלקו כפי מצות הקאנגרעס אז יקח ביד חזקה. שר הצבא מחמד עלי פחה נסע למאנטענעגרא לשים המעקשים למישור ולהציב גבולותיה החדשים. בכלל לא יצא עד היום אף דבר אחד לפעולת אדם מכל הסדרים החדשים שעשה הקאנגרעס בבערלין, אף כי עברו שנים ירחים מעת כלה מלאכתו. צבאות רוסלאנד עודם עומדים בקרבת קאנסטנטינאפעל, ואניות המלחמה של ענגלאנד עוד עומדות על המצפה בים מארמארא. עוד לא נפרדו גבולות בולגאריען ואסטרומעליען; צבאות עסטרייך הנועדים על פי הקאנגרעס לעשות סדרים חדשים בבאסניען והערצאגאווינא, עודם רחוקים ממטרתם, וצבאות תוגרמה עוד לא עזבו את המבצרים בבולגאריען. — בכלל מצב הדבר הוא כעת כמו שהיה טרם אסיפת הקאנגרעס, ומי יודע מתי יהי׳ קץ הפלאות. ע״כ עוד לא הרגיע רוח אייראפא החפצה בשלום באמת ותמים כי לא תדע מה ילד יום. מי אשם בדבר? קשה לחרוץ משפט להשיב נכונה על השאלה ההיא. מכל הנראה והנשמע רק תוגרמה אשמה בדבר, יען כי קשה לה כקריעת ים סוף להוציא אל הפועל אשר חוטל עליה כי בנפשה הוא. ע״כ מתנהגת בכבדות ומתאמצת להניח מכשולים על הדרך כפי יכלתה, אף כי יודעת כי סוף סוף לא יועילו לה. כן היא השאלה: איך יהי׳ הדבר עד״מ אם תוגרמה לא תחפיץ למלאות משאלות הקאנגרעס? האם תקראינה כל הממשלות עליה מלחמה לאלצה ביד חזקה? מזה לא נזכר דבר בספר הברית בבערלין. האם מובן הדבר מאליו? מי יודע פשר דבר! — ממשלת ענגלאנד הודיעה כי בנוגע לגריכענלאנד, לא יעלה על דעתה להכריח את תוגרמה ביד חזקה למלאות מצות הקאנגרעס אם לא תעשה תוגרמה את זאת מרצונה החפשי. אם תחשוב ענגלאנד כן גם ביחוס הענינים האחרים אשר נעשו בסוד הקאנגרעס, אז רחוקים אנחנו ממטרת השלום."
044-MGD-1878-09-11-PG001-SINGLE-ORIGNAME_220281_toc_6,")Cypern( דון יוסף הנשיא מלך קפריסין
Israelit. העתקה ממכ""ה "," )Cypern( דון יוסף הנשיא מלך קפריסין Israelit. העתקה ממכ""ה  מאת שלמה קאנעל. (המשך מגליון 35). בשנת 1550 בא יואן מיקוועץ ובעלי בריתו לקאנסטנטי- נאפעל. פה הוציא לאור כל מחשבתו, ויקבל עליו עול מלכו שמים, ויעבוד את ה בגלוי כאשר עם לבבו, וישנה את שמו לשם העברי דון יוסף הנשיא. וד׳ נתן את חנו בעיני יודעיו ומכיריו, בגלל יתרון הכשר חכמתו, תום דרכו, יושר לבו ועשרו הרב והעצום, אשר היה בידו לכלי חפץ לתמוך בו עניי עמ האומללים אשר בארצות אחרות, ויהללו את שמו בשערים, וישא חן וחסד גם בעיני הסולטאן זאלימאן, ויאהב אותו מכל השרים, אשר אתו, ויהי לו ליועץ ואיש סודו. הסולטאן לא עשה דבר מקטן ועד גדול, אם לא גלה מקודם את אוזן יוסף אוחבו ושאל את עצתו. אך בגלוי לא התערב עוד דון יוסף בעניני הפאליטיק. די דון יוסף הנשיא עוד לא עשו תושיה ליסד עיר מושב לבני עמו. בשנת 1558 הלך במצות זאלימאן אל עיר קוטהאהייע אל חצר זעלים בן הבכור ויורש-עצר לזאלימאן, וישלח הסולטאן על ידו מנחה לבנו זעלים 50,000 דוקאטען כסף, ובעד 30,000 דוקאטען אבני חפץ. מעת ההיא דבקה נפש זעלים לאהבה את דון יוסף הנשיא, ויאהבהו עד למאד כל ימי חייו. הסולטאן ואלימאן נתן אז לדון יוסף את העיר טבריה וחמש בנותיה בארץ ישראל לנחלת עולם לו ולבניו אחריו למקום מושב רק ליהודים; וישמח הנשיא מאד על המתנה הזאת, בראותו כי חפצו בידו הצליח. בשנת 1,566 גוע זאלימאן, וישכב עם אבותיו, ובנו זעלים ישב על כסא אביו! ויהי בעת שוב זעלים מבעלגראד לעיר הבירה קאנסטנטינאפעל, יצאו לקראתו כל שריו ורבי המלוכה י לקבל פניו. בין השרים ההם היה גם דון יוסף; ובראות זעלים אותו כורע ומשתחוה לו, וישא חן וחסד לפניו, וירימהו מן הארץ ויחבקהו וינשקהו, ויקימהו על ויתן המשרה על שכמו על כל מדינת נאקסאס, ועל אחד עשר איי-הים מאיי ציקלאד, ויכנהו בשם הערצאג (מושל) מנאקסאס. זעלים נתן לההערצאג הרשיון למשול שם כטוב בעיניו, בתנאי אשר יתן לו למס מדי שנה בשנה רק 14,000 דוקאטען. דון יוסף הנשיא נשאר בקאנסטנטינאפעל, וישלח איש אחר למשול בשמו בנאקסאס, ואותו הפקיד הסולטאן לסגן המלחמה במלכותו. הערצאג דון יוסף הנשיא גדל מיום ליום, ושמעו הולך בכל הארץ; אהבת המלך להנשיא ולבני עמו היה לפלא בעיני כל אדם; רבים מיושבי תוגרמה אמרו, אשר הסולטאן זעלים גם הוא מזרע היהודים הנהו, ועל כן נפלאה אהבתו לדון יוסף ולעמו. דון יוסף אהב גם את אדונו הסולטאן עד למאד, ויהי לו נאמן בכל דרכיו. בחכמתו ורוחב לבבו חבי כל נכלי באי-כח הממשלות האחרות, היושבים בחצר המלוכה בתוגרמה, ויספר לאוהבו הסולטאן להשמר מפניהם. בעבור זה גדלה שנאת המלאכים והשרים לההערצאג, ובאשר גדלו המלך על כלם, ויאמרו לחריחהו משאתו, אך הוא ידע את כל מזימתם; ושמר רגלו מלכד. עד הזמן ההוא עוד לא שלם מלך צרפת את אשר לוח מאת וסף הנשיא בהיותו בצרפת הסך 15,0000 סקודי. קארל התשיעי, אשר מלך אז בצרפת, ואמו קאטהערינע לא חפצו לשלם את הכסף לדון יוסף, אך ביראם מפני זעלים ומתגרת ידו, באו בברית עם יתר באי כח הממלכות אשר בקאנסטאנ- טינאפעל, להבאיש ריח היהודי בעיני זעלים, למען יורידהו מגדולתו, ויועצו יחד, ויבקשו תחבולות להוציא מזמתם ולהגיד אל הסולטאן, כי דון יוסף עומד הכן למרוד בו, גם שכרו עדי שקר להעיד על זה. ויודע הדבר לדון יוסף הנשיא, ויקדם פני הרעה, ויגל אוזן אדונו הסולטאן מכל אשר יזמו אויביו לעשות לו. ויהי כבוא מלאכי צרפת לפני זעלים להפיק מזימתם הרעה, גרש אותם הסולטאן מעל פניו בחרפה, ויראו שונאי היהודי ויבושו. ובראות קארל התשיעי מלך צרפת, כי חכמתו לא עמדה לו, וימצא תואנה לבלתי השיב הכסף אל היהודי וישלח קארל מלאכים אל זעלים לאמר: בעת אשר היינריך השני לוה את הכסף מן היהודי היה בצרפת חוק ולא יעבור אשר אין ליהודי הצדקה לעשות מסחר וקנין בארץ צרפת, וההערצאג היהודי סחר את הארץ בשבתו בה; ועל כן יוכל המלך על פי החוק לקחת את הכסף לאוצר המלוכה. (סוף יבא)."
