article_id,headline,text
021-HMZ-1881-12-13-001_toc_1,, יום כ״א כסלו ה׳ תרמ״ב. מחירו עם המשלוח בפטרבורג ובמדינת רוסיא: שנה תמימה.  רו״כ לחצי שנה 3  לרבע שנה...........1175 „ גליון אחד בפטרבורג.... קאפ׳ 15— שכר מודעות השודה..... 10—
021-HMZ-1881-12-13-001_toc_2,," - שנת י""ז לצאתו לאור.  מחירו עם המשלוח בארצות חוץ למדינתנו: בכסף המדינות: לשנה, אל שנה, אי שנם באוסטריא, פלאָרין 10 „ 5 , 3 באשכנז, מארק 20 61 בצרפת, פראנק 20  10 „ 6 בבריטניא, שיללינג 18 „  „ 5"
021-HMZ-1881-12-13-001_toc_3,," י ילו ודר יד. חדות וספרת העברית. נעשה בעולם המדיני והמדעי, בעסקי היהודים וה להגיד ליעקב ס - יופיע אחת בשבוע ביום ג׳, בעיר המלוכה ס״ט פטרבורג."
021-HMZ-1881-12-13-001_toc_4,"ה
עת כנוס!","  עת כנוס! את מכתב העתי העברי „המלי""י"" ומ״ע בשפת יהודית אשכנזית „יידישעס פאלקסלבלאט״. מחיר „המליץ"" לשנה 8 רו״כ; לחצי שנה 8 רו""כ; לרבע שנה 1.75 רו""כ. מחיר מה״ע „יידישעם פאלקסבלאט״: לשנה 4 רו״כ; לחצי שנה 225. רו״כ; לרבע שנה 1.25 רו״כ, ולחמשה רבעי שנה מן 1 אקטאבר 1881 עד 31 דעצעמבר 1882 - 5 רו״כ. (לע״ע נמצאו עוד אתנו העלים דראשונים), לבלי תבוא ערבוביא ועיכוב במשלוח העלים נבקש מאת החפצים בשניהם או באחד מהם להיות מן הזריזיך מקדימין לבוא בין הנמנים עליהם ולא יחסרו להם העלים הראשונים אם יספו ואינם טרם ישלחו המחיר במלואו, כאשר קרה לנו באביב העבר כי נלחצנו להדפיס שלש פעמים עלים אחדים, אך לא נוכל לעשות כזאת בימים יוצרו. לסוכני „המליץ"" ינוכו 20%, ולסוכני „היידישעס פאלקסבלאט"" 15%, בתנאי כי ישלחו במזומנים מחיר עשרה עקזעמפלארים."
021-HMZ-1881-12-13-001_toc_5,^ סמרים דאלי .» 1' ן תכן עבותות * העניני..., תכן הענינים: יש תקוה. — חג השבעים. ארז. — הליכות עולם. — עזרת סופרים: עבותות הזהב. ניסן דאברוסקין. — וירושלם תעלה על לבבבם. מנחם מענדיי דאליצקי.  מכתב להמו״ל. א. שאפרטנאוויץ ועוד אחרים. — לונדון. אהרן נתן אבעלזאהן. - קטנור וסנגור. — מעשים בכל יום: א) בקהל יהודי רוסיא: ס״ט פ״ב; זיטאמיר; קרעמיניץ שווינצאן; בענדער; יאראסלאוו; טוראוו; אהנאווקא; מעזריטש; מאזיר; ארהיוב; אסטרין; וויטעבסק; פינק וצעהאנאוויץ. — חסרון לא יוכל להמנות! — ג) במשכנות יעקב בחו״ל. מודעות. —
