article_id,headline,text
021-HMZ-1883-12-07-001_toc_1,," HAMELITZ — — — יום ח׳ כסלו ה׳תרמ""ד - מחירו עם המשלוח בפטרבורג ובמדינות רוסיא: לשנה.....8 רו״כ. לחצי שנה....4 גליון אחד בפטרבורג.... קאפ׳ 10—"
021-HMZ-1883-12-07-001_toc_2,תוכן הענינים t תשובה לשואל.מ.יהלמשטיין—...., תוכן הענינים: תשובה לשואל. מ. יהלמשטיין. — עזרת סופרים: זאמושטש ז'ד״ש'י״ם. — מעשים בכל יום: א) בארצנו. ס״ט פ״ב; מאסקווא; ניזגיעאורינסק; קרעמענ- טשוג; מאהילוב; יעליסאוועטגראד; יאנאווא. — ב) חוץ לארצנו. — הליכות עולם. — מאמרי מדע לידע ולהודיע ולהורע (המסן). אליעזר צבי הכהן צווייפעל. — אלון בכות. — על שיר מהללאל. — מודעות. —
021-HMZ-1883-12-07-001_toc_3,עת כנוס!," עת כנוס! גם בשנה הבע""ל, 1884, נכונים אנחנו בעזר שדי להוציא את „המליץ״ פעמים בשבוע בכמה שנוים לטובה, ככתוב בגומר 85. חיר „המליץ"" לשנה 8 רו""כ ולחצ 4 רו""כ. ולמען הקל על החותמים לשנה שיכבד עליהם לשלם 8 רו""כ בפעם אחת נרחיב להם זמן פרעון באופן כזה: עד 1 יאנואר 1884 - 3 רו״כ, עד 1 מארץ 2 רו""כ, עד 1 יוני 22 רו״כ, עד 1 אויגוסט 1 רו""כ. החותמים בכל המדינות חוץ לארצנו משלמים: לשנה 8 רו״כ, לחצ שנה 5 רו""כ. „יודישעס פאלקס-בלאט"" מראשית השנה יצא אי״ה בכל שבוע גליון אחד וחצי ( 1 באגען); בגליון השלם יבאו מאמרים ראשיים, מאמרי סופרים, חדשות בישראל בארץ ובחוץ לארץ, הליכות עולם, ידיעות שונות, דברי חכמה, פולייטונים, מודעות וכו׳; ובחצי הגליון יבאו ספורים מושכים את הלב (ראָמאנע אונד נאוועללען). כן נוסיף „בארזענבולעטין״ כמו בהמליץ מחיר „יודישעס פאלקסבלאט״: לשנה 5 רו""כ, חצי שנה 2.50 רו״כ. ולאלה אשר קצרה ידם לשלוח את המחיר בפעם אחת נרחיב זמן באופן כזה: עד 1 יאנואר 1884—2 רו״כ, עד 1 מארץ 1 רו״כ, עד 1 אויגוסט 22 רו""כ. סוכנים אשר ישלחו לנו המחיר בעד עשרה חותמים יוכלו לנכות להם שכרם 15 למאה. כאשר חדלנו לבוא בעסקים עם המו״ס א. י. שפירא בווארשא נבקש את החפצים בשני מה״ע היוצאים על ידנו לפנות בטובם אל הרידקציא, או באמצעית מו״ס אחד. שאלתנו ובקשתנו מכל אלה אשר יחפצו במה״ע „המליץ"" גם „יודישעם פאלק בלאט"" או באחד מהם, כי יואילו בטובם להיות מן הזריזין מקדימין, ולא יפרע הסדר. וגם אנחנו מצדנו נשתדל בכל עוז לשלוח העלים ביומם למע יגיעו לידי החותמים בעתם. מר""ה 1884 יודפס „המליץ"" גם „יודישעס פאלקסבלאט"" באותיות חדשות ועל נייר מהודר. החותמים מכבר החפצים במה״ע שלנו גם לשנה הבאה יואילו בטובם: א) לשלוח יחד עם המחיר את האדרעססע הנדפסה שעל הבאנדעראַללע מכל גליון, או עכ״פ הגומר שעל האדרעססע. ב) החותמים אשר לא שלחו את המחיר הקצוב במלואו, וישכחו עד לשלם החסרון, אם רבע או חצי רובל, יאבו נא להחיש למלאות החסרון לפני בוא חדש דעצעמבר, כי הלא הודענו מראש, כי נחדול לשלוח להם העלים לפני הסך הנחסר. סוכננו (שלא על מנת לקבל פרס) בכל ארצות אמעריקא הוא ה׳ מרדכי יהלומשטיין היושב בנו יארק, וכל הרוצה בהמליץ ובהיודישעס- פאלקסבלאט יפנה אליו על האדרעססע: M. Jalomstein. 45 Orchard Str. 45. New-Jork."
021-HMZ-1883-12-07-001_toc_4,, ГАМЕЛИЦЪ  ה — — .25 Ronбря (7 денаб( 1883. מחירו עם המשלוח בארצות חוץ למדינתנו: לשנה......9 רו״כ לחצי שנה.......5 בעד מודעות מכל שורה.. קאפ׳ 10—
