article_id,headline,text
021-HMZ-1882-01-19-001_toc_1,," יום ד שבטה׳ תרמב מחירו עם המשלוח בפטרבורג ובמדינת רוסיא: שנה מי. רו״כ לחצי שנה. - ! "" ד - ד - -  לרבע שנה „חת 1.75 גליון אחד צפטרבורגי... . קאפ 15— שכר מודעות השודה..... 10—"
021-HMZ-1882-01-19-001_toc_2,,"  יר די ררי להגיד ליעקר רית. ות וספרת ה׳  היהודים והיהו ב מכל עשה בעולם המדיני והמדעי, בעם ל יופיע אחת בשבוע ביום ג׳, בעיר המלוכה ס״ט פטרבורג."
021-HMZ-1882-01-19-001_toc_3,תכן הענינים ) גזעקף •*ילון?קצו»יךT ארז. ..., תכן הענינים! בזעקך יצילוך קבוציך! ארז. — הליכות עולם. — עודת סופרים: וארשא. ש. פר..— קטגור וסנגור. — מעשים בכל יום 7 א) בקהל יהודי רוסיא: ס״ט פ״ב; קיוב; וואלאטשיסק; ראדאמישל; באר; מאהילוב פאדאלסק; יארישוב? סקולען; ווילנא; טשעכינאוויץ זקאפיטקעוויץ — ג) במשכנות יעקב בחו״ל . — עלה נדף: למען האמת והשלום. ש. פ.ר..
021-HMZ-1882-01-19-001_toc_4,בזעקך יצילוך קבוציך!," בזעקך יצילוך קבוציך! נסיונות ימים רבים יורונו דעת איך להתנהג לימים יוצרו, על כן בישישים חכמה, ולקנות דעת ועצה מנועד יועילו קורות העתים. ובכן בחפצנו עתה לבקש עצות לחלצנו ממיצר מצבנו הנורא, אין טוב לנו כי אם לפנות אל מועצות וקנינו לפנים המלומבים בנסיונות. לפנים בישראל, מאז גלינו מארצנו ונהיה נודדים בארצות שונות, כי כל עדה ביעקב בחרה מקרבה פרנסים מנכבדי הקהלה והם ביחד עם הרב דאגו לכל עסקי הקהל פנימה וחוצה, המת המציאו הכנסות לכל צרכי העדה: בתי ד׳ בתי החסד והצדקה, בתי החנוך (ה״ת, ישיבה, בתי מדרש) שכר לנושאי המשרה; רבנים, שוהטים, חזנים וכדומה, וגם לשלם מסים למלכות ומתנות לפושטים יד לדטות אליהם חנם. על הרוב נמנו עוד ראשי גלילות, אשר היו לפה לכל הגליל וכאשר קרה ענין נוגע לכל היהודים יושבי ערי הגליל התאספו ויועצו יחדו מה עשות. מלבד זאת היה להם שתדלן לכל המדינה אשר ישב על הרוב בעיר הבירה להשתדל לפני שרי המלוכה לבטל גזרות או להקים תקונים ולמלאות בקשות קהלות ויחידים, גם בארצנו היו שתדלנים אשר ישבו בעיר המלוכה להשתדל בכל הנוגע ליהודים וליהדות. ואף אם לא היה להם המשפט לשבת שם כעברים, מצאו להם תחבולות שונות, על הרוב היו להם עסקים פרטיים בהסענאט ויקר תעודה משם, ובזכותה השיגו הרשיון לגור פה. אמנם כן, השתדלנים עד לפני שלשים שנה היו אנשים פשוטים, אשר לא ידעו לדבר נכותה בשפת המדינה והנהגות הדור נעלמו מהם צלם חידדות היה חרות על מצחם ועל בגדיהם ותנועותיהם, בכל זאת רבות פעלו בחשאי. המה בקשו ומצאו להם איזה כותב בלשכות המלכות אשר נתן להם ידיעות ברורות מענינים שבאו שמה לדון עלידם, אז התאמצו להתראות פנים את פקיד המחלקה ולהבינו באותות נאמנים כי מן היושר להטות כלפי חסד, והוא התקין את הגבוה ממנו להביט על הענין ממרכז הראות ההוא ויציע בסגנון הזה לפני השליט על גבו, וכה הלך בעסקי מחיל אל חיל עד אשר נחרץ כחפץ המשתדל. יש אשר מצאו להם מליצים לפני השרים אשר עתותינו בידיהם ויהיו חשובים בעיניהם וכל חפצם השלימו. והשתדלנים האלה דרשו מקהלות שולחיהם כסף להוצאות; ואחת היה— אם באמת נחוץ היה לו כל הסך (בערך לא גדול) להוצאות הענין או התפרנס מזה וגם שם מעט בכליו, כי סוף סוף מלא משלחתו. אך הפרנסים כבר חדלו בארץ זה כארבעים שנה ומאן ניתן הרשיון בימי הקיסר הטוב והמטיב אלכסנדר השני, נ״ע, ליהודים סוחרים מגילדיע ראשונה ומלומדים מוסמכים לשבת פה, ספו תמו כלה השתדלנים, כי הגבירים אשר התקרבו לרשות קראו לעזר את המלומדים וגם מאחינו אשר באו בברית האמונה השלטת אך רוהם נשארה נאמנה לעם מחצבתם ובנפש חפצה עזרו בעצה ובמליצה לפג השרים מכיריהם, ויעשו ויצלחו במפעלם. ולאנשי מעשה אלה ביחד אנחנו חייבים להודות איזה הנחות אשר נעשו לנו מן הגזרות הקשות אשר נתחדשו עלינו משנות העשרים עד אחד החמשים למאה זו וגם איזה זכיות אשר נתנו לנו, וכאשר בעת ההיא נשב רוח חופש וסבלנות בארץ וישכחו אויבינו לנו; כי בפרק הזמן הקשה אשר הזכרנו היו ערינו ומשנאינו רק הפקידים והשרים אשר בידם נתבנו עלילותינו (תרתי במשמע), אם לאשר שלטו ברוחם דעות קרומות נגד היהודים והיהדות, או מאיזה סבה פרטית וחשבונות רבים. מה״ע בעת ההיא היו מעטים ופעולתם מאפע, ואם ביניהם נמצאו שנים „סעווערנאיא פטשעלא"" גם „סין אטעטשעסטוואָ"" אשר דברו סרה עלינו, וילענו על היהודים והיהדות, קראו אמריהם על הרוב איזה פקידים בערי המדינה, בעלי נכסים ברוסיא הפנימית, ועד ההמון והעירונים והסוחרים לא הגיעו, על כן נשארו על הרוב בתומם נאמנים לתכונת הרוסית המקרבת את כל אדם ואין עיניהם צרה בשל אחרים. והנה על כותבי העתים עשה רושם גדול כאשר החלו מה״ע בחו״ל לדבר על אדות מצב היהודים ברוסיא, ואז בקשה רוסיא אחרי מלחמת הקרים להטות אליה דעת הקהל באירופא ויחלג מה״ע פת לגבא בסגנון אחד עם אלה שבחו״ל להמליץ טוב עלינו. עד מהרת הרל הסעוו. פטש. לצאת וסין אטעטש. אבד כהו. והשרים והפקידים אשרי ראו כי מושל צדיק (המנוח) מקשיב על דבר אמת וענות צדק החלו גם הם להטות אלינו חסד. השנוי לטוב הזה השכיח את אחינו בערי המדינה לדאוג לטובת הכלל. המה ידעו כי מושל ארצנו דורש טוב לכל עבדיו ובתוכם גם לנו וגם שריו יטו אלינו חסד, כי יש בזה אדירי כסף אשר דבריהם נשמעים באזני שרי המדינה משניהם ועוזריהם והם עוסקים בצרכי צבור, באמונה וטובת הכלל נגד עיניהם תמיד. וכמעט נשכחו מלב כל ישראל וגם מלב אצילי עמנו פה, כי עפ״י דתי המלכות הם אנשים פרטיים ולא להם להשתדל בעד הכלל, אשר אין לו המשפט לתת להם כח והרשאה, כי אינם נחשבים לאומה או לשבט, או גם לאגודה אחת דתית, ורק לפנים משורת הרין לא השגיחו השרים על זה ולא העמידו דבריהם על דין תורת המלכות. וכה גם בענינים הנוגעים לאיזה פלך או עיר לאיזה חברה וליהידים לא מצאו לנחוץ לשלוח שתדלן ויספיקו לכתוב לאחד הנדיבים או לאחרים שיצא טבעם כי קרובים הם לשרי המלכות; ולכל היותר בענינים מאד נעלים שלחו איש להשתדל, לא לפני השרים, רק לפני אלה מאחינו פה שיש בידם לעשות מה בענין ההוא. ימי דוד אחד חלף הלך באופן כזה, אחינו במדינה היו שקועים בעסקיהם ויבטחו על המתנדבים לעבוד עבודת הקודש פה לבדם ולא חשבו לנחוץ לשלוח להם צירים מקרבם להודיעם מצב אחיהם למקומותם ומחסוריהם ויחוסס לעם הארץ ולרשות כן הדרישו ולא דרשו אולי נחוצים איזה אמצעיים אשר פעולתם נברנה ולא תחטיא המטרה (גם אם קראנו להם זה כשנה וחצי לא שמעו לדברינו) והמה לא אבו לראות את השנוים הגדולים אשר היי בארץ ביחס אלינו. הר קול דעת הקהל אשר בשנות הששים קנא לחרותנו עלזכיותינו נשתקע לאט לאט ובמקומו יצאו קולי קולות למצוא עונינו לשנוא, מר״ע פרו ורבו בארץ והמון העם החל לקרות בהם ובחוברות מיוחדות אשר נדפסו לאלפים ולרבבות ונתחלקו בכל מפלגות העם; כן יצאו ספרים עבים אשר מצאו להם מהלכים בקרב השרים וההודים; מטיפים לעם ומשוררים ליצנים יצאו במדינות להבאיש ריחנו בעיני ההמון בספרס בפומבי מעשים נוראים מהעקספלאָאטאציא של היהודים וכי המה, פאראָ: זיטים המוצצים לשד הארץ ויושביה. לתוגת לבבנו היינו אנחנו מן השוטים אחר החורבן, כי רוח נבואה התנוססה בנו ונעורר זה כמה שנים על התולדות המעציבות אשר תצמחנה מדברי שטנה וקנאות כאלה. אך שומע לא היה ל אחינו במושבותיהם שכחו דרכי הוריהם ויבטחו בנדיבים. ואלה היו טרודים בעסקיהם, או יצאו לחו״ל להנפש ולהתענג בכל הטוב אשר רכשו להם, וגם הסמוכים נתקררה קנאתם ליהדות אחרי אשר נהגו מזכיותיהם ויארחו לחברה את חבריהם מבני מרום עם הארץ ויתקרבו לרשות לצורך הנאתם ולא אבו להזכיר גזע מחצבתם מאז לא נכרו בחוצות ויתרחקו מאחיהם ומהיהדות בכלל וכלם יחד האמינו כי כבר הונח לאחינו במדינה ובתוך עם הארץ הם יושבים שקטים ושאננים, חדלה מועקה ולאט לאט יחלו לחנך את בניהם להיות גם הם הזוכים, ע״כ בלי שום השתדלות תפתר שאלת היהודים מאליה, ולא ראו את הנולד מן ההכנות אשר עשו צוררינו בנפש בגלוי ועוד יותר בסתר. ע״כ כרו מחריד נעצם השמים לטורר באו השערוריות והזועות בקהלות רבות ואחינו פה שם עמדו בגדהמים מדרישים, מבלי דעת מאין בא הרעש הזה. עתה אחרי אשר כדבר באפל הלך הסער וסבב בכל פאתי רוסיא מקום שם יהודים נחתים, נוכחנו לדעת כי לחנם האשימו לראשונה את הבנים השובבים אשר אפס ותהו כל מעינם, כי אם ידי צוררינו בנפש בקנאת עברתם ושכיריהם הדוברים מתוך גרונם כותבי פלסתר במה״ע ובקונטרסים המה התעו לב העם ויפיחו בלבם זיק נקמות בשימם אשם את היהודים על גודלם המר ולאחרונה צירים מיוחדים אשר שלחו בארץ לפרסם פקודות מזויפות בשם המלכות ותכבי- ומלשינות, וכמלומדי מרד הלכו לפני האספסוף ויהרסו וישברו ויחמסו וישחיתו ויכו ויענו בסגנון אחד ובשטה אחת, — רק אלה הביאו אש זרה בלב הרוסים הישרים בלבותם לנטור לנו איבה, ונביאי שקר אלה שבו ויצדיקו את הפרוע לשמצה לשום אשמתם בנו ויפתו גם את שלוחי המלכות ואת פקידיה להאמין בשוא נתעה, כי רבה דעת היהודים בארץ ובמעשיהם הכעיסו את העם אשר התקומם עליהם בזעף אף, וכה עשו דברי נרגן כמתלהמים אלה דרכם למרומים ויצא העגל הזה. והיה אם נשים אל לב מה נעשה מצדנו במשך תשעת הירחים האחרונים להסיר מעלינו את הנגע הזה? עלינו להשיב באנחה שוברת את הלב. לא כל מאומה! - אמנם כן, אלופינו פה התעוררו וינסו לעשות כל יכלתם; אך השאלה הקשה להולמה היא! מה ביכלתם? לא לאשר לא ידענו להשיב עליה כהוגן, רק לאשר צר לנו להבאיב לב אלה אשר הקריבו עתותם בהם ועמלם וגם עסקיהם וכספם לטובתנו, לנו להגיד להם? פעלכם מאפע! — ובאמת אין להאשימם, דק באשר לא ידעו כי נשתנו העתים והשטה, וביותר אחרי אשר ראו כי זכו לראות פני המושל האדיר ולשמוע מפיו דברי תנחומין, על כן האמינו כי דין באי כח. אומה להם, והמה לא הרגישו כי רוח אחרת נשבה בעליונים וכאשר אחרו סבות זריזות יתירה, גגב משל הצרפתי) להושים את הבקשה אשר דרש המלך, מדנודע להם כי יביטו עליהם כעל יחידים ולא כמורשים. הקרואים אשר באו הנה בלי כתבי הרשאה, אשר אי אפשר להם להשיג כאלה, לא נתקבלו בתור צירים כאנשים פרטים כמשמעות הדת וגם ההחלטות אשר נועצו עליהם בועדים מיוחדים ואח״כ באספה כוללת עלו בתהו ואבדו, כי כמעט לא נעשה מאומה. ובאמת אך שוא כל תקותנו לפעול בעת הזאת בתפלה ותחנונים ובדברים לבד, ובעזר מליצים וחשובים. וכן לא יוכלו לעזור לנו אצילי עמנו אילי הכסף, אנשי שמות תואר נכבדים ומצלצלים, ולא המוכתרים בזר החכמות. כי גם שניהם ועוררו קנאה בלב מקטריגים, המראים עליהם באצבעם; אמי טרם נתנו ליהודים כיות אזרחים היתה לאל יד אלה לרכוש רכוש ולקנות להם שם, ואלה להתנשא להדמות למלומדי הרוסים, ומה יהי עוד אם ירחיבו משפטיהם! ואחרים בראותם נטילי זהב לנגד עיניהם בבואם לבקש מה מהם תתעורר בלבם התשוקה לברק הזהב ויחשבו בלבם: „כשם שאתם בעסקיכם תבקשו חשבונות, וכלל הבריטני בידכם — „העת היא מטבע״, מדוע תדרשו ממני לאבד זמני למענכם״. לאות י צדקנו במשפטנו — באשכנז, באוסטריא ובבריטניא לא נשמע כי השתדלו הבראָנים ראטהשילד בעד אחיהם, רק יודעי דעת ומקנאים ליהדות כהר״ר נבריאל ריעסער, כהרב הד״ר ל. פהיללפפזאן ודומיהם למכביר, וסוף סוף כל אלה השתדלנים המנוקים והמתוקנים במראה אירופי אינם, אם אין בידם כח והרשאה כתוב וחתום, לא יוכלו להיות נחשבים לבאי כח כלל היהודים ברוסיא אשר רחקו מהם בסגנונם הפנימי והחיצוני ורובם דרובם שכחו את אחיהם ולא רגישו עוד כאלו היו עמם בצרה, רק מכח השכל ורגש המוסרי. כן אין להשלות אותנו כי הדור הצעיר אשר נפתחו לפניו שערי חכמה ותקוות אושר וכבוד, שטו כהרעבים ימים רבים אל מעדני המדע ויאכלו כנפשם שבעם ויהיו מאושרים בהושיט חבריהם מילדי הארץ ידם להם, וישכחו עמם ותורתם וספרותה העשירה וישארו עברים רק בשם ויתנאו רק בזאת—כי כיהודים עלו לגדולה. כעבור מספר שנים ומה גם בעת האחרונה, אשר ראו כי חבריהם לפנים בלב ולב עמם וקרבתם לא יחפצו, החלו יותר לשוב אל עמם ואל אמונתם, אך מעטים מהם יודעים מה להשיב בענין בשאלות הנוגעות לאחינו אשר כבר שכחו תהלוכותיהם ומשפטיהם, או נשארו בלבם זכרונות משפילים ומדאיבים, האם כל אלה יוכלו להתיצב בתור צירי היהודים בערי המדינה? ומאד יוכלו להשיב להם כאשר ענה הנסיך נארטשאקאוו בהקאנגרעס בברלין: „הבו, תנו לנו עברים כמוכם ולא נמנע מהם כל זכיות אזרחים״. מכל אלה נוכחנו לדעת: א) כי חסרון לא יוכל להמנות הוא: שאין לנו שתדלנים כמלפנים אשר לא יוכלו לרחותם באמתלאות שונות, ב) כי בעת הזאת, אחרי אשר בעצלתים נתקלקל הדבר והקמים עלינו רבים מכל צד, לא יספיקו לנו עוד תחנונים ולא טענות והוכחות בדבר שפתים, או גם בכתבי סנגור ובספרים ולמען מלאות החסרונים השנים האלה אין טוב, כי אם לכונן ועדים בכל פלך ופלך אשר יקבלו עליהם לדאוג להמציא מוצא למחיה למשפחות רבות מעמל ידיהם, דבר אשר אין שום ספק כי תאות הממשלה המקומית והראשית לחפצם וינעם לה להכיר מזה כי יש את לבב היהודים להסיר מעליהם עקשות פה. וכאשר תקים הממשלה את הועדים יוכלו חברי הועדים המקוימים להתיצב בתור בחירי קהלות נפותיהם להציע בקשות ומועצות להטבת מצב היהודים ברוחני ובגשמי, כי היא עיקר תעודתם; ושרי המלוכה יראו לפניהם אנשים מקרב העם בעי ובטבעם ובתבונותיהם, אשר דות שולחיהם דובר בם ומלתם ורגשותיהם על לשונם. ועדים כאלה אחרי אשר יצא טבעם במדינה והממשלה תראה כי עשו והצליחו ויוציאו רבים מאחיהם מחיי הבהלה לחיי עבורה מועילה ויגיעת בשר ורוח, ועדים כאלה יוכלו להציע לפני הממשלה אם תקצר ידם לברוא פרנסות חדשות לכל החיים מן הרוח ומפרנסות שאינן הגונות, כי טוב לתת להם הרשיון לעלות מן הארץ להשתקע בארץ הצבי, ואז יש לקוות כי יהיו אמריהם לרצון.  מעו אחינו ואל תתרשלו בדבר כי עת לעשות היא ורק באופן זה יהי עת להננה כי בא מועד אחרי שבאר מים עד נפש ועל העת הזאת נאמר: „אם תעזבה יום יומים תעזבך!״. ארז."
021-HMZ-1882-01-19-001_toc_5,," שנת י""ח לצאתו לאור מחירו עם המשלוח בארצות חוץ למדינתנו: בכסף המדימפה לשנם, שנט, די שנם באוסטריאן פלארין 10 „5  „ 3 באשכנז, מארק. 26 10 בצרפת, פראנק 20 19 „6 בבריטניא, שיללינג 18 2.  5"
