article_id,headline,text
021-HMZ-1881-02-08-001_toc_1,, יום ט׳ אד״ר ה׳ תרמ״א. מחירו עם המשלוח בפטרבורג ובמדינת רוסיא: שנה תמימה.........6 רו״כ לחצי שנה.........3 לרבע שנה........ 1.75 גליון אחד בפטרבורג.. קאפ׳ 15 — שכר מודעות השורה.. . 10 -
021-HMZ-1881-02-08-001_toc_2,," שנת י""ז לצאתו לאור מחירו עם המשלוח בארצות חוץ למדינתנו: בכסף המדינות:, לשנה, ב שנה,  שנם באוסטריא, פלארין 10 „ 5  „ 3 באשכנז, מארק 20 10 „ 6 בצרפת, פראנק 20 10 „ 6 בבריטניא, שיללינג 18 „ 9     „ 5"
021-HMZ-1881-02-08-001_toc_3,,"  ר⸗ ויר הנעשה בעולם המדיני והמדעי, בעסקי היהודים והיהדות וספרת העברית. להגיד ליעקב מכל יופיע אחת בשבוע ביום ג׳, בעיר המלוכה ס״ט פטרבורג.  "
021-HMZ-1881-02-08-001_toc_4,תכן הענינים : שני הפכים בנושא אחד .ארז—...., תכן הענינים: שני הפכים בנושא אחד. ארו. — הליכות עולם. — עזרת סופרים:  משא ווארשא. מ—ן. — מעשים בכל יום: א) בקהל יהודי רוסיא: ס״ט פ״ב; ראדאם; וויל קאוונא; וויטעבסק; אטאקי; העלזינגפאָרס; סלוצק; וואלקאוויסק (פלך סובאלק); ברדיטשוב; לאחאוויץ; וואלקאוויסק (פלך הוראדנא) ובוטען. — ב) במשכנות יעקב בחו״ל. — בשורת ספר חדש. — אלון בכות. — מודעות. — עלה נדף: כוס התרעלה. יקותיאל בערמאן. — הוספה: יוצאת מן הכלל אדברה אך הפעם. משה האשקעם.
